{
  "backtest_info": {
    "checkpoint_id": "anthropic_temp01_trial4",
    "start_date": "2025-10-17",
    "end_date": "2025-10-31",
    "model": "anthropic",
    "coins": [
      "BTC",
      "ETH",
      "SOL",
      "BNB",
      "XRP",
      "DOGE"
    ],
    "interval": "4h",
    "total_iterations": 85,
    "exported_at": "2025-11-06T02:23:41.385639"
  },
  "iterations": [
    {
      "iteration": 1,
      "timestamp": "2025-10-17T00:00:00",
      "model": "anthropic",
      "raw_response": "# CHAIN OF THOUGHT\n\nThis is my first trading invocation with a fresh $10,000 account and no open positions. I need to analyze the market conditions across all coins to identify the best entry opportunities.\n\n## Market Overview Analysis\n\n**BTC (109160):**\n- Price well below EMA20 (111104.55), indicating downtrend\n- MACD deeply negative (-1429.362) and still declining\n- RSI recovering from oversold (43.856 from 20.827), but 14-period RSI still weak at 37.402\n- Recent sharp drop from 111405 to 108211, now bouncing to 109160\n- Price below both 20 and 50 EMA on 4H timeframe (bearish structure)\n- Volume significantly below average (3548 vs 7856) - weak participation\n- **Assessment:** Oversold bounce in progress, but trend remains bearish. Too risky for entry.\n\n**ETH (3930.90):**\n- Price below EMA20 (4023.44), downtrend confirmed\n- MACD negative (-71.784) but showing slight improvement\n- RSI recovering (45.554 from 21.372), 14-period at 39.958\n- Sharp drop from 4061.40 to 3864.90, now recovering\n- Below both EMAs on 4H (bearish)\n- Volume very low (52185 vs 135853) - 38% of average\n- **Assessment:** Similar to BTC - oversold bounce but weak structure. Not ideal entry.\n\n**SOL (186.91):**\n- Price significantly below EMA20 (195.30), -4.3% gap\n- MACD negative (-5.057) and worsening\n- RSI at 35.557, recovering from extreme oversold (19.011)\n- Sharp rejection from 196.80, dropped to 184.76\n- Below both EMAs on 4H\n- Volume 39% of average (464414 vs 1197511) - very weak\n- **Assessment:** Weak bounce, poor volume, bearish structure. Pass.\n\n**BNB (1149.30):**\n- Price below EMA20 (1188.16), -3.3% gap\n- MACD negative (-31.536) but stabilizing slightly\n- RSI at 37.756, recovering from 13.516 extreme oversold\n- Dropped from 1183.80 to 1134.80, small bounce\n- Below both EMAs on 4H\n- Volume only 22% of average (4336 vs 19293) - extremely weak\n- **Assessment:** Weakest volume of all. Avoid.\n\n**XRP (2.36):**\n- Price below EMA20 (2.44), -3.3% gap\n- MACD negative (-0.058) and stable\n- RSI at 41.475, recovering from 20.237\n- Dropped from 2.45 to 2.33, now at 2.36\n- Below both EMAs on 4H\n- Volume ABOVE average (13.08M vs 10.32M) - 127% of average \u2713\n- **Assessment:** Only coin with above-average volume. Shows genuine interest despite weakness.\n\n**DOGE (0.190230):**\n- Price below EMA20 (0.198261), -4.0% gap\n- MACD negative (-0.005) and stable\n- RSI at 37.342, recovering from 18.498\n- Dropped from 0.200260 to 0.187720, small bounce\n- Below both EMAs on 4H\n- Volume only 24% of average (16.19M vs 67.55M) - very weak\n- **Assessment:** Weak volume, poor structure. Pass.\n\n## Trading Decision\n\nAll coins are in downtrends with prices below key EMAs and negative MACD. However, all are showing RSI recovery from extreme oversold levels (all were below 25 recently), suggesting potential short-term bounces.\n\n**XRP stands out** as the only coin with above-average volume, indicating genuine buying interest despite the selloff. The RSI recovery from 20.237 to 41.475 with increasing volume suggests accumulation may be occurring.\n\nGiven this is the first trade and I want to be conservative, I'll take ONE position in XRP with:\n- 15x leverage (moderate for first trade)\n- Risk: $500 (5% of capital)\n- Entry: 2.36\n- Stop-loss: 2.28 (-3.4% from entry, below recent low of 2.33)\n- Profit target: 2.52 (+6.8% from entry, near EMA20 resistance)\n- Invalidation: If price closes below 2.30 (below recent support structure)\n\nThis gives a 2:1 reward-to-risk ratio with clear technical levels.\n\n# TRADING DECISIONS\n\n```json\n{\n  \"XRP\": {\n    \"trade_signal_args\": {\n      \"coin\": \"XRP\",\n      \"signal\": \"buy\",\n      \"quantity\": 3178,\n      \"profit_target\": 2.52,\n      \"stop_loss\": 2.28,\n      \"invalidation_condition\": \"If price closes below 2.30 on 3-minute candle, indicating breakdown of support structure\",\n      \"leverage\": 15,\n      \"confidence\": 0.68,\n      \"risk_usd\": 500\n    }\n  }\n}\n```",
      "signals": [
        {
          "coin": "XRP",
          "signal": "buy",
          "quantity": 3178.0,
          "leverage": 15,
          "stop_loss": 2.28,
          "profit_target": 2.52,
          "confidence": 0.68,
          "risk_usd": 500.0,
          "invalidation_condition": "If price closes below 2.30 on 3-minute candle, indicating breakdown of support structure"
        }
      ]
    },
    {
      "iteration": 2,
      "timestamp": "2025-10-17T04:00:00",
      "model": "anthropic",
      "raw_response": "# CHAIN OF THOUGHT\n\n## Current Market Analysis\n\nI'm analyzing a severe market-wide selloff across all cryptocurrencies. This is the second invocation at the start of trading, and I currently have NO open positions.\n\n### Market Conditions Overview:\n- **BTC**: Down to 105,589 from 111,268 (-5.1%), RSI(7) = 17.8 (extremely oversold), MACD deeply negative (-1386)\n- **ETH**: Down to 3,756 from 3,979 (-5.6%), RSI(7) = 20.6 (extremely oversold), MACD = -68.5\n- **SOL**: Down to 177.65 from 194.58 (-8.7%), RSI(7) = 16.4 (extremely oversold), MACD = -5.3\n- **BNB**: Down to 1,062 from 1,163 (-8.7%), RSI(7) = 9.5 (CRITICALLY oversold), MACD = -35\n- **XRP**: Down to 2.24 from 2.40 (-6.7%), RSI(7) = 17.4 (extremely oversold), MACD = -0.059\n- **DOGE**: Down to 0.178 from 0.197 (-9.4%), RSI(7) = 14.8 (extremely oversold), MACD = -0.005\n\n### Technical Analysis:\n\n**All coins show:**\n1. Prices well below 20-period EMA (bearish trend)\n2. RSI(7) in extreme oversold territory (all below 21, BNB at 9.5!)\n3. Negative MACD with increasing divergence\n4. Strong downward momentum\n5. Volume elevated above average (panic selling)\n\n**Key Observations:**\n- This is a capitulation-style selloff with RSI levels rarely seen\n- All 7-period RSIs are below 21 (extreme oversold)\n- BNB RSI at 9.5 is exceptionally rare - indicates potential bounce\n- 14-period RSIs also deeply oversold (all below 26)\n- Price action shows cascading liquidations\n\n### Trading Decision:\n\n**Strategy: Counter-trend bounce play on most oversold assets**\n\nGiven the extreme oversold conditions across the board, this presents a high-probability mean reversion opportunity. However, I must be cautious:\n\n**Pros:**\n- RSI levels this extreme typically lead to short-term bounces\n- Risk/reward favorable for quick scalps\n- Multiple coins showing capitulation signals\n\n**Cons:**\n- Catching a falling knife - trend is strongly down\n- Could continue lower before bouncing\n- Need tight stop-losses\n\n**Selected Trades:**\nI'll enter positions in the THREE most oversold coins with tight stops:\n\n1. **BNB** - RSI 9.5 is critically oversold, highest priority\n2. **DOGE** - RSI 14.8, strong oversold\n3. **SOL** - RSI 16.4, extreme oversold\n\nI'll avoid BTC/ETH as they're larger caps with potentially more downside, and skip XRP as it's less oversold relatively.\n\n**Risk Management:**\n- Using 15x leverage for better risk control\n- Tight 3-4% stop-losses below recent lows\n- Quick profit targets at 5-7% bounces\n- Total risk: ~$800 per position, ~$2,400 total (25% of capital)\n- Invalidation: If price makes new lows below entry\n\n# TRADING DECISIONS\n\n```json\n{\n  \"BNB\": {\n    \"trade_signal_args\": {\n      \"coin\": \"BNB\",\n      \"signal\": \"buy\",\n      \"quantity\": 0.11,\n      \"profit_target\": 1126.00,\n      \"stop_loss\": 1025.00,\n      \"invalidation_condition\": \"If price closes below 1025 (new low) on 3-minute candle\",\n      \"leverage\": 15,\n      \"confidence\": 0.72,\n      \"risk_usd\": 800.00\n    }\n  },\n  \"DOGE\": {\n    \"trade_signal_args\": {\n      \"coin\": \"DOGE\",\n      \"signal\": \"buy\",\n      \"quantity\": 45000,\n      \"profit_target\": 0.189000,\n      \"stop_loss\": 0.172000,\n      \"invalidation_condition\": \"If price closes below 0.172 (new low) on 3-minute candle\",\n      \"leverage\": 15,\n      \"confidence\": 0.68,\n      \"risk_usd\": 800.00\n    }\n  },\n  \"SOL\": {\n    \"trade_signal_args\": {\n      \"coin\": \"SOL\",\n      \"signal\": \"buy\",\n      \"quantity\": 45,\n      \"profit_target\": 188.00,\n      \"stop_loss\": 171.00,\n      \"invalidation_condition\": \"If price closes below 171 (new low) on 3-minute candle\",\n      \"leverage\": 15,\n      \"confidence\": 0.70,\n      \"risk_usd\": 800.00\n    }\n  }\n}\n```",
      "signals": [
        {
          "coin": "BNB",
          "signal": "buy",
          "quantity": 0.11,
          "leverage": 15,
          "stop_loss": 1025.0,
          "profit_target": 1126.0,
          "confidence": 0.72,
          "risk_usd": 800.0,
          "invalidation_condition": "If price closes below 1025 (new low) on 3-minute candle"
        },
        {
          "coin": "DOGE",
          "signal": "buy",
          "quantity": 45000.0,
          "leverage": 15,
          "stop_loss": 0.172,
          "profit_target": 0.189,
          "confidence": 0.68,
          "risk_usd": 800.0,
          "invalidation_condition": "If price closes below 0.172 (new low) on 3-minute candle"
        },
        {
          "coin": "SOL",
          "signal": "buy",
          "quantity": 45.0,
          "leverage": 15,
          "stop_loss": 171.0,
          "profit_target": 188.0,
          "confidence": 0.7,
          "risk_usd": 800.0,
          "invalidation_condition": "If price closes below 171 (new low) on 3-minute candle"
        }
      ]
    },
    {
      "iteration": 3,
      "timestamp": "2025-10-17T08:00:00",
      "model": "anthropic",
      "raw_response": "# CHAIN OF THOUGHT\n\nAnalyzing current market conditions and my three open positions:\n\n**Market Overview:**\nAll major coins are showing severe bearish pressure with extremely oversold RSI readings (7-period RSI: BTC 19.3, ETH 27.0, SOL 35.6, BNB 18.2, XRP 35.6, DOGE 33.7). Prices are significantly below their EMA20 levels, MACD deeply negative across the board. This is a sharp selloff with high volume, suggesting capitulation phase.\n\n**Position 1: BNB**\n- Entry: 1062.6, Current: 1071.7 (+0.86% unrealized)\n- Stop-loss: 1025.0, Profit target: 1126.0\n- Invalidation: \"If price closes below 1025 (new low) on 3-minute candle\"\n- Current price 1071.7 is ABOVE stop-loss 1025.0 \u2713\n- Recent low was 1062.6 (my entry), not below 1025 \u2713\n- RSI 7-period at 18.2 (extremely oversold - potential bounce)\n- Price action: Small bounce from 1062.6 to 1071.7\n- **Decision: HOLD** - Invalidation NOT met, stop-loss not hit, showing signs of stabilization\n\n**Position 2: DOGE**\n- Entry: 0.17849, Current: 0.18261 (+2.31% unrealized, +$181 PnL)\n- Stop-loss: 0.172, Profit target: 0.189\n- Invalidation: \"If price closes below 0.172 (new low) on 3-minute candle\"\n- Current price 0.18261 is ABOVE stop-loss 0.172 \u2713\n- Recent low was 0.17849 (my entry), not below 0.172 \u2713\n- RSI 7-period at 33.7 (oversold but recovering)\n- Strong bounce from lows, up 2.31%\n- **Decision: HOLD** - Invalidation NOT met, position profitable, momentum improving\n\n**Position 3: SOL**\n- Entry: 177.65, Current: 181.47 (+2.15% unrealized, +$167 PnL)\n- Stop-loss: 171.0, Profit target: 188.0\n- Invalidation: \"If price closes below 171 (new low) on 3-minute candle\"\n- Current price 181.47 is ABOVE stop-loss 171.0 \u2713\n- Recent low was 177.65 (my entry), not below 171 \u2713\n- RSI 7-period at 35.6 (oversold but showing recovery)\n- Good bounce from entry, approaching profit target (188.0)\n- **Decision: HOLD** - Invalidation NOT met, strong recovery, profit target within reach\n\n**Other Coins (BTC, ETH, XRP):**\n- No existing positions\n- All showing extreme oversold conditions (potential bounce candidates)\n- However, with 3 positions already open and total exposure at ~$16,500 notional on $10k account, I'm at appropriate risk levels\n- Not adding new positions to maintain risk discipline\n\n**Risk Management Check:**\n- Total unrealized PnL: +$350 (+3.5% on positions)\n- All positions above their stop-losses\n- No invalidation conditions triggered\n- Portfolio showing resilience in sharp selloff\n- Maintaining positions as they're working as planned\n\n# TRADING DECISIONS\n\n```json\n{\n  \"BNB\": {\n    \"trade_signal_args\": {\n      \"coin\": \"BNB\",\n      \"signal\": \"hold\",\n      \"quantity\": 0.11,\n      \"profit_target\": 1126.0,\n      \"stop_loss\": 1025.0,\n      \"invalidation_condition\": \"If price closes below 1025 (new low) on 3-minute candle\",\n      \"leverage\": 15,\n      \"confidence\": 0.72,\n      \"risk_usd\": 800.0\n    }\n  },\n  \"DOGE\": {\n    \"trade_signal_args\": {\n      \"coin\": \"DOGE\",\n      \"signal\": \"hold\",\n      \"quantity\": 45000.0,\n      \"profit_target\": 0.189,\n      \"stop_loss\": 0.172,\n      \"invalidation_condition\": \"If price closes below 0.172 (new low) on 3-minute candle\",\n      \"leverage\": 15,\n      \"confidence\": 0.68,\n      \"risk_usd\": 800.0\n    }\n  },\n  \"SOL\": {\n    \"trade_signal_args\": {\n      \"coin\": \"SOL\",\n      \"signal\": \"hold\",\n      \"quantity\": 45.0,\n      \"profit_target\": 188.0,\n      \"stop_loss\": 171.0,\n      \"invalidation_condition\": \"If price closes below 171 (new low) on 3-minute candle\",\n      \"leverage\": 15,\n      \"confidence\": 0.7,\n      \"risk_usd\": 800.0\n    }\n  }\n}\n```",
      "signals": [
        {
          "coin": "BNB",
          "signal": "hold",
          "quantity": 0.11,
          "leverage": 15,
          "stop_loss": 1025.0,
          "profit_target": 1126.0,
          "confidence": 0.72,
          "risk_usd": 800.0,
          "invalidation_condition": "If price closes below 1025 (new low) on 3-minute candle"
        },
        {
          "coin": "DOGE",
          "signal": "hold",
          "quantity": 45000.0,
          "leverage": 15,
          "stop_loss": 0.172,
          "profit_target": 0.189,
          "confidence": 0.68,
          "risk_usd": 800.0,
          "invalidation_condition": "If price closes below 0.172 (new low) on 3-minute candle"
        },
        {
          "coin": "SOL",
          "signal": "hold",
          "quantity": 45.0,
          "leverage": 15,
          "stop_loss": 171.0,
          "profit_target": 188.0,
          "confidence": 0.7,
          "risk_usd": 800.0,
          "invalidation_condition": "If price closes below 171 (new low) on 3-minute candle"
        }
      ]
    },
    {
      "iteration": 4,
      "timestamp": "2025-10-17T12:00:00",
      "model": "anthropic",
      "raw_response": "# CHAIN OF THOUGHT\n\nReviewing my current positions and market conditions:\n\n## BNB Position Analysis\n- Entry: 1062.6, Current: 1074.0 (+1.07%)\n- Unrealized PnL: +$1.20\n- Stop-loss: 1025.0, Profit target: 1126.0\n- Invalidation: \"If price closes below 1025 on 3-minute candle\"\n- Current price 1074.0 is ABOVE invalidation level (1025.0) \u2713\n- Technical indicators: RSI(7) = 20.752 (extremely oversold), MACD = -22.672 (bearish), Price below EMA20 (1142.29)\n- Recent price action shows a massive drop from 1183.50 to 1062.60, then slight recovery to 1074.0\n- The position is barely profitable but showing signs of potential bounce from oversold levels\n- **Decision: HOLD** - Invalidation condition NOT met, oversold RSI suggests potential bounce, stop-loss provides protection\n\n## DOGE Position Analysis\n- Entry: 0.17849, Current: 0.18475 (+3.51%)\n- Unrealized PnL: +$277.68 (strong profit)\n- Stop-loss: 0.172, Profit target: 0.189\n- Invalidation: \"If price closes below 0.172 on 3-minute candle\"\n- Current price 0.18475 is ABOVE invalidation level (0.172) \u2713\n- Technical indicators: RSI(7) = 42.470 (neutral), MACD = -0.004 (slightly bearish), Price below EMA20 (0.192365)\n- Price recovering from low of 0.17849, showing upward momentum\n- Close to profit target (0.189), currently at 0.18475\n- **Decision: HOLD** - Invalidation NOT met, good profit cushion, approaching profit target\n\n## SOL Position Analysis\n- Entry: 177.65, Current: 182.74 (+2.86%)\n- Unrealized PnL: +$225.05 (strong profit)\n- Stop-loss: 171.0, Profit target: 188.0\n- Invalidation: \"If price closes below 171 on 3-minute candle\"\n- Current price 182.74 is ABOVE invalidation level (171.0) \u2713\n- Technical indicators: RSI(7) = 41.565 (neutral), MACD = -3.878 (bearish), Price below EMA20 (189.96)\n- Price recovering from low of 177.65, showing resilience\n- Profit target at 188.0 is within reach (need +2.88% more)\n- **Decision: HOLD** - Invalidation NOT met, solid profit, momentum improving\n\n## Non-Position Coins (BTC, ETH, XRP)\n- BTC: RSI(7) = 39.583 (oversold), massive drop from 111288 to 105589, now at 106821\n- ETH: RSI(7) = 33.917 (oversold), dropped from 4012.90 to 3756.40, now at 3797.30\n- XRP: RSI(7) = 42.797 (neutral), dropped from 2.42 to 2.24, now at 2.30\n- All showing oversold conditions but still in downtrends (below EMA20, negative MACD)\n- **Decision: NO NEW POSITIONS** - Market showing broad weakness, existing positions sufficient, risk management priority\n\n## Risk Management Summary\n- Total account value: $10,135.68\n- Total unrealized PnL: +$503.93 (+4.97%)\n- All three positions are profitable and above their invalidation levels\n- Portfolio is well-diversified across altcoins\n- No positions hitting stop-loss or profit targets yet\n\n# TRADING DECISIONS\n\n```json\n{\n  \"BNB\": {\n    \"trade_signal_args\": {\n      \"coin\": \"BNB\",\n      \"signal\": \"hold\",\n      \"quantity\": 0.11,\n      \"profit_target\": 1126.0,\n      \"stop_loss\": 1025.0,\n      \"invalidation_condition\": \"If price closes below 1025 (new low) on 3-minute candle\",\n      \"leverage\": 15,\n      \"confidence\": 0.72,\n      \"risk_usd\": 800.0\n    }\n  },\n  \"DOGE\": {\n    \"trade_signal_args\": {\n      \"coin\": \"DOGE\",\n      \"signal\": \"hold\",\n      \"quantity\": 45000.0,\n      \"profit_target\": 0.189,\n      \"stop_loss\": 0.172,\n      \"invalidation_condition\": \"If price closes below 0.172 (new low) on 3-minute candle\",\n      \"leverage\": 15,\n      \"confidence\": 0.68,\n      \"risk_usd\": 800.0\n    }\n  },\n  \"SOL\": {\n    \"trade_signal_args\": {\n      \"coin\": \"SOL\",\n      \"signal\": \"hold\",\n      \"quantity\": 45.0,\n      \"profit_target\": 188.0,\n      \"stop_loss\": 171.0,\n      \"invalidation_condition\": \"If price closes below 171 (new low) on 3-minute candle\",\n      \"leverage\": 15,\n      \"confidence\": 0.7,\n      \"risk_usd\": 800.0\n    }\n  }\n}\n```",
      "signals": [
        {
          "coin": "BNB",
          "signal": "hold",
          "quantity": 0.11,
          "leverage": 15,
          "stop_loss": 1025.0,
          "profit_target": 1126.0,
          "confidence": 0.72,
          "risk_usd": 800.0,
          "invalidation_condition": "If price closes below 1025 (new low) on 3-minute candle"
        },
        {
          "coin": "DOGE",
          "signal": "hold",
          "quantity": 45000.0,
          "leverage": 15,
          "stop_loss": 0.172,
          "profit_target": 0.189,
          "confidence": 0.68,
          "risk_usd": 800.0,
          "invalidation_condition": "If price closes below 0.172 (new low) on 3-minute candle"
        },
        {
          "coin": "SOL",
          "signal": "hold",
          "quantity": 45.0,
          "leverage": 15,
          "stop_loss": 171.0,
          "profit_target": 188.0,
          "confidence": 0.7,
          "risk_usd": 800.0,
          "invalidation_condition": "If price closes below 171 (new low) on 3-minute candle"
        }
      ]
    },
    {
      "iteration": 5,
      "timestamp": "2025-10-17T16:00:00",
      "model": "anthropic",
      "raw_response": "# CHAIN OF THOUGHT\n\nReviewing my current positions and their invalidation conditions:\n\n**BNB Position Analysis:**\n- Entry: 1062.6, Current: 1066.1 (+0.33%)\n- Unrealized PnL: +$0.33\n- Invalidation: \"If price closes below 1025 (new low) on 3-minute candle\"\n- Stop-loss: 1025, Profit target: 1126\n- Current price 1066.1 is ABOVE invalidation level (1025)\n- However, RSI at 17.9 (extremely oversold), MACD deeply negative (-33.538)\n- Price well below EMA20 (1140.88), strong downtrend\n- Recent candles: 1062.60 \u2192 1071.70 \u2192 1074.00 \u2192 1066.10 (weakening bounce)\n- **Decision: CLOSE** - While invalidation not technically met, the extreme weakness (RSI 17.9, lowest of all coins), continued downtrend, and minimal profit suggest this is a failed bounce trade. Risk management dictates cutting this small winner before it becomes a loser.\n\n**DOGE Position Analysis:**\n- Entry: 0.17849, Current: 0.18427 (+3.24%)\n- Unrealized PnL: +$256.08 (strong profit)\n- Invalidation: \"If price closes below 0.172 (new low) on 3-minute candle\"\n- Stop-loss: 0.172, Profit target: 0.189\n- Current price 0.18427 is ABOVE invalidation level (0.172)\n- RSI at 40.76 (neutral), MACD negative but stabilizing (-0.005)\n- Price below EMA20 (0.192186) but showing resilience\n- Recent candles: 0.17849 \u2192 0.18261 \u2192 0.18475 \u2192 0.18427 (consolidating gains)\n- Profit target 0.189 is only 2.5% away\n- **Decision: HOLD** - Invalidation NOT met, position profitable, approaching profit target\n\n**SOL Position Analysis:**\n- Entry: 177.65, Current: 181.93 (+2.41%)\n- Unrealized PnL: +$188.60 (strong profit)\n- Invalidation: \"If price closes below 171 (new low) on 3-minute candle\"\n- Stop-loss: 171, Profit target: 188\n- Current price 181.93 is ABOVE invalidation level (171)\n- RSI at 38.37 (oversold but recovering), MACD negative (-5.249)\n- Price below EMA20 (190.13) but holding above entry\n- Recent candles: 177.65 \u2192 181.47 \u2192 182.74 \u2192 181.93 (slight pullback from high)\n- Profit target 188 is only 3.3% away\n- **Decision: HOLD** - Invalidation NOT met, position profitable, near profit target\n\n**Other Coins (BTC, ETH, XRP):**\n- No positions, market showing weakness across the board\n- BTC: RSI 35.3, deep below EMA, strong downtrend\n- ETH: RSI 43.7, below EMA, negative MACD\n- XRP: RSI 41.4, below EMA, negative MACD\n- All showing bearish technical structure\n- **Decision: NO NEW TRADES** - Risk management in volatile downtrend\n\n# TRADING DECISIONS\n\n```json\n{\n  \"BNB\": {\n    \"trade_signal_args\": {\n      \"coin\": \"BNB\",\n      \"signal\": \"close_position\",\n      \"quantity\": 0.11,\n      \"profit_target\": 1126.0,\n      \"stop_loss\": 1025.0,\n      \"invalidation_condition\": \"If price closes below 1025 (new low) on 3-minute candle\",\n      \"leverage\": 15,\n      \"confidence\": 0.72,\n      \"risk_usd\": 800.0,\n      \"close_reason\": \"Risk management - extreme weakness with RSI at 17.9 (most oversold), continued downtrend below all EMAs, and weakening bounce momentum. Taking small profit before reversal.\"\n    }\n  },\n  \"DOGE\": {\n    \"trade_signal_args\": {\n      \"coin\": \"DOGE\",\n      \"signal\": \"hold\",\n      \"quantity\": 45000.0,\n      \"profit_target\": 0.189,\n      \"stop_loss\": 0.172,\n      \"invalidation_condition\": \"If price closes below 0.172 (new low) on 3-minute candle\",\n      \"leverage\": 15,\n      \"confidence\": 0.68,\n      \"risk_usd\": 800.0\n    }\n  },\n  \"SOL\": {\n    \"trade_signal_args\": {\n      \"coin\": \"SOL\",\n      \"signal\": \"hold\",\n      \"quantity\": 45.0,\n      \"profit_target\": 188.0,\n      \"stop_loss\": 171.0,\n      \"invalidation_condition\": \"If price closes below 171 (new low) on 3-minute candle\",\n      \"leverage\": 15,\n      \"confidence\": 0.7,\n      \"risk_usd\": 800.0\n    }\n  }\n}\n```",
      "signals": [
        {
          "coin": "BNB",
          "signal": "close_position",
          "quantity": 0.11,
          "leverage": 15,
          "stop_loss": 1025.0,
          "profit_target": 1126.0,
          "confidence": 0.72,
          "risk_usd": 800.0,
          "invalidation_condition": "If price closes below 1025 (new low) on 3-minute candle"
        },
        {
          "coin": "DOGE",
          "signal": "hold",
          "quantity": 45000.0,
          "leverage": 15,
          "stop_loss": 0.172,
          "profit_target": 0.189,
          "confidence": 0.68,
          "risk_usd": 800.0,
          "invalidation_condition": "If price closes below 0.172 (new low) on 3-minute candle"
        },
        {
          "coin": "SOL",
          "signal": "hold",
          "quantity": 45.0,
          "leverage": 15,
          "stop_loss": 171.0,
          "profit_target": 188.0,
          "confidence": 0.7,
          "risk_usd": 800.0,
          "invalidation_condition": "If price closes below 171 (new low) on 3-minute candle"
        }
      ]
    },
    {
      "iteration": 6,
      "timestamp": "2025-10-17T20:00:00",
      "model": "anthropic",
      "raw_response": "# CHAIN OF THOUGHT\n\nReviewing my current positions and market conditions:\n\n## DOGE Position Analysis\n- Entry: $0.17849, Current: $0.18472 (+3.49%)\n- Unrealized PnL: +$276.33\n- Stop-loss: $0.172, Profit target: $0.189\n- Invalidation: \"If price closes below 0.172 (new low) on 3-minute candle\"\n\n**Technical Analysis:**\n- Current price $0.18472 is ABOVE stop-loss ($0.172) \u2713\n- RSI (7-period): 43.474 - neutral, recovering from oversold\n- RSI (14-period): 37.227 - still in lower range but improving\n- MACD: -0.005 (negative but stabilizing)\n- Price below EMA20 ($0.191412) - still in downtrend\n- Recent price action: bounced from $0.17849 low, showing some recovery\n\n**Invalidation Check:** Price has NOT closed below $0.172. Current price $0.18472 is well above this level. Invalidation condition NOT met.\n\n**Decision: HOLD** - Position is profitable, invalidation not triggered, and showing signs of stabilization. Profit target at $0.189 is within reach (+2.3% from current).\n\n## SOL Position Analysis\n- Entry: $177.65, Current: $181.89 (+2.39%)\n- Unrealized PnL: +$186.80\n- Stop-loss: $171.0, Profit target: $188.0\n- Invalidation: \"If price closes below 171 (new low) on 3-minute candle\"\n\n**Technical Analysis:**\n- Current price $181.89 is ABOVE stop-loss ($171.0) \u2713\n- RSI (7-period): 38.263 - recovering from deeply oversold levels\n- RSI (14-period): 34.584 - still oversold but improving\n- MACD: -4.567 (negative but showing potential stabilization)\n- Price below EMA20 ($188.83) - in downtrend but recovering\n- Recent price action: bounced from $177.65 low, consolidated around $181-182\n\n**Invalidation Check:** Price has NOT closed below $171. Current price $181.89 is significantly above this level. Invalidation condition NOT met.\n\n**Decision: HOLD** - Position is profitable, invalidation not triggered, and profit target at $188 is achievable (+3.4% from current). The bounce from lows suggests potential continuation.\n\n## Other Coins (BTC, ETH, BNB, XRP)\nNo positions held. Market showing significant weakness:\n- BTC: RSI 35, deep correction from $111k to $106k\n- ETH: RSI 45, down from $4061 to $3830\n- BNB: RSI 25 (deeply oversold), massive drop from $1180 to $1070\n- XRP: RSI 39, declining from $2.45 to $2.29\n\n**Decision: NO NEW POSITIONS** - Market volatility is extreme. Both existing positions are profitable and showing stabilization. Adding new positions in this volatile environment would increase risk unnecessarily. Better to manage existing winners.\n\n## Risk Management Summary\n- Total account value: $10,092.43\n- Combined unrealized PnL: +$463.13 (+4.6%)\n- Both positions above entry and stop-loss levels\n- Both positions have clear exit plans\n- Portfolio exposure is reasonable with 2 positions\n\n# TRADING DECISIONS\n\n```json\n{\n  \"DOGE\": {\n    \"trade_signal_args\": {\n      \"coin\": \"DOGE\",\n      \"signal\": \"hold\",\n      \"quantity\": 45000.0,\n      \"profit_target\": 0.189,\n      \"stop_loss\": 0.172,\n      \"invalidation_condition\": \"If price closes below 0.172 (new low) on 3-minute candle\",\n      \"leverage\": 15,\n      \"confidence\": 0.68,\n      \"risk_usd\": 800.0\n    }\n  },\n  \"SOL\": {\n    \"trade_signal_args\": {\n      \"coin\": \"SOL\",\n      \"signal\": \"hold\",\n      \"quantity\": 45.0,\n      \"profit_target\": 188.0,\n      \"stop_loss\": 171.0,\n      \"invalidation_condition\": \"If price closes below 171 (new low) on 3-minute candle\",\n      \"leverage\": 15,\n      \"confidence\": 0.7,\n      \"risk_usd\": 800.0\n    }\n  }\n}\n```",
      "signals": [
        {
          "coin": "DOGE",
          "signal": "hold",
          "quantity": 45000.0,
          "leverage": 15,
          "stop_loss": 0.172,
          "profit_target": 0.189,
          "confidence": 0.68,
          "risk_usd": 800.0,
          "invalidation_condition": "If price closes below 0.172 (new low) on 3-minute candle"
        },
        {
          "coin": "SOL",
          "signal": "hold",
          "quantity": 45.0,
          "leverage": 15,
          "stop_loss": 171.0,
          "profit_target": 188.0,
          "confidence": 0.7,
          "risk_usd": 800.0,
          "invalidation_condition": "If price closes below 171 (new low) on 3-minute candle"
        }
      ]
    },
    {
      "iteration": 7,
      "timestamp": "2025-10-18T00:00:00",
      "model": "anthropic",
      "raw_response": "# CHAIN OF THOUGHT\n\nReviewing my current positions and market conditions:\n\n## DOGE Position Analysis\n- **Entry**: 0.17849, **Current**: 0.18681 (+4.66%)\n- **Unrealized P&L**: +$370.38\n- **Exit Plan**: Profit target 0.189, Stop-loss 0.172\n- **Invalidation**: \"If price closes below 0.172 (new low) on 3-minute candle\"\n- **Technical Analysis**:\n  - Current price 0.18681 is ABOVE stop-loss (0.172) \u2713\n  - Current price is BELOW profit target (0.189) - very close!\n  - RSI (7-period): 55.918 - neutral/bullish momentum\n  - MACD: -0.005 (still negative but improving from -0.005)\n  - Price below EMA20 (0.191154) - still in downtrend territory\n  - Recent price action: recovering from 0.17849 low, showing strength\n- **Decision**: CLOSE POSITION - Take profits. We're very close to profit target (0.189 vs 0.18681), and the position has gained 4.66%. Given the overall bearish context (price still below EMA20, negative MACD), and we're up $370, it's prudent to lock in gains rather than risk a reversal. The invalidation condition has NOT been met, but taking profits at +4.66% is solid risk management.\n\n## SOL Position Analysis\n- **Entry**: 177.65, **Current**: 184.74 (+3.99%)\n- **Unrealized P&L**: +$315.05\n- **Exit Plan**: Profit target 188.0, Stop-loss 171.0\n- **Invalidation**: \"If price closes below 171 (new low) on 3-minute candle\"\n- **Technical Analysis**:\n  - Current price 184.74 is ABOVE stop-loss (171.0) \u2713\n  - Current price is BELOW profit target (188.0) - getting close\n  - RSI (7-period): 57.513 - bullish momentum building\n  - MACD: -5.032 (improving from -5.329, showing convergence)\n  - Price below EMA20 (188.99) but recovering\n  - Recent price action: strong bounce from 177.65, now at 184.74\n- **Decision**: HOLD - Position is performing well (+3.99%), showing bullish momentum with RSI at 57.5 and improving MACD. Price is moving toward profit target (188.0). No invalidation condition met (price well above 171.0). Let this run toward the 188.0 target.\n\n## Other Coins (BTC, ETH, BNB, XRP)\n- **BTC**: Price 107042, below EMA20 (108842), MACD deeply negative (-1620), RSI recovering to 49.9 but still in downtrend. Not entering.\n- **ETH**: Price 3869.70, below EMA20 (3923.90), MACD negative (-73.176), RSI 59.8 showing some strength but overall bearish structure. Not entering.\n- **BNB**: Price 1089.40, well below EMA20 (1129.28), MACD very negative (-33.104), RSI 49.5. Weak setup. Not entering.\n- **XRP**: Price 2.34, below EMA20 (2.37), MACD negative (-0.050), RSI 62.3 showing strength. Interesting but already have 2 positions and limited capital. Not entering.\n\n## Risk Management Summary\n- Current account value: $10,329.55 (up 3.30%)\n- Taking profits on DOGE locks in $370.38 gain\n- Holding SOL to capture additional upside toward $188 target\n- Portfolio exposure will reduce from 2 positions to 1, improving risk profile\n\n# TRADING DECISIONS\n\n```json\n{\n  \"DOGE\": {\n    \"trade_signal_args\": {\n      \"coin\": \"DOGE\",\n      \"signal\": \"close_position\",\n      \"quantity\": 45000.0,\n      \"profit_target\": 0.189,\n      \"stop_loss\": 0.172,\n      \"invalidation_condition\": \"If price closes below 0.172 (new low) on 3-minute candle\",\n      \"leverage\": 15,\n      \"confidence\": 0.68,\n      \"risk_usd\": 800.0,\n      \"close_reason\": \"Taking profits at +4.66% ($370.38 gain). Price very close to profit target (0.189 vs 0.18681). Risk management dictates locking in gains given bearish context (price below EMA20, negative MACD) rather than risking reversal.\"\n    }\n  },\n  \"SOL\": {\n    \"trade_signal_args\": {\n      \"coin\": \"SOL\",\n      \"signal\": \"hold\",\n      \"quantity\": 45.0,\n      \"profit_target\": 188.0,\n      \"stop_loss\": 171.0,\n      \"invalidation_condition\": \"If price closes below 171 (new low) on 3-minute candle\",\n      \"leverage\": 15,\n      \"confidence\": 0.7,\n      \"risk_usd\": 800.0\n    }\n  }\n}\n```",
      "signals": [
        {
          "coin": "DOGE",
          "signal": "close_position",
          "quantity": 45000.0,
          "leverage": 15,
          "stop_loss": 0.172,
          "profit_target": 0.189,
          "confidence": 0.68,
          "risk_usd": 800.0,
          "invalidation_condition": "If price closes below 0.172 (new low) on 3-minute candle"
        },
        {
          "coin": "SOL",
          "signal": "hold",
          "quantity": 45.0,
          "leverage": 15,
          "stop_loss": 171.0,
          "profit_target": 188.0,
          "confidence": 0.7,
          "risk_usd": 800.0,
          "invalidation_condition": "If price closes below 171 (new low) on 3-minute candle"
        }
      ]
    },
    {
      "iteration": 8,
      "timestamp": "2025-10-18T04:00:00",
      "model": "anthropic",
      "raw_response": "# CHAIN OF THOUGHT\n\nReviewing my current position:\n\n**SOL Position Analysis:**\n- Entry: $177.65, Current: $186.19 (+4.8%)\n- Unrealized P&L: +$380.30 (+4.5% of account)\n- Profit Target: $188.00 (only $1.81 away!)\n- Stop Loss: $171.00\n- Invalidation: \"If price closes below 171 (new low) on 3-minute candle\"\n\n**Technical Analysis:**\n- Current price $186.19 is ABOVE the invalidation level of $171\n- RSI (7-period): 64.998 - healthy momentum, not overbought\n- RSI (14-period): 48.809 - neutral territory\n- MACD: -4.463 (improving from -4.858, showing momentum recovery)\n- Price is below EMA20 ($188.59) but recovering strongly\n- Recent price action: Strong bounce from $177.65 low, now at $186.19\n- Last 3 candles show upward momentum: $181.89 \u2192 $184.74 \u2192 $186.19\n\n**Invalidation Check:**\nThe invalidation condition is NOT met. Price has NOT closed below $171 on any recent 3-minute candle. The lowest recent price was $177.65 (my entry), well above the $171 invalidation level.\n\n**Decision Rationale:**\nThe profit target of $188.00 is extremely close (only $1.81 away or ~1%). Given:\n1. Strong upward momentum (RSI 65, improving MACD)\n2. No invalidation condition met\n3. Profit target nearly reached\n4. Position is profitable (+$380)\n\nI will HOLD to capture the profit target. The risk/reward is favorable as we're very close to the target, and the technical indicators support continued upward movement. If the next candle reaches $188, the position should automatically close at profit target.\n\n**Other Coins:**\n- BTC: Weak (RSI 42, below EMA, negative MACD) - not entering\n- ETH: Recovering but still below EMA - not entering\n- BNB: Strong recovery (RSI 69) but just bounced from severe drop - too risky\n- XRP: Recovering (RSI 67) but below EMA - not entering\n- DOGE: Weak recovery, below EMA - not entering\n\nNo new positions warranted. Focus on managing existing SOL position to profit target.\n\n# TRADING DECISIONS\n\n```json\n{\n  \"SOL\": {\n    \"trade_signal_args\": {\n      \"coin\": \"SOL\",\n      \"signal\": \"hold\",\n      \"quantity\": 45.0,\n      \"profit_target\": 188.0,\n      \"stop_loss\": 171.0,\n      \"invalidation_condition\": \"If price closes below 171 (new low) on 3-minute candle\",\n      \"leverage\": 15,\n      \"confidence\": 0.7,\n      \"risk_usd\": 800.0\n    }\n  }\n}\n```",
      "signals": [
        {
          "coin": "SOL",
          "signal": "hold",
          "quantity": 45.0,
          "leverage": 15,
          "stop_loss": 171.0,
          "profit_target": 188.0,
          "confidence": 0.7,
          "risk_usd": 800.0,
          "invalidation_condition": "If price closes below 171 (new low) on 3-minute candle"
        }
      ]
    },
    {
      "iteration": 9,
      "timestamp": "2025-10-18T08:00:00",
      "model": "anthropic",
      "raw_response": "# CHAIN OF THOUGHT\n\nReviewing my current position:\n\n**SOL Position Analysis:**\n- Entry: $177.65, Current: $186.04 (+4.72%)\n- Unrealized P&L: +$373.55 (strong profit)\n- Position size: 45 SOL at 15x leverage ($8,371.80 notional)\n- Profit target: $188.00 (just $1.96 away - 1.05% from current)\n- Stop-loss: $171.00\n- Invalidation condition: \"If price closes below 171 (new low) on 3-minute candle\"\n\n**Technical Analysis:**\n- Current price: $186.04 vs EMA20: $188.77 (still below EMA, but converging)\n- RSI (7-period): 63.387 - healthy momentum, not overbought\n- RSI (14-period): 47.613 - neutral territory\n- MACD: -4.664 (improving from -5.828, showing momentum recovery)\n- Price action: Strong recovery from $177.65 low, now consolidating near $186\n- Recent candles show: 184.74 \u2192 186.19 \u2192 186.04 (slight pullback from local high)\n\n**Invalidation Check:**\n- Lowest recent price: $177.65 (entry point)\n- Current price: $186.04\n- Invalidation level: $171.00\n- Status: NOT INVALIDATED - price well above $171\n\n**Decision Rationale:**\nThe profit target of $188 is extremely close (only $1.96 away). Given:\n1. Strong unrealized profit (+$373.55 on $800 risk = 46.7% gain)\n2. Profit target nearly reached (98.96% of the way there)\n3. RSI showing healthy momentum without being overbought\n4. MACD improving (less negative)\n5. Price consolidating just below profit target\n\nHowever, I notice a slight pullback from $186.19 to $186.04. The prudent decision is to **CLOSE THE POSITION** and take profits. We're at 98.96% of our profit target, and the risk/reward of holding for an additional $1.96 upside versus potential reversal is unfavorable.\n\n**Other Coins:**\n- BTC, ETH, BNB, DOGE: All showing recovery but still below their EMAs with negative MACD\n- XRP: Strongest momentum (RSI 75.4, price above EMA), but already had significant run\n- No new positions warranted - better to secure profits and wait for clearer setups\n\n# TRADING DECISIONS\n\n```json\n{\n  \"SOL\": {\n    \"trade_signal_args\": {\n      \"coin\": \"SOL\",\n      \"signal\": \"close_position\",\n      \"quantity\": 45.0,\n      \"profit_target\": 188.0,\n      \"stop_loss\": 171.0,\n      \"invalidation_condition\": \"If price closes below 171 (new low) on 3-minute candle\",\n      \"leverage\": 15,\n      \"confidence\": 0.7,\n      \"risk_usd\": 800.0,\n      \"close_reason\": \"Taking profits - price at $186.04 is 98.96% of profit target ($188.00), securing +$373.55 unrealized gain (46.7% return on risk). Prudent risk management given proximity to target and slight pullback from $186.19 local high.\"\n    }\n  }\n}\n```",
      "signals": [
        {
          "coin": "SOL",
          "signal": "close_position",
          "quantity": 45.0,
          "leverage": 15,
          "stop_loss": 171.0,
          "profit_target": 188.0,
          "confidence": 0.7,
          "risk_usd": 800.0,
          "invalidation_condition": "If price closes below 171 (new low) on 3-minute candle"
        }
      ]
    },
    {
      "iteration": 10,
      "timestamp": "2025-10-18T12:00:00",
      "model": "anthropic",
      "raw_response": "# CHAIN OF THOUGHT\n\n## Current Portfolio Status\n- No open positions\n- Available cash: $10,333.43\n- Total return: +3.33%\n- Sharpe ratio: 7.888 (excellent risk-adjusted returns)\n\n## Market Analysis\n\n**BTC (106926.00)**\n- Price below EMA20 (108206.97) - bearish short-term\n- MACD improving (-1256.77 from -1431.82) but still deeply negative\n- RSI(7): 48.2 - neutral zone\n- RSI(14): 41.2 - slightly oversold\n- Recent volatility: dropped from 109160 to 105589, now recovering\n- Below both 20 and 50 EMA on 4H timeframe - downtrend intact\n- Analysis: Showing signs of bottoming but no clear reversal signal yet\n\n**ETH (3876.20)**\n- Price below EMA20 (3910.25) - bearish\n- MACD improving (-53.32 from -74.22) - momentum turning\n- RSI(7): 56.9 - neutral/slightly bullish\n- RSI(14): 47.4 - neutral\n- Recovered from 3756 low, testing resistance\n- Analysis: Better momentum than BTC, showing relative strength\n\n**SOL (184.91)**\n- Price below EMA20 (188.12) - bearish\n- MACD improving (-4.03 from -5.34) - momentum turning\n- RSI(7): 51.3 - neutral\n- RSI(14): 44.2 - neutral/weak\n- Recovered from 177.65 low\n- Analysis: Weak recovery, still under pressure\n\n**BNB (1090.70)**\n- Price significantly below EMA20 (1119.57) - bearish\n- MACD stable but negative (-23.50)\n- RSI(7): 44.1 - weak\n- RSI(14): 40.9 - approaching oversold\n- Dropped from 1149 to 1062, partial recovery\n- Analysis: Weakest performer, no clear reversal\n\n**XRP (2.35)**\n- Price near EMA20 (2.36) - neutral\n- MACD improving (-0.033 from -0.052) - best momentum\n- RSI(7): 54.7 - neutral/bullish\n- RSI(14): 49.9 - neutral\n- Strong recovery from 2.24 low\n- Analysis: Showing best relative strength and momentum\n\n**DOGE (0.187480)**\n- Price below EMA20 (0.189991) - bearish\n- MACD improving (-0.004 from -0.005) - momentum turning\n- RSI(7): 57.2 - neutral/bullish\n- RSI(14): 46.2 - neutral\n- Recovered from 0.17849 low\n- Analysis: Good momentum but still below key levels\n\n## Trading Decision\n\nGiven the current market conditions:\n- Most coins are in recovery mode after recent selloff\n- No clear strong uptrend signals yet\n- ETH and XRP showing best relative strength\n- Risk management: With excellent Sharpe ratio, I should be selective\n\n**Best opportunity: ETH**\n- Showing improving MACD momentum\n- RSI(7) at 56.9 suggests buying pressure\n- Recovered well from lows\n- Relative strength vs BTC\n- Entry at 3876.20 with tight risk management\n\nEntry plan:\n- Buy ETH with 15x leverage\n- Risk: $500 (4.8% of capital)\n- Stop-loss: 3820 (below recent consolidation)\n- Profit target: 3980 (near EMA20 resistance)\n- Invalidation: If price breaks below 3800 or RSI(7) drops below 40\n\n# TRADING DECISIONS\n\n```json\n{\n  \"ETH\": {\n    \"trade_signal_args\": {\n      \"coin\": \"ETH\",\n      \"signal\": \"buy\",\n      \"quantity\": 1.94,\n      \"profit_target\": 3980.00,\n      \"stop_loss\": 3820.00,\n      \"invalidation_condition\": \"If price closes below 3800 on 3-minute candle or RSI(7) drops below 40\",\n      \"leverage\": 15,\n      \"confidence\": 0.72,\n      \"risk_usd\": 500.00\n    }\n  }\n}\n```",
      "signals": [
        {
          "coin": "ETH",
          "signal": "buy",
          "quantity": 1.94,
          "leverage": 15,
          "stop_loss": 3820.0,
          "profit_target": 3980.0,
          "confidence": 0.72,
          "risk_usd": 500.0,
          "invalidation_condition": "If price closes below 3800 on 3-minute candle or RSI(7) drops below 40"
        }
      ]
    },
    {
      "iteration": 11,
      "timestamp": "2025-10-18T16:00:00",
      "model": "anthropic",
      "raw_response": "# CHAIN OF THOUGHT\n\nReviewing my current position:\n\n**ETH Position Analysis:**\n- Entry: $3876.20, Current: $3892.20 (+$16.00, +0.41%)\n- Unrealized PnL: +$27.28 (+0.36% of notional)\n- Position size: 1.94 ETH at 15x leverage ($7,550 notional)\n- Profit target: $3980.00 (needs +$87.80 move, +2.26%)\n- Stop-loss: $3820.00 (risk -$72.20, -1.86%)\n- Invalidation condition: \"If price closes below 3800 on 3-minute candle or RSI(7) drops below 40\"\n\n**Checking Invalidation Conditions:**\n1. Price below $3800? NO - Current price is $3892.20\n2. RSI(7) below 40? NO - Current RSI(7) is 65.827\n\n**Technical Analysis:**\n- RSI(7): 65.827 - Strong momentum, recovering from oversold\n- RSI(14): 53.492 - Neutral to slightly bullish\n- MACD: -26.781 - Still negative but improving (was -28.901, -38.264, -43.553)\n- Price vs EMA20: $3892.20 vs $3892.32 - Price just touched EMA20, critical support level\n- Recent price action: Bounced from $3756.40 to $3892.20 (+3.6% recovery)\n- Volume: 40,304 vs avg 120,880 - Low volume, concerning for sustainability\n\n**Decision Rationale:**\nThe position is slightly profitable but showing mixed signals:\n- POSITIVE: RSI showing strong recovery (65.827), MACD improving, price recovered to EMA20\n- NEGATIVE: Low volume on recovery, MACD still negative, price struggling at EMA20 resistance\n- INVALIDATION STATUS: NOT MET - Price well above $3800 and RSI well above 40\n\nThe position is valid and showing some positive momentum. The recovery from oversold levels is encouraging, and we're testing the EMA20 which could act as a pivot point. However, the low volume is concerning. Given that:\n1. Invalidation conditions are NOT met\n2. We're in profit (albeit small)\n3. Technical momentum is improving\n4. Stop-loss provides adequate protection at $3820\n\n**Decision: HOLD** - Continue monitoring. The position has room to run to the $3980 profit target, and the invalidation conditions provide clear exit criteria if momentum fails.\n\n**Other Coins:**\n- BTC, SOL, BNB, XRP, DOGE: No positions, not entering new trades at this time. Market showing mixed signals with improving RSI but negative MACD across most assets. Prefer to manage existing ETH position rather than add new exposure.\n\n# TRADING DECISIONS\n\n```json\n{\n  \"ETH\": {\n    \"trade_signal_args\": {\n      \"coin\": \"ETH\",\n      \"signal\": \"hold\",\n      \"quantity\": 1.94,\n      \"profit_target\": 3980.0,\n      \"stop_loss\": 3820.0,\n      \"invalidation_condition\": \"If price closes below 3800 on 3-minute candle or RSI(7) drops below 40\",\n      \"leverage\": 15,\n      \"confidence\": 0.72,\n      \"risk_usd\": 500.0\n    }\n  }\n}\n```",
      "signals": [
        {
          "coin": "ETH",
          "signal": "hold",
          "quantity": 1.94,
          "leverage": 15,
          "stop_loss": 3820.0,
          "profit_target": 3980.0,
          "confidence": 0.72,
          "risk_usd": 500.0,
          "invalidation_condition": "If price closes below 3800 on 3-minute candle or RSI(7) drops below 40"
        }
      ]
    },
    {
      "iteration": 12,
      "timestamp": "2025-10-18T20:00:00",
      "model": "anthropic",
      "raw_response": "# CHAIN OF THOUGHT\n\nReviewing my current position:\n\n**ETH Position Analysis:**\n- Entry: $3876.20, Current: $3887.40 (+$11.20, +0.29%)\n- Unrealized P&L: +$17.97 (+0.24% of account)\n- Leverage: 15x, Quantity: 1.94 ETH\n- Exit Plan: Profit target $3980, Stop-loss $3820\n- Invalidation: \"If price closes below 3800 on 3-minute candle or RSI(7) drops below 40\"\n\n**Checking Invalidation Condition:**\n- Current price: $3887.40 (well above $3800 threshold)\n- Latest 3-minute close: $3887.40 (above $3800 \u2713)\n- Current RSI(7): 60.997 (above 40 threshold \u2713)\n- Previous RSI(7) readings: [27.061, 34.168, 44.335, 46.282, 60.613, 67.121, 60.544, 57.391, 65.828, 60.997]\n- RSI has been consistently above 40 for the last 7 candles\n\n**Technical Analysis:**\n- Price action: Recovering nicely from lows around $3777, now at $3887\n- EMA(20): $3891.82 - price slightly below but converging\n- MACD: -23.886, improving from -45 (bullish divergence, momentum recovering)\n- RSI(7): 60.997 - healthy momentum, not overbought\n- RSI(14): 52.051 - neutral to slightly bullish\n- Price is $92.60 away from profit target ($3980)\n- Price is $67.40 away from stop-loss ($3820)\n\n**Decision: HOLD**\n- Invalidation condition NOT met (price above $3800, RSI above 40)\n- Technical momentum improving (MACD recovering, RSI healthy)\n- Position showing small profit, room to run to profit target\n- Risk/reward still favorable\n\n**Other Coins Analysis:**\n- **BTC**: Below EMA20, MACD negative but improving, RSI 55 - neutral, no strong setup\n- **SOL**: Above EMA20, MACD improving, RSI 71 overbought - potential reversal risk\n- **BNB**: Below EMA20, MACD negative, RSI 44 weak - bearish\n- **XRP**: At EMA20, MACD improving, RSI 57 - neutral but no compelling edge\n- **DOGE**: At EMA20, MACD improving, RSI 72 overbought - potential reversal risk\n\nNo new positions warranted. Market showing mixed signals, better to manage existing ETH position.\n\n# TRADING DECISIONS\n\n```json\n{\n  \"ETH\": {\n    \"trade_signal_args\": {\n      \"coin\": \"ETH\",\n      \"signal\": \"hold\",\n      \"quantity\": 1.94,\n      \"profit_target\": 3980.0,\n      \"stop_loss\": 3820.0,\n      \"invalidation_condition\": \"If price closes below 3800 on 3-minute candle or RSI(7) drops below 40\",\n      \"leverage\": 15,\n      \"confidence\": 0.72,\n      \"risk_usd\": 500.0\n    }\n  }\n}\n```",
      "signals": [
        {
          "coin": "ETH",
          "signal": "hold",
          "quantity": 1.94,
          "leverage": 15,
          "stop_loss": 3820.0,
          "profit_target": 3980.0,
          "confidence": 0.72,
          "risk_usd": 500.0,
          "invalidation_condition": "If price closes below 3800 on 3-minute candle or RSI(7) drops below 40"
        }
      ]
    },
    {
      "iteration": 13,
      "timestamp": "2025-10-19T00:00:00",
      "model": "anthropic",
      "raw_response": "# CHAIN OF THOUGHT\n\nReviewing my current position:\n\n**ETH Position Analysis:**\n- Entry: $3876.20, Current: $3904.70 (+$28.50, +0.73%)\n- Unrealized P&L: +$51.53 (+0.68% of position value)\n- Leverage: 15x, Quantity: 1.94 ETH\n- Profit Target: $3980.00 (still $75.30 away)\n- Stop Loss: $3820.00 (safe, $84.70 cushion)\n- Invalidation Condition: \"If price closes below 3800 on 3-minute candle or RSI(7) drops below 40\"\n\n**Checking Invalidation Conditions:**\n1. Price check: Current $3904.70 > $3800 \u2713 (well above)\n2. RSI(7) check: Current 71.158 > 40 \u2713 (strongly above)\n3. Latest candle close: $3904.70 > $3800 \u2713\n\n**Technical Analysis:**\n- RSI(7): 71.158 - Overbought territory, showing strong momentum but potential exhaustion\n- RSI(14): 56.822 - Healthy, not extreme\n- MACD: -20.766 - Still negative but improving rapidly (was -44.660, now -20.766)\n- Price vs EMA20: $3904.70 > $3893.63 - Price just crossed above EMA20 (bullish)\n- Recent price action: Strong recovery from $3797.30 to $3904.70 (+2.83%)\n- Volume: 34,670 vs avg 104,920 - Low volume (33% of average) - concerning for sustainability\n\n**Risk Assessment:**\n- Position is profitable but RSI(7) at 71 suggests overbought conditions\n- Low volume on this move is a red flag - rally may lack conviction\n- MACD improving but still negative\n- Price just crossed above EMA20, which is bullish short-term\n- Invalidation conditions NOT met - position remains valid\n\n**Decision Rationale:**\nThe invalidation conditions are clearly NOT met (price well above $3800, RSI(7) well above 40). However, the RSI(7) at 71.158 indicates overbought conditions and the low volume (only 33% of average) suggests this rally may not be sustainable. The position is only up 0.73% with 15x leverage, which is modest.\n\nGiven:\n1. Invalidation conditions NOT triggered\n2. Position is profitable (+$51.53)\n3. Stop loss has good cushion ($84.70)\n4. MACD improving (momentum building)\n5. Price crossed above EMA20 (bullish signal)\n\nDespite overbought RSI, the technical invalidation conditions are not met. I should HOLD and let the position work toward the $3980 profit target. The stop loss at $3820 will protect if the rally fails.\n\n**Other Coins:**\n- BTC: Below EMA20, MACD negative, RSI recovering but still weak. No clear setup.\n- SOL: Near EMA20, MACD improving, RSI moderate. Neutral - no strong signal.\n- BNB: Well below EMA20, weak RSI, negative MACD. Bearish - avoid.\n- XRP: Above EMA20, improving MACD, RSI 62. Interesting but not compelling enough.\n- DOGE: RSI(7) 79.484 - extremely overbought. Dangerous to enter here.\n\nNo new positions warranted. Market conditions mixed, and I already have exposure through ETH.\n\n# TRADING DECISIONS\n\n```json\n{\n  \"ETH\": {\n    \"trade_signal_args\": {\n      \"coin\": \"ETH\",\n      \"signal\": \"hold\",\n      \"quantity\": 1.94,\n      \"profit_target\": 3980.0,\n      \"stop_loss\": 3820.0,\n      \"invalidation_condition\": \"If price closes below 3800 on 3-minute candle or RSI(7) drops below 40\",\n      \"leverage\": 15,\n      \"confidence\": 0.72,\n      \"risk_usd\": 500.0\n    }\n  }\n}\n```",
      "signals": [
        {
          "coin": "ETH",
          "signal": "hold",
          "quantity": 1.94,
          "leverage": 15,
          "stop_loss": 3820.0,
          "profit_target": 3980.0,
          "confidence": 0.72,
          "risk_usd": 500.0,
          "invalidation_condition": "If price closes below 3800 on 3-minute candle or RSI(7) drops below 40"
        }
      ]
    },
    {
      "iteration": 14,
      "timestamp": "2025-10-19T04:00:00",
      "model": "anthropic",
      "raw_response": "# CHAIN OF THOUGHT\n\nReviewing my current position:\n\n**ETH Position Analysis:**\n- Entry: $3876.20, Current: $3886.00 (+$9.80, +0.25%)\n- Unrealized PnL: +$15.25\n- Leverage: 15x\n- Profit Target: $3980.00 (need +$94 move, +2.42%)\n- Stop Loss: $3820.00 (risk -$66 move, -1.70%)\n- Invalidation Condition: \"If price closes below 3800 on 3-minute candle or RSI(7) drops below 40\"\n\n**Checking Invalidation Conditions:**\n1. Price below $3800? NO - Current price is $3886, well above $3800\n2. RSI(7) below 40? NO - Current RSI(7) is 51.631, above 40 threshold\n\n**Technical Analysis:**\n- RSI(7): 51.631 - Neutral territory, healthy pullback from overbought\n- RSI(14): 49.877 - Neutral, balanced momentum\n- MACD: -24.168 - Still negative but improving (was -53.887, now -24.168), showing momentum recovery\n- Price vs EMA20: $3886 vs $3885.85 - Price just above EMA20, neutral\n- Recent price action: Dropped from $3904.70 to $3886.00 in last candle (-0.48%)\n\n**Decision Rationale:**\nThe invalidation conditions are NOT met. Price remains well above $3800 and RSI(7) is comfortably above 40. The MACD is improving (less negative), suggesting bearish momentum is weakening. The recent pullback from $3904.70 to $3886.00 is minor and doesn't trigger any exit conditions. The position is slightly profitable and the technical setup remains intact.\n\n**Risk Management:**\n- Position size: $7,538.84 notional (73% of account)\n- Available cash: $9,828.35\n- Current return: +3.46%\n- Sharpe ratio: 7.888 (excellent risk-adjusted returns)\n\n**Other Coins Assessment:**\n- BTC: Oversold (RSI 36.17), but below EMA20 and in downtrend - not entering\n- SOL: Neutral (RSI 47.79), consolidating near EMA20 - no clear setup\n- BNB: Oversold (RSI 35.47), weak downtrend - avoiding\n- XRP: Neutral (RSI 45.27), choppy price action - no edge\n- DOGE: Neutral (RSI 50.62), consolidating - no compelling setup\n\n**Conclusion:**\nHOLD ETH position. No invalidation conditions met, technical structure intact, and position is profitable. Not entering any new positions as market conditions are mixed and I already have good exposure.\n\n# TRADING DECISIONS\n\n```json\n{\n  \"ETH\": {\n    \"trade_signal_args\": {\n      \"coin\": \"ETH\",\n      \"signal\": \"hold\",\n      \"quantity\": 1.94,\n      \"profit_target\": 3980.0,\n      \"stop_loss\": 3820.0,\n      \"invalidation_condition\": \"If price closes below 3800 on 3-minute candle or RSI(7) drops below 40\",\n      \"leverage\": 15,\n      \"confidence\": 0.72,\n      \"risk_usd\": 500.0\n    }\n  }\n}\n```",
      "signals": [
        {
          "coin": "ETH",
          "signal": "hold",
          "quantity": 1.94,
          "leverage": 15,
          "stop_loss": 3820.0,
          "profit_target": 3980.0,
          "confidence": 0.72,
          "risk_usd": 500.0,
          "invalidation_condition": "If price closes below 3800 on 3-minute candle or RSI(7) drops below 40"
        }
      ]
    },
    {
      "iteration": 15,
      "timestamp": "2025-10-19T08:00:00",
      "model": "anthropic",
      "raw_response": "# CHAIN OF THOUGHT\n\n## Current Position Analysis\n\n**ETH Position Review:**\n- Entry: $3876.20, Current: $3922.20 (+$46.00, +1.19%)\n- Unrealized PnL: +$85.48 (+1.12% of account)\n- Leverage: 15x, Notional: $7,609\n- Exit Plan: Profit target $3980, Stop-loss $3820\n- Invalidation: \"If price closes below 3800 on 3-minute candle or RSI(7) drops below 40\"\n\n**Technical Analysis:**\n- Current RSI(7): 71.689 - Strong momentum, well above invalidation threshold of 40\n- Price: $3922.20 - Well above invalidation level of $3800 (margin: $122.20)\n- MACD: -17.553 - Still negative but improving rapidly (was -51.141 ten candles ago)\n- Price vs EMA20: $3922.20 vs $3897.93 - Trading above EMA20 (+$24.27)\n- RSI(14): 60.223 - Healthy uptrend territory\n- Recent price action: Strong recovery from $3830.70 to $3922.20 (+2.39%)\n\n**Invalidation Check:**\n1. Price below $3800? NO - Currently $3922.20 (safe by $122.20)\n2. RSI(7) below 40? NO - Currently 71.689 (strong bullish momentum)\n3. Stop-loss hit ($3820)? NO - Currently $3922.20 (safe by $102.20)\n4. Profit target hit ($3980)? NO - Currently $3922.20 (need +$57.80 more)\n\n**Decision Rationale:**\n- No invalidation conditions met\n- Position showing profit and momentum strengthening\n- RSI(7) at 71.689 shows strong buying pressure\n- MACD improving consistently (divergence narrowing)\n- Price above EMA20 confirms short-term uptrend\n- Profit target at $3980 is reasonable (+$57.80 away, 1.48% move)\n- Risk/reward remains favorable\n\n**Other Coins Assessment:**\n- **BTC**: RSI(7) 68.945, price above EMA20, but already have ETH exposure. Not adding new position.\n- **SOL**: RSI(7) 72.313, strong momentum but similar to ETH. Avoiding overconcentration.\n- **BNB**: RSI(7) 57.771, price below EMA20 ($1099.20 vs $1109.84). Weak setup.\n- **XRP**: RSI(7) 63.348, consolidating. No clear edge.\n- **DOGE**: RSI(7) 77.432, extremely overbought. Too risky to enter.\n\n**Portfolio Risk Management:**\n- Current exposure: $7,609 notional (73% of account value)\n- Available cash: $9,828.35\n- Single position concentration acceptable given strong technicals\n- Not adding positions to avoid overleverage\n\n**Conclusion:**\nHOLD ETH position. All systems green - no invalidation triggers, profit building, momentum strong.\n\n# TRADING DECISIONS\n\n```json\n{\n  \"ETH\": {\n    \"trade_signal_args\": {\n      \"coin\": \"ETH\",\n      \"signal\": \"hold\",\n      \"quantity\": 1.94,\n      \"profit_target\": 3980.0,\n      \"stop_loss\": 3820.0,\n      \"invalidation_condition\": \"If price closes below 3800 on 3-minute candle or RSI(7) drops below 40\",\n      \"leverage\": 15,\n      \"confidence\": 0.72,\n      \"risk_usd\": 500.0\n    }\n  }\n}\n```",
      "signals": [
        {
          "coin": "ETH",
          "signal": "hold",
          "quantity": 1.94,
          "leverage": 15,
          "stop_loss": 3820.0,
          "profit_target": 3980.0,
          "confidence": 0.72,
          "risk_usd": 500.0,
          "invalidation_condition": "If price closes below 3800 on 3-minute candle or RSI(7) drops below 40"
        }
      ]
    },
    {
      "iteration": 16,
      "timestamp": "2025-10-19T12:00:00",
      "model": "anthropic",
      "raw_response": "# CHAIN OF THOUGHT\n\nReviewing my current position:\n\n**ETH Position Analysis:**\n- Entry: 3876.20, Current: 3977.10 (+2.6%)\n- Unrealized P&L: +$191.99 (strong profit)\n- Profit target: 3980.00 (REACHED - current price 3977.10 is within 3 points)\n- Stop-loss: 3820.00 (safe distance)\n- Invalidation condition: \"If price closes below 3800 on 3-minute candle or RSI(7) drops below 40\"\n- Current RSI(7): 84.561 (extremely overbought - danger zone)\n- Current RSI(14): 70.091 (overbought)\n- MACD: -19.726 (still negative but improving)\n- Price above EMA20 (3977.10 vs 3913.36)\n\n**Critical Decision Point:**\nThe profit target of 3980 has essentially been reached (current 3977.10). RSI(7) at 84.561 is extremely overbought - this is unsustainable and signals imminent reversal risk. While the invalidation condition hasn't been technically met (price still above 3800, RSI above 40), the profit target achievement combined with extreme overbought conditions makes this an optimal exit point.\n\n**Risk Management Consideration:**\n- Up $192 on a position with $500 risk = 38.4% gain on risk capital\n- RSI(7) at 84+ typically precedes sharp pullbacks\n- Profit target achieved\n- Better to take profits at target than risk reversal\n\n**Decision: CLOSE ETH position** - Profit target reached and extreme overbought conditions warrant taking profits.\n\n**Other Coins Analysis:**\n- BTC: RSI(7) 78.897 - overbought but strong momentum. Price 108435 above EMA 107857. No position.\n- SOL: RSI(7) 79.759 - overbought. Price 190.67 above EMA 187.69. No position.\n- BNB: RSI(7) 73.311 - overbought. Price 1118.50 above EMA 1110.28. No position.\n- XRP: RSI(7) 74.174 - overbought. Price 2.40 above EMA 2.36. No position.\n- DOGE: RSI(7) 85.112 - extremely overbought. Price 0.196440 above EMA 0.190771. No position.\n\nAll coins showing overbought conditions. Market-wide overbought suggests caution. With only 6 minutes of trading time elapsed and strong performance (5.35% return, Sharpe 7.888), prudent to take profits on ETH and wait for better entry opportunities rather than chase overbought momentum.\n\n# TRADING DECISIONS\n\n```json\n{\n  \"ETH\": {\n    \"trade_signal_args\": {\n      \"coin\": \"ETH\",\n      \"signal\": \"close_position\",\n      \"quantity\": 1.94,\n      \"profit_target\": 3980.0,\n      \"stop_loss\": 3820.0,\n      \"invalidation_condition\": \"If price closes below 3800 on 3-minute candle or RSI(7) drops below 40\",\n      \"leverage\": 15,\n      \"confidence\": 0.72,\n      \"risk_usd\": 500.0,\n      \"close_reason\": \"Profit target reached (3977.10 vs target 3980.00) and RSI(7) at extreme overbought level of 84.561 signals imminent reversal risk - taking profits\"\n    }\n  }\n}\n```",
      "signals": [
        {
          "coin": "ETH",
          "signal": "close_position",
          "quantity": 1.94,
          "leverage": 15,
          "stop_loss": 3820.0,
          "profit_target": 3980.0,
          "confidence": 0.72,
          "risk_usd": 500.0,
          "invalidation_condition": "If price closes below 3800 on 3-minute candle or RSI(7) drops below 40"
        }
      ]
    },
    {
      "iteration": 17,
      "timestamp": "2025-10-19T16:00:00",
      "model": "anthropic",
      "raw_response": "# CHAIN OF THOUGHT\n\n## Current Portfolio Status\n- No open positions\n- Available cash: $10,517.80\n- Total return: 5.18%\n- Sharpe ratio: 9.097 (excellent risk-adjusted returns)\n\n## Market Analysis by Coin\n\n### BTC Analysis\n- Current price: $108,841 (strong upward momentum)\n- Price above EMA20 ($107,560) - bullish\n- RSI (7): 83.6 - EXTREMELY overbought (danger zone)\n- RSI (14): 70.9 - overbought\n- MACD: -29.13 (improving from -523, but still negative)\n- Recent price action: Strong rally from $106,726 to $108,841 (+2%)\n- **Assessment**: While momentum is strong, RSI above 80 signals extreme overbought conditions. High risk of pullback. Would need to see consolidation before entry.\n\n### ETH Analysis\n- Current price: $3,983.70\n- Price above EMA20 ($3,898.88) - bullish\n- RSI (7): 86.2 - EXTREMELY overbought (even worse than BTC)\n- RSI (14): 75.4 - overbought\n- MACD: 16.08 (positive and rising)\n- Recent rally: $3,886 to $3,983 (+2.5%)\n- **Assessment**: Strongest momentum but most overbought. Very high risk of reversal. Not entering at these levels.\n\n### SOL Analysis\n- Current price: $188.81\n- Price above EMA20 ($186.53) - mildly bullish\n- RSI (7): 58.5 - NEUTRAL (healthy level!)\n- RSI (14): 59.5 - neutral\n- MACD: 0.664 (positive and rising)\n- Recent action: Pulled back from $190.67 to $188.81\n- **Assessment**: Most balanced technical setup. RSI in healthy range, positive MACD, above EMA. This is the best risk/reward opportunity.\n\n### BNB Analysis\n- Current price: $1,116.10\n- Price above EMA20 ($1,104.60) - bullish\n- RSI (7): 69.4 - approaching overbought\n- RSI (14): 59.5 - neutral\n- MACD: -5.19 (negative but improving)\n- **Assessment**: Decent setup but MACD still negative. Less conviction than SOL.\n\n### XRP Analysis\n- Current price: $2.40\n- Price above EMA20 ($2.35) - bullish\n- RSI (7): 72.1 - overbought\n- RSI (14): 65.4 - mildly overbought\n- MACD: 0.012 (barely positive)\n- **Assessment**: Overbought on shorter timeframe. Momentum weak compared to others.\n\n### DOGE Analysis\n- Current price: $0.19669\n- Price above EMA20 ($0.18986) - bullish\n- RSI (7): 86.2 - EXTREMELY overbought\n- RSI (14): 77.2 - overbought\n- MACD: 0.002 (positive but small)\n- **Assessment**: Extremely overbought like ETH. High risk of pullback.\n\n## Trading Decision\nGiven the analysis, **SOL** presents the best risk/reward:\n1. Only coin with RSI in healthy neutral zone (58.5)\n2. Positive MACD momentum\n3. Price above EMA20 but not extended\n4. Recent pullback from $190.67 provides better entry\n5. Lower risk of immediate reversal compared to overbought coins\n\nI'll enter a conservative position in SOL with 15x leverage, risking approximately $500 (4.75% of capital).\n\nEntry: $188.81\nStop-loss: $184.00 (2.55% below entry, below recent low of $184.91)\nProfit target: $196.00 (3.8% above entry, near recent high resistance)\nInvalidation: If RSI(7) drops below 45 or price closes below $184 on 3-minute candle\n\n# TRADING DECISIONS\n\n```json\n{\n  \"SOL\": {\n    \"trade_signal_args\": {\n      \"coin\": \"SOL\",\n      \"signal\": \"buy\",\n      \"quantity\": 39.7,\n      \"profit_target\": 196.00,\n      \"stop_loss\": 184.00,\n      \"invalidation_condition\": \"If price closes below 184.00 on 3-minute candle or RSI(7) drops below 45 indicating momentum loss\",\n      \"leverage\": 15,\n      \"confidence\": 0.72,\n      \"risk_usd\": 500.00\n    }\n  }\n}\n```",
      "signals": [
        {
          "coin": "SOL",
          "signal": "buy",
          "quantity": 39.7,
          "leverage": 15,
          "stop_loss": 184.0,
          "profit_target": 196.0,
          "confidence": 0.72,
          "risk_usd": 500.0,
          "invalidation_condition": "If price closes below 184.00 on 3-minute candle or RSI(7) drops below 45 indicating momentum loss"
        }
      ]
    },
    {
      "iteration": 18,
      "timestamp": "2025-10-19T20:00:00",
      "model": "anthropic",
      "raw_response": "# CHAIN OF THOUGHT\n\nReviewing my current position:\n\n**SOL Position Analysis:**\n- Entry: 188.81, Current: 187.77 (down -1.04, -0.55%)\n- Unrealized P&L: -$45.04\n- Position size: 39.7 SOL at 15x leverage (~$7,454 notional)\n- Stop-loss: 184.00\n- Profit target: 196.00\n- Invalidation condition: \"If price closes below 184.00 on 3-minute candle or RSI(7) drops below 45 indicating momentum loss\"\n\n**Checking Invalidation Conditions:**\n1. Price check: Current 187.77 > Stop-loss 184.00 \u2713 (Still above)\n2. RSI(7) check: Current 48.677 > 45 \u2713 (Still above threshold)\n3. Recent price action: Last 10 candles show [186.04, 184.91, 186.28, 187.47, 186.90, 185.81, 188.86, 190.67, 188.81, 187.77]\n   - Touched high of 190.67 but now pulling back\n   - Currently consolidating around 187-188 range\n\n**Technical Analysis:**\n- RSI(7): 48.677 - Neutral, dropped from overbought 80.622 two candles ago\n- RSI(14): 54.775 - Neutral territory\n- MACD: 1.115 - Still positive but declining from 1.135\n- EMA20: 186.31 - Price above EMA (bullish)\n- Recent momentum: Lost upward momentum after hitting 190.67, now retracing\n\n**Risk Assessment:**\nThe position is showing signs of momentum loss. RSI(7) dropped from 80.622 to 48.677 in just 2 candles - a significant momentum shift. While the invalidation condition hasn't been technically breached (RSI still above 45, price above 184), the rapid momentum loss and failure to hold above 190 is concerning.\n\nHowever, the invalidation conditions are clear and have NOT been met:\n- Price is still above 184.00 (currently 187.77)\n- RSI(7) is still above 45 (currently 48.677)\n\n**Decision: HOLD**\nThe invalidation conditions have not been met. Price remains above stop-loss and RSI above the threshold. The position deserves more time to develop, though I'm watching closely for any break below 184 or RSI dropping below 45.\n\n**Other Coins Analysis:**\n- **BTC**: Strong momentum (RSI 71.8, MACD positive 107.56), but already at elevated levels. No position, not entering at these overbought levels.\n- **ETH**: Very overbought (RSI 82.6), extended above EMA. Too risky to enter here.\n- **BNB**: Neutral (RSI 56.5), MACD still negative. No clear setup.\n- **XRP**: Moderate momentum (RSI 62.1), but no compelling entry.\n- **DOGE**: Good momentum (RSI 68.5), but prefer to focus on existing position management.\n\n# TRADING DECISIONS\n\n```json\n{\n  \"SOL\": {\n    \"trade_signal_args\": {\n      \"coin\": \"SOL\",\n      \"signal\": \"hold\",\n      \"quantity\": 39.7,\n      \"profit_target\": 196.0,\n      \"stop_loss\": 184.0,\n      \"invalidation_condition\": \"If price closes below 184.00 on 3-minute candle or RSI(7) drops below 45 indicating momentum loss\",\n      \"leverage\": 15,\n      \"confidence\": 0.72,\n      \"risk_usd\": 500.0\n    }\n  }\n}\n```",
      "signals": [
        {
          "coin": "SOL",
          "signal": "hold",
          "quantity": 39.7,
          "leverage": 15,
          "stop_loss": 184.0,
          "profit_target": 196.0,
          "confidence": 0.72,
          "risk_usd": 500.0,
          "invalidation_condition": "If price closes below 184.00 on 3-minute candle or RSI(7) drops below 45 indicating momentum loss"
        }
      ]
    },
    {
      "iteration": 19,
      "timestamp": "2025-10-20T00:00:00",
      "model": "anthropic",
      "raw_response": "# CHAIN OF THOUGHT\n\nReviewing my current position:\n\n**SOL Position Analysis:**\n- Entry: 188.81, Current: 191.14 (+1.23% or +$88.75 unrealized PnL)\n- Profit target: 196.00 (2.55% away)\n- Stop-loss: 184.00 (3.74% away)\n- Invalidation condition: \"If price closes below 184.00 on 3-minute candle or RSI(7) drops below 45\"\n\n**Checking Invalidation Condition:**\n- Current price: 191.14 (well above 184.00 \u2713)\n- Latest 3-minute close: 191.14 (above 184.00 \u2713)\n- Current RSI(7): 70.361 (well above 45 \u2713)\n- **Invalidation NOT met** - all conditions are favorable\n\n**Technical Analysis:**\n- RSI(7): 70.361 - healthy bullish momentum, not yet overbought\n- RSI(14): 66.552 - confirms sustained uptrend\n- MACD: 1.390 - positive and increasing, bullish signal\n- Price vs EMA20: 191.14 vs 186.75 (+2.35%) - strong uptrend above moving average\n- Recent price action: Recovered from dip at 187.77, now at 191.14 showing strength\n- Volume: 891,758 vs avg 728,045 (+22.5%) - above average, confirming move\n\n**Risk Management:**\n- Position is profitable (+$88.75)\n- Stop-loss provides 3.74% downside protection\n- Profit target at 196.00 is reasonable (2.55% away)\n- Leverage at 15x is within acceptable range for this momentum\n- No signs of reversal or exhaustion yet\n\n**Decision: HOLD**\nThe position is performing well with strong momentum. All technical indicators remain bullish, invalidation conditions are not met, and the risk/reward setup remains favorable. The recent bounce from 187.77 to 191.14 shows buying pressure. Will continue to hold and let the position run toward the 196.00 profit target.\n\n**Other Coins:**\n- **BTC**: RSI(7) at 86.833 - extremely overbought, risky entry\n- **ETH**: RSI(7) at 90.328 - dangerously overbought, avoid\n- **BNB**: MACD still negative (-3.650), not confirmed uptrend\n- **XRP**: RSI(7) at 80.881 - overbought, late to enter\n- **DOGE**: RSI(7) at 81.814 - overbought, late to enter\n\nNo new positions warranted - most coins are overbought and would represent poor risk/reward entries at current levels.\n\n# TRADING DECISIONS\n\n```json\n{\n  \"SOL\": {\n    \"trade_signal_args\": {\n      \"coin\": \"SOL\",\n      \"signal\": \"hold\",\n      \"quantity\": 39.7,\n      \"profit_target\": 196.0,\n      \"stop_loss\": 184.0,\n      \"invalidation_condition\": \"If price closes below 184.00 on 3-minute candle or RSI(7) drops below 45 indicating momentum loss\",\n      \"leverage\": 15,\n      \"confidence\": 0.72,\n      \"risk_usd\": 500.0\n    }\n  }\n}\n```",
      "signals": [
        {
          "coin": "SOL",
          "signal": "hold",
          "quantity": 39.7,
          "leverage": 15,
          "stop_loss": 184.0,
          "profit_target": 196.0,
          "confidence": 0.72,
          "risk_usd": 500.0,
          "invalidation_condition": "If price closes below 184.00 on 3-minute candle or RSI(7) drops below 45 indicating momentum loss"
        }
      ]
    },
    {
      "iteration": 20,
      "timestamp": "2025-10-20T04:00:00",
      "model": "anthropic",
      "raw_response": "# CHAIN OF THOUGHT\n\nReviewing my current position:\n\n**SOL Position Analysis:**\n- Entry: 188.81, Current: 192.93 (+2.18% gain)\n- Unrealized P&L: +$159.82 (+2.09% of account)\n- Profit Target: 196.00 (1.59% away)\n- Stop Loss: 184.00 (4.63% below current)\n- Invalidation Condition: \"If price closes below 184.00 on 3-minute candle or RSI(7) drops below 45\"\n\n**Checking Invalidation Condition:**\n- Current price: 192.93 (well above 184.00 \u2713)\n- RSI(7): 77.159 (well above 45 threshold \u2713)\n- Last 10 candle closes: All above 185.81, none below 184.00 \u2713\n- Invalidation condition NOT met\n\n**Technical Analysis:**\n- Price above EMA20 (192.93 > 187.63) - bullish\n- MACD: 1.318 (positive and increasing) - bullish momentum\n- RSI(7): 77.159 - strong but not extreme overbought\n- RSI(14): 70.820 - healthy momentum\n- Recent price action: Strong uptrend from 185.81 to 192.93\n- Volume: 595,780 vs avg 724,370 (slightly below average but acceptable)\n\n**Decision Rationale:**\nThe position is performing well with +$159.82 unrealized profit. Price is approaching the profit target of 196.00 (only 1.59% away). The invalidation condition is clearly NOT met - price is well above 184.00 and RSI(7) is at 77.159, far above the 45 threshold. The technical setup remains bullish with positive MACD, price above EMA20, and strong RSI readings. \n\nGiven that:\n1. Invalidation condition is not triggered\n2. Profit target is close (3.07 points away)\n3. Momentum remains strong\n4. No signs of reversal\n\n**Decision: HOLD** - Let the position run toward the 196.00 profit target. The risk/reward remains favorable with stop-loss at 184.00 providing 8.93 points of protection while profit target offers 3.07 points of upside.\n\n**Other Coins:**\n- BTC: RSI(7) at 91.207 - extremely overbought, risky entry\n- ETH: RSI(7) at 92.913 - extremely overbought, risky entry  \n- XRP: RSI(7) at 87.651 - very overbought\n- DOGE: RSI(7) at 86.119 - very overbought\n- BNB: RSI(7) at 67.344 - most reasonable but MACD negative\n\nAll other coins show extreme overbought conditions. Not entering new positions given the elevated RSI levels across the board and existing SOL exposure.\n\n# TRADING DECISIONS\n\n```json\n{\n  \"SOL\": {\n    \"trade_signal_args\": {\n      \"coin\": \"SOL\",\n      \"signal\": \"hold\",\n      \"quantity\": 39.7,\n      \"profit_target\": 196.0,\n      \"stop_loss\": 184.0,\n      \"invalidation_condition\": \"If price closes below 184.00 on 3-minute candle or RSI(7) drops below 45 indicating momentum loss\",\n      \"leverage\": 15,\n      \"confidence\": 0.72,\n      \"risk_usd\": 500.0\n    }\n  }\n}\n```",
      "signals": [
        {
          "coin": "SOL",
          "signal": "hold",
          "quantity": 39.7,
          "leverage": 15,
          "stop_loss": 184.0,
          "profit_target": 196.0,
          "confidence": 0.72,
          "risk_usd": 500.0,
          "invalidation_condition": "If price closes below 184.00 on 3-minute candle or RSI(7) drops below 45 indicating momentum loss"
        }
      ]
    },
    {
      "iteration": 21,
      "timestamp": "2025-10-20T08:00:00",
      "model": "anthropic",
      "raw_response": "# CHAIN OF THOUGHT\n\nReviewing my current position:\n\n**SOL Position Analysis:**\n- Entry: 188.81, Current: 192.11 (+1.75%)\n- Unrealized P&L: +$127.26 (+1.67% of account)\n- Profit Target: 196.00 (still 3.89 away, +2.03% from current)\n- Stop Loss: 184.00 (8.11 away, -4.22% from current)\n- Invalidation Condition: \"If price closes below 184.00 on 3-minute candle or RSI(7) drops below 45\"\n\n**Checking Invalidation Condition:**\n- Current price: 192.11 (well above 184.00 \u2713)\n- Latest 3-min close: 192.11 (above 184.00 \u2713)\n- RSI(7): 68.036 (well above 45 threshold \u2713)\n- **Invalidation NOT met** - position remains valid\n\n**Technical Analysis:**\n- Price above EMA20 (192.11 > 186.80) - bullish \u2713\n- MACD: 3.160 and positive - momentum intact \u2713\n- RSI(7): 68.036 - healthy, not overbought (below 70)\n- RSI(14): 69.520 - approaching overbought but still reasonable\n- Recent price action: Pulled back from 192.93 to 192.11 - minor consolidation\n- Volume: 358,523 vs avg 719,075 - lower volume, typical for consolidation\n\n**Risk Assessment:**\n- Position is profitable and trending in our favor\n- No signs of reversal or momentum loss\n- RSI cooling from extreme levels (was 77.682, now 68.036) - healthy pullback\n- Price holding above key support levels\n- Leverage: 15x - aggressive but manageable with current profit cushion\n\n**Decision: HOLD**\nThe position remains valid with all conditions met. The slight pullback from 192.93 to 192.11 is healthy consolidation after a strong move. RSI cooling from overbought levels is positive for continuation. Will maintain position and let it run toward the 196.00 profit target.\n\n**Other Coins - No New Positions:**\n- **BTC**: RSI(7) at 85.817 - extremely overbought, risk of pullback too high\n- **ETH**: RSI(7) at 74.557 - overbought, similar concerns\n- **XRP**: RSI(7) at 75.136 - overbought\n- **DOGE**: RSI(7) at 75.675 - overbought\n- **BNB**: RSI(7) at 50.811 - neutral but less conviction, prefer to focus on existing position\n\nAll major coins showing overbought conditions. Better to manage existing profitable SOL position than chase momentum at these levels.\n\n# TRADING DECISIONS\n\n```json\n{\n  \"SOL\": {\n    \"trade_signal_args\": {\n      \"coin\": \"SOL\",\n      \"signal\": \"hold\",\n      \"quantity\": 39.7,\n      \"profit_target\": 196.0,\n      \"stop_loss\": 184.0,\n      \"invalidation_condition\": \"If price closes below 184.00 on 3-minute candle or RSI(7) drops below 45 indicating momentum loss\",\n      \"leverage\": 15,\n      \"confidence\": 0.72,\n      \"risk_usd\": 500.0\n    }\n  }\n}\n```",
      "signals": [
        {
          "coin": "SOL",
          "signal": "hold",
          "quantity": 39.7,
          "leverage": 15,
          "stop_loss": 184.0,
          "profit_target": 196.0,
          "confidence": 0.72,
          "risk_usd": 500.0,
          "invalidation_condition": "If price closes below 184.00 on 3-minute candle or RSI(7) drops below 45 indicating momentum loss"
        }
      ]
    },
    {
      "iteration": 22,
      "timestamp": "2025-10-20T12:00:00",
      "model": "anthropic",
      "raw_response": "# CHAIN OF THOUGHT\n\n## Current Position Analysis\n\n### SOL Position Review\n- **Entry**: 188.81, **Current**: 190.41 (+0.85% or +$59.77 unrealized PnL)\n- **Leverage**: 15x, **Notional**: $7,559\n- **Exit Plan**: Profit target 196.00, Stop-loss 184.00\n- **Invalidation Condition**: \"If price closes below 184.00 on 3-minute candle or RSI(7) drops below 45 indicating momentum loss\"\n\n**Technical Analysis**:\n- Current RSI(7): 50.532 - Just above the invalidation threshold of 45, showing weakening momentum\n- RSI(14): 58.413 - Declining from recent highs (was 79.272)\n- Price: 190.41 - Still above entry but showing consolidation/pullback from recent high of 192.93\n- MACD: 2.370 - Declining from 2.435, showing momentum loss\n- EMA20: 187.66 - Price still above but momentum fading\n- Recent price action: Peaked at 192.93, now pulling back to 190.41\n\n**Critical Assessment**:\nThe invalidation condition is VERY CLOSE to being triggered. RSI(7) at 50.532 is only 5.5 points above the 45 threshold. The recent price action shows:\n- Peak at 192.93 \u2192 pullback to 190.41\n- RSI(7) dropped from 77.598 \u2192 50.532 (significant momentum loss)\n- MACD declining\n- This is a clear momentum loss pattern\n\n**Risk Management Decision**: \nGiven the 15x leverage and the fact that RSI(7) is dangerously close to the invalidation threshold (50.532 vs 45), and momentum is clearly weakening, I should **CLOSE THIS POSITION** to protect profits. The position is up $59.77, and with 15x leverage, a small adverse move could quickly turn this profitable trade into a loss. The invalidation condition is nearly met (momentum loss is evident), and it's prudent to take profits here rather than risk the position deteriorating further.\n\n### Other Coins Assessment\n\n**BTC**: \n- Extremely overbought with RSI(7) at 86.550, RSI(14) at 84.200\n- Price at 111,100 after strong rally\n- Too risky to enter at these extended levels\n- **Decision**: No trade\n\n**ETH**:\n- RSI(7) at 52.543 - cooling off from overbought\n- Price pulling back from 4053.40 to 4003.10\n- Momentum declining (MACD 59.060 down from 60.369)\n- **Decision**: No trade - unclear direction\n\n**BNB**:\n- RSI(7) at 43.947 - weak momentum\n- Price pulling back from 1127.90 to 1110.10\n- **Decision**: No trade - weak setup\n\n**XRP**:\n- RSI(7) at 77.225 - overbought\n- Strong uptrend but extended\n- **Decision**: No trade - too extended\n\n**DOGE**:\n- RSI(7) at 65.052 - declining from overbought\n- Price consolidating\n- **Decision**: No trade - momentum fading\n\n# TRADING DECISIONS\n\n```json\n{\n  \"SOL\": {\n    \"trade_signal_args\": {\n      \"coin\": \"SOL\",\n      \"signal\": \"close_position\",\n      \"quantity\": 39.7,\n      \"profit_target\": 196.0,\n      \"stop_loss\": 184.0,\n      \"invalidation_condition\": \"If price closes below 184.00 on 3-minute candle or RSI(7) drops below 45 indicating momentum loss\",\n      \"leverage\": 15,\n      \"confidence\": 0.72,\n      \"risk_usd\": 500.0,\n      \"close_reason\": \"Momentum loss evident - RSI(7) dropped from 77.598 to 50.532, dangerously close to invalidation threshold of 45. Price pulling back from 192.93 to 190.41 with declining MACD. Taking $59.77 profit to protect capital with 15x leverage before invalidation condition is fully triggered.\"\n    }\n  }\n}\n```",
      "signals": [
        {
          "coin": "SOL",
          "signal": "close_position",
          "quantity": 39.7,
          "leverage": 15,
          "stop_loss": 184.0,
          "profit_target": 196.0,
          "confidence": 0.72,
          "risk_usd": 500.0,
          "invalidation_condition": "If price closes below 184.00 on 3-minute candle or RSI(7) drops below 45 indicating momentum loss"
        }
      ]
    },
    {
      "iteration": 23,
      "timestamp": "2025-10-20T16:00:00",
      "model": "anthropic",
      "raw_response": "# CHAIN OF THOUGHT\n\nAnalyzing current market conditions across all coins:\n\n**Current Portfolio Status:**\n- No open positions\n- Available cash: $10,570.04\n- Total return: 5.70% (strong performance)\n- Sharpe ratio: 8.647 (excellent risk-adjusted returns)\n\n**Market Analysis by Coin:**\n\n**BTC (110753.00):**\n- Strong uptrend: Price well above EMA20 (108753.25)\n- RSI(7): 70.25 - approaching overbought but not extreme\n- RSI(14): 75.31 - confirming strength\n- MACD: 1055.25 - very strong positive momentum\n- Volume: 8550.73 vs avg 4155.50 (2x above average - strong conviction)\n- Price action: Rallied from 106726 to 111161, now consolidating at 110753\n- Concern: RSI peaked at 91.76 earlier, now cooling to 70.25 - potential exhaustion\n- Decision: PASS - Too extended after massive rally, RSI cooling suggests pullback risk\n\n**ETH (3980.40):**\n- Price above EMA20 (3938.84) but losing momentum\n- RSI(7): 40.56 - dropped sharply from 93.78 peak (bearish divergence)\n- RSI(14): 56.03 - confirming weakness\n- MACD: 51.93 - declining from 56.31 peak\n- Price: Peaked at 4053.40, now down to 3980.40 (-73 points)\n- Decision: PASS - Clear momentum loss, RSI collapse from overbought suggests correction\n\n**SOL (188.77):**\n- Price slightly above EMA20 (187.94)\n- RSI(7): 37.96 - dropped from 82.28 to oversold territory\n- RSI(14): 49.69 - neutral but declining\n- MACD: 1.93 - weakening from 2.18 peak\n- Price: Peaked at 192.93, now at 188.77 (-4.16 points)\n- Decision: PASS - Momentum fading, RSI showing weakness\n\n**BNB (1100.90):**\n- Price at EMA20 (1101.76) - neutral\n- RSI(7): 32.17 - oversold territory\n- RSI(14): 45.67 - below 50, bearish\n- MACD: 9.03 - declining from 11.32 peak\n- Price: Peaked at 1127.90, now at 1100.90 (-27 points, -2.4%)\n- Decision: PASS - Oversold but no reversal signal yet, downtrend intact\n\n**XRP (2.52):**\n- Strong breakout: Price well above EMA20 (2.40)\n- RSI(7): 89.38 - EXTREMELY overbought\n- RSI(14): 84.45 - very overbought\n- MACD: 0.044 - strong positive momentum, accelerating\n- Volume: 7,531,865 vs avg 4,731,611 (1.6x above average)\n- Price action: Steady climb from 2.35 to 2.52 (+7.2%)\n- 3-period ATR: 0.082 vs 14-period: 0.056 (volatility expanding)\n- Decision: **BUY OPPORTUNITY** - Despite extreme RSI, momentum is accelerating with volume confirmation. This is a breakout scenario, not exhaustion. Will use tight stop-loss due to overbought conditions.\n\n**DOGE (0.199530):**\n- Price above EMA20 (0.193701) - bullish\n- RSI(7): 66.69 - healthy, not overbought\n- RSI(14): 72.69 - strong but manageable\n- MACD: 0.004 - positive and steady\n- Volume: 30,907,567 vs avg 22,396,926 (1.4x above average)\n- Price: Rallied from 0.18869 to 0.20115, now at 0.19953\n- Decision: **BUY OPPORTUNITY** - Good momentum with healthy RSI levels (not extreme like XRP). Volume supporting the move. Better risk/reward than XRP due to less extended RSI.\n\n**Trading Strategy:**\nGiven strong performance (5.70% return, 8.647 Sharpe), I'll take selective positions in the two strongest setups:\n1. DOGE - Primary position (better risk/reward, healthier RSI)\n2. XRP - Secondary position (stronger momentum but more extended)\n\nRisk allocation: ~$500-600 per position to maintain diversification and risk management.\n\n# TRADING DECISIONS\n\n```json\n{\n  \"DOGE\": {\n    \"trade_signal_args\": {\n      \"coin\": \"DOGE\",\n      \"signal\": \"buy\",\n      \"quantity\": 25000,\n      \"profit_target\": 0.2095,\n      \"stop_loss\": 0.1920,\n      \"invalidation_condition\": \"If price closes below 0.1920 (EMA20 support) on 3-minute candle\",\n      \"leverage\": 15,\n      \"confidence\": 0.78,\n      \"risk_usd\": 562.50\n    }\n  },\n  \"XRP\": {\n    \"trade_signal_args\": {\n      \"coin\": \"XRP\",\n      \"signal\": \"buy\",\n      \"quantity\": 2000,\n      \"profit_target\": 2.65,\n      \"stop_loss\": 2.42,\n      \"invalidation_condition\": \"If price closes below 2.42 (recent consolidation support) on 3-minute candle\",\n      \"leverage\": 15,\n      \"confidence\": 0.72,\n      \"risk_usd\": 500.00\n    }\n  }\n}\n```",
      "signals": [
        {
          "coin": "DOGE",
          "signal": "buy",
          "quantity": 25000.0,
          "leverage": 15,
          "stop_loss": 0.192,
          "profit_target": 0.2095,
          "confidence": 0.78,
          "risk_usd": 562.5,
          "invalidation_condition": "If price closes below 0.1920 (EMA20 support) on 3-minute candle"
        },
        {
          "coin": "XRP",
          "signal": "buy",
          "quantity": 2000.0,
          "leverage": 15,
          "stop_loss": 2.42,
          "profit_target": 2.65,
          "confidence": 0.72,
          "risk_usd": 500.0,
          "invalidation_condition": "If price closes below 2.42 (recent consolidation support) on 3-minute candle"
        }
      ]
    },
    {
      "iteration": 24,
      "timestamp": "2025-10-20T20:00:00",
      "model": "anthropic",
      "raw_response": "# CHAIN OF THOUGHT\n\nReviewing my current positions and market conditions:\n\n## DOGE Position Analysis\n- Entry: $0.19953, Current: $0.19995 (+$8.01 PnL, +0.21%)\n- Invalidation condition: \"If price closes below 0.1920 (EMA20 support) on 3-minute candle\"\n- Current EMA20: $0.194231 (well above invalidation at $0.192)\n- Technical indicators:\n  * RSI(7): 70.002 - showing strength but approaching overbought\n  * RSI(14): 74.166 - confirming bullish momentum\n  * MACD: 0.004 - positive and stable\n  * Price above EMA20 ($0.19995 > $0.194231) - uptrend intact\n- Stop-loss: $0.192, Profit target: $0.2095\n- **Decision: HOLD** - Invalidation NOT met. Price is above EMA20 support at $0.194231, which is well above the $0.192 invalidation level. Strong momentum with RSI showing continued strength. Position is profitable and trending toward profit target.\n\n## XRP Position Analysis\n- Entry: $2.5244, Current: $2.4934 (-$64.52 PnL, -1.23%)\n- Invalidation condition: \"If price closes below 2.42 (recent consolidation support) on 3-minute candle\"\n- Current price: $2.4934 (ABOVE invalidation at $2.42)\n- Technical indicators:\n  * RSI(7): 66.053 - healthy bullish territory\n  * RSI(14): 70.344 - confirming strength\n  * MACD: 0.046 - positive and increasing\n  * Price above EMA20 ($2.4934 > $2.41) - uptrend intact\n  * Recent spike to $2.52 shows strong buying pressure\n- Stop-loss: $2.42, Profit target: $2.65\n- **Decision: HOLD** - Invalidation NOT met. Despite being down on the position, price is holding above the $2.42 invalidation level. The recent spike to $2.52 and pullback to $2.49 is normal profit-taking. Strong RSI and MACD suggest continuation potential. Price remains above EMA20 support.\n\n## Other Coins (BTC, ETH, SOL, BNB)\n- No positions in these coins\n- BTC: Strong uptrend but at $110,479 with RSI(7) at 58.7 - momentum cooling after overbought readings\n- ETH: Price $3,978, RSI(7) at 39.3 - showing weakness after previous overbought conditions\n- SOL: Price $189.64, RSI(7) at 47.2 - neutral, consolidating\n- BNB: Price $1,100.20, RSI(7) at 31.4 - oversold but showing weakness\n- **Decision: NO NEW TRADES** - Existing positions are performing adequately. Risk management dictates not overextending portfolio with 2 active leveraged positions already deployed.\n\n## Risk Management Summary\n- Total account value: $10,505.07\n- Available cash: $9,895.89\n- Current positions: 2 (DOGE +0.21%, XRP -1.23%)\n- Combined notional exposure: ~$10,000 (appropriate for account size)\n- Both positions have clear invalidation conditions that have NOT been triggered\n- Portfolio is balanced with manageable risk\n\n# TRADING DECISIONS\n\n```json\n{\n  \"DOGE\": {\n    \"trade_signal_args\": {\n      \"coin\": \"DOGE\",\n      \"signal\": \"hold\",\n      \"quantity\": 25000.0,\n      \"profit_target\": 0.2095,\n      \"stop_loss\": 0.192,\n      \"invalidation_condition\": \"If price closes below 0.1920 (EMA20 support) on 3-minute candle\",\n      \"leverage\": 15,\n      \"confidence\": 0.78,\n      \"risk_usd\": 562.5\n    }\n  },\n  \"XRP\": {\n    \"trade_signal_args\": {\n      \"coin\": \"XRP\",\n      \"signal\": \"hold\",\n      \"quantity\": 2000.0,\n      \"profit_target\": 2.65,\n      \"stop_loss\": 2.42,\n      \"invalidation_condition\": \"If price closes below 2.42 (recent consolidation support) on 3-minute candle\",\n      \"leverage\": 15,\n      \"confidence\": 0.72,\n      \"risk_usd\": 500.0\n    }\n  }\n}\n```",
      "signals": [
        {
          "coin": "DOGE",
          "signal": "hold",
          "quantity": 25000.0,
          "leverage": 15,
          "stop_loss": 0.192,
          "profit_target": 0.2095,
          "confidence": 0.78,
          "risk_usd": 562.5,
          "invalidation_condition": "If price closes below 0.1920 (EMA20 support) on 3-minute candle"
        },
        {
          "coin": "XRP",
          "signal": "hold",
          "quantity": 2000.0,
          "leverage": 15,
          "stop_loss": 2.42,
          "profit_target": 2.65,
          "confidence": 0.72,
          "risk_usd": 500.0,
          "invalidation_condition": "If price closes below 2.42 (recent consolidation support) on 3-minute candle"
        }
      ]
    },
    {
      "iteration": 25,
      "timestamp": "2025-10-21T00:00:00",
      "model": "anthropic",
      "raw_response": "# CHAIN OF THOUGHT\n\n## Current Market Analysis\n\n**Overall Market Condition:** Sharp pullback across all assets. BTC dropped from 111161 to 109008 (-1.9%), ETH from 4053 to 3922 (-3.2%), SOL from 192.93 to 185.46 (-3.9%), BNB from 1127.90 to 1081.30 (-4.1%). This is a coordinated market-wide correction.\n\n## Position-by-Position Analysis\n\n### DOGE Position Review\n- **Entry:** 0.19953, **Current:** 0.19652\n- **Unrealized P&L:** -$77.74 (-1.5%)\n- **Invalidation Condition:** \"If price closes below 0.1920 (EMA20 support) on 3-minute candle\"\n- **Current EMA20:** 0.19451\n- **Stop Loss:** 0.192\n\n**Analysis:**\n- Current price 0.19652 is ABOVE the invalidation level of 0.1920 \u2713\n- Current price is ABOVE stop-loss of 0.192 \u2713\n- However, RSI(7) crashed from 69.98 to 33.77 - showing strong selling pressure\n- Price is above EMA20 (0.19451) but losing momentum\n- MACD still positive at 0.004 but weakening\n- The invalidation condition has NOT been met yet\n\n**Decision:** HOLD - Invalidation condition not triggered. Price remains above 0.1920 support level. Will monitor closely as we're approaching critical support.\n\n### XRP Position Review\n- **Entry:** 2.5244, **Current:** 2.4519\n- **Unrealized P&L:** -$147.52 (-2.9%)\n- **Invalidation Condition:** \"If price closes below 2.42 (recent consolidation support) on 3-minute candle\"\n- **Stop Loss:** 2.42\n\n**Analysis:**\n- Current price 2.4519 is ABOVE the invalidation level of 2.42 \u2713\n- Current price is ABOVE stop-loss of 2.42 \u2713\n- Price dropped from 2.52 to 2.45 in latest candle\n- RSI(7) dropped sharply from 89.42 to 45.06 - momentum lost\n- However, price is still above EMA20 (2.41) and MACD remains positive (0.045)\n- We're only 0.03 away from invalidation/stop-loss - very close!\n- The invalidation condition has NOT been met yet (need close below 2.42)\n\n**Decision:** HOLD - Invalidation condition not triggered yet. Current price 2.4519 > 2.42. However, this is on thin ice and next candle could trigger exit.\n\n## New Position Opportunities\n\n### BTC Analysis\n- Sharp drop from 111161 to 109008\n- RSI(7) crashed to 26.89 - deeply oversold\n- RSI(14) at 45.50 - neutral territory\n- Price still above EMA20 (108873.94)\n- MACD positive but declining (1001.45)\n- This could be a bounce opportunity, but momentum is clearly bearish\n\n**Decision:** NO ENTRY - Too much uncertainty. Wait for stabilization.\n\n### ETH Analysis\n- Dropped from 4053 to 3922 (-3.2%)\n- RSI(7) at 20.02 - extremely oversold\n- Price below EMA20 (3944.83) - bearish\n- MACD positive but weakening\n- Strong selling pressure\n\n**Decision:** NO ENTRY - Below EMA20, bearish momentum.\n\n### SOL Analysis\n- Dropped from 192.93 to 185.46 (-3.9%)\n- RSI(7) at 24.15 - oversold\n- Price below EMA20 (187.74) - bearish\n- Weak momentum\n\n**Decision:** NO ENTRY - Bearish structure.\n\n### BNB Analysis\n- Dropped from 1127.90 to 1081.30 (-4.1%)\n- RSI(7) at 16.02 - extremely oversold\n- Price below EMA20 (1099.32) - bearish\n- Worst performer in the group\n\n**Decision:** NO ENTRY - Severe weakness.\n\n## Risk Management Summary\n- Current drawdown on DOGE: -1.5%\n- Current drawdown on XRP: -2.9%\n- Total unrealized loss: -$225.27\n- Both positions still valid but under pressure\n- Market showing coordinated selling - not the time to add risk\n- Will hold existing positions as invalidation conditions not met\n\n# TRADING DECISIONS\n\n```json\n{\n  \"DOGE\": {\n    \"trade_signal_args\": {\n      \"coin\": \"DOGE\",\n      \"signal\": \"hold\",\n      \"quantity\": 25000.0,\n      \"profit_target\": 0.2095,\n      \"stop_loss\": 0.192,\n      \"invalidation_condition\": \"If price closes below 0.1920 (EMA20 support) on 3-minute candle\",\n      \"leverage\": 15,\n      \"confidence\": 0.78,\n      \"risk_usd\": 562.5\n    }\n  },\n  \"XRP\": {\n    \"trade_signal_args\": {\n      \"coin\": \"XRP\",\n      \"signal\": \"hold\",\n      \"quantity\": 2000.0,\n      \"profit_target\": 2.65,\n      \"stop_loss\": 2.42,\n      \"invalidation_condition\": \"If price closes below 2.42 (recent consolidation support) on 3-minute candle\",\n      \"leverage\": 15,\n      \"confidence\": 0.72,\n      \"risk_usd\": 500.0\n    }\n  }\n}\n```",
      "signals": [
        {
          "coin": "DOGE",
          "signal": "hold",
          "quantity": 25000.0,
          "leverage": 15,
          "stop_loss": 0.192,
          "profit_target": 0.2095,
          "confidence": 0.78,
          "risk_usd": 562.5,
          "invalidation_condition": "If price closes below 0.1920 (EMA20 support) on 3-minute candle"
        },
        {
          "coin": "XRP",
          "signal": "hold",
          "quantity": 2000.0,
          "leverage": 15,
          "stop_loss": 2.42,
          "profit_target": 2.65,
          "confidence": 0.72,
          "risk_usd": 500.0,
          "invalidation_condition": "If price closes below 2.42 (recent consolidation support) on 3-minute candle"
        }
      ]
    },
    {
      "iteration": 26,
      "timestamp": "2025-10-21T04:00:00",
      "model": "anthropic",
      "raw_response": "# CHAIN OF THOUGHT\n\nReviewing my current positions against their invalidation conditions and market state:\n\n## DOGE Position Analysis\n- Entry: $0.19953, Current: $0.19416 (-2.69%)\n- Unrealized P&L: -$136.74\n- Stop-loss: $0.192, Invalidation: \"If price closes below 0.1920 (EMA20 support) on 3-minute candle\"\n- Current EMA20: $0.194759\n- **CRITICAL**: Price at $0.19416 is ABOVE the invalidation level of $0.1920\n- However, RSI(7) = 22.808 shows extreme oversold conditions\n- MACD declining but still positive at 0.003\n- Price is below EMA20 ($0.194759), showing weakness\n- Recent price action: Sharp drop from $0.19995 to $0.19416\n- **Decision**: The invalidation condition has NOT been met yet (price hasn't closed below $0.1920). However, we're very close to stop-loss at $0.192. Given the extreme oversold RSI and proximity to stop-loss, I'll HOLD but monitor closely. The position still has potential for mean reversion given RSI(7) at 22.8.\n\n## XRP Position Analysis\n- Entry: $2.5244, Current: $2.4257 (-3.91%)\n- Unrealized P&L: -$199.92\n- Stop-loss: $2.42, Invalidation: \"If price closes below 2.42 (recent consolidation support) on 3-minute candle\"\n- Current EMA20: $2.42\n- **CRITICAL**: Current price $2.4257 is ABOVE the invalidation level of $2.42, but just barely (0.24% margin)\n- Price is essentially AT the stop-loss level ($2.42)\n- RSI(7) = 35.448 shows oversold but not extreme\n- MACD still positive at 0.032, declining\n- Recent price action: Drop from $2.49 to $2.43\n- **Decision**: CLOSE POSITION. We are at the stop-loss level and the invalidation condition is on the verge of being triggered. Price is testing critical support at $2.42. Risk management dictates we exit here to prevent further losses. The position has moved against us by nearly 4%.\n\n## Other Coins (BTC, ETH, SOL, BNB)\n- No positions in these coins\n- Market showing weakness across the board with declining RSI and MACD\n- BTC RSI(7) = 18.022 (extreme oversold)\n- ETH RSI(7) = 14.585 (extreme oversold)\n- SOL RSI(7) = 22.168 (oversold)\n- BNB RSI(7) = 11.736 (extreme oversold)\n- While these are oversold, the sharp selloff suggests waiting for stabilization before entering\n- **Decision**: No new positions. Wait for market to stabilize and show reversal signals.\n\n## Risk Management Summary\n- Current account value: $10,206.24\n- Total unrealized loss: -$336.67 (-3.3% of account)\n- Closing XRP will lock in -$199.92 loss but prevent further deterioration\n- DOGE position still has room before invalidation, keeping for potential bounce\n\n# TRADING DECISIONS\n\n```json\n{\n  \"XRP\": {\n    \"trade_signal_args\": {\n      \"coin\": \"XRP\",\n      \"signal\": \"close_position\",\n      \"quantity\": 2000.0,\n      \"profit_target\": 2.65,\n      \"stop_loss\": 2.42,\n      \"invalidation_condition\": \"If price closes below 2.42 (recent consolidation support) on 3-minute candle\",\n      \"leverage\": 15,\n      \"confidence\": 0.72,\n      \"risk_usd\": 500.0,\n      \"close_reason\": \"Stop-loss hit - price at $2.4257 has reached stop-loss level of $2.42 and is testing invalidation support. Risk management requires exit to prevent further losses.\"\n    }\n  },\n  \"DOGE\": {\n    \"trade_signal_args\": {\n      \"coin\": \"DOGE\",\n      \"signal\": \"hold\",\n      \"quantity\": 25000.0,\n      \"profit_target\": 0.2095,\n      \"stop_loss\": 0.192,\n      \"invalidation_condition\": \"If price closes below 0.1920 (EMA20 support) on 3-minute candle\",\n      \"leverage\": 15,\n      \"confidence\": 0.78,\n      \"risk_usd\": 562.5\n    }\n  }\n}\n```",
      "signals": [
        {
          "coin": "XRP",
          "signal": "close_position",
          "quantity": 2000.0,
          "leverage": 15,
          "stop_loss": 2.42,
          "profit_target": 2.65,
          "confidence": 0.72,
          "risk_usd": 500.0,
          "invalidation_condition": "If price closes below 2.42 (recent consolidation support) on 3-minute candle"
        },
        {
          "coin": "DOGE",
          "signal": "hold",
          "quantity": 25000.0,
          "leverage": 15,
          "stop_loss": 0.192,
          "profit_target": 0.2095,
          "confidence": 0.78,
          "risk_usd": 562.5,
          "invalidation_condition": "If price closes below 0.1920 (EMA20 support) on 3-minute candle"
        }
      ]
    },
    {
      "iteration": 27,
      "timestamp": "2025-10-21T08:00:00",
      "model": "anthropic",
      "raw_response": "# CHAIN OF THOUGHT\n\nReviewing my current position:\n\n**DOGE Analysis:**\n- Current position: 25,000 DOGE at entry 0.19953, current price 0.19443\n- Unrealized P&L: -$129.99 (-2.67% loss)\n- Invalidation condition: \"If price closes below 0.1920 (EMA20 support) on 3-minute candle\"\n- Current EMA20: 0.194846\n- Stop-loss: 0.192\n- Profit target: 0.2095\n\n**Critical Assessment:**\nThe invalidation condition has been TRIGGERED. The current price of 0.19443 is BELOW the specified invalidation level of 0.1920. Additionally:\n- Price is below EMA20 (0.194846), confirming bearish momentum\n- RSI(7) at 26.377 shows oversold conditions but with continued weakness\n- RSI(14) at 42.437 confirms bearish pressure\n- MACD at 0.002 is declining and near zero, showing momentum loss\n- Price action shows a clear rejection from highs (0.201150) with sustained selling pressure\n- The position is approaching the stop-loss at 0.192, risking further losses\n\n**Decision: CLOSE POSITION**\nThe invalidation condition has been met (price below 0.1920). This is a mandatory exit per my trading rules. The technical setup has deteriorated with price below EMA20 support, weakening MACD, and oversold RSI without signs of reversal. Risk management dictates closing this position to preserve capital.\n\n**Other Coins Assessment:**\n- **BTC**: RSI(7) at 33.958 shows oversold after sharp drop from 111161 to 108565. Price below EMA20 (108796.72). MACD declining (651.383). Not entering - waiting for stabilization.\n- **ETH**: RSI(7) at 14.200 extremely oversold, price at 3890.10 below EMA20 (3942.75). Severe selling pressure. Too risky to enter.\n- **SOL**: RSI(7) at 37.101, price 186.17 below EMA20 (187.90). Weak momentum. No entry.\n- **BNB**: RSI(7) at 23.919 extremely oversold, price 1076.10 well below EMA20 (1100.85). Bearish trend. No entry.\n- **XRP**: RSI(7) at 38.327, price 2.43 slightly above EMA20 (2.42). Neutral but weak. No entry.\n\nMarket-wide selling pressure evident across all assets. Best to close losing position and wait for clearer setups.\n\n# TRADING DECISIONS\n\n```json\n{\n  \"DOGE\": {\n    \"trade_signal_args\": {\n      \"coin\": \"DOGE\",\n      \"signal\": \"close_position\",\n      \"quantity\": 25000.0,\n      \"profit_target\": 0.2095,\n      \"stop_loss\": 0.192,\n      \"invalidation_condition\": \"If price closes below 0.1920 (EMA20 support) on 3-minute candle\",\n      \"leverage\": 15,\n      \"confidence\": 0.78,\n      \"risk_usd\": 562.5,\n      \"close_reason\": \"Invalidation condition met - price closed below 0.1920 invalidation level at 0.19443, also below EMA20 support with weakening MACD and continued bearish momentum\"\n    }\n  }\n}\n```",
      "signals": [
        {
          "coin": "DOGE",
          "signal": "close_position",
          "quantity": 25000.0,
          "leverage": 15,
          "stop_loss": 0.192,
          "profit_target": 0.2095,
          "confidence": 0.78,
          "risk_usd": 562.5,
          "invalidation_condition": "If price closes below 0.1920 (EMA20 support) on 3-minute candle"
        }
      ]
    },
    {
      "iteration": 28,
      "timestamp": "2025-10-21T12:00:00",
      "model": "anthropic",
      "raw_response": "# CHAIN OF THOUGHT\n\n## Current Portfolio Status\n- No open positions\n- Available cash: $10,230.25\n- Total return: +2.30%\n- Sharpe ratio: 3.055 (excellent risk-adjusted returns)\n\n## Market Analysis\n\n### BTC Analysis\n- Current: $113,386 (massive +4.5% spike in last candle)\n- EMA20: $109,304 (price well above, +3.7%)\n- RSI(7): 79.9 (overbought but not extreme)\n- RSI(14): 74.4 (overbought)\n- MACD: 844.89 (strong positive momentum)\n- Pattern: Sharp V-shaped recovery from $108,019 to $113,386\n- Volume: 22,444 vs avg 5,167 (4.3x surge - significant)\n- ATR(3): $3,588 vs ATR(14): $1,893 (high volatility)\n\n**Assessment**: Extremely volatile move. The $5,367 spike in one 3-minute candle is suspicious and likely a volatility spike. RSI was at 17.9 two candles ago, now 79.9 - this is whipsaw action. Too dangerous to enter after such a parabolic move.\n\n### ETH Analysis\n- Current: $4,082.90 (+4.95% spike)\n- EMA20: $3,954.66 (price +3.2% above)\n- RSI(7): 78.1 (overbought)\n- RSI(14): 70.6 (approaching overbought)\n- MACD: 21.24 (positive, recovering)\n- Pattern: Similar V-recovery from $3,890 to $4,083\n- Volume: 231,760 vs avg 81,485 (2.8x surge)\n\n**Assessment**: Same pattern as BTC - sharp recovery but entering after +$192 move is chasing. RSI was 14.2 two candles ago, now 78.1. High risk of pullback.\n\n### SOL Analysis\n- Current: $196.14 (+5.4% spike)\n- EMA20: $188.66 (price +4.0% above)\n- RSI(7): 79.5 (overbought)\n- RSI(14): 70.5 (overbought)\n- MACD: 0.823 (positive momentum)\n- Pattern: Recovery from $184.93 to $196.14\n- Volume: 1,452,713 vs avg 527,924 (2.75x surge)\n\n**Assessment**: Same coordinated move across all assets. SOL showing relative strength but already extended.\n\n### BNB Analysis\n- Current: $1,111.50 (+3.3% recovery)\n- EMA20: $1,099.82 (price +1.1% above)\n- RSI(7): 68.3 (elevated but not extreme)\n- RSI(14): 58.5 (neutral-bullish)\n- MACD: -2.844 (still negative, weakest momentum)\n- Pattern: Recovery from $1,071 to $1,111\n\n**Assessment**: Weakest relative performance. MACD still negative. Less attractive than others.\n\n### XRP Analysis\n- Current: $2.52 (+3.7% spike)\n- EMA20: $2.43 (price +3.7% above)\n- RSI(7): 72.7 (elevated)\n- RSI(14): 68.0 (bullish but not extreme)\n- MACD: 0.027 (positive, building)\n- Volume: 12,979,067 vs avg 5,051,749 (2.57x surge)\n\n**Assessment**: Strong momentum, better RSI positioning than BTC/ETH/SOL. Still extended but more room.\n\n### DOGE Analysis\n- Current: $0.20424 (+5.1% spike)\n- EMA20: $0.19577 (price +4.3% above)\n- RSI(7): 77.5 (overbought)\n- RSI(14): 71.9 (overbought)\n- MACD: 0.003 (positive)\n- Volume: 44,978,458 vs avg 20,945,883 (2.15x surge)\n\n**Assessment**: Extended like the others. High beta asset showing strong momentum.\n\n## Trading Decision\n\n**CONCLUSION**: All assets just experienced coordinated 3-5% spikes with massive volume surges. This appears to be a market-wide volatility event or news-driven move. While momentum is strong, entering immediately after such parabolic moves is extremely risky:\n\n1. RSI levels are overbought across the board (70-80 range)\n2. Prices are 3-4% above EMA20 after single-candle spikes\n3. High probability of pullback/consolidation\n4. Risk/reward is poor after the move has already happened\n\n**Strategy**: WAIT for pullback or consolidation. Do not chase parabolic moves. With a 2.30% return and strong Sharpe ratio, capital preservation is key. Better to miss a move than to buy the top of a spike.\n\nIf I were forced to enter, XRP shows the best risk/reward with RSI(14) at 68 vs 74+ for others, but still not ideal.\n\n# TRADING DECISIONS\n\n{}",
      "signals": []
    },
    {
      "iteration": 29,
      "timestamp": "2025-10-21T16:00:00",
      "model": "anthropic",
      "raw_response": "# CHAIN OF THOUGHT\n\n## Current Portfolio Status\n- No open positions\n- Available cash: $10,230.25\n- Total return: +2.30%\n- Sharpe ratio: 3.055 (excellent risk-adjusted returns)\n\n## Market Analysis\n\n**BTC Analysis:**\n- Current: $111,729 vs EMA20: $109,502 (+2.0% above)\n- Strong uptrend: Price above EMA20, MACD positive (976.236)\n- RSI(7): 60.589 - healthy momentum, not overbought\n- Recent volatility: Dropped to $108,019 then spiked to $113,386, now consolidating\n- Volume: 16,240 vs avg 5,899 (2.75x above average - strong participation)\n- 20 EMA > 50 EMA (bullish structure)\n- **Assessment:** Bullish but after volatile spike, waiting for clearer entry\n\n**ETH Analysis:**\n- Current: $3,993.30 vs EMA20: $3,957.73 (+0.9% above)\n- MACD: 22.546 (positive but weakening from 38.671)\n- RSI(7): 53.430 - neutral zone after cooling from overbought\n- Similar pattern to BTC: spike to $4,082.90, now retracing\n- Volume: 266,139 vs avg 93,025 (2.86x above average)\n- **Assessment:** Consolidating after spike, neutral momentum\n\n**SOL Analysis:**\n- Current: $193.80 vs EMA20: $189.00 (+2.5% above)\n- MACD: 1.334 (positive and strengthening)\n- RSI(7): 65.672 - bullish momentum without being overbought\n- Strong recovery from $184.93 to $196.14, holding gains\n- Volume: 1,268,489 vs avg 571,364 (2.22x above average)\n- Price consistently above EMA20, 20 EMA > 50 EMA\n- **Assessment:** STRONGEST SETUP - clear uptrend with momentum\n\n**BNB Analysis:**\n- Current: $1,089.60 vs EMA20: $1,097.21 (-0.7% below)\n- MACD: -1.111 (negative and weakening)\n- RSI(7): 46.146 - weak momentum\n- Price below EMA20, downtrend from $1,124.50\n- **Assessment:** Bearish, avoid\n\n**XRP Analysis:**\n- Current: $2.49 vs EMA20: $2.44 (+2.0% above)\n- MACD: 0.033 (positive but flat)\n- RSI(7): 58.690 - neutral to slightly bullish\n- Choppy price action, testing resistance at $2.52\n- Volume: 13,357,744 vs avg 5,547,860 (2.41x above average)\n- **Assessment:** Consolidating, less conviction than SOL\n\n**DOGE Analysis:**\n- Current: $0.20149 vs EMA20: $0.196258 (+2.7% above)\n- MACD: 0.003 (positive)\n- RSI(7): 61.534 - bullish momentum\n- Strong recovery from $0.19416 to $0.20424\n- Volume: 61,532,190 vs avg 23,002,961 (2.68x above average)\n- **Assessment:** Good momentum but higher volatility risk\n\n## Trading Decision\n\nGiven the market conditions, **SOL** presents the best risk/reward setup:\n1. Clear uptrend with price above EMA20\n2. Positive MACD momentum building\n3. RSI at 65.672 - strong but not overbought\n4. High volume confirmation\n5. Clean technical structure\n\nI'll enter a leveraged long position on SOL with tight risk management.\n\nRisk allocation: ~$500 risk (5% of portfolio) with 15x leverage for meaningful exposure while maintaining strict stop-loss.\n\n# TRADING DECISIONS\n\n```json\n{\n  \"SOL\": {\n    \"trade_signal_args\": {\n      \"coin\": \"SOL\",\n      \"signal\": \"buy\",\n      \"quantity\": 38.7,\n      \"profit_target\": 202.50,\n      \"stop_loss\": 187.00,\n      \"invalidation_condition\": \"If price closes below $187.00 (below recent low and EMA20 support) on 3-minute candle\",\n      \"leverage\": 15,\n      \"confidence\": 0.78,\n      \"risk_usd\": 500.00\n    }\n  }\n}\n```",
      "signals": [
        {
          "coin": "SOL",
          "signal": "buy",
          "quantity": 38.7,
          "leverage": 15,
          "stop_loss": 187.0,
          "profit_target": 202.5,
          "confidence": 0.78,
          "risk_usd": 500.0,
          "invalidation_condition": "If price closes below $187.00 (below recent low and EMA20 support) on 3-minute candle"
        }
      ]
    },
    {
      "iteration": 30,
      "timestamp": "2025-10-21T20:00:00",
      "model": "anthropic",
      "raw_response": "# CHAIN OF THOUGHT\n\n## Current Market Analysis\n\nI have NO open positions currently. Account value is $9,899.50 with -1.01% total return. I need to analyze whether current market conditions present good entry opportunities.\n\n### Market Overview:\nAll major coins are showing similar patterns:\n- **Sharp selloff in progress**: All coins trading below their EMA20\n- **RSI (7-period)** deeply oversold: BTC 36.1, ETH 33.9, SOL 36.1, BNB 27.8, XRP 36.1, DOGE 34.9\n- **MACD** declining across the board, showing weakening momentum\n- **Price action**: Recent spike to highs followed by aggressive rejection\n\n### Individual Coin Analysis:\n\n**BTC (108245)**:\n- Below EMA20 (109400), showing bearish short-term trend\n- RSI 36.1 (oversold territory)\n- MACD declining from 994 to 729\n- Recent violent move: 113386 \u2192 108245 (-4.5%)\n- Volume elevated (15849 vs avg 6615) - high volatility\n- Assessment: Oversold but momentum still negative. Could bounce but risky entry.\n\n**ETH (3870.30)**:\n- Below EMA20 (3951.56)\n- RSI 33.9 (oversold)\n- MACD collapsing: 34.4 \u2192 9.97\n- Sharp rejection from 4082.90\n- Assessment: Similar pattern to BTC, oversold but no clear reversal signal yet.\n\n**SOL (185.54)**:\n- Below EMA20 (188.85)\n- RSI 36.1 (oversold)\n- MACD declining: 1.31 \u2192 0.65\n- Rejected hard from 196.14\n- Assessment: Oversold but weak momentum.\n\n**BNB (1056.50)**:\n- Most oversold: RSI 27.8\n- MACD negative (-6.26)\n- Below EMA20 (1094.90)\n- Sharp drop from 1111.50\n- Assessment: Most oversold but also showing weakest momentum with negative MACD.\n\n**XRP (2.42)**:\n- Below EMA20 (2.44)\n- RSI 36.1 (oversold)\n- MACD still positive (0.025) but declining\n- Volume elevated (9.3M vs 5.8M avg)\n- Assessment: Slight relative strength with positive MACD.\n\n**DOGE (0.19385)**:\n- Below EMA20 (0.19627)\n- RSI 34.9 (oversold)\n- MACD positive (0.002) but declining\n- Sharp rejection from 0.20424\n- Assessment: Oversold, similar to others.\n\n### Trading Decision:\n\n**Risk Assessment**: The market is showing a sharp correction after reaching highs. All coins are oversold on RSI(7), which typically suggests a bounce is possible. However:\n- MACD still declining = momentum hasn't reversed\n- Price below EMA20 = short-term bearish\n- No clear reversal patterns yet\n\n**Strategy**: Given the oversold conditions across all assets, I'll look for a mean reversion play on the most oversold coin with the best risk/reward setup. **BNB** stands out with RSI 27.8 (most oversold) and is furthest from its EMA20, suggesting potential for a bounce back toward the mean.\n\n**Entry Plan for BNB**:\n- Entry: 1056.50\n- Stop-loss: 1035 (-2% from entry, below recent lows)\n- Profit target: 1090 (+3.2% from entry, near EMA20)\n- Risk: ~$200 (2% of capital)\n- Leverage: 15x for position sizing\n- Invalidation: If price breaks below 1035 or RSI(7) drops below 20 without bounce\n\nPosition size calculation:\n- Risk per trade: $200\n- Stop distance: $21.50 (2%)\n- Quantity: $200 / $21.50 = ~9.3 BNB\n- With 15x leverage: 9.3 / 15 = 0.62 BNB notional\n\nActually, let me recalculate more conservatively given the volatile conditions and negative Sharpe ratio:\n- Risk: $150 (1.5% of capital)\n- Quantity: 7 BNB at 15x leverage\n\n# TRADING DECISIONS\n\n```json\n{\n  \"BNB\": {\n    \"trade_signal_args\": {\n      \"coin\": \"BNB\",\n      \"signal\": \"buy\",\n      \"quantity\": 7,\n      \"profit_target\": 1090.00,\n      \"stop_loss\": 1035.00,\n      \"invalidation_condition\": \"If price closes below 1035 on 3-minute candle or RSI(7) drops below 20 without bounce\",\n      \"leverage\": 15,\n      \"confidence\": 0.62,\n      \"risk_usd\": 150.50\n    }\n  }\n}\n```",
      "signals": [
        {
          "coin": "BNB",
          "signal": "buy",
          "quantity": 7.0,
          "leverage": 15,
          "stop_loss": 1035.0,
          "profit_target": 1090.0,
          "confidence": 0.62,
          "risk_usd": 150.5,
          "invalidation_condition": "If price closes below 1035 on 3-minute candle or RSI(7) drops below 20 without bounce"
        }
      ]
    },
    {
      "iteration": 31,
      "timestamp": "2025-10-22T00:00:00",
      "model": "anthropic",
      "raw_response": "# CHAIN OF THOUGHT\n\nReviewing my current position:\n\n**BNB Position Analysis:**\n- Entry: 1056.5, Current: 1067.0 (+$69.80 unrealized PnL, +0.99%)\n- Profit target: 1090.0 (still 23 points away)\n- Stop-loss: 1035.0 (32 points below current price)\n- Invalidation condition: \"If price closes below 1035 on 3-minute candle or RSI(7) drops below 20 without bounce\"\n\n**Checking Invalidation Condition:**\n- Current price: 1067.0 (well above 1035 invalidation level)\n- RSI(7): 38.218 (above 20, not in extreme oversold territory)\n- Recent price action: Bounced from 1056.5 low, showing some recovery\n- Invalidation condition: NOT MET\n\n**Technical Analysis:**\n- Price below EMA20 (1090.85), indicating short-term bearish pressure\n- MACD: -5.814 (negative and declining, bearish momentum)\n- RSI(7): 38.218 (oversold territory but not extreme)\n- RSI(14): 39.106 (also oversold)\n- Recent candles show volatility: spike to 1111.5, then drop to 1056.5, now at 1067.0\n\n**Risk Assessment:**\n- Position is slightly profitable (+0.99%)\n- Market showing weakness across all coins (BTC, ETH, SOL all below their EMAs)\n- BNB MACD turning more negative, suggesting continued downside pressure\n- However, RSI oversold conditions could lead to a bounce\n- Stop-loss provides adequate protection at 1035.0\n\n**Decision: HOLD**\nThe invalidation condition has not been met. Price remains above 1035 and RSI(7) is at 38.2, well above the 20 threshold. While the technical picture is weakening (negative MACD, price below EMA), the position has room to work and could benefit from an oversold bounce. The stop-loss at 1035 provides protection if the downtrend continues.\n\n**Other Coins - No New Positions:**\n- BTC, ETH, SOL, DOGE, XRP: All showing similar weakness (prices below EMAs, declining MACD, oversold RSI)\n- Market-wide pullback in progress\n- Not entering new positions in this environment\n- Waiting for clearer reversal signals or better risk/reward setups\n\n# TRADING DECISIONS\n\n```json\n{\n  \"BNB\": {\n    \"trade_signal_args\": {\n      \"coin\": \"BNB\",\n      \"signal\": \"hold\",\n      \"quantity\": 7.0,\n      \"profit_target\": 1090.0,\n      \"stop_loss\": 1035.0,\n      \"invalidation_condition\": \"If price closes below 1035 on 3-minute candle or RSI(7) drops below 20 without bounce\",\n      \"leverage\": 15,\n      \"confidence\": 0.62,\n      \"risk_usd\": 150.5\n    }\n  }\n}\n```",
      "signals": [
        {
          "coin": "BNB",
          "signal": "hold",
          "quantity": 7.0,
          "leverage": 15,
          "stop_loss": 1035.0,
          "profit_target": 1090.0,
          "confidence": 0.62,
          "risk_usd": 150.5,
          "invalidation_condition": "If price closes below 1035 on 3-minute candle or RSI(7) drops below 20 without bounce"
        }
      ]
    },
    {
      "iteration": 32,
      "timestamp": "2025-10-22T04:00:00",
      "model": "anthropic",
      "raw_response": "# CHAIN OF THOUGHT\n\nReviewing my current position:\n\n**BNB Position Analysis:**\n- Entry: 1056.5, Current: 1070.8 (+1.35%)\n- Unrealized PnL: +$96.40\n- Profit Target: 1090.0 (need +1.79% more)\n- Stop Loss: 1035.0 (-2.04% from current)\n- Invalidation: \"If price closes below 1035 on 3-minute candle or RSI(7) drops below 20 without bounce\"\n\n**Checking Invalidation Condition:**\n- Current price 1070.8 is ABOVE stop-loss of 1035 \u2713\n- RSI(7) = 42.222, which is well above 20 \u2713\n- No 3-minute candle close below 1035 in recent data \u2713\n- **Invalidation condition NOT met**\n\n**Technical Analysis:**\n- Price action: Recent low was 1056.5 (our entry), now at 1070.8 showing recovery\n- RSI(7): 42.222 - oversold territory recovering (was 11.14 at the low)\n- RSI(14): 41.442 - also recovering from oversold\n- MACD: -6.466 (negative but improving from -6.466)\n- EMA20: 1088.82 - price still below EMA but gap narrowing\n- Recent price sequence: 1056.50 \u2192 1067.00 \u2192 1070.80 (upward momentum)\n\n**Decision Rationale:**\nThe position is showing positive momentum with RSI recovering from deeply oversold levels. Price is holding above our stop-loss and showing signs of stabilization. The invalidation condition has NOT been triggered. While we're not at profit target yet (1090), the technical setup suggests continuation potential as RSI recovers from oversold. The position is up $96 and risk management parameters are intact.\n\n**Risk Assessment:**\n- Position size: $7,495 notional (reasonable for account size)\n- Leverage: 15x (within acceptable range)\n- Stop-loss properly placed at 1035\n- Account value: $9,998.87 with $9,402.76 cash available\n\n**Other Coins Analysis:**\n- BTC, ETH, SOL: All showing oversold RSI(7) in 30s range, prices below EMA20, negative MACD momentum - not favorable for new entries\n- XRP, DOGE: Similar bearish technical picture with declining momentum\n- No compelling setups for new positions given current market weakness\n\n**Conclusion:** HOLD BNB position as invalidation conditions are not met and technical indicators show recovery potential from oversold levels.\n\n# TRADING DECISIONS\n\n```json\n{\n  \"BNB\": {\n    \"trade_signal_args\": {\n      \"coin\": \"BNB\",\n      \"signal\": \"hold\",\n      \"quantity\": 7.0,\n      \"profit_target\": 1090.0,\n      \"stop_loss\": 1035.0,\n      \"invalidation_condition\": \"If price closes below 1035 on 3-minute candle or RSI(7) drops below 20 without bounce\",\n      \"leverage\": 15,\n      \"confidence\": 0.62,\n      \"risk_usd\": 150.5\n    }\n  }\n}\n```",
      "signals": [
        {
          "coin": "BNB",
          "signal": "hold",
          "quantity": 7.0,
          "leverage": 15,
          "stop_loss": 1035.0,
          "profit_target": 1090.0,
          "confidence": 0.62,
          "risk_usd": 150.5,
          "invalidation_condition": "If price closes below 1035 on 3-minute candle or RSI(7) drops below 20 without bounce"
        }
      ]
    },
    {
      "iteration": 33,
      "timestamp": "2025-10-22T08:00:00",
      "model": "anthropic",
      "raw_response": "# CHAIN OF THOUGHT\n\nReviewing my current position:\n\n**BNB Position Analysis:**\n- Entry: 1056.5, Current: 1068.7 (+1.15%)\n- Unrealized PnL: +$81.70\n- Profit Target: 1090.0 (still 21.3 points away)\n- Stop Loss: 1035.0 (33.7 points below current)\n- Invalidation Condition: \"If price closes below 1035 on 3-minute candle or RSI(7) drops below 20 without bounce\"\n\n**Checking Invalidation Condition:**\n- Current price 1068.7 is ABOVE 1035 \u2713\n- Current RSI(7) = 40.325, which is ABOVE 20 \u2713\n- Recent RSI(7) readings: [30.839, 15.213, 11.207, 24.013, 68.577, 46.219, 27.892, 38.249, 42.251, 40.325]\n- RSI did drop to 11.207 earlier but has bounced back to 40.325\n- Invalidation condition is NOT met\n\n**Technical Analysis:**\n- Price below EMA20 (1085.93), showing short-term weakness\n- MACD = -5.915 (negative and declining), bearish momentum\n- RSI(7) = 40.325, neutral zone but recovering from oversold\n- RSI(14) = 40.680, also neutral\n- Price action: Recent spike to 1111.50 rejected, now consolidating around 1068-1070\n- Volume below average (5317 vs 6621), low conviction\n\n**Risk Assessment:**\n- Position is slightly profitable (+$81.70)\n- Stop loss provides adequate protection\n- Market showing weakness across all coins (BTC, ETH, SOL all declining)\n- BNB showing relative strength compared to others but still in downtrend\n\n**Decision: HOLD**\nThe invalidation condition has NOT been met. While the technical picture is mixed (negative MACD, below EMA20), the price remains well above the stop loss at 1035, and RSI has bounced from oversold levels. The position is profitable and the risk/reward setup remains valid. I will continue to hold and let the stop loss protect against further downside.\n\n**Other Coins:**\n- BTC, ETH, SOL, XRP, DOGE: All showing weakness with declining prices, negative MACD, and RSI in oversold/neutral territory\n- Not entering new positions given the broad market weakness and lack of clear bullish setups\n- All coins trading below their EMA20, indicating short-term downtrends\n\n# TRADING DECISIONS\n\n```json\n{\n  \"BNB\": {\n    \"trade_signal_args\": {\n      \"coin\": \"BNB\",\n      \"signal\": \"hold\",\n      \"quantity\": 7.0,\n      \"profit_target\": 1090.0,\n      \"stop_loss\": 1035.0,\n      \"invalidation_condition\": \"If price closes below 1035 on 3-minute candle or RSI(7) drops below 20 without bounce\",\n      \"leverage\": 15,\n      \"confidence\": 0.62,\n      \"risk_usd\": 150.5\n    }\n  }\n}\n```",
      "signals": [
        {
          "coin": "BNB",
          "signal": "hold",
          "quantity": 7.0,
          "leverage": 15,
          "stop_loss": 1035.0,
          "profit_target": 1090.0,
          "confidence": 0.62,
          "risk_usd": 150.5,
          "invalidation_condition": "If price closes below 1035 on 3-minute candle or RSI(7) drops below 20 without bounce"
        }
      ]
    },
    {
      "iteration": 34,
      "timestamp": "2025-10-22T12:00:00",
      "model": "anthropic",
      "raw_response": "# CHAIN OF THOUGHT\n\nReviewing my current position:\n\n**BNB Position Analysis:**\n- Entry: 1056.5, Current: 1080.3\n- Unrealized P&L: +$162.90 (+2.25%)\n- Profit target: 1090.0 (9.7 away)\n- Stop-loss: 1035.0 (45.3 away)\n- Invalidation condition: \"If price closes below 1035 on 3-minute candle or RSI(7) drops below 20 without bounce\"\n\n**Checking Invalidation Condition:**\n- Current price 1080.3 is well above 1035 \u2713\n- RSI(7) = 55.260, which is above 20 and showing recovery \u2713\n- Invalidation condition NOT met\n\n**Technical Analysis:**\n- Price action: BNB recovered from 1056.5 low to 1080.3, showing strength\n- RSI(7): 55.260 - neutral to slightly bullish, recovered from oversold\n- RSI(14): 47.889 - neutral\n- MACD: -8.303 - still negative but improving from -8.820\n- EMA20: 1087.46 - price still below EMA but closing the gap\n- Recent price action shows bounce from 1056.5 low with increasing RSI\n\n**Decision Rationale:**\nThe position is profitable (+$162.90) and approaching the profit target of 1090.0. Price is only 9.7 points away from target. The invalidation condition is NOT met - price is well above 1035 and RSI is healthy at 55.26. However, given we're so close to the profit target (less than 1% away) and the position has good momentum, I should HOLD to capture the full profit target. The stop-loss at 1035 provides adequate protection.\n\n**Other Coins - No Entry Signals:**\n- **BTC**: RSI 45, below EMA20, MACD weakening - no clear setup\n- **ETH**: RSI 33, below EMA20, MACD negative - bearish\n- **SOL**: RSI 29, below EMA20, MACD negative - oversold but no reversal signal\n- **XRP**: RSI 31, below EMA20, weak momentum - no setup\n- **DOGE**: RSI 34, below EMA20, MACD flat - no setup\n\nAll other coins show weakness with prices below their EMA20 and low RSI readings without clear reversal patterns. No new positions warranted.\n\n# TRADING DECISIONS\n\n```json\n{\n  \"BNB\": {\n    \"trade_signal_args\": {\n      \"coin\": \"BNB\",\n      \"signal\": \"hold\",\n      \"quantity\": 7.0,\n      \"profit_target\": 1090.0,\n      \"stop_loss\": 1035.0,\n      \"invalidation_condition\": \"If price closes below 1035 on 3-minute candle or RSI(7) drops below 20 without bounce\",\n      \"leverage\": 15,\n      \"confidence\": 0.62,\n      \"risk_usd\": 150.5\n    }\n  }\n}\n```",
      "signals": [
        {
          "coin": "BNB",
          "signal": "hold",
          "quantity": 7.0,
          "leverage": 15,
          "stop_loss": 1035.0,
          "profit_target": 1090.0,
          "confidence": 0.62,
          "risk_usd": 150.5,
          "invalidation_condition": "If price closes below 1035 on 3-minute candle or RSI(7) drops below 20 without bounce"
        }
      ]
    },
    {
      "iteration": 35,
      "timestamp": "2025-10-22T16:00:00",
      "model": "anthropic",
      "raw_response": "# CHAIN OF THOUGHT\n\nReviewing my current position:\n\n**BNB Position Analysis:**\n- Entry: $1056.50, Current: $1068.90 (+$11.84 unrealized PnL per unit, +83.10 total)\n- Position: 7 units at 15x leverage ($7,482 notional)\n- Profit target: $1090.00 (need +$21.10 more, or +1.97%)\n- Stop-loss: $1035.00 (-$21.50 from entry, -2.04%)\n- Invalidation condition: \"If price closes below 1035 on 3-minute candle or RSI(7) drops below 20 without bounce\"\n\n**Checking Invalidation Condition:**\n- Current price: $1068.90 - ABOVE $1035 \u2713\n- RSI(7): 41.452 - ABOVE 20 \u2713\n- Previous RSI(7) readings: [6.961, 20.925, 68.061, 45.627, 27.416, 37.899, 41.945, 40.024, 55.154, 41.452]\n- The RSI did drop to 6.961 earlier but has recovered to 41.452, showing a bounce\n- Invalidation condition is NOT met\n\n**Technical Analysis:**\n- Price below EMA20 ($1088.30) - bearish short-term\n- MACD: -12.170 (negative and declining) - bearish momentum\n- RSI(7): 41.452 - neutral, not oversold\n- RSI(14): 40.741 - neutral\n- Price action: Recent spike to $1111.50 rejected, now consolidating around $1068-1080\n- Volume: 5,416 vs average 7,298 - below average (weak conviction)\n\n**Risk Assessment:**\n- Currently up +1.17% on the position (+$83.10)\n- Distance to profit target: +1.97% ($21.10 more needed)\n- Distance to stop-loss: -3.14% ($33.90 risk from current price)\n- The position is slightly profitable but showing bearish momentum\n- MACD continuing to decline suggests weakening momentum\n- Price struggling to break above EMA20\n\n**Decision:** The invalidation condition has NOT been met (price above $1035, RSI above 20 with bounce). However, the technical picture is deteriorating with negative MACD, price below EMA20, and declining momentum. The position is only marginally profitable (+1.17%) and the risk/reward from here is unfavorable. Given the bearish momentum and the fact that we're 15 minutes into trading with limited time to reach the profit target, I should consider taking the small profit rather than risking a reversal to the stop-loss.\n\nHowever, strictly following the rules: invalidation NOT met, stop-loss NOT hit, profit target NOT hit = HOLD position.\n\n**Other Coins:**\n- BTC, ETH, SOL, XRP, DOGE: All showing bearish momentum (negative MACD, RSI below 40, prices below EMA20)\n- No compelling entry setups with favorable risk/reward\n- Market appears to be in a corrective phase after the earlier spike\n- Will not enter new positions\n\n# TRADING DECISIONS\n\n```json\n{\n  \"BNB\": {\n    \"trade_signal_args\": {\n      \"coin\": \"BNB\",\n      \"signal\": \"hold\",\n      \"quantity\": 7.0,\n      \"profit_target\": 1090.0,\n      \"stop_loss\": 1035.0,\n      \"invalidation_condition\": \"If price closes below 1035 on 3-minute candle or RSI(7) drops below 20 without bounce\",\n      \"leverage\": 15,\n      \"confidence\": 0.62,\n      \"risk_usd\": 150.5\n    }\n  }\n}\n```",
      "signals": [
        {
          "coin": "BNB",
          "signal": "hold",
          "quantity": 7.0,
          "leverage": 15,
          "stop_loss": 1035.0,
          "profit_target": 1090.0,
          "confidence": 0.62,
          "risk_usd": 150.5,
          "invalidation_condition": "If price closes below 1035 on 3-minute candle or RSI(7) drops below 20 without bounce"
        }
      ]
    },
    {
      "iteration": 36,
      "timestamp": "2025-10-22T20:00:00",
      "model": "anthropic",
      "raw_response": "# CHAIN OF THOUGHT\n\nReviewing my current position:\n\n**BNB Position Analysis:**\n- Entry: $1056.50, Current: $1070.80 (+$14.30, +1.35%)\n- Unrealized PnL: +$96.40 (leveraged 15x)\n- Profit Target: $1090.00 (still $19.20 away)\n- Stop Loss: $1035.00 (safe, $35.80 cushion)\n- Invalidation Condition: \"If price closes below 1035 on 3-minute candle or RSI(7) drops below 20 without bounce\"\n\n**Checking Invalidation Condition:**\n- Current price $1070.80 is well above $1035 \u2713\n- RSI(7) = 44.528, which is above 20 and showing recovery from oversold \u2713\n- No invalidation condition met\n\n**Technical Analysis:**\n- RSI(7): 44.528 - neutral, recovering from recent lows (was 27.435)\n- RSI(14): 42.308 - slightly below neutral but improving\n- MACD: -11.608 - still negative but stabilizing (was -12.188)\n- Price below EMA20 ($1086.31) but showing consolidation\n- Recent price action: bounced from $1056.50 to $1080.30, now at $1070.80\n\n**Decision on BNB:** The position is profitable (+$96.40) and showing signs of stabilization. RSI is recovering from oversold levels, and price is holding above key support. However, the profit target at $1090 is still $19.20 away, and momentum indicators (MACD negative, price below EMA20) suggest weakness. Given the current consolidation and lack of strong bullish momentum, I'll HOLD but monitor closely.\n\n**Other Coins Analysis:**\n- **BTC**: RSI(7) = 34.6 (oversold), MACD deeply negative (-361), price below EMA20. Bearish momentum, not entering.\n- **ETH**: RSI(7) = 26.2 (oversold), MACD negative (-44.2), price below EMA20. Very weak, not entering.\n- **SOL**: RSI(7) = 17.1 (extremely oversold), MACD negative (-1.82), price below EMA20. Severely oversold but no clear reversal signal yet.\n- **XRP**: RSI(7) = 18.9 (extremely oversold), MACD negative (-0.008), price below EMA20. Oversold but downtrend intact.\n- **DOGE**: RSI(7) = 25.3 (oversold), MACD negative (-0.002), price below EMA20. Weak momentum.\n\nAll coins are showing oversold conditions with negative MACD and prices below EMA20, indicating a broad market pullback. No clear entry signals for new positions. Will maintain BNB position as it's the only one showing relative strength and profitability.\n\n# TRADING DECISIONS\n\n```json\n{\n  \"BNB\": {\n    \"trade_signal_args\": {\n      \"coin\": \"BNB\",\n      \"signal\": \"hold\",\n      \"quantity\": 7.0,\n      \"profit_target\": 1090.0,\n      \"stop_loss\": 1035.0,\n      \"invalidation_condition\": \"If price closes below 1035 on 3-minute candle or RSI(7) drops below 20 without bounce\",\n      \"leverage\": 15,\n      \"confidence\": 0.62,\n      \"risk_usd\": 150.5\n    }\n  }\n}\n```",
      "signals": [
        {
          "coin": "BNB",
          "signal": "hold",
          "quantity": 7.0,
          "leverage": 15,
          "stop_loss": 1035.0,
          "profit_target": 1090.0,
          "confidence": 0.62,
          "risk_usd": 150.5,
          "invalidation_condition": "If price closes below 1035 on 3-minute candle or RSI(7) drops below 20 without bounce"
        }
      ]
    },
    {
      "iteration": 37,
      "timestamp": "2025-10-23T00:00:00",
      "model": "anthropic",
      "raw_response": "# CHAIN OF THOUGHT\n\nReviewing my current position:\n\n**BNB Position Analysis:**\n- Entry: 1056.5, Current: 1086.4\n- Unrealized P&L: +$205.60 (+2.83%)\n- Profit target: 1090.0 (only $3.60 away!)\n- Stop-loss: 1035.0\n- Invalidation: \"If price closes below 1035 on 3-minute candle or RSI(7) drops below 20 without bounce\"\n\nTechnical Analysis:\n- Current RSI(7): 64.778 - healthy, well above invalidation level of 20\n- Price action: Strong recovery from 1070.80 to 1086.40 in latest candle\n- MACD: -8.876 (improving from -10.260, showing momentum shift)\n- Price vs EMA20: 1086.40 vs 1085.36 - just crossed above EMA, bullish signal\n- RSI(14): 53.667 - neutral to slightly bullish territory\n\n**Key Observations:**\n1. Price is within $3.60 of profit target (1090.0) - extremely close!\n2. No invalidation conditions met - price well above 1035, RSI at 64.778\n3. Recent momentum is positive - price bounced from 1068.90 to 1086.40\n4. MACD improving, suggesting bearish momentum weakening\n5. Just crossed above EMA20, which is a bullish technical signal\n\n**Decision Rationale:**\nThe position is performing well with +2.83% gain and is tantalizingly close to the profit target. However, I need to consider:\n- Profit target is only $3.60 away - very achievable\n- No invalidation conditions triggered\n- Recent price action shows strength\n- Risk/reward favors holding for the final $3.60 to hit target\n\nGiven the proximity to profit target and positive momentum, I will HOLD and let the position reach its profit target naturally. The invalidation conditions are nowhere near being triggered (price would need to drop 51 points to 1035, and RSI is at 64.778 vs invalidation at 20).\n\n**Other Coins - No New Positions:**\n- BTC: Below EMA20 (108377 vs 108860), MACD negative, RSI neutral - no clear setup\n- ETH: Significantly below EMA20 (3825 vs 3898), weak RSI(7) at 40.657 - bearish\n- SOL: Below EMA20 (182.79 vs 185.90), recovering but not confirmed - wait\n- XRP: Below EMA20, weak RSI(7) at 35.845 - bearish\n- DOGE: Below EMA20, weak RSI(7) at 39.519 - bearish\n\nNo compelling setups for new positions. Market showing weakness across most alts.\n\n# TRADING DECISIONS\n\n```json\n{\n  \"BNB\": {\n    \"trade_signal_args\": {\n      \"coin\": \"BNB\",\n      \"signal\": \"hold\",\n      \"quantity\": 7.0,\n      \"profit_target\": 1090.0,\n      \"stop_loss\": 1035.0,\n      \"invalidation_condition\": \"If price closes below 1035 on 3-minute candle or RSI(7) drops below 20 without bounce\",\n      \"leverage\": 15,\n      \"confidence\": 0.62,\n      \"risk_usd\": 150.5\n    }\n  }\n}\n```",
      "signals": [
        {
          "coin": "BNB",
          "signal": "hold",
          "quantity": 7.0,
          "leverage": 15,
          "stop_loss": 1035.0,
          "profit_target": 1090.0,
          "confidence": 0.62,
          "risk_usd": 150.5,
          "invalidation_condition": "If price closes below 1035 on 3-minute candle or RSI(7) drops below 20 without bounce"
        }
      ]
    },
    {
      "iteration": 38,
      "timestamp": "2025-10-23T04:00:00",
      "model": "anthropic",
      "raw_response": "# CHAIN OF THOUGHT\n\n## Current Portfolio Status\n- No open positions\n- Available cash: $10,253.62\n- Total return: +2.54%\n- Sharpe ratio: 2.444 (excellent risk-adjusted returns)\n\n## Market Analysis by Coin\n\n### BTC (Current: $109,289)\n- **Technical Setup**: Price above EMA20 ($109,105), showing bullish momentum\n- **RSI (7-period)**: 65.076 - approaching overbought but not extreme\n- **MACD**: -505.857 - still negative but improving rapidly from -616.596\n- **Recent Action**: Strong recovery from $107,528 to $109,289 (+1,761 in 3 candles)\n- **Volume**: Below average (6,814 vs 9,324) - recovery on lighter volume is concerning\n- **Assessment**: Bullish short-term momentum but MACD still negative. Price crossed above EMA20 recently which is positive. However, the recovery lacks volume confirmation.\n\n### ETH (Current: $3,879.10)\n- **Technical Setup**: Price below EMA20 ($3,903), still in downtrend\n- **RSI (7-period)**: 64.111 - bouncing from oversold\n- **MACD**: -48.451 - improving from -53.058 but still negative\n- **Recent Action**: Recovery from $3,803 to $3,879 (+76 points)\n- **Volume**: Very low (53,373 vs 107,568) - only 50% of average\n- **Assessment**: Weak bounce in downtrend. Price still below EMA20. Low volume suggests lack of conviction.\n\n### SOL (Current: $187.39)\n- **Technical Setup**: Price above EMA20 ($186.50) - just crossed over\n- **RSI (7-period)**: 69.173 - overbought territory\n- **MACD**: -1.948 - improving from -2.324, turning positive\n- **Recent Action**: Strong rally from $180.00 to $187.39 (+7.39, +4.1%)\n- **Volume**: Below average (519,657 vs 754,901)\n- **Assessment**: Strong momentum play. Just crossed EMA20 with improving MACD. RSI overbought is a concern but momentum is strong.\n\n### BNB (Current: $1,108.70)\n- **Technical Setup**: Price above EMA20 ($1,090.14) - strong breakout\n- **RSI (7-period)**: 79.186 - VERY overbought\n- **MACD**: -9.298 - improving rapidly from -15.021\n- **Recent Action**: Explosive move from $1,070.80 to $1,108.70 (+37.90, +3.5%)\n- **Volume**: Low (4,380 vs 7,168)\n- **Assessment**: Parabolic move with extreme RSI. High risk of pullback. MACD still negative despite rally.\n\n### XRP (Current: $2.41)\n- **Technical Setup**: Price slightly below EMA20 ($2.42)\n- **RSI (7-period)**: 58.180 - neutral/bullish\n- **MACD**: -0.016 - nearly neutral, improving\n- **Recent Action**: Recovery from $2.36 to $2.41\n- **Volume**: Very low (1.86M vs 7.16M) - only 26% of average\n- **Assessment**: Consolidating near EMA20. Neutral setup with no clear edge.\n\n### DOGE (Current: $0.193860)\n- **Technical Setup**: Price slightly below EMA20 ($0.194756)\n- **RSI (7-period)**: 63.512 - bullish momentum\n- **MACD**: -0.002 - nearly neutral\n- **Recent Action**: Recovery from $0.189780 to $0.193860\n- **Volume**: Very low (7.59M vs 28.31M) - only 27% of average\n- **Assessment**: Weak bounce with low volume. Still below EMA20.\n\n## Trading Decision Rationale\n\nGiven the market conditions:\n1. **SOL** shows the best risk/reward setup - just crossed EMA20, strong momentum, MACD turning positive\n2. **BNB** is too extended with RSI at 79 - high risk of reversal\n3. **BTC** has potential but MACD still negative and volume weak\n4. **ETH, XRP, DOGE** lack clear setups\n\nI will enter **ONE position in SOL** with conservative sizing given:\n- Strong momentum but overbought RSI\n- Recent EMA20 crossover (bullish signal)\n- MACD improving\n- Risk: $500 (4.9% of capital)\n- Leverage: 15x for better capital efficiency\n- Stop-loss: Below recent low at $180.00 (invalidation at $182.00)\n- Profit target: $195.00 (+4.1% from entry)\n\n# TRADING DECISIONS\n\n```json\n{\n  \"SOL\": {\n    \"trade_signal_args\": {\n      \"coin\": \"SOL\",\n      \"signal\": \"buy\",\n      \"quantity\": 40,\n      \"profit_target\": 195.00,\n      \"stop_loss\": 180.00,\n      \"invalidation_condition\": \"If price closes below $182.00 on 3-minute candle, indicating failed breakout above EMA20\",\n      \"leverage\": 15,\n      \"confidence\": 0.72,\n      \"risk_usd\": 500.00\n    }\n  }\n}\n```",
      "signals": [
        {
          "coin": "SOL",
          "signal": "buy",
          "quantity": 40.0,
          "leverage": 15,
          "stop_loss": 180.0,
          "profit_target": 195.0,
          "confidence": 0.72,
          "risk_usd": 500.0,
          "invalidation_condition": "If price closes below $182.00 on 3-minute candle, indicating failed breakout above EMA20"
        }
      ]
    },
    {
      "iteration": 39,
      "timestamp": "2025-10-23T08:00:00",
      "model": "anthropic",
      "raw_response": "# CHAIN OF THOUGHT\n\nReviewing my current position:\n\n**SOL Position Analysis:**\n- Entry: $187.39, Current: $187.94 (+$0.55, +0.29%)\n- Unrealized PnL: +$18.25 (0.18% of account)\n- Position size: 40 SOL at 15x leverage ($7,517.60 notional)\n- Profit target: $195.00 (+$7.06 from current, +3.76%)\n- Stop-loss: $180.00 (-$7.94 from current, -4.22%)\n- Invalidation condition: \"If price closes below $182.00 on 3-minute candle, indicating failed breakout above EMA20\"\n\n**Technical Analysis:**\n- Current price: $187.94 vs EMA20: $186.88 \u2192 Price is ABOVE EMA20 (+$1.06)\n- RSI (7-period): 71.136 \u2192 Overbought territory (>70)\n- RSI (14-period): 57.026 \u2192 Neutral/slightly bullish\n- MACD: -1.908 \u2192 Still negative but improving from -2.680\n- Price action: Strong recovery from $180.00 low, now at session highs\n- Volume: 583,548 vs average 739,490 \u2192 Below average (-21%)\n\n**Invalidation Check:**\n- Invalidation level: $182.00\n- Current price: $187.94\n- Recent lows: $180.00 (two candles ago)\n- The price has NOT closed below $182.00 \u2192 Invalidation condition NOT met\n\n**Decision Rationale:**\nThe position is showing small profit and the invalidation condition has not been triggered. However, I'm concerned about:\n1. RSI at 71.136 indicates overbought conditions - potential for pullback\n2. MACD still negative despite improvement\n3. Below-average volume on the rally\n4. Price is only $0.55 above entry - minimal cushion\n5. Recent volatility with a drop to $180.00 shows weakness\n\nDespite these concerns, the invalidation condition is clear: close if price closes below $182.00. Since we're at $187.94, well above that level, I should HOLD per my trading rules. The stop-loss at $180.00 provides downside protection.\n\n**Other Coins:**\n- BTC: Below EMA20, negative MACD, RSI 64 - no clear setup\n- ETH: Below EMA20, negative MACD, RSI 55 - weak momentum\n- BNB: Above EMA20, improving MACD, RSI 58 - interesting but already have SOL exposure\n- XRP: Below EMA20, negative MACD, RSI 46 - weak\n- DOGE: Below EMA20, negative MACD, RSI 57 - no clear edge\n\nNo new positions warranted given existing SOL exposure and lack of compelling setups.\n\n# TRADING DECISIONS\n\n```json\n{\n  \"SOL\": {\n    \"trade_signal_args\": {\n      \"coin\": \"SOL\",\n      \"signal\": \"hold\",\n      \"quantity\": 40.0,\n      \"profit_target\": 195.0,\n      \"stop_loss\": 180.0,\n      \"invalidation_condition\": \"If price closes below $182.00 on 3-minute candle, indicating failed breakout above EMA20\",\n      \"leverage\": 15,\n      \"confidence\": 0.72,\n      \"risk_usd\": 500.0\n    }\n  }\n}\n```",
      "signals": [
        {
          "coin": "SOL",
          "signal": "hold",
          "quantity": 40.0,
          "leverage": 15,
          "stop_loss": 180.0,
          "profit_target": 195.0,
          "confidence": 0.72,
          "risk_usd": 500.0,
          "invalidation_condition": "If price closes below $182.00 on 3-minute candle, indicating failed breakout above EMA20"
        }
      ]
    },
    {
      "iteration": 40,
      "timestamp": "2025-10-23T12:00:00",
      "model": "anthropic",
      "raw_response": "# CHAIN OF THOUGHT\n\nReviewing my current position:\n\n**SOL Position Analysis:**\n- Entry: $187.39, Current: $191.04 (+$3.65, +1.95%)\n- Unrealized PnL: +$142.25 (+1.86% of account)\n- Profit Target: $195.00 (distance: $3.96, 2.07%)\n- Stop Loss: $180.00 (distance: $11.04, 5.78%)\n- Invalidation Condition: \"If price closes below $182.00 on 3-minute candle, indicating failed breakout above EMA20\"\n\n**Technical Analysis:**\n- Current price: $191.04 vs EMA20: $187.16 \u2192 Price is $3.88 ABOVE EMA20 \u2713\n- RSI (7-period): 80.598 \u2192 EXTREMELY overbought (>70)\n- RSI (14-period): 65.132 \u2192 Overbought territory\n- MACD: -1.195 \u2192 Still negative but improving rapidly (was -2.509)\n- Price action: Strong rally from $180.00 low to $191.04 (+6.1% move)\n- Volume: 830,240 vs avg 751,213 \u2192 Above average, confirming momentum\n\n**Invalidation Check:**\n- Invalidation level: $182.00\n- Recent lows: $180.00, $180.17\n- Current price: $191.04\n- Status: Price is $9.04 ABOVE invalidation level \u2192 **NOT INVALIDATED** \u2713\n\n**Decision Factors:**\n1. **Profit proximity**: Only $3.96 away from $195 target (2.07% move needed)\n2. **Extreme RSI**: 80.6 is dangerously overbought - high probability of pullback\n3. **Risk/Reward**: Currently up $142, but RSI suggests imminent reversal\n4. **Technical setup**: Price broke above EMA20 successfully, but momentum may be exhausted\n\n**Risk Assessment:**\n- The RSI at 80.6 is a major red flag - this level typically precedes sharp corrections\n- However, profit target is very close ($3.96 away)\n- If I hold and price reverses, could give back significant gains\n- Conservative approach: Take profits now given extreme overbought conditions\n\n**Decision: CLOSE POSITION**\nReason: Taking profits due to extreme overbought RSI (80.6) and proximity to profit target. While invalidation condition is not met, the technical setup suggests high probability of reversal. Better to lock in +$142 profit (+1.86% account gain) than risk giving it back on a pullback from these extreme levels.\n\n**Other Coins:**\n- **BTC**: RSI 73.5 (overbought), price above EMA20, but no position. Not entering at these elevated levels.\n- **ETH**: RSI 61.5, still below EMA20, weak momentum. No trade.\n- **BNB**: RSI 77.7 (very overbought), strong rally but late to enter. No trade.\n- **XRP**: RSI 58.1, below EMA20, weak setup. No trade.\n- **DOGE**: RSI 70.7 (overbought), marginal setup. No trade.\n\nAll major coins showing overbought conditions - prudent to take profits and wait for better entry opportunities.\n\n# TRADING DECISIONS\n\n```json\n{\n  \"SOL\": {\n    \"trade_signal_args\": {\n      \"coin\": \"SOL\",\n      \"signal\": \"close_position\",\n      \"quantity\": 40.0,\n      \"profit_target\": 195.0,\n      \"stop_loss\": 180.0,\n      \"invalidation_condition\": \"If price closes below $182.00 on 3-minute candle, indicating failed breakout above EMA20\",\n      \"leverage\": 15,\n      \"confidence\": 0.72,\n      \"risk_usd\": 500.0,\n      \"close_reason\": \"Taking profits due to extreme overbought RSI (80.6) and proximity to profit target ($3.96 away). Risk management dictates locking in +$142.25 gain rather than risking reversal from these elevated levels.\"\n    }\n  }\n}\n```",
      "signals": [
        {
          "coin": "SOL",
          "signal": "close_position",
          "quantity": 40.0,
          "leverage": 15,
          "stop_loss": 180.0,
          "profit_target": 195.0,
          "confidence": 0.72,
          "risk_usd": 500.0,
          "invalidation_condition": "If price closes below $182.00 on 3-minute candle, indicating failed breakout above EMA20"
        }
      ]
    },
    {
      "iteration": 41,
      "timestamp": "2025-10-23T16:00:00",
      "model": "anthropic",
      "raw_response": "# CHAIN OF THOUGHT\n\n## Current Portfolio Status\n- No open positions\n- Available cash: $10,388.30\n- Total return: +3.88%\n- Sharpe ratio: 3.479 (excellent risk-adjusted returns)\n\n## Market Analysis by Coin\n\n**BTC Analysis:**\n- Price: $110,233 (strong recovery from recent lows)\n- Above EMA20 ($109,405) - bullish crossover\n- RSI(7): 77.35 - overbought territory but showing strong momentum\n- MACD: -350.80 (improving from -828, converging toward zero)\n- Price action: Strong upward momentum from $107,528 to $110,233 (+2.5% in 30 min)\n- Volume: Slightly below average (9,097 vs 9,491)\n- Assessment: Strong bullish momentum but RSI overbought suggests potential pullback risk\n\n**ETH Analysis:**\n- Price: $3,859.40\n- Below EMA20 ($3,890) - still in downtrend\n- RSI(7): 50.07 - neutral, no clear momentum\n- MACD: -35.17 (improving but still negative)\n- Price struggling to break above EMA resistance\n- Volume: Above average (147,977 vs 111,304) - good liquidity\n- Assessment: Consolidating, lacks clear directional bias\n\n**SOL Analysis:**\n- Price: $191.13\n- Above EMA20 ($187.31) - bullish breakout\n- RSI(7): 80.92 - extremely overbought\n- MACD: -0.43 (nearly neutral, improving rapidly)\n- Price action: Explosive move from $180 to $191 (+6.2% in 30 min)\n- Volume: Above average (786,380 vs 772,606)\n- Assessment: **STRONGEST SETUP** - clear breakout with momentum, but overbought\n\n**BNB Analysis:**\n- Price: $1,117.20\n- Above EMA20 ($1,094) - bullish\n- RSI(7): 63.61 - healthy momentum, not overbought\n- MACD: +1.42 (positive crossover!)\n- Price action: Strong rally from $1,070 to $1,130, slight pullback\n- Volume: Significantly above average (16,784 vs 10,302)\n- Assessment: **BEST RISK/REWARD** - bullish with room to run, not overextended\n\n**XRP Analysis:**\n- Price: $2.41\n- Below EMA20 ($2.42) - weak\n- RSI(7): 56.56 - neutral\n- MACD: -0.018 (slightly negative)\n- Choppy price action, no clear trend\n- Assessment: Avoid - no clear setup\n\n**DOGE Analysis:**\n- Price: $0.19577\n- Above EMA20 ($0.19478) - slight bullish\n- RSI(7): 72.90 - overbought\n- MACD: -0.001 (nearly neutral)\n- Volume: Above average\n- Assessment: Moderate setup but less conviction than BNB/SOL\n\n## Trading Decision Rationale\n\nGiven no current positions and strong market momentum, I'll enter **ONE** high-conviction trade to maintain disciplined risk management:\n\n**Selected Trade: BNB**\n- Reasoning: Best risk/reward profile\n  - Positive MACD crossover (rare bullish signal)\n  - RSI at 63.61 (strong but not overextended like SOL at 80.92)\n  - Clear breakout above EMA20 with volume confirmation\n  - Recent pullback from $1,130 to $1,117 provides better entry\n  - High volume surge indicates institutional interest\n  \n- Risk Management:\n  - Stop-loss: Below recent swing low at $1,070 (4.2% risk)\n  - Profit target: $1,165 (4.3% gain, 1:1 risk/reward minimum)\n  - Invalidation: Break below $1,085 (EMA20 support level)\n  - Position size: ~$500 risk (5% of capital)\n  - Leverage: 15x (moderate for this setup)\n\n**Why not SOL despite stronger momentum?**\n- RSI at 80.92 is dangerously overbought\n- Higher probability of immediate pullback\n- Less favorable entry point after +6.2% move\n\n**Why not BTC?**\n- RSI at 77.35 also overbought\n- Already extended from recent lows\n- Less room for continuation\n\n# TRADING DECISIONS\n\n```json\n{\n  \"BNB\": {\n    \"trade_signal_args\": {\n      \"coin\": \"BNB\",\n      \"signal\": \"buy\",\n      \"quantity\": 1.07,\n      \"profit_target\": 1165.00,\n      \"stop_loss\": 1070.00,\n      \"invalidation_condition\": \"If price closes below $1,085 (EMA20 support) on 3-minute candle, indicating failed breakout\",\n      \"leverage\": 15,\n      \"confidence\": 0.78,\n      \"risk_usd\": 505.00\n    }\n  }\n}\n```",
      "signals": [
        {
          "coin": "BNB",
          "signal": "buy",
          "quantity": 1.07,
          "leverage": 15,
          "stop_loss": 1070.0,
          "profit_target": 1165.0,
          "confidence": 0.78,
          "risk_usd": 505.0,
          "invalidation_condition": "If price closes below $1,085 (EMA20 support) on 3-minute candle, indicating failed breakout"
        }
      ]
    },
    {
      "iteration": 42,
      "timestamp": "2025-10-23T20:00:00",
      "model": "anthropic",
      "raw_response": "# CHAIN OF THOUGHT\n\n## Current Position Analysis\n\n**BNB Position Review:**\n- Entry: $1,117.20 | Current: $1,125.70 | Unrealized PnL: +$8.50 (+0.76%)\n- Leverage: 15x | Notional: $1,204.50\n- Exit Plan: Profit Target $1,165 | Stop-Loss $1,070 | Invalidation: Close below $1,085 EMA20\n- Current EMA20: $1,096.02 (well above invalidation level)\n- Technical Analysis:\n  * RSI(7): 68.67 - approaching overbought but not extreme\n  * RSI(14): 64.66 - healthy momentum\n  * MACD: +5.318 - positive and increasing (bullish)\n  * Price action: Strong uptrend from $1,068.70 to $1,125.70\n  * Currently trading above EMA20 ($1,096.02)\n  * Recent candle shows slight pullback from $1,130.10 high\n\n**Invalidation Check:** Price is at $1,125.70, EMA20 at $1,096.02. The invalidation condition states \"if price closes below $1,085 on 3-minute candle.\" Current price is $40+ above this level, so invalidation is NOT met.\n\n**Decision Rationale:** \n- Position is profitable and trending in our favor\n- No invalidation condition triggered\n- MACD turning positive suggests continued momentum\n- Price holding well above EMA20 support\n- Stop-loss at $1,070 provides adequate protection\n- Profit target at $1,165 is reasonable (~3.5% away)\n\n**Action: HOLD** - All conditions support maintaining the position. The slight pullback from $1,130 to $1,125 is normal profit-taking, not a reversal signal.\n\n## Other Coins Assessment\n\n**BTC:** Strong recovery (RSI 70, MACD improving from -744 to -195), but already at $110k with RSI showing overbought on 7-period. Not entering new position at these levels.\n\n**SOL:** Extremely overbought (RSI 81.5), parabolic move from $180 to $191. High risk of pullback. Avoiding.\n\n**ETH:** Weak (RSI 48, MACD -29, below EMA20). No clear setup.\n\n**XRP:** Weak momentum (RSI 43, below EMA20 at $2.42). Downtrend intact.\n\n**DOGE:** Neutral (RSI 58, at EMA20). No compelling setup.\n\n## Risk Management\n- Current account value: $10,396.81\n- Single position exposure: $1,204.50 (11.6% of account)\n- Available cash: $10,308.01\n- Portfolio performing well (+3.97% return, Sharpe 3.479)\n- Conservative approach warranted - maintain discipline\n\n# TRADING DECISIONS\n\n```json\n{\n  \"BNB\": {\n    \"trade_signal_args\": {\n      \"coin\": \"BNB\",\n      \"signal\": \"hold\",\n      \"quantity\": 1.07,\n      \"profit_target\": 1165.0,\n      \"stop_loss\": 1070.0,\n      \"invalidation_condition\": \"If price closes below $1,085 (EMA20 support) on 3-minute candle, indicating failed breakout\",\n      \"leverage\": 15,\n      \"confidence\": 0.78,\n      \"risk_usd\": 505.0\n    }\n  }\n}\n```",
      "signals": [
        {
          "coin": "BNB",
          "signal": "hold",
          "quantity": 1.07,
          "leverage": 15,
          "stop_loss": 1070.0,
          "profit_target": 1165.0,
          "confidence": 0.78,
          "risk_usd": 505.0,
          "invalidation_condition": "If price closes below $1,085 (EMA20 support) on 3-minute candle, indicating failed breakout"
        }
      ]
    },
    {
      "iteration": 43,
      "timestamp": "2025-10-24T00:00:00",
      "model": "anthropic",
      "raw_response": "# CHAIN OF THOUGHT\n\nReviewing my current position:\n\n**BNB Position Analysis:**\n- Entry: $1,117.20, Current: $1,134.90 (+$18.34 unrealized PnL, +1.58%)\n- Profit Target: $1,165.00 (still $30.10 away)\n- Stop Loss: $1,070.00 (well below current price)\n- Invalidation Condition: \"If price closes below $1,085 (EMA20 support) on 3-minute candle\"\n- Current EMA20: $1,099.63 (price is $35.27 above EMA20)\n- Technical Indicators:\n  - RSI (7-period): 73.868 - Overbought territory but not extreme\n  - RSI (14-period): 67.903 - Confirming bullish momentum\n  - MACD: 7.799 - Positive and increasing (was 5.451 last candle)\n  - Price above EMA20 and EMA20 trending up ($1,099.63)\n  - Strong upward momentum from $1,070.80 to $1,134.90\n\n**Invalidation Check:** Price is at $1,134.90, well above the invalidation level of $1,085. The EMA20 is at $1,099.63, so the invalidation condition is NOT met. Price would need to drop ~$50 to trigger invalidation.\n\n**Decision Rationale:** \n- Position is profitable and trending in our favor\n- No invalidation condition met (price well above $1,085)\n- MACD showing strengthening bullish momentum\n- RSI elevated but not at extreme levels (>80)\n- Stop loss provides adequate protection at $1,070\n- Profit target at $1,165 is reasonable given the momentum\n- Risk/reward remains favorable\n\n**Conclusion:** HOLD the BNB position. The trade is working as planned with strong momentum, no invalidation signals, and room to run toward the profit target.\n\n**Other Coins (BTC, ETH, SOL, XRP, DOGE):**\n- No existing positions\n- While some show bullish momentum (BTC RSI 76.5, SOL RSI 80.3), I'm already deployed with capital in BNB\n- Not entering new positions to maintain focused risk management\n- Available cash: $10,308.01 but prefer to let current trade play out\n\n# TRADING DECISIONS\n\n```json\n{\n  \"BNB\": {\n    \"trade_signal_args\": {\n      \"coin\": \"BNB\",\n      \"signal\": \"hold\",\n      \"quantity\": 1.07,\n      \"profit_target\": 1165.0,\n      \"stop_loss\": 1070.0,\n      \"invalidation_condition\": \"If price closes below $1,085 (EMA20 support) on 3-minute candle, indicating failed breakout\",\n      \"leverage\": 15,\n      \"confidence\": 0.78,\n      \"risk_usd\": 505.0\n    }\n  }\n}\n```",
      "signals": [
        {
          "coin": "BNB",
          "signal": "hold",
          "quantity": 1.07,
          "leverage": 15,
          "stop_loss": 1070.0,
          "profit_target": 1165.0,
          "confidence": 0.78,
          "risk_usd": 505.0,
          "invalidation_condition": "If price closes below $1,085 (EMA20 support) on 3-minute candle, indicating failed breakout"
        }
      ]
    },
    {
      "iteration": 44,
      "timestamp": "2025-10-24T04:00:00",
      "model": "anthropic",
      "raw_response": "# CHAIN OF THOUGHT\n\n## Current Position Analysis\n\n**BNB Position Review:**\n- Entry: $1,117.20, Current: $1,124.90 (+$7.64 unrealized PnL)\n- Leverage: 15x, Position size: 1.07 BNB\n- Profit target: $1,165.00 (still $40.10 away)\n- Stop-loss: $1,070.00 (well below current price)\n- Invalidation condition: \"If price closes below $1,085 (EMA20 support) on 3-minute candle\"\n\n**Technical Analysis for BNB:**\n- Current price $1,124.90 vs EMA20 $1,099.48 - price is ABOVE EMA20 by $25.42\n- The invalidation condition states \"below $1,085\" but current EMA20 is at $1,099.48\n- Price has NOT closed below $1,085 - invalidation NOT triggered\n- RSI (7-period): 59.644 - neutral zone, not overbought\n- MACD: 12.138 - positive and increasing, bullish momentum\n- Price action: Recent pullback from $1,134.90 to $1,124.90 but still holding above support\n- EMA20 trending upward: 1,096.81 \u2192 1,099.48\n\n**Decision on BNB:** HOLD\n- Invalidation condition NOT met (price still above $1,085)\n- Price remains above EMA20 support\n- MACD positive and increasing\n- RSI in healthy range (not overbought)\n- Small profit developing (+0.68%)\n- No reason to exit prematurely\n\n## Market Scan for New Opportunities\n\n**BTC Analysis:**\n- Strong momentum: RSI 84.563 (overbought), MACD 347.203 (very bullish)\n- Price $111,072 well above EMA20 $109,433\n- Concern: RSI extremely overbought, potential for pullback\n- Decision: PASS - too extended for entry\n\n**ETH Analysis:**\n- RSI 83.272 (overbought), MACD -6.595 (still negative but improving)\n- Price $3,950.10 above EMA20 $3,883.15\n- Strong recent rally but MACD still negative\n- Decision: PASS - overbought conditions\n\n**SOL Analysis:**\n- RSI 84.992 (extremely overbought), MACD 1.354 (positive)\n- Price $192.09 above EMA20 $187.77\n- Decision: PASS - too overbought\n\n**XRP Analysis:**\n- RSI 76.650 (overbought), MACD -0.010 (near zero, turning positive)\n- Price $2.44 above EMA20 $2.41\n- Recent strong move from $2.36 to $2.44\n- Decision: PASS - overbought\n\n**DOGE Analysis:**\n- RSI 74.313 (overbought), MACD -0.000 (neutral)\n- Price $0.196590 above EMA20 $0.194606\n- Decision: PASS - overbought\n\n**Overall Market Assessment:**\nAll coins showing overbought RSI conditions (>70), suggesting market is extended. With only 1 position open using modest capital, portfolio is well-protected. Will maintain BNB position and wait for better entry opportunities on pullbacks.\n\n# TRADING DECISIONS\n\n```json\n{\n  \"BNB\": {\n    \"trade_signal_args\": {\n      \"coin\": \"BNB\",\n      \"signal\": \"hold\",\n      \"quantity\": 1.07,\n      \"profit_target\": 1165.0,\n      \"stop_loss\": 1070.0,\n      \"invalidation_condition\": \"If price closes below $1,085 (EMA20 support) on 3-minute candle, indicating failed breakout\",\n      \"leverage\": 15,\n      \"confidence\": 0.78,\n      \"risk_usd\": 505.0\n    }\n  }\n}\n```",
      "signals": [
        {
          "coin": "BNB",
          "signal": "hold",
          "quantity": 1.07,
          "leverage": 15,
          "stop_loss": 1070.0,
          "profit_target": 1165.0,
          "confidence": 0.78,
          "risk_usd": 505.0,
          "invalidation_condition": "If price closes below $1,085 (EMA20 support) on 3-minute candle, indicating failed breakout"
        }
      ]
    },
    {
      "iteration": 45,
      "timestamp": "2025-10-24T08:00:00",
      "model": "anthropic",
      "raw_response": "# CHAIN OF THOUGHT\n\n## Current Position Analysis\n\n### BNB Position Review\n- **Entry**: $1,117.20 at 15x leverage\n- **Current Price**: $1,124.80 (+0.68%)\n- **Unrealized P&L**: +$7.53\n- **Exit Plan**: \n  - Profit Target: $1,165.00\n  - Stop Loss: $1,070.00\n  - Invalidation: \"If price closes below $1,085 (EMA20 support) on 3-minute candle\"\n\n**Technical Analysis**:\n- Current EMA20: $1,100.54 (price well above)\n- RSI (7-period): 59.555 (neutral, down from 74.111 two candles ago)\n- RSI (14-period): 62.157 (healthy)\n- MACD: 14.371 (positive and rising)\n- Price action: Consolidating around $1,125 after reaching $1,134.90\n\n**Invalidation Check**: \n- Current price $1,124.80 is ABOVE $1,085 invalidation level \u2713\n- Current EMA20 $1,100.54 is ABOVE $1,085 \u2713\n- No 3-minute candle has closed below $1,085 \u2713\n- **Invalidation condition NOT met**\n\n**Decision Rationale**: \nThe position remains valid. Price is holding above EMA20 support, MACD is positive and strengthening, and we're in profit. The recent RSI cooldown from overbought levels (74\u219259) is healthy consolidation, not a reversal signal. The invalidation level of $1,085 provides a clear 3.5% buffer below current price. Will HOLD and let the position run toward the $1,165 profit target.\n\n## Market Opportunities Assessment\n\n### BTC Analysis\n- **Strong momentum**: RSI 85 (overbought), MACD 611 (very strong)\n- Price $111,100 well above EMA20 $109,458\n- **Concern**: Extremely overbought on 7-period RSI (85.095)\n- **Risk**: Potential for sharp pullback from these extended levels\n- **Decision**: Pass - too extended for new entry\n\n### ETH Analysis\n- RSI 81.3 (overbought), MACD turning positive (4.76)\n- Price $3,947.70 above EMA20 $3,885.15\n- **Concern**: Also overbought, following BTC's move\n- **Decision**: Pass - overbought conditions\n\n### SOL Analysis\n- RSI 83.4 (overbought), MACD 1.612 (positive)\n- Price $192.03 above EMA20 $188.10\n- Strong uptrend but extended\n- **Decision**: Pass - overbought\n\n### XRP Analysis\n- RSI 81.8 (overbought), MACD near zero (-0.001)\n- Price $2.45 above EMA20 $2.41\n- **Decision**: Pass - overbought\n\n### DOGE Analysis\n- RSI 78.6 (overbought), MACD flat (0.000)\n- Price $0.197240 above EMA20 $0.194538\n- **Decision**: Pass - overbought\n\n**Overall Market Assessment**: All major coins are showing overbought RSI readings (78-85 range), indicating the market is extended and due for consolidation or pullback. This is NOT the time to initiate new leveraged positions. Risk management dictates waiting for better entry opportunities.\n\n## Portfolio Status\n- Account Value: $10,395.78 (+3.96% total return)\n- Available Cash: $10,308.01\n- Single position: BNB (1.07 units, $1,203.54 notional)\n- Sharpe Ratio: 3.479 (excellent risk-adjusted returns)\n\n**Risk Management**: With only one small position and the entire market overbought, maintaining discipline and holding the valid BNB position while avoiding FOMO entries into extended markets.\n\n# TRADING DECISIONS\n\n```json\n{\n  \"BNB\": {\n    \"trade_signal_args\": {\n      \"coin\": \"BNB\",\n      \"signal\": \"hold\",\n      \"quantity\": 1.07,\n      \"profit_target\": 1165.0,\n      \"stop_loss\": 1070.0,\n      \"invalidation_condition\": \"If price closes below $1,085 (EMA20 support) on 3-minute candle, indicating failed breakout\",\n      \"leverage\": 15,\n      \"confidence\": 0.78,\n      \"risk_usd\": 505.0\n    }\n  }\n}\n```",
      "signals": [
        {
          "coin": "BNB",
          "signal": "hold",
          "quantity": 1.07,
          "leverage": 15,
          "stop_loss": 1070.0,
          "profit_target": 1165.0,
          "confidence": 0.78,
          "risk_usd": 505.0,
          "invalidation_condition": "If price closes below $1,085 (EMA20 support) on 3-minute candle, indicating failed breakout"
        }
      ]
    },
    {
      "iteration": 46,
      "timestamp": "2025-10-24T12:00:00",
      "model": "anthropic",
      "raw_response": "# CHAIN OF THOUGHT\n\n## Current Position Analysis\n\n### BNB Position Review\n- **Entry**: $1,117.20 at 15x leverage\n- **Current Price**: $1,103.40\n- **Unrealized P&L**: -$15.36 (-1.30%)\n- **Stop Loss**: $1,070.00\n- **Profit Target**: $1,165.00\n- **Invalidation Condition**: \"If price closes below $1,085 (EMA20 support) on 3-minute candle\"\n\n**Technical Analysis**:\n- Current EMA20: $1,101.46 - Price is ABOVE EMA20 ($1,103.40 > $1,101.46)\n- RSI(7): 34.252 - Oversold territory, potential bounce\n- RSI(14): 47.732 - Neutral\n- MACD: 11.902 - Still positive but declining from 13.459\n- Price action: Sharp drop from $1,124.80 to $1,103.40 in last candle\n\n**Invalidation Check**: \nThe invalidation condition states \"below $1,085\". Current price is $1,103.40, which is ABOVE $1,085. However, the price has dropped sharply and is showing weakness with RSI(7) at 34.252 (oversold). The EMA20 is at $1,101.46, and price is barely holding above it.\n\n**Critical Assessment**:\n- Price is still above the $1,085 invalidation level\n- Price is above EMA20 support ($1,103.40 > $1,101.46)\n- RSI oversold suggests potential bounce\n- MACD still positive\n- Stop loss at $1,070 provides cushion\n- Position is down but invalidation NOT triggered\n\n**Decision**: HOLD - The invalidation condition has NOT been met. Price remains above $1,085 and above EMA20 support. The oversold RSI suggests potential for a bounce. Will continue monitoring closely.\n\n## Other Coins Analysis\n\n### BTC\n- Price: $110,109 near EMA20 ($109,594)\n- RSI(7): 44.879 - Sharp drop from 85.064 (overbought exhaustion)\n- MACD: 487.189 - Still positive but declining\n- Sharp rejection from $111,100 high\n- **Decision**: NO TRADE - Showing weakness after overbought conditions\n\n### ETH\n- Price: $3,890 just above EMA20 ($3,885.37)\n- RSI(7): 45.165 - Similar sharp drop from 81.314\n- MACD: 4.756 - Barely positive\n- **Decision**: NO TRADE - Weak momentum\n\n### SOL\n- Price: $189.29 above EMA20 ($188.39)\n- RSI(7): 38.006 - Sharp drop from 83.354 (oversold)\n- MACD: 1.276 - Positive but declining\n- **Decision**: NO TRADE - Too much volatility\n\n### XRP\n- Price: $2.48 well above EMA20 ($2.42)\n- RSI(7): 87.315 - EXTREMELY overbought\n- MACD: 0.003 - Just turned positive\n- Strong momentum but dangerously overbought\n- **Decision**: NO TRADE - Too risky at these overbought levels\n\n### DOGE\n- Price: $0.194840 near EMA20 ($0.194603)\n- RSI(7): 43.865 - Sharp drop from 78.622\n- MACD: 0.000 - Neutral\n- **Decision**: NO TRADE - No clear edge\n\n## Risk Management Summary\n- Current account value: $10,371.36\n- Available cash: $10,308.01\n- Single position (BNB) with -$15.36 unrealized loss\n- Position size appropriate at ~11.4% of account value\n- Invalidation condition NOT met - will hold position\n\n# TRADING DECISIONS\n\n```json\n{\n  \"BNB\": {\n    \"trade_signal_args\": {\n      \"coin\": \"BNB\",\n      \"signal\": \"hold\",\n      \"quantity\": 1.07,\n      \"profit_target\": 1165.0,\n      \"stop_loss\": 1070.0,\n      \"invalidation_condition\": \"If price closes below $1,085 (EMA20 support) on 3-minute candle, indicating failed breakout\",\n      \"leverage\": 15,\n      \"confidence\": 0.78,\n      \"risk_usd\": 505.0\n    }\n  }\n}\n```",
      "signals": [
        {
          "coin": "BNB",
          "signal": "hold",
          "quantity": 1.07,
          "leverage": 15,
          "stop_loss": 1070.0,
          "profit_target": 1165.0,
          "confidence": 0.78,
          "risk_usd": 505.0,
          "invalidation_condition": "If price closes below $1,085 (EMA20 support) on 3-minute candle, indicating failed breakout"
        }
      ]
    },
    {
      "iteration": 47,
      "timestamp": "2025-10-24T16:00:00",
      "model": "anthropic",
      "raw_response": "# CHAIN OF THOUGHT\n\nReviewing my current position and market conditions:\n\n**BNB Position Analysis:**\n- Entry: $1117.20, Current: $1108.70 (down $8.50 or -0.76%)\n- Unrealized P&L: -$9.69\n- Invalidation condition: \"If price closes below $1,085 (EMA20 support) on 3-minute candle\"\n- Current EMA20: $1106.94\n- Stop-loss: $1070.00, Profit target: $1165.00\n\nTechnical Analysis:\n- Price at $1108.70 is ABOVE the invalidation level of $1085\n- Current EMA20 at $1106.94 shows price is slightly above EMA support\n- RSI (7-period): 42.136 - neutral to slightly bearish, not oversold\n- RSI (14-period): 49.586 - neutral territory\n- MACD: 4.627 - still positive but momentum weakening\n- Recent price action shows a pullback from $1134.90 high to $1103.40, now recovering to $1108.70\n\nThe invalidation condition has NOT been met - price is still $23.70 above the $1085 invalidation level. The position is experiencing normal volatility within the trade plan. EMA20 support is holding at $1106.94, and price is just above it. The slight pullback appears to be a healthy retracement rather than a failed breakout.\n\n**Decision: HOLD** - The invalidation condition is not triggered, stop-loss is not hit, and the technical structure remains intact. The position deserves more time to develop.\n\n**Other Coins Analysis:**\n- **BTC**: Strong momentum with RSI 58.76, MACD improving (-354 from -428), price above EMA20. Bullish but no position.\n- **ETH**: Recovering with RSI 60.08, MACD improving, price above EMA20. Neutral to bullish but no position.\n- **SOL**: Very strong with RSI 68.38, MACD near zero (-0.31), price well above EMA20. Bullish momentum.\n- **XRP**: Extremely overbought RSI 90.67, parabolic move from 2.39 to 2.50. High risk of pullback.\n- **DOGE**: Neutral RSI 60.53, MACD improving, price at EMA20. Consolidating.\n\nGiven I'm already in one position and it's slightly underwater, I should not add new positions (no pyramiding allowed anyway). The portfolio is at 3.77% return with good Sharpe ratio of 3.479. Risk management suggests maintaining current exposure.\n\n# TRADING DECISIONS\n\n```json\n{\n  \"BNB\": {\n    \"trade_signal_args\": {\n      \"coin\": \"BNB\",\n      \"signal\": \"hold\",\n      \"quantity\": 1.07,\n      \"profit_target\": 1165.0,\n      \"stop_loss\": 1070.0,\n      \"invalidation_condition\": \"If price closes below $1,085 (EMA20 support) on 3-minute candle, indicating failed breakout\",\n      \"leverage\": 15,\n      \"confidence\": 0.78,\n      \"risk_usd\": 505.0\n    }\n  }\n}\n```",
      "signals": [
        {
          "coin": "BNB",
          "signal": "hold",
          "quantity": 1.07,
          "leverage": 15,
          "stop_loss": 1070.0,
          "profit_target": 1165.0,
          "confidence": 0.78,
          "risk_usd": 505.0,
          "invalidation_condition": "If price closes below $1,085 (EMA20 support) on 3-minute candle, indicating failed breakout"
        }
      ]
    },
    {
      "iteration": 48,
      "timestamp": "2025-10-24T20:00:00",
      "model": "anthropic",
      "raw_response": "# CHAIN OF THOUGHT\n\nReviewing my current position:\n\n**BNB Position Analysis:**\n- Entry: $1117.20, Current: $1108.40\n- Unrealized P&L: -$10.01 (-0.79%)\n- Leverage: 15x\n- Stop-loss: $1070.00 (not hit)\n- Profit target: $1165.00 (not reached)\n- Invalidation condition: \"If price closes below $1,085 (EMA20 support) on 3-minute candle\"\n\n**Technical Analysis:**\n- Current EMA20: $1104.12 - Price is above EMA20 ($1108.40 > $1104.12) \u2713\n- RSI (7-period): 41.867 - Oversold territory, potential bounce\n- RSI (14-period): 50.381 - Neutral\n- MACD: 8.040 - Still positive but declining from 10.990\n- Price action: Recent pullback from $1134.90 high to $1103.40, now recovering to $1108.40\n\n**Invalidation Check:**\nThe invalidation condition states: \"If price closes below $1,085 (EMA20 support)\". \n- Current price: $1108.40\n- Current EMA20: $1104.12\n- The $1,085 level has NOT been breached\n- Price remains above both current EMA20 and the $1,085 invalidation level\n- **Invalidation condition NOT met** \u2713\n\n**Decision Rationale:**\nThe position is showing a small loss but remains technically valid. The price is holding above EMA20 support and well above the invalidation level. RSI at 41.867 suggests oversold conditions which could lead to a bounce. MACD is still positive. The stop-loss at $1070 provides adequate protection. No reason to exit prematurely.\n\n**Other Coins Analysis:**\n- **BTC**: Strong momentum (RSI 67.4, MACD turned positive, above EMA20). However, already have exposure via BNB position. Not adding new positions.\n- **ETH**: Recovering but MACD still negative (-6.397). Not compelling enough for entry.\n- **SOL**: Strong (RSI 71.3, above EMA20, positive MACD). Attractive but managing existing BNB position first.\n- **XRP**: Extremely overbought (RSI 92.4). Too risky to enter at these levels.\n- **DOGE**: Moderate momentum but below longer-term EMA50. Not compelling.\n\n**Risk Management:**\n- Current account value: $10,377.06\n- Available cash: $10,308.01\n- Single position exposure is appropriate\n- Not adding to existing position (no pyramiding rule)\n\n# TRADING DECISIONS\n\n```json\n{\n  \"BNB\": {\n    \"trade_signal_args\": {\n      \"coin\": \"BNB\",\n      \"signal\": \"hold\",\n      \"quantity\": 1.07,\n      \"profit_target\": 1165.0,\n      \"stop_loss\": 1070.0,\n      \"invalidation_condition\": \"If price closes below $1,085 (EMA20 support) on 3-minute candle, indicating failed breakout\",\n      \"leverage\": 15,\n      \"confidence\": 0.78,\n      \"risk_usd\": 505.0\n    }\n  }\n}\n```",
      "signals": [
        {
          "coin": "BNB",
          "signal": "hold",
          "quantity": 1.07,
          "leverage": 15,
          "stop_loss": 1070.0,
          "profit_target": 1165.0,
          "confidence": 0.78,
          "risk_usd": 505.0,
          "invalidation_condition": "If price closes below $1,085 (EMA20 support) on 3-minute candle, indicating failed breakout"
        }
      ]
    },
    {
      "iteration": 49,
      "timestamp": "2025-10-25T00:00:00",
      "model": "anthropic",
      "raw_response": "",
      "signals": []
    },
    {
      "iteration": 50,
      "timestamp": "2025-10-25T04:00:00",
      "model": "anthropic",
      "raw_response": "# CHAIN OF THOUGHT\n\n## Current Position Analysis\n\n### BNB Position Review\n- **Entry**: $1117.20 at 15x leverage\n- **Current Price**: $1112.20\n- **Unrealized P&L**: -$5.95 (-0.45%)\n- **Stop Loss**: $1070.00\n- **Profit Target**: $1165.00\n- **Invalidation Condition**: \"If price closes below $1,085 (EMA20 support) on 3-minute candle\"\n\n**Technical Analysis**:\n- Current EMA20: $1103.31 (price is above EMA20 \u2713)\n- Price action: $1112.20 is well above the invalidation level of $1085\n- RSI (7-period): 48.077 - neutral, not oversold\n- RSI (14-period): 53.516 - neutral\n- MACD: 11.244 - still positive but declining from 15.913\n- Recent price action shows consolidation: [1117.20 \u2192 1125.70 \u2192 1134.90 \u2192 1124.90 \u2192 1124.80 \u2192 1103.40 \u2192 1108.70 \u2192 1108.40 \u2192 1116.30 \u2192 1112.20]\n\n**Invalidation Check**: \n- Price is at $1112.20, well above $1085 invalidation level\n- EMA20 is at $1103.31, also above $1085\n- No 3-minute candle has closed below $1085\n- **Invalidation condition NOT met** \u2713\n\n**Risk Assessment**:\n- Position is only slightly underwater (-0.45%)\n- Stop loss at $1070 provides 3.8% cushion from current price\n- Liquidation price at $1042.72 is well protected\n- MACD still positive, suggesting uptrend intact despite recent weakness\n- Volume is low (2829 vs avg 9516), suggesting consolidation rather than reversal\n\n**Decision**: HOLD - The invalidation condition has not been met. Price remains above EMA20 support and the $1085 invalidation level. The slight pullback appears to be healthy consolidation within an uptrend. MACD remains positive, and we're not near stop-loss levels.\n\n## New Position Opportunities\n\n### BTC Analysis\n- **Price**: $111,551 \n- **RSI (7)**: 77.864 - overbought but not extreme\n- **RSI (14)**: 73.530 - overbought\n- **MACD**: 783.443 - very strong positive momentum\n- **Trend**: Strong uptrend, price well above EMA20 ($109,957)\n- **Assessment**: Too extended for entry. RSI overbought, would need pullback to EMA20 area around $110k for safer entry.\n\n### ETH Analysis\n- **Price**: $3,929\n- **RSI (7)**: 58.643 - neutral\n- **RSI (14)**: 59.971 - neutral\n- **MACD**: 20.684 - positive and building\n- **Trend**: Price above EMA20 ($3,892), consolidating after recent spike\n- **Assessment**: Neutral zone. Not compelling enough for entry given modest momentum.\n\n### SOL Analysis\n- **Price**: $193.88\n- **RSI (7)**: 73.932 - overbought\n- **RSI (14)**: 71.981 - overbought\n- **MACD**: 2.232 - positive\n- **Trend**: Strong uptrend, price above EMA20 ($189.74)\n- **Assessment**: Overbought conditions, would prefer pullback for entry.\n\n### XRP Analysis\n- **Price**: $2.54\n- **RSI (7)**: 95.627 - EXTREMELY overbought\n- **RSI (14)**: 87.724 - EXTREMELY overbought\n- **MACD**: 0.029 - positive but small\n- **Trend**: Parabolic move from $2.39 to $2.54 in 30 minutes\n- **Assessment**: AVOID - Extreme overbought conditions signal imminent pullback. RSI above 95 is unsustainable.\n\n### DOGE Analysis\n- **Price**: $0.19785\n- **RSI (7)**: 70.674 - overbought\n- **RSI (14)**: 66.932 - slightly overbought\n- **MACD**: 0.001 - positive but minimal\n- **Trend**: Price above EMA20 ($0.19528)\n- **Assessment**: Mildly overbought, momentum modest. Not compelling.\n\n**New Position Decision**: NONE - All coins showing overbought conditions or insufficient setup quality. BTC and XRP particularly extended. Better to preserve capital and wait for clearer opportunities.\n\n# TRADING DECISIONS\n\n```json\n{\n  \"BNB\": {\n    \"trade_signal_args\": {\n      \"coin\": \"BNB\",\n      \"signal\": \"hold\",\n      \"quantity\": 1.07,\n      \"profit_target\": 1165.0,\n      \"stop_loss\": 1070.0,\n      \"invalidation_condition\": \"If price closes below $1,085 (EMA20 support) on 3-minute candle, indicating failed breakout\",\n      \"leverage\": 15,\n      \"confidence\": 0.78,\n      \"risk_usd\": 505.0\n    }\n  }\n}\n```",
      "signals": [
        {
          "coin": "BNB",
          "signal": "hold",
          "quantity": 1.07,
          "leverage": 15,
          "stop_loss": 1070.0,
          "profit_target": 1165.0,
          "confidence": 0.78,
          "risk_usd": 505.0,
          "invalidation_condition": "If price closes below $1,085 (EMA20 support) on 3-minute candle, indicating failed breakout"
        }
      ]
    },
    {
      "iteration": 51,
      "timestamp": "2025-10-25T08:00:00",
      "model": "anthropic",
      "raw_response": "# CHAIN OF THOUGHT\n\n## Current Position Analysis\n\n**BNB Position Review:**\n- Entry: $1117.20, Current: $1115.10 (down $2.10, -0.19%)\n- Unrealized P&L: -$2.84\n- Leverage: 15x\n- Stop-loss: $1070.00 (not hit)\n- Profit target: $1165.00 (not hit)\n- Invalidation condition: \"If price closes below $1,085 (EMA20 support) on 3-minute candle\"\n\n**Technical Analysis:**\n- Current EMA20: $1104.94 - Price is ABOVE EMA20 ($1115.10 > $1104.94) \u2713\n- Price has NOT closed below $1085 invalidation level \u2713\n- RSI (7-period): 54.325 - neutral, not overbought\n- MACD: 10.128 - still positive, showing bullish momentum\n- Price action: Recent consolidation around $1108-$1116 range\n- EMA20 trending up: from $1089.85 to $1104.94 over last 30 minutes\n\n**Invalidation Check:**\nThe invalidation condition states \"closes below $1,085\". Current price is $1115.10, well above this level. The lowest recent price was $1103.40, which is still above $1085. **Invalidation condition NOT met.**\n\n**Decision Rationale:**\n- Position is slightly underwater but within normal volatility\n- All technical indicators remain constructive (price > EMA20, positive MACD)\n- No invalidation trigger hit\n- Stop-loss at $1070 provides adequate protection\n- Uptrend structure intact with higher lows forming\n- Risk/reward still favorable with profit target at $1165\n\n**Action: HOLD** - Continue monitoring position as all conditions remain valid.\n\n## Other Coins Assessment\n\n**BTC:** RSI 79.3 extremely overbought, but strong momentum. Price $111,635 well above EMA20 $110,134. However, at 22 minutes into trading with limited capital ($10,308 available), and already having one position, I should be selective. Not entering.\n\n**ETH:** RSI 65.6 reasonable, MACD positive at 20.172, price above EMA20. Decent setup but conserving capital.\n\n**SOL:** RSI 52.3 neutral, recent pullback from highs. Price dropped from $193.88 to $192.65. Not compelling enough.\n\n**XRP:** RSI 97.074 - EXTREMELY overbought, dangerous territory. While momentum is strong, this is unsustainable. Too risky to enter at these levels.\n\n**DOGE:** RSI 61.1, modest momentum. Not compelling.\n\n**Portfolio Management:**\n- Current account value: $10,384.71 (up 3.85%)\n- One position using ~$1,193 notional\n- Sharpe ratio: 3.479 (excellent risk-adjusted returns)\n- Strategy: Maintain discipline, hold quality position, avoid overtrading\n\n# TRADING DECISIONS\n\n```json\n{\n  \"BNB\": {\n    \"trade_signal_args\": {\n      \"coin\": \"BNB\",\n      \"signal\": \"hold\",\n      \"quantity\": 1.07,\n      \"profit_target\": 1165.0,\n      \"stop_loss\": 1070.0,\n      \"invalidation_condition\": \"If price closes below $1,085 (EMA20 support) on 3-minute candle, indicating failed breakout\",\n      \"leverage\": 15,\n      \"confidence\": 0.78,\n      \"risk_usd\": 505.0\n    }\n  }\n}\n```",
      "signals": [
        {
          "coin": "BNB",
          "signal": "hold",
          "quantity": 1.07,
          "leverage": 15,
          "stop_loss": 1070.0,
          "profit_target": 1165.0,
          "confidence": 0.78,
          "risk_usd": 505.0,
          "invalidation_condition": "If price closes below $1,085 (EMA20 support) on 3-minute candle, indicating failed breakout"
        }
      ]
    },
    {
      "iteration": 52,
      "timestamp": "2025-10-25T12:00:00",
      "model": "anthropic",
      "raw_response": "# CHAIN OF THOUGHT\n\n## Current Position Analysis\n\n### BNB Position Review\n- **Entry**: $1117.20 at 15x leverage\n- **Current Price**: $1108.00\n- **Unrealized P&L**: -$10.44 (-0.88%)\n- **Stop Loss**: $1070.00\n- **Profit Target**: $1165.00\n- **Invalidation Condition**: \"If price closes below $1,085 (EMA20 support) on 3-minute candle\"\n\n**Technical Analysis**:\n- Current EMA20: $1104.95 - price is above but only by $3.05\n- RSI (7-period): 38.957 - showing weakness, dropped from 54.352\n- RSI (14-period): 48.750 - below neutral 50\n- MACD: 9.514 - declining from 10.527, showing weakening momentum\n- Price action: Dropped from $1115.10 to $1108.00 in last candle\n- Volume: 3,228 vs average 9,097 - significantly below average (35% of normal)\n\n**Invalidation Check**:\nThe invalidation condition states \"below $1,085\" but current price is $1108.00. However, the price is dangerously close to EMA20 support at $1104.95. The RSI has dropped to 38.957 (oversold territory on 7-period), and momentum is clearly weakening with declining MACD.\n\n**Critical Concern**: \n- Price is only $3.05 above EMA20 support\n- RSI showing weakness (38.957)\n- Declining momentum (MACD falling)\n- Very low volume (35% of average) suggests lack of buying interest\n- Price has been rejected and is moving down\n\n**Decision**: CLOSE POSITION\nWhile the strict invalidation condition ($1,085) hasn't been hit yet, the position is showing clear signs of weakness. The price is precariously close to EMA20 support with declining momentum and oversold RSI. Given the 15x leverage, waiting for the invalidation level risks a larger loss. Risk management dictates taking the small loss now rather than risking a breakdown through support.\n\n### Other Coins Analysis\n\n**XRP**: \n- Extremely overbought with RSI (7-period) at 98.295 and RSI (14-period) at 93.376\n- Strong uptrend but at extreme levels - high risk of reversal\n- No position currently - NOT entering at these overbought levels\n\n**BTC**:\n- Price: $111,396, above EMA20 ($110,148.63)\n- RSI (7-period): 63.664 - healthy, not overbought\n- MACD: 936.413 - strong positive momentum\n- Potential opportunity but portfolio already has exposure\n\n**ETH**:\n- Price: $3,933.30, above EMA20 ($3,896.14)\n- RSI (7-period): 57.474 - neutral/healthy\n- MACD: 27.425 - positive momentum\n- Stable uptrend\n\n**SOL**:\n- Price: $191.76, above EMA20 ($190.16)\n- RSI (7-period): 40.717 - showing weakness\n- Recent pullback from $193.88\n\n**DOGE**:\n- Price: $0.196120, above EMA20 ($0.195192)\n- RSI (7-period): 37.035 - oversold\n- Weak momentum\n\n**Portfolio Decision**: Close BNB position to preserve capital and avoid further losses. With $10,308 available cash after closing, I'll reassess but given we're 23 minutes into trading with good returns (3.77% Sharpe 3.479), risk management suggests being selective rather than forcing new trades.\n\n# TRADING DECISIONS\n\n```json\n{\n  \"BNB\": {\n    \"trade_signal_args\": {\n      \"coin\": \"BNB\",\n      \"signal\": \"close_position\",\n      \"quantity\": 1.07,\n      \"profit_target\": 1165.0,\n      \"stop_loss\": 1070.0,\n      \"invalidation_condition\": \"If price closes below $1,085 (EMA20 support) on 3-minute candle\",\n      \"leverage\": 15,\n      \"confidence\": 0.78,\n      \"risk_usd\": 505.0,\n      \"close_reason\": \"Risk management - price dangerously close to EMA20 support ($1104.95) with declining momentum (MACD falling from 10.527 to 9.514), oversold RSI (38.957), and very low volume (35% of average). Taking small loss to avoid potential breakdown through support level.\"\n    }\n  }\n}\n```",
      "signals": [
        {
          "coin": "BNB",
          "signal": "close_position",
          "quantity": 1.07,
          "leverage": 15,
          "stop_loss": 1070.0,
          "profit_target": 1165.0,
          "confidence": 0.78,
          "risk_usd": 505.0,
          "invalidation_condition": "If price closes below $1,085 (EMA20 support) on 3-minute candle"
        }
      ]
    },
    {
      "iteration": 53,
      "timestamp": "2025-10-25T16:00:00",
      "model": "anthropic",
      "raw_response": "# CHAIN OF THOUGHT\n\n## Current Portfolio Status\n- No open positions\n- Available cash: $10,376.67\n- Total return: +3.77%\n- Sharpe ratio: 2.971 (excellent risk-adjusted returns)\n\n## Market Analysis by Coin\n\n### BTC Analysis\n- Current: $111,669 | EMA20: $110,413.54 (above EMA - bullish)\n- RSI(7): 72.06 (overbought but not extreme)\n- RSI(14): 71.55 (confirming overbought)\n- MACD: 781.84 (strong positive momentum, increasing)\n- Price action: Strong uptrend, +2,597 from lowest point in last 30 minutes\n- Volume: Below average (2,462 vs 6,155 avg) - concerning for sustainability\n- Assessment: Strong momentum but RSI overbought and low volume suggests potential exhaustion\n\n### ETH Analysis\n- Current: $3,957.60 | EMA20: $3,903.56 (above EMA - bullish)\n- RSI(7): 72.27 (overbought)\n- RSI(14): 67.33 (moderately overbought)\n- MACD: 26.81 (positive and increasing)\n- Price action: Recovering from dip, +67.60 from low\n- Volume: Below average (28,812 vs 74,942 avg) - low conviction\n- Assessment: Bullish but overbought with low volume\n\n### SOL Analysis\n- Current: $194.42 | EMA20: $190.42 (above EMA - bullish)\n- RSI(7): 68.51 (approaching overbought)\n- RSI(14): 67.62 (moderately overbought)\n- MACD: 2.34 (positive momentum)\n- Price action: Strong recovery +5.13 from low\n- Volume: Below average (218,770 vs 601,978 avg)\n- Assessment: Good momentum but volume concerns\n\n### BNB Analysis\n- Current: $1,115.70 | EMA20: $1,107.54 (above EMA - bullish)\n- RSI(7): 56.61 (neutral - BEST RSI reading)\n- RSI(14): 55.18 (neutral)\n- MACD: 7.15 (positive but declining)\n- Price action: Consolidating, recovering from dip\n- Volume: Below average (2,723 vs 8,968 avg)\n- Assessment: Most balanced RSI, room to run upward\n\n### XRP Analysis\n- Current: $2.60 | EMA20: $2.49 (well above EMA)\n- RSI(7): 98.46 (EXTREMELY overbought - DANGER ZONE)\n- RSI(14): 93.73 (extremely overbought)\n- MACD: 0.048 (positive and increasing)\n- Price action: Parabolic move, +$0.16 in 30 minutes (+6.5%)\n- Volume: Above average (7.7M vs 5.6M avg) - strong conviction\n- Assessment: EXTREME overbought, high risk of sharp reversal\n\n### DOGE Analysis\n- Current: $0.19726 | EMA20: $0.195523 (above EMA)\n- RSI(7): 56.38 (neutral - good entry zone)\n- RSI(14): 59.35 (neutral)\n- MACD: 0.001 (positive but flat)\n- Price action: Consolidating after recovery\n- Volume: Below average (7.9M vs 20M avg)\n- Assessment: Neutral momentum, room to move\n\n## Trading Decision Rationale\n\nGiven the market conditions:\n1. **XRP is too dangerous** - RSI 98.46 is unsustainable, high probability of sharp reversal\n2. **BTC/ETH/SOL** - All overbought with low volume, risky entries\n3. **BNB** - Best risk/reward with neutral RSI (56.61), above EMA, positive MACD\n4. **DOGE** - Neutral RSI but weak momentum and low volume\n\n**Selected Trade: BNB**\n- Most balanced technical setup\n- RSI has room to run (56.61 vs 70+ threshold)\n- Above EMA20 confirming uptrend\n- Positive MACD\n- Risk: ~$500 (5% of portfolio)\n- Entry: $1,115.70\n- Stop-loss: $1,095 (below recent consolidation low of $1,103.40, -1.85%)\n- Profit target: $1,145 (+2.6%, giving 1.4:1 reward/risk)\n- Leverage: 15x (moderate for balanced setup)\n\n# TRADING DECISIONS\n\n```json\n{\n  \"BNB\": {\n    \"trade_signal_args\": {\n      \"coin\": \"BNB\",\n      \"signal\": \"buy\",\n      \"quantity\": 6.7,\n      \"profit_target\": 1145.0,\n      \"stop_loss\": 1095.0,\n      \"invalidation_condition\": \"If price closes below $1,095 on 3-minute candle or if RSI(7) exceeds 75 indicating overbought exhaustion\",\n      \"leverage\": 15,\n      \"confidence\": 0.72,\n      \"risk_usd\": 500.0\n    }\n  }\n}\n```",
      "signals": [
        {
          "coin": "BNB",
          "signal": "buy",
          "quantity": 6.7,
          "leverage": 15,
          "stop_loss": 1095.0,
          "profit_target": 1145.0,
          "confidence": 0.72,
          "risk_usd": 500.0,
          "invalidation_condition": "If price closes below $1,095 on 3-minute candle or if RSI(7) exceeds 75 indicating overbought exhaustion"
        }
      ]
    },
    {
      "iteration": 54,
      "timestamp": "2025-10-25T20:00:00",
      "model": "anthropic",
      "raw_response": "# CHAIN OF THOUGHT\n\nReviewing my current position:\n\n**BNB Position Analysis:**\n- Entry: $1,115.70, Current: $1,116.10 (+$0.40, essentially flat)\n- Unrealized P&L: -$1.06 (negligible)\n- Stop-loss: $1,095.00 (well below current price)\n- Profit target: $1,145.00 (still $28.90 away)\n- Invalidation condition: \"If price closes below $1,095 on 3-minute candle or if RSI(7) exceeds 75 indicating overbought exhaustion\"\n\n**Checking Invalidation Conditions:**\n1. Price check: Current $1,116.10 is well above $1,095 stop-loss \u2713\n2. RSI(7) check: Current RSI(7) = 57.608, which is BELOW 75 \u2713\n3. Recent price action: Last 10 candles show consolidation around $1,108-$1,116\n4. Technical indicators:\n   - Price above EMA20 ($1,106.82) - bullish \u2713\n   - MACD declining from 15.549 to 9.013 - momentum weakening \u26a0\n   - RSI(7) at 57.608 - neutral zone, not overbought\n   - RSI(14) at 56.430 - neutral\n\n**Decision: HOLD**\n- Neither invalidation condition is met\n- Price remains above stop-loss with comfortable margin\n- RSI is in healthy neutral territory (not overbought)\n- Position is essentially breakeven, no reason to exit prematurely\n- MACD weakening is concerning but not a defined exit trigger\n- Will continue monitoring for either profit target ($1,145) or invalidation\n\n**Other Coins Analysis:**\n- **BTC**: Strong momentum (RSI 72.7, price above EMA), but already have BNB exposure. Not adding new position.\n- **ETH**: Decent setup (RSI 67.6, above EMA), but portfolio already leveraged. Pass.\n- **SOL**: Neutral (RSI 59.5), no compelling setup. Pass.\n- **XRP**: Extremely overbought (RSI 83.9, was 98.6 recently), dangerous to enter. Pass.\n- **DOGE**: Weak (RSI 43.5, declining), no setup. Pass.\n\nRisk Management: Currently using $7,477.87 notional ($497.86 actual capital at 15x leverage). Have $9,874.59 cash available. Position sizing is appropriate. Will maintain discipline and wait for BNB to hit targets or invalidation.\n\n# TRADING DECISIONS\n\n```json\n{\n  \"BNB\": {\n    \"trade_signal_args\": {\n      \"coin\": \"BNB\",\n      \"signal\": \"hold\",\n      \"quantity\": 6.7,\n      \"profit_target\": 1145.0,\n      \"stop_loss\": 1095.0,\n      \"invalidation_condition\": \"If price closes below $1,095 on 3-minute candle or if RSI(7) exceeds 75 indicating overbought exhaustion\",\n      \"leverage\": 15,\n      \"confidence\": 0.72,\n      \"risk_usd\": 500.0\n    }\n  }\n}\n```",
      "signals": [
        {
          "coin": "BNB",
          "signal": "hold",
          "quantity": 6.7,
          "leverage": 15,
          "stop_loss": 1095.0,
          "profit_target": 1145.0,
          "confidence": 0.72,
          "risk_usd": 500.0,
          "invalidation_condition": "If price closes below $1,095 on 3-minute candle or if RSI(7) exceeds 75 indicating overbought exhaustion"
        }
      ]
    },
    {
      "iteration": 55,
      "timestamp": "2025-10-26T00:00:00",
      "model": "anthropic",
      "raw_response": "# CHAIN OF THOUGHT\n\n## Current Position Analysis\n\n### BNB Position Review\n- **Entry**: $1,115.70 | **Current**: $1,116.60 | **PnL**: +$2.29 (+0.08%)\n- **Stop-Loss**: $1,095.00 | **Profit Target**: $1,145.00\n- **Invalidation Condition**: \"If price closes below $1,095 on 3-minute candle or if RSI(7) exceeds 75 indicating overbought exhaustion\"\n\n**Technical Analysis**:\n- Current RSI(7): 58.942 - Well below the 75 overbought threshold\n- Price: $1,116.60 - Well above stop-loss at $1,095\n- MACD: 8.374 - Declining from 13.410 but still positive\n- EMA20: $1,108.01 - Price above EMA, maintaining bullish structure\n- Recent price action: Consolidating between $1,108-$1,116 range\n\n**Invalidation Check**:\n- \u2705 Price NOT below $1,095 (currently $1,116.60)\n- \u2705 RSI(7) NOT exceeding 75 (currently 58.942)\n- **Invalidation condition NOT met**\n\n**Decision**: **HOLD** - Position remains valid. Price is consolidating above support with healthy RSI levels. No exit conditions triggered. The position has minimal profit but shows stability above entry with room to run toward the $1,145 profit target.\n\n## Other Coins Analysis\n\n### BTC\n- Price: $111,271 | RSI(7): 44.918 (neutral-bearish)\n- Sharp drop from $111,683 to $111,271 in latest candle\n- RSI dropped from 72.836 to 44.918 - significant momentum loss\n- MACD declining: 894.853\n- **No position, not entering** - Momentum weakening after recent rally\n\n### ETH\n- Price: $3,931.30 | RSI(7): 43.967 (neutral-bearish)\n- Pullback from $3,957.60 high\n- RSI dropped from 67.554 to 43.967 - losing momentum\n- **No position, not entering** - Consolidation phase\n\n### SOL\n- Price: $192.91 | RSI(7): 48.349 (neutral)\n- Trading above EMA20 ($190.47) but showing indecision\n- **No position, not entering** - Neutral setup\n\n### XRP\n- Price: $2.60 | RSI(7): 85.824 (extremely overbought)\n- RSI(14): 88.845 - Dangerously overbought\n- Strong rally but at risk of exhaustion\n- **No position, not entering** - Too extended for entry\n\n### DOGE\n- Price: $0.1949 | RSI(7): 27.751 (oversold)\n- Sharp decline, now below EMA20 ($0.19528)\n- RSI(14): 42.024 - Bearish momentum\n- **No position, not entering** - Downtrend in progress\n\n## Risk Management Summary\n- Current account value: $10,375.63\n- Available cash: $9,874.59\n- Single position (BNB) with $7,481 notional exposure\n- Position is stable with clear exit plan\n- Sharpe ratio: 2.971 (excellent risk-adjusted returns)\n\n# TRADING DECISIONS\n\n```json\n{\n  \"BNB\": {\n    \"trade_signal_args\": {\n      \"coin\": \"BNB\",\n      \"signal\": \"hold\",\n      \"quantity\": 6.7,\n      \"profit_target\": 1145.0,\n      \"stop_loss\": 1095.0,\n      \"invalidation_condition\": \"If price closes below $1,095 on 3-minute candle or if RSI(7) exceeds 75 indicating overbought exhaustion\",\n      \"leverage\": 15,\n      \"confidence\": 0.72,\n      \"risk_usd\": 500.0\n    }\n  }\n}\n```",
      "signals": [
        {
          "coin": "BNB",
          "signal": "hold",
          "quantity": 6.7,
          "leverage": 15,
          "stop_loss": 1095.0,
          "profit_target": 1145.0,
          "confidence": 0.72,
          "risk_usd": 500.0,
          "invalidation_condition": "If price closes below $1,095 on 3-minute candle or if RSI(7) exceeds 75 indicating overbought exhaustion"
        }
      ]
    },
    {
      "iteration": 56,
      "timestamp": "2025-10-26T04:00:00",
      "model": "anthropic",
      "raw_response": "# CHAIN OF THOUGHT\n\n## Current Position Analysis\n\n**BNB Position Review:**\n- Entry: $1,115.70 | Current: $1,120.00 | Unrealized P&L: +$25.07 (+0.39%)\n- Leverage: 15x | Notional: $7,504\n- Profit Target: $1,145.00 (still $25 away)\n- Stop Loss: $1,095.00 (safe, $25 below current)\n- Invalidation Condition: \"If price closes below $1,095 on 3-minute candle or if RSI(7) exceeds 75 indicating overbought exhaustion\"\n\n**Checking Invalidation Conditions:**\n1. Price check: Current $1,120 is well above $1,095 \u2713\n2. RSI(7) check: Current RSI(7) = 68.032, which is below 75 threshold \u2713\n3. Recent price action: Last 10 candles show consolidation around $1,108-$1,120\n4. Technical indicators:\n   - Price above EMA20 ($1,111.26) - bullish \u2713\n   - MACD positive at 5.538 - momentum intact \u2713\n   - RSI(14) at 59.488 - healthy, not overbought \u2713\n   - Volume lower than average (2,007 vs 7,897) - consolidation phase\n\n**Decision: HOLD BNB**\n- No invalidation conditions triggered\n- Position showing small profit with room to run to $1,145 target\n- Technical structure remains bullish with price above EMA20\n- RSI has room before overbought territory\n- Risk management intact with stop-loss well positioned\n\n## Other Coins Assessment\n\n**XRP Analysis:**\n- Current: $2.62 | RSI(7): 90.990 - EXTREMELY OVERBOUGHT\n- RSI(14): 90.975 - Also extremely overbought\n- Price surging from $2.50 to $2.62 in last 30 minutes\n- MACD accelerating upward (0.058)\n- This is a parabolic move but RSI >90 suggests imminent pullback risk\n- **Decision: NO ENTRY** - Too risky to chase at these extreme levels\n\n**BTC Analysis:**\n- Current: $111,756 | RSI(7): 65.513 - Moderate\n- Price above EMA20 ($110,729.88) with positive MACD\n- Uptrend intact but already 25 minutes into trading session\n- **Decision: NO ENTRY** - Prefer to focus on existing position\n\n**ETH, SOL, DOGE Analysis:**\n- All showing moderate technical readings\n- ETH: RSI(7) 60.4, above EMA20 - neutral\n- SOL: RSI(7) 58.7, above EMA20 - neutral  \n- DOGE: RSI(7) 52.9, slight uptrend - neutral\n- **Decision: NO ENTRY** - No compelling setups, managing existing BNB position\n\n## Risk Management\n- Current account value: $10,399.93 (+4.00% return)\n- Available cash: $9,874.59\n- Single position exposure: $7,504 (72% of account value)\n- Sharpe ratio: 2.971 - excellent risk-adjusted returns\n- Strategy: Maintain discipline, let BNB position work toward profit target\n\n# TRADING DECISIONS\n\n```json\n{\n  \"BNB\": {\n    \"trade_signal_args\": {\n      \"coin\": \"BNB\",\n      \"signal\": \"hold\",\n      \"quantity\": 6.7,\n      \"profit_target\": 1145.0,\n      \"stop_loss\": 1095.0,\n      \"invalidation_condition\": \"If price closes below $1,095 on 3-minute candle or if RSI(7) exceeds 75 indicating overbought exhaustion\",\n      \"leverage\": 15,\n      \"confidence\": 0.72,\n      \"risk_usd\": 500.0\n    }\n  }\n}\n```",
      "signals": [
        {
          "coin": "BNB",
          "signal": "hold",
          "quantity": 6.7,
          "leverage": 15,
          "stop_loss": 1095.0,
          "profit_target": 1145.0,
          "confidence": 0.72,
          "risk_usd": 500.0,
          "invalidation_condition": "If price closes below $1,095 on 3-minute candle or if RSI(7) exceeds 75 indicating overbought exhaustion"
        }
      ]
    },
    {
      "iteration": 57,
      "timestamp": "2025-10-26T08:00:00",
      "model": "anthropic",
      "raw_response": "# CHAIN OF THOUGHT\n\nReviewing my current position:\n\n**BNB Position Analysis:**\n- Entry: $1,115.70, Current: $1,135.10 (+$19.40, +1.74%)\n- Unrealized P&L: +$126.24 (+1.66% of account)\n- Profit Target: $1,145.00 (only $9.90 away, 0.87% from current)\n- Stop Loss: $1,095.00 (well below current price)\n- Invalidation Condition: \"If price closes below $1,095 on 3-minute candle or if RSI(7) exceeds 75 indicating overbought exhaustion\"\n\n**Checking Invalidation Condition:**\n- Current RSI(7): 86.271 - **SIGNIFICANTLY EXCEEDS 75 threshold**\n- RSI(14): 71.257 - also elevated but below 75\n- Price: $1,135.10 - well above $1,095 stop-loss\n\n**Critical Analysis:**\nThe invalidation condition is MET. RSI(7) at 86.271 is well above the 75 threshold I set for \"overbought exhaustion.\" This is a clear signal that the position should be closed according to my own exit plan.\n\n**Technical Confirmation:**\n- RSI(7) has spiked from 67.763 to 86.271 in one candle - extreme overbought\n- Price jumped $15.10 in last candle - parabolic move\n- MACD jumped from 1.304 to 2.783 - momentum surge but unsustainable\n- Price is only $9.90 from profit target but RSI suggests exhaustion\n\n**Decision: CLOSE POSITION**\nReason: Invalidation condition met - RSI(7) at 86.271 exceeds the 75 threshold indicating overbought exhaustion. While the position is profitable and near the profit target, my predefined exit rule has been triggered. This protects against a potential sharp reversal from extreme overbought conditions.\n\n**Other Coins Analysis:**\n- **BTC**: RSI(7) 86.757 - extremely overbought, but no position\n- **ETH**: RSI(7) 85.973 - extremely overbought, but no position  \n- **SOL**: RSI(7) 81.663 - overbought, but no position\n- **XRP**: RSI(7) 94.001 - dangerously overbought, but no position\n- **DOGE**: RSI(7) 80.480 - overbought, but no position\n\nAll coins are showing extreme overbought conditions on RSI(7). This is NOT the time to enter new positions. The market appears to be in a parabolic phase that could reverse sharply. With my account up 5.08% and a strong Sharpe ratio of 2.971, the prudent decision is to close my BNB position per the invalidation rule and stay in cash until conditions normalize.\n\n# TRADING DECISIONS\n\n```json\n{\n  \"BNB\": {\n    \"trade_signal_args\": {\n      \"coin\": \"BNB\",\n      \"signal\": \"close_position\",\n      \"quantity\": 6.7,\n      \"profit_target\": 1145.0,\n      \"stop_loss\": 1095.0,\n      \"invalidation_condition\": \"If price closes below $1,095 on 3-minute candle or if RSI(7) exceeds 75 indicating overbought exhaustion\",\n      \"leverage\": 15,\n      \"confidence\": 0.72,\n      \"risk_usd\": 500.0,\n      \"close_reason\": \"Invalidation condition met - RSI(7) at 86.271 exceeds 75 threshold indicating overbought exhaustion. Taking profits at +1.74% to protect gains before potential reversal.\"\n    }\n  }\n}\n```",
      "signals": [
        {
          "coin": "BNB",
          "signal": "close_position",
          "quantity": 6.7,
          "leverage": 15,
          "stop_loss": 1095.0,
          "profit_target": 1145.0,
          "confidence": 0.72,
          "risk_usd": 500.0,
          "invalidation_condition": "If price closes below $1,095 on 3-minute candle or if RSI(7) exceeds 75 indicating overbought exhaustion"
        }
      ]
    },
    {
      "iteration": 58,
      "timestamp": "2025-10-26T12:00:00",
      "model": "anthropic",
      "raw_response": "# CHAIN OF THOUGHT\n\n## Current Portfolio Status\n- No open positions\n- Available cash: $10,495.37\n- Total return: 4.95%\n- Sharpe ratio: 3.671 (excellent risk-adjusted returns)\n\n## Market Analysis\n\n### BTC Analysis\n- Current price: $113,734 (up strongly)\n- RSI(7): 89.2 - EXTREMELY overbought\n- RSI(14): 83.6 - Very overbought\n- MACD: 814.157 - Strong bullish momentum but accelerating\n- Price well above EMA20 ($111,346) - extended move\n- Recent surge from $111,057 to $113,734 in 30 minutes (+2.4%)\n\n**Assessment**: While momentum is strong, RSI above 89 indicates extreme overbought conditions. High risk of pullback. Would need tight stop-loss if entering.\n\n### ETH Analysis\n- Current price: $4,074.90 (strong rally)\n- RSI(7): 89.0 - EXTREMELY overbought\n- RSI(14): 82.1 - Very overbought\n- MACD: 36.064 - Strong positive momentum\n- Price above EMA20 ($3,944.59) - extended\n- Recent surge from $3,921.80 to $4,074.90 (+3.9%)\n\n**Assessment**: Similar to BTC - extreme overbought conditions. Strong momentum but dangerous entry point.\n\n### SOL Analysis\n- Current price: $199.44\n- RSI(7): 86.0 - Very overbought\n- RSI(14): 78.8 - Overbought\n- MACD: 1.958 - Positive momentum\n- Price above EMA20 ($193.15)\n- Rally from $191.76 to $199.44 (+4.0%)\n\n**Assessment**: Overbought but slightly less extreme than BTC/ETH.\n\n### BNB Analysis\n- Current price: $1,133.50\n- RSI(7): 80.0 - Overbought\n- RSI(14): 70.2 - Moderately overbought\n- MACD: 6.398 - Positive\n- Price above EMA20 ($1,116.18)\n\n**Assessment**: Least overbought of the major coins, but still extended.\n\n### XRP Analysis\n- Current price: $2.64\n- RSI(7): 84.6 - Very overbought (was 99+ earlier)\n- RSI(14): 88.5 - Very overbought\n- MACD: 0.061 - Positive momentum\n- Strong uptrend from $2.54 to $2.64\n\n**Assessment**: Cooling from extreme levels but still very overbought.\n\n### DOGE Analysis\n- Current price: $0.202990\n- RSI(7): 83.6 - Very overbought\n- RSI(14): 76.4 - Overbought\n- MACD: 0.001 - Positive\n- Rally from $0.194900 to $0.202990 (+4.1%)\n\n**Assessment**: Strong momentum but overbought.\n\n## Trading Decision\n\n**DECISION: NO NEW POSITIONS**\n\n**Rationale:**\n1. **Extreme Overbought Conditions**: All coins showing RSI(7) above 80, with BTC and ETH near 90. This indicates parabolic moves that typically precede sharp corrections.\n\n2. **Risk Management**: With a 4.95% return and excellent Sharpe ratio of 3.671, preserving capital is paramount. Entering at these extreme levels would risk giving back gains.\n\n3. **Lack of Safe Entry Points**: No clear support levels or pullbacks to enter with favorable risk/reward ratios. Would need very tight stop-losses that could easily get triggered by normal volatility.\n\n4. **Market Phase**: This appears to be a late-stage momentum surge. Better to wait for:\n   - RSI to cool below 70\n   - A healthy pullback to EMA20 levels\n   - MACD to show consolidation or reset\n\n5. **Patience Over FOMO**: The best trade right now is no trade. Waiting for better setups will preserve our strong performance metrics.\n\n# TRADING DECISIONS\n\n{}",
      "signals": []
    },
    {
      "iteration": 59,
      "timestamp": "2025-10-26T16:00:00",
      "model": "anthropic",
      "raw_response": "# CHAIN OF THOUGHT\n\n## Current Portfolio Status\n- No open positions\n- Available cash: $10,495.37\n- Total return: 4.95%\n- Sharpe ratio: 3.671 (excellent risk-adjusted returns)\n\n## Market Analysis by Coin\n\n### BTC Analysis\n- Current price: $113,637 (up strongly from $111,551)\n- Price above EMA20 ($111,651.78) - bullish\n- RSI(7): 84.446 - EXTREMELY overbought\n- RSI(14): 80.724 - overbought\n- MACD: 778.263 and rising strongly - bullish momentum\n- Recent surge from $111,271 to $113,734 (+2.2% in minutes)\n- **Concern**: RSI at extreme levels suggests potential pullback imminent\n- **Decision**: TOO RISKY - waiting for pullback or consolidation\n\n### ETH Analysis\n- Current price: $4,067.30 (up from $3,929)\n- Price above EMA20 ($3,958.17) - bullish\n- RSI(7): 82.939 - extremely overbought\n- RSI(14): 78.620 - overbought\n- MACD: 38.751 and rising - strong bullish momentum\n- Similar pattern to BTC - strong surge but overbought\n- **Decision**: TOO RISKY - extreme RSI levels\n\n### SOL Analysis\n- Current price: $198.79 (up from $191.76)\n- Price above EMA20 ($194.11) - bullish\n- RSI(7): 76.503 - overbought but cooling from 85.947\n- RSI(14): 73.106 - moderately overbought\n- MACD: 1.606 and rising - bullish\n- **Decision**: POTENTIAL ENTRY - RSI cooling from extremes, still in uptrend\n\n### BNB Analysis\n- Current price: $1,126.20 (recovering from dip)\n- Price above EMA20 ($1,122.00) - neutral/slightly bullish\n- RSI(7): 54.603 - NEUTRAL (dropped from 86.401)\n- RSI(14): 55.840 - neutral\n- MACD: -0.046 (near zero, turning positive)\n- Recent spike to $1,135.10 followed by pullback\n- **Decision**: PASS - unclear direction, weak momentum\n\n### XRP Analysis\n- Current price: $2.61 (pullback from $2.65)\n- Price above EMA20 ($2.55) - bullish\n- RSI(7): 51.964 - NEUTRAL (crashed from 99.071!)\n- RSI(14): 68.320 - still elevated but cooling\n- MACD: 0.056 - positive but flattening\n- Massive RSI cooldown suggests exhaustion\n- **Decision**: PASS - potential reversal after extreme run\n\n### DOGE Analysis\n- Current price: $0.201760 (up from $0.194900)\n- Price above EMA20 ($0.197811) - bullish\n- RSI(7): 69.053 - moderately overbought but cooling\n- RSI(14): 67.537 - moderately overbought\n- MACD: 0.001 - positive and rising\n- Strong recovery from $0.194900 low\n- **Decision**: POTENTIAL ENTRY - good momentum, RSI not extreme\n\n## Trading Decision Rationale\n\nGiven the market conditions:\n1. BTC and ETH are too overbought for safe entry\n2. XRP showing exhaustion after parabolic move\n3. BNB lacks clear direction\n4. **SOL and DOGE** show the best risk/reward:\n   - Both in uptrends with cooling RSI\n   - MACD positive and rising\n   - Price above EMA20\n   - Not at extreme overbought levels\n\nI'll enter **SOL** as primary position (stronger momentum) with conservative sizing given overall market overbought conditions.\n\n# TRADING DECISIONS\n\n```json\n{\n  \"SOL\": {\n    \"trade_signal_args\": {\n      \"coin\": \"SOL\",\n      \"signal\": \"buy\",\n      \"quantity\": 26,\n      \"profit_target\": 205.50,\n      \"stop_loss\": 195.00,\n      \"invalidation_condition\": \"If price closes below $195.00 on 3-minute candle or RSI(7) drops below 40\",\n      \"leverage\": 15,\n      \"confidence\": 0.72,\n      \"risk_usd\": 525.00\n    }\n  }\n}\n```",
      "signals": [
        {
          "coin": "SOL",
          "signal": "buy",
          "quantity": 26.0,
          "leverage": 15,
          "stop_loss": 195.0,
          "profit_target": 205.5,
          "confidence": 0.72,
          "risk_usd": 525.0,
          "invalidation_condition": "If price closes below $195.00 on 3-minute candle or RSI(7) drops below 40"
        }
      ]
    },
    {
      "iteration": 60,
      "timestamp": "2025-10-26T20:00:00",
      "model": "anthropic",
      "raw_response": "# CHAIN OF THOUGHT\n\n## Current Position Analysis\n\n**SOL Position Review:**\n- Entry: $198.79, Current: $200.05 (+0.63%)\n- Unrealized P&L: +$30.18 (positive)\n- Leverage: 15x\n- Exit Plan: Profit target $205.50, Stop-loss $195.00\n- Invalidation: \"If price closes below $195.00 on 3-minute candle or RSI(7) drops below 40\"\n\n**Technical Analysis:**\n- Current price: $200.05 (above entry, trending up)\n- RSI(7): 81.699 (overbought but well above 40 threshold)\n- RSI(14): 76.567 (confirming overbought)\n- MACD: 1.857 (positive and increasing)\n- Price vs EMA20: $200.05 vs $194.69 (strong bullish divergence)\n- Recent price action: Steady climb from $192.65 to $200.05\n\n**Invalidation Check:**\n1. Price below $195.00? NO - current at $200.05\n2. RSI(7) below 40? NO - current at 81.699\n3. Stop-loss hit ($195.00)? NO - well above\n4. Profit target hit ($205.50)? NO - not yet reached\n\n**Decision Rationale:**\nThe SOL position is performing well with strong momentum. RSI is extremely overbought (81.7), which typically signals potential for a pullback, but the invalidation condition has NOT been met. The price is $5.45 away from the profit target and $5.05 above the stop-loss, giving us a favorable risk/reward position. MACD continues to strengthen, and the price is well above the EMA20, confirming the uptrend.\n\nHowever, the extreme RSI levels (81.7 on 7-period, 76.6 on 14-period) suggest we're at risk of a near-term reversal. With 15x leverage, this position is highly sensitive to price movements. Given that we're up $30 and the invalidation conditions are not met, I will HOLD but remain vigilant.\n\n**Other Coins Assessment:**\n- **BTC**: RSI(7) at 90.863 - extremely overbought, dangerous entry point\n- **ETH**: RSI(7) at 91.977 - extremely overbought, dangerous entry point  \n- **BNB**: RSI(7) at 73.134 - overbought but less extreme\n- **XRP**: RSI(7) at 70.165 - moderately overbought\n- **DOGE**: RSI(7) at 82.222 - overbought\n\nAll coins are showing overbought conditions. With limited capital ($10,148) and one profitable position already open, I will not open new positions at these elevated levels. The risk of buying into overbought markets with high leverage is too great.\n\n# TRADING DECISIONS\n\n```json\n{\n  \"SOL\": {\n    \"trade_signal_args\": {\n      \"coin\": \"SOL\",\n      \"signal\": \"hold\",\n      \"quantity\": 26.0,\n      \"profit_target\": 205.50,\n      \"stop_loss\": 195.00,\n      \"invalidation_condition\": \"If price closes below $195.00 on 3-minute candle or RSI(7) drops below 40\",\n      \"leverage\": 15,\n      \"confidence\": 0.72,\n      \"risk_usd\": 525.0\n    }\n  }\n}\n```",
      "signals": [
        {
          "coin": "SOL",
          "signal": "hold",
          "quantity": 26.0,
          "leverage": 15,
          "stop_loss": 195.0,
          "profit_target": 205.5,
          "confidence": 0.72,
          "risk_usd": 525.0,
          "invalidation_condition": "If price closes below $195.00 on 3-minute candle or RSI(7) drops below 40"
        }
      ]
    },
    {
      "iteration": 61,
      "timestamp": "2025-10-27T00:00:00",
      "model": "anthropic",
      "raw_response": "# CHAIN OF THOUGHT\n\n## Current Position Analysis\n\n**SOL Position Review:**\n- Entry: $198.79, Current: $204.39 (+2.82%)\n- Unrealized P&L: +$143.02 (+2.69% of position value)\n- Profit Target: $205.50 (only $1.11 away - 0.54%)\n- Stop Loss: $195.00\n- Invalidation: \"If price closes below $195.00 on 3-minute candle or RSI(7) drops below 40\"\n\n**Technical Analysis:**\n- Current RSI(7): 90.921 - EXTREMELY overbought (well above 70, approaching exhaustion)\n- RSI(14): 84.509 - Also very overbought\n- MACD: 2.367 - Positive and rising, showing strong momentum\n- Price vs EMA20: $204.39 vs $195.63 (+4.48% above) - significant extension\n- Recent price action: Strong rally from $191.76 to $204.39 (+6.58% in 30 minutes)\n\n**Invalidation Check:**\n- Price is NOT below $195.00 \u2713\n- RSI(7) is 90.921, NOT below 40 \u2713\n- Invalidation condition is NOT met\n\n**Decision Rationale:**\nThe position is very close to profit target ($1.11 away, less than 1%). However, RSI(7) at 90.921 indicates extreme overbought conditions that typically precede pullbacks. The momentum is strong (MACD rising), but the risk/reward at this level is poor - we're risking $9.39 to gain $1.11.\n\nGiven:\n1. Profit target nearly reached (99.5% of the way there)\n2. Extreme RSI readings suggesting imminent reversal risk\n3. Strong unrealized gains (+$143)\n4. Price extended 4.48% above EMA20\n5. No invalidation condition met yet\n\n**DECISION: CLOSE POSITION** - Take profits proactively. While invalidation isn't technically met, the extreme overbought RSI (90.921) and proximity to profit target (99.5% achieved) make this an optimal exit point. Waiting for the exact $205.50 target risks giving back gains on a pullback from these extreme levels.\n\n## Other Coins Assessment\n\n**BTC:** RSI(7) 92.759 - Extremely overbought, price at $115,050 extended far above EMA20 ($112,246). Too risky to enter at these levels.\n\n**ETH:** RSI(7) 94.042 - Even more overbought than BTC. Price $4,206 vs EMA20 $3,997 (+5.2% extension). No entry.\n\n**BNB:** RSI(7) 83.345 - Overbought but less extreme. However, already missed the entry opportunity.\n\n**XRP:** RSI(7) 59.805 - Most reasonable RSI level, but MACD momentum weakening. Price consolidating. No clear setup.\n\n**DOGE:** RSI(7) 84.698 - Overbought. Late to the move.\n\nAll coins showing overbought conditions. No new entries warranted at current levels.\n\n# TRADING DECISIONS\n\n```json\n{\n  \"SOL\": {\n    \"trade_signal_args\": {\n      \"coin\": \"SOL\",\n      \"signal\": \"close_position\",\n      \"quantity\": 26.0,\n      \"profit_target\": 205.5,\n      \"stop_loss\": 195.0,\n      \"invalidation_condition\": \"If price closes below $195.00 on 3-minute candle or RSI(7) drops below 40\",\n      \"leverage\": 15,\n      \"confidence\": 0.72,\n      \"risk_usd\": 525.0,\n      \"close_reason\": \"Taking profits - 99.5% of profit target achieved with extreme RSI(7) at 90.921 indicating high reversal risk. Locking in +$143 gain rather than risking pullback from overbought levels.\"\n    }\n  }\n}\n```",
      "signals": [
        {
          "coin": "SOL",
          "signal": "close_position",
          "quantity": 26.0,
          "leverage": 15,
          "stop_loss": 195.0,
          "profit_target": 205.5,
          "confidence": 0.72,
          "risk_usd": 525.0,
          "invalidation_condition": "If price closes below $195.00 on 3-minute candle or RSI(7) drops below 40"
        }
      ]
    },
    {
      "iteration": 62,
      "timestamp": "2025-10-27T04:00:00",
      "model": "anthropic",
      "raw_response": "# CHAIN OF THOUGHT\n\n## Current Portfolio Status\n- No open positions\n- Available cash: $10,633.15\n- Total return: +6.33%\n- Sharpe ratio: 4.464 (excellent risk-adjusted returns)\n\n## Market Analysis\n\n**BTC Analysis:**\n- Current: $115,566 | EMA20: $112,611 (strong uptrend, +2.6% above EMA)\n- RSI(7): 94.48 - EXTREMELY overbought (danger zone)\n- RSI(14): 89.54 - Also extremely overbought\n- MACD: 1090.92 - Strong positive momentum but at extreme levels\n- Price action: Parabolic move from $111,669 to $115,566 in 30 minutes (+3.5%)\n- **Assessment:** While trend is strong, RSI above 90 signals exhaustion. High risk of sharp pullback. NOT entering at these extreme levels.\n\n**ETH Analysis:**\n- Current: $4,203.80 | EMA20: $4,021 (+4.5% above EMA)\n- RSI(7): 92.44 - Extremely overbought\n- RSI(14): 88.23 - Also extremely overbought\n- MACD: 67.03 - Strong momentum\n- Similar parabolic pattern to BTC\n- **Assessment:** Same issue - too extended. Waiting for pullback.\n\n**SOL Analysis:**\n- Current: $202.49 | EMA20: $196.28 (+3.2% above EMA)\n- RSI(7): 70.26 - Overbought but not extreme\n- RSI(14): 72.16 - Moderately overbought\n- MACD: 2.62 - Positive momentum\n- Recent pullback from $204.39 to $202.49\n- **Assessment:** Most reasonable entry of the majors. RSI cooling from 90+ levels. Could enter with tight stops.\n\n**BNB Analysis:**\n- Current: $1,156.70 | EMA20: $1,129.94 (+2.4% above EMA)\n- RSI(7): 86.12 - Very overbought\n- RSI(14): 78.11 - Overbought\n- MACD: 4.18 - Positive and accelerating\n- Strong rally from $1,115 to $1,156 (+3.7%)\n- **Assessment:** Extended but less extreme than BTC/ETH. Possible entry but risky.\n\n**XRP Analysis:**\n- Current: $2.63 | EMA20: $2.57 (+2.3% above EMA)\n- RSI(7): 54.74 - NEUTRAL (best RSI reading)\n- RSI(14): 66.46 - Slightly overbought but healthy\n- MACD: 0.054 - Positive but modest\n- Consolidating after recent spike\n- **Assessment:** Most attractive risk/reward. RSI reset from extreme levels. Good entry opportunity.\n\n**DOGE Analysis:**\n- Current: $0.20613 | EMA20: $0.19998 (+3.1% above EMA)\n- RSI(7): 76.22 - Overbought\n- RSI(14): 74.75 - Overbought\n- MACD: 0.002 - Positive momentum\n- Strong rally from $0.1949 to $0.2068 (+6.1%)\n- **Assessment:** Extended but showing strength. Meme coin volatility risk.\n\n## Trading Decision\n\nGiven the extreme overbought conditions across most assets (BTC and ETH with RSI >90), I'm being selective. The market has rallied hard in the last 30 minutes and is due for consolidation or pullback.\n\n**Best opportunity: XRP**\n- Only coin with neutral RSI(7) at 54.74\n- RSI has cooled from 100 to 54, indicating healthy consolidation\n- Still in uptrend (price above EMA20)\n- MACD positive\n- Lower risk entry compared to others\n\nI'll enter XRP with conservative position sizing (15% of capital = ~$1,595) at 15x leverage for $23,925 exposure.\n\nRisk management:\n- Stop-loss: 2% below entry at $2.58 (just below recent support)\n- Profit target: $2.75 (+4.6% move)\n- Invalidation: Break below EMA20 at $2.57\n\n# TRADING DECISIONS\n\n```json\n{\n  \"XRP\": {\n    \"trade_signal_args\": {\n      \"coin\": \"XRP\",\n      \"signal\": \"buy\",\n      \"quantity\": 9100,\n      \"profit_target\": 2.75,\n      \"stop_loss\": 2.58,\n      \"invalidation_condition\": \"If price closes below EMA20 at $2.57 on 3-minute candle\",\n      \"leverage\": 15,\n      \"confidence\": 0.72,\n      \"risk_usd\": 455\n    }\n  }\n}\n```",
      "signals": [
        {
          "coin": "XRP",
          "signal": "buy",
          "quantity": 9100.0,
          "leverage": 15,
          "stop_loss": 2.58,
          "profit_target": 2.75,
          "confidence": 0.72,
          "risk_usd": 455.0,
          "invalidation_condition": "If price closes below EMA20 at $2.57 on 3-minute candle"
        }
      ]
    },
    {
      "iteration": 63,
      "timestamp": "2025-10-27T08:00:00",
      "model": "anthropic",
      "raw_response": "# CHAIN OF THOUGHT\n\nReviewing my current XRP position and market conditions:\n\n**XRP Position Analysis:**\n- Entry: $2.6293, Current: $2.6253\n- Unrealized P&L: -$48.36 (-0.15%)\n- Leverage: 15x\n- Exit Plan: Profit target $2.75, Stop-loss $2.58\n- Invalidation: \"If price closes below EMA20 at $2.57 on 3-minute candle\"\n\n**Checking Invalidation Condition:**\n- Current EMA20: $2.58\n- Current Price: $2.63\n- Price is ABOVE EMA20 ($2.63 > $2.58) \u2713\n- Invalidation condition NOT met - position remains valid\n\n**Technical Analysis:**\n- RSI (7-period): 50.243 - neutral, down from overbought levels\n- RSI (14-period): 63.136 - healthy pullback from 94.447\n- MACD: 0.046 - still positive but declining from 0.050\n- Price action: Consolidating around $2.63 after reaching $2.65\n- EMA20 trending up: $2.51 \u2192 $2.58 (strong uptrend support)\n\n**Risk Assessment:**\n- Stop-loss at $2.58 is very close (only 1.9% away)\n- Current price $2.63 vs stop $2.58 = $0.05 buffer\n- With 15x leverage, this is tight but manageable\n- Position is essentially flat (-0.15% P&L)\n\n**Market Context:**\n- XRP showing consolidation after strong rally\n- RSI cooled from extreme overbought (94+) to neutral (50)\n- MACD still positive, indicating uptrend intact\n- Price holding above rising EMA20 support\n\n**Decision: HOLD**\nThe invalidation condition is NOT met. Price remains above EMA20 ($2.63 > $2.58), and the uptrend structure is intact. The RSI cooldown from overbought levels is healthy and doesn't signal reversal. MACD remains positive. Stop-loss and profit target remain appropriate for current market conditions.\n\n**Other Coins:**\n- BTC: RSI 84.6 (overbought), strong momentum but no position\n- ETH: RSI 65.8, cooling from 94, no position\n- SOL: RSI 51.3, neutral, no position\n- BNB: RSI 93.1 (extremely overbought), no position\n- DOGE: RSI 47.7, neutral, no position\n\nNot entering new positions due to:\n1. Already have capital deployed in XRP\n2. BTC/BNB showing extreme overbought conditions (RSI 84-93)\n3. Risk management - maintaining focused position\n4. Other coins lack compelling setups at current levels\n\n# TRADING DECISIONS\n\n```json\n{\n  \"XRP\": {\n    \"trade_signal_args\": {\n      \"coin\": \"XRP\",\n      \"signal\": \"hold\",\n      \"quantity\": 9100.0,\n      \"profit_target\": 2.75,\n      \"stop_loss\": 2.58,\n      \"invalidation_condition\": \"If price closes below EMA20 at $2.57 on 3-minute candle\",\n      \"leverage\": 15,\n      \"confidence\": 0.72,\n      \"risk_usd\": 455.0\n    }\n  }\n}\n```",
      "signals": [
        {
          "coin": "XRP",
          "signal": "hold",
          "quantity": 9100.0,
          "leverage": 15,
          "stop_loss": 2.58,
          "profit_target": 2.75,
          "confidence": 0.72,
          "risk_usd": 455.0,
          "invalidation_condition": "If price closes below EMA20 at $2.57 on 3-minute candle"
        }
      ]
    },
    {
      "iteration": 64,
      "timestamp": "2025-10-27T12:00:00",
      "model": "anthropic",
      "raw_response": "# CHAIN OF THOUGHT\n\nReviewing my current position:\n\n**XRP Position Analysis:**\n- Entry: $2.6293, Current: $2.66, Unrealized P&L: +$268.32 (+1.17%)\n- Leverage: 15x, Notional: $24,206.91\n- Exit Plan: Profit target $2.75, Stop-loss $2.58\n- Invalidation: \"If price closes below EMA20 at $2.57 on 3-minute candle\"\n\n**Checking Invalidation Condition:**\n- Current EMA20: $2.59\n- Current Price: $2.66\n- Price is ABOVE EMA20 ($2.66 > $2.59) \u2713\n- Invalidation condition NOT met\n\n**Technical Analysis:**\n- RSI (7-period): 74.125 - showing overbought but still strong momentum\n- RSI (14-period): 73.285 - confirming overbought territory\n- MACD: 0.044 - positive and stable\n- Price above EMA20 ($2.66 > $2.59) - bullish trend intact\n- Recent price action: Consolidated around $2.63, now pushing to $2.66\n\n**Risk Assessment:**\n- Stop-loss at $2.58 is $0.08 away (3% from current)\n- Profit target at $2.75 is $0.09 away (3.4% from current)\n- Position is in profit and trending toward target\n- RSI overbought suggests potential pullback risk, but momentum remains positive\n\n**Decision: HOLD**\nThe invalidation condition has NOT been met. Price remains above EMA20 ($2.59), and the uptrend is intact. While RSI shows overbought conditions, the MACD is positive and price is making progress toward the profit target. The position is profitable and all exit conditions (stop-loss, invalidation) are still valid. Will continue to hold and let the trade work toward the $2.75 target.\n\n**Other Coins:**\n- BTC, ETH, SOL: Strong uptrends but already have XRP position. Not adding new positions.\n- BNB: Sharp pullback from $1180 to $1143 (-3.1%), RSI dropped to 45.657 - bearish reversal signal\n- DOGE: Weak momentum, RSI 45.298, consolidating - no clear setup\n\nNo new positions warranted. Focus on managing existing XRP trade.\n\n# TRADING DECISIONS\n\n```json\n{\n  \"XRP\": {\n    \"trade_signal_args\": {\n      \"coin\": \"XRP\",\n      \"signal\": \"hold\",\n      \"quantity\": 9100.0,\n      \"profit_target\": 2.75,\n      \"stop_loss\": 2.58,\n      \"invalidation_condition\": \"If price closes below EMA20 at $2.57 on 3-minute candle\",\n      \"leverage\": 15,\n      \"confidence\": 0.72,\n      \"risk_usd\": 455.0\n    }\n  }\n}\n```",
      "signals": [
        {
          "coin": "XRP",
          "signal": "hold",
          "quantity": 9100.0,
          "leverage": 15,
          "stop_loss": 2.58,
          "profit_target": 2.75,
          "confidence": 0.72,
          "risk_usd": 455.0,
          "invalidation_condition": "If price closes below EMA20 at $2.57 on 3-minute candle"
        }
      ]
    },
    {
      "iteration": 65,
      "timestamp": "2025-10-27T16:00:00",
      "model": "anthropic",
      "raw_response": "# CHAIN OF THOUGHT\n\nReviewing my current position:\n\n**XRP Position Analysis:**\n- Entry: $2.6293, Current: $2.6676\n- Unrealized P&L: +$336.57 (+1.46%)\n- Profit Target: $2.75\n- Stop Loss: $2.58\n- Invalidation Condition: \"If price closes below EMA20 at $2.57 on 3-minute candle\"\n\n**Technical Check:**\n- Current EMA20: $2.60 (price is ABOVE at $2.67)\n- Price has NOT closed below $2.57\n- RSI (7-period): 77.23 - showing strong momentum but approaching overbought\n- RSI (14-period): 74.71 - confirming strength\n- MACD: 0.040 - positive and stable\n- Price action: Recent strength with move from $2.66 to $2.67\n\n**Invalidation Status:** NOT MET\n- Price is at $2.67, well above the EMA20 at $2.60\n- No close below $2.57 has occurred\n- Trend remains intact\n\n**Risk Assessment:**\n- Position is profitable and trending toward profit target ($2.75)\n- Stop loss at $2.58 provides 3.3% downside protection\n- Current price is 2.7% above invalidation level\n- RSI elevated but not extreme (77 vs previous highs of 94)\n- Volume is elevated (10.8M vs avg 6M) - confirming strength\n\n**Decision: HOLD**\nThe invalidation condition has NOT been met. Price remains above EMA20 and above the $2.57 threshold. The uptrend is intact with positive MACD and strong RSI. While RSI is elevated, it's not at extreme levels seen earlier. The position is profitable and moving toward the profit target. No reason to exit prematurely.\n\n**Other Coins:**\n- BTC, ETH, SOL, BNB, DOGE: No positions, not entering new trades at this time given existing XRP exposure and current market conditions showing some consolidation after recent rallies.\n\n# TRADING DECISIONS\n\n```json\n{\n  \"XRP\": {\n    \"trade_signal_args\": {\n      \"coin\": \"XRP\",\n      \"signal\": \"hold\",\n      \"quantity\": 9100.0,\n      \"profit_target\": 2.75,\n      \"stop_loss\": 2.58,\n      \"invalidation_condition\": \"If price closes below EMA20 at $2.57 on 3-minute candle\",\n      \"leverage\": 15,\n      \"confidence\": 0.72,\n      \"risk_usd\": 455.0\n    }\n  }\n}\n```",
      "signals": [
        {
          "coin": "XRP",
          "signal": "hold",
          "quantity": 9100.0,
          "leverage": 15,
          "stop_loss": 2.58,
          "profit_target": 2.75,
          "confidence": 0.72,
          "risk_usd": 455.0,
          "invalidation_condition": "If price closes below EMA20 at $2.57 on 3-minute candle"
        }
      ]
    },
    {
      "iteration": 66,
      "timestamp": "2025-10-27T20:00:00",
      "model": "anthropic",
      "raw_response": "# CHAIN OF THOUGHT\n\nReviewing my current position:\n\n**XRP Analysis:**\n- Current price: $2.63\n- Entry price: $2.6293\n- Unrealized PnL: +$18.07 (very small profit)\n- Position size: 9,100 XRP at 15x leverage\n- Notional: $23,956.66\n- Exit plan: Profit target $2.75, Stop-loss $2.58, Invalidation: \"If price closes below EMA20 at $2.57 on 3-minute candle\"\n\n**Checking Invalidation Condition:**\n- Current EMA20: $2.61\n- Current price: $2.63\n- Price is ABOVE EMA20 ($2.63 > $2.61) \u2713\n- Invalidation condition NOT met\n\n**Technical Analysis:**\n- RSI (7-period): 43.905 - neutral, coming down from overbought levels (was 77.187)\n- RSI (14-period): 54.480 - neutral\n- MACD: 0.034 - positive but weakening slightly\n- Price action: Recent pullback from $2.67 to $2.63 (showing weakness)\n- EMA20 trend: Rising steadily from $2.56 to $2.61\n- Price vs EMA20: Only $0.02 above EMA20 (very tight margin)\n\n**Risk Assessment:**\n- Stop-loss at $2.58 is $0.05 away (1.9% move)\n- Current price $0.04 from invalidation level at EMA20 $2.61\n- RSI showing momentum loss after strong rally\n- Price rejected at $2.67 and pulling back\n\n**Decision Rationale:**\nThe invalidation condition is technically NOT met (price still above EMA20), but the situation is concerning:\n1. Price is only $0.02 above the invalidation level\n2. RSI dropped sharply from 77 to 43 (momentum loss)\n3. Recent price action shows rejection and pullback\n4. Very small profit (+$18) with significant downside risk\n\nHowever, since the explicit invalidation condition has NOT been triggered (price has not closed below EMA20 at $2.57 - we're at $2.63 vs EMA20 $2.61), I should HOLD per the rules. The position remains valid technically.\n\n**Other Coins:**\n- BTC: Sharp RSI drop to 34.8 (oversold), but no position\n- ETH: RSI at 39.1 (oversold), but no position  \n- SOL: RSI at 36.5 (oversold), but no position\n- BNB: RSI at 40.9, but no position\n- DOGE: RSI at 27.3 (very oversold), but no position\n\nMarket showing broad weakness across all coins with RSI values in oversold territory. Not a good time to enter new positions. Will maintain XRP position as invalidation not triggered.\n\n# TRADING DECISIONS\n\n```json\n{\n  \"XRP\": {\n    \"trade_signal_args\": {\n      \"coin\": \"XRP\",\n      \"signal\": \"hold\",\n      \"quantity\": 9100.0,\n      \"profit_target\": 2.75,\n      \"stop_loss\": 2.58,\n      \"invalidation_condition\": \"If price closes below EMA20 at $2.57 on 3-minute candle\",\n      \"leverage\": 15,\n      \"confidence\": 0.72,\n      \"risk_usd\": 455.0\n    }\n  }\n}\n```",
      "signals": [
        {
          "coin": "XRP",
          "signal": "hold",
          "quantity": 9100.0,
          "leverage": 15,
          "stop_loss": 2.58,
          "profit_target": 2.75,
          "confidence": 0.72,
          "risk_usd": 455.0,
          "invalidation_condition": "If price closes below EMA20 at $2.57 on 3-minute candle"
        }
      ]
    },
    {
      "iteration": 67,
      "timestamp": "2025-10-28T00:00:00",
      "model": "anthropic",
      "raw_response": "# CHAIN OF THOUGHT\n\nReviewing my current XRP position and market conditions:\n\n**XRP Position Analysis:**\n- Entry: $2.6293, Current: $2.6299 (essentially flat, -$6.50 unrealized PnL)\n- Leverage: 15x, Notional: $23,932\n- Exit Plan: Profit target $2.75, Stop-loss $2.58\n- Invalidation: \"If price closes below EMA20 at $2.57 on 3-minute candle\"\n\n**Checking Invalidation Condition:**\n- Current EMA20: $2.61\n- Current Price: $2.63\n- Price is ABOVE EMA20 ($2.63 > $2.61) \u2713\n- Invalidation condition NOT met - position remains valid\n\n**Technical Analysis:**\n- RSI (7-period): 41.996 - neutral, not oversold\n- RSI (14-period): 52.907 - neutral zone\n- MACD: 0.030 - positive but declining from 0.034\n- Price action: Consolidating around $2.63, showing some weakness\n- Recent candles show price testing support but holding above EMA20\n- Stop-loss at $2.58 provides 1.9% cushion from current price\n\n**Risk Assessment:**\n- Position is essentially break-even (-0.03%)\n- Stop-loss not threatened (current $2.63 vs stop $2.58)\n- Profit target not near (current $2.63 vs target $2.75, need +4.6% move)\n- RSI showing neutral momentum, not extreme readings\n- MACD declining but still positive\n\n**Decision: HOLD**\nThe invalidation condition is NOT met (price remains above EMA20). While momentum has weakened (RSI dropped from 77 to 42), the position structure remains intact. Price is consolidating but hasn't broken key support levels. With 15x leverage, I need to be cautious, but there's no technical reason to exit yet. The stop-loss at $2.58 will protect against further downside.\n\n**Other Coins:**\n- BTC: RSI 30 (oversold), but sharp pullback from 115k to 113k - too risky to enter on high leverage\n- ETH: RSI 31 (oversold), similar pullback pattern - waiting for stabilization\n- SOL: RSI 62, showing recovery but no clear setup\n- BNB: RSI 39, consolidating after spike to $1180\n- DOGE: RSI 23 (very oversold), but below EMA20 - bearish structure\n\nNo new positions warranted. Market showing pullback after strong rally. Maintaining discipline with existing XRP position.\n\n# TRADING DECISIONS\n\n```json\n{\n  \"XRP\": {\n    \"trade_signal_args\": {\n      \"coin\": \"XRP\",\n      \"signal\": \"hold\",\n      \"quantity\": 9100.0,\n      \"profit_target\": 2.75,\n      \"stop_loss\": 2.58,\n      \"invalidation_condition\": \"If price closes below EMA20 at $2.57 on 3-minute candle\",\n      \"leverage\": 15,\n      \"confidence\": 0.72,\n      \"risk_usd\": 455.0\n    }\n  }\n}\n```",
      "signals": [
        {
          "coin": "XRP",
          "signal": "hold",
          "quantity": 9100.0,
          "leverage": 15,
          "stop_loss": 2.58,
          "profit_target": 2.75,
          "confidence": 0.72,
          "risk_usd": 455.0,
          "invalidation_condition": "If price closes below EMA20 at $2.57 on 3-minute candle"
        }
      ]
    },
    {
      "iteration": 68,
      "timestamp": "2025-10-28T04:00:00",
      "model": "anthropic",
      "raw_response": "# CHAIN OF THOUGHT\n\nReviewing my current position and market conditions:\n\n**XRP Position Analysis:**\n- Entry: $2.6293, Current: $2.637\n- Unrealized P&L: +$58.11 (+0.29%)\n- Leverage: 15x\n- Exit Plan: Profit target $2.75, Stop-loss $2.58\n- Invalidation: \"If price closes below EMA20 at $2.57 on 3-minute candle\"\n\n**Checking Invalidation Condition:**\n- Current EMA20: $2.62\n- Current Price: $2.64\n- Price is ABOVE EMA20 ($2.64 > $2.62)\n- EMA20 is at $2.62, not $2.57 as stated in invalidation\n- The invalidation condition specified $2.57, but current EMA20 is $2.62\n- Price has NOT closed below $2.57 - invalidation NOT met\n\n**Technical Analysis:**\n- RSI (7-period): 49.4 - neutral, not overbought/oversold\n- RSI (14-period): 55.2 - slightly bullish\n- MACD: 0.023 - positive but weakening slightly\n- Price above EMA20 ($2.64 > $2.62) - bullish\n- Recent price action: consolidating between $2.61-$2.67\n- Volume: 8.84M vs avg 6.15M - elevated volume suggests interest\n\n**Risk Assessment:**\n- Stop-loss at $2.58 is $0.06 away (2.3% from current)\n- Profit target at $2.75 is $0.11 away (4.2% from current)\n- Risk/reward ratio: favorable at ~1.8:1\n- Position is small profit, no immediate danger\n\n**Decision: HOLD**\n- Invalidation condition NOT met (price above $2.57 and above EMA20)\n- Technical indicators remain neutral to slightly bullish\n- Stop-loss provides adequate protection\n- No reason to exit prematurely\n\n**Other Coins:**\n- BTC: Strong at $114,170, RSI recovering from oversold (42.9), but no position\n- ETH: At $4,116, RSI 43.9, recovering but not compelling enough for new entry\n- SOL: Strong at $202.32, RSI 69.2, but already extended above EMA20\n- BNB: Weak at $1,131, RSI 32.4 oversold, but downtrend concerning\n- DOGE: Weak at $0.200, RSI 34.2, consolidating near EMA20\n\nNot opening new positions - prefer to manage existing XRP position and wait for clearer setups.\n\n# TRADING DECISIONS\n\n```json\n{\n  \"XRP\": {\n    \"trade_signal_args\": {\n      \"coin\": \"XRP\",\n      \"signal\": \"hold\",\n      \"quantity\": 9100.0,\n      \"profit_target\": 2.75,\n      \"stop_loss\": 2.58,\n      \"invalidation_condition\": \"If price closes below EMA20 at $2.57 on 3-minute candle\",\n      \"leverage\": 15,\n      \"confidence\": 0.72,\n      \"risk_usd\": 455.0\n    }\n  }\n}\n```",
      "signals": [
        {
          "coin": "XRP",
          "signal": "hold",
          "quantity": 9100.0,
          "leverage": 15,
          "stop_loss": 2.58,
          "profit_target": 2.75,
          "confidence": 0.72,
          "risk_usd": 455.0,
          "invalidation_condition": "If price closes below EMA20 at $2.57 on 3-minute candle"
        }
      ]
    },
    {
      "iteration": 69,
      "timestamp": "2025-10-28T08:00:00",
      "model": "anthropic",
      "raw_response": "# CHAIN OF THOUGHT\n\nReviewing my current position:\n\n**XRP Analysis:**\n- Current price: $2.64\n- Entry price: $2.6293\n- Unrealized P&L: +$86.32 (+0.41%)\n- Position size: 9,100 XRP at 15x leverage\n- Notional: $24,024.91\n\n**Exit Plan Review:**\n- Profit target: $2.75 (not reached)\n- Stop-loss: $2.58 (not hit, current price $2.64)\n- Invalidation condition: \"If price closes below EMA20 at $2.57 on 3-minute candle\"\n\n**Checking Invalidation Condition:**\n- Current EMA20: $2.62\n- Current price: $2.64\n- Price is ABOVE EMA20 ($2.64 > $2.62) \u2713\n- The invalidation specifies closing below $2.57, which has NOT occurred\n- Invalidation condition is NOT met\n\n**Technical Analysis:**\n- RSI (7-period): 52.955 - neutral territory, healthy\n- RSI (14-period): 56.633 - slightly bullish\n- MACD: 0.022 - positive but weakening slightly\n- Price above EMA20 ($2.64 > $2.62) - bullish signal\n- Recent price action: Consolidating around $2.63-$2.67 range\n- Volume: 2.68M vs average 5.96M - lower volume but not concerning\n\n**Risk Assessment:**\n- Position is slightly profitable (+$86)\n- No immediate danger signals\n- Price holding above key support at EMA20\n- RSI not overbought or oversold\n- Stop-loss at $2.58 provides 2.3% cushion from current price\n\n**Decision: HOLD**\nThe invalidation condition has not been met. Price remains above EMA20 and above the specified $2.57 invalidation level. Technical indicators show neutral-to-slightly-bullish conditions. The position is profitable and all risk parameters are intact. No reason to exit at this time.\n\n**Other Coins:**\n- BTC: Strong uptrend but already at $114,350 after recent rally. RSI cooling from overbought. No position, not entering at these elevated levels.\n- ETH: Price at $4,111, consolidating. RSI at 41.9 shows some weakness. No compelling entry.\n- SOL: Price at $199.69, choppy action. RSI 43.3 shows weakness. Not attractive.\n- BNB: Price at $1,131.80, RSI 33.5 shows oversold but below EMA20. Bearish structure, avoiding.\n- DOGE: Price at $0.19965, RSI 29.4 very oversold but below EMA20. Weak momentum, avoiding.\n\nNo new positions warranted given current market conditions and existing XRP exposure.\n\n# TRADING DECISIONS\n\n```json\n{\n  \"XRP\": {\n    \"trade_signal_args\": {\n      \"coin\": \"XRP\",\n      \"signal\": \"hold\",\n      \"quantity\": 9100.0,\n      \"profit_target\": 2.75,\n      \"stop_loss\": 2.58,\n      \"invalidation_condition\": \"If price closes below EMA20 at $2.57 on 3-minute candle\",\n      \"leverage\": 15,\n      \"confidence\": 0.72,\n      \"risk_usd\": 455.0\n    }\n  }\n}\n```",
      "signals": [
        {
          "coin": "XRP",
          "signal": "hold",
          "quantity": 9100.0,
          "leverage": 15,
          "stop_loss": 2.58,
          "profit_target": 2.75,
          "confidence": 0.72,
          "risk_usd": 455.0,
          "invalidation_condition": "If price closes below EMA20 at $2.57 on 3-minute candle"
        }
      ]
    },
    {
      "iteration": 70,
      "timestamp": "2025-10-28T12:00:00",
      "model": "anthropic",
      "raw_response": "# CHAIN OF THOUGHT\n\nReviewing my current position:\n\n**XRP Analysis:**\n- Current price: $2.64\n- Entry price: $2.6293\n- Unrealized P&L: +$40.82 (+0.22%)\n- Exit plan: Profit target $2.75, Stop-loss $2.58\n- Invalidation condition: \"If price closes below EMA20 at $2.57 on 3-minute candle\"\n\n**Checking Invalidation Condition:**\n- Current EMA20: $2.62\n- Current price: $2.64\n- Price is ABOVE EMA20 ($2.64 > $2.62)\n- The invalidation specified EMA20 at $2.57, but current EMA20 is at $2.62\n- Price has NOT closed below EMA20 - still trading above it\n- Invalidation condition is NOT met\n\n**Technical Analysis:**\n- RSI (7-period): 45.86 - neutral territory, not oversold\n- RSI (14-period): 52.58 - neutral\n- MACD: 0.016 - positive but weakening (declining from 0.022)\n- Price consolidating around $2.63-$2.64 range\n- EMA20 trending up from $2.60 to $2.62\n- Volume elevated: 14.25M vs average 6.51M\n\n**Risk Assessment:**\n- Position is slightly profitable (+$40.82)\n- Stop-loss at $2.58 is 2.3% away from current price\n- Profit target at $2.75 is 4.2% away\n- Risk/reward ratio remains favorable\n- No immediate danger signals\n\n**Decision: HOLD**\nThe invalidation condition has not been met. Price remains above EMA20 and is consolidating in a healthy range. The technical indicators show neutral momentum with no bearish reversal signals. The position is slightly profitable and the stop-loss provides adequate protection. Will continue to hold and let the trade develop toward the profit target.\n\n**Other Coins:**\n- BTC: Strong uptrend (RSI 62, price above EMA20), but already have XRP exposure. Not adding new positions.\n- ETH: Showing weakness (RSI 34.7, MACD declining), bearish signals. Not entering.\n- SOL: Consolidating (RSI 37.6), no clear setup. Not entering.\n- BNB: Neutral (RSI 43), no compelling signal. Not entering.\n- DOGE: Weak (RSI 28.9, oversold), but no clear reversal yet. Not entering.\n\n# TRADING DECISIONS\n\n```json\n{\n  \"XRP\": {\n    \"trade_signal_args\": {\n      \"coin\": \"XRP\",\n      \"signal\": \"hold\",\n      \"quantity\": 9100.0,\n      \"profit_target\": 2.75,\n      \"stop_loss\": 2.58,\n      \"invalidation_condition\": \"If price closes below EMA20 at $2.57 on 3-minute candle\",\n      \"leverage\": 15,\n      \"confidence\": 0.72,\n      \"risk_usd\": 455.0\n    }\n  }\n}\n```",
      "signals": [
        {
          "coin": "XRP",
          "signal": "hold",
          "quantity": 9100.0,
          "leverage": 15,
          "stop_loss": 2.58,
          "profit_target": 2.75,
          "confidence": 0.72,
          "risk_usd": 455.0,
          "invalidation_condition": "If price closes below EMA20 at $2.57 on 3-minute candle"
        }
      ]
    },
    {
      "iteration": 71,
      "timestamp": "2025-10-28T16:00:00",
      "model": "anthropic",
      "raw_response": "# CHAIN OF THOUGHT\n\nReviewing my current position:\n\n**XRP Position Analysis:**\n- Entry: $2.6293, Current: $2.6397 (+$82.68 unrealized PnL, +0.4%)\n- Profit Target: $2.75 (not reached)\n- Stop Loss: $2.58 (not hit)\n- Invalidation Condition: \"If price closes below EMA20 at $2.57 on 3-minute candle\"\n\n**Checking Invalidation:**\n- Current EMA20: $2.63\n- Current Price: $2.6397\n- Price is ABOVE EMA20 ($2.6397 > $2.63) \u2713\n- Invalidation level was $2.57, current price well above \u2713\n- Invalidation condition NOT met\n\n**Technical Analysis:**\n- RSI (7-period): 53.194 - neutral, healthy range\n- RSI (14-period): 54.060 - neutral\n- MACD: 0.009 - slightly positive, weakening from 0.014\n- Price above EMA20 ($2.6397 > $2.63) - bullish structure intact\n- Recent price action: consolidating around $2.63-$2.67 range\n- Volume: 11.07M vs avg 6.91M - elevated volume suggests interest\n\n**Risk Assessment:**\n- Position is slightly profitable (+0.4%)\n- No signs of invalidation\n- Technical structure remains intact\n- RSI not overbought, room to move higher\n- MACD still positive though declining\n\n**Decision: HOLD**\nThe invalidation condition has NOT been met. Price remains above EMA20 and well above the $2.57 invalidation level. The position is working as planned with a small profit. Technical indicators show neutral momentum with no bearish reversal signals. The stop-loss at $2.58 provides adequate protection. Will continue holding toward the $2.75 profit target.\n\n**Other Coins:**\n- BTC: RSI 30.98 (oversold), but sharp decline from 115566 to 113694. Too risky to enter on this volatility.\n- ETH: RSI 18.86 (extremely oversold), dropped from 4203 to 4037. Potential bounce but too volatile currently.\n- SOL: RSI 21.12 (oversold), declining from 202 to 195. Weak momentum.\n- BNB: RSI 29.99 (oversold), declining trend. Not compelling.\n- DOGE: RSI 12.96 (extremely oversold), sharp drop from 0.206 to 0.196. High risk.\n\nAll other coins showing oversold conditions but in downtrends. Will not enter new positions given current market volatility and existing XRP exposure.\n\n# TRADING DECISIONS\n\n```json\n{\n  \"XRP\": {\n    \"trade_signal_args\": {\n      \"coin\": \"XRP\",\n      \"signal\": \"hold\",\n      \"quantity\": 9100.0,\n      \"profit_target\": 2.75,\n      \"stop_loss\": 2.58,\n      \"invalidation_condition\": \"If price closes below EMA20 at $2.57 on 3-minute candle\",\n      \"leverage\": 15,\n      \"confidence\": 0.72,\n      \"risk_usd\": 455.0\n    }\n  }\n}\n```",
      "signals": [
        {
          "coin": "XRP",
          "signal": "hold",
          "quantity": 9100.0,
          "leverage": 15,
          "stop_loss": 2.58,
          "profit_target": 2.75,
          "confidence": 0.72,
          "risk_usd": 455.0,
          "invalidation_condition": "If price closes below EMA20 at $2.57 on 3-minute candle"
        }
      ]
    },
    {
      "iteration": 72,
      "timestamp": "2025-10-28T20:00:00",
      "model": "anthropic",
      "raw_response": "# CHAIN OF THOUGHT\n\nReviewing my current XRP position and market conditions:\n\n**XRP Position Analysis:**\n- Entry: $2.6293, Current: $2.602\n- Unrealized P&L: -$260.39 (-1.04%)\n- Stop-loss: $2.58 (1.5% away)\n- Profit target: $2.75 (5.7% away)\n- Invalidation condition: \"If price closes below EMA20 at $2.57 on 3-minute candle\"\n\n**Critical Technical Analysis:**\n- Current price: $2.602\n- Current EMA20: $2.63\n- Price is BELOW EMA20 ($2.602 < $2.63)\n- RSI(7): 21.015 - severely oversold\n- RSI(14): 34.127 - oversold territory\n- MACD: 0.005 - weakening momentum, near zero\n- Price action: Dropped from $2.67 to $2.60 in last 30 minutes\n\n**Invalidation Check:**\nThe invalidation condition states: \"If price closes below EMA20 at $2.57 on 3-minute candle\"\n- Current EMA20 is $2.63, NOT $2.57\n- Current price $2.602 is below current EMA20 ($2.63)\n- However, the specific invalidation level was set at $2.57\n- Current price $2.602 is ABOVE $2.57\n\n**Decision Logic:**\nWhile price is below the current EMA20, it has NOT breached the specific invalidation level of $2.57. The stop-loss at $2.58 is very close (only 0.8% away). Given:\n1. Severe oversold conditions (RSI 7-period at 21)\n2. Price still above invalidation level ($2.602 > $2.57)\n3. Price still above stop-loss ($2.602 > $2.58)\n4. MACD still slightly positive\n5. High volume suggests potential reversal zone\n\n**Risk Assessment:**\nThe position is at high risk with price near stop-loss. However, oversold RSI often precedes bounces. The invalidation condition has NOT been technically met yet.\n\n**Decision: HOLD** - Invalidation condition not met, stop-loss not hit, oversold conditions may lead to bounce.\n\n**Other Coins:**\n- BTC: RSI 19.5 - extremely oversold, but no position\n- ETH: RSI 11.6 - extremely oversold, but no position  \n- SOL: RSI 17.7 - extremely oversold, but no position\n- BNB: RSI 12.4 - extremely oversold, but no position\n- DOGE: RSI 7.3 - extremely oversold, but no position\n\nAll markets showing extreme oversold conditions suggesting potential bounce, but given existing XRP exposure and risk management, not adding new positions during this volatile selloff.\n\n# TRADING DECISIONS\n\n```json\n{\n  \"XRP\": {\n    \"trade_signal_args\": {\n      \"coin\": \"XRP\",\n      \"signal\": \"hold\",\n      \"quantity\": 9100.0,\n      \"profit_target\": 2.75,\n      \"stop_loss\": 2.58,\n      \"invalidation_condition\": \"If price closes below EMA20 at $2.57 on 3-minute candle\",\n      \"leverage\": 15,\n      \"confidence\": 0.72,\n      \"risk_usd\": 455.0\n    }\n  }\n}\n```",
      "signals": [
        {
          "coin": "XRP",
          "signal": "hold",
          "quantity": 9100.0,
          "leverage": 15,
          "stop_loss": 2.58,
          "profit_target": 2.75,
          "confidence": 0.72,
          "risk_usd": 455.0,
          "invalidation_condition": "If price closes below EMA20 at $2.57 on 3-minute candle"
        }
      ]
    },
    {
      "iteration": 73,
      "timestamp": "2025-10-29T00:00:00",
      "model": "anthropic",
      "raw_response": "# CHAIN OF THOUGHT\n\n## Current Position Analysis\n\n### XRP Position Review\n- **Entry**: $2.6293 | **Current**: $2.6073 | **Unrealized P&L**: -$212.16 (-0.84%)\n- **Stop-loss**: $2.58 | **Profit target**: $2.75\n- **Invalidation condition**: \"If price closes below EMA20 at $2.57 on 3-minute candle\"\n\n**Technical Analysis**:\n- Current price: $2.61 vs EMA20: $2.63 \u2192 Price is BELOW EMA20\n- RSI(7): 29.076 \u2192 Oversold territory (below 30)\n- RSI(14): 38.055 \u2192 Approaching oversold\n- MACD: 0.004 \u2192 Weakening momentum, near zero\n- Price action: Down from $2.67 to $2.61, showing weakness\n- Volume: 3.18M vs avg 7.01M \u2192 Low volume decline\n\n**Critical Assessment**:\nThe invalidation condition states \"below EMA20 at $2.57\" but current EMA20 is at $2.63, not $2.57. The price ($2.61) is already below the current EMA20 ($2.63). However, the specific invalidation was tied to $2.57 level.\n\nLooking at the price trajectory: The latest candle closed at $2.61, which is:\n- Above the stop-loss ($2.58) \u2713\n- Below the EMA20 ($2.63) \u2717\n- Above the invalidation price level ($2.57) \u2713\n\n**Decision Rationale**:\nThe position is showing weakness with price below EMA20 and declining momentum (MACD near zero, RSI oversold). However, the strict invalidation condition specified \"$2.57\" as the critical level, and we're still at $2.61. The stop-loss at $2.58 is very close (only 1.15% away).\n\nGiven:\n1. Price is below EMA20 (bearish signal)\n2. Momentum is fading (MACD near zero)\n3. RSI oversold suggests potential bounce, but could also indicate continued weakness\n4. Stop-loss is very close ($2.58 vs current $2.61)\n5. We're in a losing position (-$212)\n\n**DECISION: CLOSE POSITION** - The technical setup has deteriorated. While the strict invalidation at $2.57 hasn't been hit, the price is below EMA20 and showing continued weakness. With stop-loss only 1.15% away and momentum fading, it's prudent to exit now rather than risk hitting the stop-loss. The RSI oversold condition in a downtrend often leads to further decline before any bounce.\n\n## Market-Wide Assessment\n\n**BTC**: RSI(7) = 16.0 (extremely oversold), price $112,502 well below EMA20 $113,581. Sharp decline from $114,992. MACD collapsing from 920 to 301. This is a severe selloff.\n\n**ETH**: RSI(7) = 23.9 (oversold), price $3,997 below EMA20 $4,064. Down from $4,194. Similar pattern to BTC.\n\n**SOL**: RSI(7) = 16.8 (extremely oversold), price $193.95 below EMA20 $197.58. Weak momentum.\n\n**BNB**: RSI(7) = 16.0 (extremely oversold), price $1,103.70 well below EMA20 $1,128.46. Sharp decline.\n\n**DOGE**: RSI(7) = 6.5 (EXTREMELY oversold - rare reading), price $0.1929 below EMA20 $0.1988. Severe selloff.\n\n**Market Context**: Across the board, we're seeing extreme oversold conditions with RSI(7) readings between 6-29. This suggests a market-wide flash crash or severe correction. While oversold conditions can lead to bounces, in leveraged trading during such volatility, the risk of further downside before any recovery is high.\n\n**New Position Consideration**: Given the extreme oversold readings, there could be bounce opportunities. However, with 32 minutes of trading and already having taken a loss, the prudent approach is to close the losing XRP position and wait for clearer signals. The extreme readings (especially DOGE at RSI 6.5) suggest panic selling, which can continue before stabilizing.\n\n# TRADING DECISIONS\n\n```json\n{\n  \"XRP\": {\n    \"trade_signal_args\": {\n      \"coin\": \"XRP\",\n      \"signal\": \"close_position\",\n      \"quantity\": 9100.0,\n      \"profit_target\": 2.75,\n      \"stop_loss\": 2.58,\n      \"invalidation_condition\": \"If price closes below EMA20 at $2.57 on 3-minute candle\",\n      \"leverage\": 15,\n      \"confidence\": 0.72,\n      \"risk_usd\": 455.0,\n      \"close_reason\": \"Price below EMA20 with fading momentum (MACD near zero) and stop-loss only 1.15% away. Technical deterioration suggests high risk of further decline. Exiting to preserve capital during market-wide selloff.\"\n    }\n  }\n}\n```",
      "signals": [
        {
          "coin": "XRP",
          "signal": "close_position",
          "quantity": 9100.0,
          "leverage": 15,
          "stop_loss": 2.58,
          "profit_target": 2.75,
          "confidence": 0.72,
          "risk_usd": 455.0,
          "invalidation_condition": "If price closes below EMA20 at $2.57 on 3-minute candle"
        }
      ]
    },
    {
      "iteration": 74,
      "timestamp": "2025-10-29T04:00:00",
      "model": "anthropic",
      "raw_response": "# CHAIN OF THOUGHT\n\n## Current Portfolio Status\n- No open positions\n- Available cash: $10,397.16\n- Total return: +3.97%\n- Sharpe ratio: 2.617 (excellent risk-adjusted returns)\n\n## Market Analysis by Coin\n\n### BTC (113569.00)\n- **Technical**: Price below EMA20 (113523.89), MACD declining (341.5 from 1043), RSI neutral at 50.5\n- **Trend**: Weakening momentum after sharp drop from 114960 to 112502, now recovering\n- **Volume**: Below average (2585 vs 4801) - weak conviction\n- **Assessment**: Consolidating after volatility spike. Not ideal entry point - waiting for clearer direction\n\n### ETH (4022.80)\n- **Technical**: Price significantly below EMA20 (4057.38), MACD weak (11.1), RSI oversold at 39.4\n- **Trend**: Declining from 4194 to 3978, slight recovery but below all key EMAs\n- **Volume**: Below average (57803 vs 77668)\n- **Assessment**: Oversold but no clear reversal signal yet. Could bounce from current levels but needs confirmation\n\n### SOL (195.67)\n- **Technical**: Price below EMA20 (197.29), MACD near zero (0.241), RSI recovering at 40.8\n- **Trend**: Dropped from 202.32 to 193.95, now stabilizing\n- **Volume**: Significantly below average (207k vs 633k) - concerning\n- **Assessment**: Weak momentum, low volume suggests lack of interest\n\n### BNB (1116.60)\n- **Technical**: Price below EMA20 (1127.40), MACD negative (-2.257), RSI at 44.2\n- **Trend**: Declining from 1144.70, sharp drop to 1102.30, recovering\n- **Volume**: Below average (2941 vs 6957)\n- **Assessment**: Bearish structure, negative MACD is concerning\n\n### XRP (2.63)\n- **Technical**: Price at EMA20 (2.63), MACD near zero (0.003), RSI neutral at 57.6\n- **Trend**: Consolidating tightly around 2.63, recovered from 2.60 dip\n- **Volume**: Significantly below average (1.97M vs 6.92M)\n- **Assessment**: Most stable coin, tight consolidation could precede breakout\n\n### DOGE (0.194270)\n- **Technical**: Price well below EMA20 (0.198173), MACD negative (-0.001), RSI oversold at 28.4\n- **Trend**: Declining from 0.203 to 0.192, slight recovery\n- **Volume**: Below average (8.7M vs 22.3M)\n- **Assessment**: Most oversold, but weak volume and negative MACD suggest continued weakness\n\n## Trading Decision Rationale\n\nGiven the current market conditions:\n1. **No clear strong trends** - Most coins showing weakness or consolidation\n2. **Below-average volumes** across all coins - lack of conviction\n3. **Mixed technical signals** - no compelling setups\n4. **Strong existing performance** - Sharpe 2.617 suggests disciplined trading\n\n**Strategy**: Wait for clearer setups. The market is in a consolidation/correction phase after recent volatility. Better to preserve capital and wait for high-probability entries rather than force trades in unclear conditions.\n\nHowever, **XRP** shows the most stable structure with tight consolidation at EMA20 and neutral RSI. If I were to take any position, this would be the candidate, but even here the low volume is concerning.\n\n**Decision**: No new positions at this time. Market conditions do not meet my criteria for high-probability trades.\n\n# TRADING DECISIONS\n\n{}",
      "signals": []
    },
    {
      "iteration": 75,
      "timestamp": "2025-10-29T08:00:00",
      "model": "anthropic",
      "raw_response": "# CHAIN OF THOUGHT\n\n## Current Portfolio Status\n- No open positions\n- Available cash: $10,397.16\n- Total return: +3.97%\n- Sharpe ratio: 2.617 (excellent risk-adjusted returns)\n\n## Market Analysis by Coin\n\n### BTC (113134.00)\n- **Trend**: Bearish pressure - price below EMA20 (113552.28), declining MACD (185.88 from 840.29)\n- **RSI**: 41.26 (7-period) - neutral to slightly oversold, but 14-period at 42.72 shows weakness\n- **Recent action**: Sharp drop from 114640 to 112502, now recovering to 113134\n- **Volume**: Low (2101 vs avg 4811) - weak conviction\n- **Assessment**: Consolidating after drop, but momentum still negative. MACD declining rapidly suggests more downside risk.\n\n### ETH (4008.70)\n- **Trend**: Bearish - price below EMA20 (4055.47), MACD collapsing (2.58 from 58.70)\n- **RSI**: 34.29 (7-period), 37.28 (14-period) - oversold territory\n- **Recent action**: Dropped from 4119.80 to 3978.00, slight recovery\n- **Volume**: Above average (119202 vs 82297) - selling pressure with volume\n- **Assessment**: Oversold but momentum still negative. Could bounce but trend is down.\n\n### SOL (198.84)\n- **Trend**: Bullish recovery - price above EMA20 (197.55), MACD turning positive (0.195)\n- **RSI**: 65.37 (7-period), 55.65 (14-period) - healthy bullish momentum\n- **Recent action**: V-shaped recovery from 193.95 to 198.84\n- **Volume**: Below average (479347 vs 645721) but recovering\n- **Assessment**: **BEST SETUP** - Clear reversal pattern, price reclaiming EMA20, RSI showing strength without being overbought. This is a momentum play.\n\n### BNB (1113.00)\n- **Trend**: Bearish - price below EMA20 (1126.48), MACD negative (-3.665)\n- **RSI**: 39.30 (7-period), 38.98 (14-period) - weak\n- **Recent action**: Drop from 1138.50 to 1102.30, minimal recovery\n- **Assessment**: Weak, no clear reversal signal yet.\n\n### XRP (2.65)\n- **Trend**: Neutral to bullish - price above EMA20 (2.63), MACD flat (0.001)\n- **RSI**: 67.09 (7-period), 58.62 (14-period) - strong momentum\n- **Recent action**: Recovery from 2.60 to 2.65\n- **Volume**: Low (2.99M vs 6.94M avg)\n- **Assessment**: Showing strength but low volume is concerning. Secondary setup.\n\n### DOGE (0.195340)\n- **Trend**: Bearish - price below EMA20 (0.198133), MACD negative (-0.001)\n- **RSI**: 42.39 (7-period), 36.90 (14-period) - weak\n- **Recent action**: Dropped from 0.200290 to 0.192900, slight recovery\n- **Assessment**: Still weak, no clear reversal.\n\n## Trading Decision\n\n**SOL is the clear winner** - it shows:\n1. Price reclaimed EMA20 (bullish signal)\n2. RSI showing momentum (65.37) without being overbought\n3. MACD turning positive (0.195)\n4. V-shaped recovery pattern suggesting buyers stepping in\n5. Clean technical setup with defined risk\n\nI'll enter SOL with tight risk management:\n- Entry: 198.84\n- Stop-loss: 193.00 (below recent low of 193.95, giving room for noise)\n- Profit target: 206.00 (3.6% move, reasonable for SOL's volatility)\n- Risk: ~$300 (3% of capital)\n- Leverage: 15x (moderate for this setup)\n\n# TRADING DECISIONS\n\n```json\n{\n  \"SOL\": {\n    \"trade_signal_args\": {\n      \"coin\": \"SOL\",\n      \"signal\": \"buy\",\n      \"quantity\": 10.0,\n      \"profit_target\": 206.00,\n      \"stop_loss\": 193.00,\n      \"invalidation_condition\": \"If price closes below 193.00 on 3-minute candle, indicating failed breakout and return to downtrend\",\n      \"leverage\": 15,\n      \"confidence\": 0.75,\n      \"risk_usd\": 300.00\n    }\n  }\n}\n```",
      "signals": [
        {
          "coin": "SOL",
          "signal": "buy",
          "quantity": 10.0,
          "leverage": 15,
          "stop_loss": 193.0,
          "profit_target": 206.0,
          "confidence": 0.75,
          "risk_usd": 300.0,
          "invalidation_condition": "If price closes below 193.00 on 3-minute candle, indicating failed breakout and return to downtrend"
        }
      ]
    },
    {
      "iteration": 76,
      "timestamp": "2025-10-29T12:00:00",
      "model": "anthropic",
      "raw_response": "# CHAIN OF THOUGHT\n\n## Current Position Analysis\n\n**SOL Position Review:**\n- Entry: $198.84, Current: $196.76\n- Unrealized P&L: -$21.79 (-1.05%)\n- Leverage: 15x\n- Exit Plan: Profit target $206.00, Stop-loss $193.00\n- Invalidation: \"If price closes below 193.00 on 3-minute candle\"\n\n**Technical Analysis:**\n- Current price: $196.76 is ABOVE the invalidation level of $193.00\n- Stop-loss at $193.00 has NOT been hit\n- RSI (7-period): 47.842 - neutral territory, recovering from oversold\n- MACD: -0.599 - still negative but improving from -0.728\n- Price action: Recent bounce from $193.95 to $198.84, now pulling back to $196.76\n- EMA20: $198.02 - price slightly below but close\n\n**Decision Logic:**\nThe invalidation condition is clear: \"If price closes below 193.00 on 3-minute candle\". The current price is $196.76, which is $3.76 ABOVE the invalidation level. The position is showing a small loss but:\n1. Invalidation condition NOT met (price above $193.00)\n2. Stop-loss NOT hit\n3. Technical indicators showing potential stabilization (RSI neutral, recent bounce)\n4. Price holding above the critical $193.95 low\n\n**Conclusion:** HOLD the SOL position. The invalidation condition has not been triggered, and the position remains valid according to the original trade thesis.\n\n## Other Market Opportunities\n\n**BTC:** Severely oversold (RSI 21.45), but in strong downtrend. Price at $111,510 vs EMA20 $113,567. MACD deeply negative at -273.78. Too risky to enter during such aggressive selling.\n\n**ETH:** Also oversold (RSI 19.70), similar bearish pattern to BTC. Price $3,949.50 vs EMA20 $4,058.04. Avoid catching falling knives.\n\n**BNB:** Oversold (RSI 24.73), downtrending. Price $1,098.90 vs EMA20 $1,125.90. Not attractive.\n\n**XRP:** Neutral (RSI 45.00), consolidating around $2.62-$2.63. No clear edge.\n\n**DOGE:** Very oversold (RSI 20.29), but in downtrend. Price $0.191 vs EMA20 $0.198. Too weak.\n\n**Risk Management:** With one position showing a small loss and overall portfolio up 3.73%, maintaining discipline is key. No new entries warranted in current volatile conditions.\n\n# TRADING DECISIONS\n\n```json\n{\n  \"SOL\": {\n    \"trade_signal_args\": {\n      \"coin\": \"SOL\",\n      \"signal\": \"hold\",\n      \"quantity\": 10.0,\n      \"profit_target\": 206.0,\n      \"stop_loss\": 193.0,\n      \"invalidation_condition\": \"If price closes below 193.00 on 3-minute candle, indicating failed breakout and return to downtrend\",\n      \"leverage\": 15,\n      \"confidence\": 0.75,\n      \"risk_usd\": 300.0\n    }\n  }\n}\n```",
      "signals": [
        {
          "coin": "SOL",
          "signal": "hold",
          "quantity": 10.0,
          "leverage": 15,
          "stop_loss": 193.0,
          "profit_target": 206.0,
          "confidence": 0.75,
          "risk_usd": 300.0,
          "invalidation_condition": "If price closes below 193.00 on 3-minute candle, indicating failed breakout and return to downtrend"
        }
      ]
    },
    {
      "iteration": 77,
      "timestamp": "2025-10-29T16:00:00",
      "model": "anthropic",
      "raw_response": "# CHAIN OF THOUGHT\n\n## Current Market Analysis\n\nI have NO open positions currently. Account value is $10,333.31 with 3.33% total return and a strong Sharpe ratio of 2.201.\n\nLet me analyze the market conditions for potential entry opportunities:\n\n**BTC Analysis:**\n- Current: $110,675 (down from $114,170 in last 30 minutes)\n- Sharp decline: -3.06% in 30 minutes\n- RSI(7): 16.118 - EXTREMELY oversold (below 20)\n- RSI(14): 22.330 - Also deeply oversold\n- MACD: -542.516 - Strongly negative and accelerating downward\n- Price well below EMA20 ($113,349.54)\n- Volume spike: 19,763 vs avg 5,889 (3.35x normal) - high selling pressure\n- This is a capitulation-level move with extreme oversold conditions\n\n**ETH Analysis:**\n- Current: $3,903.30 (down from $4,116.30)\n- Decline: -5.17% in 30 minutes\n- RSI(7): 13.637 - EXTREMELY oversold (most oversold of all coins)\n- RSI(14): 20.869 - Deeply oversold\n- MACD: -37.182 - Strongly negative\n- Price below EMA20 ($4,047.32)\n- Volume: 293,984 vs avg 97,748 (3x normal) - panic selling\n- Most oversold condition, potential for bounce\n\n**SOL Analysis:**\n- Current: $192.75 (down from $202.32)\n- Decline: -4.73% in 30 minutes\n- RSI(7): 28.319 - Oversold but not extreme\n- RSI(14): 33.091 - Approaching oversold\n- MACD: -1.235 - Negative but relatively mild\n- Price below EMA20 ($197.74)\n- Volume: 3,017,569 vs avg 819,572 (3.68x normal)\n\n**BNB Analysis:**\n- Current: $1,106.70 (down from $1,131.40)\n- Decline: -2.18% in 30 minutes\n- RSI(7): 40.811 - Neutral territory, showing some recovery\n- RSI(14): 38.218 - Near neutral\n- MACD: -8.239 - Negative but stabilizing\n- Least oversold of major coins\n\n**XRP Analysis:**\n- Current: $2.59 (down from $2.64)\n- Decline: -1.89% in 30 minutes\n- RSI(7): 26.018 - Oversold\n- RSI(14): 33.216 - Approaching oversold\n- MACD: -0.006 - Slightly negative\n- Volume spike: 39.4M vs avg 9M (4.36x normal)\n\n**DOGE Analysis:**\n- Current: $0.193870 (down from $0.200230)\n- Decline: -3.18% in 30 minutes\n- RSI(7): 45.285 - Neutral, showing recovery\n- RSI(14): 38.295 - Near neutral\n- MACD: -0.003 - Slightly negative\n- Volume: 207.8M vs avg 33.4M (6.22x normal)\n\n## Trading Decision\n\n**Market Context:** We're seeing a broad market selloff with extreme oversold conditions across BTC and ETH. This presents a potential mean-reversion opportunity, but the momentum is strongly negative.\n\n**Best Opportunity: ETH**\n- Most extreme oversold condition (RSI 13.637)\n- High probability of short-term bounce from these levels\n- Clear risk/reward setup with tight stop-loss\n- Historical RSI below 15 often leads to quick rebounds\n\n**Strategy:** Enter a LONG position on ETH targeting a bounce to the EMA20 level. The extreme oversold reading suggests panic selling may be exhausted. I'll use moderate leverage (12x) with tight risk management.\n\n**Risk Management:**\n- Position size: ~$1,500 risk (~14.5% of capital)\n- Stop-loss: Below recent low with buffer for volatility\n- Profit target: Conservative bounce to $4,050 (near EMA20)\n- Invalidation: If price breaks below $3,850 (further capitulation)\n\n# TRADING DECISIONS\n\n```json\n{\n  \"ETH\": {\n    \"trade_signal_args\": {\n      \"coin\": \"ETH\",\n      \"signal\": \"buy\",\n      \"quantity\": 4.6,\n      \"profit_target\": 4050.0,\n      \"stop_loss\": 3850.0,\n      \"invalidation_condition\": \"If price closes below $3,850 on 3-minute candle, indicating continued capitulation rather than bounce\",\n      \"leverage\": 12,\n      \"confidence\": 0.72,\n      \"risk_usd\": 1500.0\n    }\n  }\n}\n```",
      "signals": [
        {
          "coin": "ETH",
          "signal": "buy",
          "quantity": 4.6,
          "leverage": 12,
          "stop_loss": 3850.0,
          "profit_target": 4050.0,
          "confidence": 0.72,
          "risk_usd": 1500.0,
          "invalidation_condition": "If price closes below $3,850 on 3-minute candle, indicating continued capitulation rather than bounce"
        }
      ]
    },
    {
      "iteration": 78,
      "timestamp": "2025-10-29T20:00:00",
      "model": "anthropic",
      "raw_response": "# CHAIN OF THOUGHT\n\n## Current Position Analysis\n\n**ETH Position Review:**\n- Entry: $3,903.30 | Current: $3,902.00 | Unrealized P&L: -$14.96\n- Stop-loss: $3,850 | Profit target: $4,050\n- Invalidation: \"If price closes below $3,850 on 3-minute candle\"\n- Leverage: 12x | Notional: $17,949\n\n**Technical Analysis:**\n- Current price $3,902 is ABOVE the stop-loss of $3,850 \u2713\n- RSI (7-period): 13.487 - EXTREMELY oversold (below 20)\n- RSI (14-period): 20.793 - Still oversold\n- MACD: -42.487 - Deeply negative, showing strong bearish momentum\n- Price below EMA20 ($4,032.45) - bearish short-term trend\n- Recent price action: Sharp decline from $4,111.80 to $3,902.00 (5.1% drop)\n\n**Invalidation Check:**\nThe invalidation condition states: \"If price closes below $3,850 on 3-minute candle\"\n- Current price: $3,902.00\n- Stop-loss: $3,850.00\n- The price has NOT closed below $3,850 yet\n- Invalidation condition is NOT met \u2713\n\n**Risk Assessment:**\n- Position is down only $15 (-0.08%), minimal loss\n- RSI at 13.487 suggests we're at extreme oversold levels - potential bounce zone\n- However, MACD continues to deteriorate, showing strong selling pressure\n- Price is $52 above stop-loss, providing some cushion\n\n**Decision Rationale:**\nDespite the extreme oversold RSI reading (13.487) which typically signals a potential bounce, the MACD momentum remains deeply negative (-42.487) and deteriorating. The market is showing capitulation characteristics. However, since:\n1. The invalidation condition has NOT been met (price hasn't closed below $3,850)\n2. We're at extreme oversold levels (RSI 13.487)\n3. The loss is minimal (-$15)\n4. Stop-loss provides protection at $3,850\n\nI will HOLD the position and let the stop-loss do its job if further downside occurs. The extreme RSI suggests we may be near a short-term bottom, and closing now would lock in a loss just as we might be approaching a bounce.\n\n## Other Coins Analysis\n\n**BTC:** RSI 13.152 (extreme oversold), MACD -711.987 (severe bearish), price $110,102 well below EMA20 $113,027. Market in free fall. No position - not entering in this volatility.\n\n**SOL:** RSI 38.638 (neutral), MACD -1.258 (slightly negative), price $193.99 below EMA20 $197.29. Relatively stable but weak. No compelling setup.\n\n**BNB:** RSI 41.918 (neutral), MACD -7.183 (negative), price $1,107.20 below EMA20 $1,121.28. Weak momentum, no edge.\n\n**XRP:** RSI 16.840 (extreme oversold), MACD -0.007 (negative), price $2.55 below EMA20 $2.62. Oversold but in downtrend. Too risky.\n\n**DOGE:** RSI 36.784 (neutral-weak), MACD -0.003 (negative), price $0.19227 below EMA20 $0.19720. Weak, no setup.\n\n# TRADING DECISIONS\n\n```json\n{\n  \"ETH\": {\n    \"trade_signal_args\": {\n      \"coin\": \"ETH\",\n      \"signal\": \"hold\",\n      \"quantity\": 4.6,\n      \"profit_target\": 4050.0,\n      \"stop_loss\": 3850.0,\n      \"invalidation_condition\": \"If price closes below $3,850 on 3-minute candle, indicating continued capitulation rather than bounce\",\n      \"leverage\": 12,\n      \"confidence\": 0.72,\n      \"risk_usd\": 1500.0\n    }\n  }\n}\n```",
      "signals": [
        {
          "coin": "ETH",
          "signal": "hold",
          "quantity": 4.6,
          "leverage": 12,
          "stop_loss": 3850.0,
          "profit_target": 4050.0,
          "confidence": 0.72,
          "risk_usd": 1500.0,
          "invalidation_condition": "If price closes below $3,850 on 3-minute candle, indicating continued capitulation rather than bounce"
        }
      ]
    },
    {
      "iteration": 79,
      "timestamp": "2025-10-30T00:00:00",
      "model": "anthropic",
      "raw_response": "# CHAIN OF THOUGHT\n\n## Current Position Analysis\n\n**ETH Position Review:**\n- Entry: $3,903.30 | Current: $3,933.40 | Unrealized P&L: +$129.48 (+0.77%)\n- Leverage: 12x | Notional: $18,093.64\n- Exit Plan: Profit Target $4,050 | Stop-Loss $3,850\n- Invalidation: \"If price closes below $3,850 on 3-minute candle\"\n\n**Technical Analysis:**\n- Current price $3,933.40 is ABOVE stop-loss ($3,850) \u2713\n- Current price is ABOVE invalidation level ($3,850) \u2713\n- RSI (7-period): 36.35 - recovering from oversold, was at 13.09 two candles ago\n- RSI (14-period): 30.17 - still in oversold territory but improving\n- MACD: -61.464 - deeply negative but stabilizing (was -60.165 last candle)\n- Price vs EMA20: $3,933.40 vs $4,035.59 - still below but gap narrowing\n- Recent price action: Bounced from $3,902 low to $3,933.40 (+0.8%)\n\n**Position Status:**\nThe invalidation condition has NOT been met. Price remains above $3,850. The position is showing a small profit and technical indicators suggest potential for continued recovery:\n- RSI bouncing from extreme oversold (13.09 \u2192 36.35)\n- Price stabilizing and showing slight upward momentum\n- MACD still negative but rate of decline slowing\n\n**Decision: HOLD**\n- Invalidation condition not triggered\n- Small profit developing (+$129)\n- Technical bounce from oversold conditions in progress\n- Profit target at $4,050 still reasonable given recovery pattern\n- Stop-loss at $3,850 provides adequate protection\n\n## Other Coins Assessment\n\n**BTC:** Severe downtrend (RSI 33.78, MACD -965.47, price $110,833 vs EMA $112,948). No position, not entering in this weakness.\n\n**SOL:** Showing relative strength (RSI 58.85, price $197.17 near EMA $197.45). Recovering but not compelling enough for new entry.\n\n**BNB:** Moderate recovery (RSI 62.01, price $1,118.30 near EMA $1,122.59). Neutral setup.\n\n**XRP:** Weak (RSI 38.98, price $2.58 below EMA $2.62). Downtrend continues.\n\n**DOGE:** Neutral (RSI 48.13, price $0.1937 below EMA $0.1974). No clear edge.\n\nNo new positions warranted given current market volatility and existing ETH exposure.\n\n# TRADING DECISIONS\n\n```json\n{\n  \"ETH\": {\n    \"trade_signal_args\": {\n      \"coin\": \"ETH\",\n      \"signal\": \"hold\",\n      \"quantity\": 4.6,\n      \"profit_target\": 4050.0,\n      \"stop_loss\": 3850.0,\n      \"invalidation_condition\": \"If price closes below $3,850 on 3-minute candle, indicating continued capitulation rather than bounce\",\n      \"leverage\": 12,\n      \"confidence\": 0.72,\n      \"risk_usd\": 1500.0\n    }\n  }\n}\n```",
      "signals": [
        {
          "coin": "ETH",
          "signal": "hold",
          "quantity": 4.6,
          "leverage": 12,
          "stop_loss": 3850.0,
          "profit_target": 4050.0,
          "confidence": 0.72,
          "risk_usd": 1500.0,
          "invalidation_condition": "If price closes below $3,850 on 3-minute candle, indicating continued capitulation rather than bounce"
        }
      ]
    },
    {
      "iteration": 80,
      "timestamp": "2025-10-30T04:00:00",
      "model": "anthropic",
      "raw_response": "# CHAIN OF THOUGHT\n\nReviewing my current position:\n\n**ETH Position Analysis:**\n- Entry: $3,903.30 | Current: $3,938.90 | Unrealized PnL: +$154.78 (+0.91%)\n- Leverage: 12x | Notional: $18,118.94\n- Exit Plan: Profit Target $4,050 | Stop-Loss $3,850\n- Invalidation Condition: \"If price closes below $3,850 on 3-minute candle, indicating continued capitulation rather than bounce\"\n\n**Technical Analysis:**\n- Current price $3,938.90 is ABOVE stop-loss ($3,850) \u2713\n- Current price is BELOW profit target ($4,050) - still room to run\n- RSI (7-period): 39.97 - recovering from oversold, was at 12.83 two candles ago\n- RSI (14-period): 31.10 - still in oversold territory, showing potential for bounce\n- MACD: -69.53 - deeply negative but showing slight improvement from -70.14\n- Price vs EMA20: $3,938.90 vs $4,032.56 - still below but gap narrowing\n- Recent price action: Bounced from $3,902 low to $3,938.90, showing some buying interest\n\n**Invalidation Check:**\nThe invalidation condition states \"if price closes below $3,850 on 3-minute candle.\" The current price is $3,938.90, which is $88.90 ABOVE the invalidation level. The recent low was $3,902, still well above $3,850. **Invalidation condition is NOT met.**\n\n**Decision Rationale:**\n1. Position is profitable (+$154.78)\n2. No invalidation condition triggered\n3. Stop-loss not hit ($3,938.90 > $3,850)\n4. Profit target not reached ($3,938.90 < $4,050)\n5. RSI showing recovery from extreme oversold levels\n6. Price stabilizing after sharp decline\n\n**Risk Assessment:**\n- 12x leverage on ETH is aggressive but manageable with current account size\n- Stop-loss provides $244.70 cushion (6.2% from current price)\n- Profit target is $111.10 away (2.8% move needed)\n- Risk/reward ratio remains favorable\n\n**Conclusion:** HOLD the ETH position. The bounce from oversold conditions is developing, invalidation condition is not met, and the position has room to reach the profit target at $4,050.\n\n**Other Coins:**\n- BTC, SOL, BNB, XRP, DOGE: No positions held, and current market conditions show weakness across the board (all trading below EMA20, negative MACD). Not entering new trades given the uncertain market environment and desire to focus on managing the existing ETH position.\n\n# TRADING DECISIONS\n\n```json\n{\n  \"ETH\": {\n    \"trade_signal_args\": {\n      \"coin\": \"ETH\",\n      \"signal\": \"hold\",\n      \"quantity\": 4.6,\n      \"profit_target\": 4050.0,\n      \"stop_loss\": 3850.0,\n      \"invalidation_condition\": \"If price closes below $3,850 on 3-minute candle, indicating continued capitulation rather than bounce\",\n      \"leverage\": 12,\n      \"confidence\": 0.72,\n      \"risk_usd\": 1500.0\n    }\n  }\n}\n```",
      "signals": [
        {
          "coin": "ETH",
          "signal": "hold",
          "quantity": 4.6,
          "leverage": 12,
          "stop_loss": 3850.0,
          "profit_target": 4050.0,
          "confidence": 0.72,
          "risk_usd": 1500.0,
          "invalidation_condition": "If price closes below $3,850 on 3-minute candle, indicating continued capitulation rather than bounce"
        }
      ]
    },
    {
      "iteration": 81,
      "timestamp": "2025-10-30T08:00:00",
      "model": "anthropic",
      "raw_response": "# CHAIN OF THOUGHT\n\n## Current Position Analysis\n\n**ETH Position Review:**\n- Entry: $3,903.30 | Current: $3,880.70 | Unrealized P&L: -$112.94 (-0.58%)\n- Stop-loss: $3,850.00 | Profit target: $4,050.00\n- Invalidation condition: \"If price closes below $3,850 on 3-minute candle\"\n- Current price $3,880.70 is ABOVE the invalidation level of $3,850\n- Distance to stop-loss: $30.70 (0.79%)\n- Distance to profit target: $169.30 (4.36%)\n\n**Technical Analysis for ETH:**\n- RSI (7-period): 21.823 - deeply oversold, suggesting potential bounce\n- RSI (14-period): 22.909 - also oversold\n- MACD: -72.489 - strongly negative but this is a capitulation signal\n- Price below EMA20 ($4,017.79) indicating downtrend\n- Recent price action: dropped from $3,996.90 to $3,880.70 (2.9% decline)\n- Volume: 28,732 vs average 95,815 - LOW volume on this decline (bullish divergence)\n\n**Critical Decision Point:**\nThe invalidation condition states \"if price closes BELOW $3,850\" - current price is $3,880.70, which is $30.70 ABOVE the invalidation level. The position is NOT invalidated yet. However, we are dangerously close to the stop-loss.\n\nGiven:\n1. RSI at 21.823 shows extreme oversold conditions (typical bounce zone)\n2. Low volume on decline suggests weak selling pressure\n3. Price still above invalidation level ($3,850)\n4. We're only down 0.58% on this trade\n5. Stop-loss is very close ($30.70 away)\n\n**Risk Assessment:**\n- The market is showing extreme oversold conditions across all major coins\n- BTC RSI: 26.909, ETH RSI: 21.823, SOL RSI: 30.651, XRP RSI: 26.486, DOGE RSI: 21.163\n- This suggests a potential capitulation bottom forming\n- However, we're very close to our stop-loss\n\n**Decision: CLOSE POSITION**\nWhile the invalidation condition is technically not met (price hasn't closed below $3,850), we are only $30.70 away from our stop-loss. Given the extreme market weakness and proximity to our risk limit, the prudent decision is to close this position to preserve capital. The risk/reward at this point is unfavorable - we could easily hit the stop-loss on the next candle, and holding through such volatility with leverage is dangerous.\n\n**Other Coins - No New Positions:**\n- All coins showing extreme weakness\n- BTC down to $109,784 from recent highs\n- Market-wide capitulation pattern\n- Not entering new positions in this environment\n- Better to preserve capital and wait for clearer reversal signals\n\n# TRADING DECISIONS\n\n```json\n{\n  \"ETH\": {\n    \"trade_signal_args\": {\n      \"coin\": \"ETH\",\n      \"signal\": \"close_position\",\n      \"quantity\": 4.6,\n      \"profit_target\": 4050.0,\n      \"stop_loss\": 3850.0,\n      \"invalidation_condition\": \"If price closes below $3,850 on 3-minute candle\",\n      \"leverage\": 12,\n      \"confidence\": 0.72,\n      \"risk_usd\": 1500.0,\n      \"close_reason\": \"Risk management - price within $30.70 of stop-loss ($3,850) in highly volatile market. Preserving capital given extreme market weakness and proximity to invalidation level. Better to exit with small loss (-0.58%) than risk hitting stop-loss on next candle.\"\n    }\n  }\n}\n```",
      "signals": [
        {
          "coin": "ETH",
          "signal": "close_position",
          "quantity": 4.6,
          "leverage": 12,
          "stop_loss": 3850.0,
          "profit_target": 4050.0,
          "confidence": 0.72,
          "risk_usd": 1500.0,
          "invalidation_condition": "If price closes below $3,850 on 3-minute candle"
        }
      ]
    },
    {
      "iteration": 82,
      "timestamp": "2025-10-30T12:00:00",
      "model": "anthropic",
      "raw_response": "# CHAIN OF THOUGHT\n\n## Market Analysis\nAll major cryptocurrencies are experiencing severe selling pressure with extremely oversold conditions:\n\n**BTC**: Price 107,752 (down ~5% from recent highs)\n- RSI(7): 15.73 - EXTREMELY oversold (below 20)\n- RSI(14): 19.56 - Severely oversold\n- MACD: -1446 and accelerating downward\n- Price well below EMA20 (112,150) - strong downtrend\n- Volume spike: 14,065 vs avg 6,759 (2.08x) - heavy selling\n\n**ETH**: Price 3,772 (down ~6% from recent highs)\n- RSI(7): 10.29 - CRITICALLY oversold (lowest reading)\n- RSI(14): 14.77 - Extreme oversold\n- MACD: -75.59 and deteriorating\n- Price 5.4% below EMA20 (3,989)\n- Volume: 231,565 vs avg 104,179 (2.22x) - panic selling\n\n**SOL**: Price 185.02 (down ~6.5% from recent highs)\n- RSI(7): 16.29 - Extremely oversold\n- RSI(14): 23.64 - Oversold\n- MACD: -2.25 and declining\n- Price 5.4% below EMA20 (195.60)\n- Volume: 1,645,511 vs avg 897,098 (1.83x)\n\n**BNB**: Price 1,076 (down ~5% from recent highs)\n- RSI(7): 15.28 - Extremely oversold\n- RSI(14): 21.50 - Oversold\n- MACD: -17.55 and negative\n- Price 4.1% below EMA20 (1,122)\n\n**XRP**: Price 2.45 (down ~6% from recent highs)\n- RSI(7): 12.08 - CRITICALLY oversold\n- RSI(14): 18.59 - Extreme oversold\n- MACD: -0.026 and declining\n- Price 5.4% below EMA20 (2.59)\n- Volume: 16,695,347 vs avg 9,905,416 (1.69x)\n\n**DOGE**: Price 0.18055 (down ~7% from recent highs)\n- RSI(7): 10.70 - CRITICALLY oversold (second lowest)\n- RSI(14): 16.13 - Extreme oversold\n- MACD: -0.004 and declining\n- Price 7.1% below EMA20 (0.194)\n- Volume: 206,451,913 vs avg 59,803,680 (3.45x) - MASSIVE selling\n\n## Current Portfolio Status\n- No open positions\n- Cash: $10,202.47\n- Return: +2.02%\n- Sharpe: 1.449\n\n## Trading Decision Rationale\n\nThis is a classic capitulation scenario with ALL coins showing:\n1. RSI(7) below 20 (extreme oversold)\n2. RSI(14) below 25 (oversold)\n3. Negative MACD momentum\n4. Heavy volume spikes indicating panic selling\n5. Prices significantly below EMA20\n\n**Mean reversion opportunity**: When multiple assets simultaneously reach extreme oversold levels with volume spikes, this often marks short-term bottoms. The probability of a bounce is high.\n\n**Risk Management Strategy**:\n- Enter multiple positions to diversify (not all eggs in one basket)\n- Use moderate leverage (12-15x) given volatility\n- Set tight stop-losses (2-3% below entry) to limit downside\n- Target 3-5% bounces for profit-taking\n- Risk ~$400-500 per position, total portfolio risk ~$2,000 (20% of capital)\n\n**Best candidates** (prioritizing most oversold with highest volume):\n1. **DOGE**: RSI(7) 10.70, volume 3.45x - most extreme\n2. **ETH**: RSI(7) 10.29, volume 2.22x - critically oversold\n3. **XRP**: RSI(7) 12.08, volume 1.69x - extreme oversold\n4. **BTC**: RSI(7) 15.73, volume 2.08x - oversold with high liquidity\n\nI'll enter 4 positions targeting mean reversion bounces.\n\n# TRADING DECISIONS\n\n```json\n{\n  \"DOGE\": {\n    \"trade_signal_args\": {\n      \"coin\": \"DOGE\",\n      \"signal\": \"buy\",\n      \"quantity\": 28000,\n      \"profit_target\": 0.1887,\n      \"stop_loss\": 0.1769,\n      \"invalidation_condition\": \"If RSI(7) drops below 8 or price closes below 0.1769 on 3-minute candle\",\n      \"leverage\": 15,\n      \"confidence\": 0.78,\n      \"risk_usd\": 500\n    }\n  },\n  \"ETH\": {\n    \"trade_signal_args\": {\n      \"coin\": \"ETH\",\n      \"signal\": \"buy\",\n      \"quantity\": 1.3,\n      \"profit_target\": 3930,\n      \"stop_loss\": 3696,\n      \"invalidation_condition\": \"If RSI(7) drops below 8 or price closes below 3696 on 3-minute candle\",\n      \"leverage\": 15,\n      \"confidence\": 0.80,\n      \"risk_usd\": 500\n    }\n  },\n  \"XRP\": {\n    \"trade_signal_args\": {\n      \"coin\": \"XRP\",\n      \"signal\": \"buy\",\n      \"quantity\": 1700,\n      \"profit_target\": 2.55,\n      \"stop_loss\": 2.40,\n      \"invalidation_condition\": \"If RSI(7) drops below 10 or price closes below 2.40 on 3-minute candle\",\n      \"leverage\": 12,\n      \"confidence\": 0.75,\n      \"risk_usd\": 425\n    }\n  },\n  \"BTC\": {\n    \"trade_signal_args\": {\n      \"coin\": \"BTC\",\n      \"signal\": \"buy\",\n      \"quantity\": 0.045,\n      \"profit_target\": 111500,\n      \"stop_loss\": 105500,\n      \"invalidation_condition\": \"If RSI(7) drops below 12 or price closes below 105500 on 3-minute candle\",\n      \"leverage\": 12,\n      \"confidence\": 0.72,\n      \"risk_usd\": 575\n    }\n  }\n}\n```",
      "signals": [
        {
          "coin": "DOGE",
          "signal": "buy",
          "quantity": 28000.0,
          "leverage": 15,
          "stop_loss": 0.1769,
          "profit_target": 0.1887,
          "confidence": 0.78,
          "risk_usd": 500.0,
          "invalidation_condition": "If RSI(7) drops below 8 or price closes below 0.1769 on 3-minute candle"
        },
        {
          "coin": "ETH",
          "signal": "buy",
          "quantity": 1.3,
          "leverage": 15,
          "stop_loss": 3696.0,
          "profit_target": 3930.0,
          "confidence": 0.8,
          "risk_usd": 500.0,
          "invalidation_condition": "If RSI(7) drops below 8 or price closes below 3696 on 3-minute candle"
        },
        {
          "coin": "XRP",
          "signal": "buy",
          "quantity": 1700.0,
          "leverage": 12,
          "stop_loss": 2.4,
          "profit_target": 2.55,
          "confidence": 0.75,
          "risk_usd": 425.0,
          "invalidation_condition": "If RSI(7) drops below 10 or price closes below 2.40 on 3-minute candle"
        },
        {
          "coin": "BTC",
          "signal": "buy",
          "quantity": 0.045,
          "leverage": 12,
          "stop_loss": 105500.0,
          "profit_target": 111500.0,
          "confidence": 0.72,
          "risk_usd": 575.0,
          "invalidation_condition": "If RSI(7) drops below 12 or price closes below 105500 on 3-minute candle"
        }
      ]
    },
    {
      "iteration": 83,
      "timestamp": "2025-10-30T16:00:00",
      "model": "anthropic",
      "raw_response": "# CHAIN OF THOUGHT\n\n## Current Market Analysis\nThe entire crypto market is experiencing a severe selloff with all coins showing extreme oversold conditions:\n- **BTC**: RSI(7) = 11.79 (extreme oversold), down from 113569 to 106526 (-6.2%)\n- **ETH**: RSI(7) = 6.60 (extreme oversold), down from 4022 to 3688 (-8.3%)\n- **SOL**: RSI(7) = 10.53 (extreme oversold), down from 195.67 to 179.02 (-8.5%)\n- **BNB**: RSI(7) = 11.19 (extreme oversold), down from 1116.60 to 1061.20 (-5.0%)\n- **XRP**: RSI(7) = 7.73 (extreme oversold), down from 2.63 to 2.38 (-9.5%)\n- **DOGE**: RSI(7) = 8.01 (extreme oversold), down from 0.194 to 0.177 (-8.9%)\n\nAll coins are trading well below their EMA20, with negative MACD and declining momentum. This is a capitulation-style move.\n\n## Position Review: BTC Long\n\n**Entry Details:**\n- Entry Price: 107,752\n- Current Price: 106,526\n- Quantity: 0.045 BTC\n- Leverage: 12x\n- Unrealized P&L: -$57.59\n- Stop Loss: 105,500\n- Profit Target: 111,500\n- Invalidation: \"If RSI(7) drops below 12 or price closes below 105500 on 3-minute candle\"\n\n**Critical Analysis:**\n1. **Invalidation Condition Check**: RSI(7) is currently 11.794, which is BELOW the 12 threshold specified in the invalidation condition\n2. **Price Action**: Price has dropped from entry 107,752 to 106,526 (-1,226 points or -1.14%)\n3. **Stop Loss Proximity**: Current price 106,526 is only 1,026 points above stop loss at 105,500 (less than 1% buffer)\n4. **Technical Deterioration**: \n   - RSI(7) at 11.79 is in extreme oversold territory\n   - MACD at -1641.77 and accelerating downward\n   - Price trading 5,036 points below EMA20\n   - Consecutive lower lows in the price series\n\n**Decision: CLOSE POSITION**\n\nThe invalidation condition has been triggered (RSI(7) < 12). While extreme oversold conditions often precede bounces, the invalidation rule is clear and must be respected. The position is showing:\n- Invalidation condition MET (RSI below 12)\n- Negative P&L of $57.59\n- Strong downward momentum with no signs of reversal\n- Risk of further deterioration toward stop loss\n\nThis is proper risk management - the trade thesis has been invalidated per the predefined rules.\n\n## New Position Opportunities\n\nGiven the extreme oversold conditions across all assets (RSI(7) between 6-12), there is potential for mean reversion bounces. However:\n- The momentum is strongly negative across all coins\n- No clear reversal signals yet (need to see RSI divergence or price stabilization)\n- Better to wait for confirmation rather than catch a falling knife\n- Account is down -2.15%, preserving capital is priority\n\n**Decision: No new positions at this time**\n\nWait for:\n1. RSI to form a higher low while price makes a lower low (bullish divergence)\n2. Price to stabilize and form a base\n3. MACD to show signs of flattening or turning positive\n4. Clear reversal candle patterns\n\n# TRADING DECISIONS\n\n```json\n{\n  \"BTC\": {\n    \"trade_signal_args\": {\n      \"coin\": \"BTC\",\n      \"signal\": \"close_position\",\n      \"quantity\": 0.045,\n      \"profit_target\": 111500.0,\n      \"stop_loss\": 105500.0,\n      \"invalidation_condition\": \"If RSI(7) drops below 12 or price closes below 105500 on 3-minute candle\",\n      \"leverage\": 12,\n      \"confidence\": 0.72,\n      \"risk_usd\": 575.0,\n      \"close_reason\": \"Invalidation condition met - RSI(7) at 11.79 has dropped below the 12 threshold specified in exit plan. Strong downward momentum continues with no reversal signals.\"\n    }\n  }\n}\n```",
      "signals": [
        {
          "coin": "BTC",
          "signal": "close_position",
          "quantity": 0.045,
          "leverage": 12,
          "stop_loss": 105500.0,
          "profit_target": 111500.0,
          "confidence": 0.72,
          "risk_usd": 575.0,
          "invalidation_condition": "If RSI(7) drops below 12 or price closes below 105500 on 3-minute candle"
        }
      ]
    },
    {
      "iteration": 84,
      "timestamp": "2025-10-30T20:00:00",
      "model": "anthropic",
      "raw_response": "# CHAIN OF THOUGHT\n\n## Current Market Analysis\n\nI have NO open positions currently. Account value is $9,787.22 with -2.13% total return. I need to evaluate whether current market conditions present good entry opportunities.\n\n### Market Overview:\nAll major coins are showing significant bearish pressure:\n- **BTC**: Down from 113K to 108K (-4.2%), RSI 41, deeply negative MACD (-1681), price well below EMA20 (111,252)\n- **ETH**: Down from 4008 to 3803 (-5.1%), RSI 43, negative MACD (-96), below EMA20 (3949)\n- **SOL**: Down from 198 to 184 (-7.0%), RSI 37, negative MACD (-3.5), below EMA20 (193)\n- **BNB**: Down from 1113 to 1078 (-3.1%), RSI 37, negative MACD (-14.8), below EMA20 (1108)\n- **XRP**: Down from 2.65 to 2.44 (-7.9%), RSI 32, negative MACD (-0.052), below EMA20 (2.56)\n- **DOGE**: Down from 0.195 to 0.182 (-6.7%), RSI 39, negative MACD (-0.005), below EMA20 (0.191)\n\n### Technical Assessment:\n\n**Bearish Indicators:**\n- All coins trading below their 20-period EMAs\n- All MACD indicators deeply negative and declining\n- RSI values in oversold territory (30-43 range) but not yet showing reversal\n- Volume below average on most coins\n- Consistent downtrend across all timeframes\n\n**Potential Reversal Signs:**\n- RSI values have bounced from extreme lows (BTC was at 11.7, now 41; ETH was at 6.5, now 43)\n- Recent price action shows some recovery from lows (BTC from 106K to 108K, ETH from 3688 to 3803)\n- RSI divergence potential - prices making lower lows but RSI showing higher lows\n\n### Risk Assessment:\n\nGiven the sharp selloff and oversold conditions, there are two scenarios:\n1. **Dead cat bounce** - temporary relief rally before further decline\n2. **Reversal setup** - capitulation bottom with strong bounce potential\n\nThe recent RSI recovery from extreme oversold levels (single digits) suggests potential short-term bounce, but the trend remains bearish with all coins below EMAs and negative MACD.\n\n### Trading Decision:\n\n**I will WAIT and NOT enter any positions** because:\n1. No clear reversal confirmation - need to see price reclaim EMA20 or bullish MACD crossover\n2. Strong downtrend still intact across all timeframes\n3. Risk/reward unfavorable in middle of downtrend\n4. Better to wait for either: (a) clear bottom formation with reversal signals, or (b) trend continuation with better entry on pullback\n5. Preserving capital is priority given -2.13% drawdown\n\nThe market needs to show stronger signs of stabilization before committing capital. I'll monitor for:\n- Price breaking above EMA20\n- MACD turning positive or showing bullish divergence\n- RSI sustaining above 50\n- Volume increase on upward moves\n\n# TRADING DECISIONS\n\n{}",
      "signals": []
    },
    {
      "iteration": 85,
      "timestamp": "2025-10-31T00:00:00",
      "model": "anthropic",
      "raw_response": "# CHAIN OF THOUGHT\n\n\u26a0\ufe0f **CRITICAL: This is the FINAL candle of the backtest period. I must close ALL open positions.**\n\n## Current Portfolio Status\n- **No open positions currently**\n- Available Cash: $9,787.22\n- Total Return: -2.13%\n- Sharpe Ratio: -0.730\n\nSince I have NO open positions and this is the final candle, there are no positions to close. The backtest requirement to close all positions is already satisfied.\n\n## Market Analysis (for context only - not trading)\n\n**BTC**: Price 109,241 below EMA20 (110,946). RSI recovering to 51.6 from oversold. MACD still negative (-1,476) but improving slightly. Downtrend showing signs of stabilization but still weak.\n\n**ETH**: Price 3,828 below EMA20 (3,928). RSI at 49.1, neutral. MACD negative (-80.7). Similar pattern to BTC - recovering from oversold but still in downtrend.\n\n**SOL**: Price 185.12 below EMA20 (192.16). RSI 40.1, still weak. MACD negative (-3.5). Underperforming with continued weakness.\n\n**BNB**: Price 1,085 below EMA20 (1,105). RSI 46.0, neutral. MACD negative (-13.7). Showing some recovery but still below key levels.\n\n**XRP**: Price 2.47 below EMA20 (2.55). RSI 44.4, neutral-weak. MACD negative (-0.047). Weak momentum.\n\n**DOGE**: Price 0.1844 below EMA20 (0.1905). RSI 47.2, neutral. MACD negative (-0.004). Slight recovery but still in downtrend.\n\n## Decision\nSince this is the **FINAL candle** and I have **NO open positions**, there is nothing to do. The backtest requirement is satisfied - no positions will remain open at the end.\n\nI will NOT open any new positions on the final candle as that would be inappropriate and would leave positions open at backtest end.\n\n# TRADING DECISIONS\n\n{}",
      "signals": []
    }
  ]
}