{
  "backtest_info": {
    "checkpoint_id": "anthropic_oct_31_temp07_trial4",
    "start_date": "2025-10-17",
    "end_date": "2025-10-31",
    "model": "anthropic",
    "coins": [
      "BTC",
      "ETH",
      "SOL",
      "BNB",
      "XRP",
      "DOGE"
    ],
    "interval": "4h",
    "total_iterations": 85,
    "exported_at": "2025-11-03T13:06:31.718266"
  },
  "iterations": [
    {
      "iteration": 1,
      "timestamp": "2025-10-17T00:00:00",
      "model": "anthropic",
      "raw_response": "# CHAIN OF THOUGHT\n\nThis is my first trading invocation with a clean $10,000 account and no open positions. I need to analyze the market conditions for potential entry opportunities.\n\n## Market Analysis by Coin:\n\n**BTC (Current: $109,160)**\n- Price significantly below EMA20 ($111,104), indicating downtrend\n- MACD deeply negative (-1,429), showing strong bearish momentum\n- RSI(7) at 43.8 recovering from oversold (was 20.8), RSI(14) at 37.4\n- Price dropped from $111,268 to $108,211 (sharp selloff), now bouncing to $109,160\n- Volume below average (3,549 vs 7,857) - weak participation\n- Assessment: Potential bounce from oversold, but trend still bearish. Risky entry.\n\n**ETH (Current: $3,930.90)**\n- Price below EMA20 ($4,023), bearish positioning\n- MACD negative (-71.78), showing bearish momentum\n- RSI(7) at 45.5 recovering from 21.4, RSI(14) at 39.9\n- Similar pattern to BTC - sharp drop from $4,061 to $3,864, now recovering\n- Volume very low (52,185 vs 135,854) - concerning\n- Assessment: Oversold bounce but weak volume, risky setup\n\n**SOL (Current: $186.91)**\n- Price well below EMA20 ($195.30), clear downtrend\n- MACD negative (-5.057), weakening momentum\n- RSI(7) at 35.5 recovering from 19.0, RSI(14) at 32.6\n- Dropped from $197 to $184.76, now bouncing\n- Volume weak (464k vs 1.19M)\n- Assessment: Oversold but still in downtrend\n\n**BNB (Current: $1,149.30)**\n- Price below EMA20 ($1,188), downtrend\n- MACD negative (-31.54)\n- RSI(7) at 37.7 recovering from 13.5 (extreme oversold), RSI(14) at 32.6\n- Sharp drop from $1,183 to $1,134, now stabilizing\n- Very low volume (4,336 vs 19,294)\n- Assessment: Extreme oversold bounce potential but weak structure\n\n**XRP (Current: $2.36)**\n- Price below EMA20 ($2.44), bearish\n- MACD negative (-0.058)\n- RSI(7) at 41.5 recovering from 20.2, RSI(14) at 35.1\n- Dropped from $2.45 to $2.33, now recovering\n- Volume above average (13.07M vs 10.32M) - positive sign\n- Assessment: Best relative strength, volume supporting\n\n**DOGE (Current: $0.190230)**\n- Price below EMA20 ($0.198261), downtrend\n- MACD negative (-0.005)\n- RSI(7) at 37.3 recovering from 18.5, RSI(14) at 32.7\n- Dropped from $0.200 to $0.187, now bouncing\n- Volume very weak (16.19M vs 67.54M)\n- Assessment: Weak structure, low volume\n\n## Trading Decision:\n\nAll coins are in clear downtrends with prices below their EMA20s and negative MACDs. However, RSI indicators show oversold bounces are occurring across the board. This is a counter-trend setup which is inherently risky.\n\n**Best opportunity: XRP**\n- Strongest relative performance\n- Volume above average (only coin with this)\n- RSI recovery from deeply oversold\n- Tightest risk management possible given small price\n\nI'll take ONE position in XRP with tight risk management, using moderate leverage (15x) to test the oversold bounce thesis. If this fails, I'll reassess market conditions.\n\n**Risk Management:**\n- Entry: $2.36\n- Stop-loss: $2.30 (2.5% below, just under recent low of $2.33)\n- Profit target: $2.48 (5% above, near EMA20 resistance at $2.44)\n- Invalidation: If price closes below $2.30 or RSI(7) drops back below 25\n- Position size: ~$2,500 notional ($167 actual with 15x leverage)\n- Risk: ~$100 (1% of account)\n\n# TRADING DECISIONS\n\n```json\n{\n  \"XRP\": {\n    \"trade_signal_args\": {\n      \"coin\": \"XRP\",\n      \"signal\": \"buy\",\n      \"quantity\": 1059,\n      \"profit_target\": 2.48,\n      \"stop_loss\": 2.30,\n      \"invalidation_condition\": \"If price closes below $2.30 on 3-minute candle or RSI(7) drops back below 25\",\n      \"leverage\": 15,\n      \"confidence\": 0.55,\n      \"risk_usd\": 95.31\n    }\n  }\n}\n```",
      "signals": [
        {
          "coin": "XRP",
          "signal": "buy",
          "quantity": 1059.0,
          "leverage": 15,
          "stop_loss": 2.3,
          "profit_target": 2.48,
          "confidence": 0.55,
          "risk_usd": 95.31,
          "invalidation_condition": "If price closes below $2.30 on 3-minute candle or RSI(7) drops back below 25"
        }
      ]
    },
    {
      "iteration": 2,
      "timestamp": "2025-10-17T04:00:00",
      "model": "anthropic",
      "raw_response": "# CHAIN OF THOUGHT\n\n## Market Analysis\n\nThe entire crypto market is experiencing a severe flash crash across all assets:\n\n**BTC**: Down from 111,268 to 105,589 (-5.1%) in 30 minutes. RSI(7) at 17.8 (extreme oversold), RSI(14) at 22.3. Price well below EMA20 (110,350). MACD deeply negative at -1,386. This is a capitulation-level move.\n\n**ETH**: Down from 4,012 to 3,756 (-6.4%). RSI(7) at 20.6 (extreme oversold), RSI(14) at 25.5. Price 6% below EMA20. MACD at -68.5.\n\n**SOL**: Down from 196.8 to 177.65 (-9.7%). RSI(7) at 16.4 (most oversold), RSI(14) at 21.5. Price 8% below EMA20.\n\n**BNB**: Down from 1,183 to 1,062 (-10.2%). RSI(7) at 9.5 (EXTREMELY oversold - lowest I've seen), RSI(14) at 14.7. Price 9.5% below EMA20.\n\n**XRP**: Down from 2.45 to 2.24 (-8.6%). RSI(7) at 17.4, RSI(14) at 21.1.\n\n**DOGE**: Down from 0.200 to 0.178 (-11%). RSI(7) at 14.8, RSI(14) at 19.2.\n\n## Current Position Status\nI have NO open positions currently. Account value: $9,868.60 (down 1.31% from initial).\n\n## Trading Decision Rationale\n\nThis is a classic flash crash scenario with ALL coins showing:\n- Extreme RSI oversold readings (all RSI(7) below 20, most below 18)\n- Prices 6-10% below EMA20\n- Deeply negative MACD\n- High volume suggesting capitulation\n\n**Opportunity**: These are bounce conditions. When RSI(7) drops below 20 across the board, we typically see mean reversion bounces of 3-8% within hours.\n\n**Strategy**: I'll enter LONG positions on the most oversold coins with tight stop-losses below recent lows, targeting quick 4-6% bounces back toward EMA20 levels.\n\n**Position Sizing**: With $9,868 available, I'll allocate approximately $2,000-2,500 per position across 3-4 coins to diversify risk.\n\n**Selected Trades**:\n1. **BNB** - RSI(7) at 9.5 is historically extreme. Target bounce to 1,120 (+5.4%)\n2. **DOGE** - RSI(7) at 14.8, down 11%. Target bounce to 0.188 (+5.3%)\n3. **SOL** - RSI(7) at 16.4, down 9.7%. Target bounce to 186 (+4.7%)\n4. **XRP** - RSI(7) at 17.4. Target bounce to 2.35 (+4.9%)\n\nI'll use 15x leverage for these mean reversion plays with tight 2-3% stop-losses.\n\n# TRADING DECISIONS\n\n```json\n{\n  \"BNB\": {\n    \"trade_signal_args\": {\n      \"coin\": \"BNB\",\n      \"signal\": \"buy\",\n      \"quantity\": 0.035,\n      \"profit_target\": 1120.0,\n      \"stop_loss\": 1035.0,\n      \"invalidation_condition\": \"If price drops below 1035 or RSI(7) fails to recover above 25 within 30 minutes\",\n      \"leverage\": 15,\n      \"confidence\": 0.78,\n      \"risk_usd\": 2500\n    }\n  },\n  \"DOGE\": {\n    \"trade_signal_args\": {\n      \"coin\": \"DOGE\",\n      \"signal\": \"buy\",\n      \"quantity\": 210000,\n      \"profit_target\": 0.188,\n      \"stop_loss\": 0.173,\n      \"invalidation_condition\": \"If price drops below 0.173 or fails to bounce above 0.182 within 30 minutes\",\n      \"leverage\": 15,\n      \"confidence\": 0.75,\n      \"risk_usd\": 2500\n    }\n  },\n  \"SOL\": {\n    \"trade_signal_args\": {\n      \"coin\": \"SOL\",\n      \"signal\": \"buy\",\n      \"quantity\": 200,\n      \"profit_target\": 186.0,\n      \"stop_loss\": 172.0,\n      \"invalidation_condition\": \"If price drops below 172 or RSI(7) fails to recover above 30 within 30 minutes\",\n      \"leverage\": 15,\n      \"confidence\": 0.72,\n      \"risk_usd\": 2000\n    }\n  },\n  \"XRP\": {\n    \"trade_signal_args\": {\n      \"coin\": \"XRP\",\n      \"signal\": \"buy\",\n      \"quantity\": 16700,\n      \"profit_target\": 2.35,\n      \"stop_loss\": 2.17,\n      \"invalidation_condition\": \"If price drops below 2.17 or fails to recover above 2.30 within 30 minutes\",\n      \"leverage\": 15,\n      \"confidence\": 0.70,\n      \"risk_usd\": 2000\n    }\n  }\n}\n```",
      "signals": [
        {
          "coin": "BNB",
          "signal": "buy",
          "quantity": 0.035,
          "leverage": 15,
          "stop_loss": 1035.0,
          "profit_target": 1120.0,
          "confidence": 0.78,
          "risk_usd": 2500.0,
          "invalidation_condition": "If price drops below 1035 or RSI(7) fails to recover above 25 within 30 minutes"
        },
        {
          "coin": "DOGE",
          "signal": "buy",
          "quantity": 210000.0,
          "leverage": 15,
          "stop_loss": 0.173,
          "profit_target": 0.188,
          "confidence": 0.75,
          "risk_usd": 2500.0,
          "invalidation_condition": "If price drops below 0.173 or fails to bounce above 0.182 within 30 minutes"
        },
        {
          "coin": "SOL",
          "signal": "buy",
          "quantity": 200.0,
          "leverage": 15,
          "stop_loss": 172.0,
          "profit_target": 186.0,
          "confidence": 0.72,
          "risk_usd": 2000.0,
          "invalidation_condition": "If price drops below 172 or RSI(7) fails to recover above 30 within 30 minutes"
        },
        {
          "coin": "XRP",
          "signal": "buy",
          "quantity": 16700.0,
          "leverage": 15,
          "stop_loss": 2.17,
          "profit_target": 2.35,
          "confidence": 0.7,
          "risk_usd": 2000.0,
          "invalidation_condition": "If price drops below 2.17 or fails to recover above 2.30 within 30 minutes"
        }
      ]
    },
    {
      "iteration": 3,
      "timestamp": "2025-10-17T08:00:00",
      "model": "anthropic",
      "raw_response": "# CHAIN OF THOUGHT\n\nReviewing my current positions and their invalidation conditions:\n\n## BNB Position Analysis\n- Entry: 1062.6, Current: 1071.7 (+0.86%)\n- Unrealized PnL: +$0.30\n- Stop-loss: 1035, Profit target: 1120\n- Invalidation: \"If price drops below 1035 or RSI(7) fails to recover above 25 within 30 minutes\"\n- Current RSI(7): 18.184 (EXTREMELY OVERSOLD)\n- Time check: Position entered ~3 minutes ago, RSI still at 18.184 (below 25)\n- MACD: -23.812 (strongly negative), Price well below EMA20 (1153.12)\n- **CRITICAL**: RSI(7) has NOT recovered above 25, still deeply oversold at 18.184. This is concerning but we're only 3 minutes into the 30-minute window. However, the price is holding above stop-loss (1035).\n- Decision: **HOLD** - Price above stop-loss, within 30-minute recovery window, but monitoring closely.\n\n## DOGE Position Analysis\n- Entry: 0.17849, Current: 0.18261 (+2.31%)\n- Unrealized PnL: +$846.46 (STRONG)\n- Stop-loss: 0.173, Profit target: 0.188\n- Invalidation: \"If price drops below 0.173 or fails to bounce above 0.182 within 30 minutes\"\n- Current RSI(7): 33.667 (recovering from oversold)\n- Price: 0.18261 > 0.182 threshold \u2713\n- MACD: -0.004 (negative but improving), Price below EMA20 (0.192992)\n- **Status**: Price HAS bounced above 0.182 successfully! Invalidation condition NOT met.\n- Decision: **HOLD** - Strong profit, above invalidation level, RSI recovering.\n\n## SOL Position Analysis\n- Entry: 177.65, Current: 181.47 (+2.15%)\n- Unrealized PnL: +$746.23 (STRONG)\n- Stop-loss: 172, Profit target: 186\n- Invalidation: \"If price drops below 172 or RSI(7) fails to recover above 30 within 30 minutes\"\n- Current RSI(7): 35.632 (ABOVE 30 threshold \u2713)\n- MACD: -3.552 (negative), Price below EMA20 (190.58)\n- **Status**: RSI(7) HAS recovered above 30! Price well above stop-loss. Invalidation condition NOT met.\n- Decision: **HOLD** - Good profit, RSI recovered, approaching profit target.\n\n## XRP Position Analysis\n- Entry: 2.2374, Current: 2.2812 (+1.96%)\n- Unrealized PnL: +$712.78 (STRONG)\n- Stop-loss: 2.17, Profit target: 2.35\n- Invalidation: \"If price drops below 2.17 or fails to recover above 2.30 within 30 minutes\"\n- Current RSI(7): 35.633 (recovering from oversold)\n- Price: 2.2812 < 2.30 threshold (has NOT recovered above 2.30 yet)\n- MACD: -0.042 (negative), Price below EMA20 (2.39)\n- **Status**: Price has NOT yet recovered above 2.30, but we're only 3 minutes into the 30-minute window. Price is well above stop-loss.\n- Decision: **HOLD** - Within 30-minute recovery window, good profit, above stop-loss.\n\n## New Position Opportunities\n- **BTC**: RSI(7) 19.327 (extremely oversold), MACD -1264.47, massive selloff from 111K to 105K. Too risky in current freefall.\n- **ETH**: RSI(7) 27.023 (oversold), MACD -45.685, similar selloff pattern. Not entering during panic.\n\n## Portfolio Status\n- Total unrealized PnL: +$2,305.77 (+18.8% on positions)\n- All positions are profitable\n- Account value: $12,276.57 (up 22.77%)\n- Available cash: $2,452.42\n\n**Risk Management Decision**: All positions showing profit and none have triggered invalidation conditions yet. BNB is concerning with RSI(7) at 18.184, but still within the 30-minute recovery window. Will hold all positions as they're above stop-losses and within their invalidation timeframes.\n\n# TRADING DECISIONS\n\n```json\n{\n  \"BNB\": {\n    \"trade_signal_args\": {\n      \"coin\": \"BNB\",\n      \"signal\": \"hold\",\n      \"quantity\": 0.035,\n      \"profit_target\": 1120.0,\n      \"stop_loss\": 1035.0,\n      \"invalidation_condition\": \"If price drops below 1035 or RSI(7) fails to recover above 25 within 30 minutes\",\n      \"leverage\": 15,\n      \"confidence\": 0.65,\n      \"risk_usd\": 2500.0\n    }\n  },\n  \"DOGE\": {\n    \"trade_signal_args\": {\n      \"coin\": \"DOGE\",\n      \"signal\": \"hold\",\n      \"quantity\": 210000.0,\n      \"profit_target\": 0.188,\n      \"stop_loss\": 0.173,\n      \"invalidation_condition\": \"If price drops below 0.173 or fails to bounce above 0.182 within 30 minutes\",\n      \"leverage\": 15,\n      \"confidence\": 0.80,\n      \"risk_usd\": 2500.0\n    }\n  },\n  \"SOL\": {\n    \"trade_signal_args\": {\n      \"coin\": \"SOL\",\n      \"signal\": \"hold\",\n      \"quantity\": 200.0,\n      \"profit_target\": 186.0,\n      \"stop_loss\": 172.0,\n      \"invalidation_condition\": \"If price drops below 172 or RSI(7) fails to recover above 30 within 30 minutes\",\n      \"leverage\": 15,\n      \"confidence\": 0.82,\n      \"risk_usd\": 2000.0\n    }\n  },\n  \"XRP\": {\n    \"trade_signal_args\": {\n      \"coin\": \"XRP\",\n      \"signal\": \"hold\",\n      \"quantity\": 16700.0,\n      \"profit_target\": 2.35,\n      \"stop_loss\": 2.17,\n      \"invalidation_condition\": \"If price drops below 2.17 or fails to recover above 2.30 within 30 minutes\",\n      \"leverage\": 15,\n      \"confidence\": 0.75,\n      \"risk_usd\": 2000.0\n    }\n  }\n}\n```",
      "signals": [
        {
          "coin": "BNB",
          "signal": "hold",
          "quantity": 0.035,
          "leverage": 15,
          "stop_loss": 1035.0,
          "profit_target": 1120.0,
          "confidence": 0.65,
          "risk_usd": 2500.0,
          "invalidation_condition": "If price drops below 1035 or RSI(7) fails to recover above 25 within 30 minutes"
        },
        {
          "coin": "DOGE",
          "signal": "hold",
          "quantity": 210000.0,
          "leverage": 15,
          "stop_loss": 0.173,
          "profit_target": 0.188,
          "confidence": 0.8,
          "risk_usd": 2500.0,
          "invalidation_condition": "If price drops below 0.173 or fails to bounce above 0.182 within 30 minutes"
        },
        {
          "coin": "SOL",
          "signal": "hold",
          "quantity": 200.0,
          "leverage": 15,
          "stop_loss": 172.0,
          "profit_target": 186.0,
          "confidence": 0.82,
          "risk_usd": 2000.0,
          "invalidation_condition": "If price drops below 172 or RSI(7) fails to recover above 30 within 30 minutes"
        },
        {
          "coin": "XRP",
          "signal": "hold",
          "quantity": 16700.0,
          "leverage": 15,
          "stop_loss": 2.17,
          "profit_target": 2.35,
          "confidence": 0.75,
          "risk_usd": 2000.0,
          "invalidation_condition": "If price drops below 2.17 or fails to recover above 2.30 within 30 minutes"
        }
      ]
    },
    {
      "iteration": 4,
      "timestamp": "2025-10-17T12:00:00",
      "model": "anthropic",
      "raw_response": "# CHAIN OF THOUGHT\n\nReviewing my current 4 open positions against their invalidation conditions and technical indicators:\n\n## BNB Position Analysis\n- Entry: 1062.6, Current: 1074.0 (+1.07%)\n- Unrealized PnL: +$0.38 (minimal gain)\n- Stop-loss: 1035.0, Profit target: 1120.0\n- Invalidation: \"If price drops below 1035 or RSI(7) fails to recover above 25 within 30 minutes\"\n- Current RSI(7): 20.752 (EXTREMELY OVERSOLD - below 25)\n- Technical context: Price at 1074 is well above stop-loss (1035), but RSI(7) has been declining and is now at 20.752, which is BELOW the 25 threshold mentioned in invalidation condition\n- MACD: -22.672 (strongly negative and worsening)\n- Price below EMA20 (1142.29) - bearish trend\n- **DECISION: CLOSE** - Invalidation condition partially met (RSI(7) at 20.752 is below 25 and showing no recovery). The position has been open for enough time and RSI continues to deteriorate. Risk management dictates exit.\n\n## DOGE Position Analysis\n- Entry: 0.17849, Current: 0.18475 (+3.51%)\n- Unrealized PnL: +$1,295.86 (STRONG GAIN - 3.34% account value)\n- Stop-loss: 0.173, Profit target: 0.188\n- Invalidation: \"If price drops below 0.173 or fails to bounce above 0.182 within 30 minutes\"\n- Current RSI(7): 42.470 (recovering from oversold)\n- Price: 0.18475 is ABOVE the 0.182 bounce level mentioned in invalidation\n- MACD: -0.004 (negative but stabilizing)\n- Price below EMA20 (0.192365) but showing recovery momentum\n- **DECISION: HOLD** - Invalidation NOT met. Price successfully bounced above 0.182, RSI recovering, and position is profitable. Close to profit target (0.188), will monitor.\n\n## SOL Position Analysis\n- Entry: 177.65, Current: 182.74 (+2.86%)\n- Unrealized PnL: +$1,000.24 (STRONG GAIN - 7.49% account value)\n- Stop-loss: 172.0, Profit target: 186.0\n- Invalidation: \"If price drops below 172 or RSI(7) fails to recover above 30 within 30 minutes\"\n- Current RSI(7): 41.565 (ABOVE 30 - recovery confirmed)\n- Price: 182.74 is well above stop-loss and approaching profit target (186.0)\n- MACD: -3.878 (negative but improving from -3.728)\n- Price below EMA20 (189.96) but showing strong recovery\n- **DECISION: HOLD** - Invalidation NOT met. RSI(7) at 41.565 is well above 30 threshold, price strong, approaching profit target. Let it run to 186.0 target.\n\n## XRP Position Analysis\n- Entry: 2.2374, Current: 2.30 (+2.79%)\n- Unrealized PnL: +$1,025.07 (STRONG GAIN - 7.67% account value)\n- Stop-loss: 2.17, Profit target: 2.35\n- Invalidation: \"If price drops below 2.17 or fails to recover above 2.30 within 30 minutes\"\n- Current RSI(7): 42.797 (recovering from oversold)\n- Price: 2.30 is EXACTLY at the 2.30 recovery level mentioned in invalidation\n- MACD: -0.044 (negative but stabilizing)\n- Price below EMA20 (2.38) but showing recovery\n- **DECISION: HOLD** - Invalidation NOT met. Price has successfully recovered to 2.30, RSI recovering. Position profitable and moving toward 2.35 target.\n\n## Portfolio Risk Assessment\n- Total unrealized PnL: +$3,321.55 (24.87% of account value)\n- Three positions showing strong gains (DOGE, SOL, XRP)\n- One position marginal with invalidation concerns (BNB)\n- Account value: $13,360.05 (33.60% total return)\n- Risk management: Close BNB due to invalidation, hold profitable positions approaching targets\n\n# TRADING DECISIONS\n\n```json\n{\n  \"BNB\": {\n    \"trade_signal_args\": {\n      \"coin\": \"BNB\",\n      \"signal\": \"close_position\",\n      \"quantity\": 0.035,\n      \"profit_target\": 1120.0,\n      \"stop_loss\": 1035.0,\n      \"invalidation_condition\": \"If price drops below 1035 or RSI(7) fails to recover above 25 within 30 minutes\",\n      \"leverage\": 15,\n      \"confidence\": 0.78,\n      \"risk_usd\": 2500.0,\n      \"close_reason\": \"Invalidation condition met - RSI(7) at 20.752 is below 25 threshold and showing continued weakness. Position has been open 30+ minutes with no RSI recovery. Risk management exit.\"\n    }\n  },\n  \"DOGE\": {\n    \"trade_signal_args\": {\n      \"coin\": \"DOGE\",\n      \"signal\": \"hold\",\n      \"quantity\": 210000.0,\n      \"profit_target\": 0.188,\n      \"stop_loss\": 0.173,\n      \"invalidation_condition\": \"If price drops below 0.173 or fails to bounce above 0.182 within 30 minutes\",\n      \"leverage\": 15,\n      \"confidence\": 0.75,\n      \"risk_usd\": 2500.0\n    }\n  },\n  \"SOL\": {\n    \"trade_signal_args\": {\n      \"coin\": \"SOL\",\n      \"signal\": \"hold\",\n      \"quantity\": 200.0,\n      \"profit_target\": 186.0,\n      \"stop_loss\": 172.0,\n      \"invalidation_condition\": \"If price drops below 172 or RSI(7) fails to recover above 30 within 30 minutes\",\n      \"leverage\": 15,\n      \"confidence\": 0.72,\n      \"risk_usd\": 2000.0\n    }\n  },\n  \"XRP\": {\n    \"trade_signal_args\": {\n      \"coin\": \"XRP\",\n      \"signal\": \"hold\",\n      \"quantity\": 16700.0,\n      \"profit_target\": 2.35,\n      \"stop_loss\": 2.17,\n      \"invalidation_condition\": \"If price drops below 2.17 or fails to recover above 2.30 within 30 minutes\",\n      \"leverage\": 15,\n      \"confidence\": 0.7,\n      \"risk_usd\": 2000.0\n    }\n  }\n}\n```",
      "signals": [
        {
          "coin": "BNB",
          "signal": "close_position",
          "quantity": 0.035,
          "leverage": 15,
          "stop_loss": 1035.0,
          "profit_target": 1120.0,
          "confidence": 0.78,
          "risk_usd": 2500.0,
          "invalidation_condition": "If price drops below 1035 or RSI(7) fails to recover above 25 within 30 minutes"
        },
        {
          "coin": "DOGE",
          "signal": "hold",
          "quantity": 210000.0,
          "leverage": 15,
          "stop_loss": 0.173,
          "profit_target": 0.188,
          "confidence": 0.75,
          "risk_usd": 2500.0,
          "invalidation_condition": "If price drops below 0.173 or fails to bounce above 0.182 within 30 minutes"
        },
        {
          "coin": "SOL",
          "signal": "hold",
          "quantity": 200.0,
          "leverage": 15,
          "stop_loss": 172.0,
          "profit_target": 186.0,
          "confidence": 0.72,
          "risk_usd": 2000.0,
          "invalidation_condition": "If price drops below 172 or RSI(7) fails to recover above 30 within 30 minutes"
        },
        {
          "coin": "XRP",
          "signal": "hold",
          "quantity": 16700.0,
          "leverage": 15,
          "stop_loss": 2.17,
          "profit_target": 2.35,
          "confidence": 0.7,
          "risk_usd": 2000.0,
          "invalidation_condition": "If price drops below 2.17 or fails to recover above 2.30 within 30 minutes"
        }
      ]
    },
    {
      "iteration": 5,
      "timestamp": "2025-10-17T16:00:00",
      "model": "anthropic",
      "raw_response": "# CHAIN OF THOUGHT\n\nAnalyzing my three open positions against their invalidation conditions and current market state:\n\n## DOGE Position Analysis\n- Entry: $0.17849, Current: $0.18427 (+3.24%)\n- Unrealized P&L: +$1,195.06 (strong profit)\n- Profit target: $0.188 (only 2.2% away)\n- Stop-loss: $0.173 (safe distance)\n- Invalidation: \"If price drops below 0.173 or fails to bounce above 0.182 within 30 minutes\"\n- Technical: RSI(7) = 40.76 (recovering from oversold), MACD = -0.005 (still negative), Price < EMA20 (0.192186)\n- **Decision: CLOSE POSITION - Taking profits**\n  - Price has bounced above 0.182 successfully (currently 0.18427)\n  - Near profit target with strong unrealized gains\n  - RSI showing recovery but price still below EMA20 suggests resistance ahead\n  - Market showing weakness across all coins - prudent to lock in profits\n\n## SOL Position Analysis\n- Entry: $177.65, Current: $181.93 (+2.41%)\n- Unrealized P&L: +$838.24 (good profit)\n- Profit target: $186.00 (2.2% away)\n- Stop-loss: $172.00 (safe distance)\n- Invalidation: \"If price drops below 172 or RSI(7) fails to recover above 30 within 30 minutes\"\n- Technical: RSI(7) = 38.37 (recovered above 30 \u2713), MACD = -5.249 (negative), Price < EMA20 (190.13)\n- **Status Check**: RSI has recovered above 30 (currently 38.37), so invalidation NOT met\n- **Decision: CLOSE POSITION - Taking profits**\n  - RSI recovered above 30 as required, but momentum is weak\n  - Price still significantly below EMA20 (190.13) showing resistance\n  - MACD deeply negative and worsening\n  - Broader market showing weakness - lock in gains\n\n## XRP Position Analysis\n- Entry: $2.2374, Current: $2.2959 (+2.61%)\n- Unrealized P&L: +$958.27 (strong profit)\n- Profit target: $2.35 (2.4% away)\n- Stop-loss: $2.17 (safe distance)\n- Invalidation: \"If price drops below 2.17 or fails to recover above 2.30 within 30 minutes\"\n- Technical: RSI(7) = 41.39 (recovering), MACD = -0.053 (negative), Price < EMA20 (2.38)\n- **Status Check**: Price at $2.30, exactly at the recovery threshold mentioned in invalidation\n- **Decision: HOLD**\n  - Price has just reached 2.30 threshold - give it time to confirm breakout\n  - RSI recovering (41.39), showing momentum improvement\n  - Still below EMA20 but closest to profit target\n  - Of all three positions, this has the best setup for reaching profit target\n\n## Market Context\n- All coins showing bearish pressure (prices < EMA20, negative MACD)\n- RSI values recovering from oversold but still in lower ranges\n- BTC down significantly (-2.6%), leading market weakness\n- Volume below average across board\n- Sharpe ratio of -26.87 indicates high volatility/risk\n\n## Risk Management Decision\nWith 2 positions showing good profits but weak momentum, and overall market weakness, I'll take profits on DOGE and SOL while giving XRP one more chance to hit its nearby profit target since it's showing the best relative strength.\n\n# TRADING DECISIONS\n\n```json\n{\n  \"DOGE\": {\n    \"trade_signal_args\": {\n      \"coin\": \"DOGE\",\n      \"signal\": \"close_position\",\n      \"quantity\": 210000.0,\n      \"profit_target\": 0.188,\n      \"stop_loss\": 0.173,\n      \"invalidation_condition\": \"If price drops below 0.173 or fails to bounce above 0.182 within 30 minutes\",\n      \"leverage\": 15,\n      \"confidence\": 0.75,\n      \"risk_usd\": 2500.0,\n      \"close_reason\": \"Taking profits - price successfully bounced above 0.182 invalidation level with +$1,195 unrealized gain, but broader market weakness and resistance at EMA20 suggests limited upside\"\n    }\n  },\n  \"SOL\": {\n    \"trade_signal_args\": {\n      \"coin\": \"SOL\",\n      \"signal\": \"close_position\",\n      \"quantity\": 200.0,\n      \"profit_target\": 186.0,\n      \"stop_loss\": 172.0,\n      \"invalidation_condition\": \"If price drops below 172 or RSI(7) fails to recover above 30 within 30 minutes\",\n      \"leverage\": 15,\n      \"confidence\": 0.72,\n      \"risk_usd\": 2000.0,\n      \"close_reason\": \"Taking profits - RSI recovered above 30 as required, but price remains well below EMA20 (190.13) with worsening MACD, locking in +$838 gain amid market weakness\"\n    }\n  },\n  \"XRP\": {\n    \"trade_signal_args\": {\n      \"coin\": \"XRP\",\n      \"signal\": \"hold\",\n      \"quantity\": 16700.0,\n      \"profit_target\": 2.35,\n      \"stop_loss\": 2.17,\n      \"invalidation_condition\": \"If price drops below 2.17 or fails to recover above 2.30 within 30 minutes\",\n      \"leverage\": 15,\n      \"confidence\": 0.7,\n      \"risk_usd\": 2000.0\n    }\n  }\n}\n```",
      "signals": [
        {
          "coin": "DOGE",
          "signal": "close_position",
          "quantity": 210000.0,
          "leverage": 15,
          "stop_loss": 0.173,
          "profit_target": 0.188,
          "confidence": 0.75,
          "risk_usd": 2500.0,
          "invalidation_condition": "If price drops below 0.173 or fails to bounce above 0.182 within 30 minutes"
        },
        {
          "coin": "SOL",
          "signal": "close_position",
          "quantity": 200.0,
          "leverage": 15,
          "stop_loss": 172.0,
          "profit_target": 186.0,
          "confidence": 0.72,
          "risk_usd": 2000.0,
          "invalidation_condition": "If price drops below 172 or RSI(7) fails to recover above 30 within 30 minutes"
        },
        {
          "coin": "XRP",
          "signal": "hold",
          "quantity": 16700.0,
          "leverage": 15,
          "stop_loss": 2.17,
          "profit_target": 2.35,
          "confidence": 0.7,
          "risk_usd": 2000.0,
          "invalidation_condition": "If price drops below 2.17 or fails to recover above 2.30 within 30 minutes"
        }
      ]
    },
    {
      "iteration": 6,
      "timestamp": "2025-10-17T20:00:00",
      "model": "anthropic",
      "raw_response": "# CHAIN OF THOUGHT\n\nReviewing my current position:\n\n**XRP Analysis:**\n- Current price: $2.29\n- Entry price: $2.2374\n- Unrealized P&L: +$893.14 (+2.44% gain)\n- Position size: 16,700 XRP at 15x leverage\n- Notional: $38,276\n- Exit plan: Profit target $2.35, Stop-loss $2.17\n- Invalidation: \"If price drops below 2.17 or fails to recover above 2.30 within 30 minutes\"\n\n**Checking invalidation condition:**\n- Price is at $2.29, NOT below $2.17 \u2713\n- Price has NOT recovered above $2.30 yet - it's been hovering around $2.28-$2.30 for the last several candles\n- The position has been open for some time now (6 invocations = ~12+ minutes)\n- The invalidation mentions \"within 30 minutes\" - we're still within that window\n\n**Technical analysis for XRP:**\n- RSI (7-period): 39.82 - oversold territory, showing potential for bounce\n- RSI (14-period): 36.04 - also oversold\n- MACD: -0.050 - still negative but stabilizing (was -0.050 for last 2 candles)\n- Price below EMA20 ($2.37) - bearish trend\n- Price action: Bounced from $2.24 low, recovered to $2.29-$2.30 range\n- Volume: 7.4M vs average 10.7M - below average\n\n**Decision reasoning:**\nThe invalidation condition states \"fails to recover above 2.30 within 30 minutes.\" We're currently at $2.29, very close to $2.30. The price has been consolidating in the $2.28-$2.30 range. Given:\n1. We're in profit (+$893)\n2. RSI is oversold, suggesting potential bounce\n3. Price is holding above stop-loss ($2.17)\n4. We're still within the 30-minute window\n5. Price is just $0.01 away from the $2.30 recovery level\n\nHowever, the broader market context shows:\n- All major coins (BTC, ETH, SOL, BNB) are in strong downtrends\n- Market-wide weakness with oversold conditions\n- XRP price below EMA20 and in downtrend\n- MACD still negative\n\n**Risk assessment:**\nGiven the weak market conditions and that we're approaching the time limit in the invalidation condition without a clear break above $2.30, the prudent decision is to **CLOSE** the position and take profits. The invalidation condition is borderline met (price hasn't recovered above $2.30 convincingly), and with broad market weakness, protecting the $893 gain is the smart risk management move.\n\n**Other coins analysis:**\n- BTC, ETH, SOL, BNB, DOGE: All showing strong bearish signals (RSI oversold, MACD negative, prices below EMAs)\n- Not entering new positions given the market-wide selloff\n- Better to preserve capital and wait for clearer setups\n\n# TRADING DECISIONS\n\n```json\n{\n  \"XRP\": {\n    \"trade_signal_args\": {\n      \"coin\": \"XRP\",\n      \"signal\": \"close_position\",\n      \"quantity\": 16700.0,\n      \"profit_target\": 2.35,\n      \"stop_loss\": 2.17,\n      \"invalidation_condition\": \"If price drops below 2.17 or fails to recover above 2.30 within 30 minutes\",\n      \"leverage\": 15,\n      \"confidence\": 0.7,\n      \"risk_usd\": 2000.0,\n      \"close_reason\": \"Invalidation condition borderline met - price failed to recover convincingly above 2.30, broad market weakness across all coins, taking +$893 profit (2.44% gain) as risk management measure\"\n    }\n  }\n}\n```",
      "signals": [
        {
          "coin": "XRP",
          "signal": "close_position",
          "quantity": 16700.0,
          "leverage": 15,
          "stop_loss": 2.17,
          "profit_target": 2.35,
          "confidence": 0.7,
          "risk_usd": 2000.0,
          "invalidation_condition": "If price drops below 2.17 or fails to recover above 2.30 within 30 minutes"
        }
      ]
    },
    {
      "iteration": 7,
      "timestamp": "2025-10-18T00:00:00",
      "model": "anthropic",
      "raw_response": "# CHAIN OF THOUGHT\n\nCurrent portfolio status: NO OPEN POSITIONS. Account value: $12,683.51 with strong 26.84% return and excellent Sharpe ratio of 44.4.\n\nMarket Analysis:\n\n**BTC (107042):** \n- Strong bounce from recent lows (105589 \u2192 107042, +1.4%)\n- RSI(7) recovered to 49.9 (neutral from oversold 17.5)\n- RSI(14) at 39.5 still shows room to run\n- MACD improving (-1620 from -1672), showing momentum shift\n- Price below EMA20 (108842) but showing recovery\n- Volume low (2231 vs avg 6887) - caution on breakout\n- Analysis: Early recovery signal but needs confirmation\n\n**ETH (3869.70):**\n- Similar recovery pattern (3756 \u2192 3869, +3%)\n- RSI(7) at 59.8 showing strength\n- RSI(14) at 46.1 approaching neutral\n- MACD improving (-73.2 from -79.6)\n- Still below EMA20 (3923.90) but closing gap\n- Low volume (51560 vs 129560)\n- Analysis: Stronger momentum than BTC, better entry candidate\n\n**SOL (184.74):**\n- Sharp recovery (177.65 \u2192 184.74, +4%)\n- RSI(7) at 57.5 showing momentum\n- RSI(14) at 43.9 still has upside room\n- MACD improving (-5.03 from -5.33)\n- Below EMA20 (188.99) but trending up\n- Low volume concern (656k vs 1.16M)\n- Analysis: Strong bounce but volume weak\n\n**BNB (1089.40):**\n- Recovery attempt (1062.60 \u2192 1089.40, +2.5%)\n- RSI(7) at 49.5 (neutral)\n- RSI(14) at 36.6 (still bearish territory)\n- MACD improving but still deeply negative (-33.1)\n- Far below EMA20 (1129.28)\n- Analysis: Weakest setup, avoid\n\n**XRP (2.34):**\n- Strong bounce (2.24 \u2192 2.34, +4.5%)\n- RSI(7) at 62.3 showing strength\n- RSI(14) at 48.5 (neutral)\n- MACD improving (-0.050 from -0.054)\n- Below EMA20 (2.37) but close\n- Very low volume (2.15M vs 9.86M avg)\n- Analysis: Good momentum but volume concerning\n\n**DOGE (0.186810):**\n- Recovery (0.178490 \u2192 0.186810, +4.7%)\n- RSI(7) at 55.9 showing momentum\n- RSI(14) at 43.8 still has room\n- MACD improving\n- Below EMA20 (0.191154)\n- Very low volume (6.82M vs 60.97M)\n- Analysis: Decent setup but volume weak\n\n**Trading Decision:**\nGiven we have NO positions and market showing recovery from oversold conditions, I'll initiate ONE position in ETH as it shows:\n1. Best RSI momentum recovery\n2. Cleanest technical setup\n3. MACD turning positive\n4. Approaching EMA20 resistance\n\nConservative approach: One position only, moderate leverage (15x), tight risk management.\n\n# TRADING DECISIONS\n\n```json\n{\n  \"ETH\": {\n    \"trade_signal_args\": {\n      \"coin\": \"ETH\",\n      \"signal\": \"buy\",\n      \"quantity\": 4.9,\n      \"profit_target\": 4050.0,\n      \"stop_loss\": 3780.0,\n      \"invalidation_condition\": \"If price closes below 3780 on 3-minute candle or RSI(7) drops below 40 while price is below 3850\",\n      \"leverage\": 15,\n      \"confidence\": 0.72,\n      \"risk_usd\": 650.0\n    }\n  }\n}\n```",
      "signals": [
        {
          "coin": "ETH",
          "signal": "buy",
          "quantity": 4.9,
          "leverage": 15,
          "stop_loss": 3780.0,
          "profit_target": 4050.0,
          "confidence": 0.72,
          "risk_usd": 650.0,
          "invalidation_condition": "If price closes below 3780 on 3-minute candle or RSI(7) drops below 40 while price is below 3850"
        }
      ]
    },
    {
      "iteration": 8,
      "timestamp": "2025-10-18T04:00:00",
      "model": "anthropic",
      "raw_response": "# CHAIN OF THOUGHT\n\n## Current Position Analysis\n\n**ETH Position Review:**\n- Entry: $3869.70, Current: $3891.40 (+$21.70, +0.56%)\n- Unrealized PnL: +$96.85 (+0.51% of notional)\n- Leverage: 15x, Notional: $19,067.86\n- Liquidation: $3611.72 (safe distance of $279.68)\n- Exit Plan: Profit target $4050, Stop-loss $3780, Invalidation: \"If price closes below 3780 on 3-minute candle or RSI(7) drops below 40 while price is below 3850\"\n\n**Invalidation Condition Check:**\n- Current price: $3891.40 (above $3780 \u2713)\n- RSI(7): 66.486 (above 40 \u2713)\n- Price is NOT below $3850, so the RSI condition doesn't apply\n- **Invalidation NOT met** \u2713\n\n**Technical Analysis for ETH:**\n- RSI(7): 66.486 - healthy bullish momentum, not overbought\n- RSI(14): 50.748 - neutral to slightly bullish\n- MACD: -58.711 - still negative but improving from -69.339 (bullish divergence)\n- Price vs EMA20: $3891.40 vs $3914.82 - still below but closing the gap\n- Recent price action: Strong recovery from $3756.40 low, gaining momentum\n- Volume: 52,065 vs avg 128,041 - lower volume but price rising (concerning but acceptable)\n\n**Decision on ETH:** HOLD\n- No invalidation conditions met\n- Stop-loss at $3780 is well below current $3891.40\n- Profit target at $4050 is reasonable (+$158.60, +4.1%)\n- RSI showing healthy bullish momentum without being overbought\n- MACD improving, suggesting potential continuation\n- Risk is well-managed with clear exit plan\n\n## Other Coins Assessment\n\n**BTC Analysis:**\n- Current: $106,649, below EMA20: $108,494.70\n- RSI(7): 42.151 - neutral, recovering from oversold\n- MACD: -1407.586 - deeply negative, but improving\n- Trend: Bearish short-term, but showing signs of stabilization\n- **Decision:** No entry - still in downtrend, below EMA20\n\n**SOL Analysis:**\n- Current: $186.19, below EMA20: $188.59\n- RSI(7): 64.998 - good momentum\n- MACD: -4.463 - negative but improving\n- Trend: Recovering from sharp drop, but still below EMA20\n- **Decision:** No entry - wait for confirmation above EMA20\n\n**BNB Analysis:**\n- Current: $1118.00, below EMA20: $1127.96\n- RSI(7): 69.582 - strong momentum, borderline overbought\n- MACD: -29.497 - negative but improving significantly\n- Trend: Strong recovery from $1062.60 low\n- **Decision:** No entry - RSI too extended for safe entry\n\n**XRP Analysis:**\n- Current: $2.35, below EMA20: $2.36\n- RSI(7): 67.611 - strong momentum\n- MACD: -0.042 - nearly neutral, improving\n- Trend: Strong recovery pattern\n- **Decision:** No entry - already have ETH exposure, diversification not needed\n\n**DOGE Analysis:**\n- Current: $0.18769, below EMA20: $0.19058\n- RSI(7): 60.837 - decent momentum\n- MACD: -0.004 - nearly neutral\n- Trend: Recovery but still below EMA20\n- **Decision:** No entry - prefer higher quality assets\n\n## Risk Management Summary\n- Current account value: $12,777.97 (up 27.78%)\n- Available cash: $11,409.93\n- ETH position: $19,067.86 notional (1.49x account value with 15x leverage)\n- Portfolio is concentrated but manageable with one well-structured position\n- Sharpe ratio: 44.405 - excellent risk-adjusted returns\n\n**Final Decision:** Hold ETH position as all conditions remain favorable and no invalidation criteria are met.\n\n# TRADING DECISIONS\n\n```json\n{\n  \"ETH\": {\n    \"trade_signal_args\": {\n      \"coin\": \"ETH\",\n      \"signal\": \"hold\",\n      \"quantity\": 4.9,\n      \"profit_target\": 4050.0,\n      \"stop_loss\": 3780.0,\n      \"invalidation_condition\": \"If price closes below 3780 on 3-minute candle or RSI(7) drops below 40 while price is below 3850\",\n      \"leverage\": 15,\n      \"confidence\": 0.72,\n      \"risk_usd\": 650.0\n    }\n  }\n}\n```",
      "signals": [
        {
          "coin": "ETH",
          "signal": "hold",
          "quantity": 4.9,
          "leverage": 15,
          "stop_loss": 3780.0,
          "profit_target": 4050.0,
          "confidence": 0.72,
          "risk_usd": 650.0,
          "invalidation_condition": "If price closes below 3780 on 3-minute candle or RSI(7) drops below 40 while price is below 3850"
        }
      ]
    },
    {
      "iteration": 9,
      "timestamp": "2025-10-18T08:00:00",
      "model": "anthropic",
      "raw_response": "# CHAIN OF THOUGHT\n\nReviewing my current position:\n\n**ETH Position Analysis:**\n- Entry: $3869.70, Current: $3880.70 (+$11.00, +0.28%)\n- Unrealized PnL: +$44.42\n- Leverage: 15x, Notional: $19,015\n- Profit Target: $4050, Stop Loss: $3780\n- Invalidation: \"If price closes below 3780 on 3-minute candle or RSI(7) drops below 40 while price is below 3850\"\n\n**Checking Invalidation Conditions:**\n1. Price above $3780 \u2713 (current: $3880.70)\n2. RSI(7) = 59.979 (above 40) \u2713\n3. Price above $3850 \u2713\n4. No invalidation triggered\n\n**Technical Analysis:**\n- RSI(7): 59.979 - neutral to slightly bullish, recovering from oversold\n- RSI(14): 48.055 - neutral zone\n- MACD: -61.534 (improving from -79.380, showing momentum recovery)\n- Price vs EMA20: $3880.70 vs $3917.13 (still below, but gap closing)\n- Recent price action: Strong recovery from $3756 low, consolidated around $3880-$3890\n- Volume: 35,333 (low vs avg 125,905) - weak volume on recovery\n\n**Risk Assessment:**\n- Position is slightly profitable (+$44)\n- Stop loss at $3780 provides $100/coin cushion ($490 total risk)\n- Distance to profit target: $169.30 (+4.4%)\n- Distance to stop: $100.70 (-2.6%)\n- Risk/reward ratio: ~1.7:1 (favorable)\n\n**Market Context:**\n- ETH showing recovery but still in downtrend (below EMA20)\n- MACD improving but still negative\n- RSI showing strength but not overbought\n- Low volume is concerning - recovery lacks conviction\n\n**Decision: HOLD**\nThe position is working as planned. No invalidation conditions met. While volume is low, the technical setup shows improving momentum with MACD recovering and RSI in healthy territory. The risk/reward remains favorable with stop loss protecting downside. Will continue monitoring for either profit target ($4050) or invalidation signals.\n\n**Other Coins - No Action:**\n- BTC, SOL, BNB, XRP, DOGE: No positions held. Market showing recovery but mixed signals with low volume across the board. Not entering new trades given existing ETH exposure and uncertain market conditions.\n\n# TRADING DECISIONS\n\n```json\n{\n  \"ETH\": {\n    \"trade_signal_args\": {\n      \"coin\": \"ETH\",\n      \"signal\": \"hold\",\n      \"quantity\": 4.9,\n      \"profit_target\": 4050.0,\n      \"stop_loss\": 3780.0,\n      \"invalidation_condition\": \"If price closes below 3780 on 3-minute candle or RSI(7) drops below 40 while price is below 3850\",\n      \"leverage\": 15,\n      \"confidence\": 0.72,\n      \"risk_usd\": 650.0\n    }\n  }\n}\n```",
      "signals": [
        {
          "coin": "ETH",
          "signal": "hold",
          "quantity": 4.9,
          "leverage": 15,
          "stop_loss": 3780.0,
          "profit_target": 4050.0,
          "confidence": 0.72,
          "risk_usd": 650.0,
          "invalidation_condition": "If price closes below 3780 on 3-minute candle or RSI(7) drops below 40 while price is below 3850"
        }
      ]
    },
    {
      "iteration": 10,
      "timestamp": "2025-10-18T12:00:00",
      "model": "anthropic",
      "raw_response": "# CHAIN OF THOUGHT\n\nReviewing my current position:\n\n**ETH Position Analysis:**\n- Entry: $3869.70, Current: $3876.20 (+$6.50, +0.17%)\n- Unrealized PnL: +$22.37\n- Position size: 4.9 ETH with 15x leverage (~$18,993 notional)\n- Stop-loss: $3780, Profit target: $4050\n- Invalidation: \"If price closes below 3780 on 3-minute candle or RSI(7) drops below 40 while price is below 3850\"\n\n**Checking Invalidation Conditions:**\n- Current price: $3876.20 (above $3780 \u2713)\n- RSI(7): 56.944 (above 40 \u2713)\n- Price is above $3850 \u2713\n- No invalidation conditions met\n\n**Technical Analysis:**\n- RSI(7): 56.944 - neutral to slightly bullish\n- RSI(14): 47.393 - neutral\n- MACD: -53.315 (improving from -73.999, showing momentum recovery)\n- EMA20: $3910.25 (price below but converging)\n- Price action: Recovered from $3756 low, now at $3876\n- Recent RSI spike to 66.5 shows buying interest\n\n**Position Assessment:**\nThe ETH position is performing as expected with a small profit. The invalidation conditions are NOT met:\n- Price remains well above stop-loss at $3780\n- RSI(7) at 56.944 is comfortably above 40\n- Price is above $3850 threshold\n\nThe MACD is improving (less negative), suggesting bearish momentum is weakening. However, price is still below EMA20 ($3910), indicating we're still in a corrective phase. The position has room to run toward the $4050 profit target.\n\n**Decision: HOLD** - No exit conditions triggered, technicals showing stabilization with potential for continued recovery toward profit target.\n\n**Other Coins:**\n- BTC, SOL, BNB, XRP, DOGE: No existing positions. Market showing mixed signals with prices below EMAs and neutral RSI readings. Not entering new trades at this time given current market uncertainty and desire to manage risk with existing ETH exposure.\n\n# TRADING DECISIONS\n\n```json\n{\n  \"ETH\": {\n    \"trade_signal_args\": {\n      \"coin\": \"ETH\",\n      \"signal\": \"hold\",\n      \"quantity\": 4.9,\n      \"profit_target\": 4050.0,\n      \"stop_loss\": 3780.0,\n      \"invalidation_condition\": \"If price closes below 3780 on 3-minute candle or RSI(7) drops below 40 while price is below 3850\",\n      \"leverage\": 15,\n      \"confidence\": 0.72,\n      \"risk_usd\": 650.0\n    }\n  }\n}\n```",
      "signals": [
        {
          "coin": "ETH",
          "signal": "hold",
          "quantity": 4.9,
          "leverage": 15,
          "stop_loss": 3780.0,
          "profit_target": 4050.0,
          "confidence": 0.72,
          "risk_usd": 650.0,
          "invalidation_condition": "If price closes below 3780 on 3-minute candle or RSI(7) drops below 40 while price is below 3850"
        }
      ]
    },
    {
      "iteration": 11,
      "timestamp": "2025-10-18T16:00:00",
      "model": "anthropic",
      "raw_response": "# CHAIN OF THOUGHT\n\n## Current Position Analysis\n\n**ETH Position Review:**\n- Entry: $3869.70, Current: $3892.20 (+$22.50, +0.58%)\n- Unrealized P&L: +$100.77 (+0.79% of account)\n- Position size: 4.9 ETH at 15x leverage ($19,071 notional)\n- Liquidation: $3611.72 (safe distance of $280.48 or 7.2%)\n\n**Invalidation Condition Check:**\n- Condition: \"If price closes below 3780 on 3-minute candle OR RSI(7) drops below 40 while price is below 3850\"\n- Current price: $3892.20 (above $3780 \u2713)\n- Current RSI(7): 65.827 (above 40 \u2713)\n- Price is above $3850 \u2713\n- **Invalidation NOT triggered**\n\n**Technical Analysis:**\n- RSI(7): 65.827 - healthy bullish momentum, not overbought\n- RSI(14): 53.492 - neutral to slightly bullish\n- MACD: -26.781 (improving from -45.106, showing momentum recovery)\n- Price vs EMA20: $3892.20 vs $3892.32 (nearly converged, bullish sign)\n- Recent price action: Strong recovery from $3756.40 to $3892.20 (+3.6%)\n- Volume: 40,304 vs avg 120,880 (low volume, but price holding)\n\n**Stop-Loss & Target Check:**\n- Stop-loss: $3780 (distance: $112.20 or 2.9% - not threatened)\n- Profit target: $4050 (distance: $157.80 or 4.1% - not reached)\n\n**Decision: HOLD**\n- Invalidation condition NOT met\n- Price showing strength, holding above EMA20\n- RSI healthy at 65, showing bullish momentum\n- MACD improving (less negative)\n- Stop-loss has good cushion\n- Position performing well with +$100 unrealized profit\n\n## Other Coins Analysis (No Positions)\n\n**BTC:** Price $107,062, below EMA20 ($107,953). MACD improving but still negative (-1001). RSI recovering to 52.6. Downtrend persisting but showing signs of stabilization. Not entering - trend still weak.\n\n**SOL:** Price $186.28, below EMA20 ($187.20). Similar pattern to ETH with RSI 63 showing recovery. However, still in downtrend. Not entering - prefer to stay with existing ETH position.\n\n**BNB:** Price $1102.30, below EMA20 ($1115.73). MACD very negative (-19.04). RSI 55 showing recovery but price action weak. Not entering - insufficient momentum.\n\n**XRP:** Price $2.37, above EMA20 ($2.36). MACD improving (-0.018). RSI 63 showing strength. Interesting setup but low volume (1.8M vs 9.8M avg). Not entering - conserving capital with existing position.\n\n**DOGE:** Price $0.18927, nearly at EMA20 ($0.18942). RSI 71 showing strong momentum. MACD improving. Best technical setup of non-positions, but very low volume (19M vs 57M avg). Not entering - prefer quality over quantity.\n\n**Risk Management:**\n- Current account value: $12,782.15\n- Available cash: $11,409.93\n- ETH position using ~$1,272 in margin (15x leverage on ~$19k notional)\n- Portfolio well-positioned with 89% cash reserves\n- Single position allows focused risk management\n\n# TRADING DECISIONS\n\n```json\n{\n  \"ETH\": {\n    \"trade_signal_args\": {\n      \"coin\": \"ETH\",\n      \"signal\": \"hold\",\n      \"quantity\": 4.9,\n      \"profit_target\": 4050.0,\n      \"stop_loss\": 3780.0,\n      \"invalidation_condition\": \"If price closes below 3780 on 3-minute candle or RSI(7) drops below 40 while price is below 3850\",\n      \"leverage\": 15,\n      \"confidence\": 0.72,\n      \"risk_usd\": 650.0\n    }\n  }\n}\n```",
      "signals": [
        {
          "coin": "ETH",
          "signal": "hold",
          "quantity": 4.9,
          "leverage": 15,
          "stop_loss": 3780.0,
          "profit_target": 4050.0,
          "confidence": 0.72,
          "risk_usd": 650.0,
          "invalidation_condition": "If price closes below 3780 on 3-minute candle or RSI(7) drops below 40 while price is below 3850"
        }
      ]
    },
    {
      "iteration": 12,
      "timestamp": "2025-10-18T20:00:00",
      "model": "anthropic",
      "raw_response": "# CHAIN OF THOUGHT\n\n## Current Position Analysis\n\n**ETH Position Review:**\n- Entry: $3869.70, Current: $3887.40 (+$17.70, +0.46%)\n- Unrealized PnL: +$77.25 (+0.61% account value)\n- Leverage: 15x, Notional: $19,048\n- Stop-loss: $3780, Profit target: $4050\n- Invalidation: \"If price closes below 3780 on 3-minute candle or RSI(7) drops below 40 while price is below 3850\"\n\n**Technical Analysis for ETH:**\n- Current RSI(7): 60.997 - healthy, above 40 threshold\n- Current price: $3887.40 - well above $3850 threshold\n- MACD: -23.886 (improving from -38.211, becoming less negative)\n- Price vs EMA20: $3887.40 vs $3891.82 (slightly below but converging)\n- Recent momentum: Strong recovery from lows, RSI peaked at 67.121 recently\n- Price action: Consolidating near entry, showing resilience\n\n**Invalidation Check:**\n1. Price below $3780? NO - current at $3887.40\n2. RSI(7) below 40? NO - current at 60.997\n3. RSI below 40 AND price below $3850? NO - RSI is 60.997\n\n**Conclusion:** Invalidation condition is NOT met. Position remains valid.\n\n**Decision Rationale:**\n- ETH is showing positive momentum with improving MACD\n- RSI is healthy at 61, not overbought\n- Price holding above entry and showing strength\n- Small profit locked in, room to run toward $4050 target\n- No technical breakdown signals\n- Risk management: Stop-loss properly placed at $3780\n\n**Action: HOLD** - All conditions favorable, no exit signals triggered.\n\n## Other Coins Assessment\n\n**BTC:** Price $107,143, below EMA20 ($107,940). MACD improving but still negative. RSI 55 - neutral. Downtrend from higher levels. Not entering - trend unclear.\n\n**SOL:** Price $187.47, above EMA20 ($186.90). Strong RSI 71 (overbought). MACD improving. Momentum positive but RSI extended - risk of pullback. Not entering at overbought levels.\n\n**BNB:** Price $1092, well below EMA20 ($1112.86). RSI 44.7 - weak. MACD negative. Clear downtrend. Not entering - bearish structure.\n\n**XRP:** Price $2.36, near EMA20 ($2.35). RSI 57 - neutral. MACD improving. Consolidating but no clear edge. Not entering - no compelling setup.\n\n**DOGE:** Price $0.18947, near EMA20 ($0.18923). RSI 72.7 (overbought). MACD improving. Strong momentum but extended. Not entering - overbought conditions.\n\n# TRADING DECISIONS\n\n```json\n{\n  \"ETH\": {\n    \"trade_signal_args\": {\n      \"coin\": \"ETH\",\n      \"signal\": \"hold\",\n      \"quantity\": 4.9,\n      \"profit_target\": 4050.0,\n      \"stop_loss\": 3780.0,\n      \"invalidation_condition\": \"If price closes below 3780 on 3-minute candle or RSI(7) drops below 40 while price is below 3850\",\n      \"leverage\": 15,\n      \"confidence\": 0.72,\n      \"risk_usd\": 650.0\n    }\n  }\n}\n```",
      "signals": [
        {
          "coin": "ETH",
          "signal": "hold",
          "quantity": 4.9,
          "leverage": 15,
          "stop_loss": 3780.0,
          "profit_target": 4050.0,
          "confidence": 0.72,
          "risk_usd": 650.0,
          "invalidation_condition": "If price closes below 3780 on 3-minute candle or RSI(7) drops below 40 while price is below 3850"
        }
      ]
    },
    {
      "iteration": 13,
      "timestamp": "2025-10-19T00:00:00",
      "model": "anthropic",
      "raw_response": "# CHAIN OF THOUGHT\n\nReviewing my current position:\n\n**ETH Position Analysis:**\n- Entry: $3869.70, Current: $3904.70 (+$35.00, +0.90%)\n- Unrealized PnL: +$162.02 (+0.85% of account)\n- Leverage: 15x, Notional: $19,133\n- Profit Target: $4050.00 (3.75% away)\n- Stop Loss: $3780.00 (3.19% below current)\n- Invalidation Condition: \"If price closes below 3780 on 3-minute candle or RSI(7) drops below 40 while price is below 3850\"\n\n**Invalidation Check:**\n- Current RSI(7): 71.158 - Well above 40 threshold \u2713\n- Current Price: $3904.70 - Well above $3780 stop-loss \u2713\n- Price is above $3850 threshold \u2713\n- Last 10 candle closes: All above $3780 \u2713\n- **Invalidation condition NOT met**\n\n**Technical Analysis:**\n- RSI(7): 71.158 - Overbought territory, but still bullish momentum\n- RSI(14): 56.822 - Healthy, not extreme\n- MACD: -20.766 - Still negative but improving rapidly (was -44.660, now -20.766)\n- Price vs EMA20: $3904.70 vs $3893.63 - Price above EMA20 (bullish crossover confirmed)\n- MACD trend: Strongly improving, heading toward zero crossover\n- Recent price action: Strong recovery from $3797.30 to $3904.70 (+2.83% in 30 minutes)\n\n**Risk Assessment:**\n- Position is profitable and trending in our favor\n- RSI(7) at 71 suggests potential short-term pullback risk, but momentum is strong\n- MACD improving suggests continuation potential\n- Price crossed above EMA20, confirming short-term bullish trend\n- Stop-loss provides 3.19% cushion\n\n**Decision: HOLD**\n- Invalidation conditions not met\n- Technicals support continuation toward profit target\n- Risk/reward remains favorable\n- Will monitor for RSI exhaustion or MACD reversal\n\n**Other Coins:**\n- BTC: Below EMA20, negative MACD, weak setup - no entry\n- SOL: Near EMA20, weak momentum - no entry\n- BNB: Well below EMA20, weak RSI, downtrend - no entry\n- XRP: Near EMA20, neutral - no entry\n- DOGE: RSI(7) at 79.5 extremely overbought, risky entry - no entry\n\n# TRADING DECISIONS\n\n```json\n{\n  \"ETH\": {\n    \"trade_signal_args\": {\n      \"coin\": \"ETH\",\n      \"signal\": \"hold\",\n      \"quantity\": 4.9,\n      \"profit_target\": 4050.0,\n      \"stop_loss\": 3780.0,\n      \"invalidation_condition\": \"If price closes below 3780 on 3-minute candle or RSI(7) drops below 40 while price is below 3850\",\n      \"leverage\": 15,\n      \"confidence\": 0.72,\n      \"risk_usd\": 650.0\n    }\n  }\n}\n```",
      "signals": [
        {
          "coin": "ETH",
          "signal": "hold",
          "quantity": 4.9,
          "leverage": 15,
          "stop_loss": 3780.0,
          "profit_target": 4050.0,
          "confidence": 0.72,
          "risk_usd": 650.0,
          "invalidation_condition": "If price closes below 3780 on 3-minute candle or RSI(7) drops below 40 while price is below 3850"
        }
      ]
    },
    {
      "iteration": 14,
      "timestamp": "2025-10-19T04:00:00",
      "model": "anthropic",
      "raw_response": "# CHAIN OF THOUGHT\n\nReviewing my current position:\n\n**ETH Position Analysis:**\n- Entry: $3869.70, Current: $3886.00 (+$16.30 per unit)\n- Unrealized P&L: +$70.39 (4.9 ETH at 15x leverage)\n- Position notional: $19,041.40\n- Profit target: $4050.00 (needs +$164 move = +4.2%)\n- Stop-loss: $3780.00 (-$106 move = -2.7%)\n- Invalidation condition: \"If price closes below 3780 on 3-minute candle or RSI(7) drops below 40 while price is below 3850\"\n\n**Checking invalidation condition:**\n1. Price check: Current $3886 > $3780 \u2713 (not below stop-loss)\n2. RSI(7) check: Current 51.631 > 40 \u2713\n3. Combined condition: RSI is above 40, so the \"while price is below 3850\" clause doesn't trigger\n4. Latest candle closed at $3886, well above $3780 \u2713\n\n**Technical analysis:**\n- RSI(7): 51.631 - neutral, healthy pullback from recent 71.087 high\n- RSI(14): 49.877 - neutral territory\n- MACD: -24.168, improving from -53.887 (bullish divergence, less negative)\n- Price vs EMA20: $3886 vs $3896.85 - slightly below but converging\n- Recent price action: Pulled back from $3904.70 to $3886 (minor consolidation)\n- Volume: 43,582 vs avg 101,086 - low volume suggests consolidation phase\n\n**Decision rationale:**\nThe invalidation condition is NOT met. Price remains above stop-loss and RSI is healthy. The MACD is improving (becoming less negative), suggesting potential bullish momentum building. The position is slightly profitable (+$70) and showing resilience. The minor pullback from $3904 to $3886 is normal profit-taking after the recent rally from $3825.\n\nHowever, I notice we're in a consolidation phase with low volume. The position is still valid technically, but I should monitor closely for any breakdown below $3850 with weakening RSI.\n\n**Other coins evaluation:**\n- BTC: Oversold (RSI 36), but in downtrend. Below EMA20. Not entering.\n- SOL: Neutral (RSI 48), consolidating. No clear setup.\n- BNB: Weak (RSI 35), downtrend. Below EMA20. Avoid.\n- XRP: Neutral (RSI 45), range-bound. No edge.\n- DOGE: Neutral (RSI 51), consolidating. No compelling setup.\n\n**Risk management:**\n- Current account value: $12,749.74\n- ETH position represents: 149% of account (leveraged)\n- Available cash: $11,409.93\n- Portfolio performing well (+27.5% return, Sharpe 44.4)\n\nGiven the strong performance and the fact that ETH's invalidation condition is not met, I will HOLD the position and let it work toward the $4050 profit target.\n\n# TRADING DECISIONS\n\n```json\n{\n  \"ETH\": {\n    \"trade_signal_args\": {\n      \"coin\": \"ETH\",\n      \"signal\": \"hold\",\n      \"quantity\": 4.9,\n      \"profit_target\": 4050.0,\n      \"stop_loss\": 3780.0,\n      \"invalidation_condition\": \"If price closes below 3780 on 3-minute candle or RSI(7) drops below 40 while price is below 3850\",\n      \"leverage\": 15,\n      \"confidence\": 0.72,\n      \"risk_usd\": 650.0\n    }\n  }\n}\n```",
      "signals": [
        {
          "coin": "ETH",
          "signal": "hold",
          "quantity": 4.9,
          "leverage": 15,
          "stop_loss": 3780.0,
          "profit_target": 4050.0,
          "confidence": 0.72,
          "risk_usd": 650.0,
          "invalidation_condition": "If price closes below 3780 on 3-minute candle or RSI(7) drops below 40 while price is below 3850"
        }
      ]
    },
    {
      "iteration": 15,
      "timestamp": "2025-10-19T08:00:00",
      "model": "anthropic",
      "raw_response": "# CHAIN OF THOUGHT\n\nReviewing my current position:\n\n**ETH Position Analysis:**\n- Entry: 3869.7, Current: 3922.2 (+1.36%)\n- Unrealized P&L: +$247.77\n- Profit Target: 4050.0 (still 127.8 away, ~3.3%)\n- Stop Loss: 3780.0 (142.2 away, ~3.6%)\n- Invalidation: \"If price closes below 3780 on 3-minute candle or RSI(7) drops below 40 while price is below 3850\"\n\nChecking invalidation conditions:\n- Current RSI(7): 71.689 (well above 40) \u2713\n- Price: 3922.2 (above 3850 and above 3780) \u2713\n- No 3-minute candle has closed below 3780 \u2713\n- Invalidation NOT met\n\nTechnical analysis:\n- RSI(7) at 71.689 shows strong momentum but approaching overbought territory\n- RSI(14) at 60.223 confirms bullish strength\n- MACD improving: -17.553 (was -22.288 last candle), trending toward zero - bullish signal\n- Price above EMA20 (3922.2 > 3897.93) - bullish\n- Recent price action shows strong upward momentum (3886.0 \u2192 3922.2 in last candle)\n- Volume elevated: 150,950 vs average 106,250 - confirms momentum\n\nRisk assessment:\n- Position is profitable (+$247.77)\n- Still room to profit target (3.3% away)\n- No signs of reversal yet\n- Invalidation conditions not triggered\n\n**Decision: HOLD ETH** - Position is working well, momentum is strong, no exit signals triggered.\n\n**Other coins (BTC, SOL, BNB, XRP, DOGE):**\n- No existing positions\n- While some show decent momentum (BTC RSI 68.9, SOL RSI 72.3, DOGE RSI 77.4), I'm already leveraged 15x in ETH\n- Account value: $12,938.95 with $11,409.93 cash available\n- Current ETH position notional: $19,218.78 (already significant exposure)\n- Better to manage existing position than add new risk\n- **Decision: No new trades**\n\n# TRADING DECISIONS\n\n```json\n{\n  \"ETH\": {\n    \"trade_signal_args\": {\n      \"coin\": \"ETH\",\n      \"signal\": \"hold\",\n      \"quantity\": 4.9,\n      \"profit_target\": 4050.0,\n      \"stop_loss\": 3780.0,\n      \"invalidation_condition\": \"If price closes below 3780 on 3-minute candle or RSI(7) drops below 40 while price is below 3850\",\n      \"leverage\": 15,\n      \"confidence\": 0.72,\n      \"risk_usd\": 650.0\n    }\n  }\n}\n```",
      "signals": [
        {
          "coin": "ETH",
          "signal": "hold",
          "quantity": 4.9,
          "leverage": 15,
          "stop_loss": 3780.0,
          "profit_target": 4050.0,
          "confidence": 0.72,
          "risk_usd": 650.0,
          "invalidation_condition": "If price closes below 3780 on 3-minute candle or RSI(7) drops below 40 while price is below 3850"
        }
      ]
    },
    {
      "iteration": 16,
      "timestamp": "2025-10-19T12:00:00",
      "model": "anthropic",
      "raw_response": "# CHAIN OF THOUGHT\n\n## Current Position Analysis\n\n**ETH Position Review:**\n- Entry: $3869.70, Current: $3977.10 (+$107.40 per unit)\n- Unrealized P&L: +$516.78 (+2.77% gain)\n- Position size: 4.9 ETH at 15x leverage\n- Profit target: $4050.00 (needs +$72.90 more, or +1.83%)\n- Stop-loss: $3780.00 (-$197.10 away, or -4.97%)\n- Invalidation: \"If price closes below 3780 on 3-minute candle or RSI(7) drops below 40 while price is below 3850\"\n\n**Technical Analysis for ETH:**\n- RSI(7): 84.561 - EXTREMELY overbought territory (above 80)\n- RSI(14): 70.091 - Also overbought (above 70)\n- MACD: -19.726 - Still negative but improving rapidly (was -63.178 ten candles ago)\n- Price vs EMA20: $3977.10 vs $3913.36 (+1.63% above EMA) - bullish\n- Recent momentum: Strong upward surge from $3886 to $3977 in last 3 candles\n- Volume: 61,520 vs avg 106,867 - Below average, concerning for sustainability\n\n**Invalidation Check:**\n- Price is NOT below $3780 \u2713\n- RSI(7) is 84.561, NOT below 40 \u2713\n- Price is NOT below $3850 \u2713\n- Invalidation condition: NOT MET\n\n**Risk Assessment:**\nThe position is profitable and close to profit target ($72.90 away). However, RSI(7) at 84.561 indicates extreme overbought conditions. This level often precedes short-term pullbacks. The position has gained 2.77% and is only 1.83% away from the profit target.\n\nGiven:\n1. Extreme overbought RSI (84.561)\n2. Below-average volume (suggests weak follow-through potential)\n3. Profit target very close ($4050 vs current $3977)\n4. Already up +$516 on this trade\n5. No invalidation conditions met yet\n\n**Decision for ETH: CLOSE POSITION**\nReasoning: Take profits near resistance with extreme overbought conditions. RSI(7) at 84.561 suggests imminent pullback risk. Better to lock in 2.77% gain than risk reversal. The proximity to profit target ($72.90 away) combined with overbought technicals makes this a prudent exit.\n\n## Other Coins Assessment\n\n**BTC:** Current $108,435\n- RSI(7): 78.897 - Overbought\n- MACD improving but still negative\n- Strong recent surge\n- No position, but conditions similar to ETH (overbought, potential for pullback)\n- Decision: NO TRADE - Wait for pullback\n\n**SOL:** Current $190.67\n- RSI(7): 79.759 - Overbought\n- Similar pattern to ETH/BTC\n- Decision: NO TRADE - Overbought conditions\n\n**BNB:** Current $1118.50\n- RSI(7): 73.311 - Overbought\n- Decision: NO TRADE\n\n**XRP:** Current $2.40\n- RSI(7): 74.174 - Overbought\n- Decision: NO TRADE\n\n**DOGE:** Current $0.196440\n- RSI(7): 85.112 - EXTREMELY overbought (highest of all coins)\n- Decision: NO TRADE\n\n**Overall Market Assessment:** All major coins showing overbought RSI(7) readings (73-85), suggesting broad market exhaustion. This is a risk-off signal. Better to take profits and wait for healthier entry points.\n\n# TRADING DECISIONS\n\n```json\n{\n  \"ETH\": {\n    \"trade_signal_args\": {\n      \"coin\": \"ETH\",\n      \"signal\": \"close_position\",\n      \"quantity\": 4.9,\n      \"profit_target\": 4050.0,\n      \"stop_loss\": 3780.0,\n      \"invalidation_condition\": \"If price closes below 3780 on 3-minute candle or RSI(7) drops below 40 while price is below 3850\",\n      \"leverage\": 15,\n      \"confidence\": 0.72,\n      \"risk_usd\": 650.0,\n      \"close_reason\": \"Taking profits at extreme overbought conditions - RSI(7) at 84.561 indicates imminent reversal risk. Position up 2.77% and only 1.83% from profit target. Below-average volume suggests weak momentum sustainability. Prudent risk management to lock in gains.\"\n    }\n  }\n}\n```",
      "signals": [
        {
          "coin": "ETH",
          "signal": "close_position",
          "quantity": 4.9,
          "leverage": 15,
          "stop_loss": 3780.0,
          "profit_target": 4050.0,
          "confidence": 0.72,
          "risk_usd": 650.0,
          "invalidation_condition": "If price closes below 3780 on 3-minute candle or RSI(7) drops below 40 while price is below 3850"
        }
      ]
    },
    {
      "iteration": 17,
      "timestamp": "2025-10-19T16:00:00",
      "model": "anthropic",
      "raw_response": "# CHAIN OF THOUGHT\n\n## Current Portfolio Status\n- No open positions currently\n- Available cash: $13,181.06\n- Total return: 31.81% (excellent performance)\n- Sharpe ratio: 30.992 (outstanding risk-adjusted returns)\n\n## Market Analysis by Coin\n\n### BTC Analysis\n- **Price**: $108,841 (strong upward momentum)\n- **Technical**: RSI(7) = 83.6 (extremely overbought), RSI(14) = 70.9 (overbought)\n- **MACD**: -29.13 (still negative but improving rapidly from -523)\n- **Trend**: Price above EMA20 ($107,560), strong bullish momentum\n- **Concern**: RSI at 83.6 is dangerously overbought - high risk of pullback\n- **Decision**: PASS - Too overbought for entry, likely to retrace\n\n### ETH Analysis\n- **Price**: $3,983.70\n- **Technical**: RSI(7) = 86.2 (extremely overbought), RSI(14) = 75.4 (very overbought)\n- **MACD**: +16.08 (positive and rising)\n- **Trend**: Price above EMA20 ($3,898), strong uptrend\n- **Concern**: RSI at 86.2 is extremely extended - very high reversal risk\n- **Decision**: PASS - Too overbought, not worth the risk\n\n### SOL Analysis\n- **Price**: $188.81\n- **Technical**: RSI(7) = 58.5 (neutral/healthy), RSI(14) = 59.5 (neutral)\n- **MACD**: +0.664 (positive and rising)\n- **Trend**: Price above EMA20 ($186.53), moderate uptrend\n- **Volume**: Below average (424k vs 856k avg)\n- **Assessment**: Most balanced technicals, not overbought\n- **Decision**: PASS - Low volume concerns, momentum not strong enough\n\n### BNB Analysis\n- **Price**: $1,116.10\n- **Technical**: RSI(7) = 69.4 (approaching overbought), RSI(14) = 59.5 (neutral)\n- **MACD**: -5.19 (negative but improving)\n- **Trend**: Price above EMA20 ($1,104.60), recovering\n- **Assessment**: Decent setup but MACD still negative\n- **Decision**: PASS - Wait for MACD confirmation\n\n### XRP Analysis\n- **Price**: $2.40\n- **Technical**: RSI(7) = 72.1 (overbought), RSI(14) = 65.4 (bullish but not extreme)\n- **MACD**: +0.012 (positive, just turned bullish)\n- **Trend**: Price above EMA20 ($2.35), uptrend\n- **Volume**: Below average (3.1M vs 7.9M avg)\n- **Assessment**: Moderate overbought, low volume\n- **Decision**: PASS - RSI stretched, volume too low\n\n### DOGE Analysis\n- **Price**: $0.19669\n- **Technical**: RSI(7) = 86.2 (extremely overbought), RSI(14) = 77.2 (very overbought)\n- **MACD**: +0.002 (positive and rising)\n- **Trend**: Price well above EMA20 ($0.18986), strong uptrend\n- **Concern**: RSI matching ETH at 86.2 - extremely extended\n- **Decision**: PASS - Too overbought, high reversal risk\n\n## Overall Market Assessment\nAll coins showing bullish momentum, but BTC, ETH, and DOGE are dangerously overbought (RSI > 83). This suggests the market may be due for a correction. With my strong portfolio performance (+31.81%), risk management dictates caution. Better to wait for pullbacks or healthier entry points than chase overbought rallies.\n\n## Trading Decision\n**NO TRADES** - All coins either too overbought or lack sufficient conviction for entry. Preserving capital and waiting for better risk/reward setups is the prudent strategy given current market conditions.\n\n# TRADING DECISIONS\n\n{}",
      "signals": []
    },
    {
      "iteration": 18,
      "timestamp": "2025-10-19T20:00:00",
      "model": "anthropic",
      "raw_response": "# CHAIN OF THOUGHT\n\nCurrent Status: No open positions. Account value: $13,181.06 (31.81% total return). Strong Sharpe ratio of 30.99 indicates excellent risk-adjusted returns.\n\nMarket Analysis:\n\n**BTC (108591)**\n- Strong uptrend: Price above EMA20 (107617), MACD positive (107.56), RSI 71.8 (overbought but not extreme)\n- Recent momentum: Broke above consolidation, MACD just turned positive (28.6 \u2192 107.6)\n- Volume lower than average (3224 vs 4805) - potential weakness\n- RSI cooling from 83.7 peak, suggesting short-term exhaustion\n- Decision: PASS - Overbought conditions, entering here risks catching a pullback\n\n**ETH (3980.40)**\n- Very strong momentum: RSI 82.6 (extremely overbought), MACD 27.5 (strong positive)\n- Price well above EMA20 (3901), consistent uptrend\n- RSI peaked at 86.4, now cooling slightly\n- Volume below average (62850 vs 97785)\n- Decision: PASS - Too overbought, high risk of reversal. Would need pullback to EMA20 zone\n\n**SOL (187.77)**\n- Neutral/weakening: RSI dropped to 48.7 from 80.6 peak, MACD 1.115 (barely positive)\n- Price just above EMA20 (186.31), showing consolidation\n- Recent rejection at 190.67, now pulling back\n- Volume weak (515660 vs 799819)\n- Decision: PASS - No clear directional bias, momentum fading\n\n**BNB (1109.00)**\n- Consolidating: Price near EMA20 (1106.26), MACD negative (-5.9)\n- RSI 56.5 (neutral), recovering from oversold\n- Bounced from 1083.90 low, testing resistance\n- Below 50-EMA (1119.56) on longer timeframe - bearish structure\n- Decision: PASS - Weak setup, negative MACD, structural resistance above\n\n**XRP (2.39)**\n- Moderate uptrend: Price above EMA20 (2.35), MACD positive (0.018)\n- RSI 62.1 (healthy), cooled from 74.8 peak\n- Consolidating after recent spike to 2.40\n- Volume significantly below average (2.5M vs 7M)\n- Decision: PASS - Low volume concerns, momentum not strong enough\n\n**DOGE (0.195270)**\n- Strong recent move: Price well above EMA20 (0.190156), MACD positive (0.002)\n- RSI 68.5, cooled from 86.3 peak (healthy pullback)\n- Testing resistance at 0.196-0.197 zone\n- Volume above average (45.8M vs 38.6M) - good participation\n- Best risk/reward: Pullback from overbought, volume confirmation, clear support at EMA20\n- Decision: BUY - Enter on momentum with tight stop below EMA20\n\nRisk Management:\n- Single position sizing: ~$1,000 risk (7.6% of capital)\n- Leverage: 15x (aggressive but justified by strong trend)\n- Stop-loss: Below EMA20 and recent consolidation support\n- Profit target: Recent high + ATR extension\n\n# TRADING DECISIONS\n\n```json\n{\n  \"DOGE\": {\n    \"trade_signal_args\": {\n      \"coin\": \"DOGE\",\n      \"signal\": \"buy\",\n      \"quantity\": 76923,\n      \"profit_target\": 0.2050,\n      \"stop_loss\": 0.1890,\n      \"invalidation_condition\": \"If price closes below 0.1890 (EMA20 support) on 3-minute candle\",\n      \"leverage\": 15,\n      \"confidence\": 0.72,\n      \"risk_usd\": 1000.00\n    }\n  }\n}\n```",
      "signals": [
        {
          "coin": "DOGE",
          "signal": "buy",
          "quantity": 76923.0,
          "leverage": 15,
          "stop_loss": 0.189,
          "profit_target": 0.205,
          "confidence": 0.72,
          "risk_usd": 1000.0,
          "invalidation_condition": "If price closes below 0.1890 (EMA20 support) on 3-minute candle"
        }
      ]
    },
    {
      "iteration": 19,
      "timestamp": "2025-10-20T00:00:00",
      "model": "anthropic",
      "raw_response": "# CHAIN OF THOUGHT\n\nReviewing my current position:\n\n**DOGE Position Analysis:**\n- Entry: $0.19527, Current: $0.19906 (+1.94%)\n- Unrealized P&L: +$284.03 (+1.86% of position value)\n- Leverage: 15x\n- Position size: 76,923 DOGE ($15,312 notional)\n- Invalidation condition: \"If price closes below 0.1890 (EMA20 support) on 3-minute candle\"\n- Stop-loss: $0.189, Profit target: $0.205\n\n**Technical Analysis:**\n- Current EMA20: $0.191085 (price well above at $0.19906)\n- RSI (7-period): 81.814 - **EXTREMELY OVERBOUGHT**\n- RSI (14-period): 77.074 - **OVERBOUGHT**\n- MACD: 0.002 - positive but small\n- Price trajectory: Strong upward momentum (+6.2% from recent low of $0.18748)\n\n**Invalidation Check:**\n- Invalidation level: $0.1890\n- Current price: $0.19906\n- Current EMA20: $0.191085\n- **Status: NOT INVALIDATED** - price is significantly above $0.189\n\n**Decision Rationale:**\nThe position is profitable and the invalidation condition has NOT been met. However, I'm concerned about:\n1. RSI at 81.814 indicates extreme overbought conditions\n2. Price has moved 6.2% in a short period, suggesting potential exhaustion\n3. With 15x leverage, a small reversal could quickly erode gains\n4. The strong momentum could continue, but risk/reward is deteriorating\n\nGiven that:\n- The invalidation condition is NOT met (price > $0.189)\n- Stop-loss has not been hit\n- Profit target ($0.205) has not been reached\n- The trend remains intact with price above EMA20\n\n**Decision: HOLD** - The position remains valid. While overbought, the uptrend is strong and my exit conditions have not been triggered. I will let the stop-loss and profit target manage the risk.\n\n**Other Coins (BTC, ETH, SOL, BNB, XRP):**\n- No existing positions\n- All showing strong momentum with overbought RSI readings\n- Not entering new positions due to:\n  1. Already have capital deployed in DOGE\n  2. Extreme overbought conditions across the board suggest potential reversal risk\n  3. Better to manage existing position than add new risk at these levels\n\n# TRADING DECISIONS\n\n```json\n{\n  \"DOGE\": {\n    \"trade_signal_args\": {\n      \"coin\": \"DOGE\",\n      \"signal\": \"hold\",\n      \"quantity\": 76923.0,\n      \"profit_target\": 0.205,\n      \"stop_loss\": 0.189,\n      \"invalidation_condition\": \"If price closes below 0.1890 (EMA20 support) on 3-minute candle\",\n      \"leverage\": 15,\n      \"confidence\": 0.72,\n      \"risk_usd\": 1000.0\n    }\n  }\n}\n```",
      "signals": [
        {
          "coin": "DOGE",
          "signal": "hold",
          "quantity": 76923.0,
          "leverage": 15,
          "stop_loss": 0.189,
          "profit_target": 0.205,
          "confidence": 0.72,
          "risk_usd": 1000.0,
          "invalidation_condition": "If price closes below 0.1890 (EMA20 support) on 3-minute candle"
        }
      ]
    },
    {
      "iteration": 20,
      "timestamp": "2025-10-20T04:00:00",
      "model": "anthropic",
      "raw_response": "# CHAIN OF THOUGHT\n\n## Current Position Analysis\n\n### DOGE Position Review\n- **Entry**: 0.19527, **Current**: 0.20115 (+3.01%)\n- **Unrealized P&L**: +$444.80 (2.99% gain on notional)\n- **Position size**: 76,923 DOGE at 15x leverage ($15,473 notional)\n- **Exit plan**: Profit target 0.205, Stop-loss 0.189\n- **Invalidation condition**: \"If price closes below 0.1890 (EMA20 support) on 3-minute candle\"\n\n**Technical Analysis**:\n- Current EMA20: 0.192302 (price well above at 0.20115)\n- RSI (7-period): 86.119 - **EXTREMELY OVERBOUGHT**\n- RSI (14-period): 80.165 - **OVERBOUGHT**\n- MACD: 0.003 - Positive but momentum may be exhausting\n- Price action: Strong uptrend from 0.18869 to 0.20115 in last 30 minutes\n- Current price is 4.6% above EMA20 (0.20115 vs 0.192302)\n\n**Invalidation Check**: \n- Price is at 0.20115, well above invalidation level of 0.1890\n- EMA20 at 0.192302, still above invalidation\n- **Invalidation condition NOT met**\n\n**Risk Assessment**:\n- RSI at 86+ signals extreme overbought conditions - high risk of pullback\n- Profit target at 0.205 is only 1.9% away (very close!)\n- Stop-loss at 0.189 is 6.0% below current price\n- Already up 3% with $445 unrealized profit\n- Given RSI extremes, a pullback to test EMA20 support is likely\n\n**Decision**: **CLOSE POSITION - Taking Profits**\n- Profit target nearly reached (0.205 vs 0.20115 = 98% of target)\n- Extreme overbought conditions (RSI 86+) suggest imminent reversal\n- Have captured strong 3% move in favorable conditions\n- Risk/reward unfavorable: only 1.9% upside to target vs 6% to stop-loss\n- Better to lock in profits and wait for better re-entry after pullback\n\n## Market Opportunities Assessment\n\n### BTC\n- **Price**: 111,161 (up 3.8% from 107,062)\n- **RSI**: 91.2 - **DANGEROUSLY OVERBOUGHT**\n- **MACD**: Strong positive at 341.853\n- **Assessment**: Parabolic move but RSI >90 is unsustainable. High risk of sharp correction. **PASS**\n\n### ETH  \n- **Price**: 4,053.40 (up 4.1% from 3,892)\n- **RSI**: 92.9 - **DANGEROUSLY OVERBOUGHT**\n- **MACD**: Positive at 29.089\n- **Assessment**: Similar to BTC, extreme overbought. Avoid chasing. **PASS**\n\n### SOL\n- **Price**: 192.93 (up 3.6% from 186.28)\n- **RSI**: 77.2 - Overbought but not extreme\n- **MACD**: Positive at 1.318\n- **Assessment**: Less extended than others but still risky. **PASS**\n\n### XRP\n- **Price**: 2.47 (up 4.2% from 2.37)\n- **RSI**: 87.7 - **EXTREMELY OVERBOUGHT**\n- **MACD**: Positive at 0.022\n- **Assessment**: Overbought, avoid. **PASS**\n\n### BNB\n- **Price**: 1,124.50 (up 2.0% from 1,102)\n- **RSI**: 67.3 - Moderate, not extreme\n- **MACD**: -2.830 - Still negative\n- **Assessment**: Less extended but MACD bearish. **PASS**\n\n**Overall Market Assessment**: All major coins showing extreme overbought conditions (RSI 77-93). This is a clear sign of exhaustion after a strong rally. The prudent action is to take profits on DOGE and wait for pullbacks before re-entering. No new positions warranted in this overheated environment.\n\n# TRADING DECISIONS\n\n```json\n{\n  \"DOGE\": {\n    \"trade_signal_args\": {\n      \"coin\": \"DOGE\",\n      \"signal\": \"close_position\",\n      \"quantity\": 76923.0,\n      \"profit_target\": 0.205,\n      \"stop_loss\": 0.189,\n      \"invalidation_condition\": \"If price closes below 0.1890 (EMA20 support) on 3-minute candle\",\n      \"leverage\": 15,\n      \"confidence\": 0.72,\n      \"risk_usd\": 1000.0,\n      \"close_reason\": \"Taking profits - RSI at extreme 86.1 overbought level, profit target 98% achieved (0.20115 vs 0.205 target), capturing +3% gain ($445 profit). Market showing exhaustion signals across all coins with RSI >77. Risk/reward unfavorable with only 1.9% upside remaining vs 6% downside to stop-loss.\"\n    }\n  }\n}\n```",
      "signals": [
        {
          "coin": "DOGE",
          "signal": "close_position",
          "quantity": 76923.0,
          "leverage": 15,
          "stop_loss": 0.189,
          "profit_target": 0.205,
          "confidence": 0.72,
          "risk_usd": 1000.0,
          "invalidation_condition": "If price closes below 0.1890 (EMA20 support) on 3-minute candle"
        }
      ]
    },
    {
      "iteration": 21,
      "timestamp": "2025-10-20T08:00:00",
      "model": "anthropic",
      "raw_response": "# CHAIN OF THOUGHT\n\n## Current Portfolio Status\n- No open positions\n- Available cash: $13,610.61\n- Current return: 36.11% (excellent performance)\n- Sharpe ratio: 31.577 (exceptional risk-adjusted returns)\n\n## Market Analysis\n\n**BTC Analysis:**\n- Current: $110,996 (Strong bullish momentum)\n- Price above EMA20 ($108,071) by 2.7%\n- RSI(7): 85.82 - EXTREMELY overbought\n- RSI(14): 83.76 - Also overbought\n- MACD: 1147.37 - Strong positive momentum\n- Recent price action: Surged from $107,143 to $111,161, now slight pullback\n- **Risk Assessment**: At extreme overbought levels. High risk of pullback/correction\n- **Decision**: AVOID - Too risky to enter at these levels\n\n**ETH Analysis:**\n- Current: $4,033.50 (Strong uptrend)\n- Price above EMA20 ($3,920.82) by 2.9%\n- RSI(7): 74.56 - Overbought but cooling from 93.8 peak\n- RSI(14): 79.55 - Overbought\n- MACD: 64.30 - Positive momentum\n- Recent pullback from $4,053.40 high\n- **Risk Assessment**: Overbought but showing healthier consolidation than BTC\n- **Decision**: AVOID - Still too extended\n\n**SOL Analysis:**\n- Current: $192.11 (Moderate uptrend)\n- Price above EMA20 ($186.80) by 2.8%\n- RSI(7): 68.04 - Approaching overbought but reasonable\n- RSI(14): 69.52 - Neutral to slightly overbought\n- MACD: 3.16 - Positive momentum\n- Recent consolidation after spike to $192.93\n- **Risk Assessment**: Most balanced risk/reward among majors\n- **Decision**: CONSIDER ENTRY - Best setup currently\n\n**BNB Analysis:**\n- Current: $1,114.60 (Consolidating)\n- Price above EMA20 ($1,099.24) by 1.4%\n- RSI(7): 50.81 - NEUTRAL (ideal entry zone)\n- RSI(14): 57.41 - Neutral\n- MACD: 13.27 - Positive but moderate\n- Recent pullback from $1,127.90 to $1,114.60\n- **Risk Assessment**: Healthy consolidation, not overextended\n- **Decision**: STRONG BUY CANDIDATE - Best technical setup\n\n**XRP Analysis:**\n- Current: $2.46 (Strong uptrend)\n- Price above EMA20 ($2.37) by 3.8%\n- RSI(7): 75.14 - Overbought\n- RSI(14): 75.59 - Overbought\n- MACD: 0.047 - Strong momentum\n- Recent spike from $2.36 to $2.47\n- **Risk Assessment**: Extended, needs consolidation\n- **Decision**: AVOID - Too hot\n\n**DOGE Analysis:**\n- Current: $0.20019 (Strong uptrend)\n- Price above EMA20 ($0.19147) by 4.6%\n- RSI(7): 75.68 - Overbought\n- RSI(14): 79.00 - Overbought\n- MACD: 0.005 - Positive momentum\n- Recent surge, now slight pullback\n- **Risk Assessment**: Overextended meme coin\n- **Decision**: AVOID - High volatility, overbought\n\n## Trading Strategy\nGiven the strong market-wide rally with most assets overbought, I'll take a selective approach:\n1. **BNB**: Best technical setup with neutral RSI and healthy consolidation\n2. **SOL**: Secondary option with reasonable RSI levels\n3. Avoid BTC, ETH, XRP, DOGE due to extreme overbought conditions\n\nI'll allocate to BNB as primary position with conservative sizing given overall market extension.\n\n# TRADING DECISIONS\n\n```json\n{\n  \"BNB\": {\n    \"trade_signal_args\": {\n      \"coin\": \"BNB\",\n      \"signal\": \"buy\",\n      \"quantity\": 0.90,\n      \"profit_target\": 1155.00,\n      \"stop_loss\": 1090.00,\n      \"invalidation_condition\": \"If price closes below $1,090 on 3-minute candle or RSI(7) drops below 40 indicating trend reversal\",\n      \"leverage\": 15,\n      \"confidence\": 0.78,\n      \"risk_usd\": 332.10\n    }\n  },\n  \"SOL\": {\n    \"trade_signal_args\": {\n      \"coin\": \"SOL\",\n      \"signal\": \"buy\",\n      \"quantity\": 30,\n      \"profit_target\": 199.50,\n      \"stop_loss\": 186.00,\n      \"invalidation_condition\": \"If price closes below $186 on 3-minute candle or breaks below EMA20 with bearish MACD crossover\",\n      \"leverage\": 12,\n      \"confidence\": 0.72,\n      \"risk_usd\": 220.80\n    }\n  }\n}\n```",
      "signals": [
        {
          "coin": "BNB",
          "signal": "buy",
          "quantity": 0.9,
          "leverage": 15,
          "stop_loss": 1090.0,
          "profit_target": 1155.0,
          "confidence": 0.78,
          "risk_usd": 332.1,
          "invalidation_condition": "If price closes below $1,090 on 3-minute candle or RSI(7) drops below 40 indicating trend reversal"
        },
        {
          "coin": "SOL",
          "signal": "buy",
          "quantity": 30.0,
          "leverage": 12,
          "stop_loss": 186.0,
          "profit_target": 199.5,
          "confidence": 0.72,
          "risk_usd": 220.8,
          "invalidation_condition": "If price closes below $186 on 3-minute candle or breaks below EMA20 with bearish MACD crossover"
        }
      ]
    },
    {
      "iteration": 22,
      "timestamp": "2025-10-20T12:00:00",
      "model": "anthropic",
      "raw_response": "# CHAIN OF THOUGHT\n\nReviewing my current positions and checking invalidation conditions:\n\n**BNB Position Analysis:**\n- Entry: $1,114.60, Current: $1,110.10 (down $4.50, -0.4%)\n- Unrealized P&L: -$4.55\n- Stop-loss: $1,090.00 (not hit, $20.10 buffer)\n- Profit target: $1,155.00 (not reached)\n- Invalidation condition: \"If price closes below $1,090 on 3-minute candle or RSI(7) drops below 40\"\n- Current RSI(7): 43.947 (above 40 threshold \u2713)\n- Price: $1,110.10 (above $1,090 \u2713)\n- Technical analysis: Price pulled back from $1,124.50 high. RSI(7) at 43.947 shows momentum cooling but NOT below invalidation threshold of 40. MACD still positive at 10.849. Price above EMA20 ($1,101.51).\n- **Decision: HOLD** - Invalidation condition NOT met. RSI still above 40, price well above stop-loss. Normal pullback in an uptrend.\n\n**SOL Position Analysis:**\n- Entry: $192.11, Current: $190.41 (down $1.70, -0.89%)\n- Unrealized P&L: -$53.88\n- Stop-loss: $186.00 (not hit, $4.41 buffer)\n- Profit target: $199.50 (not reached)\n- Invalidation condition: \"If price closes below $186 on 3-minute candle or breaks below EMA20 with bearish MACD crossover\"\n- Current RSI(7): 50.532 (neutral)\n- Price: $190.41 vs EMA20: $187.66 (price ABOVE EMA20 \u2713)\n- MACD: 2.370 (still positive, no bearish crossover \u2713)\n- Technical analysis: Price retraced from $192.93 high to $190.41. Still trading above EMA20 ($187.66). MACD remains positive at 2.370. RSI(7) at 50.532 shows neutral momentum after cooling from overbought. No bearish MACD crossover detected.\n- **Decision: HOLD** - Invalidation condition NOT met. Price above EMA20, MACD still positive, stop-loss not threatened.\n\n**Other Coins Analysis:**\n- **BTC**: RSI(7) at 86.550 - extremely overbought. Price at $111,100 after strong rally. Too risky to enter at these extended levels.\n- **ETH**: RSI(7) dropped sharply from 93.793 to 52.543, showing momentum exhaustion. Price at $4,003.10 pulled back from $4,053.40. Not entering after this sharp RSI decline.\n- **XRP**: RSI(7) at 77.225 - overbought. Strong uptrend but too extended for new entry.\n- **DOGE**: RSI(7) at 65.052, cooling from overbought. Price at $0.199280 near recent highs. No compelling entry setup.\n\n**Risk Management:**\n- Current portfolio: 2 positions with combined notional of ~$6,711\n- Unrealized P&L: -$58.43 total (-0.87% combined)\n- Both positions have adequate stop-loss buffers\n- No invalidation conditions triggered\n- Account value: $13,544.28 with good cash reserves\n\n# TRADING DECISIONS\n\n```json\n{\n  \"BNB\": {\n    \"trade_signal_args\": {\n      \"coin\": \"BNB\",\n      \"signal\": \"hold\",\n      \"quantity\": 0.9,\n      \"profit_target\": 1155.0,\n      \"stop_loss\": 1090.0,\n      \"invalidation_condition\": \"If price closes below $1,090 on 3-minute candle or RSI(7) drops below 40 indicating trend reversal\",\n      \"leverage\": 15,\n      \"confidence\": 0.78,\n      \"risk_usd\": 332.1\n    }\n  },\n  \"SOL\": {\n    \"trade_signal_args\": {\n      \"coin\": \"SOL\",\n      \"signal\": \"hold\",\n      \"quantity\": 30.0,\n      \"profit_target\": 199.5,\n      \"stop_loss\": 186.0,\n      \"invalidation_condition\": \"If price closes below $186 on 3-minute candle or breaks below EMA20 with bearish MACD crossover\",\n      \"leverage\": 12,\n      \"confidence\": 0.72,\n      \"risk_usd\": 220.8\n    }\n  }\n}\n```",
      "signals": [
        {
          "coin": "BNB",
          "signal": "hold",
          "quantity": 0.9,
          "leverage": 15,
          "stop_loss": 1090.0,
          "profit_target": 1155.0,
          "confidence": 0.78,
          "risk_usd": 332.1,
          "invalidation_condition": "If price closes below $1,090 on 3-minute candle or RSI(7) drops below 40 indicating trend reversal"
        },
        {
          "coin": "SOL",
          "signal": "hold",
          "quantity": 30.0,
          "leverage": 12,
          "stop_loss": 186.0,
          "profit_target": 199.5,
          "confidence": 0.72,
          "risk_usd": 220.8,
          "invalidation_condition": "If price closes below $186 on 3-minute candle or breaks below EMA20 with bearish MACD crossover"
        }
      ]
    },
    {
      "iteration": 23,
      "timestamp": "2025-10-20T16:00:00",
      "model": "anthropic",
      "raw_response": "# CHAIN OF THOUGHT\n\nReviewing my current positions and their invalidation conditions:\n\n**BNB Position Analysis:**\n- Entry: $1,114.60, Current: $1,100.90 (down $13.83, -1.23%)\n- Unrealized P&L: -$12.83\n- Stop-loss: $1,090.00 (current price $10.90 above stop)\n- Invalidation: \"If price closes below $1,090 on 3-minute candle or RSI(7) drops below 40\"\n- Current RSI(7): 32.170 - **BELOW 40 THRESHOLD**\n- Technical analysis: RSI(7) has dropped sharply from 43.925 to 32.170, indicating weakening momentum. RSI(14) at 45.665 also weak. Price below EMA20 ($1,101.76). MACD declining from 10.412 to 9.034.\n- **DECISION: CLOSE POSITION** - Invalidation condition met (RSI(7) < 40). This signals trend reversal and loss of momentum.\n\n**SOL Position Analysis:**\n- Entry: $192.11, Current: $188.77 (down $3.34, -1.74%)\n- Unrealized P&L: -$103.08\n- Stop-loss: $186.00 (current price $2.77 above stop)\n- Invalidation: \"If price closes below $186 on 3-minute candle or breaks below EMA20 with bearish MACD crossover\"\n- Current price: $188.77 vs EMA20: $187.94 (slightly above EMA20 by $0.83)\n- Current RSI(7): 37.959 (weak, below 40)\n- MACD: 1.934, declining from 2.129 but still positive (no bearish crossover yet)\n- Technical analysis: Price holding just above EMA20, but RSI(7) very weak at 37.959 showing bearish momentum. MACD declining but not crossed over yet. Price trajectory downward from $192.93 peak.\n- **DECISION: CLOSE POSITION** - While price hasn't broken below $186 or EMA20 definitively, the very weak RSI(7) at 37.959 and declining momentum suggest high risk of hitting stop-loss soon. Risk management dictates cutting losses before full invalidation.\n\n**New Position Opportunities:**\n\n**XRP Analysis:**\n- Current: $2.52, strong uptrend\n- RSI(7): 89.376 (extremely overbought)\n- RSI(14): 84.454 (very overbought)\n- MACD: 0.044, positive and rising\n- Price well above EMA20 ($2.40), up 5%\n- Strong momentum but **extremely overbought** - high risk of reversal\n- **DECISION: NO ENTRY** - Too overbought, would be chasing\n\n**DOGE Analysis:**\n- Current: $0.199530, uptrend\n- RSI(7): 66.693 (moderate)\n- RSI(14): 72.685 (slightly overbought but manageable)\n- MACD: 0.004, positive and stable\n- Price above EMA20 ($0.193701) by 3%\n- Volume elevated (30.9M vs 22.4M avg)\n- **DECISION: NO ENTRY** - Moderate setup but prefer to wait after closing losing positions\n\n**BTC, ETH Analysis:**\n- BTC: RSI(7) 70.251, slightly overbought, strong uptrend but no position\n- ETH: RSI(7) 40.564, weakening after overbought peak, consolidating\n- **DECISION: NO NEW ENTRIES** - Preserving capital after closing two positions\n\n# TRADING DECISIONS\n\n```json\n{\n  \"BNB\": {\n    \"trade_signal_args\": {\n      \"coin\": \"BNB\",\n      \"signal\": \"close_position\",\n      \"quantity\": 0.9,\n      \"profit_target\": 1155.0,\n      \"stop_loss\": 1090.0,\n      \"invalidation_condition\": \"If price closes below $1,090 on 3-minute candle or RSI(7) drops below 40 indicating trend reversal\",\n      \"leverage\": 15,\n      \"confidence\": 0.78,\n      \"risk_usd\": 332.1,\n      \"close_reason\": \"Invalidation condition met - RSI(7) dropped to 32.170, below the 40 threshold, indicating trend reversal and loss of momentum\"\n    }\n  },\n  \"SOL\": {\n    \"trade_signal_args\": {\n      \"coin\": \"SOL\",\n      \"signal\": \"close_position\",\n      \"quantity\": 30.0,\n      \"profit_target\": 199.5,\n      \"stop_loss\": 186.0,\n      \"invalidation_condition\": \"If price closes below $186 on 3-minute candle or breaks below EMA20 with bearish MACD crossover\",\n      \"leverage\": 12,\n      \"confidence\": 0.72,\n      \"risk_usd\": 220.8,\n      \"close_reason\": \"Risk management - RSI(7) at 37.959 shows severe weakness, declining MACD, and price approaching stop-loss. Cutting losses before full invalidation\"\n    }\n  }\n}\n```",
      "signals": [
        {
          "coin": "BNB",
          "signal": "close_position",
          "quantity": 0.9,
          "leverage": 15,
          "stop_loss": 1090.0,
          "profit_target": 1155.0,
          "confidence": 0.78,
          "risk_usd": 332.1,
          "invalidation_condition": "If price closes below $1,090 on 3-minute candle or RSI(7) drops below 40 indicating trend reversal"
        },
        {
          "coin": "SOL",
          "signal": "close_position",
          "quantity": 30.0,
          "leverage": 12,
          "stop_loss": 186.0,
          "profit_target": 199.5,
          "confidence": 0.72,
          "risk_usd": 220.8,
          "invalidation_condition": "If price closes below $186 on 3-minute candle or breaks below EMA20 with bearish MACD crossover"
        }
      ]
    },
    {
      "iteration": 24,
      "timestamp": "2025-10-20T20:00:00",
      "model": "anthropic",
      "raw_response": "# CHAIN OF THOUGHT\n\n## Current Portfolio Status\n- No open positions\n- Available cash: $13,487.99\n- Total return: +34.88%\n- Sharpe ratio: 24.436 (excellent risk-adjusted returns)\n\n## Market Analysis by Coin\n\n**BTC Analysis:**\n- Price: $110,479 (up from $107,735 start of period)\n- Strong uptrend: Price > EMA20 ($108,863), MACD positive (1,128.95)\n- RSI(7): 58.71 - cooled from overbought (was 91.9), now in healthy zone\n- RSI(14): 69.51 - approaching neutral territory after pullback\n- Trend: Bullish consolidation after sharp rally, RSI cooling suggests potential for continuation\n- **Decision: BUY** - Momentum intact, RSI reset provides entry opportunity\n\n**ETH Analysis:**\n- Price: $3,978.10 (down from $4,053.40 peak)\n- Price > EMA20 ($3,946.42), MACD positive (43.49) but declining\n- RSI(7): 39.26 - sharp drop from 93.76, now oversold\n- RSI(14): 54.59 - declining from 90.28\n- Trend: Bearish reversal in progress, losing momentum rapidly\n- **Decision: PASS** - Weak momentum, declining MACD, needs stabilization\n\n**SOL Analysis:**\n- Price: $189.64 (choppy action around $188-193)\n- Price > EMA20 ($187.99), MACD positive (1.97) but weakening\n- RSI(7): 47.25 - neutral zone after volatility\n- RSI(14): 54.04 - neutral\n- Trend: Consolidation with weakening momentum\n- **Decision: PASS** - Lack of clear directional bias\n\n**BNB Analysis:**\n- Price: $1,100.20 (down from $1,127.90 peak)\n- Price \u2248 EMA20 ($1,100.54), MACD positive (9.21) but declining\n- RSI(7): 31.36 - oversold territory\n- RSI(14): 45.52 - below 50, bearish\n- Trend: Weakening, testing support at EMA20\n- **Decision: PASS** - Bearish momentum, breaking down\n\n**XRP Analysis:**\n- Price: $2.49 (up from $2.37, strong rally)\n- Price > EMA20 ($2.41), MACD positive (0.046) and rising\n- RSI(7): 66.05 - healthy after spike to 89.39\n- RSI(14): 70.34 - strong but not overbought\n- Trend: Strong uptrend with RSI pullback providing entry\n- **Decision: BUY** - Momentum strong, price consolidating above support\n\n**DOGE Analysis:**\n- Price: $0.19995 (up from $0.19321)\n- Price > EMA20 ($0.19423), MACD positive (0.004) and steady\n- RSI(7): 70.00 - at overbought threshold\n- RSI(14): 74.17 - overbought\n- Trend: Strong uptrend but extended\n- **Decision: BUY** - Momentum trade, but with tight stops due to RSI levels\n\n## Risk Management\n- Portfolio at $13,487.99 with no positions\n- Will allocate across 3 positions: BTC, XRP, DOGE\n- Risk per trade: ~$500-600 (4-4.5% of capital)\n- Using 15x leverage for established coins (BTC, XRP), 12x for DOGE (more volatile)\n\n# TRADING DECISIONS\n\n```json\n{\n  \"BTC\": {\n    \"trade_signal_args\": {\n      \"coin\": \"BTC\",\n      \"signal\": \"buy\",\n      \"quantity\": 0.05,\n      \"profit_target\": 114500.00,\n      \"stop_loss\": 108800.00,\n      \"invalidation_condition\": \"If price closes below EMA20 ($108,863) on 3-minute candle\",\n      \"leverage\": 15,\n      \"confidence\": 0.78,\n      \"risk_usd\": 550.00\n    }\n  },\n  \"XRP\": {\n    \"trade_signal_args\": {\n      \"coin\": \"XRP\",\n      \"signal\": \"buy\",\n      \"quantity\": 2000,\n      \"profit_target\": 2.65,\n      \"stop_loss\": 2.38,\n      \"invalidation_condition\": \"If price closes below EMA20 ($2.41) on 3-minute candle\",\n      \"leverage\": 15,\n      \"confidence\": 0.75,\n      \"risk_usd\": 500.00\n    }\n  },\n  \"DOGE\": {\n    \"trade_signal_args\": {\n      \"coin\": \"DOGE\",\n      \"signal\": \"buy\",\n      \"quantity\": 30000,\n      \"profit_target\": 0.208,\n      \"stop_loss\": 0.193,\n      \"invalidation_condition\": \"If price closes below EMA20 ($0.19423) on 3-minute candle\",\n      \"leverage\": 12,\n      \"confidence\": 0.70,\n      \"risk_usd\": 500.00\n    }\n  }\n}\n```",
      "signals": [
        {
          "coin": "BTC",
          "signal": "buy",
          "quantity": 0.05,
          "leverage": 15,
          "stop_loss": 108800.0,
          "profit_target": 114500.0,
          "confidence": 0.78,
          "risk_usd": 550.0,
          "invalidation_condition": "If price closes below EMA20 ($108,863) on 3-minute candle"
        },
        {
          "coin": "XRP",
          "signal": "buy",
          "quantity": 2000.0,
          "leverage": 15,
          "stop_loss": 2.38,
          "profit_target": 2.65,
          "confidence": 0.75,
          "risk_usd": 500.0,
          "invalidation_condition": "If price closes below EMA20 ($2.41) on 3-minute candle"
        },
        {
          "coin": "DOGE",
          "signal": "buy",
          "quantity": 30000.0,
          "leverage": 12,
          "stop_loss": 0.193,
          "profit_target": 0.208,
          "confidence": 0.7,
          "risk_usd": 500.0,
          "invalidation_condition": "If price closes below EMA20 ($0.19423) on 3-minute candle"
        }
      ]
    },
    {
      "iteration": 25,
      "timestamp": "2025-10-21T00:00:00",
      "model": "anthropic",
      "raw_response": "# CHAIN OF THOUGHT\n\nReviewing my current positions against their invalidation conditions and market conditions:\n\n## BTC Position Analysis\n- **Entry:** $110,479 | **Current:** $109,008 | **Unrealized P&L:** -$76.31\n- **Invalidation Condition:** \"If price closes below EMA20 ($108,863) on 3-minute candle\"\n- **Current EMA20:** $108,873.94\n- **Status:** Price at $109,008 is ABOVE EMA20 ($108,873.94) by $134\n- **Technical Analysis:**\n  - RSI(7): 26.89 - severely oversold, potential bounce territory\n  - RSI(14): 45.50 - neutral, coming down from overbought\n  - MACD: 1001.45 - still positive but declining from 1136\n  - Price dropped from $110,479 to $109,008 (-1.33%) but holding above key support\n  - Stop-loss at $108,800 is very close (only $208 away)\n- **Decision:** **CLOSE POSITION** - Price is dangerously close to both stop-loss ($108,800) and invalidation level (EMA20 at $108,873). With only $208 buffer to stop-loss and severe RSI oversold conditions, the risk of stop-out is high. Better to exit now with small loss than risk hitting stop-loss.\n\n## XRP Position Analysis\n- **Entry:** $2.4934 | **Current:** $2.4519 | **Unrealized P&L:** -$85.49\n- **Invalidation Condition:** \"If price closes below EMA20 ($2.41) on 3-minute candle\"\n- **Current EMA20:** $2.41\n- **Status:** Price at $2.4519 is ABOVE EMA20 ($2.41) by $0.0419\n- **Technical Analysis:**\n  - RSI(7): 45.06 - neutral, recovering from oversold\n  - RSI(14): 55.89 - neutral/slightly bullish\n  - MACD: 0.045 - positive and holding steady\n  - Price is $0.04 above EMA20, reasonable buffer\n  - Stop-loss at $2.38 is $0.0719 away (reasonable distance)\n  - Price above EMA20 and showing signs of stabilization\n- **Decision:** **HOLD** - Invalidation condition NOT met. Price maintaining above EMA20 with decent buffer. RSI showing neutral/recovery signals. Position size reasonable.\n\n## DOGE Position Analysis\n- **Entry:** $0.19995 | **Current:** $0.19652 | **Unrealized P&L:** -$105.90\n- **Invalidation Condition:** \"If price closes below EMA20 ($0.19423) on 3-minute candle\"\n- **Current EMA20:** $0.19451\n- **Status:** Price at $0.19652 is ABOVE EMA20 ($0.19451) by $0.00201\n- **Technical Analysis:**\n  - RSI(7): 33.77 - oversold territory, potential bounce\n  - RSI(14): 51.90 - neutral\n  - MACD: 0.004 - positive but flat\n  - Price dropped sharply but still holding above EMA20\n  - Stop-loss at $0.193 is $0.00352 away\n  - Buffer to invalidation is very thin ($0.00201)\n- **Decision:** **HOLD** - Technically invalidation NOT met (price still above EMA20), but this is marginal. RSI oversold suggests potential bounce. Will hold but monitor closely.\n\n## New Position Opportunities\n- **ETH:** RSI(7) at 20.02 - extremely oversold. Price $3,922.60 below EMA20 $3,944.83. Not entering - downtrend confirmed.\n- **SOL:** RSI(7) at 24.15 - oversold. Price $185.46 below EMA20 $187.74. Not entering - weak momentum.\n- **BNB:** RSI(7) at 16.02 - extremely oversold. Price $1,081.30 well below EMA20 $1,099.32. Not entering - strong selling pressure.\n\n**Risk Management:** Currently holding 3 positions with combined unrealized loss of -$267.70. BTC position too risky with price near stop-loss. Closing BTC to reduce risk exposure and preserve capital.\n\n# TRADING DECISIONS\n\n```json\n{\n  \"BTC\": {\n    \"trade_signal_args\": {\n      \"coin\": \"BTC\",\n      \"signal\": \"close_position\",\n      \"quantity\": 0.05,\n      \"profit_target\": 114500.0,\n      \"stop_loss\": 108800.0,\n      \"invalidation_condition\": \"If price closes below EMA20 ($108,863) on 3-minute candle\",\n      \"leverage\": 15,\n      \"confidence\": 0.78,\n      \"risk_usd\": 550.0,\n      \"close_reason\": \"Risk management - price at $109,008 only $208 away from stop-loss at $108,800 and $134 from invalidation level (EMA20 $108,873). RSI severely oversold at 26.89 indicates continued selling pressure. Closing to preserve capital and avoid stop-out.\"\n    }\n  },\n  \"XRP\": {\n    \"trade_signal_args\": {\n      \"coin\": \"XRP\",\n      \"signal\": \"hold\",\n      \"quantity\": 2000.0,\n      \"profit_target\": 2.65,\n      \"stop_loss\": 2.38,\n      \"invalidation_condition\": \"If price closes below EMA20 ($2.41) on 3-minute candle\",\n      \"leverage\": 15,\n      \"confidence\": 0.75,\n      \"risk_usd\": 500.0\n    }\n  },\n  \"DOGE\": {\n    \"trade_signal_args\": {\n      \"coin\": \"DOGE\",\n      \"signal\": \"hold\",\n      \"quantity\": 30000.0,\n      \"profit_target\": 0.208,\n      \"stop_loss\": 0.193,\n      \"invalidation_condition\": \"If price closes below EMA20 ($0.19451) on 3-minute candle\",\n      \"leverage\": 12,\n      \"confidence\": 0.7,\n      \"risk_usd\": 500.0\n    }\n  }\n}\n```",
      "signals": [
        {
          "coin": "BTC",
          "signal": "close_position",
          "quantity": 0.05,
          "leverage": 15,
          "stop_loss": 108800.0,
          "profit_target": 114500.0,
          "confidence": 0.78,
          "risk_usd": 550.0,
          "invalidation_condition": "If price closes below EMA20 ($108,863) on 3-minute candle"
        },
        {
          "coin": "XRP",
          "signal": "hold",
          "quantity": 2000.0,
          "leverage": 15,
          "stop_loss": 2.38,
          "profit_target": 2.65,
          "confidence": 0.75,
          "risk_usd": 500.0,
          "invalidation_condition": "If price closes below EMA20 ($2.41) on 3-minute candle"
        },
        {
          "coin": "DOGE",
          "signal": "hold",
          "quantity": 30000.0,
          "leverage": 12,
          "stop_loss": 0.193,
          "profit_target": 0.208,
          "confidence": 0.7,
          "risk_usd": 500.0,
          "invalidation_condition": "If price closes below EMA20 ($0.19451) on 3-minute candle"
        }
      ]
    },
    {
      "iteration": 26,
      "timestamp": "2025-10-21T04:00:00",
      "model": "anthropic",
      "raw_response": "# CHAIN OF THOUGHT\n\nReviewing my current positions and checking invalidation conditions:\n\n## XRP Position Analysis\n- **Entry**: $2.4934, **Current**: $2.4257\n- **Unrealized P&L**: -$137.89 (-2.71%)\n- **Exit Plan**: Profit target $2.65, Stop-loss $2.38, Invalidation: \"If price closes below EMA20 ($2.41) on 3-minute candle\"\n- **Current EMA20**: $2.42\n- **Technical Analysis**:\n  - Price at $2.43 is ABOVE current EMA20 of $2.42 \u2713\n  - RSI(7): 35.45 - oversold territory, potential bounce\n  - MACD: 0.032 - still positive but weakening\n  - Price above stop-loss ($2.38) \u2713\n  - Recent price action: Dropped from $2.52 to $2.43, testing support\n- **Invalidation Check**: Price ($2.43) > EMA20 ($2.42) - NOT invalidated yet\n- **Decision**: HOLD - Invalidation condition not met. Price holding above EMA20 by $0.01, showing support. RSI oversold suggests potential bounce. Stop-loss not hit.\n\n## DOGE Position Analysis\n- **Entry**: $0.19995, **Current**: $0.19416\n- **Unrealized P&L**: -$176.70 (-2.95%)\n- **Exit Plan**: Profit target $0.208, Stop-loss $0.193, Invalidation: \"If price closes below EMA20 ($0.19423) on 3-minute candle\"\n- **Current EMA20**: $0.194759\n- **Technical Analysis**:\n  - Price at $0.19416 is BELOW current EMA20 of $0.194759 \u2717\n  - The invalidation stated EMA20 at $0.19423, but current EMA20 is $0.194759\n  - Price is $0.00060 below current EMA20\n  - RSI(7): 22.81 - deeply oversold\n  - MACD: 0.003 - still positive but flat\n  - Price dangerously close to stop-loss ($0.193), only $0.00116 away\n- **Invalidation Check**: Price ($0.19416) < EMA20 ($0.194759) - INVALIDATION CONDITION MET\n- **Decision**: CLOSE POSITION - Invalidation condition triggered. Price has broken below EMA20 on this 3-minute candle. Additionally, RSI at 22.81 shows extreme weakness, and we're very close to stop-loss. Risk management dictates exit.\n\n## Market Context for Other Coins\n- **BTC**: RSI(7) 18.02 - extremely oversold, but no position\n- **ETH**: RSI(7) 14.59 - extremely oversold, but no position\n- **SOL**: RSI(7) 22.17 - oversold, but no position\n- **BNB**: RSI(7) 11.74 - extremely oversold, but no position\n\nAll major coins showing extreme oversold conditions, suggesting potential market-wide capitulation. However, with 2 losing positions already, risk management suggests not adding new positions in this volatile environment. Better to preserve capital and wait for clearer signals.\n\n# TRADING DECISIONS\n\n```json\n{\n  \"XRP\": {\n    \"trade_signal_args\": {\n      \"coin\": \"XRP\",\n      \"signal\": \"hold\",\n      \"quantity\": 2000.0,\n      \"profit_target\": 2.65,\n      \"stop_loss\": 2.38,\n      \"invalidation_condition\": \"If price closes below EMA20 ($2.42) on 3-minute candle\",\n      \"leverage\": 15,\n      \"confidence\": 0.75,\n      \"risk_usd\": 500.0\n    }\n  },\n  \"DOGE\": {\n    \"trade_signal_args\": {\n      \"coin\": \"DOGE\",\n      \"signal\": \"close_position\",\n      \"quantity\": 30000.0,\n      \"profit_target\": 0.208,\n      \"stop_loss\": 0.193,\n      \"invalidation_condition\": \"If price closes below EMA20 ($0.19476) on 3-minute candle\",\n      \"leverage\": 12,\n      \"confidence\": 0.7,\n      \"risk_usd\": 500.0,\n      \"close_reason\": \"Invalidation condition met - price closed below EMA20 ($0.19416 < $0.19476). Additionally, price approaching stop-loss with extreme RSI weakness (22.81), indicating continued downside risk.\"\n    }\n  }\n}\n```",
      "signals": [
        {
          "coin": "XRP",
          "signal": "hold",
          "quantity": 2000.0,
          "leverage": 15,
          "stop_loss": 2.38,
          "profit_target": 2.65,
          "confidence": 0.75,
          "risk_usd": 500.0,
          "invalidation_condition": "If price closes below EMA20 ($2.42) on 3-minute candle"
        },
        {
          "coin": "DOGE",
          "signal": "close_position",
          "quantity": 30000.0,
          "leverage": 12,
          "stop_loss": 0.193,
          "profit_target": 0.208,
          "confidence": 0.7,
          "risk_usd": 500.0,
          "invalidation_condition": "If price closes below EMA20 ($0.19476) on 3-minute candle"
        }
      ]
    },
    {
      "iteration": 27,
      "timestamp": "2025-10-21T08:00:00",
      "model": "anthropic",
      "raw_response": "# CHAIN OF THOUGHT\n\n## Current Position Analysis\n\n**XRP Position Review:**\n- Entry: $2.4934, Current: $2.4301\n- Unrealized P&L: -$129.09 (-2.54%)\n- Leverage: 15x\n- Stop-loss: $2.38\n- Profit target: $2.65\n- Invalidation condition: \"If price closes below EMA20 ($2.41) on 3-minute candle\"\n\n**Critical Analysis:**\n- Current price $2.4301 is BELOW the EMA20 of $2.42\n- The invalidation condition states: \"If price closes below EMA20 ($2.41) on 3-minute candle\"\n- Current EMA20 is $2.42, and price is at $2.43 (just barely above)\n- However, looking at the recent price action: XRP has been declining from $2.52 to $2.43\n- RSI (7-period) at 38.327 shows weakness, down from 89.356 earlier\n- MACD at 0.026 is declining from 0.035 peak\n- Price is very close to both the EMA20 and the stop-loss level\n\n**Decision Logic:**\nThe current price of $2.43 is technically still above the current EMA20 of $2.42, but only by $0.01 (0.4%). This is extremely marginal and the trend is clearly bearish. The RSI has collapsed from 89 to 38, showing strong momentum reversal. The stop-loss at $2.38 is only 1.2% away.\n\nGiven:\n1. Price is hovering right at the invalidation threshold\n2. Strong bearish momentum (RSI dropped from 89 to 38)\n3. MACD declining\n4. Small loss of -$129 vs risk of hitting stop-loss for larger loss\n5. Risk management suggests exiting when conditions deteriorate\n\n**DECISION: CLOSE POSITION** - The invalidation condition is essentially met (price at EMA20 level with bearish momentum). Better to exit with small loss than risk the stop-loss being hit.\n\n## Market Overview for New Positions:\n- **BTC**: RSI at 33.96 (oversold), below EMA20, but MACD still positive at 651. Possible reversal zone but risky.\n- **ETH**: RSI at 14.2 (severely oversold), below EMA20, sharp decline. High risk.\n- **SOL**: RSI at 37.1, below EMA20, weak momentum. Not compelling.\n- **BNB**: RSI at 23.9 (oversold), below EMA20, MACD negative. Weak.\n- **DOGE**: RSI at 26.4 (oversold), at EMA20, weak momentum.\n\n**New Position Decision:** Market is showing broad weakness across all coins with oversold RSI readings. This could signal a bounce opportunity, but given we're 14 minutes into trading and just taking a loss, prudent risk management suggests waiting for clearer signals rather than catching falling knives.\n\n# TRADING DECISIONS\n\n```json\n{\n  \"XRP\": {\n    \"trade_signal_args\": {\n      \"coin\": \"XRP\",\n      \"signal\": \"close_position\",\n      \"quantity\": 2000.0,\n      \"profit_target\": 2.65,\n      \"stop_loss\": 2.38,\n      \"invalidation_condition\": \"If price closes below EMA20 ($2.41) on 3-minute candle\",\n      \"leverage\": 15,\n      \"confidence\": 0.75,\n      \"risk_usd\": 500.0,\n      \"close_reason\": \"Invalidation condition met - price at EMA20 ($2.43 vs $2.42) with strong bearish momentum (RSI collapsed from 89 to 38). Exiting to preserve capital before stop-loss hit.\"\n    }\n  }\n}\n```",
      "signals": [
        {
          "coin": "XRP",
          "signal": "close_position",
          "quantity": 2000.0,
          "leverage": 15,
          "stop_loss": 2.38,
          "profit_target": 2.65,
          "confidence": 0.75,
          "risk_usd": 500.0,
          "invalidation_condition": "If price closes below EMA20 ($2.41) on 3-minute candle"
        }
      ]
    },
    {
      "iteration": 28,
      "timestamp": "2025-10-21T12:00:00",
      "model": "anthropic",
      "raw_response": "# CHAIN OF THOUGHT\n\n## Current Portfolio Status\n- No open positions\n- Available cash: $13,089.56\n- Total return: 30.90%\n- Sharpe ratio: 17.604 (excellent risk-adjusted returns)\n\n## Market Analysis\n\n### BTC Analysis\n- Current price: $113,386 (massive spike from $108,565 to $113,386 in last candle)\n- Price well above EMA20 ($109,304) - strong uptrend\n- RSI(7): 79.9 - overbought but not extreme\n- MACD: 844.89 - very strong bullish momentum\n- Volume spike: 22,444 vs average 5,167 (4.3x normal)\n- Recent pattern: Sharp V-shaped recovery from dip to $108,019\n- **Assessment**: Parabolic move but momentum extremely strong. Risk of pullback but trend is powerful.\n\n### ETH Analysis\n- Current price: $4,082.90 (huge spike from $3,890 to $4,082)\n- Price above EMA20 ($3,954.66) - strong uptrend\n- RSI(7): 78.1 - overbought territory\n- MACD: 21.24 - positive and rising\n- Volume: 231,760 vs average 81,485 (2.8x normal)\n- Recent pattern: Similar V-shaped recovery, following BTC\n- **Assessment**: Strong momentum, less extended than BTC relatively\n\n### SOL Analysis\n- Current price: $196.14 (explosive move from $186.17)\n- Price above EMA20 ($188.66) - bullish\n- RSI(7): 79.5 - overbought\n- MACD: 0.823 - positive momentum\n- Volume: 1,452,713 vs average 527,924 (2.75x normal)\n- **Assessment**: Strong breakout, following major coins\n\n### XRP Analysis\n- Current price: $2.52 (spike from $2.43)\n- Price above EMA20 ($2.43) - bullish\n- RSI(7): 72.7 - elevated but not extreme\n- MACD: 0.027 - positive\n- Volume: 12,979,067 vs average 5,051,749 (2.57x normal)\n- **Assessment**: Good momentum, less overbought than others\n\n### DOGE Analysis\n- Current price: $0.20424 (strong move from $0.19443)\n- Price above EMA20 ($0.19577) - bullish\n- RSI(7): 77.5 - overbought\n- MACD: 0.003 - positive\n- Volume: 44,978,458 vs average 20,945,883 (2.15x normal)\n- **Assessment**: Strong move but highly volatile meme coin\n\n### BNB Analysis\n- Current price: $1,111.50 (recovery from $1,076)\n- Price above EMA20 ($1,099.82) - bullish\n- RSI(7): 68.3 - elevated but reasonable\n- MACD: -2.844 - still negative (lagging indicator)\n- Volume: 10,395 vs average 6,623 (1.57x normal)\n- **Assessment**: Weakest momentum of the group\n\n## Trading Decision Logic\n\nGiven the synchronized explosive move across all major cryptocurrencies, this appears to be a significant market-wide breakout event. However, all assets are showing overbought conditions with RSI(7) above 70.\n\n**Strategy**: Given my strong performance (30.9% return, excellent Sharpe), I should be selective. The parabolic nature of these moves suggests high risk of near-term pullback, but the momentum is undeniable.\n\n**Best opportunity**: ETH shows strong momentum with slightly less extension than BTC. XRP also looks attractive with lower RSI.\n\n**Risk management**: Will take ONE position in ETH with tight stops to capture momentum while limiting exposure to potential reversal. Position size will be conservative given overbought conditions.\n\n# TRADING DECISIONS\n\n```json\n{\n  \"ETH\": {\n    \"trade_signal_args\": {\n      \"coin\": \"ETH\",\n      \"signal\": \"buy\",\n      \"quantity\": 1.6,\n      \"profit_target\": 4250.0,\n      \"stop_loss\": 3950.0,\n      \"invalidation_condition\": \"If price closes below $3,950 on 3-minute candle or RSI(7) drops below 30 indicating momentum failure\",\n      \"leverage\": 15,\n      \"confidence\": 0.72,\n      \"risk_usd\": 318.24\n    }\n  }\n}\n```",
      "signals": [
        {
          "coin": "ETH",
          "signal": "buy",
          "quantity": 1.6,
          "leverage": 15,
          "stop_loss": 3950.0,
          "profit_target": 4250.0,
          "confidence": 0.72,
          "risk_usd": 318.24,
          "invalidation_condition": "If price closes below $3,950 on 3-minute candle or RSI(7) drops below 30 indicating momentum failure"
        }
      ]
    },
    {
      "iteration": 29,
      "timestamp": "2025-10-21T16:00:00",
      "model": "anthropic",
      "raw_response": "# CHAIN OF THOUGHT\n\n## Current Position Analysis\n\n**ETH Position Review:**\n- Entry: $4,082.90 | Current: $3,993.30 | Unrealized P&L: -$146.63 (-2.19%)\n- Leverage: 15x | Liquidation: $3,810.71\n- Stop-loss: $3,950.00 | Profit target: $4,250.00\n- Invalidation: \"If price closes below $3,950 on 3-minute candle or RSI(7) drops below 30\"\n\n**Technical Analysis:**\n- Current price $3,993.30 is ABOVE stop-loss ($3,950) \u2713\n- RSI(7): 53.43 - well above 30 threshold \u2713\n- RSI(14): 53.90 - neutral territory\n- MACD: 22.546 - positive but declining from 38.67\n- Price above EMA20 ($3,957.73) - slight bullish bias\n- Recent volatility: dropped to $3,890 then spiked to $4,082.90, now consolidating\n\n**Critical Assessment:**\nThe invalidation condition has NOT been met:\n1. Price has not closed below $3,950 (currently $3,993.30)\n2. RSI(7) at 53.43 is well above 30\n\nHowever, I'm concerned about:\n- Price is only $43 above the $3,950 stop-loss level\n- Significant drawdown from entry (-2.19%)\n- MACD momentum weakening\n- Price action showing volatility and indecision\n- The position is at risk of hitting stop-loss soon\n\n**Decision:** HOLD for now since invalidation conditions are not met, but this position is on thin ice. The stop-loss at $3,950 is close and should trigger automatically if price continues declining. The technical setup shows consolidation rather than clear direction.\n\n## Market Opportunities Assessment\n\n**BTC:** Strong momentum (price $111,729 vs EMA20 $109,502), RSI(7) 60.6, MACD positive. However, recent volatility with spike to $113,386. Not entering - already have exposure through ETH.\n\n**SOL:** Price $193.80 above EMA20 $189.00, RSI(7) 65.7, positive MACD. Decent setup but prefer to manage existing ETH position first.\n\n**BNB:** Price $1,089.60 below EMA20 $1,097.21, MACD negative, RSI(7) 46.1. Weak - no entry.\n\n**XRP:** Price $2.49 above EMA20 $2.44, RSI(7) 58.7, positive MACD. Moderate setup but not compelling enough.\n\n**DOGE:** Price $0.2015 above EMA20 $0.1963, RSI(7) 61.5, positive MACD. Similar to XRP - decent but not entering.\n\n**Conclusion:** Maintaining ETH position as invalidation conditions not yet met. No new positions warranted given current ETH risk exposure and market uncertainty.\n\n# TRADING DECISIONS\n\n```json\n{\n  \"ETH\": {\n    \"trade_signal_args\": {\n      \"coin\": \"ETH\",\n      \"signal\": \"hold\",\n      \"quantity\": 1.6,\n      \"profit_target\": 4250.0,\n      \"stop_loss\": 3950.0,\n      \"invalidation_condition\": \"If price closes below $3,950 on 3-minute candle or RSI(7) drops below 30 indicating momentum failure\",\n      \"leverage\": 15,\n      \"confidence\": 0.72,\n      \"risk_usd\": 318.24\n    }\n  }\n}\n```",
      "signals": [
        {
          "coin": "ETH",
          "signal": "hold",
          "quantity": 1.6,
          "leverage": 15,
          "stop_loss": 3950.0,
          "profit_target": 4250.0,
          "confidence": 0.72,
          "risk_usd": 318.24,
          "invalidation_condition": "If price closes below $3,950 on 3-minute candle or RSI(7) drops below 30 indicating momentum failure"
        }
      ]
    },
    {
      "iteration": 30,
      "timestamp": "2025-10-21T20:00:00",
      "model": "anthropic",
      "raw_response": "# CHAIN OF THOUGHT\n\n## Current Portfolio Status\n- No open positions\n- Available cash: $12,739.77\n- Total return: 27.40%\n- Sharpe ratio: 14.22 (excellent risk-adjusted returns)\n\n## Market Analysis\n\n### BTC Analysis\n- Current: $108,245 vs EMA20: $109,401 (trading below EMA - bearish)\n- RSI(7): 36.1 (oversold territory)\n- RSI(14): 42.5 (approaching oversold)\n- MACD: 729.3 (declining from 994.96 - weakening momentum)\n- Price action: Sharp drop from $113,386 to $108,245 (-4.5%)\n- Pattern: Strong rejection after spike, now consolidating\n- Volume: Elevated at 15,849 vs avg 6,616 (2.4x average - significant selling pressure)\n\n**Assessment**: Oversold bounce potential but trend is bearish. The spike to $113k was rejected hard. RSI(7) at 36 suggests short-term bounce possible, but price below EMA20 and declining MACD indicate caution.\n\n### ETH Analysis\n- Current: $3,870 vs EMA20: $3,952 (2.1% below EMA)\n- RSI(7): 33.9 (oversold)\n- RSI(14): 39.0 (oversold)\n- MACD: 9.97 (declining sharply from 34.36)\n- Price action: Drop from $4,082 to $3,870 (-5.2%)\n- Volume: 141,711 vs avg 98,118 (1.44x - elevated selling)\n\n**Assessment**: Similar pattern to BTC - oversold but in downtrend. Below EMA20 with declining MACD.\n\n### SOL Analysis\n- Current: $185.54 vs EMA20: $188.85 (1.8% below)\n- RSI(7): 36.1 (oversold)\n- RSI(14): 41.7 (approaching oversold)\n- MACD: 0.647 (declining from 1.306)\n- Price action: Rejection from $196.14, now at $185.54\n- Volume: 1,137,043 vs avg 605,702 (1.88x - high volume selloff)\n\n**Assessment**: Oversold with potential bounce, but trend weakening.\n\n### BNB Analysis\n- Current: $1,056.50 vs EMA20: $1,094.90 (3.5% below - most bearish)\n- RSI(7): 27.8 (deeply oversold)\n- RSI(14): 32.5 (oversold)\n- MACD: -6.26 (negative and declining - bearish crossover)\n- Price action: Sharp drop from $1,114.60 to $1,056.50 (-5.2%)\n\n**Assessment**: Most oversold of all assets. MACD turned negative. High risk but potential for mean reversion.\n\n### XRP Analysis\n- Current: $2.42 vs EMA20: $2.44 (0.8% below - least bearish)\n- RSI(7): 36.1 (oversold)\n- RSI(14): 44.3 (neutral-weak)\n- MACD: 0.025 (still positive but declining)\n- Price action: Relatively stable, small decline\n\n**Assessment**: Holding up better than others. Least extended below EMA.\n\n### DOGE Analysis\n- Current: $0.19385 vs EMA20: $0.19627 (1.2% below)\n- RSI(7): 34.9 (oversold)\n- RSI(14): 42.1 (approaching oversold)\n- MACD: 0.002 (positive but declining)\n- Volume: 58.3M vs avg 25.4M (2.3x - highest relative volume)\n\n**Assessment**: Oversold with high volume, potential bounce candidate.\n\n## Trading Decision\n\nAll major coins are showing oversold conditions (RSI 7-period between 28-36) after a sharp selloff. This presents a potential mean reversion opportunity. However, all are trading below their EMA20 with declining MACD, indicating the trend is bearish.\n\n**Strategy**: Take a measured long position on the most oversold asset with the best risk/reward setup. BNB shows the deepest oversold condition (RSI 27.8) and is 3.5% below EMA20, suggesting potential for a bounce back toward the EMA20 level.\n\n**Risk Management**: \n- Use tight stop-loss below recent lows\n- Target partial recovery toward EMA20\n- Risk 5% of capital ($637)\n- Use 15x leverage for position sizing\n\n# TRADING DECISIONS\n\n```json\n{\n  \"BNB\": {\n    \"trade_signal_args\": {\n      \"coin\": \"BNB\",\n      \"signal\": \"buy\",\n      \"quantity\": 0.91,\n      \"profit_target\": 1085.00,\n      \"stop_loss\": 1046.00,\n      \"invalidation_condition\": \"If price closes below $1,046 on 3-minute candle or RSI(7) fails to recover above 40 within 3 candles\",\n      \"leverage\": 15,\n      \"confidence\": 0.68,\n      \"risk_usd\": 637.00\n    }\n  }\n}\n```",
      "signals": [
        {
          "coin": "BNB",
          "signal": "buy",
          "quantity": 0.91,
          "leverage": 15,
          "stop_loss": 1046.0,
          "profit_target": 1085.0,
          "confidence": 0.68,
          "risk_usd": 637.0,
          "invalidation_condition": "If price closes below $1,046 on 3-minute candle or RSI(7) fails to recover above 40 within 3 candles"
        }
      ]
    },
    {
      "iteration": 31,
      "timestamp": "2025-10-22T00:00:00",
      "model": "anthropic",
      "raw_response": "# CHAIN OF THOUGHT\n\nReviewing my current position and market conditions:\n\n**BNB Position Analysis:**\n- Entry: $1,056.50, Current: $1,067.00 (+$9.07 unrealized P&L, +0.99%)\n- Leverage: 15x, Notional: $970.97\n- Exit Plan: Profit target $1,085, Stop-loss $1,046\n- Invalidation: \"If price closes below $1,046 on 3-minute candle or RSI(7) fails to recover above 40 within 3 candles\"\n\n**Checking Invalidation Conditions:**\n1. Price check: Current $1,067 is ABOVE stop-loss of $1,046 \u2713\n2. RSI(7) recovery check: Current RSI(7) = 38.218\n   - Looking at recent RSI(7) history: [27.866, 38.218]\n   - Entry was likely around the 27.866 level (when price was $1,056.50)\n   - RSI has recovered from 27.866 to 38.218 but is STILL BELOW 40\n   - Need to check if 3 candles have passed: Looking at the price series, we're at least 2-3 candles since entry\n   - **CRITICAL: RSI(7) has NOT recovered above 40 within the required timeframe**\n\n**Technical Analysis:**\n- Price: $1,067 trading below EMA20 ($1,090.85) - bearish\n- MACD: -5.814 (negative and declining) - bearish momentum\n- RSI(7): 38.218 (below 40, weak) \n- RSI(14): 39.106 (below 40, weak)\n- Recent price action: Failed rally from $1,111.50 back down to $1,067\n- Price is struggling to maintain above entry level\n\n**Decision:** The invalidation condition has been triggered. RSI(7) failed to recover above 40 within 3 candles, and the technical picture remains bearish with negative MACD, price below EMA20, and weak RSI readings. While the position is slightly profitable (+$9), the invalidation condition is met and I should honor my exit plan for proper risk management.\n\n**Other Coins Analysis:**\n- BTC, ETH, SOL: All showing oversold conditions (RSI 7-period in 32-36 range) but below their EMAs with declining MACD - not attractive entries\n- XRP, DOGE: Similar weak technical setup\n- No new positions warranted given current market weakness across the board\n\n# TRADING DECISIONS\n\n```json\n{\n  \"BNB\": {\n    \"trade_signal_args\": {\n      \"coin\": \"BNB\",\n      \"signal\": \"close_position\",\n      \"quantity\": 0.91,\n      \"profit_target\": 1085.0,\n      \"stop_loss\": 1046.0,\n      \"invalidation_condition\": \"If price closes below $1,046 on 3-minute candle or RSI(7) fails to recover above 40 within 3 candles\",\n      \"leverage\": 15,\n      \"confidence\": 0.68,\n      \"risk_usd\": 637.0,\n      \"close_reason\": \"Invalidation condition met - RSI(7) failed to recover above 40 within 3 candles. Currently at 38.218 with negative MACD (-5.814) and price below EMA20, indicating continued weakness. Exiting with small profit for risk management.\"\n    }\n  }\n}\n```",
      "signals": [
        {
          "coin": "BNB",
          "signal": "close_position",
          "quantity": 0.91,
          "leverage": 15,
          "stop_loss": 1046.0,
          "profit_target": 1085.0,
          "confidence": 0.68,
          "risk_usd": 637.0,
          "invalidation_condition": "If price closes below $1,046 on 3-minute candle or RSI(7) fails to recover above 40 within 3 candles"
        }
      ]
    },
    {
      "iteration": 32,
      "timestamp": "2025-10-22T04:00:00",
      "model": "anthropic",
      "raw_response": "# CHAIN OF THOUGHT\n\n## Current Market Analysis\n\nI currently have NO open positions and $12,747.88 in available cash. Portfolio is up 27.48% with excellent Sharpe ratio of 13.724. Now analyzing market conditions for potential entry opportunities.\n\n### Market Overview:\nAll coins showing bearish pressure after recent spike:\n- **BTC**: Price 108,289 below EMA20 (109,208), RSI 37.3 oversold territory, MACD declining (370.9)\n- **ETH**: Price 3,866.9 below EMA20 (3,937), RSI 35.3 oversold, MACD negative (-6.97)\n- **SOL**: Price 184.9 below EMA20 (188.23), RSI 34.2 oversold, MACD negative (-0.14)\n- **BNB**: Price 1,070.8 below EMA20 (1,088.82), RSI 42.2, MACD negative (-6.47)\n- **XRP**: Price 2.41 below EMA20 (2.43), RSI 32.4 oversold, MACD positive but declining (0.015)\n- **DOGE**: Price 0.1918 below EMA20 (0.1958), RSI 29.1 deeply oversold, MACD minimal (0.001)\n\n### Key Observations:\n1. **Recent volatility**: All coins spiked sharply (BTC to 113k, ETH to 4082) then crashed back down\n2. **Oversold conditions**: RSI 7-period below 40 across the board, many below 35\n3. **Price below EMAs**: All trading below their 20-period EMAs indicating short-term bearish momentum\n4. **MACD deterioration**: Most coins showing negative or declining MACD\n5. **Volume decline**: Current volumes significantly below averages\n\n### Trading Decision:\n**OPPORTUNISTIC LONG ENTRIES** - The market is showing oversold conditions after a sharp pullback. This presents potential mean reversion opportunities, especially in coins with strongest oversold readings.\n\n**Target coins for entry:**\n1. **DOGE**: RSI 29.1 (most oversold), significant deviation from EMA20\n2. **XRP**: RSI 32.4, still has positive MACD suggesting potential bounce\n3. **SOL**: RSI 34.2, tight consolidation near lows\n\n**Risk Management:**\n- Will use 15x leverage for high conviction setups\n- Position sizing: ~$800-1000 risk per trade (6-8% of capital per position)\n- Tight stop-losses below recent lows\n- Quick profit targets at EMA20 resistance levels\n\n# TRADING DECISIONS\n\n```json\n{\n  \"DOGE\": {\n    \"trade_signal_args\": {\n      \"coin\": \"DOGE\",\n      \"signal\": \"buy\",\n      \"quantity\": 62500,\n      \"profit_target\": 0.1958,\n      \"stop_loss\": 0.1890,\n      \"invalidation_condition\": \"If price closes below 0.1890 (below recent low) on 3-minute candle\",\n      \"leverage\": 15,\n      \"confidence\": 0.72,\n      \"risk_usd\": 900\n    }\n  },\n  \"XRP\": {\n    \"trade_signal_args\": {\n      \"coin\": \"XRP\",\n      \"signal\": \"buy\",\n      \"quantity\": 5000,\n      \"profit_target\": 2.44,\n      \"stop_loss\": 2.38,\n      \"invalidation_condition\": \"If price closes below 2.38 (below recent consolidation) on 3-minute candle\",\n      \"leverage\": 15,\n      \"confidence\": 0.68,\n      \"risk_usd\": 850\n    }\n  },\n  \"SOL\": {\n    \"trade_signal_args\": {\n      \"coin\": \"SOL\",\n      \"signal\": \"buy\",\n      \"quantity\": 65,\n      \"profit_target\": 188.50,\n      \"stop_loss\": 183.00,\n      \"invalidation_condition\": \"If price closes below 183.00 (below recent low) on 3-minute candle\",\n      \"leverage\": 15,\n      \"confidence\": 0.70,\n      \"risk_usd\": 875\n    }\n  }\n}\n```",
      "signals": [
        {
          "coin": "DOGE",
          "signal": "buy",
          "quantity": 62500.0,
          "leverage": 15,
          "stop_loss": 0.189,
          "profit_target": 0.1958,
          "confidence": 0.72,
          "risk_usd": 900.0,
          "invalidation_condition": "If price closes below 0.1890 (below recent low) on 3-minute candle"
        },
        {
          "coin": "XRP",
          "signal": "buy",
          "quantity": 5000.0,
          "leverage": 15,
          "stop_loss": 2.38,
          "profit_target": 2.44,
          "confidence": 0.68,
          "risk_usd": 850.0,
          "invalidation_condition": "If price closes below 2.38 (below recent consolidation) on 3-minute candle"
        },
        {
          "coin": "SOL",
          "signal": "buy",
          "quantity": 65.0,
          "leverage": 15,
          "stop_loss": 183.0,
          "profit_target": 188.5,
          "confidence": 0.7,
          "risk_usd": 875.0,
          "invalidation_condition": "If price closes below 183.00 (below recent low) on 3-minute candle"
        }
      ]
    },
    {
      "iteration": 33,
      "timestamp": "2025-10-22T08:00:00",
      "model": "anthropic",
      "raw_response": "# CHAIN OF THOUGHT\n\nReviewing my current positions against their invalidation conditions and market technical indicators:\n\n## DOGE Position Analysis\n- Entry: 0.19185, Current: 0.19086 (Down -0.52%)\n- Unrealized PnL: -$67.87\n- **Invalidation condition: \"If price closes below 0.1890\"**\n- Current price 0.19086 is ABOVE 0.1890, so invalidation NOT met\n- RSI (7-period): 26.207 - deeply oversold, potential bounce\n- RSI (14-period): 35.956 - oversold territory\n- MACD: 0.001 - weak but still positive\n- Price below EMA20 (0.195075) - bearish short-term\n- Stop-loss at 0.189 is very close (only 0.00086 away = 0.45%)\n- However, invalidation condition is clear: below 0.1890, and we're at 0.19086\n- **Decision: HOLD** - Invalidation not met, deeply oversold RSI suggests potential bounce\n\n## XRP Position Analysis\n- Entry: 2.4083, Current: 2.3946 (Down -0.57%)\n- Unrealized PnL: -$74.52\n- **Invalidation condition: \"If price closes below 2.38\"**\n- Current price 2.3946 is ABOVE 2.38 by 0.0146 (0.61%)\n- RSI (7-period): 28.032 - deeply oversold\n- RSI (14-period): 39.152 - oversold\n- MACD: 0.014 - still positive but declining\n- Price below EMA20 (2.43) - bearish short-term\n- Stop-loss at 2.38 is close (0.0146 away = 0.61%)\n- Invalidation NOT met yet\n- **Decision: HOLD** - Invalidation not met, oversold conditions suggest potential reversal\n\n## SOL Position Analysis\n- Entry: 184.9, Current: 184.99 (Up +0.05%)\n- Unrealized PnL: -$0.16 (essentially breakeven)\n- **Invalidation condition: \"If price closes below 183.00\"**\n- Current price 184.99 is ABOVE 183.00 by 1.99 (1.08%)\n- RSI (7-period): 34.975 - oversold but recovering\n- RSI (14-period): 40.827 - neutral/oversold\n- MACD: -0.179 - negative and declining\n- Price below EMA20 (187.77) - bearish short-term\n- Stop-loss at 183.0 is 1.99 away (1.08% buffer)\n- Invalidation NOT met\n- **Decision: HOLD** - Invalidation not met, at breakeven, RSI showing potential stabilization\n\n## Market Context\nAll three positions are showing:\n- Deeply oversold RSI conditions (7-period RSI: 26-35 range)\n- Prices below their EMA20s (bearish short-term)\n- Negative MACD momentum weakening\n- All positions near stop-losses but NOT at invalidation levels\n\nThe broader market (BTC, ETH) also showing similar oversold conditions (RSI 30.867 and 28.247 respectively), suggesting a market-wide pullback that may be reaching exhaustion.\n\n## Risk Management Assessment\n- Total portfolio exposure: ~$35,926 notional across 3 positions\n- Account value: $12,579\n- Available cash: $10,326\n- All positions using 15x leverage\n- Combined unrealized loss: -$142.54 (manageable at 1.13% of account value)\n\nNone of the invalidation conditions have been triggered. All positions are in oversold territory which historically precedes bounces. Will maintain positions as per the exit plans.\n\n# TRADING DECISIONS\n\n```json\n{\n  \"DOGE\": {\n    \"trade_signal_args\": {\n      \"coin\": \"DOGE\",\n      \"signal\": \"hold\",\n      \"quantity\": 62500.0,\n      \"profit_target\": 0.1958,\n      \"stop_loss\": 0.189,\n      \"invalidation_condition\": \"If price closes below 0.1890 (below recent low) on 3-minute candle\",\n      \"leverage\": 15,\n      \"confidence\": 0.72,\n      \"risk_usd\": 900.0\n    }\n  },\n  \"XRP\": {\n    \"trade_signal_args\": {\n      \"coin\": \"XRP\",\n      \"signal\": \"hold\",\n      \"quantity\": 5000.0,\n      \"profit_target\": 2.44,\n      \"stop_loss\": 2.38,\n      \"invalidation_condition\": \"If price closes below 2.38 (below recent consolidation) on 3-minute candle\",\n      \"leverage\": 15,\n      \"confidence\": 0.68,\n      \"risk_usd\": 850.0\n    }\n  },\n  \"SOL\": {\n    \"trade_signal_args\": {\n      \"coin\": \"SOL\",\n      \"signal\": \"hold\",\n      \"quantity\": 65.0,\n      \"profit_target\": 188.5,\n      \"stop_loss\": 183.0,\n      \"invalidation_condition\": \"If price closes below 183.00 (below recent low) on 3-minute candle\",\n      \"leverage\": 15,\n      \"confidence\": 0.7,\n      \"risk_usd\": 875.0\n    }\n  }\n}\n```",
      "signals": [
        {
          "coin": "DOGE",
          "signal": "hold",
          "quantity": 62500.0,
          "leverage": 15,
          "stop_loss": 0.189,
          "profit_target": 0.1958,
          "confidence": 0.72,
          "risk_usd": 900.0,
          "invalidation_condition": "If price closes below 0.1890 (below recent low) on 3-minute candle"
        },
        {
          "coin": "XRP",
          "signal": "hold",
          "quantity": 5000.0,
          "leverage": 15,
          "stop_loss": 2.38,
          "profit_target": 2.44,
          "confidence": 0.68,
          "risk_usd": 850.0,
          "invalidation_condition": "If price closes below 2.38 (below recent consolidation) on 3-minute candle"
        },
        {
          "coin": "SOL",
          "signal": "hold",
          "quantity": 65.0,
          "leverage": 15,
          "stop_loss": 183.0,
          "profit_target": 188.5,
          "confidence": 0.7,
          "risk_usd": 875.0,
          "invalidation_condition": "If price closes below 183.00 (below recent low) on 3-minute candle"
        }
      ]
    },
    {
      "iteration": 34,
      "timestamp": "2025-10-22T12:00:00",
      "model": "anthropic",
      "raw_response": "# CHAIN OF THOUGHT\n\nReviewing my current positions against their invalidation conditions and technical indicators:\n\n**DOGE Position Analysis:**\n- Entry: 0.19185, Current: 0.191850 (flat)\n- Unrealized PnL: -$6.00 (-0.05%)\n- Stop-loss: 0.189, Invalidation: \"If price closes below 0.1890\"\n- Current price is at 0.191850, which is ABOVE the invalidation level of 0.1890\n- RSI(7): 34.751 - oversold territory, showing potential reversal\n- MACD: -0.000 - neutral/slightly negative\n- Price below EMA20 (0.195378) - bearish short-term\n- Latest candle at 0.191850 is holding above invalidation\n- **Decision: HOLD** - Invalidation condition NOT met, price holding above 0.189\n\n**XRP Position Analysis:**\n- Entry: 2.4083, Current: 2.3986 (-0.40%)\n- Unrealized PnL: -$54.52\n- Stop-loss: 2.38, Invalidation: \"If price closes below 2.38\"\n- Current price: 2.3986 is ABOVE invalidation level of 2.38\n- RSI(7): 31.539 - oversold, potential bounce\n- MACD: 0.005 - slightly positive\n- Price below EMA20 (2.43) - bearish pressure\n- Latest candle at 2.40 is still above 2.38 threshold\n- **Decision: HOLD** - Invalidation NOT triggered, maintaining position\n\n**SOL Position Analysis:**\n- Entry: 184.9, Current: 183.92 (-0.53%)\n- Unrealized PnL: -$69.71\n- Stop-loss: 183.0, Invalidation: \"If price closes below 183.00\"\n- **CRITICAL: Current price 183.92 is dangerously close to invalidation at 183.00**\n- Only $0.92 buffer remaining (0.5%)\n- RSI(7): 29.678 - deeply oversold\n- MACD: -1.000 - negative momentum\n- Price below EMA20 (187.82) - clear bearish trend\n- Recent lows: 183.92 current, approaching 183.0 threshold\n- **Decision: CLOSE_POSITION** - Risk management dictates exit. Price is within 0.5% of invalidation level with negative momentum. Better to take small loss now than risk hitting stop-loss or invalidation.\n\n**Other Coins (BTC, ETH, BNB):**\n- No positions, market showing mixed signals\n- BTC: RSI 45, below EMA, MACD weakening\n- ETH: RSI 33, below EMA, MACD negative\n- BNB: RSI 55, below EMA, MACD negative\n- Not entering new positions given current portfolio stress and unclear setups\n\n**Risk Management:**\n- Portfolio at 25.92% return - strong performance\n- Three positions all slightly underwater\n- SOL approaching invalidation - must exit to preserve capital\n- DOGE and XRP have room to work, maintaining positions\n\n# TRADING DECISIONS\n\n```json\n{\n  \"DOGE\": {\n    \"trade_signal_args\": {\n      \"coin\": \"DOGE\",\n      \"signal\": \"hold\",\n      \"quantity\": 62500.0,\n      \"profit_target\": 0.1958,\n      \"stop_loss\": 0.189,\n      \"invalidation_condition\": \"If price closes below 0.1890 (below recent low) on 3-minute candle\",\n      \"leverage\": 15,\n      \"confidence\": 0.72,\n      \"risk_usd\": 900.0\n    }\n  },\n  \"XRP\": {\n    \"trade_signal_args\": {\n      \"coin\": \"XRP\",\n      \"signal\": \"hold\",\n      \"quantity\": 5000.0,\n      \"profit_target\": 2.44,\n      \"stop_loss\": 2.38,\n      \"invalidation_condition\": \"If price closes below 2.38 (below recent consolidation) on 3-minute candle\",\n      \"leverage\": 15,\n      \"confidence\": 0.68,\n      \"risk_usd\": 850.0\n    }\n  },\n  \"SOL\": {\n    \"trade_signal_args\": {\n      \"coin\": \"SOL\",\n      \"signal\": \"close_position\",\n      \"quantity\": 65.0,\n      \"profit_target\": 188.5,\n      \"stop_loss\": 183.0,\n      \"invalidation_condition\": \"If price closes below 183.00 (below recent low) on 3-minute candle\",\n      \"leverage\": 15,\n      \"confidence\": 0.7,\n      \"risk_usd\": 875.0,\n      \"close_reason\": \"Risk management - price at 183.92 is within 0.5% of invalidation level (183.00) with negative momentum (MACD -1.0, RSI 29.7). Exiting to preserve capital before stop-loss is triggered.\"\n    }\n  }\n}\n```",
      "signals": [
        {
          "coin": "DOGE",
          "signal": "hold",
          "quantity": 62500.0,
          "leverage": 15,
          "stop_loss": 0.189,
          "profit_target": 0.1958,
          "confidence": 0.72,
          "risk_usd": 900.0,
          "invalidation_condition": "If price closes below 0.1890 (below recent low) on 3-minute candle"
        },
        {
          "coin": "XRP",
          "signal": "hold",
          "quantity": 5000.0,
          "leverage": 15,
          "stop_loss": 2.38,
          "profit_target": 2.44,
          "confidence": 0.68,
          "risk_usd": 850.0,
          "invalidation_condition": "If price closes below 2.38 (below recent consolidation) on 3-minute candle"
        },
        {
          "coin": "SOL",
          "signal": "close_position",
          "quantity": 65.0,
          "leverage": 15,
          "stop_loss": 183.0,
          "profit_target": 188.5,
          "confidence": 0.7,
          "risk_usd": 875.0,
          "invalidation_condition": "If price closes below 183.00 (below recent low) on 3-minute candle"
        }
      ]
    },
    {
      "iteration": 35,
      "timestamp": "2025-10-22T16:00:00",
      "model": "anthropic",
      "raw_response": "# CHAIN OF THOUGHT\n\nReviewing my current position:\n\n**DOGE Analysis:**\n- Current price: $0.190480\n- Entry price: $0.19185\n- Unrealized P&L: -$91.62 (-0.77%)\n- Stop-loss: $0.189\n- Profit target: $0.1958\n- Invalidation condition: \"If price closes below 0.1890 (below recent low) on 3-minute candle\"\n\n**Critical Assessment:**\nThe current price of $0.190480 is ABOVE the invalidation level of $0.189, but only by $0.00148 (0.78%). This is extremely close to the stop-loss trigger. Looking at the technical indicators:\n\n- RSI (7-period): 28.407 - deeply oversold, suggesting potential bounce\n- RSI (14-period): 34.375 - oversold territory\n- MACD: -0.001 - negative and deteriorating\n- Price vs EMA20: $0.190480 vs $0.195348 - trading 2.5% below EMA20\n- Recent price action: Declining from $0.204240 high, currently at session lows\n\n**Decision Rationale:**\nThe invalidation condition has NOT been met yet (price has not closed below $0.189). However, the position is:\n1. Very close to stop-loss (within 0.78%)\n2. Showing continued weakness with declining RSI and negative MACD\n3. Trading below all moving averages\n4. In an oversold condition that could lead to a bounce\n\nGiven the extreme proximity to the stop-loss and the deteriorating technical picture, I need to decide whether to:\n- HOLD and risk hitting the stop-loss very soon\n- CLOSE proactively to avoid slippage and further losses\n\nThe RSI at 28.407 suggests we're oversold and could see a bounce, but the momentum is clearly negative. The invalidation condition is technical and clear: \"closes below 0.1890\". Since we haven't closed below that level yet, I should HOLD per the exit plan, but monitor very closely.\n\n**Other Coins:**\n- BTC, ETH, SOL, BNB, XRP: All showing oversold conditions (RSI 7-period: 38.4, 25.4, 17.5, 41.5, 22.8 respectively)\n- All are below their EMA20 with negative MACD\n- Market appears to be in a broad correction phase\n- Not entering new positions given the bearish momentum across all assets\n\n**Final Decision:** HOLD DOGE - invalidation condition not yet met, and oversold RSI suggests potential for bounce. Will exit if price closes below $0.189 as planned.\n\n# TRADING DECISIONS\n\n```json\n{\n  \"DOGE\": {\n    \"trade_signal_args\": {\n      \"coin\": \"DOGE\",\n      \"signal\": \"hold\",\n      \"quantity\": 62500.0,\n      \"profit_target\": 0.1958,\n      \"stop_loss\": 0.189,\n      \"invalidation_condition\": \"If price closes below 0.1890 (below recent low) on 3-minute candle\",\n      \"leverage\": 15,\n      \"confidence\": 0.72,\n      \"risk_usd\": 900.0\n    }\n  }\n}\n```",
      "signals": [
        {
          "coin": "DOGE",
          "signal": "hold",
          "quantity": 62500.0,
          "leverage": 15,
          "stop_loss": 0.189,
          "profit_target": 0.1958,
          "confidence": 0.72,
          "risk_usd": 900.0,
          "invalidation_condition": "If price closes below 0.1890 (below recent low) on 3-minute candle"
        }
      ]
    },
    {
      "iteration": 36,
      "timestamp": "2025-10-22T20:00:00",
      "model": "anthropic",
      "raw_response": "# CHAIN OF THOUGHT\n\nReviewing my current position:\n\n**DOGE Analysis:**\n- Current price: 0.189780\n- Entry price: 0.191850\n- Unrealized P&L: -$135.37 (-1.14%)\n- Position size: 62,500 DOGE with 15x leverage\n- Notional: $11,861.25\n\n**Invalidation Condition Check:**\nThe invalidation condition states: \"If price closes below 0.1890 (below recent low) on 3-minute candle\"\n\nCurrent price is 0.189780, which is **BELOW** the invalidation level of 0.1890. The position has breached its invalidation condition.\n\n**Technical Analysis:**\n- RSI (7-period): 25.305 - deeply oversold\n- RSI (14-period): 32.593 - oversold\n- MACD: -0.002 - negative and declining\n- Price vs EMA20: 0.189780 vs 0.194852 - significantly below (2.6%)\n- Recent price action: Consistent downtrend from 0.204240 to 0.189780\n- The price has broken below multiple support levels\n\n**Risk Management Assessment:**\n- Stop-loss at 0.189 has been triggered (current price 0.189780)\n- The invalidation condition has been met\n- Continuing downward momentum with no signs of reversal\n- RSI oversold but no bullish divergence visible\n- MACD continuing to decline\n\n**Decision:** CLOSE POSITION\nThe invalidation condition has been clearly met - price closed below 0.1890. Additionally, the stop-loss at 0.189 has been effectively hit. The technical indicators show continued bearish momentum with no immediate reversal signals. Risk management dictates exiting this position immediately.\n\n**Market Scan for New Opportunities:**\nAll major coins (BTC, ETH, SOL, XRP, BNB) are showing:\n- Prices below EMA20\n- Negative MACD trends\n- Oversold RSI conditions\n- Bearish momentum\n\nThis is a broad market pullback. While oversold conditions might present buying opportunities, the lack of reversal signals and continued negative momentum suggests waiting for clearer entry signals. With account value at $12,337.71 and strong performance (23.38% return, Sharpe 11.62), preserving capital during this pullback is prudent.\n\n# TRADING DECISIONS\n\n```json\n{\n  \"DOGE\": {\n    \"trade_signal_args\": {\n      \"coin\": \"DOGE\",\n      \"signal\": \"close_position\",\n      \"quantity\": 62500.0,\n      \"profit_target\": 0.1958,\n      \"stop_loss\": 0.189,\n      \"invalidation_condition\": \"If price closes below 0.1890 (below recent low) on 3-minute candle\",\n      \"leverage\": 15,\n      \"confidence\": 0.72,\n      \"risk_usd\": 900.0,\n      \"close_reason\": \"Invalidation condition met - price closed below 0.1890 and stop-loss at 0.189 triggered. Continued bearish momentum with no reversal signals.\"\n    }\n  }\n}\n```",
      "signals": [
        {
          "coin": "DOGE",
          "signal": "close_position",
          "quantity": 62500.0,
          "leverage": 15,
          "stop_loss": 0.189,
          "profit_target": 0.1958,
          "confidence": 0.72,
          "risk_usd": 900.0,
          "invalidation_condition": "If price closes below 0.1890 (below recent low) on 3-minute candle"
        }
      ]
    },
    {
      "iteration": 37,
      "timestamp": "2025-10-23T00:00:00",
      "model": "anthropic",
      "raw_response": "# CHAIN OF THOUGHT\n\n## Current Portfolio Status\n- No open positions\n- Available cash: $12,340.41\n- Strong performance: 23.40% return, Sharpe ratio 10.541\n- Looking for high-probability setups with favorable risk/reward\n\n## Market Analysis by Coin\n\n### BTC (Current: $108,377)\n- Price below EMA20 ($108,860), showing short-term weakness\n- MACD negative (-312.6) but flattening slightly from -313.577\n- RSI(7): 51.926 - neutral territory, recovering from oversold\n- Recent price action: Sharp drop from $113,386 to $107,502, now consolidating\n- Price bounced from $107,528 to $108,377 (+$849)\n- **Assessment**: Showing early signs of stabilization but still in downtrend. Below key EMA20. Too early to enter - need confirmation of reversal.\n\n### ETH (Current: $3,825.10)\n- Price significantly below EMA20 ($3,898.90), -$73.80 gap\n- MACD deeply negative (-44.495) and worsening\n- RSI(7): 40.657 - approaching oversold but not extreme\n- RSI(14): 37.772 - weak\n- Price dropped from $4,082.90 to $3,802.30, slight bounce to $3,825\n- Volume low (50,658 vs avg 108,041) - weak participation\n- **Assessment**: Downtrend intact, no reversal signals. Wait for better setup.\n\n### SOL (Current: $182.79)\n- Price below EMA20 ($185.90), -$3.11 gap\n- MACD negative (-1.684) but improving from -1.624\n- RSI(7): 45.785 - recovering sharply from 17.080 (extreme oversold)\n- Recent bounce: $180.00 to $182.79 (+$2.79, +1.55%)\n- Sharp V-shaped recovery from extreme oversold\n- **Assessment**: Strong bounce from deeply oversold levels. RSI recovery from 17 to 45 shows momentum shift. This is the most attractive setup currently.\n\n### BNB (Current: $1,086.40)\n- Price just above EMA20 ($1,085.36), +$1.04\n- MACD negative (-8.876) but improving from -10.260\n- RSI(7): 64.778 - strong recovery, approaching overbought\n- Price bounced from $1,068.90 to $1,086.40 (+$17.50)\n- **Assessment**: Nice recovery but RSI already elevated at 64.778. Risk/reward less favorable at current levels.\n\n### XRP (Current: $2.38)\n- Price below EMA20 ($2.41), -$0.03\n- MACD negative (-0.009) and deteriorating\n- RSI(7): 35.845 - oversold territory\n- Price dropped from $2.52 to $2.36, slight recovery to $2.38\n- **Assessment**: Weak, no clear reversal signals yet. Stay away.\n\n### DOGE (Current: $0.190910)\n- Price below EMA20 ($0.194284), -$0.003374\n- MACD negative (-0.002) and worsening\n- RSI(7): 39.519 - weak, recovering from 25.336\n- Price dropped from $0.204240 to $0.189780, small bounce\n- **Assessment**: Weak momentum, no compelling entry signal.\n\n## Trading Decision\n\n**SOL offers the best risk/reward opportunity:**\n- Extreme RSI oversold (17.080) followed by sharp recovery to 45.785\n- Price bounced from $180.00 support level\n- MACD showing signs of bottoming\n- Volume decent at 523,403 (vs avg 754,701)\n- Risk-managed entry with tight stop below recent low\n\n**Entry Plan for SOL:**\n- Entry: $182.79\n- Stop-loss: $178.50 (below recent low of $180.00, -2.35%)\n- Profit target: $192.00 (+5.04%, 2.14:1 R/R)\n- Invalidation: Price closes below $178.50\n- Position size: ~$6,000 (48.7% of capital) with 15x leverage = 492 SOL\n- Risk: $4.29 per coin \u00d7 492 = ~$2,110 (17.1% of capital)\n\n# TRADING DECISIONS\n\n```json\n{\n  \"SOL\": {\n    \"trade_signal_args\": {\n      \"coin\": \"SOL\",\n      \"signal\": \"buy\",\n      \"quantity\": 492,\n      \"profit_target\": 192.00,\n      \"stop_loss\": 178.50,\n      \"invalidation_condition\": \"If price closes below $178.50 on 3-minute candle, indicating failed bounce from oversold levels\",\n      \"leverage\": 15,\n      \"confidence\": 0.72,\n      \"risk_usd\": 2110.00\n    }\n  }\n}\n```",
      "signals": [
        {
          "coin": "SOL",
          "signal": "buy",
          "quantity": 492.0,
          "leverage": 15,
          "stop_loss": 178.5,
          "profit_target": 192.0,
          "confidence": 0.72,
          "risk_usd": 2110.0,
          "invalidation_condition": "If price closes below $178.50 on 3-minute candle, indicating failed bounce from oversold levels"
        }
      ]
    },
    {
      "iteration": 38,
      "timestamp": "2025-10-23T04:00:00",
      "model": "anthropic",
      "raw_response": "# CHAIN OF THOUGHT\n\n## Current Position Analysis\n\n### SOL Position Review\n- **Entry**: $182.79, **Current**: $187.39 (+2.52%)\n- **Unrealized PnL**: +$2,218.23 (strong profit)\n- **Position size**: 492 SOL at 15x leverage ($92,195 notional)\n- **Exit plan**: Profit target $192.00, Stop-loss $178.50\n- **Invalidation condition**: \"If price closes below $178.50 on 3-minute candle, indicating failed bounce from oversold levels\"\n\n**Technical Analysis**:\n- Current price: $187.39 (well above stop-loss of $178.50)\n- RSI (7-period): 69.17 - approaching overbought but not extreme\n- RSI (14-period): 55.83 - healthy momentum\n- MACD: -1.948 (still negative but improving from -2.324)\n- Price above EMA20 ($186.50) - bullish signal\n- Recent price action: Strong recovery from $180.00 low to $187.39 (+4.1%)\n\n**Invalidation Check**: \n- Invalidation requires close BELOW $178.50\n- Current price $187.39 is $8.89 above invalidation level\n- Recent low was $180.00, still well above $178.50\n- **Invalidation condition NOT met**\n\n**Decision Rationale**:\n- Position is profitable (+$2,218)\n- Price showing strong momentum recovery\n- RSI at 69 shows strength but not overextended\n- MACD improving (becoming less negative)\n- Price crossed above EMA20, confirming bullish momentum\n- Still room to run toward profit target of $192.00 ($4.61 away)\n- No technical reason to exit prematurely\n\n**Decision**: HOLD - Continue riding this momentum toward profit target. Invalidation not triggered, technicals supportive.\n\n## Other Coins Analysis\n\n### BTC\n- Price: $109,289, RSI: 65.08, MACD: -505.86 (very negative)\n- Strong bounce from $107,502 low (+1.66%)\n- Below EMA20 ($109,105) but recovering\n- Not entering - MACD deeply negative suggests caution\n\n### ETH\n- Price: $3,879.10, RSI: 64.11, MACD: -48.45\n- Recovery from $3,802.30 low\n- Below EMA20 ($3,903.10)\n- Not entering - still in consolidation phase\n\n### BNB\n- Price: $1,108.70, RSI: 79.19 (OVERBOUGHT), MACD: -9.30\n- Strong rally from $1,056.50 (+4.9%)\n- Above EMA20 ($1,090.14)\n- RSI too hot at 79 - risk of pullback, not entering\n\n### XRP\n- Price: $2.41, RSI: 58.18, MACD: -0.016\n- Below EMA20 ($2.42)\n- Weak momentum - not entering\n\n### DOGE\n- Price: $0.19386, RSI: 63.51, MACD: -0.002\n- Below EMA20 ($0.19476)\n- Recovery underway but not compelling - not entering\n\n## Risk Management\n- Current account value: $14,664.56\n- Available cash: $6,299.93\n- SOL position represents large concentration but is profitable\n- Sharpe ratio of 10.54 indicates excellent risk-adjusted returns\n- Maintaining disciplined approach with single position\n\n# TRADING DECISIONS\n\n```json\n{\n  \"SOL\": {\n    \"trade_signal_args\": {\n      \"coin\": \"SOL\",\n      \"signal\": \"hold\",\n      \"quantity\": 492.0,\n      \"profit_target\": 192.0,\n      \"stop_loss\": 178.5,\n      \"invalidation_condition\": \"If price closes below $178.50 on 3-minute candle, indicating failed bounce from oversold levels\",\n      \"leverage\": 15,\n      \"confidence\": 0.72,\n      \"risk_usd\": 2110.0\n    }\n  }\n}\n```",
      "signals": [
        {
          "coin": "SOL",
          "signal": "hold",
          "quantity": 492.0,
          "leverage": 15,
          "stop_loss": 178.5,
          "profit_target": 192.0,
          "confidence": 0.72,
          "risk_usd": 2110.0,
          "invalidation_condition": "If price closes below $178.50 on 3-minute candle, indicating failed bounce from oversold levels"
        }
      ]
    },
    {
      "iteration": 39,
      "timestamp": "2025-10-23T08:00:00",
      "model": "anthropic",
      "raw_response": "# CHAIN OF THOUGHT\n\nReviewing my current position and market conditions:\n\n**SOL Position Analysis:**\n- Entry: $182.79, Current: $187.94 (+2.82%)\n- Unrealized PnL: +$2,488.83 (strong profit)\n- Stop-loss: $178.50, Profit target: $192.00\n- Invalidation condition: \"If price closes below $178.50 on 3-minute candle, indicating failed bounce from oversold levels\"\n\n**Technical Analysis:**\n- Current price $187.94 is well above stop-loss ($178.50) \u2713\n- RSI (7-period): 71.136 - overbought territory, suggesting potential pullback risk\n- RSI (14-period): 57.026 - moderately bullish\n- MACD: -1.908 - still negative but improving (was -2.680, now -1.908)\n- Price above EMA20 ($186.88) - bullish crossover confirmed\n- Recent price action: Strong recovery from $180.00 low to $187.94\n- Volume: 583,548 vs average 739,490 - below average, concerning for sustainability\n\n**Position Status Check:**\n- Invalidation NOT met: Current price $187.94 >> $178.50 stop-loss \u2713\n- Price approaching profit target: $187.94 vs $192.00 target (only $4.06 away, 2.1%)\n- Strong unrealized gain: +$2,488 on ~$9,000 position size\n\n**Decision Rationale:**\nThe SOL position is performing excellently with +27.8% unrealized return. However, several factors warrant taking profits:\n1. RSI at 71.136 indicates overbought conditions - high probability of pullback\n2. Price is 97.9% of the way to profit target ($187.94 / $192.00)\n3. Below-average volume raises concerns about momentum sustainability\n4. MACD still negative despite improvement\n5. Risk/reward ratio now unfavorable - only $4.06 upside to target vs $9.44 downside to stop-loss\n\n**Risk Management:** With nearly 28% gain and overbought conditions, the prudent decision is to take profits rather than risk a reversal. The position has achieved 78% of its profit target and shows technical exhaustion signals.\n\n**Other Coins Assessment:**\n- BTC: Below EMA20, negative MACD, choppy price action - no clear entry\n- ETH: Below EMA20, negative MACD, weak momentum - avoid\n- BNB: Just crossed above EMA20 but RSI pulling back from 79 - wait for confirmation\n- XRP: Below EMA20, weak RSI, downtrend - no entry\n- DOGE: Below EMA20, weak momentum - no entry\n\n# TRADING DECISIONS\n\n```json\n{\n  \"SOL\": {\n    \"trade_signal_args\": {\n      \"coin\": \"SOL\",\n      \"signal\": \"close_position\",\n      \"quantity\": 492.0,\n      \"profit_target\": 192.0,\n      \"stop_loss\": 178.5,\n      \"invalidation_condition\": \"If price closes below $178.50 on 3-minute candle, indicating failed bounce from oversold levels\",\n      \"leverage\": 15,\n      \"confidence\": 0.72,\n      \"risk_usd\": 2110.0,\n      \"close_reason\": \"Taking profits at 97.9% of profit target with RSI at 71.136 showing overbought conditions and below-average volume suggesting momentum exhaustion. Locking in +$2,488 gain (+27.8% return) before potential reversal.\"\n    }\n  }\n}\n```",
      "signals": [
        {
          "coin": "SOL",
          "signal": "close_position",
          "quantity": 492.0,
          "leverage": 15,
          "stop_loss": 178.5,
          "profit_target": 192.0,
          "confidence": 0.72,
          "risk_usd": 2110.0,
          "invalidation_condition": "If price closes below $178.50 on 3-minute candle, indicating failed bounce from oversold levels"
        }
      ]
    },
    {
      "iteration": 40,
      "timestamp": "2025-10-23T12:00:00",
      "model": "anthropic",
      "raw_response": "# CHAIN OF THOUGHT\n\n## Current Portfolio Status\n- **No open positions** - 100% cash ($14,738.04)\n- **Strong performance**: 47.38% total return, Sharpe ratio 12.626\n- **Trading time**: 22 minutes in, 40 invocations\n\n## Market Analysis by Coin\n\n### BTC Analysis\n- **Price action**: Strong recovery from 107,502 to 109,910 (+2.24%)\n- **Technical indicators**:\n  - RSI(7): 73.49 - entering overbought territory but strong momentum\n  - MACD: -461.88, improving from -804.59 (bullish divergence)\n  - Price above EMA20 (109,910 vs 109,302.97) - bullish crossover developing\n  - RSI(14): 58.43 - healthy, not overextended\n- **Assessment**: Clear V-shaped recovery with improving momentum. Price reclaiming EMA20 is bullish.\n- **Decision**: **BUY** - Momentum trade with tight risk management\n\n### ETH Analysis\n- **Price action**: Weaker recovery, still below EMA20 (3,877 vs 3,897.90)\n- **Technical indicators**:\n  - RSI(7): 61.53 - moderate strength\n  - MACD: -42.81, improving but still negative\n  - Price below EMA20 - bearish structure intact\n  - RSI(14): 49.68 - neutral zone\n- **Assessment**: Lagging BTC's strength, no clear breakout\n- **Decision**: **PASS** - Wait for EMA20 reclaim\n\n### SOL Analysis\n- **Price action**: Explosive move from 180.00 to 191.04 (+6.13%)\n- **Technical indicators**:\n  - RSI(7): 80.60 - **severely overbought**\n  - MACD: -1.195, improving rapidly\n  - Price well above EMA20 (191.04 vs 187.16)\n  - RSI(14): 65.13 - extended but not extreme\n- **Assessment**: Strongest performer but RSI(7) at 80.6 signals imminent pullback risk\n- **Decision**: **PASS** - Too extended for entry, high reversal risk\n\n### BNB Analysis\n- **Price action**: Strong surge from 1,067 to 1,130 (+5.91%)\n- **Technical indicators**:\n  - RSI(7): 77.72 - overbought\n  - MACD: -1.452, rapidly improving\n  - Price above EMA20 (1,130 vs 1,092.53)\n  - Volume: 60,368 vs avg 9,753 - **massive volume spike (6.2x)**\n- **Assessment**: Explosive breakout with exceptional volume confirmation\n- **Decision**: **BUY** - Volume breakout trade, but manage overbought risk\n\n### XRP Analysis\n- **Price action**: Choppy, ranging 2.36-2.42\n- **Technical indicators**:\n  - RSI(7): 58.10 - neutral\n  - MACD: -0.018, flat\n  - Price at EMA20 (2.41 vs 2.42)\n  - Low conviction setup\n- **Assessment**: No clear directional bias\n- **Decision**: **PASS** - No edge\n\n### DOGE Analysis\n- **Price action**: Recovery from 0.1898 to 0.1954 (+2.95%)\n- **Technical indicators**:\n  - RSI(7): 70.69 - overbought\n  - MACD: -0.002, improving\n  - Price above EMA20 (0.1954 vs 0.1948)\n  - RSI(14): 56.05 - healthy\n- **Assessment**: Decent setup but less conviction than BTC/BNB\n- **Decision**: **PASS** - Focus on stronger setups\n\n## Trading Plan\nGiven strong portfolio performance and multiple coins showing momentum, I'll deploy capital into the two strongest setups:\n\n1. **BTC**: Best risk/reward with bullish EMA crossover developing, improving MACD\n2. **BNB**: Volume breakout with exceptional confirmation (6.2x average volume)\n\nRisk management: Each position sized at ~$3,500-4,000 (25-27% of capital per trade), maintaining significant cash reserves.\n\n# TRADING DECISIONS\n\n```json\n{\n  \"BTC\": {\n    \"trade_signal_args\": {\n      \"coin\": \"BTC\",\n      \"signal\": \"buy\",\n      \"quantity\": 0.032,\n      \"profit_target\": 112500.00,\n      \"stop_loss\": 108200.00,\n      \"invalidation_condition\": \"If price closes below 108,200 (recent support) on 3-minute candle\",\n      \"leverage\": 15,\n      \"confidence\": 0.78,\n      \"risk_usd\": 822.00\n    }\n  },\n  \"BNB\": {\n    \"trade_signal_args\": {\n      \"coin\": \"BNB\",\n      \"signal\": \"buy\",\n      \"quantity\": 3.2,\n      \"profit_target\": 1165.00,\n      \"stop_loss\": 1105.00,\n      \"invalidation_condition\": \"If price closes below 1,105 (breakout level) or RSI(7) drops below 50 on 3-minute candle\",\n      \"leverage\": 15,\n      \"confidence\": 0.75,\n      \"risk_usd\": 1200.00\n    }\n  }\n}\n```",
      "signals": [
        {
          "coin": "BTC",
          "signal": "buy",
          "quantity": 0.032,
          "leverage": 15,
          "stop_loss": 108200.0,
          "profit_target": 112500.0,
          "confidence": 0.78,
          "risk_usd": 822.0,
          "invalidation_condition": "If price closes below 108,200 (recent support) on 3-minute candle"
        },
        {
          "coin": "BNB",
          "signal": "buy",
          "quantity": 3.2,
          "leverage": 15,
          "stop_loss": 1105.0,
          "profit_target": 1165.0,
          "confidence": 0.75,
          "risk_usd": 1200.0,
          "invalidation_condition": "If price closes below 1,105 (breakout level) or RSI(7) drops below 50 on 3-minute candle"
        }
      ]
    },
    {
      "iteration": 41,
      "timestamp": "2025-10-23T16:00:00",
      "model": "anthropic",
      "raw_response": "# CHAIN OF THOUGHT\n\nReviewing my current positions and market conditions:\n\n## BTC Position Analysis\n- Entry: 109,910 | Current: 110,233 | PnL: +$8.58 (+0.29%)\n- Stop-loss: 108,200 | Profit target: 112,500\n- Invalidation: \"If price closes below 108,200 on 3-minute candle\"\n- Current price: 110,233 is well above invalidation level (108,200)\n- Technical indicators:\n  * RSI(7): 77.35 - overbought territory, potential reversal risk\n  * MACD: -350.80 (improving from -828.89, but still negative)\n  * Price above EMA20 (109,405.60) - bullish short-term\n  * Strong momentum: +$2,944 from recent low (107,289)\n- Analysis: Invalidation condition NOT met. Price is above stop-loss and showing strong momentum. However, RSI(7) at 77.35 is concerning - highly overbought. The position is only up $8.58 on a $3,527 notional, so minimal profit. Given the overbought RSI and negative MACD, there's risk of pullback, but invalidation condition is clear and not triggered.\n- **Decision: HOLD** - Invalidation not met, let it run to profit target or stop-loss.\n\n## BNB Position Analysis\n- Entry: 1,130.10 | Current: 1,117.20 | PnL: -$43.09 (-1.20%)\n- Stop-loss: 1,105 | Profit target: 1,165\n- Invalidation: \"If price closes below 1,105 (breakout level) OR RSI(7) drops below 50 on 3-minute candle\"\n- Current price: 1,117.20 is above stop-loss (1,105) by only $12.20\n- **CRITICAL CHECK**: RSI(7) = 63.61 - ABOVE 50 \u2713\n- Price check: 1,117.20 > 1,105 \u2713\n- Technical indicators:\n  * RSI(7): 63.61 - above the 50 threshold (condition not met)\n  * MACD: +1.42 (turned positive, bullish reversal)\n  * Price above EMA20 (1,094.27) - bullish\n  * Strong recovery from 1,068.70 low\n- Analysis: BOTH parts of invalidation condition are NOT met (price above 1,105 AND RSI(7) above 50). Position is down $43 but showing recovery. MACD just turned positive, which is bullish. Price action shows strength with recent spike to 1,130.10.\n- **Decision: HOLD** - Invalidation conditions not met, MACD turning positive suggests potential recovery.\n\n## Coins Without Positions\n\n**ETH**: Price 3,859.40, below EMA20 (3,890.13). RSI(7) at 50.07 - neutral. MACD negative (-35.17). Weak setup, no clear entry signal. **SKIP**\n\n**SOL**: Price 191.13, above EMA20 (187.31). RSI(7) at 80.92 - extremely overbought! MACD negative but improving. Too risky to enter at these overbought levels. **SKIP**\n\n**XRP**: Price 2.41, below EMA20 (2.42). RSI(7) at 56.56, MACD negative (-0.018). Consolidating, no clear direction. **SKIP**\n\n**DOGE**: Price 0.19577, slightly above EMA20 (0.19478). RSI(7) at 72.90 - overbought. MACD negative. Similar to SOL, too extended. **SKIP**\n\n## Risk Management Summary\n- Total exposure: ~$7,102 notional across 2 positions\n- Available cash: $14,258.91 (ample liquidity)\n- Current account value: $14,697.90\n- Both positions have clear exit plans\n- Portfolio performing well (46.98% return, Sharpe 12.626)\n\n# TRADING DECISIONS\n\n```json\n{\n  \"BTC\": {\n    \"trade_signal_args\": {\n      \"coin\": \"BTC\",\n      \"signal\": \"hold\",\n      \"quantity\": 0.032,\n      \"profit_target\": 112500.0,\n      \"stop_loss\": 108200.0,\n      \"invalidation_condition\": \"If price closes below 108,200 (recent support) on 3-minute candle\",\n      \"leverage\": 15,\n      \"confidence\": 0.78,\n      \"risk_usd\": 822.0\n    }\n  },\n  \"BNB\": {\n    \"trade_signal_args\": {\n      \"coin\": \"BNB\",\n      \"signal\": \"hold\",\n      \"quantity\": 3.2,\n      \"profit_target\": 1165.0,\n      \"stop_loss\": 1105.0,\n      \"invalidation_condition\": \"If price closes below 1,105 (breakout level) or RSI(7) drops below 50 on 3-minute candle\",\n      \"leverage\": 15,\n      \"confidence\": 0.75,\n      \"risk_usd\": 1200.0\n    }\n  }\n}\n```",
      "signals": [
        {
          "coin": "BTC",
          "signal": "hold",
          "quantity": 0.032,
          "leverage": 15,
          "stop_loss": 108200.0,
          "profit_target": 112500.0,
          "confidence": 0.78,
          "risk_usd": 822.0,
          "invalidation_condition": "If price closes below 108,200 (recent support) on 3-minute candle"
        },
        {
          "coin": "BNB",
          "signal": "hold",
          "quantity": 3.2,
          "leverage": 15,
          "stop_loss": 1105.0,
          "profit_target": 1165.0,
          "confidence": 0.75,
          "risk_usd": 1200.0,
          "invalidation_condition": "If price closes below 1,105 (breakout level) or RSI(7) drops below 50 on 3-minute candle"
        }
      ]
    },
    {
      "iteration": 42,
      "timestamp": "2025-10-23T20:00:00",
      "model": "anthropic",
      "raw_response": "# CHAIN OF THOUGHT\n\nReviewing my current positions and market conditions:\n\n## BTC Position Analysis\n- Entry: 109,910 | Current: 110,063 | Unrealized PnL: +$3.14 (+0.14%)\n- Stop-loss: 108,200 | Profit target: 112,500\n- Invalidation: \"If price closes below 108,200 on 3-minute candle\"\n- Current technicals:\n  * RSI(7): 70.23 - approaching overbought but not extreme\n  * MACD: -195.69 (still negative but improving from -744)\n  * Price above EMA20 (110,063 > 109,421)\n  * Recent momentum: Strong recovery from 107,502 to 110,233\n- **Invalidation check**: Current price 110,063 is well above 108,200 stop-loss. No candle has closed below invalidation level.\n- **Decision**: HOLD - Position is slightly profitable, momentum is positive, MACD improving, no invalidation conditions met. Let it run toward profit target of 112,500.\n\n## BNB Position Analysis\n- Entry: 1,130.10 | Current: 1,125.70 | Unrealized PnL: -$15.89 (-0.39%)\n- Stop-loss: 1,105 | Profit target: 1,165\n- Invalidation: \"If price closes below 1,105 (breakout level) or RSI(7) drops below 50 on 3-minute candle\"\n- Current technicals:\n  * RSI(7): 68.67 - ABOVE 50 threshold (good)\n  * MACD: +5.318 (positive and improving)\n  * Price above EMA20 (1,125.70 > 1,096.02)\n  * Recent momentum: Strong surge from 1,068.70 to 1,130.10, minor pullback to 1,125.70\n- **Invalidation check**: \n  * Price 1,125.70 is ABOVE 1,105 stop-loss \u2713\n  * RSI(7) is 68.67, well ABOVE 50 threshold \u2713\n  * No invalidation conditions met\n- **Decision**: HOLD - Small drawdown but within acceptable range. RSI strong above 50, MACD positive, price above EMA20. The pullback from 1,130 to 1,125 is minor consolidation. No invalidation triggered.\n\n## Other Coins (SOL, ETH, XRP, DOGE)\n- **SOL**: RSI(7) 81.51 extremely overbought, but strong momentum. Price 191.27 vs EMA20 187.47. However, such extreme RSI readings often precede sharp reversals. Given we're 23 minutes into trading with strong returns (47.21%), I'll avoid new entries in overextended assets.\n- **ETH**: RSI(7) 48.49, MACD still negative (-29.44), price below EMA20. Weak setup, no entry.\n- **XRP**: RSI(7) 43.43, MACD negative, price below EMA20. Consolidating downward, no entry.\n- **DOGE**: RSI(7) 58.66, MACD nearly neutral, price at EMA20. Neutral setup, no compelling entry.\n\n## Risk Management Assessment\n- Current account value: $14,721.11 (47.21% return - excellent)\n- Open positions: BTC ($3,522 notional) + BNB ($3,602 notional) = $7,124 total exposure\n- Both positions have defined risk parameters and are performing within acceptable ranges\n- No positions are near liquidation levels\n- Sharpe ratio of 12.626 indicates excellent risk-adjusted returns\n\n**Conclusion**: Hold both positions. Neither has triggered invalidation conditions. BTC showing positive momentum toward profit target. BNB consolidating with strong technicals intact.\n\n# TRADING DECISIONS\n\n```json\n{\n  \"BTC\": {\n    \"trade_signal_args\": {\n      \"coin\": \"BTC\",\n      \"signal\": \"hold\",\n      \"quantity\": 0.032,\n      \"profit_target\": 112500.0,\n      \"stop_loss\": 108200.0,\n      \"invalidation_condition\": \"If price closes below 108,200 (recent support) on 3-minute candle\",\n      \"leverage\": 15,\n      \"confidence\": 0.78,\n      \"risk_usd\": 822.0\n    }\n  },\n  \"BNB\": {\n    \"trade_signal_args\": {\n      \"coin\": \"BNB\",\n      \"signal\": \"hold\",\n      \"quantity\": 3.2,\n      \"profit_target\": 1165.0,\n      \"stop_loss\": 1105.0,\n      \"invalidation_condition\": \"If price closes below 1,105 (breakout level) or RSI(7) drops below 50 on 3-minute candle\",\n      \"leverage\": 15,\n      \"confidence\": 0.75,\n      \"risk_usd\": 1200.0\n    }\n  }\n}\n```",
      "signals": [
        {
          "coin": "BTC",
          "signal": "hold",
          "quantity": 0.032,
          "leverage": 15,
          "stop_loss": 108200.0,
          "profit_target": 112500.0,
          "confidence": 0.78,
          "risk_usd": 822.0,
          "invalidation_condition": "If price closes below 108,200 (recent support) on 3-minute candle"
        },
        {
          "coin": "BNB",
          "signal": "hold",
          "quantity": 3.2,
          "leverage": 15,
          "stop_loss": 1105.0,
          "profit_target": 1165.0,
          "confidence": 0.75,
          "risk_usd": 1200.0,
          "invalidation_condition": "If price closes below 1,105 (breakout level) or RSI(7) drops below 50 on 3-minute candle"
        }
      ]
    },
    {
      "iteration": 43,
      "timestamp": "2025-10-24T00:00:00",
      "model": "anthropic",
      "raw_response": "# CHAIN OF THOUGHT\n\nReviewing my current positions against their invalidation conditions and market state:\n\n## BTC Position Analysis\n- **Entry**: 109,910 | **Current**: 110,430 | **Unrealized P&L**: +$14.88 (+0.47%)\n- **Exit Plan**: Profit target 112,500 | Stop-loss 108,200\n- **Invalidation Condition**: \"If price closes below 108,200 (recent support) on 3-minute candle\"\n- **Technical Analysis**:\n  - Price at 110,430 vs EMA20 at 109,480 \u2192 Above EMA (bullish)\n  - RSI(7): 76.56 \u2192 Overbought territory but still has room\n  - MACD: -45.20 \u2192 Still negative but improving rapidly (was -674 earlier)\n  - Price action: Strong recovery from 107,528 to 110,430 (+2.7%)\n  - Current price well above invalidation level (108,200)\n- **Decision**: **HOLD** - Invalidation condition NOT met. Price is above stop-loss and showing bullish momentum. RSI overbought but MACD improving. Let position run toward profit target of 112,500.\n\n## BNB Position Analysis\n- **Entry**: 1,130.10 | **Current**: 1,134.90 | **Unrealized P&L**: +$13.55 (+0.42%)\n- **Exit Plan**: Profit target 1,165 | Stop-loss 1,105\n- **Invalidation Condition**: \"If price closes below 1,105 (breakout level) or RSI(7) drops below 50 on 3-minute candle\"\n- **Technical Analysis**:\n  - Price at 1,134.90 vs EMA20 at 1,099.63 \u2192 Strong bullish position\n  - RSI(7): 73.87 \u2192 Overbought but maintaining strength\n  - MACD: +7.80 \u2192 Positive and increasing (was -7.24 earlier)\n  - Price action: Explosive move from 1,068 to 1,134 (+6.2%)\n  - Current price well above invalidation level (1,105)\n  - RSI(7) at 73.87, well above the 50 threshold\n- **Decision**: **HOLD** - Invalidation conditions NOT met. Price above 1,105 and RSI(7) well above 50. Strong bullish momentum with positive MACD crossover. Position working well.\n\n## Other Coins (No Positions)\n- **ETH**: Price 3,892 recovering but still below EMA20 (3,884). RSI(7) 68.68 showing recovery. MACD still negative. Not compelling enough to enter.\n- **SOL**: Price 191.21 above EMA20 (187.94). RSI(7) 80.33 extremely overbought. MACD positive but at risk of reversal. Too extended to enter.\n- **XRP**: Price 2.41 near EMA20 (2.42). RSI(7) 56.45 neutral. MACD negative. Weak momentum, no clear setup.\n- **DOGE**: Price 0.195230 slightly above EMA20 (0.194909). RSI(7) 63.02 moderate. MACD negative. Marginal setup, insufficient conviction.\n\n## Risk Management Assessment\n- Current account value: $14,765\n- Open positions: $7,165 notional (48.5% of account)\n- Both positions showing small profits\n- Portfolio Sharpe ratio: 12.626 (excellent)\n- No positions at risk of invalidation\n- Prudent to hold winners and let them run toward targets\n\n# TRADING DECISIONS\n\n```json\n{\n  \"BTC\": {\n    \"trade_signal_args\": {\n      \"coin\": \"BTC\",\n      \"signal\": \"hold\",\n      \"quantity\": 0.032,\n      \"profit_target\": 112500.0,\n      \"stop_loss\": 108200.0,\n      \"invalidation_condition\": \"If price closes below 108,200 (recent support) on 3-minute candle\",\n      \"leverage\": 15,\n      \"confidence\": 0.78,\n      \"risk_usd\": 822.0\n    }\n  },\n  \"BNB\": {\n    \"trade_signal_args\": {\n      \"coin\": \"BNB\",\n      \"signal\": \"hold\",\n      \"quantity\": 3.2,\n      \"profit_target\": 1165.0,\n      \"stop_loss\": 1105.0,\n      \"invalidation_condition\": \"If price closes below 1,105 (breakout level) or RSI(7) drops below 50 on 3-minute candle\",\n      \"leverage\": 15,\n      \"confidence\": 0.75,\n      \"risk_usd\": 1200.0\n    }\n  }\n}\n```",
      "signals": [
        {
          "coin": "BTC",
          "signal": "hold",
          "quantity": 0.032,
          "leverage": 15,
          "stop_loss": 108200.0,
          "profit_target": 112500.0,
          "confidence": 0.78,
          "risk_usd": 822.0,
          "invalidation_condition": "If price closes below 108,200 (recent support) on 3-minute candle"
        },
        {
          "coin": "BNB",
          "signal": "hold",
          "quantity": 3.2,
          "leverage": 15,
          "stop_loss": 1105.0,
          "profit_target": 1165.0,
          "confidence": 0.75,
          "risk_usd": 1200.0,
          "invalidation_condition": "If price closes below 1,105 (breakout level) or RSI(7) drops below 50 on 3-minute candle"
        }
      ]
    },
    {
      "iteration": 44,
      "timestamp": "2025-10-24T04:00:00",
      "model": "anthropic",
      "raw_response": "# CHAIN OF THOUGHT\n\n## Current Position Analysis\n\n### BTC Position Review\n- **Entry**: 109,910 | **Current**: 111,072 | **Unrealized P&L**: +$35.43 (+1.06%)\n- **Exit Plan**: Profit target 112,500 | Stop-loss 108,200\n- **Invalidation Condition**: \"If price closes below 108,200 (recent support) on 3-minute candle\"\n- **Technical Analysis**:\n  - RSI(7): 84.56 - EXTREMELY overbought (above 80)\n  - MACD: 347.20 - Strong positive momentum but at extreme level\n  - Price above EMA20 (111,072 vs 109,433)\n  - RSI(14): 69.70 - Also showing overbought\n- **Invalidation Check**: Current price 111,072 is well above 108,200 support - NOT invalidated\n- **Decision Rationale**: While RSI is extremely overbought suggesting potential pullback, the invalidation condition is NOT met. Price is approaching profit target (112,500 is only 1.3% away). However, RSI at 84.56 is a warning sign. Given the strong momentum and proximity to profit target, I'll HOLD but watch closely. The position is profitable and the stop-loss provides downside protection.\n\n### BNB Position Review\n- **Entry**: 1,130.10 | **Current**: 1,124.90 | **Unrealized P&L**: -$18.45 (-0.51%)\n- **Exit Plan**: Profit target 1,165 | Stop-loss 1,105\n- **Invalidation Condition**: \"If price closes below 1,105 (breakout level) or RSI(7) drops below 50 on 3-minute candle\"\n- **Technical Analysis**:\n  - RSI(7): 59.64 - Above the 50 threshold (safe)\n  - MACD: 12.14 - Positive but declining from 11.39\n  - Price above EMA20 (1,124.90 vs 1,099.48)\n  - Current price 1,124.90 is above 1,105 stop-loss\n- **Invalidation Check**: \n  - Price at 1,124.90 is above 1,105 \u2713\n  - RSI(7) at 59.64 is above 50 \u2713\n  - Neither invalidation condition is met\n- **Decision Rationale**: Position is slightly underwater but both invalidation conditions are NOT met. RSI(7) at 59.64 is safely above 50, and price is well above the 1,105 breakout level. The technical setup remains intact with price above EMA20 and positive MACD. HOLD the position.\n\n### Other Coins Assessment (ETH, SOL, XRP, DOGE)\n- **ETH**: RSI(7) 83.27 - extremely overbought, just like BTC. Strong upward momentum but stretched.\n- **SOL**: RSI(7) 84.99 - extremely overbought, similar conditions to BTC/ETH.\n- **XRP**: RSI(7) 76.65 - overbought but less extreme. MACD still negative (-0.010).\n- **DOGE**: RSI(7) 74.31 - overbought. MACD near zero.\n\nAll major coins showing overbought conditions on short-term RSI. Market appears stretched. No new positions warranted - better to manage existing risk.\n\n### Risk Management Summary\n- Current account value: $14,752.82\n- Total positions: $7,153.98 (BTC $3,554 + BNB $3,600)\n- Exposure: ~48.5% of account value\n- Both positions have defined stop-losses and profit targets\n- Portfolio performing well with 47.53% return and Sharpe ratio of 12.626\n\n**Final Decision**: HOLD both positions as neither invalidation condition is met, despite overbought RSI readings across the board.\n\n# TRADING DECISIONS\n\n```json\n{\n  \"BTC\": {\n    \"trade_signal_args\": {\n      \"coin\": \"BTC\",\n      \"signal\": \"hold\",\n      \"quantity\": 0.032,\n      \"profit_target\": 112500.0,\n      \"stop_loss\": 108200.0,\n      \"invalidation_condition\": \"If price closes below 108,200 (recent support) on 3-minute candle\",\n      \"leverage\": 15,\n      \"confidence\": 0.78,\n      \"risk_usd\": 822.0\n    }\n  },\n  \"BNB\": {\n    \"trade_signal_args\": {\n      \"coin\": \"BNB\",\n      \"signal\": \"hold\",\n      \"quantity\": 3.2,\n      \"profit_target\": 1165.0,\n      \"stop_loss\": 1105.0,\n      \"invalidation_condition\": \"If price closes below 1,105 (breakout level) or RSI(7) drops below 50 on 3-minute candle\",\n      \"leverage\": 15,\n      \"confidence\": 0.75,\n      \"risk_usd\": 1200.0\n    }\n  }\n}\n```",
      "signals": [
        {
          "coin": "BTC",
          "signal": "hold",
          "quantity": 0.032,
          "leverage": 15,
          "stop_loss": 108200.0,
          "profit_target": 112500.0,
          "confidence": 0.78,
          "risk_usd": 822.0,
          "invalidation_condition": "If price closes below 108,200 (recent support) on 3-minute candle"
        },
        {
          "coin": "BNB",
          "signal": "hold",
          "quantity": 3.2,
          "leverage": 15,
          "stop_loss": 1105.0,
          "profit_target": 1165.0,
          "confidence": 0.75,
          "risk_usd": 1200.0,
          "invalidation_condition": "If price closes below 1,105 (breakout level) or RSI(7) drops below 50 on 3-minute candle"
        }
      ]
    },
    {
      "iteration": 45,
      "timestamp": "2025-10-24T08:00:00",
      "model": "anthropic",
      "raw_response": "# CHAIN OF THOUGHT\n\nReviewing my current positions:\n\n**BTC Position Analysis:**\n- Entry: 109,910 | Current: 111,100 | Unrealized P&L: +$36.32 (+1.08%)\n- Profit target: 112,500 (1,400 points away)\n- Stop-loss: 108,200 (2,900 points away)\n- Invalidation condition: \"If price closes below 108,200 on 3-minute candle\"\n- Current technicals: RSI(7) = 85.095 (extremely overbought), MACD = 611.266 (strong positive), Price > EMA20 (111,100 > 109,458)\n- Recent price action: Strong uptrend from 107,528 to 111,100 in last 30 minutes\n- **Assessment**: Price is approaching profit target (only 1.26% away). RSI is dangerously overbought at 85+, suggesting imminent pullback risk. However, invalidation condition NOT met - price is well above 108,200. MACD still strongly positive showing momentum.\n- **Decision**: CLOSE POSITION - Taking profits at 85+ RSI. We're up 1.08% with 15x leverage, and extreme overbought conditions warrant profit-taking rather than risking a reversal.\n\n**BNB Position Analysis:**\n- Entry: 1,130.10 | Current: 1,124.80 | Unrealized P&L: -$18.77 (-0.47%)\n- Profit target: 1,165.00 (40.20 points away)\n- Stop-loss: 1,105.00 (19.80 points away)\n- Invalidation condition: \"If price closes below 1,105 (breakout level) or RSI(7) drops below 50 on 3-minute candle\"\n- Current technicals: RSI(7) = 59.555 (above 50 threshold), MACD = 14.371 (positive), Price > EMA20 (1,124.80 > 1,100.54)\n- Recent price action: Peaked at 1,134.90, now pulling back to 1,124.80\n- **Assessment**: Invalidation condition NOT met - RSI(7) at 59.555 is above 50, and price at 1,124.80 is above 1,105. However, we're closer to stop-loss (19.80 away) than profit target (40.20 away), and the position is underwater. RSI has cooled from 74+ to 59, showing momentum loss.\n- **Decision**: CLOSE POSITION - Risk/reward unfavorable. We're underwater, closer to stop-loss than target, and RSI momentum is fading. Better to cut small loss and preserve capital.\n\n**Other Coins (No Positions):**\n- **ETH**: RSI(7) = 81.306 (overbought), price at 3,947.70 near recent high. Too extended to enter.\n- **SOL**: RSI(7) = 83.392 (overbought), strong rally from 180 to 192. Too extended to enter.\n- **XRP**: RSI(7) = 81.849 (overbought), rallying from 2.36 to 2.45. Too extended to enter.\n- **DOGE**: RSI(7) = 78.630 (overbought), rallying from 0.1898 to 0.1972. Too extended to enter.\n\nAll major coins showing overbought conditions on RSI(7) above 78+. This is a broad market overbought signal suggesting near-term pullback risk. No new entries warranted.\n\n# TRADING DECISIONS\n\n```json\n{\n  \"BTC\": {\n    \"trade_signal_args\": {\n      \"coin\": \"BTC\",\n      \"signal\": \"close_position\",\n      \"quantity\": 0.032,\n      \"profit_target\": 112500.0,\n      \"stop_loss\": 108200.0,\n      \"invalidation_condition\": \"If price closes below 108,200 on 3-minute candle\",\n      \"leverage\": 15,\n      \"confidence\": 0.78,\n      \"risk_usd\": 822.0,\n      \"close_reason\": \"Taking profits at extreme RSI(7) 85.095 overbought level - risk of imminent reversal outweighs holding for final 1.26% to profit target\"\n    }\n  },\n  \"BNB\": {\n    \"trade_signal_args\": {\n      \"coin\": \"BNB\",\n      \"signal\": \"close_position\",\n      \"quantity\": 3.2,\n      \"profit_target\": 1165.0,\n      \"stop_loss\": 1105.0,\n      \"invalidation_condition\": \"If price closes below 1,105 or RSI(7) drops below 50 on 3-minute candle\",\n      \"leverage\": 15,\n      \"confidence\": 0.75,\n      \"risk_usd\": 1200.0,\n      \"close_reason\": \"Risk management - position underwater, closer to stop-loss than profit target, RSI momentum fading from 74 to 59, unfavorable risk/reward\"\n    }\n  }\n}\n```",
      "signals": [
        {
          "coin": "BTC",
          "signal": "close_position",
          "quantity": 0.032,
          "leverage": 15,
          "stop_loss": 108200.0,
          "profit_target": 112500.0,
          "confidence": 0.78,
          "risk_usd": 822.0,
          "invalidation_condition": "If price closes below 108,200 on 3-minute candle"
        },
        {
          "coin": "BNB",
          "signal": "close_position",
          "quantity": 3.2,
          "leverage": 15,
          "stop_loss": 1105.0,
          "profit_target": 1165.0,
          "confidence": 0.75,
          "risk_usd": 1200.0,
          "invalidation_condition": "If price closes below 1,105 or RSI(7) drops below 50 on 3-minute candle"
        }
      ]
    },
    {
      "iteration": 46,
      "timestamp": "2025-10-24T12:00:00",
      "model": "anthropic",
      "raw_response": "# CHAIN OF THOUGHT\n\nCurrently, I have NO open positions and $14,748.45 in available cash. I need to analyze the market conditions for potential entry opportunities.\n\n**Market Analysis:**\n\n**BTC Analysis:**\n- Current: $110,109, EMA20: $109,594\n- Just experienced a sharp drop from $111,100 to $110,109 (latest candle)\n- RSI(7) crashed from 85.064 to 44.879 - major momentum shift\n- RSI(14) at 53.962 - neutral zone\n- MACD still positive at 487.189 but declining from 507.593\n- Price above EMA20 but showing weakness\n- This looks like a potential pullback after overextension\n- **Decision: WAIT** - Too risky to enter after such a sharp reversal\n\n**ETH Analysis:**\n- Current: $3,890, EMA20: $3,885.37\n- Similar pattern to BTC - dropped from $3,947.70 to $3,890\n- RSI(7) plunged from 81.314 to 45.165 - severe momentum loss\n- RSI(14) at 50.563 - neutral\n- MACD positive at 4.756 but declining\n- Price slightly above EMA20 but showing weakness\n- **Decision: WAIT** - Same concerns as BTC\n\n**SOL Analysis:**\n- Current: $189.29, EMA20: $188.39\n- Sharp drop from $192.03 to $189.29\n- RSI(7) collapsed from 83.354 to 38.006 - oversold territory!\n- RSI(14) at 51.672 - neutral\n- MACD positive at 1.276 but declining\n- This is the most oversold on RSI(7) among all coins\n- **Decision: POTENTIAL BUY** - Oversold bounce candidate\n\n**BNB Analysis:**\n- Current: $1,103.40, EMA20: $1,101.46\n- Dropped from $1,124.80 to $1,103.40 (-$21.40)\n- RSI(7) at 34.252 - approaching oversold\n- RSI(14) at 47.732 - below neutral\n- MACD positive at 11.902 but declining\n- **Decision: WAIT** - Not oversold enough yet\n\n**XRP Analysis:**\n- Current: $2.48, EMA20: $2.42\n- Strong uptrend - rallying from $2.45 to $2.48\n- RSI(7) at 87.315 - EXTREMELY overbought!\n- RSI(14) at 73.572 - overbought\n- MACD just turned positive at 0.003\n- Price well above EMA20\n- **Decision: NO TRADE** - Too overbought, high reversal risk\n\n**DOGE Analysis:**\n- Current: $0.194840, EMA20: $0.194603\n- Dropped from $0.197240 to $0.194840\n- RSI(7) at 43.865 - neutral/weak\n- RSI(14) at 50.376 - neutral\n- MACD flat at 0.000\n- **Decision: WAIT** - No clear setup\n\n**Trading Decision:**\nI will enter a LONG position on **SOL** as it shows the best risk/reward:\n- RSI(7) at 38.006 is oversold after being overbought (83.354)\n- Price still above EMA20 ($189.29 vs $188.39)\n- MACD still positive (bullish structure intact)\n- This appears to be a healthy pullback in an uptrend\n- Risk: ~$500 (3.4% of capital)\n- Entry: $189.29\n- Stop-loss: $186.50 (below EMA20 with buffer)\n- Profit target: $195.00 (previous resistance area)\n- Leverage: 15x for optimal risk/reward\n\n# TRADING DECISIONS\n\n```json\n{\n  \"SOL\": {\n    \"trade_signal_args\": {\n      \"coin\": \"SOL\",\n      \"signal\": \"buy\",\n      \"quantity\": 40,\n      \"profit_target\": 195.00,\n      \"stop_loss\": 186.50,\n      \"invalidation_condition\": \"If price closes below 186.50 or RSI(7) drops below 30 without bounce\",\n      \"leverage\": 15,\n      \"confidence\": 0.72,\n      \"risk_usd\": 500.00\n    }\n  }\n}\n```",
      "signals": [
        {
          "coin": "SOL",
          "signal": "buy",
          "quantity": 40.0,
          "leverage": 15,
          "stop_loss": 186.5,
          "profit_target": 195.0,
          "confidence": 0.72,
          "risk_usd": 500.0,
          "invalidation_condition": "If price closes below 186.50 or RSI(7) drops below 30 without bounce"
        }
      ]
    },
    {
      "iteration": 47,
      "timestamp": "2025-10-24T16:00:00",
      "model": "anthropic",
      "raw_response": "# CHAIN OF THOUGHT\n\nReviewing my current position:\n\n**SOL Position Analysis:**\n- Entry: 189.29, Current: 192.96 (+1.94% = +$143 unrealized PnL)\n- Profit target: 195.00 (only $2.04 away - 1.06% more)\n- Stop-loss: 186.50\n- Invalidation: \"If price closes below 186.50 or RSI(7) drops below 30 without bounce\"\n- Current RSI(7): 68.378 (healthy, not overbought, well above 30)\n- Current price: 192.96 (well above stop-loss at 186.50)\n- MACD: -0.310 (negative but improving from -0.617, showing momentum recovery)\n- Price above EMA20 (192.96 > 190.17) - bullish signal\n- RSI(14): 63.894 - strong but not overbought\n\n**Invalidation Check:** \n- Price NOT below 186.50 \u2713\n- RSI(7) at 68.378, NOT below 30 \u2713\n- Invalidation condition NOT met\n\n**Decision:** The position is performing well with $143 unrealized profit. Price is just $2.04 away from profit target at 195.00. The invalidation condition is not met - price is comfortably above 186.50 and RSI is healthy at 68.378. MACD is improving, and price is above EMA20 showing bullish momentum. The position should be held to capture the remaining move to the profit target.\n\n**Other Coins Analysis:**\n- **BTC**: Price 110659, above EMA20 (110346.85), MACD improving (-354 from -428), RSI 58.761 - neutral momentum. No position, market conditions don't warrant new entry.\n- **ETH**: Price 3927.20, slightly above EMA20 (3915.40), MACD improving (-27 from -31), RSI 60.085 - similar to BTC, neutral. No compelling entry.\n- **BNB**: Price 1108.70, just above EMA20 (1106.94), but RSI(7) at 42.136 showing weakness after recent drop. Not attractive.\n- **XRP**: Price 2.50, significantly above EMA20 (2.44), RSI(7) at 90.673 - EXTREMELY overbought. Too risky to enter here.\n- **DOGE**: Price 0.196600, just above EMA20 (0.196119), RSI 60.526 - neutral. No strong signal.\n\nNo new positions warranted. Focus on managing existing SOL position to profit target.\n\n# TRADING DECISIONS\n\n```json\n{\n  \"SOL\": {\n    \"trade_signal_args\": {\n      \"coin\": \"SOL\",\n      \"signal\": \"hold\",\n      \"quantity\": 40.0,\n      \"profit_target\": 195.0,\n      \"stop_loss\": 186.5,\n      \"invalidation_condition\": \"If price closes below 186.50 or RSI(7) drops below 30 without bounce\",\n      \"leverage\": 15,\n      \"confidence\": 0.72,\n      \"risk_usd\": 500.0\n    }\n  }\n}\n```",
      "signals": [
        {
          "coin": "SOL",
          "signal": "hold",
          "quantity": 40.0,
          "leverage": 15,
          "stop_loss": 186.5,
          "profit_target": 195.0,
          "confidence": 0.72,
          "risk_usd": 500.0,
          "invalidation_condition": "If price closes below 186.50 or RSI(7) drops below 30 without bounce"
        }
      ]
    },
    {
      "iteration": 48,
      "timestamp": "2025-10-24T20:00:00",
      "model": "anthropic",
      "raw_response": "# CHAIN OF THOUGHT\n\n## Current Position Analysis\n\n**SOL Position Review:**\n- Entry: $189.29, Current: $193.50 (+2.22%)\n- Unrealized P&L: +$164.61 (on $7,740 notional)\n- Profit Target: $195.00 (0.78% away)\n- Stop-Loss: $186.50\n- Invalidation: \"If price closes below 186.50 or RSI(7) drops below 30 without bounce\"\n\n**Technical Analysis:**\n- Current price: $193.50 - very close to profit target of $195.00\n- RSI(7): 71.296 - elevated but not extreme overbought\n- RSI(14): 66.636 - healthy momentum\n- MACD: 0.396 - positive and recently turned bullish\n- Price above EMA20 ($190.17) - bullish structure\n- Recent momentum: Strong rally from $189.29 to $193.50\n\n**Invalidation Check:**\n- Price is NOT below $186.50 \u2713\n- RSI(7) at 71.296, NOT below 30 \u2713\n- Invalidation condition: NOT MET\n\n**Decision Logic:**\nThe position is performing well with +$164 unrealized profit. We're only $1.50 away from the profit target of $195.00. Given:\n1. Strong momentum (MACD positive, price above EMA)\n2. RSI showing strength but not extreme\n3. No invalidation conditions met\n4. Very close to profit target (0.78% away)\n\nI will HOLD to capture the remaining move to $195.00. The risk/reward favors holding as we're much closer to profit target ($1.50 away) than stop-loss ($7.00 away).\n\n## Other Coins Evaluation\n\n**BTC:** Strong momentum (RSI 67, MACD turned positive at 36.741, price above EMA). However, already have SOL position and don't want overexposure. Pass.\n\n**ETH:** Recovering (price $3935.90 vs EMA $3905.25), but MACD still negative at -6.397. Not compelling enough. Pass.\n\n**BNB:** Weak RSI(7) at 41.867, showing consolidation/weakness. Not attractive. Pass.\n\n**XRP:** RSI(7) at 92.379 - EXTREMELY overbought. Dangerous to enter. Pass.\n\n**DOGE:** Modest momentum but nothing compelling. Pass.\n\n**Portfolio Management:**\n- Current account value: $14,920.51 (+49.21% return)\n- Sharpe Ratio: 11.710 - excellent risk-adjusted returns\n- Single position in SOL is manageable risk\n- Will hold SOL to profit target\n\n# TRADING DECISIONS\n\n```json\n{\n  \"SOL\": {\n    \"trade_signal_args\": {\n      \"coin\": \"SOL\",\n      \"signal\": \"hold\",\n      \"quantity\": 40.0,\n      \"profit_target\": 195.0,\n      \"stop_loss\": 186.5,\n      \"invalidation_condition\": \"If price closes below 186.50 or RSI(7) drops below 30 without bounce\",\n      \"leverage\": 15,\n      \"confidence\": 0.72,\n      \"risk_usd\": 500.0\n    }\n  }\n}\n```",
      "signals": [
        {
          "coin": "SOL",
          "signal": "hold",
          "quantity": 40.0,
          "leverage": 15,
          "stop_loss": 186.5,
          "profit_target": 195.0,
          "confidence": 0.72,
          "risk_usd": 500.0,
          "invalidation_condition": "If price closes below 186.50 or RSI(7) drops below 30 without bounce"
        }
      ]
    },
    {
      "iteration": 49,
      "timestamp": "2025-10-25T00:00:00",
      "model": "anthropic",
      "raw_response": "# CHAIN OF THOUGHT\n\n## Current Position Analysis\n\n**SOL Position Review:**\n- Entry: $189.29, Current: $193.40 (+2.17%)\n- Unrealized P&L: +$160.61\n- Leverage: 15x\n- Exit Plan: Profit target $195.00, Stop-loss $186.50\n- Invalidation: \"If price closes below 186.50 or RSI(7) drops below 30 without bounce\"\n\n**Technical Analysis:**\n- Current price $193.40 is very close to profit target of $195.00 (only $1.60 away)\n- RSI(7) = 70.293 - healthy, not oversold (well above 30 threshold)\n- MACD = 2.068 - positive and rising\n- Price well above EMA20 ($189.36) showing bullish momentum\n- Price above stop-loss ($186.50) by $6.90\n- Recent price action: Strong upward movement from $189.29 \u2192 $193.50\n\n**Invalidation Check:**\n- Price NOT below $186.50 \u2713\n- RSI(7) at 70.293, NOT below 30 \u2713\n- **Invalidation condition NOT met**\n\n**Decision Rationale:**\nThe position is performing well with +$160 profit. We're within $1.60 of the profit target ($195.00). Given:\n1. Strong momentum (MACD rising, RSI healthy at 70)\n2. Price above all key moving averages\n3. Very close to profit target\n4. No invalidation conditions triggered\n\nI will **HOLD** to capture the full profit target. The risk/reward is favorable as we're much closer to the profit target ($1.60 away) than the stop-loss ($6.90 away).\n\n## Other Coins Assessment\n\n**BTC:** Price $111,057, strong uptrend (RSI 67.9, MACD 719.995). However, already have SOL position at 15x leverage using significant capital. Not entering to maintain risk management.\n\n**ETH:** Price $3,921.80, moderate momentum (RSI 54.4, MACD 17.511). Neutral - no strong entry signal.\n\n**BNB:** Price $1,116.30, moderate (RSI 56.4, MACD 13.924). No compelling setup.\n\n**XRP:** Price $2.54, RSI 95.498 - EXTREMELY overbought. Dangerous to enter at these levels. High probability of pullback.\n\n**DOGE:** Price $0.197750, RSI 69.7, MACD positive. Moderate but no strong edge.\n\n**Conclusion:** Hold SOL position to capture profit target. No new entries warranted given existing leverage exposure and lack of compelling setups in other coins.\n\n# TRADING DECISIONS\n\n```json\n{\n  \"SOL\": {\n    \"trade_signal_args\": {\n      \"coin\": \"SOL\",\n      \"signal\": \"hold\",\n      \"quantity\": 40.0,\n      \"profit_target\": 195.0,\n      \"stop_loss\": 186.5,\n      \"invalidation_condition\": \"If price closes below 186.50 or RSI(7) drops below 30 without bounce\",\n      \"leverage\": 15,\n      \"confidence\": 0.72,\n      \"risk_usd\": 500.0\n    }\n  }\n}\n```",
      "signals": [
        {
          "coin": "SOL",
          "signal": "hold",
          "quantity": 40.0,
          "leverage": 15,
          "stop_loss": 186.5,
          "profit_target": 195.0,
          "confidence": 0.72,
          "risk_usd": 500.0,
          "invalidation_condition": "If price closes below 186.50 or RSI(7) drops below 30 without bounce"
        }
      ]
    },
    {
      "iteration": 50,
      "timestamp": "2025-10-25T04:00:00",
      "model": "anthropic",
      "raw_response": "# CHAIN OF THOUGHT\n\n## Current Position Analysis\n\n**SOL Position Review:**\n- Entry: 189.29, Current: 193.88 (+2.42% gain)\n- Unrealized PnL: +$179.81\n- Leverage: 15x\n- Profit Target: 195.00 (0.58% away)\n- Stop Loss: 186.50 (3.81% away)\n- Invalidation: \"If price closes below 186.50 or RSI(7) drops below 30 without bounce\"\n\n**Technical Analysis:**\n- Current RSI(7): 73.932 - Strong but not extreme overbought\n- RSI(14): 71.981 - Confirming bullish momentum\n- MACD: 2.232 - Positive and rising\n- Price above EMA20 (189.74) - Bullish\n- Recent price action: Strong upward movement from 189.29 to 193.88\n\n**Decision Logic:**\nThe position is performing well and very close to the profit target (195.00). Current price at 193.88 is only $1.12 away from target. Given:\n1. RSI(7) at 73.932 is well above 30 (invalidation not triggered)\n2. Price well above stop-loss at 186.50\n3. MACD positive and rising\n4. Price trending upward with strong momentum\n5. Profit target nearly reached\n\n**Action: CLOSE POSITION**\nRationale: With the profit target at 195.00 just 0.58% away and the position already up 2.42%, this is an excellent opportunity to take profits. The RSI is elevated (73.932), suggesting potential for a pullback. Rather than risk giving back gains, I'll close now to lock in the $179.81 profit. This represents disciplined profit-taking near the predetermined target.\n\n## Other Coins Analysis\n\n**BTC:** RSI(7) at 77.864 - Very overbought. Price at 111,551 showing strong momentum but extended. No position currently. Not entering at these overbought levels.\n\n**ETH:** RSI(7) at 58.643 - Neutral zone. MACD positive at 20.684. Decent setup but less compelling than SOL's near-target exit opportunity.\n\n**BNB:** RSI(7) at 48.077 - Neutral. MACD declining from 15.913 to 11.244. Losing momentum. Pass.\n\n**XRP:** RSI(7) at 95.627 - EXTREMELY overbought. This is unsustainable. While momentum is strong, entering here would be chasing. Too risky.\n\n**DOGE:** RSI(7) at 70.674 - Moderately overbought. MACD positive but small. Less attractive than other opportunities.\n\n**Portfolio Decision:** Close SOL position to lock in profits near target. With account value at $14,936.72 (49.37% return) and Sharpe ratio of 11.710, taking profits here maintains excellent risk-adjusted returns. No new positions warranted given overbought conditions across most coins.\n\n# TRADING DECISIONS\n\n```json\n{\n  \"SOL\": {\n    \"trade_signal_args\": {\n      \"coin\": \"SOL\",\n      \"signal\": \"close_position\",\n      \"quantity\": 40.0,\n      \"profit_target\": 195.0,\n      \"stop_loss\": 186.5,\n      \"invalidation_condition\": \"If price closes below 186.50 or RSI(7) drops below 30 without bounce\",\n      \"leverage\": 15,\n      \"confidence\": 0.72,\n      \"risk_usd\": 500.0,\n      \"close_reason\": \"Taking profits - price at 193.88 is within 0.58% of profit target (195.00), locking in +$179.81 gain with RSI(7) at elevated 73.932 suggesting potential pullback risk\"\n    }\n  }\n}\n```",
      "signals": [
        {
          "coin": "SOL",
          "signal": "close_position",
          "quantity": 40.0,
          "leverage": 15,
          "stop_loss": 186.5,
          "profit_target": 195.0,
          "confidence": 0.72,
          "risk_usd": 500.0,
          "invalidation_condition": "If price closes below 186.50 or RSI(7) drops below 30 without bounce"
        }
      ]
    },
    {
      "iteration": 51,
      "timestamp": "2025-10-25T08:00:00",
      "model": "anthropic",
      "raw_response": "# CHAIN OF THOUGHT\n\nCurrently I have NO open positions and $14,920.60 in cash. I'm analyzing the market for potential entry opportunities.\n\n**BTC Analysis:**\n- Price: $111,635 (above EMA20: $110,134)\n- RSI(7): 79.3 - OVERBOUGHT territory\n- RSI(14): 74.3 - also elevated\n- MACD: 795.17 - strong positive momentum\n- Strong uptrend but RSI extremely overbought suggests pullback risk\n- Decision: PASS - Too extended for entry\n\n**ETH Analysis:**\n- Price: $3,941 (above EMA20: $3,898)\n- RSI(7): 65.6 - healthy bullish zone\n- RSI(14): 63.1 - moderate bullish\n- MACD: 20.17 - positive and rising\n- Price above EMA20, good momentum without being overbought\n- Decision: CONSIDER - Best risk/reward setup\n\n**SOL Analysis:**\n- Price: $192.65 (above EMA20: $189.98)\n- RSI(7): 52.3 - neutral zone, dropped from 73.96\n- RSI(14): 61.4 - moderate\n- Recent price weakness (dropped from $193.88 to $192.65)\n- Decision: PASS - Momentum fading\n\n**BNB Analysis:**\n- Price: $1,115.10 (above EMA20: $1,104.94)\n- RSI(7): 54.3 - neutral\n- RSI(14): 55.7 - neutral\n- MACD declining from 14.98 to 10.13\n- Decision: PASS - Weak momentum\n\n**XRP Analysis:**\n- Price: $2.56 (above EMA20: $2.46)\n- RSI(7): 97.1 - EXTREMELY OVERBOUGHT (danger zone!)\n- RSI(14): 90.4 - also extremely overbought\n- Parabolic move from $2.39 to $2.56 in 30 minutes\n- Decision: PASS - Severe overbought, high reversal risk\n\n**DOGE Analysis:**\n- Price: $0.19747 (above EMA20: $0.19524)\n- RSI(7): 61.1 - moderate, dropped from 70.9\n- RSI(14): 64.1 - moderate\n- Losing momentum after recent rally\n- Decision: PASS - Weakening\n\n**TRADE DECISION:**\nETH presents the best setup: strong uptrend, positive MACD, RSI in healthy bullish zone (not overbought), price above EMA20. Will enter long with 15x leverage for $3,000 risk (~20% of capital).\n\nEntry: $3,941\nStop-loss: $3,880 (below recent support and EMA20)\nProfit target: $4,060 (3% move, ~3:1 R/R)\nInvalidation: Price closes below $3,870 or RSI(7) drops below 40\n\n# TRADING DECISIONS\n\n```json\n{\n  \"ETH\": {\n    \"trade_signal_args\": {\n      \"coin\": \"ETH\",\n      \"signal\": \"buy\",\n      \"quantity\": 11.42,\n      \"profit_target\": 4060.00,\n      \"stop_loss\": 3880.00,\n      \"invalidation_condition\": \"If price closes below $3,870 on 3-minute candle or RSI(7) drops below 40\",\n      \"leverage\": 15,\n      \"confidence\": 0.72,\n      \"risk_usd\": 3000.00\n    }\n  }\n}\n```",
      "signals": [
        {
          "coin": "ETH",
          "signal": "buy",
          "quantity": 11.42,
          "leverage": 15,
          "stop_loss": 3880.0,
          "profit_target": 4060.0,
          "confidence": 0.72,
          "risk_usd": 3000.0,
          "invalidation_condition": "If price closes below $3,870 on 3-minute candle or RSI(7) drops below 40"
        }
      ]
    },
    {
      "iteration": 52,
      "timestamp": "2025-10-25T12:00:00",
      "model": "anthropic",
      "raw_response": "# CHAIN OF THOUGHT\n\nReviewing my current position:\n\n**ETH Position Analysis:**\n- Entry: $3,941.00, Current: $3,933.30 (down $7.70, -0.20%)\n- Unrealized P&L: -$110.44\n- Leverage: 15x, Notional: $44,918\n- Exit Plan: Profit target $4,060, Stop-loss $3,880\n- Invalidation: \"If price closes below $3,870 on 3-minute candle or RSI(7) drops below 40\"\n\n**Checking Invalidation Condition:**\n- Current price: $3,933.30 (well above $3,870 threshold)\n- Current RSI(7): 57.474 (above 40 threshold)\n- Latest 3-min candle closed at $3,933.30 (above $3,870)\n- **Invalidation NOT met** - both conditions are satisfied\n\n**Technical Analysis:**\n- Price above EMA20 ($3,896.14) - bullish\n- MACD: 27.425 (positive and strong)\n- RSI(7): 57.474 (neutral zone, not overbought)\n- RSI(14): 60.631 (healthy momentum)\n- Recent price action: Consolidating after earlier strength\n- Stop-loss at $3,880 is $53 away (1.35% buffer)\n- Profit target at $4,060 is $127 away (3.2% gain needed)\n\n**Decision: HOLD**\nThe position remains valid. ETH is consolidating in a healthy manner with price above key EMAs, positive MACD, and RSI in neutral territory allowing for upside. The invalidation conditions are not triggered. The technical setup remains constructive for reaching the $4,060 profit target.\n\n**Other Coins:**\n- **BTC**: Strong momentum (RSI 63.7, price above EMA), but no position and not adding new trades\n- **SOL**: Showing weakness (RSI 40.7, price declining), not entering\n- **BNB**: Weak (RSI 38.9), not entering\n- **XRP**: Extremely overbought (RSI 98.3!), dangerous to enter despite uptrend\n- **DOGE**: Weak (RSI 37.0), not entering\n\n# TRADING DECISIONS\n\n```json\n{\n  \"ETH\": {\n    \"trade_signal_args\": {\n      \"coin\": \"ETH\",\n      \"signal\": \"hold\",\n      \"quantity\": 11.42,\n      \"profit_target\": 4060.0,\n      \"stop_loss\": 3880.0,\n      \"invalidation_condition\": \"If price closes below $3,870 on 3-minute candle or RSI(7) drops below 40\",\n      \"leverage\": 15,\n      \"confidence\": 0.72,\n      \"risk_usd\": 3000.0\n    }\n  }\n}\n```",
      "signals": [
        {
          "coin": "ETH",
          "signal": "hold",
          "quantity": 11.42,
          "leverage": 15,
          "stop_loss": 3880.0,
          "profit_target": 4060.0,
          "confidence": 0.72,
          "risk_usd": 3000.0,
          "invalidation_condition": "If price closes below $3,870 on 3-minute candle or RSI(7) drops below 40"
        }
      ]
    },
    {
      "iteration": 53,
      "timestamp": "2025-10-25T16:00:00",
      "model": "anthropic",
      "raw_response": "# CHAIN OF THOUGHT\n\n## Current Position Analysis\n\n**ETH Position Review:**\n- Entry: $3,941.00, Current: $3,957.60 (+$16.60, +0.42%)\n- Unrealized P&L: +$167.07 (+0.37% of notional)\n- Position size: 11.42 ETH with 15x leverage (~$45,196 notional)\n- Profit target: $4,060.00 (needs +$102.40 move, +2.59%)\n- Stop-loss: $3,880.00 (risk -$77.60, -1.96%)\n- Invalidation condition: \"If price closes below $3,870 on 3-minute candle or RSI(7) drops below 40\"\n\n**Checking Invalidation Conditions:**\n- Current price: $3,957.60 > $3,870 \u2713 (not invalidated)\n- Current RSI(7): 72.267 > 40 \u2713 (not invalidated)\n- Recent 3-min candle lows: [3890.00, 3921.80, 3929.00, 3933.30, 3957.60] - all above $3,870 \u2713\n\n**Technical Analysis for ETH:**\n- Price above EMA20 ($3,903.56) - bullish structure maintained\n- MACD: 26.809 and rising - strong positive momentum\n- RSI(7): 72.267 - overbought but not extreme (previous peak was 86.817)\n- RSI(14): 67.326 - healthy bullish territory\n- Recent price action: Recovered from $3,890 dip, now at $3,957.60\n- Volume: 28,812 vs avg 74,942 - lower volume but price holding\n\n**Risk Assessment:**\n- Position is slightly profitable (+$167)\n- No invalidation conditions met\n- Technical indicators remain bullish\n- Stop-loss provides reasonable protection at $3,880\n\n**Decision: HOLD ETH** - All conditions favorable, invalidation criteria not met, momentum remains positive.\n\n## Other Opportunities\n\n**XRP Analysis:**\n- Extreme momentum: RSI(7) at 98.461, RSI(14) at 93.726\n- Price: $2.60, up from $2.44 (30 minutes ago)\n- MACD strongly positive and accelerating (0.048)\n- Price well above EMA20 ($2.49)\n- **Concern:** Extremely overbought - RSI(7) at 98.5 is unsustainable\n- High risk of sharp pullback from these levels\n- **Decision: PASS** - Too extended, high probability of reversal\n\n**BTC Analysis:**\n- Price: $111,669, RSI(7): 72.060\n- Strong uptrend but more measured than XRP\n- MACD positive and rising\n- **Decision: PASS** - Already have ETH exposure, don't want to over-leverage\n\n**SOL, BNB, DOGE:**\n- All showing mixed signals or consolidation\n- SOL RSI(7): 68.512 - decent but not compelling\n- BNB RSI(7): 56.614 - neutral\n- DOGE RSI(7): 56.383 - neutral\n- **Decision: PASS** - No clear edge\n\n## Portfolio Management\n- Current account value: $15,077.81 (+50.78% total return)\n- Single position (ETH) provides focused risk\n- Available cash: $11,897.68 (79% of account value)\n- Sharpe ratio: 11.506 - excellent risk-adjusted returns\n- Strategy: Maintain discipline, hold winning position, wait for clear setups\n\n# TRADING DECISIONS\n\n```json\n{\n  \"ETH\": {\n    \"trade_signal_args\": {\n      \"coin\": \"ETH\",\n      \"signal\": \"hold\",\n      \"quantity\": 11.42,\n      \"profit_target\": 4060.0,\n      \"stop_loss\": 3880.0,\n      \"invalidation_condition\": \"If price closes below $3,870 on 3-minute candle or RSI(7) drops below 40\",\n      \"leverage\": 15,\n      \"confidence\": 0.72,\n      \"risk_usd\": 3000.0\n    }\n  }\n}\n```",
      "signals": [
        {
          "coin": "ETH",
          "signal": "hold",
          "quantity": 11.42,
          "leverage": 15,
          "stop_loss": 3880.0,
          "profit_target": 4060.0,
          "confidence": 0.72,
          "risk_usd": 3000.0,
          "invalidation_condition": "If price closes below $3,870 on 3-minute candle or RSI(7) drops below 40"
        }
      ]
    },
    {
      "iteration": 54,
      "timestamp": "2025-10-25T20:00:00",
      "model": "anthropic",
      "raw_response": "# CHAIN OF THOUGHT\n\n## Current Position Analysis\n\n**ETH Position Review:**\n- Entry: $3,941.0, Current: $3,953.80 (+$12.80/coin)\n- Unrealized P&L: +$123.67 (+0.32%)\n- Position size: 11.42 ETH at 15x leverage\n- Profit target: $4,060.0 (+$106.20 from current)\n- Stop-loss: $3,880.0 (-$73.80 from current)\n- Invalidation: \"If price closes below $3,870 on 3-minute candle or RSI(7) drops below 40\"\n\n**Technical Analysis:**\n- Current price: $3,953.80 (well above $3,870 invalidation level)\n- RSI(7): 67.559 (above 40 threshold, healthy momentum)\n- RSI(14): 66.567 (no overbought concerns)\n- MACD: 34.054 (positive and rising, bullish)\n- Price above EMA20: $3,953.80 > $3,903.36 (bullish trend intact)\n- Recent price action: Recovering from brief dip, now at $3,953.80\n\n**Invalidation Check:**\n1. Price above $3,870? YES ($3,953.80 > $3,870) \u2713\n2. RSI(7) above 40? YES (67.559 > 40) \u2713\n3. Stop-loss hit? NO ($3,953.80 > $3,880.0) \u2713\n4. Profit target hit? NO ($3,953.80 < $4,060.0) \u2713\n\n**Decision: HOLD ETH**\n- No invalidation conditions met\n- Technical indicators remain bullish\n- Price trending toward profit target\n- Risk/reward still favorable\n\n## Other Coins Assessment\n\n**BTC:** Strong momentum (RSI 72.7, price $111,683 above EMA20 $110,460), but already have ETH exposure. Not adding new position to avoid over-concentration.\n\n**SOL:** Moderate momentum (RSI 59.5), but consolidating. No clear setup.\n\n**BNB:** Neutral momentum (RSI 57.6), MACD declining. No compelling entry.\n\n**XRP:** Extremely overbought (RSI(7) 83.9, RSI(14) 87.4), price $2.59 vs EMA20 $2.49. Too extended for entry - high risk of pullback.\n\n**DOGE:** Weak momentum (RSI 43.5), price barely above EMA20. No clear directional bias.\n\n**Portfolio Management:**\n- Current account value: $15,031.52 (+50.32% return)\n- Available cash: $11,897.68\n- Single ETH position allows for diversification if better setups emerge\n- Not forcing trades - waiting for quality setups\n\n# TRADING DECISIONS\n\n```json\n{\n  \"ETH\": {\n    \"trade_signal_args\": {\n      \"coin\": \"ETH\",\n      \"signal\": \"hold\",\n      \"quantity\": 11.42,\n      \"profit_target\": 4060.0,\n      \"stop_loss\": 3880.0,\n      \"invalidation_condition\": \"If price closes below $3,870 on 3-minute candle or RSI(7) drops below 40\",\n      \"leverage\": 15,\n      \"confidence\": 0.72,\n      \"risk_usd\": 3000.0\n    }\n  }\n}\n```",
      "signals": [
        {
          "coin": "ETH",
          "signal": "hold",
          "quantity": 11.42,
          "leverage": 15,
          "stop_loss": 3880.0,
          "profit_target": 4060.0,
          "confidence": 0.72,
          "risk_usd": 3000.0,
          "invalidation_condition": "If price closes below $3,870 on 3-minute candle or RSI(7) drops below 40"
        }
      ]
    },
    {
      "iteration": 55,
      "timestamp": "2025-10-26T00:00:00",
      "model": "anthropic",
      "raw_response": "# CHAIN OF THOUGHT\n\nReviewing my current position:\n\n**ETH Position Analysis:**\n- Entry: $3,941.00, Current: $3,931.30 (down $9.70, -0.25%)\n- Unrealized PnL: -$133.28\n- Leverage: 15x\n- Exit Plan: Profit target $4,060, Stop-loss $3,880\n- Invalidation Condition: \"If price closes below $3,870 on 3-minute candle or RSI(7) drops below 40\"\n\n**Checking Invalidation Condition:**\n- Current price: $3,931.30 (ABOVE $3,870 threshold \u2713)\n- Current RSI(7): 43.967 (ABOVE 40 threshold \u2713)\n- Previous candle closed at $3,953.80 (also above $3,870 \u2713)\n\n**Technical Analysis:**\n- RSI(7) dropped from 67.554 to 43.967 - sharp decline indicating selling pressure\n- RSI(14) at 54.803 - neutral territory\n- Price above EMA20 ($3,906.20) - still in uptrend\n- MACD declining from 33.807 to 31.825 - momentum weakening\n- Recent price action: peaked at $3,957.60, now pulling back to $3,931.30\n\n**Decision Rationale:**\nThe invalidation condition is NOT met. Price remains comfortably above $3,870 and RSI(7) is at 43.967, which is above the 40 threshold. While momentum is weakening, the position is still valid according to my exit plan. The pullback appears to be a normal retracement within the uptrend. Stop-loss at $3,880 provides adequate protection.\n\n**Other Coins Review:**\n- **BTC**: Strong price at $111,271 but RSI(7) dropped sharply to 44.918. No position, not entering.\n- **SOL**: Price at $192.91, consolidating. RSI(7) at 48.349. No strong signal.\n- **BNB**: Price at $1,116.60, RSI(7) at 58.942. Moderate momentum but no compelling setup.\n- **XRP**: Price at $2.60, RSI(7) at 85.824 - EXTREMELY overbought. Dangerous to enter here.\n- **DOGE**: Price at $0.1949, RSI(7) at 27.751 - oversold but weak trend. Avoiding.\n\n**Risk Management:**\n- Current account value: $14,757.44\n- Available cash: $11,897.68\n- ETH position size: $44,895.45 notional (leveraged)\n- Portfolio performing well with 47.57% return and Sharpe ratio of 11.506\n- Maintaining discipline with existing exit plan\n\n# TRADING DECISIONS\n\n```json\n{\n  \"ETH\": {\n    \"trade_signal_args\": {\n      \"coin\": \"ETH\",\n      \"signal\": \"hold\",\n      \"quantity\": 11.42,\n      \"profit_target\": 4060.0,\n      \"stop_loss\": 3880.0,\n      \"invalidation_condition\": \"If price closes below $3,870 on 3-minute candle or RSI(7) drops below 40\",\n      \"leverage\": 15,\n      \"confidence\": 0.72,\n      \"risk_usd\": 3000.0\n    }\n  }\n}\n```",
      "signals": [
        {
          "coin": "ETH",
          "signal": "hold",
          "quantity": 11.42,
          "leverage": 15,
          "stop_loss": 3880.0,
          "profit_target": 4060.0,
          "confidence": 0.72,
          "risk_usd": 3000.0,
          "invalidation_condition": "If price closes below $3,870 on 3-minute candle or RSI(7) drops below 40"
        }
      ]
    },
    {
      "iteration": 56,
      "timestamp": "2025-10-26T04:00:00",
      "model": "anthropic",
      "raw_response": "# CHAIN OF THOUGHT\n\n## Current Position Analysis\n\n**ETH Position Review:**\n- Entry: $3,941.0, Current: $3,951.5 (+$10.5/share, +0.27%)\n- Unrealized PnL: +$97.41 (profitable)\n- Position size: 11.42 ETH with 15x leverage (~$45,126 notional)\n- Exit plan: Profit target $4,060, Stop-loss $3,880\n- Invalidation: \"If price closes below $3,870 on 3-minute candle or RSI(7) drops below 40\"\n\n**Checking Invalidation Conditions:**\n- Current price: $3,951.5 - well above $3,870 \u2713\n- RSI(7): 60.431 - above 40 threshold \u2713\n- Price action: Recent candles show [3931.30, 3951.50] - no close below $3,870 \u2713\n- **Invalidation NOT met - position remains valid**\n\n**Technical Analysis for ETH:**\n- Price above EMA20 ($3,951.5 > $3,913.42) - bullish \u2713\n- MACD: 27.669 - positive and stable\n- RSI(7): 60.431 - healthy mid-range, not overbought\n- RSI(14): 61.367 - confirming moderate bullish momentum\n- Recent price action: Recovered from dip to $3,931.30, now at $3,951.50\n- Distance to profit target: $108.5 away ($4,060)\n- Distance to stop-loss: $71.5 buffer ($3,880)\n\n**Risk Assessment:**\n- Stop-loss buffer adequate at $71.5 per share\n- No signs of bearish reversal\n- Volume lower than average but price holding well\n- Position is profitable and trending toward profit target\n\n**Other Coins - No Positions:**\n- **BTC**: Strong uptrend (RSI 65.5, above EMA), but already have ETH exposure - no entry\n- **SOL**: Consolidating around $193-194, RSI 58.6 - neutral, no strong signal\n- **BNB**: Recovering (RSI 68), but just broke above resistance - too late for entry\n- **XRP**: Extremely overbought (RSI 90.99!) - dangerous to enter, likely pullback coming\n- **DOGE**: Neutral (RSI 52.9), choppy price action - no clear setup\n\n**Decision:**\nETH position is healthy with no invalidation triggers met. Price is above entry, technicals remain bullish, and we're moving toward profit target. The position has adequate stop-loss protection and shows positive momentum. Will HOLD and let the trade work toward the $4,060 target.\n\n# TRADING DECISIONS\n\n```json\n{\n  \"ETH\": {\n    \"trade_signal_args\": {\n      \"coin\": \"ETH\",\n      \"signal\": \"hold\",\n      \"quantity\": 11.42,\n      \"profit_target\": 4060.0,\n      \"stop_loss\": 3880.0,\n      \"invalidation_condition\": \"If price closes below $3,870 on 3-minute candle or RSI(7) drops below 40\",\n      \"leverage\": 15,\n      \"confidence\": 0.72,\n      \"risk_usd\": 3000.0\n    }\n  }\n}\n```",
      "signals": [
        {
          "coin": "ETH",
          "signal": "hold",
          "quantity": 11.42,
          "leverage": 15,
          "stop_loss": 3880.0,
          "profit_target": 4060.0,
          "confidence": 0.72,
          "risk_usd": 3000.0,
          "invalidation_condition": "If price closes below $3,870 on 3-minute candle or RSI(7) drops below 40"
        }
      ]
    },
    {
      "iteration": 57,
      "timestamp": "2025-10-26T08:00:00",
      "model": "anthropic",
      "raw_response": "# CHAIN OF THOUGHT\n\n## Current Position Analysis\n\n**ETH Position Review:**\n- Entry: $3,941.00 | Current: $4,045.20 | Unrealized P&L: +$1,167.46 (+2.64%)\n- Profit Target: $4,060.00 (only $14.80 away - 0.36%)\n- Stop Loss: $3,880.00 (safe distance)\n- Invalidation: \"If price closes below $3,870 on 3-minute candle or RSI(7) drops below 40\"\n- Current RSI(7): 85.973 (well above 40)\n- Current price $4,045.20 is well above $3,870 invalidation level\n- Leverage: 15x | Notional: $46,196\n\n**Technical Analysis:**\n- RSI(7): 85.973 - EXTREMELY overbought (above 85)\n- RSI(14): 78.587 - Also overbought\n- MACD: 25.097 - Strong positive momentum\n- Price above EMA20: $4,045.20 vs $3,933.26 (+2.85%)\n- Last candle shows strong bullish surge from $3,951.50 to $4,045.20 (+$93.70)\n\n**Decision Rationale:**\nThe position is only $14.80 away from the profit target of $4,060. However, RSI(7) at 85.973 indicates extreme overbought conditions, which typically precede pullbacks. With 15x leverage, even a small reversal could quickly erase gains. The smart move is to **TAKE PROFITS NOW** at $4,045.20 rather than risk a reversal. We've achieved a +2.64% gain on 15x leverage, which is excellent risk-adjusted return.\n\nThe invalidation condition is NOT met (price above $3,870, RSI above 40), but with RSI this extreme and profit target nearly reached, prudent risk management dictates securing profits.\n\n## Other Coins Analysis\n\n**BTC:** RSI(7) 86.757 - Extremely overbought. Price surged to $113,309. Strong momentum but overextended.\n\n**XRP:** RSI(7) 94.001 - DANGEROUSLY overbought. This is unsustainable.\n\n**SOL:** RSI(7) 81.663 - Overbought but less extreme.\n\n**BNB:** RSI(7) 86.271 - Extremely overbought.\n\n**DOGE:** RSI(7) 80.480 - Overbought.\n\n**Market Assessment:** Entire market is extremely overbought across all major coins. This suggests a coordinated rally that's reaching exhaustion. Not entering new positions in these conditions - high probability of near-term pullback.\n\n# TRADING DECISIONS\n\n```json\n{\n  \"ETH\": {\n    \"trade_signal_args\": {\n      \"coin\": \"ETH\",\n      \"signal\": \"close_position\",\n      \"quantity\": 11.42,\n      \"profit_target\": 4060.0,\n      \"stop_loss\": 3880.0,\n      \"invalidation_condition\": \"If price closes below $3,870 on 3-minute candle or RSI(7) drops below 40\",\n      \"leverage\": 15,\n      \"confidence\": 0.72,\n      \"risk_usd\": 3000.0,\n      \"close_reason\": \"Taking profits - price within $14.80 of profit target ($4,060) with RSI(7) at extreme overbought level of 85.973. Prudent risk management with 15x leverage to lock in +$1,167 gain before potential reversal from overbought conditions.\"\n    }\n  }\n}\n```",
      "signals": [
        {
          "coin": "ETH",
          "signal": "close_position",
          "quantity": 11.42,
          "leverage": 15,
          "stop_loss": 3880.0,
          "profit_target": 4060.0,
          "confidence": 0.72,
          "risk_usd": 3000.0,
          "invalidation_condition": "If price closes below $3,870 on 3-minute candle or RSI(7) drops below 40"
        }
      ]
    },
    {
      "iteration": 58,
      "timestamp": "2025-10-26T12:00:00",
      "model": "anthropic",
      "raw_response": "# CHAIN OF THOUGHT\n\n## Current Portfolio Status\n- No open positions\n- Available cash: $16,042.46\n- Total return: 60.42% (excellent performance)\n- Sharpe ratio: 12.624 (outstanding risk-adjusted returns)\n\n## Market Analysis\n\n### BTC Analysis\n- Current: $113,734 vs EMA20: $111,346 (+2.1% above)\n- RSI(7): 89.197 - EXTREMELY overbought\n- RSI(14): 83.616 - Very overbought\n- MACD: 814.157 - Strong bullish momentum but accelerating fast\n- Price action: Explosive move from $111,057 to $113,734 in 30 minutes (+2.4%)\n- **Assessment**: Parabolic move, extreme RSI levels suggest imminent pullback. Too risky to enter at these levels.\n\n### ETH Analysis\n- Current: $4,074.90 vs EMA20: $3,944.59 (+3.3% above)\n- RSI(7): 89.029 - EXTREMELY overbought\n- RSI(14): 82.112 - Very overbought\n- MACD: 36.064 - Strong positive momentum\n- Price action: Sharp rally from $3,921 to $4,074 (+3.9%)\n- **Assessment**: Similar to BTC - extreme overbought conditions. High risk of reversal.\n\n### SOL Analysis\n- Current: $199.44 vs EMA20: $193.15 (+3.3% above)\n- RSI(7): 85.982 - Extremely overbought\n- RSI(14): 78.775 - Overbought\n- MACD: 1.958 - Positive momentum\n- Price action: Rally from $191.76 to $199.44 (+4.0%)\n- **Assessment**: Overbought but slightly less extreme than BTC/ETH.\n\n### BNB Analysis\n- Current: $1,133.50 vs EMA20: $1,116.18 (+1.6% above)\n- RSI(7): 80.030 - Overbought\n- RSI(14): 70.157 - Moderately overbought\n- MACD: 6.398 - Positive momentum\n- Price action: Rally from $1,108 to $1,135 (+2.4%)\n- **Assessment**: Less extended than others, more sustainable momentum.\n\n### XRP Analysis\n- Current: $2.64 vs EMA20: $2.54 (+3.9% above)\n- RSI(7): 84.599 - Extremely overbought\n- RSI(14): 88.490 - EXTREMELY overbought\n- MACD: 0.061 - Positive momentum\n- Price action: Strong rally from $2.54 to $2.65 (+4.3%)\n- **Assessment**: Very overbought, high risk.\n\n### DOGE Analysis\n- Current: $0.202990 vs EMA20: $0.197078 (+3.0% above)\n- RSI(7): 83.575 - Extremely overbought\n- RSI(14): 76.363 - Overbought\n- MACD: 0.001 - Positive but weak\n- Price action: Rally from $0.194900 to $0.202990 (+4.1%)\n- **Assessment**: Overbought with weaker momentum structure.\n\n## Trading Decision Rationale\n\n**RISK MANAGEMENT CONSIDERATION**: All major coins are showing extreme overbought conditions (RSI 7-period > 80). This is a classic blow-off top scenario where entering long positions carries very high risk of immediate reversal.\n\n**Strategy**: With 60.42% returns already secured and no open positions, the prudent approach is to wait for:\n1. RSI cooling off to <70 levels\n2. Healthy pullback to EMA20 levels\n3. More sustainable entry points\n\n**Why not enter now?**\n- RSI(7) readings of 85-89 across the board indicate exhaustion\n- Sharp vertical moves suggest panic buying, not sustainable trends\n- Risk/reward is poor - minimal upside, significant downside risk\n- Protecting capital and existing gains is paramount\n\nGiven the extreme overbought conditions across all assets, I will NOT open any new positions at this time. This is a disciplined risk management decision to preserve the excellent 60.42% gains already achieved.\n\n# TRADING DECISIONS\n\n{}",
      "signals": []
    },
    {
      "iteration": 59,
      "timestamp": "2025-10-26T16:00:00",
      "model": "anthropic",
      "raw_response": "# CHAIN OF THOUGHT\n\n## Current Portfolio Status\n- No open positions\n- Available cash: $16,042.46\n- Total return: 60.42%\n- Sharpe ratio: 12.624 (excellent risk-adjusted performance)\n\n## Market Analysis\n\n**BTC Analysis:**\n- Current: $113,637 vs EMA20: $111,651 (+1.78%)\n- Strong uptrend: Price well above EMA20, MACD positive (778.26)\n- RSI(7): 84.4 - severely overbought territory\n- RSI(14): 80.7 - also overbought\n- Recent spike from $111,271 to $113,734 in minutes\n- Concern: Extreme overbought conditions suggest potential pullback imminent\n- Decision: PASS - Too risky to enter at these overbought levels\n\n**ETH Analysis:**\n- Current: $4,067.30 vs EMA20: $3,958.17 (+2.76%)\n- Strong momentum: MACD positive (38.75), trending up\n- RSI(7): 82.9 - overbought but not extreme\n- RSI(14): 78.6 - overbought\n- Similar to BTC, just spiked from $3,931 to $4,074\n- Concern: Overbought but showing relative strength\n- Decision: PASS - Wait for pullback or consolidation\n\n**SOL Analysis:**\n- Current: $198.79 vs EMA20: $194.11 (+2.41%)\n- RSI(7): 76.5 - overbought but cooling from 85.9\n- RSI(14): 73.1 - moderate overbought\n- MACD: 1.606, positive and increasing\n- Volume: 282k vs avg 472k (lower volume on move up)\n- Recent spike from $192.91 to $199.44\n- Concern: Lower volume on rally, overbought conditions\n- Decision: PASS - Need confirmation\n\n**BNB Analysis:**\n- Current: $1,126.20 vs EMA20: $1,122 (+0.37%)\n- RSI(7): 54.6 - NEUTRAL (best RSI reading of all coins)\n- RSI(14): 55.8 - neutral\n- MACD: -0.046 - nearly neutral, turning positive\n- Recent spike from $1,108 to $1,135, now pulling back\n- Price consolidating after spike\n- Decision: POTENTIAL ENTRY - Most balanced technical setup\n\n**XRP Analysis:**\n- Current: $2.61 vs EMA20: $2.55 (+2.35%)\n- RSI(7): 51.9 - NEUTRAL (dropped sharply from 94.1)\n- RSI(14): 68.3 - moderate\n- MACD: 0.056, positive\n- Recent sharp drop from $2.65 to $2.61 (RSI cooling off)\n- Strong uptrend but healthy pullback occurring\n- Decision: POTENTIAL ENTRY - RSI reset provides opportunity\n\n**DOGE Analysis:**\n- Current: $0.20176 vs EMA20: $0.19781 (+2.0%)\n- RSI(7): 69.1 - moderate, cooling from 83.5\n- RSI(14): 67.5 - moderate\n- MACD: 0.001, positive\n- Volume: 8.99M vs avg 14.09M (low volume)\n- Decision: PASS - Lower volume, prefer other setups\n\n## Risk Management Considerations\n- Portfolio performing excellently (60% return, high Sharpe)\n- Should be selective with entries at these elevated market levels\n- Most coins showing overbought conditions after recent rallies\n- XRP and BNB showing healthiest technical setups with RSI reset\n\n## Trading Decision\nGiven the overall overbought market conditions, I will take ONE selective entry on XRP, which shows:\n1. Healthy RSI pullback from extreme levels (94\u219252)\n2. Still in strong uptrend (above EMA20)\n3. MACD positive\n4. Good risk/reward at current levels\n\nConservative position sizing due to elevated market conditions overall.\n\n# TRADING DECISIONS\n\n```json\n{\n  \"XRP\": {\n    \"trade_signal_args\": {\n      \"coin\": \"XRP\",\n      \"signal\": \"buy\",\n      \"quantity\": 3800,\n      \"profit_target\": 2.78,\n      \"stop_loss\": 2.52,\n      \"invalidation_condition\": \"If price closes below $2.52 (below EMA20 support) on 3-minute candle\",\n      \"leverage\": 15,\n      \"confidence\": 0.72,\n      \"risk_usd\": 513.00\n    }\n  }\n}\n```",
      "signals": [
        {
          "coin": "XRP",
          "signal": "buy",
          "quantity": 3800.0,
          "leverage": 15,
          "stop_loss": 2.52,
          "profit_target": 2.78,
          "confidence": 0.72,
          "risk_usd": 513.0,
          "invalidation_condition": "If price closes below $2.52 (below EMA20 support) on 3-minute candle"
        }
      ]
    },
    {
      "iteration": 60,
      "timestamp": "2025-10-26T20:00:00",
      "model": "anthropic",
      "raw_response": "# CHAIN OF THOUGHT\n\n## Current Position Analysis\n\n**XRP Position Review:**\n- Entry: $2.6132, Current: $2.6457\n- Unrealized P&L: +$118.53 (+1.24%)\n- Stop-loss: $2.52, Profit target: $2.78\n- Invalidation condition: \"If price closes below $2.52 (below EMA20 support) on 3-minute candle\"\n\n**Technical Analysis:**\n- Current price: $2.65 vs EMA20: $2.56 \u2192 Price is +3.5% above EMA20 (strong bullish position)\n- RSI (7-period): 70.165 \u2192 Approaching overbought but not extreme\n- RSI (14-period): 75.878 \u2192 Elevated but sustainable\n- MACD: 0.057 \u2192 Positive and rising\n- Price action: Recent candles show $2.56 \u2192 $2.60 \u2192 $2.65, clear uptrend\n- Volume: 9.36M vs avg 5.18M \u2192 +81% above average (strong participation)\n\n**Invalidation Check:**\n- Invalidation level: Below $2.52\n- Current price: $2.65\n- EMA20: $2.56\n- Latest candle low appears to be around $2.61 (based on the price series)\n- **Invalidation condition NOT met** - price remains well above $2.52 and above EMA20\n\n**Risk Assessment:**\n- Position is +$118.53 in profit\n- Stop-loss at $2.52 is $0.1357 away (-5.2% from current)\n- Profit target at $2.78 is $0.1243 away (+4.7% from current)\n- Risk/reward remains favorable\n- Strong momentum with all indicators pointing up\n\n**Decision: HOLD**\nThe XRP position continues to perform well with strong technicals. Price is trending above EMA20 with good volume support. RSI is elevated but not at extreme levels that would suggest an imminent reversal. The invalidation condition has not been triggered, and the trade setup remains valid. Will maintain position and let it run toward the $2.78 profit target.\n\n## Other Market Opportunities\n\n**BTC Analysis:**\n- Current: $114,601, EMA20: $111,976\n- RSI (7): 90.863 \u2192 EXTREMELY overbought\n- RSI (14): 85.796 \u2192 Very overbought\n- Strong momentum but at dangerous overbought levels\n- **Decision: NO TRADE** - Too late to enter, extreme RSI suggests pullback risk\n\n**ETH Analysis:**\n- Current: $4,160.40, EMA20: $3,975.04\n- RSI (7): 91.977 \u2192 EXTREMELY overbought\n- RSI (14): 86.920 \u2192 Very overbought\n- Similar to BTC, too extended\n- **Decision: NO TRADE** - Risk of reversal too high\n\n**SOL, BNB, DOGE:**\n- All showing elevated RSI levels (76-82 range on 7-period)\n- Already had significant moves\n- **Decision: NO TRADE** - Not entering at these elevated levels\n\n# TRADING DECISIONS\n\n```json\n{\n  \"XRP\": {\n    \"trade_signal_args\": {\n      \"coin\": \"XRP\",\n      \"signal\": \"hold\",\n      \"quantity\": 3800.0,\n      \"profit_target\": 2.78,\n      \"stop_loss\": 2.52,\n      \"invalidation_condition\": \"If price closes below $2.52 (below EMA20 support) on 3-minute candle\",\n      \"leverage\": 15,\n      \"confidence\": 0.72,\n      \"risk_usd\": 513.0\n    }\n  }\n}\n```",
      "signals": [
        {
          "coin": "XRP",
          "signal": "hold",
          "quantity": 3800.0,
          "leverage": 15,
          "stop_loss": 2.52,
          "profit_target": 2.78,
          "confidence": 0.72,
          "risk_usd": 513.0,
          "invalidation_condition": "If price closes below $2.52 (below EMA20 support) on 3-minute candle"
        }
      ]
    },
    {
      "iteration": 61,
      "timestamp": "2025-10-27T00:00:00",
      "model": "anthropic",
      "raw_response": "# CHAIN OF THOUGHT\n\n## Current Position Analysis\n\n**XRP Position Review:**\n- Entry: $2.6132, Current: $2.6345\n- Unrealized P&L: +$75.97 (+0.81%)\n- Stop-loss: $2.52, Profit target: $2.78\n- Invalidation condition: \"If price closes below $2.52 (below EMA20 support) on 3-minute candle\"\n\n**Technical Analysis:**\n- Current price: $2.63 vs EMA20: $2.56 \u2713 (Above support)\n- RSI(7): 59.8 (neutral, down from extreme overbought levels)\n- RSI(14): 69.8 (still elevated but cooling)\n- MACD: 0.058 (positive but weakening from 0.061)\n- Price action: Recent pullback from $2.65 high to $2.63\n\n**Invalidation Check:**\n- Current price $2.63 is ABOVE the invalidation level of $2.52\n- Current price is ABOVE EMA20 at $2.56\n- Stop-loss at $2.52 has NOT been hit\n- Invalidation condition is NOT met \u2713\n\n**Market Context:**\n- XRP showing consolidation after strong rally\n- RSI cooling from extreme overbought (was 100, now 59.8)\n- Still in uptrend with price above EMA20\n- Volume: 4.7M vs average 4.9M (slightly below average)\n\n**Decision:** HOLD\n- No invalidation conditions met\n- Price maintaining above key support levels\n- Stop-loss provides adequate downside protection\n- Profit target at $2.78 still reasonable (+5.7% from current)\n- Position showing modest profit, no reason to exit prematurely\n\n## Other Coins Assessment\n\n**BTC:** RSI(7) at 92.8 - extremely overbought, price at $115,050 vs EMA20 $112,246. Parabolic move but no position to manage. Not entering at these extreme levels.\n\n**ETH:** RSI(7) at 94.0 - extremely overbought, similar to BTC. Massive rally but too extended for new entry.\n\n**SOL:** RSI(7) at 90.9 - extremely overbought. Strong momentum but overextended.\n\n**BNB:** RSI(7) at 83.3 - overbought but less extreme. Still not attractive for new entry.\n\n**DOGE:** RSI(7) at 84.7 - overbought. Recent rally but no compelling setup.\n\nAll major coins showing extreme overbought conditions on short-term RSI. Market appears due for consolidation/pullback. Not initiating new positions in this environment.\n\n# TRADING DECISIONS\n\n```json\n{\n  \"XRP\": {\n    \"trade_signal_args\": {\n      \"coin\": \"XRP\",\n      \"signal\": \"hold\",\n      \"quantity\": 3800.0,\n      \"profit_target\": 2.78,\n      \"stop_loss\": 2.52,\n      \"invalidation_condition\": \"If price closes below $2.52 (below EMA20 support) on 3-minute candle\",\n      \"leverage\": 15,\n      \"confidence\": 0.72,\n      \"risk_usd\": 513.0\n    }\n  }\n}\n```",
      "signals": [
        {
          "coin": "XRP",
          "signal": "hold",
          "quantity": 3800.0,
          "leverage": 15,
          "stop_loss": 2.52,
          "profit_target": 2.78,
          "confidence": 0.72,
          "risk_usd": 513.0,
          "invalidation_condition": "If price closes below $2.52 (below EMA20 support) on 3-minute candle"
        }
      ]
    },
    {
      "iteration": 62,
      "timestamp": "2025-10-27T04:00:00",
      "model": "anthropic",
      "raw_response": "# CHAIN OF THOUGHT\n\nReviewing my current position and market conditions:\n\n## XRP Position Analysis\n- **Entry**: $2.6132, **Current**: $2.6293 (+0.62%)\n- **Unrealized P&L**: +$56.21 (positive)\n- **Leverage**: 15x (high risk)\n- **Stop-loss**: $2.52, **Profit target**: $2.78\n- **Invalidation condition**: \"If price closes below $2.52 (below EMA20 support) on 3-minute candle\"\n\n**Technical Analysis**:\n- Current price: $2.63\n- EMA20: $2.57 (price well above, +2.3%)\n- RSI (7-period): 54.74 (neutral, down from overbought levels)\n- RSI (14-period): 66.46 (still elevated but cooling)\n- MACD: 0.054 (positive but weakening from recent highs)\n- Recent price action: Peaked at $2.65, now consolidating at $2.63\n\n**Key Observations**:\n1. Price is ABOVE the EMA20 ($2.57), so invalidation condition NOT met\n2. Price is ABOVE stop-loss ($2.52) by $0.11 (4.2% buffer)\n3. RSI cooling from extreme overbought (was 100, now 54.74) - healthy pullback\n4. MACD still positive but declining - momentum slowing\n5. Price consolidated after the spike, showing indecision\n6. Still $0.15 away from profit target ($2.78)\n\n**Risk Assessment**:\n- Position is slightly profitable (+$56)\n- 15x leverage means high sensitivity to moves\n- RSI cooldown is healthy, not bearish\n- Price holding above key support levels\n- No invalidation condition triggered\n\n**Decision**: **HOLD** - The invalidation condition is clearly NOT met (price is above $2.52 and above EMA20). While momentum is cooling, this is a healthy consolidation after a strong move. The technical structure remains intact with price above all key support levels. With 15x leverage, I need to see clear invalidation before exiting.\n\n## Other Coins Analysis\n**BTC, ETH, SOL, BNB, DOGE**: No positions. While all showing strong momentum (extremely overbought RSIs: BTC 94.5, ETH 92.4), I cannot add to my existing XRP position (no pyramiding), and opening new positions at these extended levels with RSI >90 would be chasing. Better to manage my current position.\n\n# TRADING DECISIONS\n\n```json\n{\n  \"XRP\": {\n    \"trade_signal_args\": {\n      \"coin\": \"XRP\",\n      \"signal\": \"hold\",\n      \"quantity\": 3800.0,\n      \"profit_target\": 2.78,\n      \"stop_loss\": 2.52,\n      \"invalidation_condition\": \"If price closes below $2.52 (below EMA20 support) on 3-minute candle\",\n      \"leverage\": 15,\n      \"confidence\": 0.72,\n      \"risk_usd\": 513.0\n    }\n  }\n}\n```",
      "signals": [
        {
          "coin": "XRP",
          "signal": "hold",
          "quantity": 3800.0,
          "leverage": 15,
          "stop_loss": 2.52,
          "profit_target": 2.78,
          "confidence": 0.72,
          "risk_usd": 513.0,
          "invalidation_condition": "If price closes below $2.52 (below EMA20 support) on 3-minute candle"
        }
      ]
    },
    {
      "iteration": 63,
      "timestamp": "2025-10-27T08:00:00",
      "model": "anthropic",
      "raw_response": "# CHAIN OF THOUGHT\n\nReviewing my current position:\n\n**XRP Position Analysis:**\n- Entry: $2.6132, Current: $2.6253\n- Unrealized P&L: +$41.01 (+0.46% gain)\n- Profit Target: $2.78, Stop-Loss: $2.52\n- Invalidation Condition: \"If price closes below $2.52 (below EMA20 support) on 3-minute candle\"\n\nTechnical Analysis:\n- Current price: $2.63 vs EMA20: $2.58 \u2192 Still above EMA20 support \u2713\n- RSI (7-period): 50.243 \u2192 Neutral, down from overbought levels\n- RSI (14-period): 63.136 \u2192 Healthy pullback from 94.447\n- MACD: 0.046 \u2192 Still positive but declining from 0.050\n- Price action: Recent consolidation around $2.63 after peak at $2.65\n\n**Invalidation Check:**\n- Current price $2.63 is ABOVE the invalidation level of $2.52\n- Price is ABOVE EMA20 ($2.58)\n- Invalidation condition is NOT met \u2713\n\n**Market Context:**\n- XRP showing healthy consolidation after strong rally\n- RSI cooled from extreme overbought (94.4) to neutral (50.2)\n- Price holding above key support at EMA20\n- Stop-loss at $2.52 provides ~4.2% cushion\n- Profit target at $2.78 offers ~5.7% upside potential\n\n**Decision: HOLD**\n- No invalidation conditions triggered\n- Price maintaining above technical support\n- Healthy RSI pullback suggests potential for continuation\n- Risk/reward remains favorable with stop-loss intact\n\n**Other Coins Assessment:**\n- BTC: RSI 84.6 extremely overbought, but no position\n- ETH: RSI 65.8 cooling from overbought, but no position  \n- SOL: RSI 51.3 neutral after pullback, but no position\n- BNB: RSI 93.1 extremely overbought, too risky for new entry\n- DOGE: RSI 47.7 neutral, but no compelling setup\n\nNo new positions warranted given current market conditions and existing XRP exposure.\n\n# TRADING DECISIONS\n\n```json\n{\n  \"XRP\": {\n    \"trade_signal_args\": {\n      \"coin\": \"XRP\",\n      \"signal\": \"hold\",\n      \"quantity\": 3800.0,\n      \"profit_target\": 2.78,\n      \"stop_loss\": 2.52,\n      \"invalidation_condition\": \"If price closes below $2.52 (below EMA20 support) on 3-minute candle\",\n      \"leverage\": 15,\n      \"confidence\": 0.72,\n      \"risk_usd\": 513.0\n    }\n  }\n}\n```",
      "signals": [
        {
          "coin": "XRP",
          "signal": "hold",
          "quantity": 3800.0,
          "leverage": 15,
          "stop_loss": 2.52,
          "profit_target": 2.78,
          "confidence": 0.72,
          "risk_usd": 513.0,
          "invalidation_condition": "If price closes below $2.52 (below EMA20 support) on 3-minute candle"
        }
      ]
    },
    {
      "iteration": 64,
      "timestamp": "2025-10-27T12:00:00",
      "model": "anthropic",
      "raw_response": "# CHAIN OF THOUGHT\n\n## Current Position Analysis\n\n### XRP Position Review\n- **Entry**: $2.6132, **Current**: $2.6601\n- **Unrealized P&L**: +$173.25 (+1.79% gain)\n- **Leverage**: 15x\n- **Exit Plan**: Profit target $2.78, Stop-loss $2.52\n- **Invalidation Condition**: \"If price closes below $2.52 (below EMA20 support) on 3-minute candle\"\n\n**Technical Analysis**:\n- Current price: $2.66 vs EMA20: $2.59 \u2713 (above support)\n- RSI (7-period): 74.125 (overbought but not extreme)\n- RSI (14-period): 73.285 (overbought)\n- MACD: 0.044 (positive and stable)\n- Price action: Trading well above EMA20 support at $2.59\n- Recent price movement: $2.63 \u2192 $2.66 (upward momentum maintained)\n\n**Invalidation Check**:\n- Current price $2.66 is WELL ABOVE the invalidation level of $2.52\n- EMA20 at $2.59 provides solid support\n- No bearish candle close below $2.52\n- **Invalidation condition NOT met** \u2713\n\n**Risk Assessment**:\n- Position is in profit (+$173)\n- Stop-loss at $2.52 is appropriately placed below EMA20\n- Profit target at $2.78 is reasonable (+6.4% from current)\n- RSI shows overbought conditions but momentum remains positive\n- MACD positive and holding steady\n\n**Decision**: **HOLD** - The position is performing well with solid technical support. Price remains above EMA20, invalidation condition not triggered, and momentum indicators remain constructive despite overbought RSI. The uptrend is intact with price consolidating near recent highs.\n\n### Other Coins Assessment\n\n**BTC**: \n- Strong uptrend (price $114,992 vs EMA20 $113,159)\n- RSI cooling from extreme overbought (94) to 65.8 (healthy)\n- MACD strong at 1077\n- However, recent pullback from $115,566 to $114,992\n- No position currently - would need fresh setup to enter\n\n**ETH**:\n- Similar strong uptrend (price $4,173 vs EMA20 $4,054)\n- RSI at 69 (slightly overbought but manageable)\n- MACD positive at 62.5\n- Recent slight pullback from $4,206\n- No position - not entering on potential pullback\n\n**SOL**:\n- Price $200.10 vs EMA20 $197.08 (above but losing momentum)\n- RSI dropped to 50.7 (neutral)\n- Recent rejection from $204.39\n- Momentum weakening - not attractive for entry\n\n**BNB**:\n- Sharp pullback: $1,180 \u2192 $1,143 (recent candle)\n- RSI crashed from 93 to 45.6 (bearish reversal)\n- Despite MACD still positive, momentum broken\n- Not entering on breakdown\n\n**DOGE**:\n- Pullback from $0.2068 to $0.2028\n- RSI at 45.3 (neutral/weak)\n- MACD barely positive\n- Momentum fading - not attractive\n\n**Conclusion**: Only XRP position to manage. Market showing some consolidation/pullback across alts after strong rally. XRP holding up best relative to its support levels.\n\n# TRADING DECISIONS\n\n```json\n{\n  \"XRP\": {\n    \"trade_signal_args\": {\n      \"coin\": \"XRP\",\n      \"signal\": \"hold\",\n      \"quantity\": 3800.0,\n      \"profit_target\": 2.78,\n      \"stop_loss\": 2.52,\n      \"invalidation_condition\": \"If price closes below $2.52 (below EMA20 support) on 3-minute candle\",\n      \"leverage\": 15,\n      \"confidence\": 0.72,\n      \"risk_usd\": 513.0\n    }\n  }\n}\n```",
      "signals": [
        {
          "coin": "XRP",
          "signal": "hold",
          "quantity": 3800.0,
          "leverage": 15,
          "stop_loss": 2.52,
          "profit_target": 2.78,
          "confidence": 0.72,
          "risk_usd": 513.0,
          "invalidation_condition": "If price closes below $2.52 (below EMA20 support) on 3-minute candle"
        }
      ]
    },
    {
      "iteration": 65,
      "timestamp": "2025-10-27T16:00:00",
      "model": "anthropic",
      "raw_response": "# CHAIN OF THOUGHT\n\nReviewing my current XRP position:\n\n**XRP Analysis:**\n- Entry: $2.6132, Current: $2.6676 (+2.08%)\n- Unrealized P&L: +$201.75 (+1.99% of notional)\n- Position: 3,800 units at 15x leverage\n- Exit Plan: Profit Target $2.78, Stop-Loss $2.52\n- Invalidation: \"If price closes below $2.52 (below EMA20 support) on 3-minute candle\"\n\n**Technical Assessment:**\n- Current EMA20: $2.60 (price well above at $2.6676)\n- RSI (7-period): 77.23 (overbought territory but still strong)\n- RSI (14-period): 74.71 (confirming overbought)\n- MACD: 0.040 (positive and stable)\n- Price action: Recent strength from $2.61 to $2.67, showing momentum\n- Volume: 10.8M vs average 6.0M (significantly elevated - bullish)\n\n**Invalidation Check:**\n- Current price $2.6676 is ABOVE the $2.52 invalidation level\n- Current price is ABOVE EMA20 at $2.60\n- Stop-loss at $2.52 has NOT been hit\n- Invalidation condition is NOT met\n\n**Decision Rationale:**\nThe XRP position remains healthy. Despite overbought RSI levels (77.23), the price continues to show strength with:\n1. Strong volume support (180% of average)\n2. Price maintaining above EMA20 ($2.60)\n3. Positive MACD momentum\n4. No bearish divergence visible\n5. Still $0.11 away from profit target ($2.78)\n\nThe overbought condition is a concern, but in strong trending markets, RSI can remain elevated. The invalidation condition is clear and has not been triggered. I will HOLD and let the position run toward the $2.78 profit target.\n\n**Other Coins Assessment:**\n- BTC: Strong uptrend (RSI 64.5, price above EMA), but already have XRP exposure\n- ETH: Very strong (RSI 75, +$134 above EMA), but portfolio concentration risk\n- SOL: Consolidating near highs, RSI cooling to 49.5 - neutral\n- BNB: Sharp pullback from $1180 to $1144, RSI 47 - bearish short-term\n- DOGE: Consolidating, RSI 47.6 - neutral\n\nGiven my current 62.53% return and healthy XRP position, I will not add new positions to avoid over-concentration and maintain risk discipline.\n\n# TRADING DECISIONS\n\n```json\n{\n  \"XRP\": {\n    \"trade_signal_args\": {\n      \"coin\": \"XRP\",\n      \"signal\": \"hold\",\n      \"quantity\": 3800.0,\n      \"profit_target\": 2.78,\n      \"stop_loss\": 2.52,\n      \"invalidation_condition\": \"If price closes below $2.52 (below EMA20 support) on 3-minute candle\",\n      \"leverage\": 15,\n      \"confidence\": 0.72,\n      \"risk_usd\": 513.0\n    }\n  }\n}\n```",
      "signals": [
        {
          "coin": "XRP",
          "signal": "hold",
          "quantity": 3800.0,
          "leverage": 15,
          "stop_loss": 2.52,
          "profit_target": 2.78,
          "confidence": 0.72,
          "risk_usd": 513.0,
          "invalidation_condition": "If price closes below $2.52 (below EMA20 support) on 3-minute candle"
        }
      ]
    },
    {
      "iteration": 66,
      "timestamp": "2025-10-27T20:00:00",
      "model": "anthropic",
      "raw_response": "# CHAIN OF THOUGHT\n\nReviewing my current position:\n\n**XRP Position Analysis:**\n- Entry: $2.6132, Current: $2.6326\n- Unrealized P&L: +$68.75 (+0.74% on position)\n- Stop-loss: $2.52, Profit target: $2.78\n- Invalidation condition: \"If price closes below $2.52 (below EMA20 support) on 3-minute candle\"\n\n**Technical Analysis:**\n- Current price: $2.63 vs EMA20: $2.61 (still above support \u2713)\n- RSI (7-period): 43.905 (neutral, down from 77.187 - showing weakness)\n- RSI (14-period): 54.480 (neutral)\n- MACD: 0.034 (positive but flat)\n- Recent price action: Dropped from $2.67 to $2.63 (last candle showed -1.5% decline)\n\n**Invalidation Check:**\n- Current price $2.63 is ABOVE the invalidation level of $2.52\n- Current price $2.63 is ABOVE EMA20 of $2.61\n- Invalidation condition is NOT met \u2713\n\n**Decision Rationale:**\nThe position is showing a small profit (+0.74%) and remains above both the stop-loss and invalidation levels. While RSI has cooled from overbought territory (good for sustainability), the recent sharp drop from $2.67 to $2.63 shows some weakness. However:\n1. Price remains above EMA20 support ($2.61)\n2. MACD remains positive\n3. Stop-loss at $2.52 provides adequate protection\n4. Invalidation condition has not been triggered\n\n**Decision: HOLD** - The position remains valid with proper risk management in place. The cooling RSI may actually be healthy for continuation. Will continue monitoring for invalidation below $2.52.\n\n**Other Coins:**\n- BTC, ETH, SOL, BNB, DOGE: No positions, not entering new trades at this time given the recent sharp pullbacks across the board (RSI dropped significantly on all coins in the last candle).\n\n# TRADING DECISIONS\n\n```json\n{\n  \"XRP\": {\n    \"trade_signal_args\": {\n      \"coin\": \"XRP\",\n      \"signal\": \"hold\",\n      \"quantity\": 3800.0,\n      \"profit_target\": 2.78,\n      \"stop_loss\": 2.52,\n      \"invalidation_condition\": \"If price closes below $2.52 (below EMA20 support) on 3-minute candle\",\n      \"leverage\": 15,\n      \"confidence\": 0.72,\n      \"risk_usd\": 513.0\n    }\n  }\n}\n```",
      "signals": [
        {
          "coin": "XRP",
          "signal": "hold",
          "quantity": 3800.0,
          "leverage": 15,
          "stop_loss": 2.52,
          "profit_target": 2.78,
          "confidence": 0.72,
          "risk_usd": 513.0,
          "invalidation_condition": "If price closes below $2.52 (below EMA20 support) on 3-minute candle"
        }
      ]
    },
    {
      "iteration": 67,
      "timestamp": "2025-10-28T00:00:00",
      "model": "anthropic",
      "raw_response": "# CHAIN OF THOUGHT\n\nReviewing my current position:\n\n**XRP Position Analysis:**\n- Entry: $2.6132, Current: $2.6299 (+0.64%)\n- Unrealized P&L: +$58.49 (+0.59% on notional)\n- Position size: 3,800 XRP at 15x leverage ($9,993.62 notional)\n- Stop-loss: $2.52, Profit target: $2.78\n- Invalidation condition: \"If price closes below $2.52 (below EMA20 support) on 3-minute candle\"\n\n**Technical Analysis:**\n- Current price: $2.63 vs EMA20: $2.61 \u2713 (Still above EMA20)\n- RSI (7-period): 41.996 - Neutral to slightly bearish (dropped from 77.155)\n- RSI (14-period): 52.907 - Neutral\n- MACD: 0.030 - Weakening momentum (declining from 0.034)\n- Price action: Recent weakness, dropped from $2.67 to $2.63\n\n**Invalidation Check:**\nThe invalidation condition states \"below $2.52 (below EMA20 support)\". Current price is $2.63 and EMA20 is $2.61. The price has NOT closed below $2.52, so invalidation condition is NOT met.\n\nHowever, I'm seeing concerning signs:\n- RSI dropped sharply from overbought (77) to 42 in two candles\n- Momentum weakening (MACD declining)\n- Price showing rejection from $2.67 highs\n- Trading just slightly above EMA20 support\n\n**Risk Management Consideration:**\nThe position is barely profitable (+0.59%) and showing signs of weakness. The RSI drop suggests momentum loss. While the invalidation condition is technically not met, the risk/reward is deteriorating. However, per my trading rules, I should hold unless invalidation is triggered or stop-loss/profit target is hit.\n\n**Decision: HOLD**\nThe invalidation condition has not been met (price has not closed below $2.52). Stop-loss at $2.52 is still valid. Will maintain position but monitor closely for any close below EMA20 support.\n\n**Other Coins:**\n- BTC: RSI dropped to 30 (oversold), but no position. After strong rally, now pulling back sharply.\n- ETH: RSI at 32 (oversold), similar pullback pattern. No position.\n- SOL: RSI 62, showing relative strength. No position.\n- BNB: RSI 40, neutral. No position.\n- DOGE: RSI 24 (very oversold), significant weakness. No position.\n\nGiven the broad market pullback (BTC, ETH, DOGE all showing oversold RSI), I'll maintain defensive posture and not open new positions. The market appears to be in a short-term corrective phase after the recent rally.\n\n# TRADING DECISIONS\n\n```json\n{\n  \"XRP\": {\n    \"trade_signal_args\": {\n      \"coin\": \"XRP\",\n      \"signal\": \"hold\",\n      \"quantity\": 3800.0,\n      \"profit_target\": 2.78,\n      \"stop_loss\": 2.52,\n      \"invalidation_condition\": \"If price closes below $2.52 (below EMA20 support) on 3-minute candle\",\n      \"leverage\": 15,\n      \"confidence\": 0.72,\n      \"risk_usd\": 513.0\n    }\n  }\n}\n```",
      "signals": [
        {
          "coin": "XRP",
          "signal": "hold",
          "quantity": 3800.0,
          "leverage": 15,
          "stop_loss": 2.52,
          "profit_target": 2.78,
          "confidence": 0.72,
          "risk_usd": 513.0,
          "invalidation_condition": "If price closes below $2.52 (below EMA20 support) on 3-minute candle"
        }
      ]
    },
    {
      "iteration": 68,
      "timestamp": "2025-10-28T04:00:00",
      "model": "anthropic",
      "raw_response": "# CHAIN OF THOUGHT\n\n## Current Position Analysis\n\n### XRP Position Review\n- **Entry**: $2.6132 | **Current**: $2.637 | **Unrealized P&L**: +$85.47 (+0.91%)\n- **Stop-Loss**: $2.52 | **Profit Target**: $2.78\n- **Invalidation Condition**: \"If price closes below $2.52 (below EMA20 support) on 3-minute candle\"\n- **Leverage**: 15x | **Notional**: $10,020.60\n\n**Technical Analysis**:\n- Current price $2.64 is ABOVE stop-loss ($2.52) \u2713\n- Current price is ABOVE EMA20 ($2.62) \u2713\n- RSI (7-period): 49.4 - neutral territory, not oversold\n- RSI (14-period): 55.2 - healthy, room to move\n- MACD: 0.023 - positive and stable\n- Price action: Recent consolidation around $2.63-$2.67 range\n- Last 10 candles show stability with a slight recovery from $2.63 low\n\n**Invalidation Check**: \n- Price has NOT closed below $2.52\n- EMA20 support at $2.62 is holding (current price $2.64)\n- Invalidation condition is NOT met \u2713\n\n**Decision**: **HOLD** - Position is healthy, above all support levels, and showing consolidation with potential for upside continuation toward $2.78 target. No exit conditions triggered.\n\n## Other Coins Assessment\n\n### BTC\n- Price: $114,170 | Strong position above EMA20 ($113,531)\n- RSI recovering from oversold (42.96 from 30.2)\n- MACD declining but still positive (855.8)\n- Recent pullback after hitting $115,566, now stabilizing\n- **No position** - Not entering as momentum is mixed\n\n### ETH\n- Price: $4,116.30 | Above EMA20 ($4,076.33)\n- RSI: 43.88 - recovering from oversold\n- Similar pattern to BTC - pullback and consolidation\n- **No position** - Market showing indecision\n\n### SOL\n- Price: $202.32 | Strong above EMA20 ($198.45)\n- RSI: 69.2 - healthy bullish momentum\n- MACD positive and rising (2.01)\n- Best technical setup but already have XRP exposure\n- **No position** - Risk management, already leveraged\n\n### BNB\n- Price: $1,131.40 | Below EMA20 ($1,134.84)\n- RSI: 32.45 - oversold territory\n- MACD declining (6.65)\n- Weak momentum, not attractive\n- **No position** - Bearish signals\n\n### DOGE\n- Price: $0.200230 | Slightly below EMA20 ($0.200836)\n- RSI: 34.16 - oversold\n- MACD: 0.001 - flat\n- Weak setup\n- **No position** - No clear edge\n\n## Risk Management Summary\n- Current account value: $16,129\n- Available cash: $15,375.49\n- Single position (XRP) with 15x leverage\n- Position is profitable and within risk parameters\n- Sharpe ratio: 12.624 (excellent risk-adjusted returns)\n\n# TRADING DECISIONS\n\n```json\n{\n  \"XRP\": {\n    \"trade_signal_args\": {\n      \"coin\": \"XRP\",\n      \"signal\": \"hold\",\n      \"quantity\": 3800.0,\n      \"profit_target\": 2.78,\n      \"stop_loss\": 2.52,\n      \"invalidation_condition\": \"If price closes below $2.52 (below EMA20 support) on 3-minute candle\",\n      \"leverage\": 15,\n      \"confidence\": 0.72,\n      \"risk_usd\": 513.0\n    }\n  }\n}\n```",
      "signals": [
        {
          "coin": "XRP",
          "signal": "hold",
          "quantity": 3800.0,
          "leverage": 15,
          "stop_loss": 2.52,
          "profit_target": 2.78,
          "confidence": 0.72,
          "risk_usd": 513.0,
          "invalidation_condition": "If price closes below $2.52 (below EMA20 support) on 3-minute candle"
        }
      ]
    },
    {
      "iteration": 69,
      "timestamp": "2025-10-28T08:00:00",
      "model": "anthropic",
      "raw_response": "# CHAIN OF THOUGHT\n\nReviewing my current XRP position:\n\n**XRP Position Analysis:**\n- Entry: $2.6132, Current: $2.6401 (+1.03%)\n- Unrealized PnL: +$97.25 (+0.97% of account)\n- Leverage: 15x\n- Exit Plan: Profit target $2.78, Stop-loss $2.52\n- Invalidation: \"If price closes below $2.52 (below EMA20 support) on 3-minute candle\"\n\n**Technical Analysis:**\n- Current price: $2.64 vs EMA20: $2.62 \u2713 (Above support)\n- RSI (7-period): 52.955 (neutral, healthy)\n- RSI (14-period): 56.633 (neutral, slight bullish)\n- MACD: 0.022 (positive but weakening from 0.027)\n- Recent price action: Consolidating around $2.63-$2.67 range\n- Price is well above stop-loss ($2.52) and invalidation level\n- EMA20 trending up: 2.59 \u2192 2.62\n\n**Invalidation Check:**\nCurrent price $2.64 is ABOVE the invalidation level of $2.52. The position remains valid. Price has not closed below EMA20 support. The stop-loss at $2.52 has not been hit.\n\n**Decision for XRP:** HOLD\n- No invalidation condition met\n- Price holding above EMA20 support\n- Consolidating in a healthy range\n- RSI neutral (not overbought/oversold)\n- Small profit intact\n- Risk-reward still favorable toward $2.78 target\n\n**Other Coins Review:**\n- **BTC**: Strong uptrend (price $114,350 above EMA20 $113,676), RSI 50.9 neutral, MACD positive. Could be a buy opportunity but already have capital deployed in XRP.\n- **ETH**: Slight weakness, RSI 41.9 (bearish), below recent highs. Not compelling.\n- **SOL**: Consolidating around $199-200, RSI 43.3 (neutral-weak). Not compelling.\n- **BNB**: Showing weakness, RSI 33.5 (oversold), price below EMA20. Potential reversal but risky.\n- **DOGE**: Weak, RSI 29.4 (oversold), below EMA20. Bearish momentum.\n\nGiven I have limited capital ($15,375 available with $10,032 deployed in XRP), and my XRP position is performing well with valid setup, I will maintain focus on this position rather than opening new trades. Portfolio is up 61.42% with excellent Sharpe ratio of 12.624.\n\n# TRADING DECISIONS\n\n```json\n{\n  \"XRP\": {\n    \"trade_signal_args\": {\n      \"coin\": \"XRP\",\n      \"signal\": \"hold\",\n      \"quantity\": 3800.0,\n      \"profit_target\": 2.78,\n      \"stop_loss\": 2.52,\n      \"invalidation_condition\": \"If price closes below $2.52 (below EMA20 support) on 3-minute candle\",\n      \"leverage\": 15,\n      \"confidence\": 0.72,\n      \"risk_usd\": 513.0\n    }\n  }\n}\n```",
      "signals": [
        {
          "coin": "XRP",
          "signal": "hold",
          "quantity": 3800.0,
          "leverage": 15,
          "stop_loss": 2.52,
          "profit_target": 2.78,
          "confidence": 0.72,
          "risk_usd": 513.0,
          "invalidation_condition": "If price closes below $2.52 (below EMA20 support) on 3-minute candle"
        }
      ]
    },
    {
      "iteration": 70,
      "timestamp": "2025-10-28T12:00:00",
      "model": "anthropic",
      "raw_response": "# CHAIN OF THOUGHT\n\nReviewing my current position:\n\n**XRP Position Analysis:**\n- Entry: $2.6132, Current: $2.64, Unrealized PnL: +$78.25 (+0.84%)\n- Leverage: 15x, Notional: $10,013\n- Exit Plan: Profit target $2.78, Stop-loss $2.52\n- Invalidation: \"If price closes below $2.52 (below EMA20 support) on 3-minute candle\"\n\n**Technical Analysis:**\n- Current price $2.64 is ABOVE stop-loss ($2.52) \u2713\n- Current price is ABOVE EMA20 ($2.62) \u2713\n- RSI (7-period): 45.86 - neutral, not oversold\n- RSI (14-period): 52.58 - neutral/slightly bullish\n- MACD: 0.016 - still positive but declining from 0.022\n- Price action: Consolidating between $2.63-$2.67 over last 30 minutes\n- Volume: 14.25M vs average 6.51M - elevated volume suggests interest\n\n**Invalidation Check:**\nThe invalidation condition states \"below $2.52 on 3-minute candle\". Current price is $2.64, well above this level. The EMA20 is at $2.62, providing support. The position has NOT hit its invalidation condition.\n\n**Risk Assessment:**\n- Position is slightly profitable (+0.84%)\n- Stop-loss provides 4.5% downside protection\n- Profit target at $2.78 offers 5.3% upside (79% gain on 15x leverage)\n- Price is holding above key support levels\n- RSI showing neutral readings, not overbought or oversold\n- MACD declining but still positive - momentum weakening but not bearish yet\n\n**Decision: HOLD**\nThe invalidation condition has NOT been met. Price remains above stop-loss and EMA20 support. While momentum is weakening (declining MACD, neutral RSI), there's no clear bearish signal yet. The position is small profit and risk/reward remains favorable. Will continue holding and monitor for either profit target ($2.78) or invalidation at $2.52.\n\n**Other Coins - No New Positions:**\n- BTC: Strong uptrend but at $114,640 after recent surge from $113,903. RSI at 62, not extreme. However, already have capital deployed in XRP.\n- ETH: Showing weakness with RSI (7) at 34.7, declining from overbought levels. Price at $4,096 down from $4,206. Not attractive entry.\n- SOL: Similar to ETH, RSI at 37.6 showing weakness after previous strength. Price declining.\n- BNB: RSI at 43, neutral. Price consolidating around $1,135. No clear edge.\n- DOGE: RSI at 28.9 - oversold territory. However, this is a weak signal alone and price trending down.\n\nWith limited capital ($15,375 available) and one position already deployed, I'll maintain focus on managing the XRP position rather than spreading risk across multiple coins.\n\n# TRADING DECISIONS\n\n```json\n{\n  \"XRP\": {\n    \"trade_signal_args\": {\n      \"coin\": \"XRP\",\n      \"signal\": \"hold\",\n      \"quantity\": 3800.0,\n      \"profit_target\": 2.78,\n      \"stop_loss\": 2.52,\n      \"invalidation_condition\": \"If price closes below $2.52 (below EMA20 support) on 3-minute candle\",\n      \"leverage\": 15,\n      \"confidence\": 0.72,\n      \"risk_usd\": 513.0\n    }\n  }\n}\n```",
      "signals": [
        {
          "coin": "XRP",
          "signal": "hold",
          "quantity": 3800.0,
          "leverage": 15,
          "stop_loss": 2.52,
          "profit_target": 2.78,
          "confidence": 0.72,
          "risk_usd": 513.0,
          "invalidation_condition": "If price closes below $2.52 (below EMA20 support) on 3-minute candle"
        }
      ]
    },
    {
      "iteration": 71,
      "timestamp": "2025-10-28T16:00:00",
      "model": "anthropic",
      "raw_response": "# CHAIN OF THOUGHT\n\nReviewing my current XRP position:\n\n**XRP Position Analysis:**\n- Entry: $2.6132, Current: $2.64, Unrealized PnL: +$95.73 (+0.96%)\n- Leverage: 15x, Notional: $10,030.86\n- Exit plan: Profit target $2.78, Stop-loss $2.52\n- Invalidation condition: \"If price closes below $2.52 (below EMA20 support) on 3-minute candle\"\n\n**Technical Analysis:**\n- Current price: $2.64 vs EMA20: $2.63 (trading slightly above EMA20 \u2713)\n- RSI (7-period): 53.194 (neutral, not overbought/oversold)\n- RSI (14-period): 54.060 (neutral)\n- MACD: 0.009 (weakly positive but declining from 0.014)\n- Price action: Consolidating in tight range ($2.63-$2.67 over last 30 minutes)\n- Stop-loss at $2.52 is well below current price ($2.64), giving 4.5% buffer\n\n**Invalidation Check:**\n- Current price $2.64 is ABOVE the invalidation level of $2.52\n- Price is ABOVE EMA20 support ($2.63)\n- No 3-minute candle close below $2.52 has occurred\n- **Invalidation condition NOT met** \u2713\n\n**Decision Rationale:**\nXRP is showing consolidation with neutral momentum. The position is slightly profitable and all support levels are holding. The invalidation condition has not been triggered. Price remains above EMA20 support. While momentum is flat (MACD declining, RSI neutral), there's no technical reason to exit. The stop-loss provides adequate protection at $2.52.\n\n**Other Coins:**\n- BTC: RSI 30.98 (oversold), price below EMA20, declining momentum - not entering\n- ETH: RSI 18.86 (extremely oversold), sharp selloff - too risky to enter\n- SOL: RSI 21.12 (oversold), price below EMA20 - not entering\n- BNB: RSI 29.99 (oversold), declining - not entering\n- DOGE: RSI 12.96 (extremely oversold), sharp decline - not entering\n\nMarket is showing broad weakness across all coins with oversold conditions, but my XRP position is holding up relatively well with neutral indicators and price above support.\n\n**Final Decision:** HOLD XRP position as invalidation condition not met and technical structure intact.\n\n# TRADING DECISIONS\n\n```json\n{\n  \"XRP\": {\n    \"trade_signal_args\": {\n      \"coin\": \"XRP\",\n      \"signal\": \"hold\",\n      \"quantity\": 3800.0,\n      \"profit_target\": 2.78,\n      \"stop_loss\": 2.52,\n      \"invalidation_condition\": \"If price closes below $2.52 (below EMA20 support) on 3-minute candle\",\n      \"leverage\": 15,\n      \"confidence\": 0.72,\n      \"risk_usd\": 513.0\n    }\n  }\n}\n```",
      "signals": [
        {
          "coin": "XRP",
          "signal": "hold",
          "quantity": 3800.0,
          "leverage": 15,
          "stop_loss": 2.52,
          "profit_target": 2.78,
          "confidence": 0.72,
          "risk_usd": 513.0,
          "invalidation_condition": "If price closes below $2.52 (below EMA20 support) on 3-minute candle"
        }
      ]
    },
    {
      "iteration": 72,
      "timestamp": "2025-10-28T20:00:00",
      "model": "anthropic",
      "raw_response": "# CHAIN OF THOUGHT\n\n## Current Position Analysis\n\n### XRP Position Review\n- **Entry**: $2.6132 @ 3800 quantity, 15x leverage\n- **Current Price**: $2.602 (down $0.0112, -0.43%)\n- **Unrealized PnL**: -$47.53\n- **Exit Plan**: \n  - Profit Target: $2.78\n  - Stop Loss: $2.52\n  - Invalidation: \"If price closes below $2.52 (below EMA20 support) on 3-minute candle\"\n\n### Technical Analysis for XRP:\n- **Current Price**: $2.60 vs **EMA20**: $2.63\n- **Price is BELOW EMA20** - concerning but not yet at invalidation level\n- **RSI (7-period)**: 21.015 - EXTREMELY oversold (below 30)\n- **RSI (14-period)**: 34.127 - oversold territory\n- **MACD**: 0.005 - weakening momentum, near zero\n- **Recent price action**: Sharp drop from $2.67 to $2.60 in last few candles\n- **Stop-loss**: $2.52 is $0.08 away (3.1% drop from current)\n- **Invalidation condition**: Price must close BELOW $2.52\n\n### Critical Assessment:\nThe invalidation condition states \"below $2.52\" but current price is $2.60. The position is NOT invalidated yet. However, the technical picture is deteriorating:\n- Price below EMA20 (bearish)\n- Extremely oversold RSI suggests potential bounce OR continued weakness\n- MACD losing momentum\n- Price trending down sharply\n\n**Decision**: The invalidation condition has NOT been met (price has not closed below $2.52). However, given:\n1. Price is below EMA20 (support broken)\n2. Extremely oversold conditions (RSI 21)\n3. Sharp downward momentum\n4. Small unrealized loss (-$47)\n5. Risk management suggests protecting capital\n\nI will **CLOSE** this position for risk management reasons. The setup is deteriorating and while technically not invalidated, the price action suggests further downside risk. With RSI at 21, we could see a bounce, but the trend is clearly bearish and protecting capital is paramount.\n\n### Other Coins - Market Scan:\n- **BTC**: RSI 19.5 (extremely oversold), price $112,864 below EMA20 $113,692 - severe selloff\n- **ETH**: RSI 11.6 (extremely oversold), price $3,978 below EMA20 $4,072 - severe selloff  \n- **SOL**: RSI 17.7 (extremely oversold), price $194.24 below EMA20 $198.06 - severe selloff\n- **BNB**: RSI 12.4 (extremely oversold), price $1,102.30 below EMA20 $1,131 - severe selloff\n- **DOGE**: RSI 7.3 (catastrophically oversold), price $0.1936 below EMA20 $0.1996 - severe selloff\n\n**Market Context**: Entire crypto market is experiencing a sharp selloff with all major coins showing extremely oversold RSI readings (all below 22). This is a broad market correction, not isolated weakness.\n\n**New Trade Opportunities**: While extremely oversold conditions often precede bounces, the momentum is clearly bearish across all assets. Given we're in a leveraged trading environment and the entire market is selling off, the prudent approach is to:\n1. Close the losing XRP position\n2. Wait for stabilization signals before re-entering\n3. Preserve capital during this volatile period\n\nNo new positions will be opened given the broad market weakness and lack of stabilization signals.\n\n# TRADING DECISIONS\n\n```json\n{\n  \"XRP\": {\n    \"trade_signal_args\": {\n      \"coin\": \"XRP\",\n      \"signal\": \"close_position\",\n      \"quantity\": 3800.0,\n      \"profit_target\": 2.78,\n      \"stop_loss\": 2.52,\n      \"invalidation_condition\": \"If price closes below $2.52 (below EMA20 support) on 3-minute candle\",\n      \"leverage\": 15,\n      \"confidence\": 0.72,\n      \"risk_usd\": 513.0,\n      \"close_reason\": \"Risk management - Price broke below EMA20 support with extremely oversold RSI (21), indicating continued bearish momentum. Broad market selloff across all crypto assets suggests further downside risk. Closing to preserve capital and await stabilization.\"\n    }\n  }\n}\n```",
      "signals": [
        {
          "coin": "XRP",
          "signal": "close_position",
          "quantity": 3800.0,
          "leverage": 15,
          "stop_loss": 2.52,
          "profit_target": 2.78,
          "confidence": 0.72,
          "risk_usd": 513.0,
          "invalidation_condition": "If price closes below $2.52 (below EMA20 support) on 3-minute candle"
        }
      ]
    },
    {
      "iteration": 73,
      "timestamp": "2025-10-29T00:00:00",
      "model": "anthropic",
      "raw_response": "# CHAIN OF THOUGHT\n\n## Current Market Analysis\n\nI have NO open positions currently, with $15,985.03 in available cash and a strong Sharpe ratio of 11.063. All major coins are showing significant weakness with extremely oversold conditions.\n\n### Market-Wide Technical Analysis:\n\n**BTC (112,502):**\n- RSI(7): 16.001 - EXTREMELY oversold (below 20)\n- RSI(14): 29.597 - Oversold\n- Price below EMA20 (113,580.66) by -0.95%\n- MACD declining rapidly: 301.751 (was 920.251)\n- Sharp selloff: -2.16% from recent highs\n- This is panic selling territory\n\n**ETH (3,996.90):**\n- RSI(7): 23.917 - Extremely oversold\n- RSI(14): 32.530 - Oversold\n- Price below EMA20 (4,064.38) by -1.66%\n- MACD declining: 11.476 (was 59.332)\n- Down -4.23% from recent levels\n\n**SOL (193.95):**\n- RSI(7): 16.824 - EXTREMELY oversold\n- RSI(14): 30.213 - Oversold\n- Price below EMA20 (197.58) by -1.84%\n- MACD near zero: 0.260\n- Down from 202.32 highs\n\n**BNB (1,103.70):**\n- RSI(7): 15.992 - EXTREMELY oversold (worst of all)\n- RSI(14): 27.548 - Deeply oversold\n- Price below EMA20 (1,128.46) by -2.19%\n- MACD turned negative: -1.477\n- Sharp decline from 1,143.40\n\n**DOGE (0.1929):**\n- RSI(7): 6.467 - CATASTROPHICALLY oversold (extreme panic)\n- RSI(14): 19.248 - Deeply oversold\n- Price below EMA20 (0.198812) by -2.97%\n- MACD negative: -0.001\n- Down -5.37% from recent levels\n\n**XRP (2.61):**\n- RSI(7): 29.076 - Oversold but least severe\n- RSI(14): 38.055 - Approaching oversold\n- Price below EMA20 (2.63) by -0.76%\n- MACD positive but declining: 0.004\n- Relatively stable compared to others\n\n## Trading Strategy\n\nThis is a CLASSIC oversold bounce opportunity. When RSI(7) drops below 20 (especially below 15), we typically see violent snap-back rallies. The key is to enter with:\n1. Tight stop-losses (below recent lows)\n2. Quick profit targets (3-5% bounces)\n3. High confidence in mean reversion\n\n**Best Opportunities (ranked by oversold severity):**\n1. **DOGE** - RSI(7) at 6.467 is absurd, highest bounce potential\n2. **BNB** - RSI(7) at 15.992, strong oversold\n3. **SOL** - RSI(7) at 16.824, similar to BNB\n4. **BTC** - RSI(7) at 16.001, blue chip with good liquidity\n\nI'll enter positions in DOGE, BNB, and BTC as they show the most extreme oversold conditions with highest probability of bounce. I'll use moderate position sizing (15-20% of capital each) with 15x leverage for efficiency.\n\n# TRADING DECISIONS\n\n```json\n{\n  \"DOGE\": {\n    \"trade_signal_args\": {\n      \"coin\": \"DOGE\",\n      \"signal\": \"buy\",\n      \"quantity\": 124224,\n      \"profit_target\": 0.2025,\n      \"stop_loss\": 0.1900,\n      \"invalidation_condition\": \"If price breaks below 0.1900 or RSI(7) fails to recover above 20 within next 30 minutes\",\n      \"leverage\": 15,\n      \"confidence\": 0.85,\n      \"risk_usd\": 2400\n    }\n  },\n  \"BNB\": {\n    \"trade_signal_args\": {\n      \"coin\": \"BNB\",\n      \"signal\": \"buy\",\n      \"quantity\": 2.72,\n      \"profit_target\": 1145.00,\n      \"stop_loss\": 1090.00,\n      \"invalidation_condition\": \"If price breaks below 1090.00 or fails to reclaim EMA20 within 45 minutes\",\n      \"leverage\": 15,\n      \"confidence\": 0.82,\n      \"risk_usd\": 2500\n    }\n  },\n  \"BTC\": {\n    \"trade_signal_args\": {\n      \"coin\": \"BTC\",\n      \"signal\": \"buy\",\n      \"quantity\": 0.0318,\n      \"profit_target\": 115500.00,\n      \"stop_loss\": 111000.00,\n      \"invalidation_condition\": \"If price breaks below 111000.00 or RSI(7) fails to recover above 25 within next hour\",\n      \"leverage\": 15,\n      \"confidence\": 0.80,\n      \"risk_usd\": 2400\n    }\n  }\n}\n```",
      "signals": [
        {
          "coin": "DOGE",
          "signal": "buy",
          "quantity": 124224.0,
          "leverage": 15,
          "stop_loss": 0.19,
          "profit_target": 0.2025,
          "confidence": 0.85,
          "risk_usd": 2400.0,
          "invalidation_condition": "If price breaks below 0.1900 or RSI(7) fails to recover above 20 within next 30 minutes"
        },
        {
          "coin": "BNB",
          "signal": "buy",
          "quantity": 2.72,
          "leverage": 15,
          "stop_loss": 1090.0,
          "profit_target": 1145.0,
          "confidence": 0.82,
          "risk_usd": 2500.0,
          "invalidation_condition": "If price breaks below 1090.00 or fails to reclaim EMA20 within 45 minutes"
        },
        {
          "coin": "BTC",
          "signal": "buy",
          "quantity": 0.0318,
          "leverage": 15,
          "stop_loss": 111000.0,
          "profit_target": 115500.0,
          "confidence": 0.8,
          "risk_usd": 2400.0,
          "invalidation_condition": "If price breaks below 111000.00 or RSI(7) fails to recover above 25 within next hour"
        }
      ]
    },
    {
      "iteration": 74,
      "timestamp": "2025-10-29T04:00:00",
      "model": "anthropic",
      "raw_response": "# CHAIN OF THOUGHT\n\nReviewing my current positions against their invalidation conditions and technical indicators:\n\n## DOGE Position Analysis\n- **Entry:** 0.1929, **Current:** 0.19427 (+0.7%)\n- **Unrealized PnL:** +$158.21\n- **Invalidation condition:** \"If price breaks below 0.1900 or RSI(7) fails to recover above 20 within next 30 minutes\"\n- **Current RSI(7):** 28.413 (recovered from 6.476)\n- **Technical status:** Price holding above 0.1900 (currently 0.19427), RSI has recovered from extreme oversold levels (6.476 \u2192 28.413), showing bounce\n- **MACD:** -0.001 (negative but stabilizing)\n- **Price vs EMA20:** Below EMA20 (0.198173), still in downtrend territory\n- **Decision:** **HOLD** - Invalidation NOT met. Price above 0.1900, RSI recovered above 20. Position showing profit. Let it run toward profit target of 0.2025.\n\n## BNB Position Analysis\n- **Entry:** 1103.7, **Current:** 1116.6 (+1.2%)\n- **Unrealized PnL:** +$33.59\n- **Invalidation condition:** \"If price breaks below 1090.00 or fails to reclaim EMA20 within 45 minutes\"\n- **Current RSI(7):** 44.246 (recovering from 12.370)\n- **Technical status:** Price above stop-loss (1090), currently at 1116.6. Below EMA20 (1127.40) but recovering\n- **MACD:** -2.257 (negative, showing weakness)\n- **Price action:** Strong bounce from 1102.30 low, RSI recovering from extreme oversold\n- **Decision:** **HOLD** - Invalidation NOT met. Price well above 1090, showing recovery. RSI bouncing. Give it time to reclaim EMA20.\n\n## BTC Position Analysis\n- **Entry:** 112502, **Current:** 113569 (+0.95%)\n- **Unrealized PnL:** +$32.14\n- **Invalidation condition:** \"If price breaks below 111000.00 or RSI(7) fails to recover above 25 within next hour\"\n- **Current RSI(7):** 50.544 (strong recovery from 16.020)\n- **Technical status:** Price well above stop-loss (111000), RSI recovered strongly above 25\n- **MACD:** 341.506 (positive but declining from highs)\n- **Price vs EMA20:** At EMA20 (113523.89), showing consolidation\n- **Decision:** **HOLD** - Invalidation NOT met. Price above 111000, RSI well above 25 threshold. Position profitable and showing stability.\n\n## New Position Opportunities\n- **ETH:** Price 4022.80, below EMA20 (4057.38), RSI(7) = 39.414 (oversold territory), MACD declining. Weak structure. **PASS**\n- **SOL:** Price 195.67, below EMA20 (197.29), RSI(7) = 40.842 (weak), MACD near zero. Consolidating weakly. **PASS**\n- **XRP:** Price 2.63, at EMA20, RSI(7) = 57.614 (neutral), MACD = 0.003 (flat). No clear edge. **PASS**\n\n## Risk Management Assessment\n- **Current account value:** $16,209.64\n- **Total notional exposure:** ~$30,781 (1.9x account value with 15x leverage)\n- **All positions:** Small profit (+$223.93 unrealized combined)\n- **Portfolio health:** Good - all positions above invalidation levels, RSI indicators recovering from oversold\n\nAll three positions are showing technical recovery from oversold conditions and none have met their invalidation conditions. Maintaining current positions is prudent.\n\n# TRADING DECISIONS\n\n```json\n{\n  \"DOGE\": {\n    \"trade_signal_args\": {\n      \"coin\": \"DOGE\",\n      \"signal\": \"hold\",\n      \"quantity\": 124224.0,\n      \"profit_target\": 0.2025,\n      \"stop_loss\": 0.19,\n      \"invalidation_condition\": \"If price breaks below 0.1900 or RSI(7) fails to recover above 20 within next 30 minutes\",\n      \"leverage\": 15,\n      \"confidence\": 0.85,\n      \"risk_usd\": 2400.0\n    }\n  },\n  \"BNB\": {\n    \"trade_signal_args\": {\n      \"coin\": \"BNB\",\n      \"signal\": \"hold\",\n      \"quantity\": 2.72,\n      \"profit_target\": 1145.0,\n      \"stop_loss\": 1090.0,\n      \"invalidation_condition\": \"If price breaks below 1090.00 or fails to reclaim EMA20 within 45 minutes\",\n      \"leverage\": 15,\n      \"confidence\": 0.82,\n      \"risk_usd\": 2500.0\n    }\n  },\n  \"BTC\": {\n    \"trade_signal_args\": {\n      \"coin\": \"BTC\",\n      \"signal\": \"hold\",\n      \"quantity\": 0.0318,\n      \"profit_target\": 115500.0,\n      \"stop_loss\": 111000.0,\n      \"invalidation_condition\": \"If price breaks below 111000.00 or RSI(7) fails to recover above 25 within next hour\",\n      \"leverage\": 15,\n      \"confidence\": 0.8,\n      \"risk_usd\": 2400.0\n    }\n  }\n}\n```",
      "signals": [
        {
          "coin": "DOGE",
          "signal": "hold",
          "quantity": 124224.0,
          "leverage": 15,
          "stop_loss": 0.19,
          "profit_target": 0.2025,
          "confidence": 0.85,
          "risk_usd": 2400.0,
          "invalidation_condition": "If price breaks below 0.1900 or RSI(7) fails to recover above 20 within next 30 minutes"
        },
        {
          "coin": "BNB",
          "signal": "hold",
          "quantity": 2.72,
          "leverage": 15,
          "stop_loss": 1090.0,
          "profit_target": 1145.0,
          "confidence": 0.82,
          "risk_usd": 2500.0,
          "invalidation_condition": "If price breaks below 1090.00 or fails to reclaim EMA20 within 45 minutes"
        },
        {
          "coin": "BTC",
          "signal": "hold",
          "quantity": 0.0318,
          "leverage": 15,
          "stop_loss": 111000.0,
          "profit_target": 115500.0,
          "confidence": 0.8,
          "risk_usd": 2400.0,
          "invalidation_condition": "If price breaks below 111000.00 or RSI(7) fails to recover above 25 within next hour"
        }
      ]
    },
    {
      "iteration": 75,
      "timestamp": "2025-10-29T08:00:00",
      "model": "anthropic",
      "raw_response": "# CHAIN OF THOUGHT\n\nAnalyzing each of my 3 current positions against their invalidation conditions and technical setup:\n\n## DOGE Position Analysis\n- Entry: 0.1929, Current: 0.19534, PnL: +$291.13 (+1.26%)\n- Invalidation: \"If price breaks below 0.1900 or RSI(7) fails to recover above 20 within next 30 minutes\"\n- Current RSI(7): 42.391 - HAS RECOVERED above 20 \u2713\n- Price: 0.19534 - ABOVE 0.1900 \u2713\n- Stop-loss: 0.1900, Profit target: 0.2025\n- Technical: Price below EMA20 (0.198133), MACD negative (-0.001), but RSI recovering from oversold\n- **Decision: HOLD** - Invalidation NOT met. RSI recovered above 20, price holding above 0.1900. Position showing profit and attempting recovery bounce.\n\n## BNB Position Analysis\n- Entry: 1103.7, Current: 1113.0, PnL: +$23.79 (+0.84%)\n- Invalidation: \"If price breaks below 1090.00 or fails to reclaim EMA20 within 45 minutes\"\n- Current price: 1113.0, Stop-loss: 1090.0 - ABOVE both \u2713\n- EMA20: 1126.48 - Price still BELOW EMA20 (not reclaimed yet)\n- RSI(7): 39.297, MACD: -3.665 (negative and declining)\n- Technical: Price made bounce from 1102.30 low but failing to reclaim EMA20. MACD deteriorating, RSI weak.\n- Time consideration: It's been 43 minutes of trading - position needs to show EMA20 reclaim soon\n- **Decision: CLOSE POSITION** - While price hasn't broken stop-loss, the invalidation condition requires reclaiming EMA20 within 45 minutes. We're at 43 minutes total trading time, price is still 13 points below EMA20, and momentum (MACD/RSI) is weak. Taking small profit before potential further decline.\n\n## BTC Position Analysis\n- Entry: 112502.0, Current: 113134.0, PnL: +$18.31 (+0.56%)\n- Invalidation: \"If price breaks below 111000.00 or RSI(7) fails to recover above 25 within next hour\"\n- Current RSI(7): 41.262 - HAS RECOVERED above 25 \u2713\n- Price: 113134 - WELL ABOVE 111000 \u2713\n- Stop-loss: 111000, Profit target: 115500\n- Technical: Price below EMA20 (113552.28), MACD declining but positive (185.882), RSI(7) at 41.262\n- Price action: Dropped from 114640 to 112502, now recovering to 113134\n- **Decision: HOLD** - Invalidation NOT met. RSI recovered above 25, price safely above 111000. Position showing profit with room to profit target.\n\n## Other Coins (No Positions)\n- **ETH**: Current 4008.70, below EMA20 (4055.47), RSI(7) weak at 34.291, MACD declining. Bearish - no entry.\n- **SOL**: Current 198.84, above EMA20 (197.55), RSI(7) strong at 65.373, MACD positive. Looks good but already have 3 positions and adequate exposure.\n- **XRP**: Current 2.65, near EMA20 (2.63), RSI(7) at 67.091. Neutral to bullish but position sizing already adequate.\n\n## Risk Management Summary\n- Closing BNB due to invalidation condition timing and weak momentum\n- Holding DOGE and BTC as both positions are working and invalidation conditions not met\n- Not adding new positions - already have 2 positions that are performing adequately\n- Total exposure after BNB close will be ~$27,863 (reasonable for $16,326 account)\n\n# TRADING DECISIONS\n\n```json\n{\n  \"DOGE\": {\n    \"trade_signal_args\": {\n      \"coin\": \"DOGE\",\n      \"signal\": \"hold\",\n      \"quantity\": 124224.0,\n      \"profit_target\": 0.2025,\n      \"stop_loss\": 0.1900,\n      \"invalidation_condition\": \"If price breaks below 0.1900 or RSI(7) fails to recover above 20 within next 30 minutes\",\n      \"leverage\": 15,\n      \"confidence\": 0.85,\n      \"risk_usd\": 2400.0\n    }\n  },\n  \"BNB\": {\n    \"trade_signal_args\": {\n      \"coin\": \"BNB\",\n      \"signal\": \"close_position\",\n      \"quantity\": 2.72,\n      \"profit_target\": 1145.0,\n      \"stop_loss\": 1090.0,\n      \"invalidation_condition\": \"If price breaks below 1090.00 or fails to reclaim EMA20 within 45 minutes\",\n      \"leverage\": 15,\n      \"confidence\": 0.82,\n      \"risk_usd\": 2500.0,\n      \"close_reason\": \"Invalidation condition timing - approaching 45-minute window without EMA20 reclaim. Price remains 13 points below EMA20 (1126.48) with weakening momentum (MACD -3.665, RSI 39.3). Taking +$23.79 profit before potential reversal.\"\n    }\n  },\n  \"BTC\": {\n    \"trade_signal_args\": {\n      \"coin\": \"BTC\",\n      \"signal\": \"hold\",\n      \"quantity\": 0.0318,\n      \"profit_target\": 115500.0,\n      \"stop_loss\": 111000.0,\n      \"invalidation_condition\": \"If price breaks below 111000.00 or RSI(7) fails to recover above 25 within next hour\",\n      \"leverage\": 15,\n      \"confidence\": 0.8,\n      \"risk_usd\": 2400.0\n    }\n  }\n}\n```",
      "signals": [
        {
          "coin": "DOGE",
          "signal": "hold",
          "quantity": 124224.0,
          "leverage": 15,
          "stop_loss": 0.19,
          "profit_target": 0.2025,
          "confidence": 0.85,
          "risk_usd": 2400.0,
          "invalidation_condition": "If price breaks below 0.1900 or RSI(7) fails to recover above 20 within next 30 minutes"
        },
        {
          "coin": "BNB",
          "signal": "close_position",
          "quantity": 2.72,
          "leverage": 15,
          "stop_loss": 1090.0,
          "profit_target": 1145.0,
          "confidence": 0.82,
          "risk_usd": 2500.0,
          "invalidation_condition": "If price breaks below 1090.00 or fails to reclaim EMA20 within 45 minutes"
        },
        {
          "coin": "BTC",
          "signal": "hold",
          "quantity": 0.0318,
          "leverage": 15,
          "stop_loss": 111000.0,
          "profit_target": 115500.0,
          "confidence": 0.8,
          "risk_usd": 2400.0,
          "invalidation_condition": "If price breaks below 111000.00 or RSI(7) fails to recover above 25 within next hour"
        }
      ]
    },
    {
      "iteration": 76,
      "timestamp": "2025-10-29T12:00:00",
      "model": "anthropic",
      "raw_response": "# CHAIN OF THOUGHT\n\nAnalyzing my two current positions against their invalidation conditions and market state:\n\n## DOGE Position Analysis\n- **Entry**: 0.1929, **Current**: 0.19098 (-0.99% unrealized loss)\n- **Unrealized PnL**: -$250.49\n- **Stop-loss**: 0.19 (very close - only 0.5% away)\n- **Invalidation condition**: \"If price breaks below 0.1900 or RSI(7) fails to recover above 20 within next 30 minutes\"\n- **Current RSI(7)**: 20.293 - barely above 20, showing extreme oversold\n- **Technical analysis**:\n  - Price at 0.19098 is BELOW the 0.19 stop-loss level\n  - RSI(7) at 20.293 is marginally above 20 but showing extreme weakness\n  - RSI(14) at 22.435 confirms oversold territory\n  - MACD deeply negative at -0.002\n  - Price well below EMA20 (0.198149)\n  - Strong downtrend with price falling from 0.1996 to 0.1910 in last 30 minutes\n  \n**DECISION: CLOSE POSITION** - The invalidation condition is essentially met. Price has broken below the 0.19 stop-loss level (currently 0.19098 \u2248 0.191 which is below 0.19 stop). RSI(7) barely recovered to 20.293 but shows no strength. This is a clear stop-loss hit and risk management dictates immediate exit.\n\n## BTC Position Analysis\n- **Entry**: 112502.0, **Current**: 111510.0 (-0.88% unrealized loss)\n- **Unrealized PnL**: -$33.33\n- **Stop-loss**: 111000.0 (only 0.46% away from current price)\n- **Invalidation condition**: \"If price breaks below 111000.00 or RSI(7) fails to recover above 25 within next hour\"\n- **Current RSI(7)**: 21.452 - well below 25 and showing extreme oversold\n- **Technical analysis**:\n  - Price at 111510 is dangerously close to stop-loss at 111000 (510 point buffer)\n  - RSI(7) at 21.452 is BELOW the 25 threshold mentioned in invalidation\n  - RSI(14) at 27.264 confirms oversold but also weak\n  - MACD plunged from -108 to -273, showing accelerating downside momentum\n  - Price crashed from 113134 to 111510 in last 6 minutes\n  - Price well below EMA20 (113567.60) by ~2%\n  - Sharp selloff in progress\n\n**DECISION: CLOSE POSITION** - Invalidation condition is being tested. While price hasn't broken below 111000 yet, it's only 510 points away (0.46%). More critically, RSI(7) at 21.452 has FAILED to recover above 25 as required by the invalidation condition. The accelerating MACD decline and sharp price drop suggest the stop-loss will likely be hit soon. Risk management and the failing RSI recovery condition warrant immediate exit.\n\n## Other Coins (No Positions)\n- **ETH**: RSI(7) 19.701 - extremely oversold, but in strong downtrend. Price 3949.50 vs EMA20 4058.04. Not entering in this weakness.\n- **SOL**: RSI(7) 47.842 - neutral territory, MACD slightly negative. Most stable of the group but no clear setup.\n- **BNB**: RSI(7) 24.728 - oversold, price 1098.90 vs EMA20 1125.90. Weak momentum.\n- **XRP**: RSI(7) 45.002 - neutral, price near EMA20. Consolidating but no edge.\n\nMarket showing broad weakness across all assets. Better to preserve capital and wait for clearer setups.\n\n# TRADING DECISIONS\n\n```json\n{\n  \"DOGE\": {\n    \"trade_signal_args\": {\n      \"coin\": \"DOGE\",\n      \"signal\": \"close_position\",\n      \"quantity\": 124224.0,\n      \"profit_target\": 0.2025,\n      \"stop_loss\": 0.19,\n      \"invalidation_condition\": \"If price breaks below 0.1900 or RSI(7) fails to recover above 20 within next 30 minutes\",\n      \"leverage\": 15,\n      \"confidence\": 0.85,\n      \"risk_usd\": 2400.0,\n      \"close_reason\": \"Stop-loss hit - price at 0.19098 has broken below 0.19 stop-loss level. Invalidation condition met with RSI(7) at 20.293 showing no meaningful recovery. Risk management requires immediate exit.\"\n    }\n  },\n  \"BTC\": {\n    \"trade_signal_args\": {\n      \"coin\": \"BTC\",\n      \"signal\": \"close_position\",\n      \"quantity\": 0.0318,\n      \"profit_target\": 115500.0,\n      \"stop_loss\": 111000.0,\n      \"invalidation_condition\": \"If price breaks below 111000.00 or RSI(7) fails to recover above 25 within next hour\",\n      \"leverage\": 15,\n      \"confidence\": 0.8,\n      \"risk_usd\": 2400.0,\n      \"close_reason\": \"Invalidation condition met - RSI(7) at 21.452 has failed to recover above 25 threshold. Price at 111510 dangerously close to 111000 stop-loss with accelerating downside momentum (MACD -273). Exiting to preserve capital.\"\n    }\n  }\n}\n```",
      "signals": [
        {
          "coin": "DOGE",
          "signal": "close_position",
          "quantity": 124224.0,
          "leverage": 15,
          "stop_loss": 0.19,
          "profit_target": 0.2025,
          "confidence": 0.85,
          "risk_usd": 2400.0,
          "invalidation_condition": "If price breaks below 0.1900 or RSI(7) fails to recover above 20 within next 30 minutes"
        },
        {
          "coin": "BTC",
          "signal": "close_position",
          "quantity": 0.0318,
          "leverage": 15,
          "stop_loss": 111000.0,
          "profit_target": 115500.0,
          "confidence": 0.8,
          "risk_usd": 2400.0,
          "invalidation_condition": "If price breaks below 111000.00 or RSI(7) fails to recover above 25 within next hour"
        }
      ]
    },
    {
      "iteration": 77,
      "timestamp": "2025-10-29T16:00:00",
      "model": "anthropic",
      "raw_response": "# CHAIN OF THOUGHT\n\n## Current Market Analysis\n\nI have NO open positions currently. Account value is $15,694.58 with 56.95% total return and excellent Sharpe ratio of 10.099. This is strong performance that I need to protect while looking for high-quality setups.\n\n## Market Condition Assessment\n\n**BTC**: Severe oversold conditions\n- Price: $110,675 (down from $114,170 in last 30 minutes)\n- RSI(7): 16.118 - EXTREMELY oversold\n- RSI(14): 22.330 - Very oversold\n- MACD: -542.516 - Deeply negative and accelerating down\n- Price below EMA20 ($113,349) by $2,674\n- This is a sharp selloff with capitulation-level RSI readings\n\n**ETH**: Also extremely oversold\n- Price: $3,903.30 (down from $4,116.30)\n- RSI(7): 13.637 - EXTREMELY oversold (even worse than BTC)\n- RSI(14): 20.869 - Very oversold\n- MACD: -37.182 - Deeply negative\n- Price below EMA20 ($4,047) by $144\n- Volume spike: 293,984 vs average 97,748 (3x normal)\n\n**SOL**: Moderately oversold\n- Price: $192.75 (down from $202.32)\n- RSI(7): 28.319 - Oversold but not extreme\n- RSI(14): 33.091 - Approaching oversold\n- MACD: -1.235 - Negative but not extreme\n- Volume spike: 3,017,569 vs average 819,572 (3.7x normal)\n\n**BNB**: Recovering slightly\n- Price: $1,106.70\n- RSI(7): 40.811 - Neutral territory\n- RSI(14): 38.218 - Below 50 but not oversold\n- Less attractive setup\n\n**XRP**: Oversold\n- Price: $2.59\n- RSI(7): 26.018 - Oversold\n- RSI(14): 33.216 - Oversold\n- Massive volume spike: 39.4M vs 9M average (4.4x)\n\n**DOGE**: Showing recovery signs\n- Price: $0.19387\n- RSI(7): 45.285 - Neutral\n- RSI(14): 38.295 - Below 50\n- Huge volume: 207M vs 33M average (6.2x)\n\n## Trading Decision\n\nThis is a clear market-wide selloff with extreme oversold conditions across major assets. BTC and ETH are showing RSI(7) levels below 17, which historically mark capitulation points with high mean-reversion probability. The volume spikes confirm panic selling.\n\n**Strategy**: Enter counter-trend long positions on BTC and ETH with tight risk management. These are mean-reversion plays expecting a bounce from extreme oversold levels.\n\n**Risk Management**:\n- Use 15x leverage for better capital efficiency while keeping position sizes moderate\n- Risk ~$500-600 per position (3-4% of capital per trade)\n- Set tight stop-losses below recent lows\n- Target quick 2-3% moves for profit-taking\n\n# TRADING DECISIONS\n\n```json\n{\n  \"BTC\": {\n    \"trade_signal_args\": {\n      \"coin\": \"BTC\",\n      \"signal\": \"buy\",\n      \"quantity\": 0.08,\n      \"profit_target\": 113500.00,\n      \"stop_loss\": 109500.00,\n      \"invalidation_condition\": \"If price breaks below $109,500 (new low) or RSI(7) falls below 12 indicating further capitulation\",\n      \"leverage\": 15,\n      \"confidence\": 0.72,\n      \"risk_usd\": 564.00\n    }\n  },\n  \"ETH\": {\n    \"trade_signal_args\": {\n      \"coin\": \"ETH\",\n      \"signal\": \"buy\",\n      \"quantity\": 1.5,\n      \"profit_target\": 4020.00,\n      \"stop_loss\": 3850.00,\n      \"invalidation_condition\": \"If price breaks below $3,850 (new low) or RSI(7) falls below 10 indicating further capitulation\",\n      \"leverage\": 15,\n      \"confidence\": 0.75,\n      \"risk_usd\": 479.25\n    }\n  }\n}\n```",
      "signals": [
        {
          "coin": "BTC",
          "signal": "buy",
          "quantity": 0.08,
          "leverage": 15,
          "stop_loss": 109500.0,
          "profit_target": 113500.0,
          "confidence": 0.72,
          "risk_usd": 564.0,
          "invalidation_condition": "If price breaks below $109,500 (new low) or RSI(7) falls below 12 indicating further capitulation"
        },
        {
          "coin": "ETH",
          "signal": "buy",
          "quantity": 1.5,
          "leverage": 15,
          "stop_loss": 3850.0,
          "profit_target": 4020.0,
          "confidence": 0.75,
          "risk_usd": 479.25,
          "invalidation_condition": "If price breaks below $3,850 (new low) or RSI(7) falls below 10 indicating further capitulation"
        }
      ]
    },
    {
      "iteration": 78,
      "timestamp": "2025-10-29T20:00:00",
      "model": "anthropic",
      "raw_response": "# CHAIN OF THOUGHT\n\n## Current Market Analysis\n\n**BTC Position Review:**\n- Entry: $110,675 | Current: $110,102 | Unrealized PnL: -$50.27\n- Stop-loss: $109,500 | Profit target: $113,500\n- Invalidation: \"If price breaks below $109,500 or RSI(7) falls below 12\"\n- Current RSI(7): 13.152 (just above invalidation threshold of 12)\n- Current price is $602 above stop-loss ($109,500)\n- Technical analysis: RSI(7) at 13.152 shows extreme oversold, MACD at -711.987 (deeply negative), price below EMA20 ($113,027)\n- **Decision: HOLD** - While position is underwater, invalidation condition NOT met (RSI still above 12, price above $109,500). Extreme oversold conditions suggest potential bounce. Stop-loss provides protection if decline continues.\n\n**ETH Position Review:**\n- Entry: $3,903.30 | Current: $3,902 | Unrealized PnL: -$4.88\n- Stop-loss: $3,850 | Profit target: $4,020\n- Invalidation: \"If price breaks below $3,850 or RSI(7) falls below 10\"\n- Current RSI(7): 13.487 (above invalidation threshold of 10)\n- Current price is $52 above stop-loss ($3,850)\n- Technical analysis: RSI(7) at 13.487 shows extreme oversold, MACD at -42.487 (negative), price well below EMA20 ($4,032)\n- **Decision: HOLD** - Invalidation condition NOT met (RSI above 10, price above $3,850). Position essentially flat. Extreme oversold suggests potential reversal. Maintaining position with tight stop-loss protection.\n\n**Other Coins (SOL, BNB, XRP, DOGE):**\n- No existing positions\n- All showing weakness: SOL (RSI 38.6), BNB (RSI 41.9), XRP (RSI 16.8 - extreme oversold), DOGE (RSI 36.8)\n- Market-wide selloff in progress with all coins below their EMA20s\n- **Decision: NO NEW POSITIONS** - Risk management dictates not adding exposure during broad market decline. Current positions already provide sufficient exposure to potential bounce.\n\n## Risk Management Assessment:\n- Current account value: $15,628.89\n- Total exposure: $14,661.16 (BTC: $8,808 + ETH: $5,853)\n- Utilization: ~93.8% of account value\n- Both positions have tight stop-losses protecting against further downside\n- Portfolio is heavily leveraged but protected by stops\n- Sharpe ratio of 10.099 indicates strong risk-adjusted returns to date\n\n# TRADING DECISIONS\n\n```json\n{\n  \"BTC\": {\n    \"trade_signal_args\": {\n      \"coin\": \"BTC\",\n      \"signal\": \"hold\",\n      \"quantity\": 0.08,\n      \"profit_target\": 113500.0,\n      \"stop_loss\": 109500.0,\n      \"invalidation_condition\": \"If price breaks below $109,500 (new low) or RSI(7) falls below 12 indicating further capitulation\",\n      \"leverage\": 15,\n      \"confidence\": 0.72,\n      \"risk_usd\": 564.0\n    }\n  },\n  \"ETH\": {\n    \"trade_signal_args\": {\n      \"coin\": \"ETH\",\n      \"signal\": \"hold\",\n      \"quantity\": 1.5,\n      \"profit_target\": 4020.0,\n      \"stop_loss\": 3850.0,\n      \"invalidation_condition\": \"If price breaks below $3,850 (new low) or RSI(7) falls below 10 indicating further capitulation\",\n      \"leverage\": 15,\n      \"confidence\": 0.75,\n      \"risk_usd\": 479.25\n    }\n  }\n}\n```",
      "signals": [
        {
          "coin": "BTC",
          "signal": "hold",
          "quantity": 0.08,
          "leverage": 15,
          "stop_loss": 109500.0,
          "profit_target": 113500.0,
          "confidence": 0.72,
          "risk_usd": 564.0,
          "invalidation_condition": "If price breaks below $109,500 (new low) or RSI(7) falls below 12 indicating further capitulation"
        },
        {
          "coin": "ETH",
          "signal": "hold",
          "quantity": 1.5,
          "leverage": 15,
          "stop_loss": 3850.0,
          "profit_target": 4020.0,
          "confidence": 0.75,
          "risk_usd": 479.25,
          "invalidation_condition": "If price breaks below $3,850 (new low) or RSI(7) falls below 10 indicating further capitulation"
        }
      ]
    },
    {
      "iteration": 79,
      "timestamp": "2025-10-30T00:00:00",
      "model": "anthropic",
      "raw_response": "# CHAIN OF THOUGHT\n\nLet me analyze my current positions against their invalidation conditions and market state:\n\n## BTC Position Analysis\n- **Entry:** $110,675 | **Current:** $110,833 | **Unrealized PnL:** +$8.21\n- **Stop-loss:** $109,500 | **Profit target:** $113,500\n- **Invalidation condition:** \"If price breaks below $109,500 (new low) or RSI(7) falls below 12\"\n- **Current RSI(7):** 33.781 (recovering from extreme oversold)\n- **Current price vs stop-loss:** $110,833 vs $109,500 = $1,333 cushion (1.2%)\n- **Technical state:** Price is $2,115 below EMA20 ($112,948), MACD deeply negative (-965), but RSI recovering from 13.0 to 33.8\n- **Analysis:** The invalidation condition is NOT met. Price is above $109,500 and RSI(7) is at 33.8, well above 12. However, the position is barely profitable and BTC remains in a strong downtrend (price below EMA, negative MACD). The recent RSI bounce from 13 to 33.8 suggests short-term oversold relief, but the broader trend is still bearish.\n- **Decision:** HOLD - Invalidation not triggered, but monitor closely as we're still in downtrend territory.\n\n## ETH Position Analysis\n- **Entry:** $3,903.30 | **Current:** $3,933.40 | **Unrealized PnL:** +$42.22\n- **Stop-loss:** $3,850 | **Profit target:** $4,020\n- **Invalidation condition:** \"If price breaks below $3,850 (new low) or RSI(7) falls below 10\"\n- **Current RSI(7):** 36.350 (recovering from extreme oversold)\n- **Current price vs stop-loss:** $3,933.40 vs $3,850 = $83.40 cushion (2.2%)\n- **Current price vs profit target:** $3,933.40 vs $4,020 = $86.60 away (2.2%)\n- **Technical state:** Price is $102 below EMA20 ($4,035), MACD negative (-61.46), RSI recovering from 13.09 to 36.35\n- **Analysis:** Invalidation NOT met. Price well above $3,850 and RSI(7) at 36.35 is far above 10. ETH is showing similar recovery pattern to BTC - bouncing from extreme oversold (RSI hit 8.68, then 13.09, now 36.35). We're only $86.60 from profit target. The recovery momentum is stronger than BTC.\n- **Decision:** HOLD - Close to profit target, invalidation not triggered, showing recovery momentum.\n\n## Other Coins (SOL, BNB, XRP, DOGE)\n- **SOL:** RSI(7) at 58.845, showing recovery. Price near EMA20 ($197.17 vs $197.45). MACD improving. Neutral/slightly bullish but not compelling enough to enter.\n- **BNB:** RSI(7) at 62.011, recovering strongly. Price near EMA20 ($1,118 vs $1,122). Similar recovery pattern but already extended.\n- **XRP:** RSI(7) at 38.981, below EMA20. Still weak, not attractive.\n- **DOGE:** RSI(7) at 48.128, below EMA20. Neutral, no edge.\n\n**Risk Management Review:**\n- Total exposure: $14,766.74 in notional positions vs $14,706.63 cash\n- Both positions are small profitable (+$50.44 combined)\n- Portfolio is well-balanced with reasonable leverage (15x)\n- No reason to close profitable positions that haven't triggered invalidation\n\n**Conclusion:** Both positions should be HELD. Neither has triggered invalidation conditions, both are profitable, and both show technical recovery from extreme oversold. ETH is particularly close to profit target. No new positions warranted given market uncertainty.\n\n# TRADING DECISIONS\n\n```json\n{\n  \"BTC\": {\n    \"trade_signal_args\": {\n      \"coin\": \"BTC\",\n      \"signal\": \"hold\",\n      \"quantity\": 0.08,\n      \"profit_target\": 113500.0,\n      \"stop_loss\": 109500.0,\n      \"invalidation_condition\": \"If price breaks below $109,500 (new low) or RSI(7) falls below 12 indicating further capitulation\",\n      \"leverage\": 15,\n      \"confidence\": 0.72,\n      \"risk_usd\": 564.0\n    }\n  },\n  \"ETH\": {\n    \"trade_signal_args\": {\n      \"coin\": \"ETH\",\n      \"signal\": \"hold\",\n      \"quantity\": 1.5,\n      \"profit_target\": 4020.0,\n      \"stop_loss\": 3850.0,\n      \"invalidation_condition\": \"If price breaks below $3,850 (new low) or RSI(7) falls below 10 indicating further capitulation\",\n      \"leverage\": 15,\n      \"confidence\": 0.75,\n      \"risk_usd\": 479.25\n    }\n  }\n}\n```",
      "signals": [
        {
          "coin": "BTC",
          "signal": "hold",
          "quantity": 0.08,
          "leverage": 15,
          "stop_loss": 109500.0,
          "profit_target": 113500.0,
          "confidence": 0.72,
          "risk_usd": 564.0,
          "invalidation_condition": "If price breaks below $109,500 (new low) or RSI(7) falls below 12 indicating further capitulation"
        },
        {
          "coin": "ETH",
          "signal": "hold",
          "quantity": 1.5,
          "leverage": 15,
          "stop_loss": 3850.0,
          "profit_target": 4020.0,
          "confidence": 0.75,
          "risk_usd": 479.25,
          "invalidation_condition": "If price breaks below $3,850 (new low) or RSI(7) falls below 10 indicating further capitulation"
        }
      ]
    },
    {
      "iteration": 80,
      "timestamp": "2025-10-30T04:00:00",
      "model": "anthropic",
      "raw_response": "# CHAIN OF THOUGHT\n\n## Current Portfolio Analysis\nAccount Value: $15,801.25 (58.01% return)\nAvailable Cash: $14,706.63\nOpen Positions: BTC ($8,914.40 notional) and ETH ($5,908.35 notional)\n\n## Position-by-Position Review\n\n### BTC Position Analysis\n- **Entry**: $110,675 | **Current**: $111,430 | **PnL**: +$55.97 (+0.68%)\n- **Stop-Loss**: $109,500 | **Profit Target**: $113,500\n- **Invalidation Condition**: \"If price breaks below $109,500 or RSI(7) falls below 12\"\n\n**Technical Analysis**:\n- Current price $111,430 is ABOVE entry ($110,675) \u2713\n- RSI(7): 47.415 - recovered from oversold, now neutral territory\n- MACD: -1042.464 - still deeply negative but improving from -1050.721\n- Price below EMA20 ($112,864) - still in bearish territory\n- Recent price action: bounced from $110,102 low to $111,430 (+1.2%)\n\n**Invalidation Check**: \n- Price is $1,930 ABOVE stop-loss ($109,500) \u2713\n- RSI(7) at 47.415 is well ABOVE the 12 threshold \u2713\n- Invalidation condition NOT met\n\n**Decision**: **HOLD** - Position is profitable, invalidation not triggered, showing signs of stabilization with RSI recovery. The bounce from $110k level suggests support. Will let it run toward $113,500 target.\n\n### ETH Position Analysis\n- **Entry**: $3,903.30 | **Current**: $3,938.90 | **PnL**: +$50.47 (+0.91%)\n- **Stop-Loss**: $3,850 | **Profit Target**: $4,020\n- **Invalidation Condition**: \"If price breaks below $3,850 or RSI(7) falls below 10\"\n\n**Technical Analysis**:\n- Current price $3,938.90 is ABOVE entry ($3,903.30) \u2713\n- RSI(7): 39.971 - recovered from extreme oversold (was 7.494)\n- MACD: -69.530 - improving from -70.141, showing momentum stabilization\n- Price below EMA20 ($4,032.56) - still bearish but gap narrowing\n- Recent low was $3,902 (nearly hit stop-loss), now recovered to $3,938.90\n\n**Invalidation Check**:\n- Price is $88.90 ABOVE stop-loss ($3,850) \u2713\n- RSI(7) at 39.971 is well ABOVE the 10 threshold \u2713\n- Invalidation condition NOT met\n\n**Decision**: **HOLD** - Position is profitable, invalidation not triggered. ETH showed strong recovery from the $3,902 low. RSI recovery from 7.494 to 39.971 indicates buying pressure returning. Profit target of $4,020 is only $81 away (2.1%), achievable in this recovery phase.\n\n## Other Coins Assessment\n\n### SOL\n- Price: $195.87 | EMA20: $197.89\n- RSI(7): 49.769 (neutral)\n- MACD: -2.064 (slightly negative)\n- No position, market showing consolidation. Not compelling enough to enter.\n\n### BNB\n- Price: $1,118.20 | EMA20: $1,123.98\n- RSI(7): 61.663 (bullish territory)\n- MACD: -10.245 (improving)\n- Showing relative strength but below EMA. Would need clearer breakout signal.\n\n### XRP\n- Price: $2.58 | EMA20: $2.61\n- RSI(7): 42.283 (neutral)\n- MACD: -0.014 (near zero)\n- Consolidating, no clear directional bias.\n\n### DOGE\n- Price: $0.192540 | EMA20: $0.197087\n- RSI(7): 40.209 (neutral-weak)\n- MACD: -0.003 (negative)\n- Below EMA, weak momentum. Pass.\n\n**Conclusion**: Will hold both BTC and ETH positions as neither has triggered invalidation conditions, both are profitable, and both show technical recovery signs. No new positions warranted given current market consolidation across other assets.\n\n# TRADING DECISIONS\n\n```json\n{\n  \"BTC\": {\n    \"trade_signal_args\": {\n      \"coin\": \"BTC\",\n      \"signal\": \"hold\",\n      \"quantity\": 0.08,\n      \"profit_target\": 113500.0,\n      \"stop_loss\": 109500.0,\n      \"invalidation_condition\": \"If price breaks below $109,500 (new low) or RSI(7) falls below 12 indicating further capitulation\",\n      \"leverage\": 15,\n      \"confidence\": 0.72,\n      \"risk_usd\": 564.0\n    }\n  },\n  \"ETH\": {\n    \"trade_signal_args\": {\n      \"coin\": \"ETH\",\n      \"signal\": \"hold\",\n      \"quantity\": 1.5,\n      \"profit_target\": 4020.0,\n      \"stop_loss\": 3850.0,\n      \"invalidation_condition\": \"If price breaks below $3,850 (new low) or RSI(7) falls below 10 indicating further capitulation\",\n      \"leverage\": 15,\n      \"confidence\": 0.75,\n      \"risk_usd\": 479.25\n    }\n  }\n}\n```",
      "signals": [
        {
          "coin": "BTC",
          "signal": "hold",
          "quantity": 0.08,
          "leverage": 15,
          "stop_loss": 109500.0,
          "profit_target": 113500.0,
          "confidence": 0.72,
          "risk_usd": 564.0,
          "invalidation_condition": "If price breaks below $109,500 (new low) or RSI(7) falls below 12 indicating further capitulation"
        },
        {
          "coin": "ETH",
          "signal": "hold",
          "quantity": 1.5,
          "leverage": 15,
          "stop_loss": 3850.0,
          "profit_target": 4020.0,
          "confidence": 0.75,
          "risk_usd": 479.25,
          "invalidation_condition": "If price breaks below $3,850 (new low) or RSI(7) falls below 10 indicating further capitulation"
        }
      ]
    },
    {
      "iteration": 81,
      "timestamp": "2025-10-30T08:00:00",
      "model": "anthropic",
      "raw_response": "# CHAIN OF THOUGHT\n\nReviewing my current positions against their invalidation conditions and market state:\n\n**BTC Position Analysis:**\n- Entry: $110,675 | Current: $109,784 | Unrealized P&L: -$75.71\n- Stop-loss: $109,500 | Profit target: $113,500\n- Invalidation: \"If price breaks below $109,500 (new low) or RSI(7) falls below 12\"\n- Current RSI(7): 26.909 (above 12, not invalidated on RSI)\n- Price is ABOVE stop-loss ($109,784 > $109,500) by only $284\n- However, price action shows weakness: dropped from $111,430 to $109,784\n- MACD: -1247.861 (very negative, worsening bearish momentum)\n- Price well below EMA20 ($109,784 vs $112,640.81)\n- RSI(7) at 26.909 shows oversold but not extreme capitulation\n- **Decision: HOLD** - Invalidation NOT met yet. Price still above $109,500 stop-loss. Will let stop-loss work if price continues down. Position is small (-$75 loss) and within risk tolerance.\n\n**ETH Position Analysis:**\n- Entry: $3,903.30 | Current: $3,880.70 | Unrealized P&L: -$36.83\n- Stop-loss: $3,850 | Profit target: $4,020\n- Invalidation: \"If price breaks below $3,850 (new low) or RSI(7) falls below 10\"\n- Current RSI(7): 21.823 (above 10, not invalidated)\n- Price is ABOVE stop-loss ($3,880.70 > $3,850) by $30.70\n- Price dropped from $3,938.90 to $3,880.70, showing weakness\n- MACD: -72.489 (very negative, worsening)\n- Price below EMA20 ($3,880.70 vs $4,017.79)\n- RSI(7) at 21.823 shows oversold conditions\n- **Decision: HOLD** - Invalidation NOT met. Price still above $3,850 stop-loss. Small unrealized loss within acceptable range. Will monitor closely.\n\n**Market Context:**\n- Both BTC and ETH showing bearish pressure but haven't broken invalidation levels\n- RSI levels suggest oversold conditions (BTC: 26.9, ETH: 21.8) which could mean bounce potential\n- Both positions are small losses and stops are close to current prices\n- No new positions warranted - market showing downtrend across all major coins\n- SOL, BNB, XRP, DOGE all showing bearish technicals - no entry signals\n\n**Risk Management:**\n- Current account value: $15,567.68\n- Total unrealized loss: -$112.53 (0.72% of account)\n- Both positions have tight stops that will trigger if weakness continues\n- Portfolio exposure is reasonable at ~$14,603 notional across 2 positions\n\n# TRADING DECISIONS\n\n```json\n{\n  \"BTC\": {\n    \"trade_signal_args\": {\n      \"coin\": \"BTC\",\n      \"signal\": \"hold\",\n      \"quantity\": 0.08,\n      \"profit_target\": 113500.0,\n      \"stop_loss\": 109500.0,\n      \"invalidation_condition\": \"If price breaks below $109,500 (new low) or RSI(7) falls below 12 indicating further capitulation\",\n      \"leverage\": 15,\n      \"confidence\": 0.72,\n      \"risk_usd\": 564.0\n    }\n  },\n  \"ETH\": {\n    \"trade_signal_args\": {\n      \"coin\": \"ETH\",\n      \"signal\": \"hold\",\n      \"quantity\": 1.5,\n      \"profit_target\": 4020.0,\n      \"stop_loss\": 3850.0,\n      \"invalidation_condition\": \"If price breaks below $3,850 (new low) or RSI(7) falls below 10 indicating further capitulation\",\n      \"leverage\": 15,\n      \"confidence\": 0.75,\n      \"risk_usd\": 479.25\n    }\n  }\n}\n```",
      "signals": [
        {
          "coin": "BTC",
          "signal": "hold",
          "quantity": 0.08,
          "leverage": 15,
          "stop_loss": 109500.0,
          "profit_target": 113500.0,
          "confidence": 0.72,
          "risk_usd": 564.0,
          "invalidation_condition": "If price breaks below $109,500 (new low) or RSI(7) falls below 12 indicating further capitulation"
        },
        {
          "coin": "ETH",
          "signal": "hold",
          "quantity": 1.5,
          "leverage": 15,
          "stop_loss": 3850.0,
          "profit_target": 4020.0,
          "confidence": 0.75,
          "risk_usd": 479.25,
          "invalidation_condition": "If price breaks below $3,850 (new low) or RSI(7) falls below 10 indicating further capitulation"
        }
      ]
    },
    {
      "iteration": 82,
      "timestamp": "2025-10-30T12:00:00",
      "model": "anthropic",
      "raw_response": "# CHAIN OF THOUGHT\n\n## Market Overview\nAll major cryptocurrencies are experiencing severe selling pressure with deeply oversold conditions:\n- **BTC**: Down to 107,752 from 112,502 (-4.2%), RSI(7)=15.7, RSI(14)=19.6, MACD=-1446\n- **ETH**: Down to 3,772 from 3,996 (-5.6%), RSI(7)=10.3, RSI(14)=14.8, MACD=-75.6\n- **SOL**: Down to 185.02 from 193.95 (-4.6%), RSI(7)=16.3, RSI(14)=23.6, MACD=-2.25\n- **BNB**: Down to 1,076 from 1,103 (-2.4%), RSI(7)=15.3, RSI(14)=21.5, MACD=-17.5\n- **XRP**: Down to 2.45 from 2.61 (-6.1%), RSI(7)=12.1, RSI(14)=18.6, MACD=-0.026\n- **DOGE**: Down to 0.1806 from 0.1929 (-6.4%), RSI(7)=10.7, RSI(14)=16.1, MACD=-0.004\n\n## Current Position Status\n**NO OPEN POSITIONS** - Cash: $15,242.99\n\n## Analysis & Strategy\n\n### Extreme Oversold Conditions\nAll coins show RSI(7) below 20 and RSI(14) below 25, indicating extreme oversold conditions. This typically presents mean-reversion opportunities, but the strong downward momentum (negative MACD, prices well below EMA20) suggests caution.\n\n### Key Observations:\n1. **Volume spike**: All coins showing elevated volume vs. average, confirming strong selling pressure\n2. **Price vs EMA20**: All coins trading 4-10% below their 20-period EMA, indicating strong bearish momentum\n3. **MACD deeply negative**: All coins showing accelerating downward momentum\n4. **Capitulation signals**: ETH (RSI 10.3) and DOGE (RSI 10.7) showing potential capitulation levels\n\n### Trading Opportunity Assessment:\n\n**Best Setup - ETH:**\n- Most extreme oversold: RSI(7)=10.3, RSI(14)=14.8\n- Clear support level around 3,750-3,770\n- High volume (231K vs 104K avg) suggests potential exhaustion\n- Risk/reward favorable for mean-reversion play\n\n**Second Best - DOGE:**\n- RSI(7)=10.7, extreme oversold\n- Volume spike (206M vs 60M avg) \n- Potential bounce candidate from 0.180 level\n\n**BTC - Consider but cautious:**\n- RSI(7)=15.7 oversold but not extreme\n- Large position size would be required, higher absolute risk\n- Better to play alts in oversold bounces\n\n### Risk Management:\n- Account value: $15,242.99\n- Target 3-5% risk per trade (~$450-750)\n- Use 15x leverage for better capital efficiency\n- Tight stops given volatility\n\n### Trade Plan:\nEnter **ETH** as primary position - extreme oversold with highest probability of mean-reversion bounce. Target bounce to EMA20 or mid-range recovery.\n\n# TRADING DECISIONS\n\n```json\n{\n  \"ETH\": {\n    \"trade_signal_args\": {\n      \"coin\": \"ETH\",\n      \"signal\": \"buy\",\n      \"quantity\": 1.2,\n      \"profit_target\": 3900.0,\n      \"stop_loss\": 3720.0,\n      \"invalidation_condition\": \"If price breaks below 3720 or RSI(14) fails to recover above 20 within next 30 minutes\",\n      \"leverage\": 15,\n      \"confidence\": 0.72,\n      \"risk_usd\": 630.0\n    }\n  }\n}\n```",
      "signals": [
        {
          "coin": "ETH",
          "signal": "buy",
          "quantity": 1.2,
          "leverage": 15,
          "stop_loss": 3720.0,
          "profit_target": 3900.0,
          "confidence": 0.72,
          "risk_usd": 630.0,
          "invalidation_condition": "If price breaks below 3720 or RSI(14) fails to recover above 20 within next 30 minutes"
        }
      ]
    },
    {
      "iteration": 83,
      "timestamp": "2025-10-30T16:00:00",
      "model": "anthropic",
      "raw_response": "# CHAIN OF THOUGHT\n\n## Market Analysis\n\nAll major cryptocurrencies are experiencing severe selling pressure with deeply oversold conditions:\n\n**BTC**: Price $106,526 (down from $113,569)\n- RSI(7): 11.79 - EXTREMELY oversold (below 20)\n- RSI(14): 16.35 - Deeply oversold\n- MACD: -1,641.77 - Strong bearish momentum\n- Price 4.5% below EMA20 ($111,562)\n- Volume elevated at 173% of average\n\n**ETH**: Price $3,688 (down from $4,022)\n- RSI(7): 6.60 - CRITICALLY oversold (lowest of all)\n- RSI(14): 10.92 - Extreme oversold\n- MACD: -92.01 - Accelerating downward\n- Price 6.9% below EMA20 ($3,961)\n- Volume elevated at 132% of average\n\n**SOL**: Price $179.02 (down from $195.67)\n- RSI(7): 10.53 - EXTREMELY oversold\n- RSI(14): 17.75 - Deeply oversold\n- MACD: -3.27 - Strong bearish\n- Price 7.7% below EMA20 ($194.01)\n- Volume elevated at 156% of average\n\n**XRP**: Price $2.38 (down from $2.63)\n- RSI(7): 7.73 - CRITICALLY oversold\n- RSI(14): 13.08 - Extreme oversold\n- MACD: -0.046 - Bearish\n- Price 7.8% below EMA20 ($2.58)\n\n**DOGE**: Price $0.1768 (down from $0.1943)\n- RSI(7): 8.01 - CRITICALLY oversold\n- RSI(14): 13.33 - Extreme oversold\n- MACD: -0.005 - Bearish\n- Price 8.2% below EMA20 ($0.1925)\n\n**BNB**: Price $1,061.20 (down from $1,116.60)\n- RSI(7): 11.19 - EXTREMELY oversold\n- RSI(14): 18.11 - Deeply oversold\n- MACD: -13.69 - Strong bearish\n- Price 4.5% below EMA20 ($1,111.37)\n\n## Trading Decision\n\n**Current Status**: No open positions, $15,134.61 cash available\n\n**Opportunity Assessment**: \nThis is a rare market condition with ALL major coins showing RSI(7) below 12 and RSI(14) below 20. This represents extreme capitulation selling that historically precedes sharp mean-reversion bounces. However, the risk is that momentum can continue lower in panic selling.\n\n**Strategy**: I will initiate SMALL counter-trend positions in the most oversold coins (ETH, XRP, DOGE) with tight stop-losses, targeting mean reversion to EMA20 levels. Using lower leverage (10x) and limiting risk to ~$500-600 per position to manage downside if selling continues.\n\n**Position Selection**:\n1. **ETH** - RSI(7) at 6.60 is the most extreme, suggesting highest probability of bounce\n2. **XRP** - RSI(7) at 7.73, second most oversold, good risk/reward\n3. **DOGE** - RSI(7) at 8.01, strong oversold signal\n\nWill skip BTC, SOL, BNB to maintain diversification and capital for additional opportunities.\n\n# TRADING DECISIONS\n\n```json\n{\n  \"ETH\": {\n    \"trade_signal_args\": {\n      \"coin\": \"ETH\",\n      \"signal\": \"buy\",\n      \"quantity\": 1.5,\n      \"profit_target\": 3850.0,\n      \"stop_loss\": 3610.0,\n      \"invalidation_condition\": \"If price breaks below $3,610 or RSI(7) fails to recover above 15 within next 5 candles\",\n      \"leverage\": 10,\n      \"confidence\": 0.72,\n      \"risk_usd\": 585.0\n    }\n  },\n  \"XRP\": {\n    \"trade_signal_args\": {\n      \"coin\": \"XRP\",\n      \"signal\": \"buy\",\n      \"quantity\": 2100.0,\n      \"profit_target\": 2.52,\n      \"stop_loss\": 2.31,\n      \"invalidation_condition\": \"If price breaks below $2.31 or fails to hold above $2.35 for 3 consecutive candles\",\n      \"leverage\": 10,\n      \"confidence\": 0.68,\n      \"risk_usd\": 588.0\n    }\n  },\n  \"DOGE\": {\n    \"trade_signal_args\": {\n      \"coin\": \"DOGE\",\n      \"signal\": \"buy\",\n      \"quantity\": 28000.0,\n      \"profit_target\": 0.186,\n      \"stop_loss\": 0.171,\n      \"invalidation_condition\": \"If price breaks below $0.171 or RSI(7) fails to recover above 12 within next 5 candles\",\n      \"leverage\": 10,\n      \"confidence\": 0.65,\n      \"risk_usd\": 544.0\n    }\n  }\n}\n```",
      "signals": [
        {
          "coin": "ETH",
          "signal": "buy",
          "quantity": 1.5,
          "leverage": 10,
          "stop_loss": 3610.0,
          "profit_target": 3850.0,
          "confidence": 0.72,
          "risk_usd": 585.0,
          "invalidation_condition": "If price breaks below $3,610 or RSI(7) fails to recover above 15 within next 5 candles"
        },
        {
          "coin": "XRP",
          "signal": "buy",
          "quantity": 2100.0,
          "leverage": 10,
          "stop_loss": 2.31,
          "profit_target": 2.52,
          "confidence": 0.68,
          "risk_usd": 588.0,
          "invalidation_condition": "If price breaks below $2.31 or fails to hold above $2.35 for 3 consecutive candles"
        },
        {
          "coin": "DOGE",
          "signal": "buy",
          "quantity": 28000.0,
          "leverage": 10,
          "stop_loss": 0.171,
          "profit_target": 0.186,
          "confidence": 0.65,
          "risk_usd": 544.0,
          "invalidation_condition": "If price breaks below $0.171 or RSI(7) fails to recover above 12 within next 5 candles"
        }
      ]
    },
    {
      "iteration": 84,
      "timestamp": "2025-10-30T20:00:00",
      "model": "anthropic",
      "raw_response": "# CHAIN OF THOUGHT\n\n## Current Market Analysis\nThe entire crypto market is experiencing significant downward pressure:\n- **BTC**: Down to 108,360 from 113,134 (-4.2%), deeply oversold with RSI(7) at 41.19, below EMA20\n- **ETH**: Down to 3,803.70 from 4,008.70 (-5.1%), RSI(7) at 43.35, recovering from extreme oversold\n- **SOL**: Down to 184.62 from 198.84 (-7.1%), RSI(7) at 37.87, below EMA20\n- **BNB**: Down to 1,078.20 from 1,113.00 (-3.1%), RSI(7) at 37.08\n- **XRP**: Down to 2.44 from 2.65 (-7.9%), RSI(7) at 32.82, deeply oversold\n- **DOGE**: Down to 0.18253 from 0.19534 (-6.6%), RSI(7) at 39.26\n\nAll coins show negative MACD, prices below EMA20, and declining momentum. This is a broad market selloff.\n\n## Position-by-Position Review\n\n### ETH Position (1.5 ETH @ $3,688 entry)\n- **Current P&L**: +$170.78 (+3.1%)\n- **Current Price**: $3,803.70\n- **Profit Target**: $3,850 (just $46.30 away - 1.2%)\n- **Stop Loss**: $3,610 (protected by $193.70 - 5.1%)\n- **Invalidation**: \"If price breaks below $3,610 or RSI(7) fails to recover above 15 within next 5 candles\"\n\n**Analysis**: \n- Price bounced from $3,688 low to $3,803.70 (+3.1%)\n- RSI(7) recovered from 6.56 to 43.35 - invalidation condition NOT met (it DID recover above 15)\n- Price is ABOVE stop-loss at $3,610\n- Very close to profit target ($3,850)\n- However, strong resistance at EMA20 ($3,949) and price showing weakness\n\n**Decision**: **CLOSE** - Take profits. We're up 3.1%, close to profit target, and the broader market is showing significant weakness. RSI recovered as required, but the risk/reward here favors locking in gains given the market selloff.\n\n### XRP Position (2,100 XRP @ $2.383 entry)\n- **Current P&L**: +$112.58 (+2.3%)\n- **Current Price**: $2.44\n- **Profit Target**: $2.52 (still $0.08 away - 3.3%)\n- **Stop Loss**: $2.31 (protected by $0.13 - 5.3%)\n- **Invalidation**: \"If price breaks below $2.31 or fails to hold above $2.35 for 3 consecutive candles\"\n\n**Analysis**:\n- Price at $2.44, well above stop-loss at $2.31\n- Recent candles: $2.54, $2.45, $2.38, $2.44 - price DID drop below $2.35 to $2.38\n- RSI(7) at 32.82 - deeply oversold\n- MACD at -0.052 - strongly negative\n- Price below EMA20 ($2.56) with downward pressure\n\n**Decision**: **CLOSE** - Invalidation condition approaching. Price dropped to $2.38, which is below the $2.35 threshold mentioned in invalidation. While currently at $2.44, the momentum is clearly bearish with RSI at 32.82 and strong selling pressure. Take the 2.3% profit before stop-loss is hit.\n\n### DOGE Position (28,000 DOGE @ $0.17684 entry)\n- **Current P&L**: +$156.84 (+3.1%)\n- **Current Price**: $0.18253\n- **Profit Target**: $0.186 (just $0.00347 away - 1.9%)\n- **Stop Loss**: $0.171 (protected by $0.01153 - 6.3%)\n- **Invalidation**: \"If price breaks below $0.171 or RSI(7) fails to recover above 12 within next 5 candles\"\n\n**Analysis**:\n- Price bounced from $0.17684 low to $0.18253 (+3.2%)\n- RSI(7) recovered from 7.99 to 39.26 - invalidation NOT met (it DID recover above 12)\n- Price is ABOVE stop-loss at $0.171\n- Very close to profit target ($0.186)\n- However, price still below EMA20 ($0.19160) and showing resistance\n\n**Decision**: **CLOSE** - Take profits. We're up 3.1%, very close to profit target, and the market is showing broad weakness. RSI recovered as required, but given the overall market selloff and proximity to target, it's prudent to lock in gains.\n\n## New Position Opportunities\n\nGiven the severe market-wide selloff with all major coins showing:\n- Deeply oversold RSI levels (32-43 range on 7-period)\n- Negative MACD across the board\n- Prices below EMA20\n- High volatility and downward momentum\n\n**Decision**: **NO NEW POSITIONS**. This is a risk-off environment. Better to preserve capital and wait for clearer reversal signals or stabilization. The market could continue dropping, and opening new leveraged positions now would be catching a falling knife.\n\n# TRADING DECISIONS\n\n```json\n{\n  \"ETH\": {\n    \"trade_signal_args\": {\n      \"coin\": \"ETH\",\n      \"signal\": \"close_position\",\n      \"quantity\": 1.5,\n      \"profit_target\": 3850.0,\n      \"stop_loss\": 3610.0,\n      \"invalidation_condition\": \"If price breaks below $3,610 or RSI(7) fails to recover above 15 within next 5 candles\",\n      \"leverage\": 10,\n      \"confidence\": 0.72,\n      \"risk_usd\": 585.0,\n      \"close_reason\": \"Taking profits at +3.1% near profit target. Broad market weakness and resistance at EMA20 ($3,949) suggest limited upside. Locking in gains before potential reversal.\"\n    }\n  },\n  \"XRP\": {\n    \"trade_signal_args\": {\n      \"coin\": \"XRP\",\n      \"signal\": \"close_position\",\n      \"quantity\": 2100.0,\n      \"profit_target\": 2.52,\n      \"stop_loss\": 2.31,\n      \"invalidation_condition\": \"If price breaks below $2.31 or fails to hold above $2.35 for 3 consecutive candles\",\n      \"leverage\": 10,\n      \"confidence\": 0.68,\n      \"risk_usd\": 588.0,\n      \"close_reason\": \"Invalidation condition approaching - price dropped to $2.38 below $2.35 threshold. RSI(7) at 32.82 deeply oversold with strong bearish momentum. Taking +2.3% profit before stop-loss risk increases.\"\n    }\n  },\n  \"DOGE\": {\n    \"trade_signal_args\": {\n      \"coin\": \"DOGE\",\n      \"signal\": \"close_position\",\n      \"quantity\": 28000.0,\n      \"profit_target\": 0.186,\n      \"stop_loss\": 0.171,\n      \"invalidation_condition\": \"If price breaks below $0.171 or RSI(7) fails to recover above 12 within next 5 candles\",\n      \"leverage\": 10,\n      \"confidence\": 0.65,\n      \"risk_usd\": 544.0,\n      \"close_reason\": \"Taking profits at +3.1% very close to profit target ($0.186). Market-wide selloff creates downside risk. Prudent to lock in gains and preserve capital in this volatile environment.\"\n    }\n  }\n}\n```",
      "signals": [
        {
          "coin": "ETH",
          "signal": "close_position",
          "quantity": 1.5,
          "leverage": 10,
          "stop_loss": 3610.0,
          "profit_target": 3850.0,
          "confidence": 0.72,
          "risk_usd": 585.0,
          "invalidation_condition": "If price breaks below $3,610 or RSI(7) fails to recover above 15 within next 5 candles"
        },
        {
          "coin": "XRP",
          "signal": "close_position",
          "quantity": 2100.0,
          "leverage": 10,
          "stop_loss": 2.31,
          "profit_target": 2.52,
          "confidence": 0.68,
          "risk_usd": 588.0,
          "invalidation_condition": "If price breaks below $2.31 or fails to hold above $2.35 for 3 consecutive candles"
        },
        {
          "coin": "DOGE",
          "signal": "close_position",
          "quantity": 28000.0,
          "leverage": 10,
          "stop_loss": 0.171,
          "profit_target": 0.186,
          "confidence": 0.65,
          "risk_usd": 544.0,
          "invalidation_condition": "If price breaks below $0.171 or RSI(7) fails to recover above 12 within next 5 candles"
        }
      ]
    },
    {
      "iteration": 85,
      "timestamp": "2025-10-31T00:00:00",
      "model": "anthropic",
      "raw_response": "# CHAIN OF THOUGHT\n\n\u26a0\ufe0f **CRITICAL NOTICE: This is the FINAL candle of the backtest period.**\n\nI have NO open positions currently, and this is the final candle. According to the instructions, I must ensure all positions are closed at the end of the backtest period. Since I have no open positions, there is nothing to close.\n\n**Current Portfolio Status:**\n- Available Cash: $15,559.10\n- Total Return: 55.59%\n- Sharpe Ratio: 9.220\n- Open Positions: NONE\n\n**Market Analysis (Final Candle):**\n\n**BTC:** Price at 109,241, below EMA20 (110,946). RSI recovering to 51.6 from oversold. MACD still negative (-1,476) but improving slightly. Price showing bounce from lows around 106,526.\n\n**ETH:** Price at 3,828, below EMA20 (3,928). RSI at 49.1, neutral. MACD negative (-80.7). Similar recovery pattern to BTC.\n\n**SOL:** Price at 185.12, below EMA20 (192.16). RSI at 40.1 (weak). MACD negative (-3.5). Still in downtrend.\n\n**BNB:** Price at 1,085, below EMA20 (1,105). RSI at 46.0. MACD negative (-13.7). Weak recovery.\n\n**XRP:** Price at 2.47, below EMA20 (2.55). RSI at 44.4. MACD negative (-0.047). Weak momentum.\n\n**DOGE:** Price at 0.1844, below EMA20 (0.1905). RSI at 47.2. MACD negative (-0.004). Slight recovery.\n\n**Decision:** Since this is the FINAL candle and I have NO open positions, I will NOT enter any new trades. The backtest is ending, and opening positions on the final candle would be inappropriate. All coins are below their EMA20s with negative MACD, indicating the recent selloff hasn't fully reversed.\n\n**Final Action:** Output empty JSON since I have no positions to manage and should not open new positions on the final candle.\n\n# TRADING DECISIONS\n\n{}",
      "signals": []
    }
  ]
}