{
  "backtest_info": {
    "checkpoint_id": "anthropic_oct_31_temp07_trial6",
    "start_date": "2025-10-17",
    "end_date": "2025-10-31",
    "model": "anthropic",
    "coins": [
      "BTC",
      "ETH",
      "SOL",
      "BNB",
      "XRP",
      "DOGE"
    ],
    "interval": "4h",
    "total_iterations": 85,
    "exported_at": "2025-11-03T17:03:24.894076"
  },
  "iterations": [
    {
      "iteration": 1,
      "timestamp": "2025-10-17T00:00:00",
      "model": "anthropic",
      "raw_response": "# CHAIN OF THOUGHT\n\nThis is my first trading invocation with a fresh $10,000 account and no open positions. I need to analyze the current market conditions across all coins to identify potential entry opportunities.\n\n## Market Overview Analysis\n\n**BTC (109160.00):**\n- Price well below EMA20 (111104.55), indicating downtrend\n- MACD deeply negative (-1429.362) and declining\n- RSI recovering from oversold: 7-period at 43.856, 14-period at 37.402\n- Recent sharp drop from 111405 to 108211, now bouncing to 109160\n- Price is 1.75% below EMA20, showing bearish momentum\n- Volume significantly below average (3548 vs 7856)\n- Pattern: Potential dead cat bounce after capitulation\n\n**ETH (3930.90):**\n- Price below EMA20 (4023.44), bearish structure\n- MACD negative (-71.784) but slightly improving\n- RSI showing recovery: 7-period at 45.554, 14-period at 39.958\n- Sharp drop from 4061.40 to 3864.90, now recovering\n- 2.3% below EMA20\n- Volume very low (52185 vs 135853)\n- Similar pattern to BTC - potential bounce after selloff\n\n**SOL (186.91):**\n- Price significantly below EMA20 (195.30) - 4.3% gap\n- MACD deeply negative (-5.057)\n- RSI still weak: 7-period at 35.557, 14-period at 32.649\n- Drop from 196.80 to 184.76, minimal recovery\n- Volume very low (464414 vs 1197511)\n- Weakest recovery of major coins\n\n**BNB (1149.30):**\n- Price below EMA20 (1188.16) - 3.3% gap\n- MACD negative (-31.536) but stabilizing\n- RSI improving: 7-period at 37.756, 14-period at 32.619\n- Dropped from 1183.80 to 1134.80, modest recovery\n- Volume extremely low (4336 vs 19293)\n\n**XRP (2.36):**\n- Price below EMA20 (2.44) - 3.3% gap\n- MACD negative (-0.058)\n- RSI showing best recovery: 7-period at 41.475, 14-period at 35.063\n- Drop from 2.45 to 2.33, now at 2.36\n- Volume above average (13.08M vs 10.32M) - interesting\n- Showing relative strength\n\n**DOGE (0.190230):**\n- Price below EMA20 (0.198261) - 4.0% gap\n- MACD negative (-0.005)\n- RSI recovering: 7-period at 37.342, 14-period at 32.667\n- Drop from 0.200260 to 0.187720, modest recovery\n- Volume very low (16.19M vs 67.54M)\n\n## Trading Decision Rationale\n\nThe market just experienced a sharp selloff across all assets with prices 2-4% below their EMA20s. All coins show:\n1. Negative MACD (bearish momentum)\n2. RSI recovering from oversold but still weak (32-40 range on 14-period)\n3. Prices below EMA20 (downtrend intact)\n4. Very low volume (suggesting weak conviction)\n\n**Risk Assessment:** This could be either:\n- A dead cat bounce before further downside\n- Early stages of reversal after capitulation\n\nGiven this is my first trade, I should be conservative. However, the RSI recovery from deeply oversold levels (20s to 40s) and the bounce pattern suggest a potential short-term relief rally.\n\n**Best Setup: ETH**\n- RSI 7-period at 45.554 (neutral, room to run)\n- MACD improving (-71.784, less negative than earlier)\n- Price bounced from 3864.90 to 3930.90 (+1.7%)\n- Tightest price-to-EMA gap recovery among majors\n- Clear support level around 3865\n\n**Trade Plan for ETH:**\n- Entry: 3930.90 (current)\n- Stop-loss: 3850 (below recent low of 3864.90, -2.06%)\n- Profit target: 4050 (just above EMA20, +3.03%)\n- Risk: ~$206 per unit at 10x leverage\n- Position size: ~4.85 ETH for $500 risk (~5% account)\n- Invalidation: Price closes below 3850 (breaks recent support)\n- Leverage: 15x (moderate for first trade)\n\nThis gives a 1:1.5 risk-reward ratio with clear technical levels.\n\n# TRADING DECISIONS\n\n```json\n{\n  \"ETH\": {\n    \"trade_signal_args\": {\n      \"coin\": \"ETH\",\n      \"signal\": \"buy\",\n      \"quantity\": 4.85,\n      \"profit_target\": 4050.00,\n      \"stop_loss\": 3850.00,\n      \"invalidation_condition\": \"If price closes below 3850 on 3-minute candle, breaking recent support and confirming downtrend continuation\",\n      \"leverage\": 15,\n      \"confidence\": 0.68,\n      \"risk_usd\": 500.00\n    }\n  }\n}\n```",
      "signals": [
        {
          "coin": "ETH",
          "signal": "buy",
          "quantity": 4.85,
          "leverage": 15,
          "stop_loss": 3850.0,
          "profit_target": 4050.0,
          "confidence": 0.68,
          "risk_usd": 500.0,
          "invalidation_condition": "If price closes below 3850 on 3-minute candle, breaking recent support and confirming downtrend continuation"
        }
      ]
    },
    {
      "iteration": 2,
      "timestamp": "2025-10-17T04:00:00",
      "model": "anthropic",
      "raw_response": "# CHAIN OF THOUGHT\n\n## Market Analysis\nAll major cryptocurrencies are showing severe bearish conditions with extremely oversold readings:\n\n**BTC**: Price 105,589 (-5.1% from recent high 111,268)\n- RSI(7): 17.8 - Extremely oversold (below 20)\n- RSI(14): 22.3 - Deeply oversold\n- MACD: -1,386 and declining rapidly\n- Price well below EMA20 (110,350)\n- Volume elevated (9,740 vs avg 8,197)\n\n**ETH**: Price 3,756 (-7.6% from recent 4,061)\n- RSI(7): 20.6 - Extremely oversold\n- RSI(14): 25.5 - Oversold\n- MACD: -68.5 and worsening\n- Price 6% below EMA20 (3,986)\n- Volume spike (213,882 vs avg 142,519)\n\n**SOL**: Price 177.65 (-9.7% from 196.80)\n- RSI(7): 16.4 - Most oversold of all\n- RSI(14): 21.5 - Deeply oversold\n- MACD: -5.3 and declining\n- Price 8% below EMA20 (193.22)\n\n**BNB**: Price 1,062.60 (-10.4% from 1,183.80)\n- RSI(7): 9.5 - EXTREME oversold (lowest reading)\n- RSI(14): 14.7 - Severely oversold\n- MACD: -35.0 - Most negative\n- Price 9.5% below EMA20 (1,174)\n\n**XRP**: Price 2.24 (-8.6% from 2.45)\n- RSI(7): 17.4 - Extremely oversold\n- RSI(14): 21.1 - Oversold\n- MACD: -0.059 and declining\n\n**DOGE**: Price 0.17849 (-10.9% from 0.20026)\n- RSI(7): 14.8 - Extremely oversold\n- RSI(14): 19.2 - Severely oversold\n- MACD: -0.005 and declining\n\n## Current Portfolio Status\n- No open positions\n- Available cash: $9,125.50\n- Account down 8.74% from initial capital\n\n## Trading Decision Logic\n\nThis is a classic capitulation scenario with all coins showing extreme oversold conditions. RSI(7) readings below 20 on all major coins simultaneously is rare and typically indicates panic selling that creates mean reversion opportunities.\n\n**Risk Assessment:**\n- High volatility environment (elevated ATR across all coins)\n- Strong downward momentum (negative MACD on all)\n- But extreme oversold conditions suggest potential bounce\n\n**Strategy:**\nGiven the extreme oversold readings (RSI 7-period between 9.5 and 20.6), I'll enter small contrarian long positions on the most oversold coins with tight stop-losses. This is a mean-reversion play betting on short-term bounce from panic selling.\n\n**Position Sizing:**\n- Will risk ~$400-500 per position (4-5% of capital each)\n- Use 15x leverage for better capital efficiency\n- Tight stop-losses (2-3% below entry)\n- Conservative profit targets at nearby resistance levels\n\n**Selected Trades:**\n1. **BNB** - RSI(7) at 9.5 is extreme, potential dead-cat bounce\n2. **DOGE** - RSI(7) at 14.8, high volume suggests climax selling\n3. **SOL** - RSI(7) at 16.4, quality asset oversold\n\n# TRADING DECISIONS\n\n```json\n{\n  \"BNB\": {\n    \"trade_signal_args\": {\n      \"coin\": \"BNB\",\n      \"signal\": \"buy\",\n      \"quantity\": 0.06,\n      \"profit_target\": 1095.00,\n      \"stop_loss\": 1032.00,\n      \"invalidation_condition\": \"If price closes below 1032 or RSI(7) drops below 8 on next candle\",\n      \"leverage\": 15,\n      \"confidence\": 0.68,\n      \"risk_usd\": 450.00\n    }\n  },\n  \"DOGE\": {\n    \"trade_signal_args\": {\n      \"coin\": \"DOGE\",\n      \"signal\": \"buy\",\n      \"quantity\": 42000,\n      \"profit_target\": 0.185000,\n      \"stop_loss\": 0.173500,\n      \"invalidation_condition\": \"If price closes below 0.1735 or fails to bounce within 2 candles\",\n      \"leverage\": 15,\n      \"confidence\": 0.65,\n      \"risk_usd\": 450.00\n    }\n  },\n  \"SOL\": {\n    \"trade_signal_args\": {\n      \"coin\": \"SOL\",\n      \"signal\": \"buy\",\n      \"quantity\": 4.2,\n      \"profit_target\": 184.00,\n      \"stop_loss\": 172.50,\n      \"invalidation_condition\": \"If price closes below 172.50 or RSI(7) makes new low below 16\",\n      \"leverage\": 15,\n      \"confidence\": 0.70,\n      \"risk_usd\": 450.00\n    }\n  }\n}\n```",
      "signals": [
        {
          "coin": "BNB",
          "signal": "buy",
          "quantity": 0.06,
          "leverage": 15,
          "stop_loss": 1032.0,
          "profit_target": 1095.0,
          "confidence": 0.68,
          "risk_usd": 450.0,
          "invalidation_condition": "If price closes below 1032 or RSI(7) drops below 8 on next candle"
        },
        {
          "coin": "DOGE",
          "signal": "buy",
          "quantity": 42000.0,
          "leverage": 15,
          "stop_loss": 0.1735,
          "profit_target": 0.185,
          "confidence": 0.65,
          "risk_usd": 450.0,
          "invalidation_condition": "If price closes below 0.1735 or fails to bounce within 2 candles"
        },
        {
          "coin": "SOL",
          "signal": "buy",
          "quantity": 4.2,
          "leverage": 15,
          "stop_loss": 172.5,
          "profit_target": 184.0,
          "confidence": 0.7,
          "risk_usd": 450.0,
          "invalidation_condition": "If price closes below 172.50 or RSI(7) makes new low below 16"
        }
      ]
    },
    {
      "iteration": 3,
      "timestamp": "2025-10-17T08:00:00",
      "model": "anthropic",
      "raw_response": "# CHAIN OF THOUGHT\n\nAnalyzing current market conditions and my three open positions:\n\n## Market Overview\nThe entire crypto market is experiencing a sharp selloff:\n- BTC down ~5.5% from recent highs, RSI(7) at extreme oversold 19.3\n- ETH down ~7%, RSI(7) at 27.0\n- All positions currently showing weakness below their EMAs\n- MACD indicators negative across the board\n- High volume confirming selling pressure\n\n## Position Analysis\n\n### BNB Position (0.06 quantity, entry: 1062.6, current: 1071.7)\n- **Current P&L**: +$0.51 (minimal profit)\n- **Entry conditions**: Caught near the bottom of previous drop\n- **Invalidation check**: \"If price closes below 1032 or RSI(7) drops below 8 on next candle\"\n  - Current price: 1071.7 (ABOVE 1032 \u2713)\n  - Current RSI(7): 18.184 (ABOVE 8 \u2713)\n  - **Invalidation NOT met**\n- **Technical analysis**: \n  - Price still well below EMA20 (1153.12), indicating downtrend\n  - RSI(7) at 18.184 is extremely oversold (second-lowest reading in series)\n  - MACD deeply negative at -23.812\n  - Stop-loss at 1032 provides ~3.7% cushion\n  - Profit target at 1095 is 2.2% away\n- **Decision**: HOLD - Invalidation condition not met. Extreme oversold conditions suggest potential bounce. Position is small ($64 notional) and stop-loss is appropriately placed.\n\n### DOGE Position (42,000 quantity, entry: 0.17849, current: 0.18261)\n- **Current P&L**: +$169.29 (strong profit, 2.2% gain)\n- **Entry conditions**: Bought at extreme oversold levels\n- **Invalidation check**: \"If price closes below 0.1735 or fails to bounce within 2 candles\"\n  - Current price: 0.18261 (ABOVE 0.1735 \u2713)\n  - Price has bounced 2.3% from entry over 2 candles \u2713\n  - **Invalidation NOT met**\n- **Technical analysis**:\n  - Profit target at 0.185 is only 1.3% away (0.00239 from current)\n  - RSI(7) at 33.667, recovering from extreme oversold 14.801\n  - Price still below EMA20 (0.192992) but showing momentum\n  - Stop-loss at 0.1735 provides 5.1% protection\n  - Already captured significant profit from oversold bounce\n- **Decision**: CLOSE POSITION - Taking profits. We're very close to profit target (only 1.3% away) and the bounce has materialized. Given the broader market weakness and the fact we've achieved our bounce thesis, it's prudent to lock in gains rather than risk reversal.\n\n### SOL Position (4.2 quantity, entry: 177.65, current: 181.47)\n- **Current P&L**: +$15.67 (2.1% gain)\n- **Entry conditions**: Caught at extreme oversold\n- **Invalidation check**: \"If price closes below 172.50 or RSI(7) makes new low below 16\"\n  - Current price: 181.47 (ABOVE 172.50 \u2713)\n  - Current RSI(7): 35.632 (well above 16, and higher than entry RSI of 16.434) \u2713\n  - **Invalidation NOT met**\n- **Technical analysis**:\n  - Profit target at 184.0 is only 1.4% away\n  - RSI(7) has recovered significantly from 16.434 to 35.632\n  - Price still below EMA20 (190.58) but showing good bounce momentum\n  - Stop-loss at 172.5 provides 4.9% protection\n  - Similar to DOGE, the oversold bounce thesis is playing out\n- **Decision**: CLOSE POSITION - Taking profits. We're within striking distance of profit target (1.4% away), have captured a solid 2.1% gain, and the bounce from extreme oversold has materialized. Given broader market weakness, prudent to lock in gains.\n\n## Risk Management Assessment\n- Portfolio is down -6.81% overall\n- Current positions showing small profits but market remains weak\n- Taking profits on DOGE and SOL locks in $184.96 in gains\n- Keeping BNB as it's smallest position with tight stop-loss and hasn't reached profit zone yet\n- No new positions warranted given market instability and negative momentum across all coins\n\n# TRADING DECISIONS\n\n```json\n{\n  \"BNB\": {\n    \"trade_signal_args\": {\n      \"coin\": \"BNB\",\n      \"signal\": \"hold\",\n      \"quantity\": 0.06,\n      \"profit_target\": 1095.0,\n      \"stop_loss\": 1032.0,\n      \"invalidation_condition\": \"If price closes below 1032 or RSI(7) drops below 8 on next candle\",\n      \"leverage\": 15,\n      \"confidence\": 0.68,\n      \"risk_usd\": 450.0\n    }\n  },\n  \"DOGE\": {\n    \"trade_signal_args\": {\n      \"coin\": \"DOGE\",\n      \"signal\": \"close_position\",\n      \"quantity\": 42000.0,\n      \"profit_target\": 0.185,\n      \"stop_loss\": 0.1735,\n      \"invalidation_condition\": \"If price closes below 0.1735 or fails to bounce within 2 candles\",\n      \"leverage\": 15,\n      \"confidence\": 0.65,\n      \"risk_usd\": 450.0,\n      \"close_reason\": \"Taking profits - price within 1.3% of profit target (0.185), captured 2.2% gain from oversold bounce, broader market remains weak, prudent to lock in $169 profit\"\n    }\n  },\n  \"SOL\": {\n    \"trade_signal_args\": {\n      \"coin\": \"SOL\",\n      \"signal\": \"close_position\",\n      \"quantity\": 4.2,\n      \"profit_target\": 184.0,\n      \"stop_loss\": 172.5,\n      \"invalidation_condition\": \"If price closes below 172.50 or RSI(7) makes new low below 16\",\n      \"leverage\": 15,\n      \"confidence\": 0.7,\n      \"risk_usd\": 450.0,\n      \"close_reason\": \"Taking profits - price within 1.4% of profit target (184.0), captured 2.1% gain from extreme oversold bounce, RSI recovered from 16 to 35, locking in $15.67 profit amid broader market weakness\"\n    }\n  }\n}\n```",
      "signals": [
        {
          "coin": "BNB",
          "signal": "hold",
          "quantity": 0.06,
          "leverage": 15,
          "stop_loss": 1032.0,
          "profit_target": 1095.0,
          "confidence": 0.68,
          "risk_usd": 450.0,
          "invalidation_condition": "If price closes below 1032 or RSI(7) drops below 8 on next candle"
        },
        {
          "coin": "DOGE",
          "signal": "close_position",
          "quantity": 42000.0,
          "leverage": 15,
          "stop_loss": 0.1735,
          "profit_target": 0.185,
          "confidence": 0.65,
          "risk_usd": 450.0,
          "invalidation_condition": "If price closes below 0.1735 or fails to bounce within 2 candles"
        },
        {
          "coin": "SOL",
          "signal": "close_position",
          "quantity": 4.2,
          "leverage": 15,
          "stop_loss": 172.5,
          "profit_target": 184.0,
          "confidence": 0.7,
          "risk_usd": 450.0,
          "invalidation_condition": "If price closes below 172.50 or RSI(7) makes new low below 16"
        }
      ]
    },
    {
      "iteration": 4,
      "timestamp": "2025-10-17T12:00:00",
      "model": "anthropic",
      "raw_response": "# CHAIN OF THOUGHT\n\n## Current Position Analysis\n\n**BNB Position Review:**\n- Entry: $1062.60, Current: $1074.00 (+$0.65 PnL, +1.07%)\n- Position size: 0.06 BNB with 15x leverage (~$64.44 notional)\n- Stop-loss: $1032.00, Profit target: $1095.00\n- Invalidation condition: \"If price closes below 1032 or RSI(7) drops below 8 on next candle\"\n\n**Technical Analysis:**\n- Current RSI(7): 20.752 (well above the 8 threshold, so invalidation NOT triggered)\n- Current price: $1074.00 (well above stop-loss at $1032.00)\n- Price action: Rebounded from $1062.60 low to $1074.00\n- MACD: -22.672 (deeply negative, still bearish)\n- EMA20: $1142.29 (price significantly below, downtrend intact)\n- RSI(14): 22.678 (oversold territory, potential bounce)\n\n**Invalidation Check:**\n- Price is NOT below $1032 \u2713\n- RSI(7) is 20.752, NOT below 8 \u2713\n- Invalidation condition is NOT met\n\n**Decision Rationale:**\nThe BNB position has shown a small recovery from the entry point. While the broader trend remains bearish (price below EMA20, negative MACD), the position is performing positively and the invalidation condition has not been triggered. The RSI(7) at 20.752 suggests oversold conditions with potential for further bounce. The stop-loss at $1032 provides adequate protection, and the profit target at $1095 remains achievable if the bounce continues.\n\nGiven:\n1. Invalidation condition NOT met\n2. Position in slight profit\n3. Stop-loss not threatened\n4. Oversold RSI suggesting potential bounce continuation\n\n**Decision: HOLD** - Continue monitoring for either profit target ($1095) or invalidation trigger.\n\n## Market Overview for Other Coins\n\n**BTC:** $106,821 - Severe downtrend (RSI 39.5, MACD -1257). Below EMA20. Not entering.\n\n**ETH:** $3,797 - Weak, below EMA20, RSI 33.9. Bearish momentum. Not entering.\n\n**SOL:** $182.74 - Below EMA20, RSI 41.6. Downtrend intact. Not entering.\n\n**XRP:** $2.30 - Below EMA20, RSI 42.8. Weak structure. Not entering.\n\n**DOGE:** $0.18475 - Below EMA20, RSI 42.5. Bearish. Not entering.\n\nAll major coins are in downtrends with prices below their EMA20s. Market conditions remain unfavorable for new entries. Focus on managing existing BNB position.\n\n# TRADING DECISIONS\n\n```json\n{\n  \"BNB\": {\n    \"trade_signal_args\": {\n      \"coin\": \"BNB\",\n      \"signal\": \"hold\",\n      \"quantity\": 0.06,\n      \"profit_target\": 1095.0,\n      \"stop_loss\": 1032.0,\n      \"invalidation_condition\": \"If price closes below 1032 or RSI(7) drops below 8 on next candle\",\n      \"leverage\": 15,\n      \"confidence\": 0.68,\n      \"risk_usd\": 450.0\n    }\n  }\n}\n```",
      "signals": [
        {
          "coin": "BNB",
          "signal": "hold",
          "quantity": 0.06,
          "leverage": 15,
          "stop_loss": 1032.0,
          "profit_target": 1095.0,
          "confidence": 0.68,
          "risk_usd": 450.0,
          "invalidation_condition": "If price closes below 1032 or RSI(7) drops below 8 on next candle"
        }
      ]
    },
    {
      "iteration": 5,
      "timestamp": "2025-10-17T16:00:00",
      "model": "anthropic",
      "raw_response": "# CHAIN OF THOUGHT\n\n## Current Position Analysis\n\n### BNB Position Review\n- **Entry**: 1062.6, **Current**: 1066.1 (+0.33%)\n- **Profit Target**: 1095.0 (+2.7% away)\n- **Stop Loss**: 1032.0 (-3.2% away)\n- **Invalidation Condition**: \"If price closes below 1032 or RSI(7) drops below 8 on next candle\"\n- **Current RSI(7)**: 17.929 (well above 8 threshold)\n- **Current Price vs Stop**: 1066.1 vs 1032.0 (still safe)\n- **Unrealized PnL**: +$0.18 (minimal gain)\n\n**Technical Analysis**:\n- RSI(7) at 17.929 indicates oversold conditions but hasn't breached the invalidation threshold of 8\n- RSI(14) at 19.046 confirms deeply oversold\n- Price is 6.5% below EMA20 (1140.88), showing strong bearish pressure\n- MACD at -33.538 and worsening, indicating continued downward momentum\n- Price action: After flash crash from 1183 to 1062, now at 1066 - slight recovery but weak\n- Volume is significantly below average (8,221 vs 15,955), suggesting lack of conviction\n\n**Invalidation Check**: \n- Price at 1066.1 is ABOVE stop-loss at 1032 \u2713\n- RSI(7) at 17.929 is ABOVE 8 \u2713\n- **Invalidation condition NOT met**\n\nHowever, this position is concerning:\n- Entered during extreme volatility at the bottom of a flash crash\n- Market showing continued weakness across all coins\n- BNB has lost significant ground and is in a strong downtrend\n- The slight +$0.18 profit is negligible and could reverse quickly\n- Risk/reward is poor given the ongoing bearish momentum\n\n**Decision**: CLOSE POSITION - While invalidation hasn't technically been met, the market structure has deteriorated significantly. The entry was made during a volatile flash crash, and the recovery is weak. With MACD worsening, price well below EMA, and overall market showing continued weakness, it's prudent to exit this small winner before it becomes a loser. This is a risk management decision.\n\n## Market Overview for Other Coins\n\nAll coins showing similar bearish patterns:\n- **BTC**: Down 3.7%, RSI 35, deeply oversold, below EMA20\n- **ETH**: Down 2.7%, RSI 44, below EMA20, bearish MACD\n- **SOL**: Down 4.3%, RSI 38, below EMA20, weak momentum\n- **XRP**: Down 3.4%, RSI 41, below EMA20\n- **DOGE**: Down 4.1%, RSI 41, below EMA20\n\nMarket-wide selloff in progress. No attractive entry setups. All coins trading below their EMA20s with negative MACD readings. This is not a market environment to add new positions.\n\n**New Position Consideration**: NONE - Market conditions are unfavorable across the board. Better to preserve capital and wait for clearer bullish signals.\n\n# TRADING DECISIONS\n\n```json\n{\n  \"BNB\": {\n    \"trade_signal_args\": {\n      \"coin\": \"BNB\",\n      \"signal\": \"close_position\",\n      \"quantity\": 0.06,\n      \"profit_target\": 1095.0,\n      \"stop_loss\": 1032.0,\n      \"invalidation_condition\": \"If price closes below 1032 or RSI(7) drops below 8 on next candle\",\n      \"leverage\": 15,\n      \"confidence\": 0.68,\n      \"risk_usd\": 450.0,\n      \"close_reason\": \"Risk management - Market showing continued weakness with MACD deteriorating (-33.538), price 6.5% below EMA20, and overall bearish market structure. Exiting small profit before position reverses. Entry was during flash crash volatility and recovery is weak with below-average volume.\"\n    }\n  }\n}\n```",
      "signals": [
        {
          "coin": "BNB",
          "signal": "close_position",
          "quantity": 0.06,
          "leverage": 15,
          "stop_loss": 1032.0,
          "profit_target": 1095.0,
          "confidence": 0.68,
          "risk_usd": 450.0,
          "invalidation_condition": "If price closes below 1032 or RSI(7) drops below 8 on next candle"
        }
      ]
    },
    {
      "iteration": 6,
      "timestamp": "2025-10-17T20:00:00",
      "model": "anthropic",
      "raw_response": "# CHAIN OF THOUGHT\n\n## Current Market Analysis\n\nI'm currently flat with no open positions and down -6.98% on the account. Let me analyze the market conditions across all coins:\n\n**BTC Analysis:**\n- Current: 106396, EMA20: 108966 (trading below EMA - bearish)\n- MACD: -1589 (deeply negative and worsening)\n- RSI(7): 35.05, RSI(14): 32.18 (oversold territory)\n- Price dropped from 111405 to 106396 (-4.5%) in last 30 minutes\n- Strong downtrend but showing potential oversold bounce setup\n- Below both 20 and 50 EMA on 4H timeframe\n\n**ETH Analysis:**\n- Current: 3830.70, EMA20: 3926 (below EMA - bearish)\n- MACD: -73.77 (negative but stabilizing slightly)\n- RSI(7): 45.61, RSI(14): 38.48 (recovering from oversold)\n- Dropped from 4061 to 3756, now recovering to 3830\n- Showing some resilience compared to BTC\n- More recovery momentum than BTC\n\n**SOL Analysis:**\n- Current: 181.89, EMA20: 188.83 (below EMA)\n- MACD: -4.57 (negative)\n- RSI(7): 38.26, RSI(14): 34.58 (oversold)\n- Dropped from 196.80 to 177.65, now at 181.89\n- Similar pattern to others but weaker recovery\n\n**BNB Analysis:**\n- Current: 1070.60, EMA20: 1133.20 (significantly below EMA)\n- MACD: -33.56 (very negative)\n- RSI(7): 25.06, RSI(14): 22.80 (extremely oversold)\n- Massive drop from 1180.90 to 1062.60 (-10%)\n- Most oversold of all coins - potential bounce candidate\n- Volume very low compared to average\n\n**XRP Analysis:**\n- Current: 2.29, EMA20: 2.37 (below EMA)\n- MACD: -0.050 (negative but stable)\n- RSI(7): 39.82, RSI(14): 36.04 (oversold)\n- Standard correction pattern\n\n**DOGE Analysis:**\n- Current: 0.18472, EMA20: 0.19141 (below EMA)\n- MACD: -0.005 (negative)\n- RSI(7): 43.47, RSI(14): 37.23 (approaching neutral from oversold)\n- Showing relative strength in recovery\n\n## Trading Decision\n\n**Market Context:** All coins are in correction mode, trading below their EMAs with negative MACD. However, RSI levels show oversold conditions across the board, suggesting potential for short-term bounces.\n\n**Risk Assessment:** Given I'm down -6.98%, I need to be selective. The extreme oversold conditions present opportunity, but the strong downtrend presents risk.\n\n**Best Opportunity:** BNB shows the most extreme oversold condition (RSI 22.80) and has dropped 10% - this creates the highest probability bounce setup. However, the low volume is concerning.\n\n**Alternative:** ETH shows better recovery momentum (RSI recovering to 45.61) and is more stable than BTC.\n\n**Decision:** I will take a SMALL position in ETH as it's showing the best recovery pattern with RSI climbing back from oversold levels. The risk/reward is favorable for a counter-trend bounce trade with tight stops.\n\nPosition sizing: With $9302 available, I'll risk $500 (5.4% of capital) on this trade.\n- ETH at 3830.70\n- Stop-loss: 3750 (below recent low of 3756.40) = 2.1% below entry\n- Profit target: 3950 (near EMA20 resistance) = 3.1% above entry\n- Leverage: 15x to capture the move\n- Invalidation: If price breaks below 3750 or RSI(14) drops back below 30\n\nRisk calculation: $500 / 15 leverage = $33.33 position notional value... wait, that's wrong.\nCorrect: To risk $500 with stop at 3750 from entry 3830.70:\n- Risk per unit: 3830.70 - 3750 = 80.70\n- Quantity needed: 500 / 80.70 = 6.20 ETH\n- Position value: 6.20 * 3830.70 = $23,750\n- With 15x leverage, margin needed: $23,750 / 15 = $1,583\n\nActually, let me recalculate more conservatively with 10x leverage and $400 risk:\n- Quantity: 400 / 80.70 = 4.96 ETH (round to 4.95)\n- Position value: 4.95 * 3830.70 = $18,962\n- Margin required: $18,962 / 10 = $1,896\n\nThis gives me a controlled risk entry on the oversold bounce.\n\n# TRADING DECISIONS\n\n```json\n{\n  \"ETH\": {\n    \"trade_signal_args\": {\n      \"coin\": \"ETH\",\n      \"signal\": \"buy\",\n      \"quantity\": 4.95,\n      \"profit_target\": 3950.0,\n      \"stop_loss\": 3750.0,\n      \"invalidation_condition\": \"If price closes below 3750 on 3-minute candle or RSI(14) drops back below 30\",\n      \"leverage\": 10,\n      \"confidence\": 0.68,\n      \"risk_usd\": 400.0\n    }\n  }\n}\n```",
      "signals": [
        {
          "coin": "ETH",
          "signal": "buy",
          "quantity": 4.95,
          "leverage": 10,
          "stop_loss": 3750.0,
          "profit_target": 3950.0,
          "confidence": 0.68,
          "risk_usd": 400.0,
          "invalidation_condition": "If price closes below 3750 on 3-minute candle or RSI(14) drops back below 30"
        }
      ]
    },
    {
      "iteration": 7,
      "timestamp": "2025-10-18T00:00:00",
      "model": "anthropic",
      "raw_response": "# CHAIN OF THOUGHT\n\nReviewing my current position:\n\n**ETH Analysis:**\n- Current price: $3869.70, Entry: $3830.70\n- Unrealized P&L: +$183.57 (+1.02%)\n- Position: 4.95 ETH at 10x leverage ($19,155 notional)\n- Profit target: $3950.00 (2.08% away)\n- Stop-loss: $3750.00 (3.09% below current)\n- Invalidation condition: \"If price closes below 3750 on 3-minute candle or RSI(14) drops back below 30\"\n\n**Checking invalidation condition:**\n- Current price $3869.70 is well above $3750 \u2713\n- RSI(14) = 46.102, which is above 30 \u2713\n- Invalidation condition NOT met\n\n**Technical indicators:**\n- RSI(7): 59.847 - Neutral to slightly bullish momentum\n- RSI(14): 46.102 - Recovering from oversold, healthy upward movement\n- MACD: -73.176 - Still negative but improving from -78.235 (bullish divergence)\n- Price vs EMA20: $3869.70 vs $3923.90 - Still below but closing the gap\n- Recent price action: Strong bounce from $3756.40 low, gaining momentum\n- Volume: 51,559 vs avg 129,560 - Lower volume but price recovering\n\n**Decision rationale:**\nETH is showing positive momentum with RSI recovering nicely and price bouncing from the recent low. The position is now profitable (+$183.57) and approaching the profit target ($3950). The invalidation conditions are not met - price is well above $3750 and RSI(14) is at 46, comfortably above 30. MACD is improving (less negative), suggesting weakening bearish momentum.\n\nGiven:\n1. Position is profitable and trending toward profit target\n2. No invalidation conditions triggered\n3. Technical momentum improving (RSI rising, MACD improving)\n4. Risk/reward still favorable\n\n**Decision: HOLD** - Continue monitoring position as it moves toward profit target.\n\n**Other coins (BTC, SOL, BNB, XRP, DOGE):**\nNo positions in these coins. Market showing mixed signals with most coins still below their EMAs and negative MACD values. Portfolio is already at -5.04% return with one leveraged position. Conservative approach: not adding new positions at this time given current drawdown and uncertain market conditions.\n\n# TRADING DECISIONS\n\n```json\n{\n  \"ETH\": {\n    \"trade_signal_args\": {\n      \"coin\": \"ETH\",\n      \"signal\": \"hold\",\n      \"quantity\": 4.95,\n      \"profit_target\": 3950.0,\n      \"stop_loss\": 3750.0,\n      \"invalidation_condition\": \"If price closes below 3750 on 3-minute candle or RSI(14) drops back below 30\",\n      \"leverage\": 10,\n      \"confidence\": 0.68,\n      \"risk_usd\": 400.0\n    }\n  }\n}\n```",
      "signals": [
        {
          "coin": "ETH",
          "signal": "hold",
          "quantity": 4.95,
          "leverage": 10,
          "stop_loss": 3750.0,
          "profit_target": 3950.0,
          "confidence": 0.68,
          "risk_usd": 400.0,
          "invalidation_condition": "If price closes below 3750 on 3-minute candle or RSI(14) drops back below 30"
        }
      ]
    },
    {
      "iteration": 8,
      "timestamp": "2025-10-18T04:00:00",
      "model": "anthropic",
      "raw_response": "# CHAIN OF THOUGHT\n\nReviewing my current position:\n\n**ETH Position Analysis:**\n- Entry: 3830.70, Current: 3891.40 (+60.70 points, +1.58%)\n- Unrealized P&L: +$290.98 (positive)\n- Profit Target: 3950.00 (58.60 points away)\n- Stop Loss: 3750.00 (141.40 points away)\n- Invalidation Condition: \"If price closes below 3750 on 3-minute candle or RSI(14) drops back below 30\"\n\n**Checking Invalidation Condition:**\n- Current price: 3891.40 (well above 3750 threshold) \u2713\n- RSI(14): 50.748 (well above 30 threshold) \u2713\n- Last 3-minute candle closed at 3891.40, not below 3750 \u2713\n- **Invalidation NOT met** - position remains valid\n\n**Technical Analysis:**\n- RSI(7): 66.486 - showing bullish momentum after recovery from oversold\n- RSI(14): 50.748 - neutral/slightly bullish, trending up from 46.622\n- MACD: -58.711, improving from -64.764 (negative but converging)\n- Price vs EMA20: 3891.40 vs 3914.82 (still below but narrowing gap)\n- Recent price action: Strong recovery from 3756.40 low, gaining +135 points\n- Volume: 52,065 vs avg 128,041 (low volume, but price moving up)\n\n**Risk Assessment:**\n- Position is profitable (+$291)\n- Price approaching profit target (3950), only 58.60 points away\n- Stop loss provides good cushion at 3750 (141 points below)\n- Momentum indicators showing bullish divergence\n- No imminent invalidation risk\n\n**Decision: HOLD**\nThe ETH position is performing well with positive momentum. Price is recovering strongly from the recent dip, RSI shows healthy bullish momentum without being overbought, and we're approaching our profit target. The invalidation condition is nowhere near being triggered. With only 58 points to profit target vs 141 points to stop loss, the risk/reward favors holding to capture the remaining upside.\n\n**Other Coins - No Action:**\n- BTC: Below EMA20, weak RSI, negative MACD - not entering\n- SOL: Below EMA20, recovering but not strong enough - not entering\n- BNB: Strong recovery but just reached neutral RSI - wait for confirmation\n- XRP: Below EMA20, moderate recovery - not entering\n- DOGE: Below EMA20, weak setup - not entering\n\n# TRADING DECISIONS\n\n```json\n{\n  \"ETH\": {\n    \"trade_signal_args\": {\n      \"coin\": \"ETH\",\n      \"signal\": \"hold\",\n      \"quantity\": 4.95,\n      \"profit_target\": 3950.0,\n      \"stop_loss\": 3750.0,\n      \"invalidation_condition\": \"If price closes below 3750 on 3-minute candle or RSI(14) drops back below 30\",\n      \"leverage\": 10,\n      \"confidence\": 0.68,\n      \"risk_usd\": 400.0\n    }\n  }\n}\n```",
      "signals": [
        {
          "coin": "ETH",
          "signal": "hold",
          "quantity": 4.95,
          "leverage": 10,
          "stop_loss": 3750.0,
          "profit_target": 3950.0,
          "confidence": 0.68,
          "risk_usd": 400.0,
          "invalidation_condition": "If price closes below 3750 on 3-minute candle or RSI(14) drops back below 30"
        }
      ]
    },
    {
      "iteration": 9,
      "timestamp": "2025-10-18T08:00:00",
      "model": "anthropic",
      "raw_response": "# CHAIN OF THOUGHT\n\nReviewing my current position:\n\n**ETH Position Analysis:**\n- Entry: 3830.7, Current: 3880.7 (+50 points, +1.31%)\n- Unrealized PnL: +$238.02 (10x leverage = +$238 on ~$1,921 notional)\n- Stop-loss: 3750.0 (130.7 points away)\n- Profit target: 3950.0 (69.3 points away)\n- Invalidation condition: \"If price closes below 3750 on 3-minute candle or RSI(14) drops back below 30\"\n\n**Checking Invalidation Condition:**\n- Current price: 3880.7 > 3750 \u2713 (not breached)\n- Current RSI(14): 48.055 > 30 \u2713 (well above threshold)\n- Latest 3-min candle close: 3880.7 > 3750 \u2713\n- **Invalidation NOT met**\n\n**Technical Analysis:**\n- RSI(7): 59.979 - neutral/slightly bullish momentum\n- RSI(14): 48.055 - neutral, recovering from oversold\n- MACD: -61.534 - still negative but improving from -79.392 (bullish divergence)\n- Price vs EMA20: 3880.7 < 3917.13 (still below, but gap closing)\n- Recent price action: Strong recovery from 3756.4 low, now consolidating around 3880-3891\n\n**Risk Assessment:**\n- Position is +1.31% in profit (+$238)\n- Stop-loss provides 3.4% cushion (130.7 points)\n- Profit target 1.8% away (69.3 points)\n- Risk/Reward ratio reasonable at current levels\n- RSI showing recovery momentum without being overbought\n\n**Decision: HOLD**\n- Invalidation conditions NOT met (price well above 3750, RSI above 30)\n- Position showing modest profit with positive momentum\n- MACD improving, RSI in healthy range\n- No reason to exit prematurely - let the trade develop toward profit target\n- Stop-loss properly positioned for protection\n\n**Other Coins (BTC, SOL, BNB, XRP, DOGE):**\n- No existing positions\n- Market showing mixed signals across the board\n- BTC: Below EMA20, negative MACD, but RSI recovering (54.7)\n- SOL: Below EMA20, negative MACD, RSI 63.4 (recovering)\n- BNB: Below EMA20, negative MACD, RSI 54.3 (neutral)\n- XRP: Above EMA20, negative MACD, RSI 75.4 (overbought - risky entry)\n- DOGE: Below EMA20, negative MACD, RSI 61.9 (neutral)\n\nAll altcoins showing similar pattern: recovering from recent selloff but still below key EMAs with negative MACD. XRP is overbought at RSI 75.4, making it a poor entry point. Given my current ETH position and -4.44% portfolio drawdown, I should focus on managing existing risk rather than adding new positions in uncertain conditions.\n\n**No new positions warranted at this time.**\n\n# TRADING DECISIONS\n\n```json\n{\n  \"ETH\": {\n    \"trade_signal_args\": {\n      \"coin\": \"ETH\",\n      \"signal\": \"hold\",\n      \"quantity\": 4.95,\n      \"profit_target\": 3950.0,\n      \"stop_loss\": 3750.0,\n      \"invalidation_condition\": \"If price closes below 3750 on 3-minute candle or RSI(14) drops back below 30\",\n      \"leverage\": 10,\n      \"confidence\": 0.68,\n      \"risk_usd\": 400.0\n    }\n  }\n}\n```",
      "signals": [
        {
          "coin": "ETH",
          "signal": "hold",
          "quantity": 4.95,
          "leverage": 10,
          "stop_loss": 3750.0,
          "profit_target": 3950.0,
          "confidence": 0.68,
          "risk_usd": 400.0,
          "invalidation_condition": "If price closes below 3750 on 3-minute candle or RSI(14) drops back below 30"
        }
      ]
    },
    {
      "iteration": 10,
      "timestamp": "2025-10-18T12:00:00",
      "model": "anthropic",
      "raw_response": "# CHAIN OF THOUGHT\n\n## Current Position Analysis\n\n**ETH Position Review:**\n- Entry: $3830.70, Current: $3876.20 (+$45.50, +1.19%)\n- Unrealized P&L: +$215.74 (+1.12% of account)\n- Profit Target: $3950.00 (distance: +$73.80, +1.90%)\n- Stop Loss: $3750.00 (distance: -$126.20, -3.26%)\n- Invalidation: \"If price closes below 3750 on 3-minute candle or RSI(14) drops back below 30\"\n\n**Technical Analysis - ETH:**\n- Current RSI(14): 47.393 (neutral, well above 30 threshold)\n- RSI(7): 56.944 (showing slight bullish momentum)\n- MACD: -53.315 (negative but improving from -73.999)\n- Price vs EMA20: $3876.20 vs $3910.25 (still below, but gap closing)\n- Recent price action: Recovering from $3756.40 low, now at $3876.20\n- Volume: 39,856 vs avg 123,997 (low volume - 32% of average)\n\n**Invalidation Check:**\n1. \u2713 Price NOT below $3750 (currently $3876.20)\n2. \u2713 RSI(14) NOT below 30 (currently 47.393)\n3. **Invalidation condition NOT met**\n\n**Position Decision - ETH:**\nThe position is performing well with +$215 unrealized profit. Price has recovered from the earlier dip and is showing resilience. RSI is in neutral territory with room to move higher. MACD is improving (less negative). The invalidation conditions are clearly not met - price is $126 above the stop loss and RSI is comfortably above 30.\n\nHowever, I note:\n- Price still below EMA20 ($3910), indicating we're in a short-term downtrend\n- Low volume (32% of average) suggests weak conviction\n- We're only $73.80 away from profit target vs $126.20 from stop loss (risk/reward ratio narrowing)\n- MACD still negative, though improving\n\n**Decision: HOLD** - The position is working, invalidation not triggered, and we're approaching profit target. No reason to exit prematurely.\n\n## Market Opportunities\n\n**BTC Analysis:**\n- Price: $106,926 below EMA20: $108,207 (-1.19%)\n- RSI(7): 48.205, RSI(14): 41.178 (neutral to weak)\n- MACD: -1256.77 (deeply negative, but improving from -1432)\n- Recovering from $105,589 low but still in downtrend\n\n**SOL Analysis:**\n- Price: $184.91 below EMA20: $188.12 (-1.71%)\n- RSI(7): 51.280, RSI(14): 44.187 (neutral)\n- MACD: -4.031 (negative but improving)\n- Similar pattern to ETH - recovering but below EMAs\n\n**BNB Analysis:**\n- Price: $1090.70 below EMA20: $1119.57 (-2.58%)\n- RSI(7): 44.053, RSI(14): 40.850 (weak)\n- MACD: -23.501 (negative)\n- Recovering from $1062.60 but still weak\n\n**XRP Analysis:**\n- Price: $2.35 below EMA20: $2.36 (-0.42%)\n- RSI(7): 54.691, RSI(14): 49.907 (neutral, almost balanced)\n- MACD: -0.033 (barely negative, improving)\n- Closest to EMA20 breakout, showing relative strength\n\n**DOGE Analysis:**\n- Price: $0.18748 below EMA20: $0.18999 (-1.32%)\n- RSI(7): 57.215, RSI(14): 46.221 (showing momentum)\n- MACD: -0.004 (minimally negative)\n- Good recovery from $0.17849 low\n\n**New Position Consideration:**\nAll markets are in short-term downtrends (below EMA20) but showing recovery. Given I'm already down -4.69% on the account and have $7,396 available cash, I should be selective. The market appears to be in a consolidation/recovery phase after a sharp drop. \n\nI will NOT open new positions at this time because:\n1. All coins still below their EMA20 (downtrend not confirmed broken)\n2. Low volumes across the board\n3. Already have ETH exposure with positive P&L\n4. Risk management - preserve capital during uncertain conditions\n\n# TRADING DECISIONS\n\n```json\n{\n  \"ETH\": {\n    \"trade_signal_args\": {\n      \"coin\": \"ETH\",\n      \"signal\": \"hold\",\n      \"quantity\": 4.95,\n      \"profit_target\": 3950.0,\n      \"stop_loss\": 3750.0,\n      \"invalidation_condition\": \"If price closes below 3750 on 3-minute candle or RSI(14) drops back below 30\",\n      \"leverage\": 10,\n      \"confidence\": 0.68,\n      \"risk_usd\": 400.0\n    }\n  }\n}\n```",
      "signals": [
        {
          "coin": "ETH",
          "signal": "hold",
          "quantity": 4.95,
          "leverage": 10,
          "stop_loss": 3750.0,
          "profit_target": 3950.0,
          "confidence": 0.68,
          "risk_usd": 400.0,
          "invalidation_condition": "If price closes below 3750 on 3-minute candle or RSI(14) drops back below 30"
        }
      ]
    },
    {
      "iteration": 11,
      "timestamp": "2025-10-18T16:00:00",
      "model": "anthropic",
      "raw_response": "# CHAIN OF THOUGHT\n\nReviewing my current position:\n\n**ETH Position Analysis:**\n- Entry: 3830.7, Current: 3892.2 (+$294.94 unrealized PnL)\n- Profit target: 3950.0 (only $57.80 away - 1.5% from current)\n- Stop-loss: 3750.0 ($142.20 below current)\n- Invalidation condition: \"If price closes below 3750 on 3-minute candle or RSI(14) drops back below 30\"\n\n**Checking invalidation condition:**\n- Current price: 3892.2 (well above 3750 threshold) \u2713\n- Current RSI(14): 53.492 (well above 30 threshold) \u2713\n- Invalidation condition NOT met\n\n**Technical indicators:**\n- Price near EMA20 (3892.32) - consolidating at resistance\n- MACD improving: -26.781 (was -45.106 earlier, trending toward zero)\n- RSI(7): 65.827 - showing bullish momentum\n- RSI(14): 53.492 - neutral to slightly bullish\n- Price action: Recovered from 3756.40 to 3892.20 (+3.6% move)\n\n**Key observations:**\n1. ETH is only $57.80 from profit target (very close)\n2. Strong recovery from oversold levels\n3. RSI showing healthy momentum without being overbought\n4. MACD improving consistently\n5. No invalidation conditions triggered\n6. Position up $294.94 (15.3% gain on margin)\n\n**Decision: HOLD**\nThe position is performing well and approaching profit target. The invalidation conditions are not met, and technical indicators show continued bullish momentum. The profit target at 3950 is achievable given the current momentum. Will let the position run toward target.\n\n**Other coins (BTC, SOL, BNB, XRP, DOGE):**\nNo positions held. Market showing mixed signals with most coins in recovery but still below key EMAs. With existing ETH position performing well and approaching target, maintaining focus on this trade rather than opening new positions. Portfolio concentration is appropriate given account size.\n\n# TRADING DECISIONS\n\n```json\n{\n  \"ETH\": {\n    \"trade_signal_args\": {\n      \"coin\": \"ETH\",\n      \"signal\": \"hold\",\n      \"quantity\": 4.95,\n      \"profit_target\": 3950.0,\n      \"stop_loss\": 3750.0,\n      \"invalidation_condition\": \"If price closes below 3750 on 3-minute candle or RSI(14) drops back below 30\",\n      \"leverage\": 10,\n      \"confidence\": 0.68,\n      \"risk_usd\": 400.0\n    }\n  }\n}\n```",
      "signals": [
        {
          "coin": "ETH",
          "signal": "hold",
          "quantity": 4.95,
          "leverage": 10,
          "stop_loss": 3750.0,
          "profit_target": 3950.0,
          "confidence": 0.68,
          "risk_usd": 400.0,
          "invalidation_condition": "If price closes below 3750 on 3-minute candle or RSI(14) drops back below 30"
        }
      ]
    },
    {
      "iteration": 12,
      "timestamp": "2025-10-18T20:00:00",
      "model": "anthropic",
      "raw_response": "# CHAIN OF THOUGHT\n\nReviewing my current position:\n\n**ETH Position Analysis:**\n- Entry: $3830.70, Current: $3887.40 (+$56.70/coin)\n- Unrealized P&L: +$271.18 (+1.48%)\n- Position size: 4.95 ETH at 10x leverage ($19,242.63 notional)\n- Profit target: $3950.00 (still $62.60 away)\n- Stop-loss: $3750.00 (well below current price)\n- Invalidation condition: \"If price closes below 3750 on 3-minute candle or RSI(14) drops back below 30\"\n\n**Checking Invalidation Condition:**\n- Current price $3887.40 is well above $3750 \u2713\n- RSI(14) = 52.051, which is above 30 \u2713\n- Invalidation condition NOT met\n\n**Technical Analysis:**\n- Price action: Recovering nicely from lows, currently just below EMA20 ($3891.82)\n- RSI(7): 60.997 - healthy momentum, not overbought\n- RSI(14): 52.051 - neutral zone, room to run\n- MACD: -23.886, improving from -45.058 (strong bullish divergence)\n- Price is attempting to break above EMA20, which would be bullish\n- Volume is light (35,720 vs avg 111,287), suggesting consolidation\n\n**Position Decision:**\nThe position is profitable and showing good momentum. Price is consolidating near EMA20 with improving MACD and healthy RSI. No invalidation conditions are met. Profit target at $3950 is reasonable and achievable. I will HOLD this position.\n\n**Other Coins Assessment:**\n- **BTC**: Below EMA20, MACD improving but still deeply negative. RSI neutral. Not compelling enough to enter.\n- **SOL**: Above EMA20, strong RSI(7) at 71.2, but overbought. MACD improving. Risky entry point.\n- **BNB**: Well below EMA20, weak RSI at 44.7, negative MACD. Downtrend continuation risk.\n- **XRP**: At EMA20, neutral RSI, MACD improving. Consolidating but no clear edge.\n- **DOGE**: At EMA20, RSI(7) 72.7 overbought, MACD improving. Too extended for entry.\n\nNo new positions warranted. Market is in consolidation mode with mixed signals. ETH position has best risk/reward setup currently.\n\n# TRADING DECISIONS\n\n```json\n{\n  \"ETH\": {\n    \"trade_signal_args\": {\n      \"coin\": \"ETH\",\n      \"signal\": \"hold\",\n      \"quantity\": 4.95,\n      \"profit_target\": 3950.0,\n      \"stop_loss\": 3750.0,\n      \"invalidation_condition\": \"If price closes below 3750 on 3-minute candle or RSI(14) drops back below 30\",\n      \"leverage\": 10,\n      \"confidence\": 0.68,\n      \"risk_usd\": 400.0\n    }\n  }\n}\n```",
      "signals": [
        {
          "coin": "ETH",
          "signal": "hold",
          "quantity": 4.95,
          "leverage": 10,
          "stop_loss": 3750.0,
          "profit_target": 3950.0,
          "confidence": 0.68,
          "risk_usd": 400.0,
          "invalidation_condition": "If price closes below 3750 on 3-minute candle or RSI(14) drops back below 30"
        }
      ]
    },
    {
      "iteration": 13,
      "timestamp": "2025-10-19T00:00:00",
      "model": "anthropic",
      "raw_response": "# CHAIN OF THOUGHT\n\n## Current Position Analysis\n\n**ETH Position Review:**\n- Entry: $3830.70, Current: $3904.70 (+$74.00 per unit)\n- Unrealized PnL: +$356.82 (+1.85% gain)\n- Position size: 4.95 ETH with 10x leverage ($19,328 notional)\n- Profit target: $3950.00 (only $45.30 away - 1.16% move)\n- Stop-loss: $3750.00 ($154.70 cushion)\n- Invalidation: \"If price closes below 3750 on 3-minute candle or RSI(14) drops back below 30\"\n\n**Technical Analysis for ETH:**\n- Current price $3904.70 is ABOVE entry and approaching profit target\n- RSI(7): 71.158 - overbought territory, showing strong momentum\n- RSI(14): 56.822 - healthy, well above the 30 invalidation level\n- MACD: -20.766, improving from -24.703 (bullish divergence, trending toward zero)\n- Price above EMA20 ($3893.63), showing short-term bullish control\n- Recent price action: Strong upward movement from $3797.30 to $3904.70 (+2.83%)\n\n**Invalidation Check:**\n- Price NOT below $3750 \u2713\n- RSI(14) at 56.822, NOT below 30 \u2713\n- **Invalidation condition NOT met**\n\n**Decision Rationale for ETH:**\nThe position is performing well with +$356 unrealized profit. Price is only $45 away from the $3950 profit target. However, RSI(7) at 71.158 shows overbought conditions which could lead to a pullback. The MACD is still negative but improving, indicating momentum shift. \n\nGiven that:\n1. We're very close to profit target (1.16% away)\n2. RSI(7) shows overbought at 71.158\n3. Position has good profit (+1.85%)\n4. No invalidation conditions are met\n\n**DECISION: CLOSE POSITION** - Taking profits near target. The overbought RSI(7) at 71+ suggests potential near-term pullback, and we're within striking distance of our $3950 target. Better to lock in gains than risk a reversal.\n\n## Other Coins Analysis\n\n**BTC:** Price $107,215, below EMA20 ($107,798). MACD still negative (-861.916) but improving. RSI(7) at 58.548 shows neutral momentum. Price action choppy. No clear setup - PASS.\n\n**SOL:** Price $186.90, just above EMA20 ($186.78). MACD negative (-1.537) but improving. RSI(7) at 62.603. Consolidating near EMA. Marginal setup but not compelling - PASS.\n\n**BNB:** Price $1091.10, well below EMA20 ($1110.60). MACD negative (-17.058). RSI(7) at 43.760 shows weakness. Downtrend intact - PASS.\n\n**XRP:** Price $2.37, above EMA20 ($2.35). MACD improving (-0.009). RSI(7) at 62.833. Similar to SOL, decent but not strong enough - PASS.\n\n**DOGE:** Price $0.190530, above EMA20 ($0.189213). MACD improving (-0.001). RSI(7) at 79.484 - EXTREMELY overbought. Too extended for entry - PASS.\n\n# TRADING DECISIONS\n\n```json\n{\n  \"ETH\": {\n    \"trade_signal_args\": {\n      \"coin\": \"ETH\",\n      \"signal\": \"close_position\",\n      \"quantity\": 4.95,\n      \"profit_target\": 3950.0,\n      \"stop_loss\": 3750.0,\n      \"invalidation_condition\": \"If price closes below 3750 on 3-minute candle or RSI(14) drops back below 30\",\n      \"leverage\": 10,\n      \"confidence\": 0.68,\n      \"risk_usd\": 400.0,\n      \"close_reason\": \"Taking profits - price within 1.16% of $3950 profit target with RSI(7) at overbought 71.158 suggesting potential pullback. Locking in +$356.82 gain (+1.85% return).\"\n    }\n  }\n}\n```",
      "signals": [
        {
          "coin": "ETH",
          "signal": "close_position",
          "quantity": 4.95,
          "leverage": 10,
          "stop_loss": 3750.0,
          "profit_target": 3950.0,
          "confidence": 0.68,
          "risk_usd": 400.0,
          "invalidation_condition": "If price closes below 3750 on 3-minute candle or RSI(14) drops back below 30"
        }
      ]
    },
    {
      "iteration": 14,
      "timestamp": "2025-10-19T04:00:00",
      "model": "anthropic",
      "raw_response": "# CHAIN OF THOUGHT\n\n## Current Portfolio Status\n- No open positions\n- Available cash: $9,639.91\n- Current drawdown: -3.60%\n- Sharpe ratio: -4.356 (poor risk-adjusted returns so far)\n\n## Market Analysis by Coin\n\n**BTC Analysis:**\n- Price: $106,726 (below EMA20: $107,771)\n- RSI(7): 36.17 - oversold territory\n- MACD: -942.47 - deeply negative but improving (-967 \u2192 -942)\n- Price action: Sharp drop from $107,215 to $106,726 in last candle\n- Trend: Below both 20 and 50 EMA, bearish structure\n- Assessment: Oversold but downtrend intact. Too risky to enter without confirmation of reversal.\n\n**ETH Analysis:**\n- Price: $3,886 (below EMA20: $3,897)\n- RSI(7): 51.63 - neutral (dropped from 71.09)\n- MACD: -24.17 - negative but improving trend\n- Price action: Consolidating near EMA20, showed strength earlier\n- Trend: Price hovering around EMA20, indecisive\n- Assessment: Neutral setup, no clear edge. Recent RSI drop from 71 to 51 suggests momentum loss.\n\n**SOL Analysis:**\n- Price: $185.81 (below EMA20: $186.66)\n- RSI(7): 47.79 - neutral (dropped from 71.30)\n- MACD: -1.395 - negative but improving\n- Price action: Failed to hold above EMA20, retreating\n- Trend: Weak, below both EMAs\n- Assessment: Lost momentum after recent strength. No entry signal.\n\n**BNB Analysis:**\n- Price: $1,083.90 (significantly below EMA20: $1,110.92)\n- RSI(7): 35.47 - oversold\n- MACD: -20.89 - negative\n- Price action: Continuing decline, broke below recent consolidation\n- Trend: Strong downtrend, below both 20 and 50 EMA\n- Assessment: Oversold but in clear downtrend. Catching falling knife risk.\n\n**XRP Analysis:**\n- Price: $2.35 (exactly at EMA20: $2.35)\n- RSI(7): 45.27 - neutral (dropped from 62.81)\n- MACD: -0.010 - slightly negative but near zero\n- Price action: Consolidating tightly around EMA20\n- Trend: Neutral, mean-reverting behavior\n- Assessment: Most balanced setup but lacking conviction for entry.\n\n**DOGE Analysis:**\n- Price: $0.18869 (below EMA20: $0.18919)\n- RSI(7): 50.62 - neutral (dropped sharply from 79.48)\n- MACD: -0.001 - nearly neutral\n- Price action: Sharp rejection from highs, mean reversion\n- Trend: Below EMA20 after overbought rejection\n- Assessment: Overbought exhaustion playing out. No edge.\n\n## Risk Management Considerations\n- Portfolio down 3.60% with negative Sharpe ratio\n- Need high-probability setups to recover\n- All coins showing either:\n  1. Clear downtrends (BTC, BNB, SOL)\n  2. Neutral/indecisive action (ETH, XRP, DOGE)\n- No strong bullish momentum or reversal patterns\n- Low volume across all assets suggests lack of conviction\n\n## Trading Decision\n**NO POSITIONS TO OPEN**: Market conditions are unfavorable across all assets. No clear bullish setups with positive risk/reward. Better to preserve capital and wait for higher-probability entries with:\n- Clear oversold bounces with momentum confirmation\n- Bullish MACD crossovers\n- Price reclaiming key EMAs with volume\n- RSI divergences at support levels\n\nCurrent market showing indecision and weakness. Patience is the correct strategy.\n\n# TRADING DECISIONS\n\n{}",
      "signals": []
    },
    {
      "iteration": 15,
      "timestamp": "2025-10-19T08:00:00",
      "model": "anthropic",
      "raw_response": "# CHAIN OF THOUGHT\n\n## Current Portfolio Status\n- No open positions\n- Available cash: $9,639.91\n- Total return: -3.60% (down from $10,000 start)\n- Sharpe ratio: -4.356 (poor risk-adjusted returns so far)\n\n## Market Analysis\n\n**BTC (107,735)**\n- Recent sharp recovery: +1,009 in last candle (from 106,726 to 107,735)\n- RSI(7): 68.9 - approaching overbought but not extreme\n- RSI(14): 55.9 - healthy mid-range\n- MACD: -694.8, improving from -797.8 (still negative but momentum turning)\n- Price above EMA20 (107,665) - bullish crossover just occurring\n- Below 50-EMA (108,788) on 4H - still in correction zone\n- Volume elevated (6,304 vs avg 5,346)\n- Strong bounce suggests potential short-term continuation\n\n**ETH (3,922.20)**\n- Strong upward momentum: +36.20 in last candle\n- RSI(7): 71.7 - overbought territory\n- RSI(14): 60.2 - still room before extreme\n- MACD: -17.6, rapidly improving from -22.3\n- Price above EMA20 (3,897.93) - bullish\n- Below 50-EMA (3,935.72) but approaching resistance\n- Volume very elevated (150,951 vs avg 106,251) - 42% above average\n- Strong buying pressure evident\n\n**SOL (188.86)**\n- Explosive move: +3.05 in last candle\n- RSI(7): 72.3 - overbought\n- RSI(14): 61.6 - moderate\n- MACD: -0.933, best momentum of all coins\n- Price above EMA20 (186.78) - bullish breakout\n- Below 50-EMA (188.91) but very close\n- Volume lower than average (513,815 vs 909,386) - concerning for sustainability\n- Strongest technical setup but lower volume is a red flag\n\n**BNB (1,099.20)**\n- Moderate recovery: +15.30 in last candle\n- RSI(7): 57.8 - neutral/slightly bullish\n- RSI(14): 48.7 - neutral\n- MACD: -19.3, still deeply negative\n- Price below EMA20 (1,109.84) - bearish\n- Below 50-EMA (1,139.35) - in downtrend\n- Weakest technical setup - avoid\n\n**XRP (2.37)**\n- Modest gain: +0.02 in last candle\n- RSI(7): 63.3 - moderate bullish\n- RSI(14): 57.5 - moderate\n- MACD: -0.006, nearly neutral\n- Price above EMA20 (2.35) - marginally bullish\n- Below 50-EMA (2.37) - at resistance\n- Volume below average - weak conviction\n- Consolidating, not compelling\n\n**DOGE (0.193210)**\n- Strong surge: +0.004520 in last candle\n- RSI(7): 77.4 - very overbought\n- RSI(14): 65.9 - elevated\n- MACD: -0.001, nearly neutral\n- Price above EMA20 (0.189724) - bullish\n- Below 50-EMA (0.192362) but approaching\n- Volume below average (42.4M vs 49M)\n- Too extended for safe entry\n\n## Trading Decision\n\nGiven my poor performance (-3.60%), I need to be selective and disciplined. The market is showing recovery momentum across the board, but I need to pick the best risk/reward setup.\n\n**Best Setup: BTC**\n- Most liquid and stable\n- Strong bounce with good volume confirmation\n- RSI not yet extreme (68.9 vs 71.7 for ETH, 72.3 for SOL)\n- Just crossed above EMA20 - early in potential trend\n- MACD improving rapidly\n- Lower risk than smaller caps\n\nI'll enter BTC with conservative sizing given my negative performance. Risk 2% of portfolio ($192.80) with 15x leverage for balanced exposure.\n\nEntry: 107,735\nStop-loss: 106,300 (below recent low of 106,726, ~1.33% below entry)\nProfit target: 110,200 (~2.29% gain, 1.7:1 reward/risk)\nInvalidation: If price closes below 106,500 (support broken)\n\nPosition size calculation:\n- Risk per unit: 107,735 - 106,300 = 1,435\n- Position size: $192.80 / 1,435 = 0.134 BTC\n- With 15x leverage: notional = 0.134 \u00d7 107,735 = $14,436\n\n# TRADING DECISIONS\n\n```json\n{\n  \"BTC\": {\n    \"trade_signal_args\": {\n      \"coin\": \"BTC\",\n      \"signal\": \"buy\",\n      \"quantity\": 0.134,\n      \"profit_target\": 110200.0,\n      \"stop_loss\": 106300.0,\n      \"invalidation_condition\": \"If price closes below 106,500 on 3-minute candle, indicating failed breakout and return to downtrend\",\n      \"leverage\": 15,\n      \"confidence\": 0.72,\n      \"risk_usd\": 192.80\n    }\n  }\n}\n```",
      "signals": [
        {
          "coin": "BTC",
          "signal": "buy",
          "quantity": 0.134,
          "leverage": 15,
          "stop_loss": 106300.0,
          "profit_target": 110200.0,
          "confidence": 0.72,
          "risk_usd": 192.8,
          "invalidation_condition": "If price closes below 106,500 on 3-minute candle, indicating failed breakout and return to downtrend"
        }
      ]
    },
    {
      "iteration": 16,
      "timestamp": "2025-10-19T12:00:00",
      "model": "anthropic",
      "raw_response": "# CHAIN OF THOUGHT\n\n## Current Position Analysis\n\n**BTC Position Review:**\n- Entry: 107,735 | Current: 108,435 (+0.65%)\n- Unrealized PnL: +$86.58\n- Leverage: 15x\n- Stop-loss: 106,300 | Profit target: 110,200\n- Invalidation: \"If price closes below 106,500 on 3-minute candle\"\n\n**Technical Analysis:**\n- Current price 108,435 is ABOVE entry and trending up\n- RSI(7): 78.9 - significantly overbought territory\n- RSI(14): 63.3 - moderately overbought\n- MACD: -707.87 (still negative but improving from -1311)\n- Price crossed above EMA20 (107,857) - bullish short-term signal\n- Recent price action shows strong recovery: 106,726 \u2192 107,735 \u2192 108,435\n\n**Invalidation Check:**\n- Invalidation level: 106,500\n- Current price: 108,435\n- Last 3-minute candle low: Above 107,735\n- **Invalidation NOT met** - price remains well above 106,500\n\n**Risk Assessment:**\n- Position is in profit (+$86)\n- RSI extremely overbought (78.9) suggests potential pullback risk\n- MACD still negative but improving rapidly\n- Price approaching profit target (110,200) - only 1,765 points away\n- Stop-loss at 106,300 provides 2,135 points of downside protection\n\n**Decision Rationale:**\nThe invalidation condition has NOT been met. Price remains above 106,500 and is actually strengthening. However, the extremely overbought RSI (78.9) is concerning for short-term continuation. The position is profitable and trending toward the profit target. Given that:\n1. Invalidation not triggered\n2. Position is profitable\n3. Stop-loss provides adequate protection\n4. Price momentum is positive despite overbought conditions\n\nI will **HOLD** the position and let it run toward the profit target at 110,200.\n\n## Other Coins Analysis\n\n**ETH:** No position. RSI(7) at 84.6 - extremely overbought. Would not enter here.\n\n**SOL:** No position. RSI(7) at 79.8 - very overbought. Would not enter here.\n\n**BNB:** No position. RSI(7) at 73.3 - overbought. Would not enter here.\n\n**XRP:** No position. RSI(7) at 74.2 - overbought. Would not enter here.\n\n**DOGE:** No position. RSI(7) at 85.1 - extremely overbought. Would not enter here.\n\nAll major coins are showing overbought conditions on short-term RSI, suggesting we're at a potential local top. Not entering new positions at these levels.\n\n# TRADING DECISIONS\n\n```json\n{\n  \"BTC\": {\n    \"trade_signal_args\": {\n      \"coin\": \"BTC\",\n      \"signal\": \"hold\",\n      \"quantity\": 0.134,\n      \"profit_target\": 110200.0,\n      \"stop_loss\": 106300.0,\n      \"invalidation_condition\": \"If price closes below 106,500 on 3-minute candle, indicating failed breakout and return to downtrend\",\n      \"leverage\": 15,\n      \"confidence\": 0.72,\n      \"risk_usd\": 192.8\n    }\n  }\n}\n```",
      "signals": [
        {
          "coin": "BTC",
          "signal": "hold",
          "quantity": 0.134,
          "leverage": 15,
          "stop_loss": 106300.0,
          "profit_target": 110200.0,
          "confidence": 0.72,
          "risk_usd": 192.8,
          "invalidation_condition": "If price closes below 106,500 on 3-minute candle, indicating failed breakout and return to downtrend"
        }
      ]
    },
    {
      "iteration": 17,
      "timestamp": "2025-10-19T16:00:00",
      "model": "anthropic",
      "raw_response": "# CHAIN OF THOUGHT\n\n## Current Position Analysis\n\n### BTC Position Review\n- **Entry**: 107,735 | **Current**: 108,841 | **PnL**: +$140.99 (+1.03%)\n- **Stop Loss**: 106,300 | **Profit Target**: 110,200\n- **Invalidation Condition**: \"If price closes below 106,500 on 3-minute candle\"\n\n**Technical Analysis**:\n- Price at 108,841 is well above invalidation level (106,500) and stop-loss (106,300)\n- RSI(7) at 83.6 - severely overbought territory (>80)\n- RSI(14) at 70.9 - also overbought but less extreme\n- MACD trending strongly positive: -29.134 (recovering from -523)\n- Price above EMA20 (107,560) - bullish momentum\n- Recent price action: Strong upward momentum from 106,726 to 108,841 in last 4 candles\n\n**Decision Factors**:\n1. \u2705 Invalidation NOT met - price well above 106,500\n2. \u2705 Stop-loss NOT hit - price at 108,841 vs SL 106,300\n3. \u26a0\ufe0f Profit target CLOSE - 108,841 vs target 110,200 (only 1.25% away)\n4. \u26a0\ufe0f RSI extremely overbought at 83.6 - suggests potential pullback imminent\n5. \u2705 MACD showing strong bullish momentum recovery\n\n**Risk Assessment**:\n- Position is profitable but in overbought territory\n- Near profit target (1,359 points away)\n- Strong momentum could push to target, but overbought RSI suggests exhaustion\n- Given we're only 8 minutes into trading and RSI is at extreme levels, taking profits near target is prudent\n\n**DECISION: CLOSE POSITION** - Taking profits due to:\n1. Price within 1.25% of profit target\n2. Extreme overbought RSI (83.6) indicating high probability of reversal\n3. Good risk management to lock in gains rather than risk reversal\n\n## Other Coins Assessment\n\n### ETH\n- **Current**: 3,983.70 | RSI(7): 86.2 | MACD: 16.084\n- Extremely overbought (RSI > 86), but strong uptrend\n- No existing position, and at these overbought levels, not entering new position\n\n### SOL\n- **Current**: 188.81 | RSI(7): 58.5 | MACD: 0.664\n- Moderate conditions but recently pulled back from 190.67\n- No clear setup\n\n### BNB\n- **Current**: 1,116.10 | RSI(7): 69.4 | MACD: -5.194\n- MACD still negative despite recent recovery\n- Not compelling\n\n### XRP\n- **Current**: 2.40 | RSI(7): 72.1 | MACD: 0.012\n- Overbought, minimal momentum\n- Pass\n\n### DOGE\n- **Current**: 0.19669 | RSI(7): 86.2 | MACD: 0.002\n- Extremely overbought like ETH\n- Not entering at these levels\n\n**Conclusion**: Close BTC position to take profits near target with extreme overbought conditions. Do not enter new positions given overbought market conditions across multiple assets.\n\n# TRADING DECISIONS\n\n```json\n{\n  \"BTC\": {\n    \"trade_signal_args\": {\n      \"coin\": \"BTC\",\n      \"signal\": \"close_position\",\n      \"quantity\": 0.134,\n      \"profit_target\": 110200.0,\n      \"stop_loss\": 106300.0,\n      \"invalidation_condition\": \"If price closes below 106,500 on 3-minute candle, indicating failed breakout and return to downtrend\",\n      \"leverage\": 15,\n      \"confidence\": 0.72,\n      \"risk_usd\": 192.8,\n      \"close_reason\": \"Taking profits - price within 1.25% of profit target (108,841 vs 110,200) with extreme overbought RSI at 83.6 indicating high probability of reversal. Locking in +$141 gain for prudent risk management.\"\n    }\n  }\n}\n```",
      "signals": [
        {
          "coin": "BTC",
          "signal": "close_position",
          "quantity": 0.134,
          "leverage": 15,
          "stop_loss": 106300.0,
          "profit_target": 110200.0,
          "confidence": 0.72,
          "risk_usd": 192.8,
          "invalidation_condition": "If price closes below 106,500 on 3-minute candle, indicating failed breakout and return to downtrend"
        }
      ]
    },
    {
      "iteration": 18,
      "timestamp": "2025-10-19T20:00:00",
      "model": "anthropic",
      "raw_response": "# CHAIN OF THOUGHT\n\n## Current Portfolio Status\n- No open positions\n- Available cash: $9,766.39\n- Total return: -2.34%\n- Sharpe ratio: -2.279 (indicates poor risk-adjusted returns so far)\n\n## Market Analysis by Coin\n\n### BTC Analysis\n- **Price action**: Strong upward momentum from 106,726 to 108,591 (+1.75%)\n- **Technical indicators**:\n  - RSI(7): 71.8 - approaching overbought but not extreme\n  - RSI(14): 65.9 - healthy bullish territory\n  - MACD: 107.6 - positive and rising strongly (was negative 9 minutes ago)\n  - Price above EMA20 (108,591 vs 107,617) - bullish\n  - MACD just turned positive indicating momentum shift\n- **Assessment**: Strong bullish breakout with momentum confirmation. However, RSI shows some overextension. This could be a good entry but need to be cautious of pullback.\n\n### ETH Analysis\n- **Price action**: Strong rally from 3,886 to 3,980 (+2.4%)\n- **Technical indicators**:\n  - RSI(7): 82.6 - significantly overbought\n  - RSI(14): 75.0 - overbought\n  - MACD: 27.5 - positive and rising\n  - Price well above EMA20 (3,980 vs 3,901) - bullish\n- **Assessment**: Very overbought conditions. While momentum is strong, the RSI levels suggest high probability of pullback. Too risky to enter here.\n\n### SOL Analysis\n- **Price action**: Volatile - peaked at 190.67, now at 187.77\n- **Technical indicators**:\n  - RSI(7): 48.7 - neutral, showing weakness after recent high\n  - RSI(14): 54.8 - neutral\n  - MACD: 1.115 - slightly positive but declining from 1.135\n  - Price slightly above EMA20 (187.77 vs 186.31)\n- **Assessment**: Losing momentum after recent spike. Not compelling for entry.\n\n### BNB Analysis\n- **Price action**: Recovering from 1,083 low to 1,109\n- **Technical indicators**:\n  - RSI(7): 56.5 - neutral\n  - RSI(14): 53.8 - neutral\n  - MACD: -5.9 - still negative but improving\n  - Price slightly above EMA20 (1,109 vs 1,106)\n  - Below 50-period EMA (1,119.56) - longer-term bearish\n- **Assessment**: Weak recovery, still in downtrend. Not attractive.\n\n### XRP Analysis\n- **Price action**: Steady uptrend from 2.35 to 2.39\n- **Technical indicators**:\n  - RSI(7): 62.1 - healthy bullish\n  - RSI(14): 62.0 - healthy bullish\n  - MACD: 0.018 - positive and rising\n  - Price above EMA20 (2.39 vs 2.35) - bullish\n  - Above 50-period EMA (2.34) - longer-term bullish\n- **Assessment**: Steady uptrend with healthy indicators. Not overextended. Good risk/reward setup.\n\n### DOGE Analysis\n- **Price action**: Strong rally from 0.1877 to 0.1953 (+4%)\n- **Technical indicators**:\n  - RSI(7): 68.5 - elevated but cooling from 86.3\n  - RSI(14): 69.1 - elevated\n  - MACD: 0.002 - positive and rising\n  - Price above EMA20 (0.1953 vs 0.1901) - bullish\n- **Assessment**: Strong move but showing signs of exhaustion. RSI cooling suggests profit-taking.\n\n## Trading Decision Rationale\n\nGiven my poor Sharpe ratio and need to improve risk-adjusted returns, I should be selective. The best opportunities appear to be:\n\n1. **XRP** - Most balanced setup with healthy momentum, not overextended, steady uptrend\n2. **BTC** - Strong momentum but slightly overextended, could wait for pullback\n\nI'll enter XRP as it has the best risk/reward profile with room to run and healthy technical setup. I'll use conservative position sizing given my negative returns so far.\n\n**Risk Management**:\n- Position size: Risk $300 (3% of capital)\n- Leverage: 15x (moderate given volatility)\n- Entry: 2.39\n- Stop-loss: 2.33 (below recent support and EMA20, ~2.5% below entry)\n- Profit target: 2.47 (resistance level, ~3.3% above entry)\n- Invalidation: Price closes below 2.32 (below EMA20 decisively)\n\n# TRADING DECISIONS\n\n```json\n{\n  \"XRP\": {\n    \"trade_signal_args\": {\n      \"coin\": \"XRP\",\n      \"signal\": \"buy\",\n      \"quantity\": 837,\n      \"profit_target\": 2.47,\n      \"stop_loss\": 2.33,\n      \"invalidation_condition\": \"If price closes below 2.32 on 3-minute candle, indicating breakdown below EMA20 support\",\n      \"leverage\": 15,\n      \"confidence\": 0.72,\n      \"risk_usd\": 300\n    }\n  }\n}\n```",
      "signals": [
        {
          "coin": "XRP",
          "signal": "buy",
          "quantity": 837.0,
          "leverage": 15,
          "stop_loss": 2.33,
          "profit_target": 2.47,
          "confidence": 0.72,
          "risk_usd": 300.0,
          "invalidation_condition": "If price closes below 2.32 on 3-minute candle, indicating breakdown below EMA20 support"
        }
      ]
    },
    {
      "iteration": 19,
      "timestamp": "2025-10-20T00:00:00",
      "model": "anthropic",
      "raw_response": "# CHAIN OF THOUGHT\n\nReviewing my current position and market conditions:\n\n**XRP Position Analysis:**\n- Entry: $2.3893, Current: $2.4327 (+1.82%)\n- Unrealized P&L: +$35.33\n- Profit Target: $2.47 (1.5% away)\n- Stop-Loss: $2.33 (4.2% below current)\n- Invalidation Condition: \"If price closes below 2.32 on 3-minute candle, indicating breakdown below EMA20 support\"\n\n**Technical Check:**\n- Current EMA20: $2.36 - Price is $2.4327, well above EMA20 \u2713\n- RSI (7-period): 80.881 - Extremely overbought (danger zone)\n- RSI (14-period): 72.770 - Overbought\n- MACD: 0.022 - Positive and trending up\n- Price action: Strong upward momentum, latest candle jumped from $2.39 to $2.43\n- EMA20 trending up: from $2.33 to $2.36 (bullish)\n\n**Invalidation Check:**\n- Invalidation level: Below $2.32\n- Current price: $2.4327\n- Current EMA20: $2.36\n- Status: NOT MET - price remains well above $2.32 and above EMA20 support\n\n**Risk Assessment:**\n- RSI at 80.881 is dangerously overbought - typically signals imminent pullback\n- However, in strong trends, RSI can remain elevated\n- Profit target at $2.47 is only 1.5% away vs 4.2% to stop-loss\n- Risk/reward currently unfavorable for holding through potential pullback\n- Position is profitable (+$35) but small gain relative to $300 risk\n\n**Decision: CLOSE POSITION**\nReasoning: While invalidation condition is NOT met, the extreme RSI reading (80.881) combined with being close to profit target suggests taking profits is prudent. The RSI has been above 80 for the last candle, indicating exhaustion. Better to lock in gains than risk a sharp reversal from overbought conditions. This is a risk management decision, not an invalidation-triggered exit.\n\n**Other Coins Review:**\n- **BTC**: RSI 86.833 (extremely overbought), strong momentum but extended. Price at $110,100 up sharply. Too risky to enter at these levels.\n- **ETH**: RSI 90.328 (dangerously overbought), similar concerns as BTC. Avoid.\n- **SOL**: RSI 70.361 (overbought but not extreme), more reasonable but momentum may be fading.\n- **BNB**: RSI 73.779 (overbought), MACD still negative (-3.650), mixed signals.\n- **DOGE**: RSI 81.814 (extremely overbought), avoid at these levels.\n\nAll major coins are showing overbought conditions. No new positions warranted. Focus on preserving capital and locking in XRP gains.\n\n# TRADING DECISIONS\n\n```json\n{\n  \"XRP\": {\n    \"trade_signal_args\": {\n      \"coin\": \"XRP\",\n      \"signal\": \"close_position\",\n      \"quantity\": 837.0,\n      \"profit_target\": 2.47,\n      \"stop_loss\": 2.33,\n      \"invalidation_condition\": \"If price closes below 2.32 on 3-minute candle, indicating breakdown below EMA20 support\",\n      \"leverage\": 15,\n      \"confidence\": 0.72,\n      \"risk_usd\": 300.0,\n      \"close_reason\": \"Taking profits due to extreme overbought conditions (RSI 80.881) and risk management. Price near profit target with unfavorable risk/reward for continued holding through potential pullback.\"\n    }\n  }\n}\n```",
      "signals": [
        {
          "coin": "XRP",
          "signal": "close_position",
          "quantity": 837.0,
          "leverage": 15,
          "stop_loss": 2.33,
          "profit_target": 2.47,
          "confidence": 0.72,
          "risk_usd": 300.0,
          "invalidation_condition": "If price closes below 2.32 on 3-minute candle, indicating breakdown below EMA20 support"
        }
      ]
    },
    {
      "iteration": 20,
      "timestamp": "2025-10-20T04:00:00",
      "model": "anthropic",
      "raw_response": "# CHAIN OF THOUGHT\n\n## Current Portfolio Status\n- No open positions\n- Available cash: $9,799.70\n- Total return: -2.00%\n- Sharpe ratio: -1.807 (negative performance so far)\n\n## Market Analysis\n\n**BTC Analysis:**\n- Current: $111,161 | EMA20: $108,297 (price well above EMA - bullish)\n- RSI(7): 91.2 (EXTREME overbought - danger zone)\n- RSI(14): 82.3 (very overbought)\n- MACD: +341.85 (strong positive momentum)\n- Recent move: +4.8% in last 30 minutes (parabolic)\n- Assessment: While trend is strong, RSI at 91.2 is extremely dangerous. This level typically precedes sharp pullbacks. The move from 107k to 111k is too vertical. **AVOID - waiting for pullback or consolidation.**\n\n**ETH Analysis:**\n- Current: $4,053.40 | EMA20: $3,935.02 (price +3% above EMA)\n- RSI(7): 92.9 (EXTREME overbought - highest of all coins)\n- RSI(14): 83.9 (very overbought)\n- MACD: +29.09 (strong bullish momentum)\n- Recent surge: Strong rally from 3,886 to 4,053\n- Assessment: RSI(7) at 92.9 is even more extreme than BTC. This is a parabolic blow-off top setup. **AVOID - too risky at these levels.**\n\n**SOL Analysis:**\n- Current: $192.93 | EMA20: $187.63 (price +2.8% above EMA)\n- RSI(7): 77.2 (overbought but not extreme)\n- RSI(14): 70.8 (moderately overbought)\n- MACD: +1.318 (positive and rising)\n- Recent pattern: Steady climb with healthier RSI levels\n- Assessment: Most reasonable RSI among major coins. Still overbought but not parabolic. **CAUTIOUS PASS - prefer to see consolidation first.**\n\n**BNB Analysis:**\n- Current: $1,124.50 | EMA20: $1,110.57 (price +1.3% above EMA)\n- RSI(7): 67.3 (approaching overbought but manageable)\n- RSI(14): 61.0 (neutral to slightly bullish)\n- MACD: -2.83 (still negative but improving)\n- Pattern: Recovery from oversold, healthiest RSI structure\n- Assessment: **BEST SETUP** - RSI not overextended, MACD turning positive, price breaking above EMA. This has the best risk/reward with room to run.\n\n**XRP Analysis:**\n- Current: $2.47 | EMA20: $2.38 (price +3.8% above EMA)\n- RSI(7): 87.7 (very overbought)\n- RSI(14): 78.3 (overbought)\n- MACD: +0.022 (positive momentum)\n- Assessment: Strong move but RSI too extended. **AVOID.**\n\n**DOGE Analysis:**\n- Current: $0.20115 | EMA20: $0.19230 (price +4.6% above EMA)\n- RSI(7): 86.1 (very overbought)\n- RSI(14): 80.2 (overbought)\n- MACD: +0.003 (positive)\n- Assessment: Meme coin with extended RSI. **AVOID.**\n\n## Trading Decision\nGiven the extreme overbought conditions across most of the market (BTC and ETH both with RSI(7) > 90), I'm being very selective. BNB offers the best risk/reward with RSI(7) at 67.3, showing strength without being overextended. I'll take a small position with tight risk management.\n\n**Position Sizing:**\n- Risk per trade: 1.5% of capital = $147\n- BNB stop-loss distance: $1,124.50 - $1,100 = $24.50 (2.2%)\n- Position size with 15x leverage: ($147 / $24.50) * 15 = ~90 BNB\n- Position value: 90 * $1,124.50 = $101,205 (leveraged)\n- Actual capital used: $101,205 / 15 = $6,747\n\n# TRADING DECISIONS\n\n```json\n{\n  \"BNB\": {\n    \"trade_signal_args\": {\n      \"coin\": \"BNB\",\n      \"signal\": \"buy\",\n      \"quantity\": 90,\n      \"profit_target\": 1165.00,\n      \"stop_loss\": 1100.00,\n      \"invalidation_condition\": \"If price closes below $1,100 on 3-minute candle or if RSI(7) reaches 90+ indicating overextension\",\n      \"leverage\": 15,\n      \"confidence\": 0.72,\n      \"risk_usd\": 147.00\n    }\n  }\n}\n```",
      "signals": [
        {
          "coin": "BNB",
          "signal": "buy",
          "quantity": 90.0,
          "leverage": 15,
          "stop_loss": 1100.0,
          "profit_target": 1165.0,
          "confidence": 0.72,
          "risk_usd": 147.0,
          "invalidation_condition": "If price closes below $1,100 on 3-minute candle or if RSI(7) reaches 90+ indicating overextension"
        }
      ]
    },
    {
      "iteration": 21,
      "timestamp": "2025-10-20T08:00:00",
      "model": "anthropic",
      "raw_response": "# CHAIN OF THOUGHT\n\n## Current Position Analysis\n\n**BNB Position Review:**\n- Entry: $1,124.50, Current: $1,114.60\n- Unrealized P&L: -$941.60 (-0.88%)\n- Position size: 90 BNB at 15x leverage ($100,314 notional)\n- Stop-loss: $1,100.00\n- Profit target: $1,165.00\n- Invalidation condition: \"If price closes below $1,100 on 3-minute candle or if RSI(7) reaches 90+ indicating overextension\"\n\n**Technical Analysis:**\n- Current price: $1,114.60 is DANGEROUSLY CLOSE to stop-loss at $1,100 (only $14.60 buffer)\n- RSI(7): 50.811 - neutral, not overbought\n- RSI(14): 57.414 - healthy mid-range\n- Price action: Recent pullback from $1,127.90 high, now consolidating\n- MACD: 13.272 still positive but declining from 13.633\n- EMA20: $1,099.24 - price is above but very close\n- Recent candles show weakness: 1127.90 \u2192 1124.50 \u2192 1114.60 (downtrend)\n\n**Critical Decision Point:**\nThe position is NOT yet invalidated (price hasn't closed below $1,100), BUT we're only $14.60 away from stop-loss. The recent price action shows bearish momentum with lower highs. RSI has dropped from 74.789 to 50.811, indicating momentum loss.\n\nGiven:\n1. We're very close to stop-loss ($14.60 buffer)\n2. Recent downtrend in price\n3. RSI showing momentum loss\n4. Small unrealized loss (-$941)\n5. High leverage (15x) means risk is amplified\n\n**Risk Management Decision:** I should CLOSE this position proactively. While the invalidation condition hasn't technically been met (no close below $1,100 yet), we're in a dangerous zone. The momentum has clearly shifted bearish, and waiting for the stop-loss to hit would be poor risk management. Better to exit now with a small controlled loss than risk further deterioration.\n\n**Other Coins - New Entry Opportunities:**\n\n**BTC:** $110,996 - RSI(7) at 85.817 is EXTREMELY overbought. Despite strong uptrend, this is too extended for entry. Would need pullback.\n\n**ETH:** $4,033.50 - RSI(7) at 74.557, also elevated but less extreme. Strong uptrend but overextended.\n\n**SOL:** $192.11 - RSI(7) at 68.036, more reasonable. Uptrend intact but not as extended.\n\n**XRP:** $2.46 - RSI(7) at 75.136, strong momentum but getting stretched.\n\n**DOGE:** $0.200190 - RSI(7) at 75.675, similar to XRP.\n\n**Conclusion:** Given we're down -12.52% overall and have limited capital ($3,002), I should close the losing BNB position to preserve capital. The market is generally overbought across most coins, making new entries risky. Better to wait for better setups.\n\n# TRADING DECISIONS\n\n```json\n{\n  \"BNB\": {\n    \"trade_signal_args\": {\n      \"coin\": \"BNB\",\n      \"signal\": \"close_position\",\n      \"quantity\": 90.0,\n      \"profit_target\": 1165.0,\n      \"stop_loss\": 1100.0,\n      \"invalidation_condition\": \"If price closes below $1,100 on 3-minute candle or if RSI(7) reaches 90+ indicating overextension\",\n      \"leverage\": 15,\n      \"confidence\": 0.72,\n      \"risk_usd\": 147.0,\n      \"close_reason\": \"Risk management - price too close to stop-loss ($14.60 buffer) with bearish momentum shift. RSI dropped from 74.789 to 50.811 showing momentum loss. Proactive exit to prevent larger loss as price shows lower highs pattern (1127.90\u21921124.50\u21921114.60). Better to take small controlled loss than risk stop-loss hit.\"\n    }\n  }\n}\n```",
      "signals": [
        {
          "coin": "BNB",
          "signal": "close_position",
          "quantity": 90.0,
          "leverage": 15,
          "stop_loss": 1100.0,
          "profit_target": 1165.0,
          "confidence": 0.72,
          "risk_usd": 147.0,
          "invalidation_condition": "If price closes below $1,100 on 3-minute candle or if RSI(7) reaches 90+ indicating overextension"
        }
      ]
    },
    {
      "iteration": 22,
      "timestamp": "2025-10-20T12:00:00",
      "model": "anthropic",
      "raw_response": "# CHAIN OF THOUGHT\n\n## Current Portfolio Status\n- No open positions\n- Available cash: $8,757.34\n- Account down -12.43% (Sharpe: -8.636)\n- Need to be selective and find high-probability setups\n\n## Market Analysis by Coin\n\n### BTC Analysis\n- **Price**: $111,100 (Strong uptrend)\n- **Technical**: Price well above EMA20 ($108,371), RSI(7) = 86.55 (extremely overbought)\n- **MACD**: 1,227.76 (very strong momentum)\n- **Assessment**: Parabolic move, RSI at dangerous overbought levels (86.55). While momentum is strong, entering at these levels is high risk. The last candle shows slight cooling (price $111,100 vs previous $110,996). This is a late-stage breakout.\n- **Decision**: PASS - Too overbought, high risk of pullback\n\n### ETH Analysis\n- **Price**: $4,003.10\n- **Technical**: Above EMA20 ($3,931.45), RSI(7) = 52.54 (neutral/cooling from overbought)\n- **MACD**: 59.06 (positive but declining from 60.37)\n- **Pattern**: Sharp pullback from $4,053.40 high. RSI dropped from 93.79 to 52.54 - healthy correction\n- **Assessment**: ETH had a strong run but is now consolidating/pulling back. The RSI cooldown from extreme overbought (93.79) to neutral (52.54) suggests profit-taking. Price still above EMA20 support. Could be a healthy pullback before continuation, but momentum is weakening.\n- **Decision**: PASS - Wait for clearer direction after pullback\n\n### SOL Analysis\n- **Price**: $190.41\n- **Technical**: Above EMA20 ($187.66), RSI(7) = 50.53 (neutral)\n- **MACD**: 2.37 (positive but declining slightly)\n- **Pattern**: Similar to ETH - pulled back from $192.93 high, RSI cooled from 77.6 to 50.5\n- **Assessment**: Healthy consolidation after uptrend. Price holding above EMA20. Neutral RSI suggests equilibrium. Not compelling enough for entry.\n- **Decision**: PASS - Sideways action, no clear edge\n\n### BNB Analysis\n- **Price**: $1,110.10\n- **Technical**: Above EMA20 ($1,101.51), RSI(7) = 43.95 (below neutral)\n- **MACD**: 10.85 (positive but declining)\n- **Pattern**: Pullback from $1,127.90 high, RSI dropping to 43.95\n- **Assessment**: Weakening momentum. RSI below 50 suggests bears gaining control. Price near EMA20 support but not bouncing convincingly.\n- **Decision**: PASS - Weak momentum, potential further downside\n\n### XRP Analysis\n- **Price**: $2.46\n- **Technical**: Well above EMA20 ($2.38), RSI(7) = 77.23 (overbought but not extreme)\n- **MACD**: 0.041 (strong uptrend, rising consistently)\n- **Pattern**: Strong uptrend from $2.35 to $2.47, now consolidating at $2.46\n- **Volume**: 2.4M vs average 5.2M (lower volume but still decent)\n- **Assessment**: XRP showing strongest relative strength. Clean uptrend, RSI overbought but not extreme (77 vs BTC's 86), MACD consistently rising. Price holding gains after breakout. This is the most attractive setup.\n- **Decision**: BUY - Best risk/reward, strong momentum without extreme overbought\n\n### DOGE Analysis\n- **Price**: $0.19928\n- **Technical**: Above EMA20 ($0.19277), RSI(7) = 65.05 (mildly overbought)\n- **MACD**: 0.004 (positive, steady)\n- **Pattern**: Strong move from $0.188 to $0.201, now pulling back slightly\n- **Assessment**: Similar to XRP but less compelling. RSI cooling from 86.7 to 65. Momentum still positive but waning.\n- **Decision**: PASS - XRP is better setup\n\n## Risk Management Decision\nGiven the account is down -12.43%, I need a high-probability setup. XRP offers:\n1. Strong uptrend with clean price action\n2. RSI overbought but manageable (77 vs 86-93 on other coins)\n3. Consistent MACD momentum\n4. Price holding above breakout levels\n5. Not as extended as BTC\n\nI'll enter XRP with conservative position sizing (risk ~$400-500, or 5% of account).\n\n# TRADING DECISIONS\n\n```json\n{\n  \"XRP\": {\n    \"trade_signal_args\": {\n      \"coin\": \"XRP\",\n      \"signal\": \"buy\",\n      \"quantity\": 1780,\n      \"profit_target\": 2.65,\n      \"stop_loss\": 2.35,\n      \"invalidation_condition\": \"If price closes below 2.35 (EMA20 support) on 3-minute candle, indicating trend reversal\",\n      \"leverage\": 15,\n      \"confidence\": 0.72,\n      \"risk_usd\": 480.00\n    }\n  }\n}\n```",
      "signals": [
        {
          "coin": "XRP",
          "signal": "buy",
          "quantity": 1780.0,
          "leverage": 15,
          "stop_loss": 2.35,
          "profit_target": 2.65,
          "confidence": 0.72,
          "risk_usd": 480.0,
          "invalidation_condition": "If price closes below 2.35 (EMA20 support) on 3-minute candle, indicating trend reversal"
        }
      ]
    },
    {
      "iteration": 23,
      "timestamp": "2025-10-20T16:00:00",
      "model": "anthropic",
      "raw_response": "# CHAIN OF THOUGHT\n\n## Current Position Analysis\n\n**XRP Position Review:**\n- Entry: $2.4619, Current: $2.5244\n- Unrealized P&L: +$109.06 (+2.54%)\n- Profit Target: $2.65, Stop-Loss: $2.35\n- Invalidation Condition: \"If price closes below 2.35 (EMA20 support) on 3-minute candle\"\n\n**Technical Analysis:**\n- Current price $2.52 is ABOVE profit target of $2.65... wait, that's not right. Let me recalculate.\n- Profit target is $2.65, current price is $2.52, so we're approaching but haven't hit it yet\n- Current EMA20 = $2.40, which is well above our invalidation level of $2.35\n- RSI(7) = 89.38 - EXTREMELY overbought (>85 indicates potential reversal)\n- RSI(14) = 84.45 - Also very overbought\n- MACD = 0.044 - Still positive and trending up\n- Price is $0.12 above EMA20, showing strong momentum\n- Recent price action: Strong upward move from $2.46 to $2.52 in last candle\n\n**Invalidation Check:**\n- Invalidation condition: Price closes below $2.35\n- Current price: $2.52\n- Current EMA20: $2.40\n- Status: **NOT INVALIDATED** - Price is well above $2.35\n\n**Decision Factors:**\n1. **Pros for holding:**\n   - Position is profitable (+$109)\n   - Invalidation condition NOT met\n   - MACD still positive\n   - Strong uptrend intact\n   - Still $0.13 away from profit target\n\n2. **Cons for holding:**\n   - RSI(7) at 89.38 is dangerously overbought - highest reading in the series\n   - RSI(14) at 84.45 also very elevated\n   - Extreme overbought conditions typically precede pullbacks\n   - We're up 2.54% on 15x leverage = 38% ROI on margin - good profit already captured\n\n**Risk Management Consideration:**\nGiven the extreme RSI readings (89.38), there's high probability of near-term pullback. However, the invalidation condition is clear: close below $2.35. Current price is $2.52, giving us $0.17 cushion. The stop-loss at $2.35 provides protection.\n\n**Final Decision: HOLD**\n- Invalidation condition is NOT met\n- Stop-loss and profit target remain valid\n- Strong momentum continues despite overbought conditions\n- Let the trade run toward $2.65 target with stop-loss protection at $2.35\n\n## Other Coins Analysis\n\n**BTC:** Strong uptrend (price $110,753 above EMA20 $108,753), RSI(7) 70.25 cooling from overbought. No position, but momentum strong. However, with limited capital ($8,463) and existing XRP position, will not enter.\n\n**ETH:** Price $3,980 above EMA20 $3,939, but RSI(7) dropped to 40.56 showing bearish momentum shift. Recent rejection from $4,053 high. Not attractive for entry.\n\n**SOL:** Price $188.77 barely above EMA20 $187.94, RSI(7) 37.96 showing weakness. Losing momentum. Pass.\n\n**BNB:** Price $1,100.90 below EMA20 $1,101.76, RSI(7) 32.17 showing weakness. Downtrend developing. Pass.\n\n**DOGE:** Price $0.1995 above EMA20 $0.1937, RSI(7) 66.69 neutral. Decent setup but weaker than XRP. With limited capital, staying focused on XRP position.\n\n# TRADING DECISIONS\n\n```json\n{\n  \"XRP\": {\n    \"trade_signal_args\": {\n      \"coin\": \"XRP\",\n      \"signal\": \"hold\",\n      \"quantity\": 1780.0,\n      \"profit_target\": 2.65,\n      \"stop_loss\": 2.35,\n      \"invalidation_condition\": \"If price closes below 2.35 (EMA20 support) on 3-minute candle, indicating trend reversal\",\n      \"leverage\": 15,\n      \"confidence\": 0.72,\n      \"risk_usd\": 480.0\n    }\n  }\n}\n```",
      "signals": [
        {
          "coin": "XRP",
          "signal": "hold",
          "quantity": 1780.0,
          "leverage": 15,
          "stop_loss": 2.35,
          "profit_target": 2.65,
          "confidence": 0.72,
          "risk_usd": 480.0,
          "invalidation_condition": "If price closes below 2.35 (EMA20 support) on 3-minute candle, indicating trend reversal"
        }
      ]
    },
    {
      "iteration": 24,
      "timestamp": "2025-10-20T20:00:00",
      "model": "anthropic",
      "raw_response": "# CHAIN OF THOUGHT\n\nReviewing my current position and market conditions:\n\n## XRP Position Analysis\n- **Current Position**: Long 1,780 XRP at entry $2.4619, current price $2.4934\n- **Unrealized P&L**: +$53.88 (+1.28%)\n- **Leverage**: 15x\n- **Exit Plan**: \n  - Profit target: $2.65\n  - Stop-loss: $2.35\n  - Invalidation: Price closes below $2.35 (EMA20 support)\n\n**Technical Analysis**:\n- Current price: $2.49 vs EMA20: $2.41 \u2713 (well above support)\n- RSI (7-period): 66.05 (healthy, not overbought)\n- RSI (14-period): 70.34 (slightly elevated but acceptable)\n- MACD: 0.046 (positive and trending up)\n- Price action: Strong uptrend from $2.37 to $2.52 high, slight pullback to $2.49\n- EMA20 trending upward: $2.33 \u2192 $2.41 (strong support building)\n\n**Invalidation Check**: \n- Current price $2.49 is well above EMA20 at $2.41\n- No close below $2.35 has occurred\n- Invalidation condition **NOT MET** \u2713\n\n**Decision**: **HOLD** - Position is profitable, trend remains intact, no invalidation signals. Price is consolidating after spike to $2.52, which is healthy. RSI cooling from overbought levels (was 89.4) to 66, suggesting sustainable momentum. Stop-loss at $2.35 provides adequate protection.\n\n## Other Coins Assessment\n\n**BTC**: Price at $110,479, strong uptrend but RSI dropping from 91.9 to 58.7 (cooling off). No position, and momentum appears to be consolidating. Not entering.\n\n**ETH**: Price at $3,978, RSI dropped sharply from 93.8 to 39.3 (oversold territory). Potential reversal but need confirmation. Too risky after sharp RSI decline. Not entering.\n\n**SOL**: Price at $189.64, RSI at 47.2 (neutral). Choppy price action without clear direction. Not entering.\n\n**BNB**: Price at $1,100.20, RSI at 31.4 (oversold). Declining momentum with RSI falling from 74.9 to 31.4. Bearish setup. Not entering.\n\n**DOGE**: Price at $0.19995, RSI at 70.0 (healthy). Strong uptrend but already extended. Not entering new position at these levels.\n\n**Risk Management**: Currently using $4,438 notional (44% of account) with 15x leverage on XRP. This is reasonable exposure. Account is down -11.87%, so maintaining discipline is critical.\n\n# TRADING DECISIONS\n\n```json\n{\n  \"XRP\": {\n    \"trade_signal_args\": {\n      \"coin\": \"XRP\",\n      \"signal\": \"hold\",\n      \"quantity\": 1780.0,\n      \"profit_target\": 2.65,\n      \"stop_loss\": 2.35,\n      \"invalidation_condition\": \"If price closes below 2.35 (EMA20 support) on 3-minute candle, indicating trend reversal\",\n      \"leverage\": 15,\n      \"confidence\": 0.72,\n      \"risk_usd\": 480.0\n    }\n  }\n}\n```",
      "signals": [
        {
          "coin": "XRP",
          "signal": "hold",
          "quantity": 1780.0,
          "leverage": 15,
          "stop_loss": 2.35,
          "profit_target": 2.65,
          "confidence": 0.72,
          "risk_usd": 480.0,
          "invalidation_condition": "If price closes below 2.35 (EMA20 support) on 3-minute candle, indicating trend reversal"
        }
      ]
    },
    {
      "iteration": 25,
      "timestamp": "2025-10-21T00:00:00",
      "model": "anthropic",
      "raw_response": "# CHAIN OF THOUGHT\n\n## Current Portfolio Analysis\n- Account Value: $8,733.97\n- Total Return: -12.66%\n- Available Cash: $8,463.00\n- Single open position: XRP (1780 units @ $2.4619 entry)\n\n## XRP Position Review\n\n**Current Status:**\n- Entry: $2.4619, Current: $2.4519\n- Unrealized P&L: -$19.99 (-0.46%)\n- Leverage: 15x\n- Stop-loss: $2.35\n- Profit target: $2.65\n- Invalidation: \"If price closes below 2.35 (EMA20 support) on 3-minute candle\"\n\n**Technical Analysis:**\n- Current price: $2.45 vs EMA20: $2.41 (still above support)\n- RSI(7): 45.061 (neutral, down from overbought 89.416)\n- RSI(14): 55.888 (neutral territory)\n- MACD: 0.045 (positive but declining from 0.047)\n- Price action: Sharp pullback from $2.52 high to $2.45\n- Recent candles show: 2.52 \u2192 2.49 \u2192 2.45 (downtrend forming)\n\n**Invalidation Check:**\nThe invalidation condition states: \"If price closes below 2.35 (EMA20 support)\"\n- Current price: $2.45\n- EMA20: $2.41\n- Stop-loss: $2.35\n- **NOT INVALIDATED** - price is still $0.10 above the invalidation level\n\n**Decision Rationale:**\nDespite the pullback from $2.52 to $2.45, the position remains valid:\n1. Price is above EMA20 ($2.41) and well above stop-loss ($2.35)\n2. RSI cooled from extreme overbought (89) to neutral (45), which is healthy\n3. MACD remains positive at 0.045\n4. The pullback appears to be a normal correction after the spike to $2.52\n5. Volume is elevated (4.8M vs 4.3M average) suggesting continued interest\n6. Loss is minimal at -$20 (-0.46%)\n\n**HOLD** - The invalidation condition has not been met, technical structure remains intact.\n\n## Other Coins - No New Positions\n\n**BTC:** RSI(7) = 26.889 (oversold), but sharp drop from 111,161 to 109,008. Price below EMA20. Too volatile after recent rally. **PASS**\n\n**ETH:** RSI(7) = 20.020 (extremely oversold), dropping from 4,053 to 3,922. Price below EMA20. Bearish momentum. **PASS**\n\n**SOL:** RSI(7) = 24.147 (oversold), falling from 192.93 to 185.46. Price below EMA20. Weak. **PASS**\n\n**BNB:** RSI(7) = 16.018 (extremely oversold), crashed from 1,127 to 1,081. Price below EMA20. Dangerous. **PASS**\n\n**DOGE:** RSI(7) = 33.772, dropped from 0.2011 to 0.1965. Still above EMA20 but weakening. **PASS**\n\nAll markets showing simultaneous weakness with oversold RSI readings. This suggests a broader market correction. Best to hold existing position and preserve capital rather than catching falling knives.\n\n# TRADING DECISIONS\n\n```json\n{\n  \"XRP\": {\n    \"trade_signal_args\": {\n      \"coin\": \"XRP\",\n      \"signal\": \"hold\",\n      \"quantity\": 1780.0,\n      \"profit_target\": 2.65,\n      \"stop_loss\": 2.35,\n      \"invalidation_condition\": \"If price closes below 2.35 (EMA20 support) on 3-minute candle, indicating trend reversal\",\n      \"leverage\": 15,\n      \"confidence\": 0.72,\n      \"risk_usd\": 480.0\n    }\n  }\n}\n```",
      "signals": [
        {
          "coin": "XRP",
          "signal": "hold",
          "quantity": 1780.0,
          "leverage": 15,
          "stop_loss": 2.35,
          "profit_target": 2.65,
          "confidence": 0.72,
          "risk_usd": 480.0,
          "invalidation_condition": "If price closes below 2.35 (EMA20 support) on 3-minute candle, indicating trend reversal"
        }
      ]
    },
    {
      "iteration": 26,
      "timestamp": "2025-10-21T04:00:00",
      "model": "anthropic",
      "raw_response": "# CHAIN OF THOUGHT\n\n## Current Position Analysis\n\n**XRP Position Review:**\n- Entry: $2.4619, Current: $2.4257\n- Unrealized PnL: -$66.63 (-1.47%)\n- Leverage: 15x\n- Stop-loss: $2.35\n- Profit target: $2.65\n- Invalidation condition: \"If price closes below 2.35 (EMA20 support) on 3-minute candle\"\n\n**Technical Analysis for XRP:**\n- Current price: $2.43 vs EMA20: $2.42 (still above EMA20 support)\n- RSI (7-period): 35.448 (oversold from recent 89.374 peak - potential bounce)\n- RSI (14-period): 47.792 (neutral territory)\n- MACD: 0.032 (still positive, though declining from 0.038)\n- Price action: Declined from $2.52 peak to $2.43, but holding above $2.42 EMA20\n- Volume: 13.38M vs average 4.57M (elevated volume = strong interest)\n\n**Critical Assessment:**\nThe invalidation condition states \"if price closes below 2.35 on 3-minute candle.\" Current price is $2.43, which is:\n1. Above the stop-loss ($2.35) \u2713\n2. Above EMA20 support ($2.42) \u2713\n3. Invalidation NOT triggered \u2713\n\nHowever, the position is showing weakness:\n- Down 1.47% with high 15x leverage\n- Recent sharp decline from $2.52 to $2.43 (3.6% drop)\n- RSI showing oversold conditions after being extremely overbought\n- Price approaching but still above critical support levels\n\n**Risk Management Consideration:**\nWith 15x leverage, a move to $2.35 would result in a -4.5% loss on spot terms, translating to approximately -67.5% on the leveraged position. The current loss is manageable at -$66.63, and the position hasn't violated its invalidation condition yet.\n\n**Decision: HOLD**\nThe invalidation condition has NOT been met. Price remains above $2.42 EMA20 and well above the $2.35 stop-loss. The oversold RSI (35.448) suggests potential for a bounce. The MACD is still positive, and volume is elevated, indicating continued interest. I will maintain the position with existing risk parameters.\n\n## Other Coins Assessment\n\n**BTC, ETH, SOL, BNB, DOGE:** No positions. Market showing significant weakness across all coins:\n- BTC: RSI 18.022 (extremely oversold), down to $108,019 from $111,161\n- ETH: RSI 14.585 (extremely oversold), down to $3,891.90 from $4,053.40\n- SOL: RSI 22.168 (oversold), down to $184.93 from $192.93\n- BNB: RSI 11.736 (extremely oversold), down to $1,071.30 from $1,127.90\n- DOGE: RSI 22.808 (oversold), down to $0.19416 from $0.20115\n\nAll coins showing severe selling pressure with extremely oversold RSI readings. While this could indicate a potential bounce opportunity, the sharp decline and breakdown below EMAs suggest strong bearish momentum. Given my current negative return (-13.16%) and limited capital ($8,463 available), I will not enter new positions during this volatile selloff. Better to preserve capital and wait for clearer trend confirmation.\n\n# TRADING DECISIONS\n\n```json\n{\n  \"XRP\": {\n    \"trade_signal_args\": {\n      \"coin\": \"XRP\",\n      \"signal\": \"hold\",\n      \"quantity\": 1780.0,\n      \"profit_target\": 2.65,\n      \"stop_loss\": 2.35,\n      \"invalidation_condition\": \"If price closes below 2.35 (EMA20 support) on 3-minute candle, indicating trend reversal\",\n      \"leverage\": 15,\n      \"confidence\": 0.72,\n      \"risk_usd\": 480.0\n    }\n  }\n}\n```",
      "signals": [
        {
          "coin": "XRP",
          "signal": "hold",
          "quantity": 1780.0,
          "leverage": 15,
          "stop_loss": 2.35,
          "profit_target": 2.65,
          "confidence": 0.72,
          "risk_usd": 480.0,
          "invalidation_condition": "If price closes below 2.35 (EMA20 support) on 3-minute candle, indicating trend reversal"
        }
      ]
    },
    {
      "iteration": 27,
      "timestamp": "2025-10-21T08:00:00",
      "model": "anthropic",
      "raw_response": "# CHAIN OF THOUGHT\n\n## Current Position Analysis\n\n**XRP Position Review:**\n- Entry: $2.4619, Current: $2.4301\n- Unrealized P&L: -$58.80 (-1.29%)\n- Leverage: 15x\n- Stop-loss: $2.35, Profit target: $2.65\n- Invalidation condition: \"If price closes below 2.35 (EMA20 support) on 3-minute candle\"\n\n**Technical Analysis:**\n- Current price: $2.4301 vs EMA20: $2.42 (slightly above support)\n- RSI(7): 38.327 - oversold territory, potential bounce\n- RSI(14): 48.817 - neutral zone\n- MACD: 0.026 - positive but weakening\n- Price action: Recovered from $2.43 low, holding above EMA20\n- Recent pattern: Sharp spike to $2.52, now consolidating around $2.43\n\n**Invalidation Check:**\nThe invalidation condition states: \"If price closes below 2.35 on 3-minute candle\"\n- Current price: $2.4301\n- EMA20: $2.42\n- Stop-loss: $2.35\n- **CRITICAL**: Price is $0.08 above the invalidation level and holding above EMA20 support\n\n**Decision Rationale:**\nThe position is NOT invalidated. Price remains above both EMA20 ($2.42) and the stop-loss ($2.35). The RSI(7) at 38.3 suggests oversold conditions with potential for mean reversion. The MACD is still positive at 0.026, indicating bullish momentum hasn't fully reversed. Price is consolidating after the spike to $2.52, which is normal profit-taking behavior.\n\nGiven:\n1. Invalidation condition NOT met (price above $2.35)\n2. Technical support holding at EMA20\n3. Oversold RSI suggesting potential bounce\n4. Small unrealized loss (-1.29%) within acceptable range\n5. Position still has room to reach profit target ($2.65)\n\n**HOLD** - The position remains valid with intact stop-loss protection. The market is showing consolidation rather than a clear reversal signal.\n\n## Other Coins Assessment\n\n**BTC, ETH, SOL, BNB, DOGE:**\n- All showing significant weakness with RSI in oversold territory\n- Sharp selloff from recent highs\n- Not entering new positions during this volatile pullback\n- Better to preserve capital and wait for clearer setups\n\n# TRADING DECISIONS\n\n```json\n{\n  \"XRP\": {\n    \"trade_signal_args\": {\n      \"coin\": \"XRP\",\n      \"signal\": \"hold\",\n      \"quantity\": 1780.0,\n      \"profit_target\": 2.65,\n      \"stop_loss\": 2.35,\n      \"invalidation_condition\": \"If price closes below 2.35 (EMA20 support) on 3-minute candle, indicating trend reversal\",\n      \"leverage\": 15,\n      \"confidence\": 0.72,\n      \"risk_usd\": 480.0\n    }\n  }\n}\n```",
      "signals": [
        {
          "coin": "XRP",
          "signal": "hold",
          "quantity": 1780.0,
          "leverage": 15,
          "stop_loss": 2.35,
          "profit_target": 2.65,
          "confidence": 0.72,
          "risk_usd": 480.0,
          "invalidation_condition": "If price closes below 2.35 (EMA20 support) on 3-minute candle, indicating trend reversal"
        }
      ]
    },
    {
      "iteration": 28,
      "timestamp": "2025-10-21T12:00:00",
      "model": "anthropic",
      "raw_response": "# CHAIN OF THOUGHT\n\n## Current Portfolio Analysis\n- Account Value: $8,867.06\n- Available Cash: $8,463.00\n- Total Return: -11.33%\n- Single Position: XRP (1,780 units @ $2.4619 entry, currently $2.522)\n\n## XRP Position Review\n\n**Entry Details:**\n- Entry Price: $2.4619\n- Current Price: $2.522\n- Unrealized P&L: +$104.79 (+2.4%)\n- Leverage: 15x\n- Notional: $4,489.16\n- Profit Target: $2.65\n- Stop Loss: $2.35\n- Invalidation: \"If price closes below 2.35 (EMA20 support) on 3-minute candle\"\n\n**Technical Analysis:**\n- Current EMA20: $2.43 (price well above, +3.8%)\n- RSI (7-period): 72.69 (elevated but not extreme)\n- RSI (14-period): 67.96 (healthy momentum)\n- MACD: 0.027 (positive and rising)\n- Price action: Strong recovery from $2.43 low to $2.52 (recent spike)\n- Volume: 12.98M vs avg 5.05M (2.57x average - strong participation)\n\n**Invalidation Check:**\n- Invalidation condition: Price closes below $2.35\n- Current price: $2.52\n- Current EMA20: $2.43\n- Price is $0.17 above invalidation level (6.7% buffer)\n- Price is $0.09 above EMA20 support\n- **Invalidation NOT met** - position remains valid\n\n**Risk Assessment:**\n- Stop loss at $2.35 provides $0.172 per unit downside protection\n- Currently $0.022 away from profit target ($2.65)\n- Price has shown strong momentum with the latest candle jumping from $2.43 to $2.52\n- RSI levels suggest some overbought conditions but not extreme\n- MACD trending positive with strong volume confirmation\n\n**Decision: HOLD**\nThe position is performing well with +$104.79 unrealized profit. The invalidation condition is NOT met - price remains well above both the $2.35 invalidation level and the EMA20 support at $2.43. The recent price spike to $2.52 shows strong bullish momentum with 2.57x average volume. While RSI shows some overbought conditions (72.69), it's not extreme enough to warrant an exit. The position has room to run toward the $2.65 profit target. All risk parameters remain intact.\n\n## Other Coins Assessment\n\n**BTC, ETH, SOL, DOGE:** All showing strong momentum with elevated RSI levels (74-79), but we cannot add to existing positions (no pyramiding rule), and I already have capital deployed in XRP. Given the -11.33% portfolio performance, maintaining focus on the existing profitable position is prudent rather than opening new leveraged positions in overbought conditions.\n\n**BNB:** RSI 68.27, MACD negative (-2.844), mixed signals. Not compelling enough to enter new position.\n\n# TRADING DECISIONS\n\n```json\n{\n  \"XRP\": {\n    \"trade_signal_args\": {\n      \"coin\": \"XRP\",\n      \"signal\": \"hold\",\n      \"quantity\": 1780.0,\n      \"profit_target\": 2.65,\n      \"stop_loss\": 2.35,\n      \"invalidation_condition\": \"If price closes below 2.35 (EMA20 support) on 3-minute candle, indicating trend reversal\",\n      \"leverage\": 15,\n      \"confidence\": 0.72,\n      \"risk_usd\": 480.0\n    }\n  }\n}\n```",
      "signals": [
        {
          "coin": "XRP",
          "signal": "hold",
          "quantity": 1780.0,
          "leverage": 15,
          "stop_loss": 2.35,
          "profit_target": 2.65,
          "confidence": 0.72,
          "risk_usd": 480.0,
          "invalidation_condition": "If price closes below 2.35 (EMA20 support) on 3-minute candle, indicating trend reversal"
        }
      ]
    },
    {
      "iteration": 29,
      "timestamp": "2025-10-21T16:00:00",
      "model": "anthropic",
      "raw_response": "# CHAIN OF THOUGHT\n\nReviewing my current position and market conditions:\n\n**XRP Position Analysis:**\n- Entry: $2.4619, Current: $2.4924 (+1.24%)\n- Unrealized PnL: +$52.10 (positive but small)\n- Leverage: 15x (high risk)\n- Stop-loss: $2.35, Profit target: $2.65\n- Invalidation condition: \"If price closes below 2.35 (EMA20 support) on 3-minute candle\"\n\n**Technical Analysis:**\n- Current price: $2.49 vs EMA20: $2.44 \u2713 (Above support, bullish)\n- RSI (7-period): 58.69 (neutral, healthy pullback from overbought)\n- RSI (14-period): 60.03 (neutral)\n- MACD: 0.033 (positive and stable)\n- Price action: Recent spike to $2.52, now consolidating at $2.49\n- Volume: 13.36M vs avg 5.55M (2.4x higher - strong interest)\n- EMA20 trending up: 2.38 \u2192 2.44 (consistent uptrend)\n\n**Invalidation Check:**\n- Price is at $2.49, well above $2.35 stop-loss\n- Price is above EMA20 ($2.44), which is the key support level\n- No 3-minute candle has closed below $2.35\n- **Invalidation condition NOT met** \u2713\n\n**Risk Assessment:**\n- Position is profitable but only +1.24%\n- High leverage (15x) means $0.16 move against us hits stop-loss\n- Current distance to stop: $2.49 - $2.35 = $0.14 (cushion exists)\n- Distance to profit target: $2.65 - $2.49 = $0.16 (6.4% upside)\n- Risk/reward still favorable\n\n**Decision: HOLD**\nThe invalidation condition has not been triggered. Price remains above EMA20 support, technicals are neutral-to-bullish, and volume supports continued interest. The position has room to run toward the $2.65 target. No reason to exit prematurely.\n\n**Other Coins:**\n- BTC: Strong at $111,729 but already -11.89% portfolio drawdown. Not adding risk.\n- ETH: Consolidating around $3,993. Neutral setup, no clear edge.\n- SOL: At $193.80, above EMA but not compelling enough for new position.\n- BNB: Below EMA20, MACD negative, RSI weak at 46. Bearish, avoid.\n- DOGE: Positive momentum but already have XRP exposure in meme/alt sector.\n\nNo new positions warranted given current drawdown and existing XRP exposure.\n\n# TRADING DECISIONS\n\n```json\n{\n  \"XRP\": {\n    \"trade_signal_args\": {\n      \"coin\": \"XRP\",\n      \"signal\": \"hold\",\n      \"quantity\": 1780.0,\n      \"profit_target\": 2.65,\n      \"stop_loss\": 2.35,\n      \"invalidation_condition\": \"If price closes below 2.35 (EMA20 support) on 3-minute candle, indicating trend reversal\",\n      \"leverage\": 15,\n      \"confidence\": 0.72,\n      \"risk_usd\": 480.0\n    }\n  }\n}\n```",
      "signals": [
        {
          "coin": "XRP",
          "signal": "hold",
          "quantity": 1780.0,
          "leverage": 15,
          "stop_loss": 2.35,
          "profit_target": 2.65,
          "confidence": 0.72,
          "risk_usd": 480.0,
          "invalidation_condition": "If price closes below 2.35 (EMA20 support) on 3-minute candle, indicating trend reversal"
        }
      ]
    },
    {
      "iteration": 30,
      "timestamp": "2025-10-21T20:00:00",
      "model": "anthropic",
      "raw_response": "# CHAIN OF THOUGHT\n\nReviewing my current position and market conditions:\n\n## XRP Position Analysis\n- **Entry**: 2.4619, **Current**: 2.4209 (-1.67%)\n- **Unrealized P&L**: -$75.17\n- **Stop-loss**: 2.35, **Profit target**: 2.65\n- **Invalidation condition**: \"If price closes below 2.35 (EMA20 support) on 3-minute candle, indicating trend reversal\"\n\n**Technical Analysis**:\n- Current price: 2.42 vs EMA20: 2.44 (price below EMA20 - bearish signal)\n- RSI(7): 36.136 (oversold territory, below 40)\n- RSI(14): 44.270 (below neutral 50)\n- MACD: 0.025 (positive but declining from 0.032)\n- Price action: Dropped from 2.52 to 2.42 in recent candles\n- Current price is 2.42, which is **above** the invalidation level of 2.35\n- Stop-loss at 2.35 has NOT been hit\n\n**Key Observations**:\n1. Price is trading below EMA20 (2.44), showing short-term bearish momentum\n2. RSI shows oversold conditions which could lead to a bounce\n3. Price hasn't closed below 2.35, so invalidation condition is NOT met\n4. However, we're only 0.07 away from the stop-loss (2.9% buffer)\n5. The trend has clearly weakened - price made a lower high at 2.52 and is now testing support\n\n**Decision Rationale**:\nWhile the invalidation condition is technically NOT met (price hasn't closed below 2.35), the position is showing weakness:\n- Trading below EMA20\n- Weak momentum (MACD declining)\n- Close to stop-loss with limited upside from current levels\n- RSI oversold could provide a bounce, but trend is questionable\n\nGiven the weak technical setup and proximity to stop-loss, I'll **HOLD** for now since the invalidation condition hasn't been triggered yet. The oversold RSI suggests a potential bounce could materialize. If the next candle closes below 2.35, I'll exit immediately.\n\n## Other Coins - No New Positions\n**BTC, ETH, SOL, BNB, DOGE**: All showing similar bearish patterns:\n- Prices below EMA20\n- RSI in oversold territory (27-37 range)\n- MACD declining or negative\n- Recent sharp selloffs\n\nWith portfolio down -13.25% and limited capital ($8,463), I will NOT open new positions in this volatile, bearish environment. Risk management is paramount.\n\n# TRADING DECISIONS\n\n```json\n{\n  \"XRP\": {\n    \"trade_signal_args\": {\n      \"coin\": \"XRP\",\n      \"signal\": \"hold\",\n      \"quantity\": 1780.0,\n      \"profit_target\": 2.65,\n      \"stop_loss\": 2.35,\n      \"invalidation_condition\": \"If price closes below 2.35 (EMA20 support) on 3-minute candle, indicating trend reversal\",\n      \"leverage\": 15,\n      \"confidence\": 0.72,\n      \"risk_usd\": 480.0\n    }\n  }\n}\n```",
      "signals": [
        {
          "coin": "XRP",
          "signal": "hold",
          "quantity": 1780.0,
          "leverage": 15,
          "stop_loss": 2.35,
          "profit_target": 2.65,
          "confidence": 0.72,
          "risk_usd": 480.0,
          "invalidation_condition": "If price closes below 2.35 (EMA20 support) on 3-minute candle, indicating trend reversal"
        }
      ]
    },
    {
      "iteration": 31,
      "timestamp": "2025-10-22T00:00:00",
      "model": "anthropic",
      "raw_response": "# CHAIN OF THOUGHT\n\nReviewing my current XRP position and market conditions:\n\n**XRP Position Analysis:**\n- Entry: $2.4619, Current: $2.4187 (-1.75%)\n- Unrealized P&L: -$79.09\n- Stop-loss: $2.35, Profit target: $2.65\n- Invalidation condition: \"If price closes below 2.35 (EMA20 support) on 3-minute candle\"\n- Current EMA20: $2.43\n\n**Technical Analysis:**\n- Price ($2.4187) is below entry but ABOVE stop-loss ($2.35)\n- Price is below EMA20 ($2.43) - showing weakness\n- RSI(7): 35.584 - oversold territory, potential bounce\n- RSI(14): 43.960 - neutral to weak\n- MACD: 0.021 - still positive but declining from 0.034\n- Recent price action: Dropped from $2.52 to $2.42 over last 30 minutes\n\n**Invalidation Check:**\n- Invalidation level: $2.35\n- Current price: $2.4187\n- Price has NOT closed below $2.35 yet\n- Invalidation condition is NOT met\n\n**Risk Assessment:**\n- Position is down 1.75% but within acceptable range\n- Stop-loss provides protection at $2.35 (3.0% below current)\n- RSI oversold suggests potential reversal\n- Price holding above key support at EMA20 area\n- MACD still positive, though weakening\n\n**Decision:** HOLD\nThe invalidation condition has not been triggered. Price remains above the critical $2.35 level. While showing weakness, the oversold RSI and positive MACD suggest potential for a bounce. The position has proper risk management with stop-loss in place. No reason to exit prematurely before invalidation or stop-loss is hit.\n\n**Other Markets:**\n- BTC, ETH, SOL, BNB, DOGE: All showing weakness with RSI in oversold territory (32-38 range)\n- Market-wide pullback occurring\n- Not entering new positions during this weakness\n- Waiting for clearer reversal signals\n\n# TRADING DECISIONS\n\n```json\n{\n  \"XRP\": {\n    \"trade_signal_args\": {\n      \"coin\": \"XRP\",\n      \"signal\": \"hold\",\n      \"quantity\": 1780.0,\n      \"profit_target\": 2.65,\n      \"stop_loss\": 2.35,\n      \"invalidation_condition\": \"If price closes below 2.35 (EMA20 support) on 3-minute candle, indicating trend reversal\",\n      \"leverage\": 15,\n      \"confidence\": 0.72,\n      \"risk_usd\": 480.0\n    }\n  }\n}\n```",
      "signals": [
        {
          "coin": "XRP",
          "signal": "hold",
          "quantity": 1780.0,
          "leverage": 15,
          "stop_loss": 2.35,
          "profit_target": 2.65,
          "confidence": 0.72,
          "risk_usd": 480.0,
          "invalidation_condition": "If price closes below 2.35 (EMA20 support) on 3-minute candle, indicating trend reversal"
        }
      ]
    },
    {
      "iteration": 32,
      "timestamp": "2025-10-22T04:00:00",
      "model": "anthropic",
      "raw_response": "# CHAIN OF THOUGHT\n\n## Current Position Analysis\n\n### XRP Position Review\n- **Entry**: $2.4619, **Current**: $2.4083 (down -2.18%)\n- **Unrealized P&L**: -$97.60\n- **Position size**: 1780 XRP at 15x leverage (~$4,287 notional)\n- **Exit Plan**: Profit target $2.65, Stop-loss $2.35\n- **Invalidation Condition**: \"If price closes below 2.35 (EMA20 support) on 3-minute candle\"\n\n### Technical Analysis - XRP\n- **Current price**: $2.41 vs **EMA20**: $2.43 (below EMA, bearish)\n- **RSI (7-period)**: 32.39 (oversold territory)\n- **RSI (14-period)**: 41.71 (weak)\n- **MACD**: 0.015 (barely positive, weakening momentum)\n- **Price action**: Declined from $2.52 to $2.41 over last 30 minutes\n- **Critical check**: Current price $2.41 is ABOVE invalidation level of $2.35 \u2713\n\n### Invalidation Assessment\nThe invalidation condition states \"closes below 2.35 on 3-minute candle\". Current price is $2.41, which is:\n- $0.06 above the invalidation level ($2.35)\n- $0.11 above the stop-loss ($2.35)\n- Still within acceptable range\n\n**Invalidation NOT triggered** - position remains valid technically.\n\n### Risk Management Considerations\n1. **Position is underwater**: -$97.60 (-2.18%)\n2. **Market sentiment**: All major coins showing weakness (BTC RSI 37, ETH RSI 35, SOL RSI 34)\n3. **XRP specific weakness**: Price trading below EMA20, declining MACD, RSI in oversold territory\n4. **Distance to stop**: Only $0.06 buffer before stop-loss\n5. **Overall portfolio**: Down -13.49%, need to protect remaining capital\n\n### Decision Rationale\nWhile the invalidation condition is NOT technically met (price hasn't closed below $2.35), the position shows concerning signs:\n- Trading below EMA20 (bearish)\n- Weak momentum (MACD declining, RSI oversold but not bouncing)\n- Broader market weakness across all coins\n- Very tight buffer to stop-loss ($0.06 or 2.5%)\n- Portfolio already down significantly (-13.49%)\n\nHowever, RSI at 32.39 indicates oversold conditions which could lead to a bounce. The price is holding above the critical $2.35 level. Given that:\n1. Invalidation is NOT met\n2. Stop-loss NOT hit\n3. RSI oversold could mean reversal imminent\n4. Price still above support\n\n**Decision: HOLD** - The invalidation condition is clear and has not been met. Will maintain position but monitor closely for any close below $2.35.\n\n### Other Coins Assessment\n- **BTC, ETH, SOL, BNB, DOGE**: All showing similar weakness with RSI in 30s-40s range, prices below EMA20\n- **Market environment**: Broad-based selling pressure\n- **Cash available**: $8,463\n- **New positions**: Given overall market weakness and portfolio drawdown, NOT opening new positions. Need to preserve capital and wait for clearer setups.\n\n# TRADING DECISIONS\n\n```json\n{\n  \"XRP\": {\n    \"trade_signal_args\": {\n      \"coin\": \"XRP\",\n      \"signal\": \"hold\",\n      \"quantity\": 1780.0,\n      \"profit_target\": 2.65,\n      \"stop_loss\": 2.35,\n      \"invalidation_condition\": \"If price closes below 2.35 (EMA20 support) on 3-minute candle, indicating trend reversal\",\n      \"leverage\": 15,\n      \"confidence\": 0.72,\n      \"risk_usd\": 480.0\n    }\n  }\n}\n```",
      "signals": [
        {
          "coin": "XRP",
          "signal": "hold",
          "quantity": 1780.0,
          "leverage": 15,
          "stop_loss": 2.35,
          "profit_target": 2.65,
          "confidence": 0.72,
          "risk_usd": 480.0,
          "invalidation_condition": "If price closes below 2.35 (EMA20 support) on 3-minute candle, indicating trend reversal"
        }
      ]
    },
    {
      "iteration": 33,
      "timestamp": "2025-10-22T08:00:00",
      "model": "anthropic",
      "raw_response": "# CHAIN OF THOUGHT\n\nReviewing my current position and market conditions:\n\n**XRP Position Analysis:**\n- Entry: $2.4619, Current: $2.3946\n- Unrealized P&L: -$121.99 (-2.73%)\n- Stop-loss: $2.35, Profit target: $2.65\n- Invalidation condition: \"If price closes below 2.35 (EMA20 support) on 3-minute candle\"\n- Current EMA20: $2.43\n- Current price: $2.39\n\n**Critical Assessment:**\nThe XRP position is approaching its invalidation level. Current price at $2.39 is:\n1. Below my entry of $2.4619\n2. Below current EMA20 of $2.43 (bearish signal)\n3. Only $0.04 away from stop-loss at $2.35\n4. RSI at 28.032 (oversold but still declining)\n5. MACD at 0.014 (weakening momentum)\n6. Price trend: Consistent downward movement from $2.49 \u2192 $2.39\n\n**Technical Deterioration:**\n- RSI(7): 28.032 - deeply oversold but no bounce yet\n- RSI(14): 39.152 - below 40, bearish\n- MACD: 0.014 - near zero, losing bullish momentum\n- Price below EMA20 for multiple candles\n- Recent price action shows continued selling pressure\n\n**Risk Management Decision:**\nWhile the invalidation condition states \"closes below 2.35,\" the position is deteriorating rapidly:\n- Already down nearly 3%\n- Price consistently below EMA20 support\n- Momentum indicators weakening\n- Only $0.04 buffer to stop-loss\n- In a 15x leveraged position, small adverse moves are magnified\n\nThe prudent decision is to **CLOSE** this position for risk management. The technical setup has broken down (price below EMA20 support), momentum is negative, and we're very close to the hard stop-loss. Better to take a controlled small loss than risk hitting the stop-loss or further deterioration.\n\n**Other Coins Assessment:**\n- BTC: RSI 30.867 (oversold), price below EMA20, downtrend - not entering\n- ETH: RSI 28.247 (oversold), price below EMA20, negative MACD - not entering  \n- SOL: RSI 34.975, price below EMA20, negative MACD - not entering\n- BNB: RSI 40.325, price below EMA20, negative MACD - not entering\n- DOGE: RSI 26.207 (extremely oversold), price below EMA20 - not entering\n\nAll major coins showing oversold conditions but still in downtrends. No clear reversal signals yet. Better to stay in cash and wait for confirmed bottoming patterns.\n\n# TRADING DECISIONS\n\n```json\n{\n  \"XRP\": {\n    \"trade_signal_args\": {\n      \"coin\": \"XRP\",\n      \"signal\": \"close_position\",\n      \"quantity\": 1780.0,\n      \"profit_target\": 2.65,\n      \"stop_loss\": 2.35,\n      \"invalidation_condition\": \"If price closes below 2.35 (EMA20 support) on 3-minute candle, indicating trend reversal\",\n      \"leverage\": 15,\n      \"confidence\": 0.72,\n      \"risk_usd\": 480.0,\n      \"close_reason\": \"Risk management - price broke below EMA20 support at 2.43, now trading at 2.39 with weakening momentum (RSI 28, MACD near zero). Position within $0.04 of stop-loss with continued bearish pressure. Technical setup invalidated as price remains below EMA20 support level.\"\n    }\n  }\n}\n```",
      "signals": [
        {
          "coin": "XRP",
          "signal": "close_position",
          "quantity": 1780.0,
          "leverage": 15,
          "stop_loss": 2.35,
          "profit_target": 2.65,
          "confidence": 0.72,
          "risk_usd": 480.0,
          "invalidation_condition": "If price closes below 2.35 (EMA20 support) on 3-minute candle, indicating trend reversal"
        }
      ]
    },
    {
      "iteration": 34,
      "timestamp": "2025-10-22T12:00:00",
      "model": "anthropic",
      "raw_response": "# CHAIN OF THOUGHT\n\n## Current Portfolio Status\n- Account Value: $8,631.03 (down 13.69% from starting capital)\n- No open positions currently\n- Sharpe Ratio: -7.617 (indicates poor risk-adjusted returns so far)\n- Need to be highly selective with new entries given the drawdown\n\n## Market Analysis by Coin\n\n### BTC (Current: $108,391)\n- **Technical Setup**: Price below EMA20 ($109,059), indicating short-term bearish pressure\n- **RSI (7)**: 45.06 - neutral zone, recovering from oversold (was 30.78)\n- **MACD**: 23.72 - positive but declining rapidly from 792 (massive momentum loss)\n- **Recent Action**: Experienced a sharp spike to $113,386 followed by rejection\n- **Assessment**: Price is consolidating after a failed breakout. Below EMA20 suggests weakness. The MACD is still positive but fading fast. Not an ideal entry - wait for clearer direction.\n\n### ETH (Current: $3,839.20)\n- **Technical Setup**: Price significantly below EMA20 ($3,920.95)\n- **RSI (7)**: 33.44 - approaching oversold territory\n- **MACD**: -22.86 - negative and deteriorating\n- **Recent Action**: Rejected hard from $4,082.90, now testing lower support\n- **Assessment**: Clear downtrend with price below EMA and negative MACD. RSI showing weakness. Not a buy yet - needs stabilization.\n\n### SOL (Current: $183.92)\n- **Technical Setup**: Price below EMA20 ($187.82)\n- **RSI (7)**: 29.68 - oversold territory\n- **MACD**: -1.00 - negative and declining\n- **Recent Action**: Rejected from $196.14, now at session lows\n- **Assessment**: Oversold RSI could indicate a bounce opportunity, but MACD negative and price below EMA suggest continued weakness. Risky entry.\n\n### BNB (Current: $1,080.30)\n- **Technical Setup**: Price below EMA20 ($1,087.46) but recovering\n- **RSI (7)**: 55.26 - neutral to slightly bullish (strongest RSI of all coins)\n- **MACD**: -8.30 - negative but improving from -8.82\n- **Recent Action**: Bouncing from $1,056.50 low, showing relative strength\n- **Assessment**: **BEST SETUP** - RSI above 50, price recovering toward EMA, MACD improving. This shows relative strength vs other coins.\n\n### XRP (Current: $2.40)\n- **Technical Setup**: Price below EMA20 ($2.43)\n- **RSI (7)**: 31.54 - oversold\n- **MACD**: 0.005 - barely positive but declining\n- **Recent Action**: Weak price action, grinding lower\n- **Assessment**: Oversold but no clear reversal signals. Pass.\n\n### DOGE (Current: $0.19185)\n- **Technical Setup**: Price below EMA20 ($0.19538)\n- **RSI (7)**: 34.75 - weak but recovering slightly\n- **MACD**: -0.000 - essentially flat at zero\n- **Recent Action**: Testing lows around $0.1908\n- **Assessment**: Weak setup, no clear edge. Pass.\n\n## Trading Decision\n\nGiven the portfolio drawdown and need for high-probability setups, I will take ONE selective position:\n\n**BNB LONG** - This is the only coin showing genuine relative strength:\n1. RSI (7) at 55.26 is the only one above 50 (bullish momentum)\n2. Price bounced from $1,056.50 and recovering toward EMA20\n3. MACD improving from -8.82 to -8.30 (momentum turning)\n4. Volume elevated (17,754 vs avg 7,428) supporting the move\n5. Clear stop-loss below recent low at $1,056.50\n\nRisk Management:\n- Position size: ~$800 risk (conservative given drawdown)\n- Stop-loss: $1,055 (below recent swing low)\n- Profit target: $1,115 (above recent high, ~3.2% move = 2.5:1 R/R with 10x leverage)\n- Leverage: 15x (moderate given the relative strength)\n\n# TRADING DECISIONS\n\n```json\n{\n  \"BNB\": {\n    \"trade_signal_args\": {\n      \"coin\": \"BNB\",\n      \"signal\": \"buy\",\n      \"quantity\": 11.0,\n      \"profit_target\": 1115.0,\n      \"stop_loss\": 1055.0,\n      \"invalidation_condition\": \"If price closes below $1,055 on 3-minute candle, indicating failed bounce and continuation of downtrend\",\n      \"leverage\": 15,\n      \"confidence\": 0.72,\n      \"risk_usd\": 800.0\n    }\n  }\n}\n```",
      "signals": [
        {
          "coin": "BNB",
          "signal": "buy",
          "quantity": 11.0,
          "leverage": 15,
          "stop_loss": 1055.0,
          "profit_target": 1115.0,
          "confidence": 0.72,
          "risk_usd": 800.0,
          "invalidation_condition": "If price closes below $1,055 on 3-minute candle, indicating failed bounce and continuation of downtrend"
        }
      ]
    },
    {
      "iteration": 35,
      "timestamp": "2025-10-22T16:00:00",
      "model": "anthropic",
      "raw_response": "# CHAIN OF THOUGHT\n\n## Current Position Analysis\n\n**BNB Position Review:**\n- Entry: $1,080.30, Current: $1,068.90\n- Unrealized P&L: -$131.34 (-1.05%)\n- Stop-loss: $1,055.00\n- Profit target: $1,115.00\n- Invalidation condition: \"If price closes below $1,055 on 3-minute candle\"\n\n**Technical Analysis:**\n- Current price $1,068.90 is ABOVE the invalidation level of $1,055\n- Price is $13.90 above stop-loss - still has room\n- RSI (7-period): 41.45 - neutral territory, not oversold\n- RSI (14-period): 40.74 - approaching oversold but not there yet\n- MACD: -12.17 - negative but showing potential stabilization\n- Price below EMA20 ($1,088.30) - bearish short-term trend\n- Recent price action: dropped from $1,080.30 to $1,068.90\n\n**Invalidation Check:**\nThe invalidation condition states \"closes below $1,055\" - current price is $1,068.90, which is $13.90 above this level. The invalidation condition has NOT been met.\n\n**Risk Assessment:**\n- Position is underwater but manageable at -1.05%\n- Stop-loss provides $13.90 cushion (1.3% from current price)\n- RSI showing neutral readings, not extreme oversold\n- MACD negative but price holding above critical support\n\n**Decision: HOLD**\nThe position remains valid as price has not closed below the $1,055 invalidation level. While the position is slightly underwater, the technical setup hasn't failed yet. RSI is neutral, and we're still above the defined stop-loss with room for potential recovery. The bearish momentum is present but not extreme enough to warrant premature exit.\n\n## Other Coins Assessment\n\n**BTC, ETH, SOL, XRP, DOGE:**\n- All showing significant weakness with RSI in oversold/near-oversold territory\n- BTC RSI 7-period: 38.45, ETH: 25.39, SOL: 17.47, XRP: 22.84, DOGE: 28.41\n- All trading below their EMA20s with negative MACD\n- Market-wide selling pressure evident\n- Not entering new positions given broad market weakness and existing underwater position\n- Need to preserve capital and manage existing risk\n\n# TRADING DECISIONS\n\n```json\n{\n  \"BNB\": {\n    \"trade_signal_args\": {\n      \"coin\": \"BNB\",\n      \"signal\": \"hold\",\n      \"quantity\": 11.0,\n      \"profit_target\": 1115.0,\n      \"stop_loss\": 1055.0,\n      \"invalidation_condition\": \"If price closes below $1,055 on 3-minute candle, indicating failed bounce and continuation of downtrend\",\n      \"leverage\": 15,\n      \"confidence\": 0.72,\n      \"risk_usd\": 800.0\n    }\n  }\n}\n```",
      "signals": [
        {
          "coin": "BNB",
          "signal": "hold",
          "quantity": 11.0,
          "leverage": 15,
          "stop_loss": 1055.0,
          "profit_target": 1115.0,
          "confidence": 0.72,
          "risk_usd": 800.0,
          "invalidation_condition": "If price closes below $1,055 on 3-minute candle, indicating failed bounce and continuation of downtrend"
        }
      ]
    },
    {
      "iteration": 36,
      "timestamp": "2025-10-22T20:00:00",
      "model": "anthropic",
      "raw_response": "# CHAIN OF THOUGHT\n\nReviewing my current position:\n\n**BNB Position Analysis:**\n- Entry: $1,080.30, Current: $1,070.80\n- Unrealized P&L: -$110.44 (-0.88%)\n- Stop-loss: $1,055.00\n- Profit target: $1,115.00\n- Invalidation condition: \"If price closes below $1,055 on 3-minute candle\"\n\n**Technical Analysis:**\n- Current price $1,070.80 is ABOVE the stop-loss of $1,055\n- Price is $15.80 away from stop-loss (1.5% cushion)\n- RSI (7-period): 44.528 - neutral zone, not oversold\n- RSI (14-period): 42.308 - slightly bearish but recovering\n- MACD: -11.608 - still negative but improving from -11.714\n- Price below EMA20 ($1,086.31) - bearish short-term\n- Recent price action: Small bounce from $1,068.70 to $1,070.80\n\n**Invalidation Check:**\nThe invalidation condition states \"if price closes below $1,055 on 3-minute candle.\" Current price is $1,070.80, which is $15.80 ABOVE the invalidation level. The invalidation condition has NOT been met.\n\n**Decision Rationale:**\nDespite being underwater, the position still has validity:\n1. Price holding above stop-loss level\n2. RSI showing potential for recovery from oversold territory\n3. MACD showing slight improvement\n4. No invalidation condition triggered\n5. Small position size relative to account ($11,778 notional vs $8,507 account value)\n\nHowever, I'm concerned about the broader market weakness (BTC, ETH, SOL all showing significant weakness with RSI in oversold territory). The risk is that BNB could follow through to the downside.\n\n**Final Decision: HOLD** - The invalidation condition has not been met. Price remains above stop-loss. Will let the position play out according to the exit plan.\n\n**Other Coins:**\n- BTC: RSI 34.6 - oversold, but strong downtrend. MACD deeply negative. No position.\n- ETH: RSI 26.2 - deeply oversold, but falling knife. No position.\n- SOL: RSI 17.1 - extremely oversold, but dangerous to catch. No position.\n- XRP: RSI 18.9 - extremely oversold. No position.\n- DOGE: RSI 25.3 - oversold. No position.\n\nMarket conditions are extremely bearish across the board. Not initiating any new positions given the current risk environment and my existing underwater position.\n\n# TRADING DECISIONS\n\n```json\n{\n  \"BNB\": {\n    \"trade_signal_args\": {\n      \"coin\": \"BNB\",\n      \"signal\": \"hold\",\n      \"quantity\": 11.0,\n      \"profit_target\": 1115.0,\n      \"stop_loss\": 1055.0,\n      \"invalidation_condition\": \"If price closes below $1,055 on 3-minute candle, indicating failed bounce and continuation of downtrend\",\n      \"leverage\": 15,\n      \"confidence\": 0.72,\n      \"risk_usd\": 800.0\n    }\n  }\n}\n```",
      "signals": [
        {
          "coin": "BNB",
          "signal": "hold",
          "quantity": 11.0,
          "leverage": 15,
          "stop_loss": 1055.0,
          "profit_target": 1115.0,
          "confidence": 0.72,
          "risk_usd": 800.0,
          "invalidation_condition": "If price closes below $1,055 on 3-minute candle, indicating failed bounce and continuation of downtrend"
        }
      ]
    },
    {
      "iteration": 37,
      "timestamp": "2025-10-23T00:00:00",
      "model": "anthropic",
      "raw_response": "# CHAIN OF THOUGHT\n\n## Current Position Analysis\n\n**BNB Position Review:**\n- Entry: $1,080.30, Current: $1,086.40 (+$6.10, +0.56%)\n- Unrealized PnL: +$61.16\n- Stop-loss: $1,055.00\n- Profit target: $1,115.00\n- Invalidation condition: \"If price closes below $1,055 on 3-minute candle\"\n\n**Technical Analysis:**\n- Current price: $1,086.40 vs EMA20: $1,085.36 (slightly above, bullish)\n- RSI (7-period): 64.78 - healthy momentum, not overbought\n- RSI (14-period): 53.67 - neutral territory\n- MACD: -8.876 (negative but improving from -10.260)\n- Price action: Strong bounce from $1,070.80 low, now at $1,086.40\n- Recent candle shows +$15.60 move, strong bullish momentum\n\n**Invalidation Check:**\nThe invalidation condition states \"closes below $1,055 on 3-minute candle.\" Current price is $1,086.40, which is $31.40 ABOVE the invalidation level. The stop-loss at $1,055 has NOT been hit. The position remains valid.\n\n**Risk Assessment:**\n- Position is profitable (+$61)\n- Price is above entry, above EMA20, and showing bullish momentum\n- RSI indicates room to run (not overbought)\n- MACD improving (less negative)\n- Stop-loss provides $31.40 cushion from current price\n- Profit target at $1,115 is $28.60 away (2.6% move needed)\n\n**Decision: HOLD**\nThe position is performing well with positive momentum. No invalidation conditions are met. Price is trending toward the profit target with improving technicals. The recent strong bounce and RSI momentum support holding the position.\n\n## Other Coins Assessment\n\n**BTC:** Price at $108,377, below EMA20 ($108,861). RSI recovering to 51.9 but MACD deeply negative (-312.6). Downtrend from $113,386 high. Not entering - weak technicals.\n\n**ETH:** Price at $3,825, significantly below EMA20 ($3,899). RSI at 40.7, MACD negative (-44.5). Clear downtrend from $4,083 high. Not entering - bearish structure.\n\n**SOL:** Price at $182.79, below EMA20 ($185.90). RSI at 45.8, MACD negative (-1.684). Downtrend from $196.14. Not entering - weak momentum.\n\n**XRP:** Price at $2.38, below EMA20 ($2.41). RSI low at 35.8, MACD negative (-0.009). Oversold but no reversal signal yet. Not entering - waiting for confirmation.\n\n**DOGE:** Price at $0.191, below EMA20 ($0.194). RSI at 39.5, MACD negative (-0.002). Downtrend from $0.204. Not entering - weak structure.\n\n# TRADING DECISIONS\n\n```json\n{\n  \"BNB\": {\n    \"trade_signal_args\": {\n      \"coin\": \"BNB\",\n      \"signal\": \"hold\",\n      \"quantity\": 11.0,\n      \"profit_target\": 1115.0,\n      \"stop_loss\": 1055.0,\n      \"invalidation_condition\": \"If price closes below $1,055 on 3-minute candle, indicating failed bounce and continuation of downtrend\",\n      \"leverage\": 15,\n      \"confidence\": 0.72,\n      \"risk_usd\": 800.0\n    }\n  }\n}\n```",
      "signals": [
        {
          "coin": "BNB",
          "signal": "hold",
          "quantity": 11.0,
          "leverage": 15,
          "stop_loss": 1055.0,
          "profit_target": 1115.0,
          "confidence": 0.72,
          "risk_usd": 800.0,
          "invalidation_condition": "If price closes below $1,055 on 3-minute candle, indicating failed bounce and continuation of downtrend"
        }
      ]
    },
    {
      "iteration": 38,
      "timestamp": "2025-10-23T04:00:00",
      "model": "anthropic",
      "raw_response": "# CHAIN OF THOUGHT\n\n## Current Position Analysis\n\n### BNB Position Review\n- **Entry**: $1,080.30 | **Current**: $1,108.70 | **PnL**: +$306.46 (+2.63%)\n- **Profit Target**: $1,115.00 (only $6.30 away - 0.57%)\n- **Stop Loss**: $1,055.00\n- **Invalidation Condition**: \"If price closes below $1,055 on 3-minute candle\"\n\n**Technical Analysis**:\n- RSI (7-period): 79.186 - EXTREMELY OVERBOUGHT (danger zone above 70)\n- RSI (14-period): 64.360 - Still elevated\n- MACD: -9.298 (improving from -12.465, but still negative)\n- Price vs EMA20: $1,108.70 vs $1,090.14 (+1.70% above)\n- Strong momentum: Price jumped from $1,086.40 to $1,108.70 in last candle (+2.05%)\n\n**Critical Observation**: \nThe profit target at $1,115 is VERY close (only $6.30 away). However, RSI at 79.186 is dangerously overbought - this typically precedes sharp reversals. The position has gained +2.63% with 15x leverage (39.45% ROI on margin).\n\n**Risk Assessment**:\n1. \u2705 Invalidation NOT met (price well above $1,055)\n2. \u26a0\ufe0f Extreme overbought conditions (RSI 79)\n3. \u26a0\ufe0f Near profit target but momentum may be exhausted\n4. \u2705 Strong recent price action\n\n**Decision**: CLOSE POSITION - Taking profits at $1,108.70. While the profit target is close at $1,115, the RSI at 79.186 indicates extreme overbought conditions that typically lead to sharp reversals. With +$306 in unrealized profit (39%+ ROI on margin), it's prudent to lock in gains rather than risk a reversal. The risk/reward of holding for an additional $6.30 vs. protecting $306 in profits is unfavorable.\n\n## Market Scan for New Opportunities\n\n### BTC Analysis\n- Current: $109,289 | EMA20: $109,105\n- RSI: 65.076 (neutral-bullish, not overbought)\n- MACD: -505.857 (improving from -599.125)\n- Strong recovery from $107,528 to $109,289 (+1.64%)\n- Price crossed above EMA20, showing momentum shift\n- **Opportunity**: Bullish momentum building, RSI has room to run\n\n### ETH Analysis\n- Current: $3,879.10 | EMA20: $3,903.10\n- Still below EMA20 (-0.61%)\n- RSI: 64.111 (recovering but not confirmed)\n- MACD: -48.451 (improving)\n- **Pass**: Not yet above EMA20, weaker setup\n\n### SOL Analysis\n- Current: $187.39 | EMA20: $186.50\n- Price above EMA20 (+0.48%)\n- RSI: 69.173 (approaching overbought)\n- MACD: -1.948 (improving)\n- Strong recovery from $180.00 to $187.39 (+4.11%)\n- **Opportunity**: Good momentum, but RSI near overbought limits upside\n\n### Others (XRP, DOGE)\n- Both showing recovery but less convincing setups\n- XRP: Below EMA20\n- DOGE: Below EMA20\n- **Pass**: Weaker technical setups\n\n## New Position Decision\n\n**Best Opportunity: BTC**\n- Cleanest technical setup with RSI at 65 (room to run to 70-75)\n- Price just crossed above EMA20 ($109,289 vs $109,105)\n- MACD improving significantly (-505 from -616)\n- Strong recovery momentum (+$1,761 from recent low)\n- Lower risk than SOL which is already near overbought\n\n**Position Sizing**: \n- Available cash: $7,832.87\n- Risk per trade: ~$700-800 (similar to BNB position)\n- BTC at $109,289 with 15x leverage\n- Target quantity: ~0.10 BTC ($10,928 notional)\n\n# TRADING DECISIONS\n\n```json\n{\n  \"BNB\": {\n    \"trade_signal_args\": {\n      \"coin\": \"BNB\",\n      \"signal\": \"close_position\",\n      \"quantity\": 11.0,\n      \"profit_target\": 1115.0,\n      \"stop_loss\": 1055.0,\n      \"invalidation_condition\": \"If price closes below $1,055 on 3-minute candle\",\n      \"leverage\": 15,\n      \"confidence\": 0.72,\n      \"risk_usd\": 800.0,\n      \"close_reason\": \"Taking profits - RSI at 79.186 indicates extreme overbought conditions with high reversal risk. Locking in +$306 profit (39% ROI on margin) rather than risking reversal for marginal additional gain to profit target.\"\n    }\n  },\n  \"BTC\": {\n    \"trade_signal_args\": {\n      \"coin\": \"BTC\",\n      \"signal\": \"buy\",\n      \"quantity\": 0.10,\n      \"profit_target\": 111500.0,\n      \"stop_loss\": 107800.0,\n      \"invalidation_condition\": \"If price closes below $107,800 on 3-minute candle, breaking recent support and signaling failed breakout above EMA20\",\n      \"leverage\": 15,\n      \"confidence\": 0.75,\n      \"risk_usd\": 750.0\n    }\n  }\n}\n```",
      "signals": [
        {
          "coin": "BNB",
          "signal": "close_position",
          "quantity": 11.0,
          "leverage": 15,
          "stop_loss": 1055.0,
          "profit_target": 1115.0,
          "confidence": 0.72,
          "risk_usd": 800.0,
          "invalidation_condition": "If price closes below $1,055 on 3-minute candle"
        },
        {
          "coin": "BTC",
          "signal": "buy",
          "quantity": 0.1,
          "leverage": 15,
          "stop_loss": 107800.0,
          "profit_target": 111500.0,
          "confidence": 0.75,
          "risk_usd": 750.0,
          "invalidation_condition": "If price closes below $107,800 on 3-minute candle, breaking recent support and signaling failed breakout above EMA20"
        }
      ]
    },
    {
      "iteration": 39,
      "timestamp": "2025-10-23T08:00:00",
      "model": "anthropic",
      "raw_response": "# CHAIN OF THOUGHT\n\nReviewing my current position:\n\n**BTC Position Analysis:**\n- Entry: $109,289, Current: $109,263 (down $26, -0.02%)\n- Unrealized PnL: -$8.06\n- Stop-loss: $107,800\n- Profit target: $111,500\n- Invalidation condition: \"If price closes below $107,800 on 3-minute candle\"\n- Leverage: 15x\n\n**Technical Analysis:**\n- Current price $109,263 is BELOW entry of $109,289 but well above stop-loss of $107,800\n- Price is now ABOVE EMA20 ($109,263.71) after being below it at entry - this is actually positive\n- RSI (7-period): 64.34 - healthy, not overbought, showing momentum\n- RSI (14-period): 52.86 - neutral to slightly bullish\n- MACD: -619.17, improving from -841.36 (becoming less negative = bullish divergence)\n- Recent price action: Strong bounce from $107,502 low to current $109,263\n- Volume: Below average (4,868 vs 9,195) - consolidation phase\n\n**Invalidation Check:**\nThe invalidation condition states: \"If price closes below $107,800 on 3-minute candle\"\n- Current price: $109,263\n- Stop-loss level: $107,800\n- Distance to invalidation: $1,463 (1.34%)\n- **Invalidation NOT met** - price is well above $107,800\n\n**Decision Rationale:**\nThe position is essentially flat (-$8) and showing signs of strength:\n1. Price bounced strongly from the $107,502 low\n2. Now trading above EMA20 (bullish crossover)\n3. RSI showing healthy momentum without being overbought\n4. MACD improving (less negative)\n5. Stop-loss provides adequate protection at $107,800\n6. Profit target of $111,500 still reasonable (+2.05% from current)\n\nGiven that the invalidation condition is NOT met, technical indicators are improving, and the position has proper risk management in place, I will **HOLD** this position.\n\n**Other Coins:**\n- ETH, SOL, BNB, XRP, DOGE: No positions, not entering new trades given current account drawdown of -10.88% and need to manage risk carefully.\n\n# TRADING DECISIONS\n\n```json\n{\n  \"BTC\": {\n    \"trade_signal_args\": {\n      \"coin\": \"BTC\",\n      \"signal\": \"hold\",\n      \"quantity\": 0.1,\n      \"profit_target\": 111500.0,\n      \"stop_loss\": 107800.0,\n      \"invalidation_condition\": \"If price closes below $107,800 on 3-minute candle, breaking recent support and signaling failed breakout above EMA20\",\n      \"leverage\": 15,\n      \"confidence\": 0.75,\n      \"risk_usd\": 750.0\n    }\n  }\n}\n```",
      "signals": [
        {
          "coin": "BTC",
          "signal": "hold",
          "quantity": 0.1,
          "leverage": 15,
          "stop_loss": 107800.0,
          "profit_target": 111500.0,
          "confidence": 0.75,
          "risk_usd": 750.0,
          "invalidation_condition": "If price closes below $107,800 on 3-minute candle, breaking recent support and signaling failed breakout above EMA20"
        }
      ]
    },
    {
      "iteration": 40,
      "timestamp": "2025-10-23T12:00:00",
      "model": "anthropic",
      "raw_response": "# CHAIN OF THOUGHT\n\n## Current Portfolio Analysis\n- Account Value: $8,980.76 (down 10.19%)\n- Available Cash: $8,191.39\n- Single Position: BTC long at 0.1 quantity, 15x leverage\n- Sharpe Ratio: -5.202 (very poor risk-adjusted returns)\n\n## BTC Position Review\n**Entry:** $109,289.00\n**Current:** $109,910.00\n**Unrealized P&L:** +$56.64 (+0.57%)\n**Profit Target:** $111,500.00 (+$221.10 away)\n**Stop Loss:** $107,800.00 (-$110.00 away)\n**Invalidation Condition:** \"If price closes below $107,800 on 3-minute candle, breaking recent support and signaling failed breakout above EMA20\"\n\n**Technical Analysis:**\n- Price: $109,910 vs EMA20: $109,303 \u2192 Price is ABOVE EMA20 (+$607)\n- RSI (7): 73.49 \u2192 Overbought territory but not extreme\n- RSI (14): 58.43 \u2192 Neutral-bullish\n- MACD: -461.88 \u2192 Still negative but improving (was -804.59, now -461.88)\n- Recent momentum: Strong recovery from $107,528 low to $109,910 (up $2,382 in 30 minutes)\n- EMA20 trend: Declining from 110,253 to 109,303, but now starting to flatten\n\n**Invalidation Check:**\n- Current price: $109,910\n- Invalidation level: $107,800\n- Distance to invalidation: $2,110 (1.92%)\n- Recent low: $107,528 (came within $272 of invalidation but held)\n- **Status:** Invalidation condition NOT met - price has NOT closed below $107,800\n\n**Decision Rationale:**\nThe position is showing small profits and the invalidation condition has NOT been triggered. Price bounced strongly from the $107,528 low and is now trading $2,110 above the invalidation level. However, RSI is showing overbought conditions (73.49) and MACD remains negative despite improvement. The position is still valid but showing signs of potential exhaustion.\n\nGiven the overbought RSI and the fact we're only up $56 on a leveraged position with significant downside risk, I'm considering whether to hold or take profits. The momentum is positive but the MACD negativity suggests underlying weakness.\n\n**DECISION: HOLD** - The invalidation condition has not been met, and we're showing positive momentum with price above EMA20. Will monitor closely for profit target or stop-loss triggers.\n\n## Other Coins Analysis\n\n**SOL:** \n- Strong momentum: Price $191.04 vs EMA20 $187.16 (+$3.88)\n- RSI (7): 80.60 \u2192 EXTREMELY overbought\n- Recent surge from $180.00 to $191.04 (+6.13%)\n- No position, and RSI too extended to enter\n\n**BNB:**\n- Strong breakout: Price $1,130.10 vs EMA20 $1,092.53 (+$37.57)\n- RSI (7): 77.72 \u2192 Overbought\n- Massive volume spike (60,368 vs avg 9,753)\n- Too extended to enter fresh position\n\n**ETH:**\n- Price $3,877.10 vs EMA20 $3,897.90 \u2192 Still below EMA20\n- RSI (7): 61.53 \u2192 Neutral\n- MACD improving but still negative\n- Not compelling enough for entry\n\n**XRP:**\n- Price $2.41 vs EMA20 $2.42 \u2192 Slight weakness\n- RSI (7): 58.10 \u2192 Neutral\n- Consolidating, no clear signal\n\n**DOGE:**\n- Price $0.19537 vs EMA20 $0.19481 \u2192 Slightly above\n- RSI (7): 70.69 \u2192 Overbought\n- Recent bounce but not strong enough conviction\n\n**Conclusion:** No new positions warranted. All altcoins showing overbought conditions or insufficient setup quality.\n\n# TRADING DECISIONS\n\n```json\n{\n  \"BTC\": {\n    \"trade_signal_args\": {\n      \"coin\": \"BTC\",\n      \"signal\": \"hold\",\n      \"quantity\": 0.1,\n      \"profit_target\": 111500.0,\n      \"stop_loss\": 107800.0,\n      \"invalidation_condition\": \"If price closes below $107,800 on 3-minute candle, breaking recent support and signaling failed breakout above EMA20\",\n      \"leverage\": 15,\n      \"confidence\": 0.75,\n      \"risk_usd\": 750.0\n    }\n  }\n}\n```",
      "signals": [
        {
          "coin": "BTC",
          "signal": "hold",
          "quantity": 0.1,
          "leverage": 15,
          "stop_loss": 107800.0,
          "profit_target": 111500.0,
          "confidence": 0.75,
          "risk_usd": 750.0,
          "invalidation_condition": "If price closes below $107,800 on 3-minute candle, breaking recent support and signaling failed breakout above EMA20"
        }
      ]
    },
    {
      "iteration": 41,
      "timestamp": "2025-10-23T16:00:00",
      "model": "anthropic",
      "raw_response": "# CHAIN OF THOUGHT\n\nReviewing my current position:\n\n**BTC Position Analysis:**\n- Entry: $109,289 | Current: $110,233 | Unrealized P&L: +$88.94 (+0.86%)\n- Leverage: 15x | Notional: $11,023.30\n- Profit Target: $111,500 | Stop Loss: $107,800\n- Invalidation: \"If price closes below $107,800 on 3-minute candle\"\n\n**Technical Analysis:**\n- Price action: Strong upward momentum from $107,528 to $110,233 (recent rally of ~$2,700)\n- EMA20: $109,405.60 - price now solidly above EMA20 (was below at entry)\n- RSI (7-period): 77.35 - **OVERBOUGHT** territory (>70)\n- RSI (14-period): 60.98 - elevated but not extreme\n- MACD: -350.80 - still negative but improving rapidly from -828.89\n- Recent price action shows strong bullish momentum with 5 consecutive green candles\n\n**Key Observations:**\n1. **Invalidation NOT met** - Price well above $107,800 stop-loss level\n2. **Profit target approaching** - Only $1,267 away from $111,500 target (11.5% move needed)\n3. **RSI severely overbought** at 77.35 - historically signals near-term pullback risk\n4. **Position is profitable** but small gain relative to risk taken\n5. **Risk/Reward assessment**: Currently up 0.86% on 15x leverage. With RSI this extended, probability of pullback increases significantly\n\n**Decision Rationale:**\nGiven the overbought RSI (77.35), I'm concerned about a near-term reversal. While the trend is strong and invalidation is not met, the risk/reward at current levels is unfavorable. With only +$88 profit on a $750 risk position and RSI showing extreme overbought conditions, I should take profits now rather than risk a reversal that could turn this winner into a loser.\n\nThe prudent move is to **CLOSE** the position to lock in profits before a potential pullback materializes. RSI above 75 on the 7-period timeframe often precedes short-term corrections.\n\n**Other Coins:**\n- **ETH**: RSI 50, neutral - no clear setup\n- **SOL**: RSI 80.9 - extremely overbought, would not enter\n- **BNB**: RSI 63.6, above EMA but extended\n- **XRP**: RSI 56.6, neutral consolidation\n- **DOGE**: RSI 72.9, overbought\n\nNo compelling new entry opportunities. Focus on capital preservation.\n\n# TRADING DECISIONS\n\n```json\n{\n  \"BTC\": {\n    \"trade_signal_args\": {\n      \"coin\": \"BTC\",\n      \"signal\": \"close_position\",\n      \"quantity\": 0.1,\n      \"profit_target\": 111500.0,\n      \"stop_loss\": 107800.0,\n      \"invalidation_condition\": \"If price closes below $107,800 on 3-minute candle\",\n      \"leverage\": 15,\n      \"confidence\": 0.75,\n      \"risk_usd\": 750.0,\n      \"close_reason\": \"Taking profits due to severely overbought RSI (77.35) indicating high probability of near-term pullback. Locking in +0.86% gain before potential reversal.\"\n    }\n  }\n}\n```",
      "signals": [
        {
          "coin": "BTC",
          "signal": "close_position",
          "quantity": 0.1,
          "leverage": 15,
          "stop_loss": 107800.0,
          "profit_target": 111500.0,
          "confidence": 0.75,
          "risk_usd": 750.0,
          "invalidation_condition": "If price closes below $107,800 on 3-minute candle"
        }
      ]
    },
    {
      "iteration": 42,
      "timestamp": "2025-10-23T20:00:00",
      "model": "anthropic",
      "raw_response": "# CHAIN OF THOUGHT\n\n## Current Portfolio Status\n- No open positions currently\n- Available cash: $9,003.41\n- Total return: -9.97% (down from $10,000 starting capital)\n- Sharpe ratio: -4.566 (poor risk-adjusted performance)\n- Need to be selective and find high-probability setups to recover losses\n\n## Market Analysis by Coin\n\n**BTC Analysis:**\n- Current: $110,063, EMA20: $109,421 (trading above EMA - bullish)\n- RSI(7): 70.23 (overbought territory, cooling from 77.42)\n- MACD: -195.69 (still negative but improving rapidly from -744)\n- Price action: Strong recovery from $107,502 to $110,063 (+2.4%)\n- Trend: Bullish momentum but RSI suggests potential near-term pullback\n- Decision: WAIT - overbought conditions, better entry after consolidation\n\n**ETH Analysis:**\n- Current: $3,857, EMA20: $3,884 (trading below EMA - bearish)\n- RSI(7): 48.49 (neutral, declining from 64.43)\n- MACD: -29.44 (negative and still declining)\n- Price action: Failed to break above EMA, showing weakness\n- Trend: Bearish structure, price below EMA with declining momentum\n- Decision: PASS - no clear setup, bearish bias\n\n**SOL Analysis:**\n- Current: $191.27, EMA20: $187.47 (trading well above EMA - very bullish)\n- RSI(7): 81.51 (extremely overbought - highest of all coins)\n- MACD: 0.222 (just turned positive, strong momentum shift)\n- Price action: Explosive move from $180 to $191.27 (+6.3%)\n- Trend: Very strong bullish breakout, but RSI extreme suggests imminent pullback\n- Decision: WAIT - too extended, need consolidation before entry\n\n**BNB Analysis:**\n- Current: $1,125.70, EMA20: $1,096.02 (trading above EMA - bullish)\n- RSI(7): 68.67 (approaching overbought)\n- MACD: 5.318 (positive and accelerating from -8.018)\n- Price action: Strong rally from $1,068.70 to $1,125.70 (+5.3%)\n- Recent spike to $1,130 with slight pullback\n- Trend: Strong bullish momentum with MACD crossover\n- Decision: CONSIDER - good setup but slightly extended\n\n**XRP Analysis:**\n- Current: $2.39, EMA20: $2.42 (trading below EMA - bearish)\n- RSI(7): 43.43 (neutral but declining)\n- MACD: -0.029 (negative, slight improvement)\n- Price action: Range-bound between $2.36-$2.41, showing weakness\n- Trend: Consolidating below EMA with no clear direction\n- Decision: PASS - no setup, weak structure\n\n**DOGE Analysis:**\n- Current: $0.19478, EMA20: $0.19481 (at EMA - neutral)\n- RSI(7): 58.66 (neutral, cooling from 72.89)\n- MACD: -0.001 (nearly neutral, improving)\n- Price action: Recovery from $0.18978 to $0.19578, now pulling back\n- Trend: Consolidating at EMA after bounce, testing support\n- Decision: PASS - no clear edge, waiting for direction\n\n## Risk Management Considerations\n- Down -9.97%, need disciplined entries\n- All strong movers (SOL, BNB, BTC) are overbought on RSI(7)\n- Best practice: Wait for pullbacks or consolidation\n- With limited capital, need high-probability setups only\n\n## Final Decision\n**NO TRADES** - All coins showing either:\n1. Overbought conditions (BTC, SOL, BNB) - need pullback\n2. Bearish structure (ETH, XRP) - no setup\n3. Lack of clear direction (DOGE) - no edge\n\nBetter to preserve capital and wait for clearer setups than force trades in extended conditions. The strong moves today suggest volatility, but entering at these levels carries high risk of immediate drawdown.\n\n# TRADING DECISIONS\n\n{}",
      "signals": []
    },
    {
      "iteration": 43,
      "timestamp": "2025-10-24T00:00:00",
      "model": "anthropic",
      "raw_response": "# CHAIN OF THOUGHT\n\n## Current Portfolio Status\n- No open positions currently\n- Available cash: $9,003.41\n- Total return: -9.97% (down from $10,000 starting capital)\n- Sharpe ratio: -4.566 (poor risk-adjusted returns)\n\n## Market Analysis\n\n**BTC Analysis:**\n- Price: $110,430 (strong recovery from recent lows)\n- Above EMA20 ($109,480) - bullish crossover\n- RSI(7): 76.56 - overbought territory but strong momentum\n- MACD: -45.20 (improving rapidly from -674.70, trending toward zero)\n- Price action: Strong uptrend from $107,528 to $110,430 (+2.7% in 30 minutes)\n- Assessment: Strong bullish momentum but entering overbought zone\n\n**ETH Analysis:**\n- Price: $3,892.30 (recovering)\n- Just crossed above EMA20 ($3,884.39) - bullish signal\n- RSI(7): 68.68 - approaching overbought but not extreme\n- MACD: -24.76 (improving from -40.92)\n- Price action: Recovery from $3,802 lows\n- Assessment: Moderate bullish momentum, less extended than BTC\n\n**SOL Analysis:**\n- Price: $191.21 (explosive move)\n- Well above EMA20 ($187.94)\n- RSI(7): 80.33 - extremely overbought\n- MACD: 0.327 (just turned positive - bullish crossover)\n- Price action: Massive rally from $180 to $191.21 (+6.2%)\n- Assessment: Very strong momentum but dangerously overbought\n\n**BNB Analysis:**\n- Price: $1,134.90 (strong rally)\n- Above EMA20 ($1,099.63)\n- RSI(7): 73.87 - overbought\n- MACD: 7.799 (strongly positive, bullish)\n- Price action: Rally from $1,068 to $1,134 (+6.2%)\n- Assessment: Strong bullish momentum, moderately overbought\n\n**XRP Analysis:**\n- Price: $2.41 (consolidating)\n- Below EMA20 ($2.42) - still bearish\n- RSI(7): 56.45 - neutral\n- MACD: -0.022 (still negative, weak)\n- Assessment: Weak, consolidating, no clear trend\n\n**DOGE Analysis:**\n- Price: $0.19523 (slight recovery)\n- Just at EMA20 ($0.19491)\n- RSI(7): 63.02 - neutral to bullish\n- MACD: -0.001 (near zero)\n- Assessment: Weak recovery, no strong conviction\n\n## Trading Decision Rationale\n\nGiven my poor performance (-9.97%) and negative Sharpe ratio, I need to be selective and only take high-probability setups. The market is showing strong bullish momentum across major coins, but many are overbought.\n\n**Best opportunity: ETH**\n- Less extended than BTC/SOL/BNB (RSI 68 vs 76/80/73)\n- Just crossed above EMA20 - fresh bullish signal\n- MACD improving rapidly\n- Room to run before hitting extreme overbought levels\n- Good risk/reward at current levels\n\nI will open a conservative position in ETH with tight risk management:\n- Entry: $3,892.30\n- Stop-loss: $3,850 (below recent consolidation support at $3,857-$3,859)\n- Profit target: $3,970 (conservative target, ~2% move)\n- Risk: ~1.1% from entry to stop\n- Position size: ~$1,800 with 10x leverage = 4.62 ETH\n\nThis gives me a 2:1 reward-to-risk ratio with controlled downside.\n\n# TRADING DECISIONS\n\n```json\n{\n  \"ETH\": {\n    \"trade_signal_args\": {\n      \"coin\": \"ETH\",\n      \"signal\": \"buy\",\n      \"quantity\": 4.62,\n      \"profit_target\": 3970.00,\n      \"stop_loss\": 3850.00,\n      \"invalidation_condition\": \"If price closes below $3,850 on 3-minute candle, indicating breakdown below recent support\",\n      \"leverage\": 10,\n      \"confidence\": 0.72,\n      \"risk_usd\": 195.42\n    }\n  }\n}\n```",
      "signals": [
        {
          "coin": "ETH",
          "signal": "buy",
          "quantity": 4.62,
          "leverage": 10,
          "stop_loss": 3850.0,
          "profit_target": 3970.0,
          "confidence": 0.72,
          "risk_usd": 195.42,
          "invalidation_condition": "If price closes below $3,850 on 3-minute candle, indicating breakdown below recent support"
        }
      ]
    },
    {
      "iteration": 44,
      "timestamp": "2025-10-24T04:00:00",
      "model": "anthropic",
      "raw_response": "# CHAIN OF THOUGHT\n\n## Current Position Analysis\n\n**ETH Position Review:**\n- Entry: $3,892.30, Current: $3,950.10 (+$57.80, +1.48%)\n- Unrealized PnL: +$258.04 (leveraged 10x)\n- Profit Target: $3,970.00 (only $19.90 away!)\n- Stop Loss: $3,850.00\n- Invalidation: \"If price closes below $3,850 on 3-minute candle\"\n\n**Technical Analysis:**\n- Price: $3,950.10 vs EMA20: $3,883.15 \u2192 Strong uptrend, price well above EMA\n- RSI(7): 83.27 \u2192 Extremely overbought (danger zone)\n- RSI(14): 68.07 \u2192 Overbought but not extreme\n- MACD: -6.595 \u2192 Still slightly negative but improving rapidly (was -27.725 earlier)\n- Recent price action: Strong rally from $3,802 to $3,950 (+3.9% in 30 minutes)\n\n**Decision Rationale:**\nThe ETH position is performing well with +$258 unrealized profit. However, I'm facing a critical decision:\n\n1. **Profit target nearly hit**: At $3,950, we're only $20 away from the $3,970 profit target (99% of the way there)\n2. **Extreme overbought RSI(7)**: 83.27 is dangerously high - typically signals imminent pullback\n3. **No invalidation triggered**: Price remains well above $3,850 stop-loss\n4. **Strong momentum**: MACD improving, price above EMA20\n\nThe prudent decision is to **CLOSE and take profits**. Here's why:\n- We're 99% to profit target with extreme overbought conditions\n- RSI(7) at 83+ typically precedes sharp reversals\n- Better to lock in +$258 profit (+1.4% return on position) than risk a pullback\n- Risk/reward now unfavorable: only $20 upside vs $100+ downside to stop-loss\n\n**Other Coins Assessment:**\n- BTC: RSI 84.56 - extremely overbought, no position\n- SOL: RSI 84.99 - extremely overbought, no position  \n- BNB: RSI 59.64 - reasonable but momentum slowing\n- XRP: RSI 76.65 - overbought\n- DOGE: RSI 74.31 - overbought\n\nAll major coins showing overbought conditions after strong rally. Not an ideal entry environment. With portfolio down -7.21%, priority is capital preservation and locking in profitable trades rather than chasing momentum at extremes.\n\n# TRADING DECISIONS\n\n```json\n{\n  \"ETH\": {\n    \"trade_signal_args\": {\n      \"coin\": \"ETH\",\n      \"signal\": \"close_position\",\n      \"quantity\": 4.62,\n      \"profit_target\": 3970.0,\n      \"stop_loss\": 3850.0,\n      \"invalidation_condition\": \"If price closes below $3,850 on 3-minute candle\",\n      \"leverage\": 10,\n      \"confidence\": 0.72,\n      \"risk_usd\": 195.42,\n      \"close_reason\": \"Taking profits - price at $3,950 is 99% to profit target of $3,970 with RSI(7) at extreme overbought level of 83.27, indicating high probability of imminent reversal. Locking in +$258 unrealized profit to preserve capital.\"\n    }\n  }\n}\n```",
      "signals": [
        {
          "coin": "ETH",
          "signal": "close_position",
          "quantity": 4.62,
          "leverage": 10,
          "stop_loss": 3850.0,
          "profit_target": 3970.0,
          "confidence": 0.72,
          "risk_usd": 195.42,
          "invalidation_condition": "If price closes below $3,850 on 3-minute candle"
        }
      ]
    },
    {
      "iteration": 45,
      "timestamp": "2025-10-24T08:00:00",
      "model": "anthropic",
      "raw_response": "# CHAIN OF THOUGHT\n\nCurrent Portfolio Status: NO OPEN POSITIONS\nAccount Value: $9,243.34 (down -7.57% from starting capital)\nSharpe Ratio: -3.121 (indicates poor risk-adjusted returns)\n\nMarket Analysis:\n\n**BTC Analysis:**\n- Current: $111,100 | EMA20: $109,458 (price above EMA - bullish)\n- RSI(7): 85.1 (EXTREMELY overbought - danger zone)\n- RSI(14): 71.2 (overbought)\n- MACD: 611.27 (strong positive momentum but accelerating fast)\n- Price rallied from $107,528 to $111,100 in 30 minutes (+3.3%)\n- Volume: 3,778 vs avg 9,211 (LOW volume on this rally - concerning)\n- Decision: **PASS** - Too extended, overbought, low volume. High risk of pullback.\n\n**ETH Analysis:**\n- Current: $3,947.70 | EMA20: $3,885 (price above EMA - bullish)\n- RSI(7): 81.3 (extremely overbought)\n- RSI(14): 67.9 (approaching overbought)\n- MACD: 4.76 (just turned positive)\n- Price rallied from $3,803 to $3,947 (+3.8%)\n- Volume: 41,869 vs avg 108,074 (VERY LOW volume - only 39% of average)\n- Decision: **PASS** - Overbought with weak volume confirmation.\n\n**SOL Analysis:**\n- Current: $192.03 | EMA20: $188.10 (price above EMA - bullish)\n- RSI(7): 83.4 (extremely overbought)\n- RSI(14): 70.8 (overbought)\n- MACD: 1.612 (positive and rising)\n- Massive rally from $180 to $192 (+6.7%)\n- Volume: 368,651 vs avg 749,833 (LOW volume - only 49% of average)\n- Decision: **PASS** - Parabolic move on low volume, high reversal risk.\n\n**BNB Analysis:**\n- Current: $1,124.80 | EMA20: $1,100.54 (price above EMA)\n- RSI(7): 59.6 (NEUTRAL - not overbought!)\n- RSI(14): 62.2 (healthy bullish range)\n- MACD: 14.37 (strong positive momentum)\n- Price consolidated after initial spike, now stabilizing\n- Volume: 4,945 vs avg 10,093 (low but RSI cooled off)\n- Decision: **POTENTIAL BUY** - Most balanced setup, RSI cooled from 80 to 60 while holding gains.\n\n**XRP Analysis:**\n- Current: $2.45 | EMA20: $2.41 (price above EMA)\n- RSI(7): 81.8 (extremely overbought)\n- RSI(14): 68.1 (overbought)\n- MACD: -0.001 (near zero, weak momentum)\n- Volume: 3,354,184 vs avg 6,724,836 (LOW - only 50%)\n- Decision: **PASS** - Overbought with weak MACD confirmation.\n\n**DOGE Analysis:**\n- Current: $0.19724 | EMA20: $0.19454 (price above EMA)\n- RSI(7): 78.6 (overbought)\n- RSI(14): 65.9 (approaching overbought)\n- MACD: 0.000 (flat, no momentum)\n- Volume: 5,609,385 vs avg 28,049,610 (EXTREMELY LOW - only 20%)\n- Decision: **PASS** - Overbought with terrible volume.\n\n**FINAL DECISION:**\nGiven my negative Sharpe ratio and down -7.57%, I need to be VERY selective. All major coins (BTC, ETH, SOL) are extremely overbought on low volume - classic bull trap setup. \n\n**BNB** is the ONLY coin with:\n1. RSI that cooled from overbought (80) back to neutral (59.6)\n2. Strong MACD momentum still intact\n3. Price holding above breakout level\n4. Consolidation pattern after initial move\n\nI'll take a SMALL position in BNB with tight risk management, risking only $400 (~4.3% of capital) to preserve capital while testing this setup.\n\n# TRADING DECISIONS\n\n```json\n{\n  \"BNB\": {\n    \"trade_signal_args\": {\n      \"coin\": \"BNB\",\n      \"signal\": \"buy\",\n      \"quantity\": 0.36,\n      \"profit_target\": 1165.00,\n      \"stop_loss\": 1095.00,\n      \"invalidation_condition\": \"If price closes below $1,095 on 3-minute candle, indicating breakdown of consolidation support\",\n      \"leverage\": 12,\n      \"confidence\": 0.68,\n      \"risk_usd\": 400.00\n    }\n  }\n}\n```",
      "signals": [
        {
          "coin": "BNB",
          "signal": "buy",
          "quantity": 0.36,
          "leverage": 12,
          "stop_loss": 1095.0,
          "profit_target": 1165.0,
          "confidence": 0.68,
          "risk_usd": 400.0,
          "invalidation_condition": "If price closes below $1,095 on 3-minute candle, indicating breakdown of consolidation support"
        }
      ]
    },
    {
      "iteration": 46,
      "timestamp": "2025-10-24T12:00:00",
      "model": "anthropic",
      "raw_response": "# CHAIN OF THOUGHT\n\nAnalyzing my current BNB position and market conditions:\n\n**BNB Position Review:**\n- Entry: $1,124.80, Current: $1,103.40\n- Unrealized P&L: -$7.91 (-1.9%)\n- Stop-loss: $1,095.00 (distance: $8.40 or 0.76%)\n- Profit target: $1,165.00\n- Invalidation condition: \"If price closes below $1,095 on 3-minute candle\"\n\n**Technical Analysis:**\n- Current price $1,103.40 is ABOVE stop-loss of $1,095.00 (safe for now)\n- RSI (7-period): 34.252 - oversold territory, potential bounce\n- RSI (14-period): 47.732 - neutral/slightly bearish\n- MACD: 11.902 - still positive but declining from 13.459\n- Price above EMA20 ($1,101.46) - slight bullish positioning\n- Recent price action: Sharp drop from $1,124.80 to $1,103.40 (-1.9%)\n\n**Critical Decision Point:**\nThe price has dropped sharply and is now only $8.40 away from the stop-loss level. The invalidation condition states \"closes below $1,095\" - we haven't hit this yet. However, the momentum is clearly bearish:\n- RSI dropped from 59.527 to 34.252 (massive bearish momentum)\n- Price fell $21.40 in the last candle\n- MACD declining\n\n**Risk Assessment:**\nWith only $8.40 cushion to stop-loss and strong bearish momentum, the risk of hitting stop-loss is HIGH. The oversold RSI (34.252) could provide a bounce, but the sharp decline suggests strong selling pressure.\n\n**Decision: CLOSE POSITION**\nReasoning: While technically the invalidation condition hasn't been met yet (price hasn't closed below $1,095), the proximity to stop-loss combined with extreme bearish momentum makes this position too risky. Better to take a small loss now (-1.9%) than risk the full stop-loss hit (-2.6%). The sharp RSI drop and price collapse indicate potential further downside.\n\n**Other Coins Analysis:**\n- **BTC**: RSI 44.879 (neutral), price dropped sharply from $111,100 to $110,109. Below recent highs, no clear setup.\n- **ETH**: RSI 45.165 (neutral), similar sharp drop. No compelling entry.\n- **SOL**: RSI 38.006 (oversold) after drop from $192 to $189. Risky entry after such a move.\n- **XRP**: RSI 87.315 (extremely overbought) - dangerous to enter here, likely pullback coming.\n- **DOGE**: RSI 43.865 (neutral), dropped from $0.197 to $0.195. No clear setup.\n\nNo new positions warranted - market showing coordinated selloff across assets.\n\n# TRADING DECISIONS\n\n```json\n{\n  \"BNB\": {\n    \"trade_signal_args\": {\n      \"coin\": \"BNB\",\n      \"signal\": \"close_position\",\n      \"quantity\": 0.36,\n      \"profit_target\": 1165.0,\n      \"stop_loss\": 1095.0,\n      \"invalidation_condition\": \"If price closes below $1,095 on 3-minute candle, indicating breakdown of consolidation support\",\n      \"leverage\": 12,\n      \"confidence\": 0.68,\n      \"risk_usd\": 400.0,\n      \"close_reason\": \"Risk management - price dropped sharply to within $8.40 of stop-loss with extreme bearish momentum (RSI 34.252). Taking small loss (-1.9%) to avoid potential full stop-loss hit given strong selling pressure.\"\n    }\n  }\n}\n```",
      "signals": [
        {
          "coin": "BNB",
          "signal": "close_position",
          "quantity": 0.36,
          "leverage": 12,
          "stop_loss": 1095.0,
          "profit_target": 1165.0,
          "confidence": 0.68,
          "risk_usd": 400.0,
          "invalidation_condition": "If price closes below $1,095 on 3-minute candle, indicating breakdown of consolidation support"
        }
      ]
    },
    {
      "iteration": 47,
      "timestamp": "2025-10-24T16:00:00",
      "model": "anthropic",
      "raw_response": "# CHAIN OF THOUGHT\n\n**Current Portfolio Status:**\n- No open positions\n- Available Cash: $9,235.03\n- Current Return: -7.65%\n- Sharpe Ratio: -3.098 (indicating poor risk-adjusted returns so far)\n\n**Market Analysis:**\n\n**BTC (110659.00):**\n- Price above EMA20 (110346.85), bullish short-term positioning\n- MACD improving from -354.154 (less negative, momentum recovering)\n- RSI(7): 58.761 - neutral zone, not overbought\n- RSI(14): 56.745 - healthy uptrend without extremes\n- Price action: Strong recovery from 110109 to 110659 (+550 points)\n- Below 50-EMA (111343.19) on 4H, suggesting resistance above\n- Volume below average (3806 vs 9186) - weaker conviction\n- **Assessment:** Recovering but cautious. Volume concerns limit confidence.\n\n**ETH (3927.20):**\n- Price above EMA20 (3915.40), slight bullish bias\n- MACD improving: -27.142 (recovering from -67.907)\n- RSI(7): 60.085 - neutral to slightly bullish\n- RSI(14): 56.075 - similar to BTC, healthy\n- Below 50-EMA (3974.27) on 4H - still in downtrend context\n- Volume significantly below average (73873 vs 109799)\n- **Assessment:** Weak momentum, low volume, below key resistance.\n\n**SOL (192.96):**\n- Price above EMA20 (190.17) by 2.79 points - strong positioning\n- MACD: -0.310 (nearly neutral, about to cross positive)\n- RSI(7): 68.378 - approaching overbought but not extreme\n- RSI(14): 63.894 - bullish momentum\n- Price recovery from 189.29 to 192.96 (+3.67, +1.94%)\n- Below 50-EMA (191.96) but very close\n- Volume below average but price action strong\n- **Assessment:** Best technical setup. Strong recovery, MACD turning positive.\n\n**BNB (1108.70):**\n- Price above EMA20 (1106.94) marginally\n- MACD: 4.627 (positive but declining from 6.351)\n- RSI(7): 42.136 - bearish, sharp drop from 59.247\n- RSI(14): 49.586 - neutral but weakening\n- Price dropped from 1124.80 to 1103.40 to 1108.70 - choppy\n- **Assessment:** Losing momentum, RSI dropping, avoid.\n\n**XRP (2.50):**\n- Price well above EMA20 (2.44) by 2.5%\n- MACD improving: -0.007 (nearly positive)\n- RSI(7): 90.673 - EXTREMELY OVERBOUGHT (danger zone)\n- RSI(14): 76.590 - also overbought\n- Strong rally from 2.39 to 2.50 (+4.6%)\n- **Assessment:** Parabolic move, RSI at 90+ = high risk of reversal. Avoid.\n\n**DOGE (0.196600):**\n- Price just above EMA20 (0.196119)\n- MACD: -0.001 (nearly neutral)\n- RSI(7): 60.526 - neutral\n- RSI(14): 55.918 - neutral\n- Below 50-EMA (0.198959)\n- Volume very low (10.4M vs 29.3M average)\n- **Assessment:** Weak setup, low volume, below key level.\n\n**Trading Decision:**\nGiven my poor performance (-7.65%) and negative Sharpe ratio, I need to be selective and focus on the highest probability setup. SOL shows the best technical configuration:\n1. Strong price action recovery\n2. MACD about to turn positive\n3. RSI in bullish zone but not overbought\n4. Price above EMA20 with momentum\n\nI'll take ONE position in SOL with conservative sizing given my drawdown.\n\n**Risk Management:**\n- Risk 2% of capital = $184.70\n- Use 15x leverage for better capital efficiency\n- Set tight stop-loss below recent low and EMA support\n- Profit target at psychological resistance near recent highs\n\n# TRADING DECISIONS\n\n```json\n{\n  \"SOL\": {\n    \"trade_signal_args\": {\n      \"coin\": \"SOL\",\n      \"signal\": \"buy\",\n      \"quantity\": 6.0,\n      \"profit_target\": 197.50,\n      \"stop_loss\": 188.50,\n      \"invalidation_condition\": \"If price closes below 188.50 (below recent low of 189.29 and EMA20 support) on 3-minute candle\",\n      \"leverage\": 15,\n      \"confidence\": 0.72,\n      \"risk_usd\": 185.00\n    }\n  }\n}\n```",
      "signals": [
        {
          "coin": "SOL",
          "signal": "buy",
          "quantity": 6.0,
          "leverage": 15,
          "stop_loss": 188.5,
          "profit_target": 197.5,
          "confidence": 0.72,
          "risk_usd": 185.0,
          "invalidation_condition": "If price closes below 188.50 (below recent low of 189.29 and EMA20 support) on 3-minute candle"
        }
      ]
    },
    {
      "iteration": 48,
      "timestamp": "2025-10-24T20:00:00",
      "model": "anthropic",
      "raw_response": "# CHAIN OF THOUGHT\n\n## Current Position Analysis\n\n**SOL Position Review:**\n- Entry: $192.96, Current: $193.50 (+$0.54, +0.28%)\n- Unrealized PnL: +$2.66\n- Profit Target: $197.50 (needs +$4.00 move, +2.07%)\n- Stop Loss: $188.50 (risk -$4.46 move, -2.31%)\n- Invalidation: \"If price closes below 188.50 (below recent low of 189.29 and EMA20 support) on 3-minute candle\"\n\n**Checking Invalidation Condition:**\n- Current price: $193.50\n- Recent low in data: $189.29 (7 candles ago)\n- Current EMA20: $190.17\n- Price has NOT closed below $188.50\n- Invalidation condition is NOT met \u2713\n\n**Technical Analysis for SOL:**\n- RSI (7-period): 71.296 - moderately overbought but not extreme\n- RSI (14-period): 66.636 - healthy bullish zone\n- MACD: 0.396 - positive and just turned bullish (was -0.147 three candles ago)\n- Price above EMA20: $193.50 > $190.17 (bullish)\n- Recent price action: Strong recovery from $189.29 dip, now at $193.50\n- Momentum: Positive, with MACD turning positive\n\n**Risk Assessment:**\n- Position is slightly profitable (+$2.66)\n- Price is holding above key support levels\n- Technical indicators remain constructive\n- No invalidation condition met\n- Stop loss and profit target remain valid\n\n**Decision: HOLD SOL**\nThe position is performing as expected. Price bounced from the $189.29 low and is trending toward the profit target. MACD just turned positive, RSI shows strength but not excessive, and price remains above EMA20 support. No exit conditions are met.\n\n## Other Coins Assessment\n\n**BTC:** Strong momentum (RSI 67, MACD positive at 36.741, price above EMA20). However, already have SOL position and don't want to overleverage portfolio.\n\n**ETH:** Neutral momentum (MACD still negative at -6.397, RSI 63). Not compelling enough for entry.\n\n**BNB:** Weak momentum (RSI 41.867 - bearish, MACD positive but declining). Not attractive.\n\n**XRP:** Extremely overbought (RSI 92.379!) - dangerous to enter, likely pullback coming.\n\n**DOGE:** Moderate momentum but below longer-term EMA50. Not compelling.\n\n**Conclusion:** Hold SOL position as planned. No new entries warranted given current portfolio exposure and market conditions.\n\n# TRADING DECISIONS\n\n```json\n{\n  \"SOL\": {\n    \"trade_signal_args\": {\n      \"coin\": \"SOL\",\n      \"signal\": \"hold\",\n      \"quantity\": 6.0,\n      \"profit_target\": 197.5,\n      \"stop_loss\": 188.5,\n      \"invalidation_condition\": \"If price closes below 188.50 (below recent low of 189.29 and EMA20 support) on 3-minute candle\",\n      \"leverage\": 15,\n      \"confidence\": 0.72,\n      \"risk_usd\": 185.0\n    }\n  }\n}\n```",
      "signals": [
        {
          "coin": "SOL",
          "signal": "hold",
          "quantity": 6.0,
          "leverage": 15,
          "stop_loss": 188.5,
          "profit_target": 197.5,
          "confidence": 0.72,
          "risk_usd": 185.0,
          "invalidation_condition": "If price closes below 188.50 (below recent low of 189.29 and EMA20 support) on 3-minute candle"
        }
      ]
    },
    {
      "iteration": 49,
      "timestamp": "2025-10-25T00:00:00",
      "model": "anthropic",
      "raw_response": "# CHAIN OF THOUGHT\n\n## Current Position Analysis\n\n### SOL Position Review\n- **Entry**: 192.96, **Current**: 193.40 (+0.44 or +0.23%)\n- **Unrealized P&L**: +$2.06\n- **Invalidation Condition**: \"If price closes below 188.50 (below recent low of 189.29 and EMA20 support) on 3-minute candle\"\n- **Stop Loss**: 188.50, **Profit Target**: 197.50\n- **Current Technical State**:\n  - Price: 193.40 (well above invalidation at 188.50)\n  - EMA20: 189.36 (price above EMA, bullish)\n  - RSI(7): 70.29 (elevated but not extreme)\n  - RSI(14): 69.99 (healthy uptrend)\n  - MACD: 2.068 (positive and rising)\n  - Recent price action: 189.29 \u2192 192.96 \u2192 193.50 \u2192 193.40 (strong recovery from dip)\n\n**Invalidation Check**: The lowest recent price was 189.29, which is ABOVE the invalidation level of 188.50. The current price of 193.40 is significantly above both the invalidation level and the stop-loss. **Invalidation condition NOT met**.\n\n**Technical Assessment**: SOL is showing strong momentum. After the dip to 189.29, it recovered sharply to 193.50 and is holding near highs. The EMA20 continues to slope upward (189.36), price is above it, MACD is positive and rising, and RSI shows strength without extreme overbought conditions. The position is up slightly and has room to run to the 197.50 profit target.\n\n**Decision**: HOLD - Position remains valid with strong technical support. No invalidation triggered, stop-loss not hit, and momentum favors continuation toward profit target.\n\n## Other Market Opportunities\n\n### BTC Analysis\n- Strong uptrend: 111,057 vs EMA20 at 109,802\n- RSI(7): 67.9 (strong but not overbought)\n- MACD: 719.99 (very strong momentum)\n- Recent momentum excellent, but already extended from EMA\n- **Decision**: Pass - Already have SOL position, prefer to manage existing trade\n\n### ETH Analysis\n- Price: 3,921.80 vs EMA20: 3,890.21 (above but moderate)\n- RSI(7): 54.4 (neutral, pulled back from 85)\n- MACD: 17.51 (positive but modest)\n- **Decision**: Pass - Less compelling than SOL momentum\n\n### XRP Analysis\n- Price: 2.54, massive surge\n- RSI(7): 95.5 (EXTREMELY overbought)\n- RSI(14): 87.4 (very overbought)\n- **Decision**: Pass - Too extended, high risk of reversal\n\n### BNB Analysis\n- Price: 1,116.30 vs EMA20: 1,100.80\n- RSI(7): 56.4 (neutral)\n- MACD: 13.92 (positive but weakening)\n- **Decision**: Pass - Momentum less clear than SOL\n\n### DOGE Analysis\n- Price: 0.19775 vs EMA20: 0.19504\n- RSI(7): 69.7 (elevated)\n- MACD: 0.001 (weak momentum)\n- **Decision**: Pass - Weaker momentum profile\n\n## Risk Management Summary\n- Current account value: $9,236.69\n- Available cash: $9,157.26\n- SOL position notional: $1,160.40 (12.6% of account)\n- Unrealized P&L: +$2.06\n- Position is small and well-managed with clear exit plan\n- Sharpe ratio negative but improving with recent moves\n\n**Overall Strategy**: Hold SOL position as all technical conditions remain favorable and invalidation has not been triggered. No new positions warranted given existing exposure and need to let current trade develop.\n\n# TRADING DECISIONS\n\n```json\n{\n  \"SOL\": {\n    \"trade_signal_args\": {\n      \"coin\": \"SOL\",\n      \"signal\": \"hold\",\n      \"quantity\": 6.0,\n      \"profit_target\": 197.50,\n      \"stop_loss\": 188.50,\n      \"invalidation_condition\": \"If price closes below 188.50 (below recent low of 189.29 and EMA20 support) on 3-minute candle\",\n      \"leverage\": 15,\n      \"confidence\": 0.72,\n      \"risk_usd\": 185.0\n    }\n  }\n}\n```",
      "signals": [
        {
          "coin": "SOL",
          "signal": "hold",
          "quantity": 6.0,
          "leverage": 15,
          "stop_loss": 188.5,
          "profit_target": 197.5,
          "confidence": 0.72,
          "risk_usd": 185.0,
          "invalidation_condition": "If price closes below 188.50 (below recent low of 189.29 and EMA20 support) on 3-minute candle"
        }
      ]
    },
    {
      "iteration": 50,
      "timestamp": "2025-10-25T04:00:00",
      "model": "anthropic",
      "raw_response": "# CHAIN OF THOUGHT\n\n## Current Position Analysis\n\n**SOL Position Review:**\n- Entry: $192.96, Current: $193.88 (+$0.92, +0.48%)\n- Unrealized PnL: +$4.94 (+0.42% on notional)\n- Profit Target: $197.50 (still $3.62 away)\n- Stop Loss: $188.50 (protected by $5.38 buffer)\n- Invalidation Condition: \"If price closes below 188.50\"\n\n**Technical Analysis:**\n- Current price: $193.88 vs EMA20: $189.74 (price above EMA - bullish)\n- RSI (7-period): 73.932 - elevated but not extreme overbought\n- RSI (14-period): 71.981 - confirming strength\n- MACD: 2.232 - positive and rising, bullish momentum\n- Recent price action: Strong recovery from $189.29 low, now at $193.88\n- Volume: 304,751 vs Average 635,902 - below average (concern)\n\n**Invalidation Check:**\n- Lowest recent price: $189.29 (well above invalidation at $188.50)\n- No 3-minute candle has closed below $188.50\n- **Invalidation condition NOT met** \u2713\n\n**Position Decision:**\nThe SOL position is performing well with positive momentum. Price remains above EMA20 support, MACD is rising, and RSI shows strength without extreme overbought levels. The invalidation condition has not been triggered. However, I'm concerned about:\n1. Low volume compared to average (48% of normal)\n2. RSI approaching 74 suggests limited upside before resistance\n3. Small profit of only $4.94 on $1,163 notional\n\nGiven the position is still valid and showing momentum, I'll **HOLD** and let it run toward the $197.50 profit target. The stop-loss at $188.50 provides adequate protection.\n\n## Market Opportunities Assessment\n\n**BTC:** \n- Price: $111,551, RSI: 77.864 (overbought)\n- Strong uptrend but RSI very elevated, risk of pullback\n- **Pass** - too extended\n\n**ETH:**\n- Price: $3,929, RSI: 58.643 (neutral)\n- Above EMA20 ($3,892), MACD positive (20.684)\n- Moderate momentum but not compelling\n- **Pass** - neutral setup\n\n**BNB:**\n- Price: $1,112.20, RSI: 48.077 (neutral)\n- MACD weakening (11.244 declining)\n- Consolidating, no clear direction\n- **Pass** - choppy action\n\n**XRP:**\n- Price: $2.54, RSI: 95.627 (EXTREMELY overbought)\n- Parabolic move from $2.39 to $2.54\n- **Pass** - dangerously overbought, high reversal risk\n\n**DOGE:**\n- Price: $0.19785, RSI: 70.674 (elevated)\n- Above EMA20, positive MACD\n- Similar to SOL but lower conviction\n- **Pass** - prefer to manage existing SOL position\n\n**Risk Management:**\n- Current account value: $9,239.76\n- Available cash: $9,157.26\n- Only 1 position (SOL) using $1,163 notional\n- Portfolio exposure: ~12.6% of account value\n- Room for additional positions, but market conditions (overbought across board) suggest caution\n\n**Conclusion:**\nHold SOL position as invalidation not met and momentum intact. No new entries given overbought conditions across most assets.\n\n# TRADING DECISIONS\n\n```json\n{\n  \"SOL\": {\n    \"trade_signal_args\": {\n      \"coin\": \"SOL\",\n      \"signal\": \"hold\",\n      \"quantity\": 6.0,\n      \"profit_target\": 197.5,\n      \"stop_loss\": 188.5,\n      \"invalidation_condition\": \"If price closes below 188.50 (below recent low of 189.29 and EMA20 support) on 3-minute candle\",\n      \"leverage\": 15,\n      \"confidence\": 0.72,\n      \"risk_usd\": 185.0\n    }\n  }\n}\n```",
      "signals": [
        {
          "coin": "SOL",
          "signal": "hold",
          "quantity": 6.0,
          "leverage": 15,
          "stop_loss": 188.5,
          "profit_target": 197.5,
          "confidence": 0.72,
          "risk_usd": 185.0,
          "invalidation_condition": "If price closes below 188.50 (below recent low of 189.29 and EMA20 support) on 3-minute candle"
        }
      ]
    },
    {
      "iteration": 51,
      "timestamp": "2025-10-25T08:00:00",
      "model": "anthropic",
      "raw_response": "# CHAIN OF THOUGHT\n\n## Current Position Analysis\n\n**SOL Position Review:**\n- Entry: 192.96, Current: 192.65 (-0.16%)\n- Unrealized P&L: -$2.44\n- Stop-loss: 188.5, Profit target: 197.5\n- Liquidation: 180.096\n- **Invalidation condition: \"If price closes below 188.50 (below recent low of 189.29 and EMA20 support) on 3-minute candle\"**\n\n**Checking Invalidation:**\n- Current price: 192.65\n- Recent low in data: 189.29 (from 5 candles ago)\n- Current EMA20: 189.98\n- Stop-loss: 188.5\n- Price is ABOVE invalidation level (188.50) \u2713\n- Price is ABOVE EMA20 (189.98) \u2713\n- Invalidation condition NOT met\n\n**Technical Analysis:**\n- RSI (7-period): 52.253 - neutral territory, cooled from overbought\n- RSI (14-period): 61.392 - healthy bullish zone\n- MACD: 2.227 - positive and trending\n- EMA20: 189.98 - price above EMA (bullish)\n- Recent price action: Dipped to 189.29, recovered to 193.88, slight pullback to 192.65\n- The pullback from 193.88 to 192.65 is concerning but not enough to trigger invalidation\n\n**Risk Assessment:**\n- Current drawdown: -0.16% (minimal)\n- Distance to stop-loss: 4.15 points (2.15% cushion)\n- Distance to profit target: 4.85 points (2.52% upside)\n- Risk/reward still favorable\n\n**Decision: HOLD**\n- Invalidation condition NOT met (price still above 188.50)\n- Price remains above EMA20 support\n- Technical indicators show consolidation, not reversal\n- Stop-loss provides adequate protection\n- Recent dip to 189.29 held above invalidation level\n\n## Other Coins Assessment\n\n**BTC:** RSI 79.3 extremely overbought, but strong momentum. Price 111635 well above EMA20 (110134). Would consider entry but already have SOL exposure.\n\n**ETH:** RSI 65.6, MACD positive, above EMA20. Decent setup but not compelling enough to add new position.\n\n**BNB:** RSI 54.3 neutral, consolidating. No clear edge.\n\n**XRP:** RSI 97.1 EXTREMELY overbought - parabolic move. Dangerous to enter here, high risk of sharp reversal.\n\n**DOGE:** RSI 61.1, modest uptrend. No compelling setup.\n\n**Portfolio Management:** With 1 position open (SOL) and account value at $9,231.89 (-7.68%), I should maintain current position and wait for SOL to reach profit target or stop-loss before considering new entries. Not adding new positions given current drawdown and lack of exceptional setups.\n\n# TRADING DECISIONS\n\n```json\n{\n  \"SOL\": {\n    \"trade_signal_args\": {\n      \"coin\": \"SOL\",\n      \"signal\": \"hold\",\n      \"quantity\": 6.0,\n      \"profit_target\": 197.5,\n      \"stop_loss\": 188.5,\n      \"invalidation_condition\": \"If price closes below 188.50 (below recent low of 189.29 and EMA20 support) on 3-minute candle\",\n      \"leverage\": 15,\n      \"confidence\": 0.72,\n      \"risk_usd\": 185.0\n    }\n  }\n}\n```",
      "signals": [
        {
          "coin": "SOL",
          "signal": "hold",
          "quantity": 6.0,
          "leverage": 15,
          "stop_loss": 188.5,
          "profit_target": 197.5,
          "confidence": 0.72,
          "risk_usd": 185.0,
          "invalidation_condition": "If price closes below 188.50 (below recent low of 189.29 and EMA20 support) on 3-minute candle"
        }
      ]
    },
    {
      "iteration": 52,
      "timestamp": "2025-10-25T12:00:00",
      "model": "anthropic",
      "raw_response": "# CHAIN OF THOUGHT\n\n## Current Position Analysis\n\n**SOL Position Review:**\n- Entry: $192.96, Current: $191.76 (down -$1.20 or -0.62%)\n- Unrealized P&L: -$7.78\n- Liquidation: $180.096\n- Exit Plan: Profit target $197.50, Stop-loss $188.50\n- Invalidation: \"If price closes below 188.50 (below recent low of 189.29 and EMA20 support) on 3-minute candle\"\n\n**Technical Analysis:**\n- Current price: $191.76 vs EMA20: $190.16 (still above EMA20 \u2713)\n- Recent low in data: $189.29 (current price above this \u2713)\n- RSI (7-period): 40.717 - showing weakness, dropped from 73.955 to 40.717\n- RSI (14-period): 54.558 - neutral territory\n- MACD: 2.072 - still positive but declining from 2.263\n- Price action: Dropped from $193.88 to $191.76 in last 2 candles\n\n**Invalidation Check:**\nThe invalidation condition states: \"If price closes below 188.50\"\n- Current price: $191.76\n- Stop-loss: $188.50\n- The price has NOT closed below $188.50 \u2713\n- Price remains above the recent low of $189.29 \u2713\n- Price remains above EMA20 support at $190.16 \u2713\n\n**Decision Rationale:**\nWhile SOL is showing weakness (RSI dropping sharply from 73.955 to 40.717), the invalidation condition has NOT been met. The price is still $3.26 above the stop-loss level and remains above key support levels (EMA20 at $190.16 and recent low at $189.29). The position is only down 0.62%, which is within acceptable drawdown. The MACD remains positive, suggesting the uptrend structure is still intact despite the pullback.\n\n**Risk Management:**\n- Current risk exposure: $1,150.56 notional (within limits)\n- Stop-loss properly set at $188.50\n- Position size: 6 SOL with 15x leverage (reasonable)\n- Account value: $9,226.19 with $9,157.26 cash available\n\n**Other Coins Assessment:**\n- **XRP**: Extremely overbought (RSI 98.295!) - dangerous to enter, likely reversal imminent\n- **BTC**: Strong uptrend but already extended (RSI 63.664), no clear entry setup\n- **ETH**: Consolidating above EMA20, but no compelling entry signal\n- **BNB**: Showing weakness (RSI 38.957), below recent highs\n- **DOGE**: Weak (RSI 37.035), no clear trend\n\n**Conclusion:**\nHOLD SOL position. The invalidation condition has not been triggered. Price remains above all critical support levels. While momentum has weakened, the technical structure remains intact. Will monitor closely for a break below $188.50 which would trigger immediate exit.\n\n# TRADING DECISIONS\n\n```json\n{\n  \"SOL\": {\n    \"trade_signal_args\": {\n      \"coin\": \"SOL\",\n      \"signal\": \"hold\",\n      \"quantity\": 6.0,\n      \"profit_target\": 197.5,\n      \"stop_loss\": 188.5,\n      \"invalidation_condition\": \"If price closes below 188.50 (below recent low of 189.29 and EMA20 support) on 3-minute candle\",\n      \"leverage\": 15,\n      \"confidence\": 0.72,\n      \"risk_usd\": 185.0\n    }\n  }\n}\n```",
      "signals": [
        {
          "coin": "SOL",
          "signal": "hold",
          "quantity": 6.0,
          "leverage": 15,
          "stop_loss": 188.5,
          "profit_target": 197.5,
          "confidence": 0.72,
          "risk_usd": 185.0,
          "invalidation_condition": "If price closes below 188.50 (below recent low of 189.29 and EMA20 support) on 3-minute candle"
        }
      ]
    },
    {
      "iteration": 53,
      "timestamp": "2025-10-25T16:00:00",
      "model": "anthropic",
      "raw_response": "# CHAIN OF THOUGHT\n\n## Current Position Analysis\n\n**SOL Position Review:**\n- Entry: $192.96, Current: $194.42 (+0.76%)\n- Unrealized PnL: +$8.18\n- Profit Target: $197.50 (1.58% away)\n- Stop Loss: $188.50 (3.05% away)\n- Invalidation Condition: \"If price closes below 188.50 (below recent low of 189.29 and EMA20 support) on 3-minute candle\"\n\n**Technical Analysis for SOL:**\n- Current price $194.42 is ABOVE invalidation level of $188.50 \u2713\n- Recent low in the data is $189.29 - we're $5.13 above that \u2713\n- Current EMA20: $190.42 - price is $4.00 above EMA20, showing strength \u2713\n- RSI(7): 68.512 - elevated but not extremely overbought\n- RSI(14): 67.621 - healthy momentum zone\n- MACD: 2.344 - positive and increasing trend\n- Price action: Recent dip to $191.76 but recovered to $194.42\n- EMA20 trending up: 189.82 \u2192 190.00 \u2192 190.42\n\n**Invalidation Check:** \nThe invalidation condition is NOT met. Price has not closed below $188.50. The lowest recent price was $189.29, and current price is $194.42. The position remains valid.\n\n**Decision Rationale:**\n- Position is profitable (+$8.18)\n- No invalidation trigger\n- Price holding above EMA20 support\n- MACD positive and increasing\n- RSI in healthy range (not oversold, not extremely overbought)\n- Stop loss not threatened\n- Profit target ($197.50) is reasonable and within reach given current momentum\n\n**Risk Management:**\n- Current exposure: $1,166.52 notional (15x leverage on 6 SOL)\n- Account value: $9,243.21\n- Position size: 12.6% of account - reasonable\n- Sharpe ratio negative but improving with this profitable trade\n\n**Other Coins Assessment:**\n- **XRP**: RSI(7) at 98.461 - EXTREMELY overbought, dangerous to enter\n- **BTC**: RSI(7) at 72.060 - overbought, already at $111,669\n- **ETH**: RSI(7) at 72.267 - overbought conditions\n- **BNB**: RSI(7) at 56.614 - neutral but no clear setup\n- **DOGE**: RSI(7) at 56.383 - neutral, choppy price action\n\nNo new positions warranted. Market showing overbought conditions across major coins except for the SOL position I'm already in, which is performing well.\n\n**Final Decision: HOLD SOL** - All conditions favorable, no exit triggers met.\n\n# TRADING DECISIONS\n\n```json\n{\n  \"SOL\": {\n    \"trade_signal_args\": {\n      \"coin\": \"SOL\",\n      \"signal\": \"hold\",\n      \"quantity\": 6.0,\n      \"profit_target\": 197.50,\n      \"stop_loss\": 188.50,\n      \"invalidation_condition\": \"If price closes below 188.50 (below recent low of 189.29 and EMA20 support) on 3-minute candle\",\n      \"leverage\": 15,\n      \"confidence\": 0.72,\n      \"risk_usd\": 185.0\n    }\n  }\n}\n```",
      "signals": [
        {
          "coin": "SOL",
          "signal": "hold",
          "quantity": 6.0,
          "leverage": 15,
          "stop_loss": 188.5,
          "profit_target": 197.5,
          "confidence": 0.72,
          "risk_usd": 185.0,
          "invalidation_condition": "If price closes below 188.50 (below recent low of 189.29 and EMA20 support) on 3-minute candle"
        }
      ]
    },
    {
      "iteration": 54,
      "timestamp": "2025-10-25T20:00:00",
      "model": "anthropic",
      "raw_response": "# CHAIN OF THOUGHT\n\n## Current Position Analysis\n\n### SOL Position Review\n- **Entry**: 192.96, **Current**: 193.76 (+0.41%)\n- **Unrealized PnL**: +$4.22\n- **Leverage**: 15x\n- **Exit Plan**: Profit target 197.5, Stop-loss 188.5\n- **Invalidation Condition**: \"If price closes below 188.50 (below recent low of 189.29 and EMA20 support) on 3-minute candle\"\n\n**Technical Analysis**:\n- Current price: 193.76\n- EMA20: 190.24 (price above EMA - bullish)\n- Recent low in data: 189.29 (well above invalidation level)\n- RSI (7-period): 59.513 (neutral, not overbought)\n- RSI (14-period): 64.409 (healthy bullish)\n- MACD: 2.991 (positive, trending up)\n- Price action: Showing consolidation around 193-194 range\n\n**Invalidation Check**: \n- Invalidation level: 188.50\n- Lowest price in last 10 candles: 189.29\n- Current price: 193.76\n- **Status**: NOT INVALIDATED - price has NOT closed below 188.50\n\n**Decision Factors**:\n1. Position is slightly profitable (+$4.22)\n2. No invalidation condition met\n3. Price holding above EMA20 support (190.24)\n4. RSI not overbought, room to move higher\n5. MACD positive and stable\n6. Not near stop-loss (188.5) or profit target (197.5)\n7. Trend remains intact\n\n**Decision**: HOLD - All conditions support maintaining the position. The trade thesis remains valid with price above EMA20, no invalidation triggered, and technical indicators showing continued bullish momentum.\n\n## Other Coins Assessment\n\n**BTC**: RSI 72.7 (overbought), strong uptrend but extended. No position, not entering at these levels.\n\n**ETH**: RSI 67.6, positive MACD, above EMA20. Decent setup but portfolio already has SOL exposure.\n\n**BNB**: RSI 57.6, weakening MACD, choppy price action. Not compelling.\n\n**XRP**: RSI 83.9 (extremely overbought), parabolic move. Too risky to enter here.\n\n**DOGE**: RSI 43.5, losing momentum, MACD weak. Not attractive.\n\n**Risk Management**: With only one position at 15x leverage representing ~12.6% of account value, risk is controlled. Maintaining current position is appropriate.\n\n# TRADING DECISIONS\n\n```json\n{\n  \"SOL\": {\n    \"trade_signal_args\": {\n      \"coin\": \"SOL\",\n      \"signal\": \"hold\",\n      \"quantity\": 6.0,\n      \"profit_target\": 197.5,\n      \"stop_loss\": 188.5,\n      \"invalidation_condition\": \"If price closes below 188.50 (below recent low of 189.29 and EMA20 support) on 3-minute candle\",\n      \"leverage\": 15,\n      \"confidence\": 0.72,\n      \"risk_usd\": 185.0\n    }\n  }\n}\n```",
      "signals": [
        {
          "coin": "SOL",
          "signal": "hold",
          "quantity": 6.0,
          "leverage": 15,
          "stop_loss": 188.5,
          "profit_target": 197.5,
          "confidence": 0.72,
          "risk_usd": 185.0,
          "invalidation_condition": "If price closes below 188.50 (below recent low of 189.29 and EMA20 support) on 3-minute candle"
        }
      ]
    },
    {
      "iteration": 55,
      "timestamp": "2025-10-26T00:00:00",
      "model": "anthropic",
      "raw_response": "# CHAIN OF THOUGHT\n\n## Current Position Analysis\n\n**SOL Position Review:**\n- Entry: $192.96, Current: $192.91 (down $0.05, -0.03%)\n- Unrealized PnL: -$0.88\n- Leverage: 15x\n- Stop-loss: $188.50\n- Profit target: $197.50\n- Invalidation condition: \"If price closes below 188.50 (below recent low of 189.29 and EMA20 support) on 3-minute candle\"\n\n**Technical Analysis:**\n- Current price: $192.91 vs EMA20: $190.47 \u2713 (still above)\n- RSI (7-period): 48.349 (neutral, down from 59.525)\n- RSI (14-period): 57.953 (neutral)\n- MACD: 2.868 (positive but declining from 3.023)\n- Recent price action: Pulled back from $194.42 high to $192.91\n- Price remains above the critical $189.29 low mentioned in invalidation\n\n**Invalidation Check:**\nThe invalidation condition states \"below 188.50\" - current price is $192.91, well above this level. The recent low in the data is $189.29, which is also above the invalidation threshold. The position is NOT invalidated.\n\n**Risk Assessment:**\n- Price is consolidating near entry, showing indecision\n- RSI cooling off from overbought levels (was 75.171, now 48.349)\n- Still trading above EMA20 support at $190.47\n- MACD positive but weakening slightly\n- Stop-loss at $188.50 provides 2.3% cushion from current price\n\n**Decision: HOLD**\nThe invalidation condition has NOT been met. Price remains above both the $188.50 stop-loss and the $189.29 recent low. While momentum has cooled, the technical structure remains intact with price above EMA20. The position is still valid and within acceptable risk parameters.\n\n## Other Coins Assessment\n\n**BTC:** Strong uptrend but RSI dropped sharply to 44.918 from 72.836, suggesting pullback. Price at $111,271 above EMA20 at $110,495. Not entering - prefer to see momentum stabilize.\n\n**ETH:** Similar pattern - RSI dropped to 43.967 from 67.554. Price at $3,931.30 above EMA20 at $3,906.20. Momentum fading.\n\n**BNB:** RSI at 58.942, price above EMA20. Modest uptrend but not compelling enough for entry.\n\n**XRP:** RSI extremely overbought at 85.824 (was 98.771). Price at $2.60, strong rally but overextended. High risk of pullback.\n\n**DOGE:** RSI crashed to 27.751 from 70.742 - significant bearish momentum. Price at $0.1949 below EMA20 at $0.1953. Avoid.\n\nNo new positions warranted - market showing mixed signals with cooling momentum across most assets.\n\n# TRADING DECISIONS\n\n```json\n{\n  \"SOL\": {\n    \"trade_signal_args\": {\n      \"coin\": \"SOL\",\n      \"signal\": \"hold\",\n      \"quantity\": 6.0,\n      \"profit_target\": 197.5,\n      \"stop_loss\": 188.5,\n      \"invalidation_condition\": \"If price closes below 188.50 (below recent low of 189.29 and EMA20 support) on 3-minute candle\",\n      \"leverage\": 15,\n      \"confidence\": 0.72,\n      \"risk_usd\": 185.0\n    }\n  }\n}\n```",
      "signals": [
        {
          "coin": "SOL",
          "signal": "hold",
          "quantity": 6.0,
          "leverage": 15,
          "stop_loss": 188.5,
          "profit_target": 197.5,
          "confidence": 0.72,
          "risk_usd": 185.0,
          "invalidation_condition": "If price closes below 188.50 (below recent low of 189.29 and EMA20 support) on 3-minute candle"
        }
      ]
    },
    {
      "iteration": 56,
      "timestamp": "2025-10-26T04:00:00",
      "model": "anthropic",
      "raw_response": "# CHAIN OF THOUGHT\n\n## Current Position Analysis\n\n### SOL Position Review\n- **Entry**: 192.96, **Current**: 193.77 (+0.42%)\n- **Unrealized PnL**: +$4.28\n- **Liquidation**: 180.096, **Stop-loss**: 188.5, **Profit Target**: 197.5\n- **Invalidation Condition**: \"If price closes below 188.50 (below recent low of 189.29 and EMA20 support) on 3-minute candle\"\n\n**Technical Analysis**:\n- Current price: 193.77 vs EMA20: 191.16 \u2713 (above support)\n- RSI (7-period): 58.673 (neutral, healthy)\n- RSI (14-period): 61.538 (bullish but not overbought)\n- MACD: 2.283 (positive, trending up)\n- Price action: Recovered from 191.76 low, showing resilience\n- Recent price trajectory: 192.96 \u2192 193.50 \u2192 193.40 \u2192 193.88 \u2192 192.65 \u2192 191.76 \u2192 194.42 \u2192 193.76 \u2192 192.91 \u2192 193.77\n\n**Invalidation Check**: \n- Lowest recent price was 191.76, well above invalidation level of 188.50 \u2713\n- Currently trading above EMA20 (191.16) \u2713\n- No closes below 188.50 \u2713\n- **Invalidation condition NOT met**\n\n**Decision**: **HOLD** - Position is performing well, no exit conditions triggered. Price is consolidating above support with bullish momentum intact. Profit target at 197.5 is reasonable given current momentum.\n\n## Other Coins Assessment\n\n### BTC\n- Price: 111,756, EMA20: 110,729 (above support)\n- RSI: 65.5 (bullish but not extreme)\n- MACD: 733.4 (strong positive)\n- Strong uptrend but already near highs\n- **No position, not entering** - Late in trend, prefer better entry\n\n### ETH\n- Price: 3,951.50, EMA20: 3,913.42 (above support)\n- RSI: 60.4 (neutral-bullish)\n- MACD: 27.7 (positive)\n- Decent setup but momentum less clear\n- **No position, not entering** - Prefer clearer signals\n\n### BNB\n- Price: 1,120, EMA20: 1,111.26 (above support)\n- RSI: 68.0 (getting overbought)\n- MACD: 5.538 (positive but declining from 8.2)\n- **No position, not entering** - MACD divergence concerning\n\n### XRP\n- Price: 2.62, EMA20: 2.51 (strong breakout)\n- RSI: **90.990** (extremely overbought!)\n- RSI (14-period): **90.975** (extremely overbought!)\n- MACD: 0.058 (positive)\n- **No position, not entering** - Parabolic move, RSI >90 = extreme risk of pullback\n\n### DOGE\n- Price: 0.1966, EMA20: 0.1956 (barely above)\n- RSI: 52.9 (neutral)\n- MACD: 0.001 (barely positive)\n- Weak momentum, choppy action\n- **No position, not entering** - No clear edge\n\n## Risk Management Summary\n- Current account value: $9,239.05\n- Available cash: $9,157.26\n- Open position: SOL ($1,162.62 notional, $4.28 profit)\n- Portfolio utilization: ~12.6% (conservative)\n- Sharpe ratio: -3.098 (need to improve)\n\n**Strategy**: Maintain SOL position as it's working and respect the exit plan. Market conditions are mixed with some coins overbought (XRP extreme). Conservative approach is appropriate given current drawdown.\n\n# TRADING DECISIONS\n\n```json\n{\n  \"SOL\": {\n    \"trade_signal_args\": {\n      \"coin\": \"SOL\",\n      \"signal\": \"hold\",\n      \"quantity\": 6.0,\n      \"profit_target\": 197.5,\n      \"stop_loss\": 188.5,\n      \"invalidation_condition\": \"If price closes below 188.50 (below recent low of 189.29 and EMA20 support) on 3-minute candle\",\n      \"leverage\": 15,\n      \"confidence\": 0.72,\n      \"risk_usd\": 185.0\n    }\n  }\n}\n```",
      "signals": [
        {
          "coin": "SOL",
          "signal": "hold",
          "quantity": 6.0,
          "leverage": 15,
          "stop_loss": 188.5,
          "profit_target": 197.5,
          "confidence": 0.72,
          "risk_usd": 185.0,
          "invalidation_condition": "If price closes below 188.50 (below recent low of 189.29 and EMA20 support) on 3-minute candle"
        }
      ]
    },
    {
      "iteration": 57,
      "timestamp": "2025-10-26T08:00:00",
      "model": "anthropic",
      "raw_response": "# CHAIN OF THOUGHT\n\n## Current Portfolio Status\n- No open positions\n- Available cash: $9,262.20\n- Portfolio down -7.38% with negative Sharpe ratio (-2.689)\n- Need to be selective and find high-probability setups to recover\n\n## Market Analysis by Coin\n\n**BTC Analysis:**\n- Current: $113,309 (up $2,249 in last candle - massive spike)\n- RSI (7): 86.76 - EXTREMELY overbought\n- RSI (14): 81.27 - also overbought\n- MACD: 685.37 (surged from 560.24) - strong momentum but parabolic\n- Price above EMA20 ($111,098) by 2%\n- This is a blow-off top pattern - price spiked from $111,756 to $113,309 in one 3-min candle\n- Risk: Immediate pullback likely after such extreme move\n- **Decision: PASS** - Too risky to chase at these levels\n\n**ETH Analysis:**\n- Current: $4,045.20 (up $93.70 in last candle - huge spike)\n- RSI (7): 85.97 - extremely overbought\n- RSI (14): 78.59 - overbought\n- MACD: 25.10 (jumped from 17.42) - strong acceleration\n- Price above EMA20 ($3,933) by 2.8%\n- Similar blow-off pattern to BTC - spiked from $3,951 to $4,045\n- **Decision: PASS** - Same concern as BTC, too extended\n\n**SOL Analysis:**\n- Current: $197.78 (up $4.01 in last candle)\n- RSI (7): 81.66 - overbought but less extreme\n- RSI (14): 75.02 - overbought\n- MACD: 1.71 (rising steadily)\n- Price above EMA20 ($192.41) by 2.8%\n- Volume: 599K vs avg 486K (23% above average)\n- More measured move than BTC/ETH\n- **Decision: PASS** - Still too extended for entry\n\n**BNB Analysis:**\n- Current: $1,135.10 (up $15.10 in last candle)\n- RSI (7): 86.27 - extremely overbought\n- RSI (14): 71.26 - overbought\n- MACD: 2.78 (doubled from 1.30) - parabolic acceleration\n- Price above EMA20 ($1,116.54) by 1.7%\n- Similar blow-off pattern\n- **Decision: PASS** - Too risky at these levels\n\n**XRP Analysis:**\n- Current: $2.65 (up $0.03 in last candle)\n- RSI (7): 94.00 - DANGEROUSLY overbought (near 100!)\n- RSI (14): 92.60 - extremely overbought\n- MACD: 0.056 (steady uptrend)\n- Price above EMA20 ($2.53) by 4.7%\n- RSI has been >90 for multiple candles - this is unsustainable\n- **Decision: PASS** - Most overbought of all coins, imminent reversal risk\n\n**DOGE Analysis:**\n- Current: $0.20176 (up $0.00516 in last candle - 2.6% spike)\n- RSI (7): 80.48 - overbought\n- RSI (14): 73.23 - moderately overbought\n- MACD: 0.001 (positive but flat)\n- Price above EMA20 ($0.19655) by 2.7%\n- Volume: 14.6M vs avg 13.7M (6.5% above average)\n- **Decision: PASS** - Also extended after spike\n\n## Risk Management Assessment\n\nAll coins are showing extreme overbought conditions with parabolic moves in the last 3-minute candle. This is characteristic of a coordinated market pump across crypto markets. The prudent approach is to:\n\n1. **Wait for pullback** - These RSI levels (80-94) typically lead to corrections\n2. **Avoid FOMO** - Chasing these moves has high probability of getting caught in reversal\n3. **Preserve capital** - Already down 7.38%, need high-probability setups\n4. **Look for reentry** - If prices pull back to EMA20 or support levels with RSI <60\n\nThe market is showing classic blow-off top characteristics across all major coins simultaneously. This suggests either:\n- A major news event driving coordinated buying\n- Algorithmic/institutional buying across the board\n- Potential for sharp reversal when momentum exhausts\n\n**FINAL DECISION: No trades this cycle. Wait for healthier entry points.**\n\n# TRADING DECISIONS\n\n{}",
      "signals": []
    },
    {
      "iteration": 58,
      "timestamp": "2025-10-26T12:00:00",
      "model": "anthropic",
      "raw_response": "# CHAIN OF THOUGHT\n\n## Current Portfolio Status\n- No open positions currently\n- Available cash: $9,262.20\n- Portfolio down -7.38% (poor Sharpe ratio of -2.689)\n- Need to be selective and disciplined with entries\n\n## Market Analysis by Coin\n\n### BTC Analysis\n- **Price action**: Strong rally from 111,057 to 113,734 (+2.4% in 30 minutes)\n- **Technical indicators**:\n  - RSI(7): 89.2 - EXTREMELY overbought (danger zone)\n  - RSI(14): 83.6 - Also overbought\n  - MACD: 814.2 - Strong positive momentum but accelerating\n  - Price 2.1% above EMA20 (111,346)\n- **Concern**: RSI above 85 typically signals exhaustion. While momentum is strong, risk of sharp pullback is high\n- **Decision**: PASS - Too late to chase, overbought conditions\n\n### ETH Analysis\n- **Price action**: Similar pattern, rallied from 3,921 to 4,074 (+3.9%)\n- **Technical indicators**:\n  - RSI(7): 89.0 - EXTREMELY overbought\n  - RSI(14): 82.1 - Overbought\n  - MACD: 36.1 - Strong momentum\n  - Price 3.3% above EMA20 (3,944)\n- **Concern**: Same issue as BTC - extreme overbought readings\n- **Decision**: PASS - Chasing at these levels is dangerous\n\n### SOL Analysis\n- **Price action**: Rally from 193.40 to 199.44 (+3.1%)\n- **Technical indicators**:\n  - RSI(7): 86.0 - EXTREMELY overbought\n  - RSI(14): 78.8 - Overbought\n  - MACD: 1.958 - Positive momentum\n  - Price 3.3% above EMA20 (193.15)\n- **Decision**: PASS - Overbought conditions\n\n### BNB Analysis\n- **Price action**: More modest rally from 1,116 to 1,133 (+1.5%)\n- **Technical indicators**:\n  - RSI(7): 80.0 - Overbought but not extreme\n  - RSI(14): 70.2 - Just entering overbought\n  - MACD: 6.398 - Building momentum\n  - Price 1.5% above EMA20 (1,116)\n- **Assessment**: Least overbought of the majors, but still extended\n- **Decision**: PASS - Wait for better entry\n\n### XRP Analysis\n- **Price action**: Strong rally from 2.54 to 2.64 (+3.9%)\n- **Technical indicators**:\n  - RSI(7): 84.6 - EXTREMELY overbought (was 99.1 earlier!)\n  - RSI(14): 88.5 - EXTREMELY overbought\n  - MACD: 0.061 - Strong momentum\n  - Price 3.9% above EMA20 (2.54)\n- **Concern**: RSI readings above 90 on 14-period indicate parabolic move\n- **Decision**: PASS - Extreme overbought, high risk of reversal\n\n### DOGE Analysis\n- **Price action**: Rally from 0.1949 to 0.2030 (+4.2%)\n- **Technical indicators**:\n  - RSI(7): 83.6 - Overbought\n  - RSI(14): 76.4 - Approaching overbought\n  - MACD: 0.001 - Positive but modest\n  - Price 3.0% above EMA20 (0.1971)\n- **Decision**: PASS - Overbought conditions\n\n## Risk Management Assessment\nGiven my current -7.38% drawdown and poor Sharpe ratio, I need to be extremely selective. All coins are showing overbought conditions with RSI(7) readings above 80. This is a classic \"FOMO\" moment where chasing could lead to immediate losses.\n\n**The prudent decision is to wait for:**\n1. Pullbacks to support levels (EMA20 or below)\n2. RSI cooling to 60-70 range\n3. Consolidation patterns that offer better risk/reward\n\nEntering at current levels would violate sound risk management principles. Better to miss a move than to enter at the top and suffer further losses.\n\n## Final Decision\n**NO TRADES** - All coins are extended and overbought. Wait for better entry opportunities with improved risk/reward ratios.\n\n# TRADING DECISIONS\n\n{}",
      "signals": []
    },
    {
      "iteration": 59,
      "timestamp": "2025-10-26T16:00:00",
      "model": "anthropic",
      "raw_response": "# CHAIN OF THOUGHT\n\n## Current Portfolio Status\n- No open positions\n- Available cash: $9,262.20\n- Total return: -7.38% (down from $10,000 starting capital)\n- Sharpe ratio: -2.689 (poor risk-adjusted returns)\n\n## Market Analysis\n\n**BTC Analysis:**\n- Current: $113,637 | EMA20: $111,651 (price +1.78% above EMA)\n- RSI(7): 84.4 - EXTREMELY overbought\n- RSI(14): 80.7 - Also overbought\n- MACD: 778.26 - strong positive momentum but accelerating rapidly\n- Price action: Explosive move from $111,271 to $113,734 in recent candles\n- Risk: Classic parabolic move with extreme RSI readings suggests imminent pullback\n- Decision: **AVOID** - Too late to chase, high probability of reversal\n\n**ETH Analysis:**\n- Current: $4,067.30 | EMA20: $3,958.17 (price +2.76% above EMA)\n- RSI(7): 82.9 - Extremely overbought\n- RSI(14): 78.6 - Overbought\n- MACD: 38.75 - strong positive momentum\n- Similar pattern to BTC - explosive rally from $3,931 to $4,074\n- Decision: **AVOID** - Same concerns as BTC, extended move\n\n**SOL Analysis:**\n- Current: $198.79 | EMA20: $194.11 (price +2.41% above EMA)\n- RSI(7): 76.5 - Overbought but cooling from 85.9\n- RSI(14): 73.1 - Moderately overbought\n- MACD: 1.606 - positive and building\n- Price pulled back from $199.44 high, showing some consolidation\n- Decision: **AVOID** - Still overbought, wait for better entry\n\n**BNB Analysis:**\n- Current: $1,126.20 | EMA20: $1,122.00 (price +0.37% above EMA)\n- RSI(7): 54.6 - NEUTRAL zone (ideal for entry consideration)\n- RSI(14): 55.8 - Neutral\n- MACD: -0.046 - Near zero, turning positive\n- Price action: Pulled back from $1,135 spike, now consolidating\n- Volume: Below average (6,011 vs 8,299 avg)\n- Decision: **POTENTIAL ENTRY** - Most balanced risk/reward, RSI reset\n\n**XRP Analysis:**\n- Current: $2.61 | EMA20: $2.55 (price +2.35% above EMA)\n- RSI(7): 51.9 - NEUTRAL (major cooldown from 99+ readings)\n- RSI(14): 68.3 - Still elevated but cooling\n- MACD: 0.056 - positive but flattening\n- Price pulled back from $2.65 to $2.61, healthy consolidation\n- Decision: **POTENTIAL ENTRY** - RSI reset makes this attractive\n\n**DOGE Analysis:**\n- Current: $0.20176 | EMA20: $0.19781 (price +2.00% above EMA)\n- RSI(7): 69.0 - Approaching overbought\n- RSI(14): 67.5 - Moderately elevated\n- MACD: 0.001 - positive but weak\n- Price consolidating after spike to $0.20299\n- Decision: **AVOID** - Less attractive than XRP/BNB\n\n## Risk Management Considerations\nGiven my -7.38% drawdown and poor Sharpe ratio, I need to be selective. The broad market is overbought (BTC/ETH/SOL all RSI 75+), suggesting a potential pullback is near.\n\n**Best opportunities:** BNB and XRP have reset their RSI levels while maintaining uptrends. These offer the best risk/reward for new entries.\n\n**Strategy:** Enter ONE position (not both) to limit risk exposure. XRP shows stronger momentum and cleaner RSI reset from extreme levels.\n\n## Trade Decision: XRP Long Entry\n\n**Entry rationale:**\n- RSI(7) cooled from 99+ to 51.9 (massive reset)\n- Price still above rising EMA20 ($2.61 vs $2.55)\n- MACD remains positive (0.056)\n- Healthy pullback from $2.65 to $2.61 provides better entry\n- Strong volume (5.86M vs 4.99M avg)\n\n**Risk parameters:**\n- Entry: $2.61\n- Stop-loss: $2.52 (below EMA20, -3.45% risk)\n- Profit target: $2.75 (+5.36% reward, 1.55:1 R/R)\n- Position size: ~1,500 XRP at 15x leverage = ~$3,915 notional\n- Risk: $135 (1.46% of capital)\n- Invalidation: Close below $2.50 on 3-minute candle\n\n# TRADING DECISIONS\n\n```json\n{\n  \"XRP\": {\n    \"trade_signal_args\": {\n      \"coin\": \"XRP\",\n      \"signal\": \"buy\",\n      \"quantity\": 1500,\n      \"profit_target\": 2.75,\n      \"stop_loss\": 2.52,\n      \"invalidation_condition\": \"If price closes below $2.50 on 3-minute candle, indicating breakdown of uptrend structure\",\n      \"leverage\": 15,\n      \"confidence\": 0.72,\n      \"risk_usd\": 135\n    }\n  }\n}\n```",
      "signals": [
        {
          "coin": "XRP",
          "signal": "buy",
          "quantity": 1500.0,
          "leverage": 15,
          "stop_loss": 2.52,
          "profit_target": 2.75,
          "confidence": 0.72,
          "risk_usd": 135.0,
          "invalidation_condition": "If price closes below $2.50 on 3-minute candle, indicating breakdown of uptrend structure"
        }
      ]
    },
    {
      "iteration": 60,
      "timestamp": "2025-10-26T20:00:00",
      "model": "anthropic",
      "raw_response": "# CHAIN OF THOUGHT\n\nReviewing my current XRP position and market conditions:\n\n**XRP Position Analysis:**\n- Entry: $2.6132, Current: $2.6457 (+1.24%)\n- Unrealized P&L: +$46.79\n- Leverage: 15x\n- Stop-loss: $2.52\n- Profit target: $2.75\n- Invalidation condition: \"If price closes below $2.50 on 3-minute candle\"\n\n**Technical Analysis:**\n- Current price $2.65 is ABOVE the $2.50 invalidation level \u2713\n- RSI (7-period): 70.165 - elevated but not extreme overbought\n- RSI (14-period): 75.878 - showing strength\n- MACD: 0.057 - positive and rising\n- Price above EMA20 ($2.56) - bullish structure intact\n- Recent price action: Consolidating between $2.60-$2.65 after strong rally\n- Volume: 9.36M vs avg 5.18M - elevated interest\n\n**Invalidation Check:**\nThe invalidation condition is NOT met. Price has NOT closed below $2.50. The recent low was $2.56, well above the invalidation threshold. The uptrend structure remains intact.\n\n**Risk Assessment:**\n- Stop-loss at $2.52 is reasonable distance from current $2.65\n- Position is profitable but not near profit target ($2.75)\n- No bearish reversal signals evident\n- Market momentum remains positive\n\n**Decision: HOLD**\nThe position is performing well, invalidation condition is not triggered, and technical indicators support continuation. The RSI is elevated but not at extreme levels that would warrant profit-taking. I'll maintain the position and let it run toward the $2.75 profit target.\n\n**Other Coins:**\n- BTC: RSI 90.863 - extremely overbought, would be risky to enter\n- ETH: RSI 91.977 - extremely overbought, would be risky to enter  \n- SOL: RSI 81.699 - overbought\n- BNB: RSI 73.134 - elevated\n- DOGE: RSI 82.222 - overbought\n\nAll other coins are showing overbought conditions. Given my current XRP exposure and the extended nature of these moves, I will not open new positions at this time.\n\n# TRADING DECISIONS\n\n```json\n{\n  \"XRP\": {\n    \"trade_signal_args\": {\n      \"coin\": \"XRP\",\n      \"signal\": \"hold\",\n      \"quantity\": 1500.0,\n      \"profit_target\": 2.75,\n      \"stop_loss\": 2.52,\n      \"invalidation_condition\": \"If price closes below $2.50 on 3-minute candle, indicating breakdown of uptrend structure\",\n      \"leverage\": 15,\n      \"confidence\": 0.72,\n      \"risk_usd\": 135.0\n    }\n  }\n}\n```",
      "signals": [
        {
          "coin": "XRP",
          "signal": "hold",
          "quantity": 1500.0,
          "leverage": 15,
          "stop_loss": 2.52,
          "profit_target": 2.75,
          "confidence": 0.72,
          "risk_usd": 135.0,
          "invalidation_condition": "If price closes below $2.50 on 3-minute candle, indicating breakdown of uptrend structure"
        }
      ]
    },
    {
      "iteration": 61,
      "timestamp": "2025-10-27T00:00:00",
      "model": "anthropic",
      "raw_response": "# CHAIN OF THOUGHT\n\n## Current Position Analysis\n\n### XRP Position Review\n- **Entry**: $2.6132, **Current**: $2.6345 (+0.81%)\n- **Unrealized P&L**: +$29.99 (small profit)\n- **Stop-loss**: $2.52, **Profit target**: $2.75\n- **Invalidation condition**: \"If price closes below $2.50 on 3-minute candle\"\n\n**Technical Analysis**:\n- Current price: $2.63 (well above invalidation at $2.50)\n- RSI (7-period): 59.8 - healthy level, no longer overbought\n- RSI (14-period): 69.8 - approaching overbought but not extreme\n- MACD: 0.058 - positive and stable\n- Price above EMA20 ($2.56) - bullish short-term trend\n- Recent price action: $2.65 \u2192 $2.61 \u2192 $2.65 \u2192 $2.63 (consolidating after spike)\n\n**Invalidation Check**: \n- Latest close: $2.63\n- Invalidation level: $2.50\n- **Status**: NOT MET - price is $0.13 above invalidation level\n\n**Risk Assessment**:\n- Position is $0.11 away from stop-loss ($2.52)\n- Position is $0.12 away from profit target ($2.75)\n- Risk/reward ratio is roughly balanced at current levels\n- RSI cooling off from extreme overbought readings (was 100, now 59.8)\n- MACD showing sustained positive momentum\n\n**Decision**: **HOLD** - The invalidation condition has NOT been met. Price remains well above $2.50, technical indicators show healthy consolidation after a strong move, and the position is in profit. The RSI pullback from extreme levels is healthy and doesn't signal a reversal. No exit conditions are triggered.\n\n## Market Opportunities Assessment\n\n### BTC Analysis\n- Price: $115,050 (+3.3% in last 30 mins)\n- RSI (7): 92.76 - **EXTREMELY OVERBOUGHT**\n- RSI (14): 87.87 - also very overbought\n- MACD: 1022.46 - strong momentum but at extremes\n- Price $2,804 above EMA20 - extended move\n- **Decision**: NO ENTRY - Dangerously overbought, high risk of sharp pullback\n\n### ETH Analysis\n- Price: $4,206.10 (+6.9% in last 30 mins)\n- RSI (7): 94.04 - **EXTREMELY OVERBOUGHT**\n- RSI (14): 89.25 - also very overbought\n- MACD: 65.17 - strong but stretched\n- Price $209 above EMA20 - very extended\n- **Decision**: NO ENTRY - Same as BTC, extreme overbought conditions\n\n### SOL Analysis\n- Price: $204.39 (+6.6% in last 30 mins)\n- RSI (7): 90.92 - **EXTREMELY OVERBOUGHT**\n- RSI (14): 84.51 - overbought\n- **Decision**: NO ENTRY - Overbought, chasing momentum here is risky\n\n### BNB Analysis\n- Price: $1,151.40 (+3.9% in last 30 mins)\n- RSI (7): 83.35 - overbought but less extreme\n- RSI (14): 75.87 - elevated but manageable\n- **Decision**: NO ENTRY - Still overbought, not compelling enough\n\n### DOGE Analysis\n- Price: $0.2068 (+5.5% in last 30 mins)\n- RSI (7): 84.70 - overbought\n- RSI (14): 79.37 - overbought\n- **Decision**: NO ENTRY - Overbought conditions\n\n## Overall Portfolio Strategy\n\nCurrent portfolio: -7.08% return, Sharpe ratio -2.689 (poor risk-adjusted performance)\n- Only 1 position open (XRP) with small profit\n- $8,998.92 cash available (96.8% in cash)\n- Market showing extreme momentum across all coins but at dangerous overbought levels\n\n**Risk Management Considerations**:\n- All major coins showing RSI (7) above 83, many above 90 - unsustainable levels\n- This looks like a blow-off top or euphoric buying that could reverse sharply\n- Better to preserve capital and wait for pullback or consolidation\n- XRP position is healthiest with RSI cooling to 59.8, justifying the hold\n\n# TRADING DECISIONS\n\n```json\n{\n  \"XRP\": {\n    \"trade_signal_args\": {\n      \"coin\": \"XRP\",\n      \"signal\": \"hold\",\n      \"quantity\": 1500.0,\n      \"profit_target\": 2.75,\n      \"stop_loss\": 2.52,\n      \"invalidation_condition\": \"If price closes below $2.50 on 3-minute candle, indicating breakdown of uptrend structure\",\n      \"leverage\": 15,\n      \"confidence\": 0.72,\n      \"risk_usd\": 135.0\n    }\n  }\n}\n```",
      "signals": [
        {
          "coin": "XRP",
          "signal": "hold",
          "quantity": 1500.0,
          "leverage": 15,
          "stop_loss": 2.52,
          "profit_target": 2.75,
          "confidence": 0.72,
          "risk_usd": 135.0,
          "invalidation_condition": "If price closes below $2.50 on 3-minute candle, indicating breakdown of uptrend structure"
        }
      ]
    },
    {
      "iteration": 62,
      "timestamp": "2025-10-27T04:00:00",
      "model": "anthropic",
      "raw_response": "# CHAIN OF THOUGHT\n\nReviewing my current position:\n\n**XRP Analysis:**\n- Current price: $2.63, Entry: $2.6132\n- Unrealized PnL: +$22.19 (+0.57%)\n- Position: 1500 XRP @ 15x leverage = $3,943.95 notional\n- Exit plan: Profit target $2.75, Stop-loss $2.52\n- Invalidation: \"If price closes below $2.50 on 3-minute candle\"\n\n**Technical Assessment:**\n- Current price $2.63 is ABOVE invalidation level of $2.50 \u2713\n- Recent price action: [2.60, 2.59, 2.60, 2.62, 2.65, 2.64, 2.61, 2.65, 2.63, 2.63]\n- Price has NOT closed below $2.50 - invalidation condition NOT met \u2713\n- RSI (7-period): 54.736 - cooled off from extreme overbought levels (was 100, then 94)\n- RSI (14-period): 66.461 - healthy but not extreme\n- MACD: 0.054 - still positive but declining from 0.058 peak\n- Price above EMA20 ($2.57) - bullish structure intact\n- Stop-loss at $2.52 has NOT been hit (current $2.63) \u2713\n- Profit target at $2.75 has NOT been hit (current $2.63) \u2713\n\n**Price Action Context:**\nThe recent candles show consolidation around $2.63 after a spike to $2.65. The RSI has cooled from extremely overbought (100) to more sustainable levels (54-66), which is actually healthy for continuation. The price remains well above both the invalidation level ($2.50) and stop-loss ($2.52).\n\n**Decision Rationale:**\n- Invalidation condition: NOT MET (price never closed below $2.50)\n- Stop-loss: NOT HIT (still $0.11 away)\n- Profit target: NOT HIT (still $0.12 away)\n- Technical structure: INTACT (above EMA, MACD positive, healthy RSI)\n- Risk management: Position is slightly profitable with proper stops in place\n\n**Conclusion:** HOLD - All conditions support maintaining the position. The invalidation condition has not been triggered, stops are not hit, and the technical structure remains bullish with price above key support levels.\n\n**Other Coins:**\n- BTC, ETH, SOL, BNB, DOGE: No positions. While some show strong momentum (BTC RSI 94, ETH RSI 92), I already have capital deployed and should not add new positions with portfolio down -7.16%. Focus on managing existing risk.\n\n# TRADING DECISIONS\n\n```json\n{\n  \"XRP\": {\n    \"trade_signal_args\": {\n      \"coin\": \"XRP\",\n      \"signal\": \"hold\",\n      \"quantity\": 1500.0,\n      \"profit_target\": 2.75,\n      \"stop_loss\": 2.52,\n      \"invalidation_condition\": \"If price closes below $2.50 on 3-minute candle, indicating breakdown of uptrend structure\",\n      \"leverage\": 15,\n      \"confidence\": 0.72,\n      \"risk_usd\": 135.0\n    }\n  }\n}\n```",
      "signals": [
        {
          "coin": "XRP",
          "signal": "hold",
          "quantity": 1500.0,
          "leverage": 15,
          "stop_loss": 2.52,
          "profit_target": 2.75,
          "confidence": 0.72,
          "risk_usd": 135.0,
          "invalidation_condition": "If price closes below $2.50 on 3-minute candle, indicating breakdown of uptrend structure"
        }
      ]
    },
    {
      "iteration": 63,
      "timestamp": "2025-10-27T08:00:00",
      "model": "anthropic",
      "raw_response": "# CHAIN OF THOUGHT\n\nReviewing my current position:\n\n**XRP Position Analysis:**\n- Entry: $2.6132, Current: $2.6253\n- Unrealized P&L: +$16.19 (+0.46%)\n- Position size: 1500 XRP at 15x leverage (~$3,938 notional)\n- Stop-loss: $2.52, Profit target: $2.75\n- Invalidation condition: \"If price closes below $2.50 on 3-minute candle\"\n\n**Technical Analysis:**\n- Current price: $2.63 - ABOVE the $2.50 invalidation level \u2713\n- RSI (7-period): 50.243 - Neutral, cooled off from overbought\n- RSI (14-period): 63.136 - Healthy, not extreme\n- MACD: 0.046 - Still positive but declining from 0.050\n- EMA20: $2.58 - Price above EMA, uptrend intact\n- Recent price action: Peaked at $2.65, pulled back to $2.63, showing consolidation\n\n**Price Movement Pattern:**\nThe last 10 candles show: [2.59, 2.60, 2.62, 2.65, 2.64, 2.61, 2.65, 2.63, 2.63, 2.63]\n- Made a high at $2.65, now consolidating around $2.63\n- Has NOT closed below $2.50, so invalidation condition NOT met\n- Stop-loss at $2.52 is still intact\n- Currently in a consolidation phase after the recent rally\n\n**Decision Rationale:**\nThe invalidation condition is clear: \"If price closes below $2.50 on 3-minute candle\"\n- Current price: $2.63 \u2713\n- Recent low: $2.59 (still above $2.50) \u2713\n- No 3-minute candle has closed below $2.50 \u2713\n- Invalidation condition is NOT met\n\nThe position is slightly profitable and the uptrend structure remains intact. RSI has cooled from extreme overbought levels (was 94+, now 50), which is healthy. MACD remains positive. Price is consolidating but above all critical support levels.\n\n**Other Coins Assessment:**\n- **BTC**: Extremely overbought (RSI 84.6), at $115,377 after strong rally. Too extended to enter.\n- **ETH**: RSI 65.8 after cooling from 94, price at $4,162. Pullback in progress, not entering.\n- **SOL**: RSI 51.3, neutral territory at $200.17. No clear setup.\n- **BNB**: RSI 93.1 - extremely overbought at $1,180. Avoid.\n- **DOGE**: RSI 47.7, pulling back to $0.203. No compelling setup.\n\n**Risk Management:**\n- Account value: $9,277.64 (down -7.22% overall)\n- Available cash: $8,998.92\n- Current XRP position risk: $135 (well-sized)\n- No reason to close profitable position with invalidation condition not met\n\n**Conclusion:**\nHOLD XRP position. Invalidation condition clearly not met (price well above $2.50), stop-loss intact, and uptrend structure preserved. No new positions warranted given overbought conditions across the board.\n\n# TRADING DECISIONS\n\n```json\n{\n  \"XRP\": {\n    \"trade_signal_args\": {\n      \"coin\": \"XRP\",\n      \"signal\": \"hold\",\n      \"quantity\": 1500.0,\n      \"profit_target\": 2.75,\n      \"stop_loss\": 2.52,\n      \"invalidation_condition\": \"If price closes below $2.50 on 3-minute candle, indicating breakdown of uptrend structure\",\n      \"leverage\": 15,\n      \"confidence\": 0.72,\n      \"risk_usd\": 135.0\n    }\n  }\n}\n```",
      "signals": [
        {
          "coin": "XRP",
          "signal": "hold",
          "quantity": 1500.0,
          "leverage": 15,
          "stop_loss": 2.52,
          "profit_target": 2.75,
          "confidence": 0.72,
          "risk_usd": 135.0,
          "invalidation_condition": "If price closes below $2.50 on 3-minute candle, indicating breakdown of uptrend structure"
        }
      ]
    },
    {
      "iteration": 64,
      "timestamp": "2025-10-27T12:00:00",
      "model": "anthropic",
      "raw_response": "# CHAIN OF THOUGHT\n\nReviewing my current XRP position:\n\n**XRP Position Analysis:**\n- Entry: $2.6132, Current: $2.66, Unrealized P&L: +$68.39 (+1.75%)\n- Profit target: $2.75, Stop-loss: $2.52\n- Invalidation condition: \"If price closes below $2.50 on 3-minute candle\"\n- Leverage: 15x, Position size: 1500 XRP\n\n**Technical Analysis:**\n- Current price: $2.66 is ABOVE the invalidation level of $2.50 \u2713\n- RSI (7-period): 74.125 - showing strong momentum, but approaching overbought\n- RSI (14-period): 73.285 - confirming strength\n- MACD: 0.044 - positive and stable\n- Price vs EMA20: $2.66 vs $2.59 - trading above EMA20, bullish\n- Recent price action: Holding steady around $2.63-$2.66 range\n\n**Invalidation Check:**\nThe invalidation condition states \"closes below $2.50\" - the current price is $2.66, well above this level. The stop-loss at $2.52 is also not threatened. NO invalidation condition met.\n\n**Risk Assessment:**\n- Position is profitable (+$68.39)\n- Stop-loss provides 4.3% cushion from current price\n- RSI elevated but not extreme (under 80 on 7-period)\n- MACD remains positive, suggesting continued momentum\n- Price structure intact with higher lows\n\n**Decision:** HOLD - The position is performing well, invalidation condition is not met, technical indicators remain supportive, and we're moving toward the profit target of $2.75. The elevated RSI suggests we're in a strong move, and closing prematurely would forfeit potential gains.\n\n**Other Coins Review:**\n- **BTC**: Strong rally to $114,992, RSI cooling from extreme levels (65.9 from 94.5). Price above EMA20. Potential entry but already have XRP exposure.\n- **ETH**: Similar strong move to $4,173, RSI at 69. Good momentum but portfolio already leveraged.\n- **SOL**: Consolidating around $200, RSI neutral at 50.7. Less compelling setup.\n- **BNB**: Sharp pullback from $1,180 to $1,143, RSI dropped to 45.7. Concerning volatility.\n- **DOGE**: Weak at $0.2028, RSI at 45.3, showing bearish pressure.\n\n**Portfolio Management:**\nWith $8,998.92 cash available and one 15x leveraged position, I'm appropriately positioned. Not adding new positions to avoid over-leverage and maintain risk discipline.\n\n# TRADING DECISIONS\n\n```json\n{\n  \"XRP\": {\n    \"trade_signal_args\": {\n      \"coin\": \"XRP\",\n      \"signal\": \"hold\",\n      \"quantity\": 1500.0,\n      \"profit_target\": 2.75,\n      \"stop_loss\": 2.52,\n      \"invalidation_condition\": \"If price closes below $2.50 on 3-minute candle, indicating breakdown of uptrend structure\",\n      \"leverage\": 15,\n      \"confidence\": 0.72,\n      \"risk_usd\": 135.0\n    }\n  }\n}\n```",
      "signals": [
        {
          "coin": "XRP",
          "signal": "hold",
          "quantity": 1500.0,
          "leverage": 15,
          "stop_loss": 2.52,
          "profit_target": 2.75,
          "confidence": 0.72,
          "risk_usd": 135.0,
          "invalidation_condition": "If price closes below $2.50 on 3-minute candle, indicating breakdown of uptrend structure"
        }
      ]
    },
    {
      "iteration": 65,
      "timestamp": "2025-10-27T16:00:00",
      "model": "anthropic",
      "raw_response": "# CHAIN OF THOUGHT\n\n## Current Position Analysis\n\n**XRP Position Review:**\n- Entry: $2.6132, Current: $2.6676\n- Unrealized PnL: +$79.64 (+2.08% gain)\n- Position size: 1500 XRP at 15x leverage ($4,001.40 notional)\n- Exit plan: Profit target $2.75, Stop-loss $2.52\n- Invalidation: \"If price closes below $2.50 on 3-minute candle\"\n\n**Technical Analysis:**\n- Current price $2.67 is well above invalidation level of $2.50 \u2713\n- RSI (7-period): 77.23 - overbought territory but not extreme\n- RSI (14-period): 74.71 - confirming overbought\n- MACD: 0.040 - positive and stable\n- Price above EMA20 ($2.60) - bullish trend intact\n- Recent price action: Strong bounce from $2.61 to $2.67, showing momentum\n- Volume: 10.8M vs avg 6.0M - significantly elevated (180% of average), confirming strength\n\n**Decision Logic:**\nThe invalidation condition is NOT met - price is at $2.67, well above the $2.50 threshold. However, I need to assess whether to take profits or continue holding:\n\n1. **Profit target proximity**: Currently at $2.67, target at $2.75 - only 3% away\n2. **Stop-loss distance**: Stop at $2.52, giving 5.6% downside buffer\n3. **Risk/Reward**: Asymmetric - only 3% to target vs 5.6% to stop\n4. **Technical concerns**: RSI at 77 shows overbought conditions, potential for pullback\n5. **Momentum**: Strong volume and clean uptrend structure support continuation\n\n**Risk Management Consideration:**\nGiven the overbought RSI and proximity to profit target, the prudent decision is to HOLD but remain vigilant. The invalidation condition is clear and not triggered. The trend remains intact with price above EMA20 and MACD positive.\n\n**Other Coins Assessment:**\n- **BTC**: Strong uptrend (RSI 64.5, above EMA, MACD positive) but already at $114,960 - would need significant capital\n- **ETH**: Very strong (RSI 75, above EMA, MACD positive) but similar capital constraints\n- **SOL**: Neutral momentum (RSI 49.5, MACD weakening) - not compelling\n- **BNB**: Neutral/weak (RSI 47, recent rejection from $1180) - not compelling\n- **DOGE**: Neutral (RSI 47.6, consolidating) - not compelling\n\nWith only $8,998.92 available cash and one profitable position, I'll maintain the XRP position and avoid overtrading in choppy conditions.\n\n# TRADING DECISIONS\n\n```json\n{\n  \"XRP\": {\n    \"trade_signal_args\": {\n      \"coin\": \"XRP\",\n      \"signal\": \"hold\",\n      \"quantity\": 1500.0,\n      \"profit_target\": 2.75,\n      \"stop_loss\": 2.52,\n      \"invalidation_condition\": \"If price closes below $2.50 on 3-minute candle, indicating breakdown of uptrend structure\",\n      \"leverage\": 15,\n      \"confidence\": 0.72,\n      \"risk_usd\": 135.0\n    }\n  }\n}\n```",
      "signals": [
        {
          "coin": "XRP",
          "signal": "hold",
          "quantity": 1500.0,
          "leverage": 15,
          "stop_loss": 2.52,
          "profit_target": 2.75,
          "confidence": 0.72,
          "risk_usd": 135.0,
          "invalidation_condition": "If price closes below $2.50 on 3-minute candle, indicating breakdown of uptrend structure"
        }
      ]
    },
    {
      "iteration": 66,
      "timestamp": "2025-10-27T20:00:00",
      "model": "anthropic",
      "raw_response": "# CHAIN OF THOUGHT\n\nReviewing my current position and market conditions:\n\n**XRP Position Analysis:**\n- Entry: $2.6132, Current: $2.6326\n- Unrealized P&L: +$27.14 (+0.74%)\n- Stop-loss: $2.52, Profit target: $2.75\n- Invalidation condition: \"If price closes below $2.50 on 3-minute candle\"\n- Leverage: 15x (high risk position)\n\n**Technical Analysis:**\n- Current price: $2.63 is ABOVE the invalidation level of $2.50 \u2713\n- RSI (7-period): 43.905 - neutral territory, down from 77.187 (significant cooling)\n- RSI (14-period): 54.480 - neutral, indicating momentum loss\n- MACD: 0.034 - still positive but weakening\n- Price vs EMA20: $2.63 vs $2.61 - slightly above, maintaining support\n- Recent price action: Dropped from $2.67 to $2.63 in last candle (-1.5%)\n\n**Risk Assessment:**\n- The invalidation condition ($2.50) has NOT been breached\n- Current price is $0.13 above invalidation level (5% buffer)\n- Stop-loss at $2.52 is still $0.11 away (4.2% buffer)\n- RSI cooling from overbought levels (was 77+, now 44) suggests healthy pullback\n- MACD remains positive, indicating trend still intact\n- Price holding above EMA20 support\n\n**Decision: HOLD**\nThe position is slightly profitable and all exit conditions remain unmet:\n1. Price has NOT closed below $2.50 (invalidation level)\n2. Stop-loss at $2.52 not hit\n3. Profit target at $2.75 not reached\n4. Technical structure remains intact with price above EMA20\n5. The RSI pullback from overbought levels is normal and healthy\n\nWhile momentum has cooled, this appears to be a consolidation rather than a breakdown. The uptrend structure remains valid with support at EMA20. Will continue monitoring closely given the 15x leverage exposure.\n\n**Other Coins:**\n- BTC, ETH, SOL, BNB, DOGE: No positions, not entering new trades at this time. Market showing some weakness with RSI values dropping across the board after recent overbought conditions. Waiting for clearer setups.\n\n# TRADING DECISIONS\n\n```json\n{\n  \"XRP\": {\n    \"trade_signal_args\": {\n      \"coin\": \"XRP\",\n      \"signal\": \"hold\",\n      \"quantity\": 1500.0,\n      \"profit_target\": 2.75,\n      \"stop_loss\": 2.52,\n      \"invalidation_condition\": \"If price closes below $2.50 on 3-minute candle, indicating breakdown of uptrend structure\",\n      \"leverage\": 15,\n      \"confidence\": 0.72,\n      \"risk_usd\": 135.0\n    }\n  }\n}\n```",
      "signals": [
        {
          "coin": "XRP",
          "signal": "hold",
          "quantity": 1500.0,
          "leverage": 15,
          "stop_loss": 2.52,
          "profit_target": 2.75,
          "confidence": 0.72,
          "risk_usd": 135.0,
          "invalidation_condition": "If price closes below $2.50 on 3-minute candle, indicating breakdown of uptrend structure"
        }
      ]
    },
    {
      "iteration": 67,
      "timestamp": "2025-10-28T00:00:00",
      "model": "anthropic",
      "raw_response": "# CHAIN OF THOUGHT\n\nReviewing my current position:\n\n**XRP Position Analysis:**\n- Entry: $2.6132, Current: $2.6299\n- Unrealized P&L: +$23.09 (0.64% gain)\n- Position: 1500 XRP @ 15x leverage\n- Exit Plan: Profit target $2.75, Stop-loss $2.52\n- Invalidation: \"If price closes below $2.50 on 3-minute candle\"\n\n**Technical Analysis:**\n- Current price: $2.63 (ABOVE invalidation level of $2.50)\n- RSI (7-period): 41.996 (neutral, not oversold)\n- RSI (14-period): 52.907 (neutral)\n- MACD: 0.030 (positive but declining from 0.034)\n- EMA20: $2.61 (price above EMA, bullish)\n- Recent price action: Dropped from $2.67 to $2.63, showing some weakness\n- Price is holding above EMA20 and well above the $2.50 invalidation level\n\n**Invalidation Check:**\nThe invalidation condition states: \"If price closes below $2.50 on 3-minute candle\"\n- Current price: $2.63\n- Invalidation level: $2.50\n- Status: NOT MET (price is $0.13 above invalidation)\n\n**Decision Rationale:**\nThe position is slightly profitable (+$23) and the invalidation condition has NOT been met. Price remains above the critical $2.50 level by a comfortable margin. While there's some recent weakness (RSI declining, MACD weakening), the uptrend structure is intact with price above EMA20. The stop-loss at $2.52 and invalidation at $2.50 provide clear risk parameters. Will HOLD and let the position work toward the $2.75 profit target.\n\n**Other Coins Review:**\n- **BTC**: Sharp pullback from $115,566 to $113,903. RSI at 30.2 (oversold). Potential bounce setup but high volatility. Not entering new position given recent sharp decline.\n- **ETH**: Similar pattern, dropped from $4,206 to $4,093. RSI 31.9 (oversold). Could bounce but risk is elevated.\n- **SOL**: Price at $201.24, RSI 62.2 (neutral). Consolidating after earlier strength. No clear edge.\n- **BNB**: Price $1,137.50, RSI 39.7. Weak momentum after spike to $1,180. Avoiding.\n- **DOGE**: Price $0.1996, RSI 23.7 (very oversold). Sharp decline but no position to add to. Avoiding new entries.\n\nNo new positions warranted given current market volatility and existing XRP exposure.\n\n# TRADING DECISIONS\n\n```json\n{\n  \"XRP\": {\n    \"trade_signal_args\": {\n      \"coin\": \"XRP\",\n      \"signal\": \"hold\",\n      \"quantity\": 1500.0,\n      \"profit_target\": 2.75,\n      \"stop_loss\": 2.52,\n      \"invalidation_condition\": \"If price closes below $2.50 on 3-minute candle, indicating breakdown of uptrend structure\",\n      \"leverage\": 15,\n      \"confidence\": 0.72,\n      \"risk_usd\": 135.0\n    }\n  }\n}\n```",
      "signals": [
        {
          "coin": "XRP",
          "signal": "hold",
          "quantity": 1500.0,
          "leverage": 15,
          "stop_loss": 2.52,
          "profit_target": 2.75,
          "confidence": 0.72,
          "risk_usd": 135.0,
          "invalidation_condition": "If price closes below $2.50 on 3-minute candle, indicating breakdown of uptrend structure"
        }
      ]
    },
    {
      "iteration": 68,
      "timestamp": "2025-10-28T04:00:00",
      "model": "anthropic",
      "raw_response": "# CHAIN OF THOUGHT\n\n## Current Portfolio Analysis\n- Account Value: $9,296.36\n- Available Cash: $8,998.92\n- Total Return: -7.04%\n- Single Position: XRP (1500 units at $2.6132 entry, 15x leverage)\n\n## XRP Position Deep Dive\n\n**Entry Details:**\n- Entry Price: $2.6132\n- Current Price: $2.637\n- Unrealized P&L: +$33.74 (+0.91% on position)\n- Leverage: 15x\n- Position Size: $3,955.50 notional\n\n**Exit Plan:**\n- Profit Target: $2.75\n- Stop Loss: $2.52\n- Invalidation: \"If price closes below $2.50 on 3-minute candle, indicating breakdown of uptrend structure\"\n\n**Technical Analysis:**\n- Current Price: $2.64 vs EMA20: $2.62 \u2713 (Above EMA, bullish)\n- RSI (7-period): 49.40 (Neutral - not oversold, not overbought)\n- RSI (14-period): 55.21 (Slightly bullish)\n- MACD: 0.023 (Positive, uptrend intact)\n- Recent price action: Showing consolidation between $2.61-$2.67\n- Price never touched $2.50 - invalidation NOT triggered\n\n**Invalidation Check:**\nThe invalidation condition requires a close below $2.50. Looking at recent 3-minute candles:\n- Last 10 prices: [2.61, 2.65, 2.63, 2.63, 2.63, 2.66, 2.67, 2.63, 2.63, 2.64]\n- Lowest recent price: $2.61\n- **Status: INVALIDATION NOT MET** - price has stayed well above $2.50\n\n**Risk Assessment:**\n- Stop loss at $2.52 is $0.117 away (4.4% from current)\n- Current price $2.637 is only $0.024 above entry (+0.91%)\n- Position is barely profitable, showing consolidation\n- Liquidation price: $2.439 (reasonable distance with 15x leverage)\n\n**Decision: HOLD**\n- Invalidation condition NOT met (never closed below $2.50)\n- Price holding above EMA20 and maintaining uptrend structure\n- MACD positive, RSI neutral-bullish\n- Stop loss not threatened\n- No reason to exit prematurely - let the trade develop\n\n## Other Coins - No Entry Signals\n\n**BTC:** RSI dropped from 94 to 42 (sharp reversal from overbought), currently consolidating. Not entering.\n\n**ETH:** Similar pattern - RSI fell from 94 to 43, showing exhaustion after rally. No entry.\n\n**SOL:** RSI 69, decent momentum but already extended. No clear setup.\n\n**BNB:** RSI 32 (oversold) but MACD declining, showing weakness. Catching falling knife risk.\n\n**DOGE:** RSI 34 (oversold) but weak momentum. No conviction.\n\n# TRADING DECISIONS\n\n```json\n{\n  \"XRP\": {\n    \"trade_signal_args\": {\n      \"coin\": \"XRP\",\n      \"signal\": \"hold\",\n      \"quantity\": 1500.0,\n      \"profit_target\": 2.75,\n      \"stop_loss\": 2.52,\n      \"invalidation_condition\": \"If price closes below $2.50 on 3-minute candle, indicating breakdown of uptrend structure\",\n      \"leverage\": 15,\n      \"confidence\": 0.72,\n      \"risk_usd\": 135.0\n    }\n  }\n}\n```",
      "signals": [
        {
          "coin": "XRP",
          "signal": "hold",
          "quantity": 1500.0,
          "leverage": 15,
          "stop_loss": 2.52,
          "profit_target": 2.75,
          "confidence": 0.72,
          "risk_usd": 135.0,
          "invalidation_condition": "If price closes below $2.50 on 3-minute candle, indicating breakdown of uptrend structure"
        }
      ]
    },
    {
      "iteration": 69,
      "timestamp": "2025-10-28T08:00:00",
      "model": "anthropic",
      "raw_response": "# CHAIN OF THOUGHT\n\nReviewing my current position:\n\n**XRP Position Analysis:**\n- Entry: $2.6132, Current: $2.6401\n- Unrealized PnL: +$38.39 (+0.97%)\n- Leverage: 15x\n- Exit Plan: Profit target $2.75, Stop-loss $2.52\n- Invalidation: \"If price closes below $2.50 on 3-minute candle\"\n\n**Technical Analysis:**\n- Current price $2.64 is ABOVE the stop-loss ($2.52) and well above invalidation ($2.50)\n- Price is above EMA20 ($2.62) - bullish structure intact\n- RSI (7-period): 52.955 - neutral, healthy pullback from overbought\n- RSI (14-period): 56.633 - neutral with slight bullish bias\n- MACD: 0.022 - positive but weakening slightly\n- Recent price action: Consolidated between $2.63-$2.67, now at $2.64\n- Volume: 2.68M vs avg 5.96M - lower volume but not concerning\n\n**Invalidation Check:**\nThe invalidation condition states \"below $2.50 on 3-minute candle\". Looking at recent prices: [2.65, 2.63, 2.63, 2.63, 2.66, 2.67, 2.63, 2.63, 2.64, 2.64]. The lowest recent close was $2.63, which is ABOVE $2.50. **Invalidation condition NOT met.**\n\n**Decision Rationale:**\n- Position is profitable and trend structure remains intact\n- No invalidation condition triggered\n- Stop-loss not hit ($2.52 vs current $2.64)\n- RSI shows healthy consolidation after previous strength\n- Price holding above key support at EMA20\n- Room to run toward profit target at $2.75\n\n**Risk Management:**\n- Current risk is well-managed with stop-loss in place\n- 15x leverage appropriate for this range-bound consolidation\n- Position size reasonable at $3,960 notional\n\n**Other Coins Review:**\n- **BTC**: Strong uptrend (price $114,350 > EMA $113,676), RSI 50.9 neutral after pullback from 94.8. Could enter but prefer to manage existing position first.\n- **ETH**: Price $4,111.80 > EMA $4,080.68, but RSI 41.9 shows weakness. Not compelling.\n- **SOL**: Price $199.69 > EMA $198.63, but RSI 43.3 shows weakness after rejection. Not entering.\n- **BNB**: Price $1,131.80 < EMA $1,133.99, RSI 33.5 oversold. Weak momentum.\n- **DOGE**: Price $0.19965 < EMA $0.20074, RSI 29.4 oversold. Weak trend.\n\n**Conclusion:** HOLD XRP position. Invalidation not triggered, technical structure intact, profit target still viable.\n\n# TRADING DECISIONS\n\n```json\n{\n  \"XRP\": {\n    \"trade_signal_args\": {\n      \"coin\": \"XRP\",\n      \"signal\": \"hold\",\n      \"quantity\": 1500.0,\n      \"profit_target\": 2.75,\n      \"stop_loss\": 2.52,\n      \"invalidation_condition\": \"If price closes below $2.50 on 3-minute candle, indicating breakdown of uptrend structure\",\n      \"leverage\": 15,\n      \"confidence\": 0.72,\n      \"risk_usd\": 135.0\n    }\n  }\n}\n```",
      "signals": [
        {
          "coin": "XRP",
          "signal": "hold",
          "quantity": 1500.0,
          "leverage": 15,
          "stop_loss": 2.52,
          "profit_target": 2.75,
          "confidence": 0.72,
          "risk_usd": 135.0,
          "invalidation_condition": "If price closes below $2.50 on 3-minute candle, indicating breakdown of uptrend structure"
        }
      ]
    },
    {
      "iteration": 70,
      "timestamp": "2025-10-28T12:00:00",
      "model": "anthropic",
      "raw_response": "# CHAIN OF THOUGHT\n\nReviewing my current position and market conditions:\n\n**XRP Position Analysis:**\n- Entry: $2.6132, Current: $2.64, Unrealized P&L: +$30.89 (+1.18%)\n- Leverage: 15x, Notional: $3,952.65\n- Exit Plan: Profit target $2.75, Stop-loss $2.52\n- Invalidation: \"If price closes below $2.50 on 3-minute candle\"\n\nTechnical Analysis:\n- Current price $2.64 is ABOVE the invalidation level of $2.50 \u2713\n- Price has been consolidating in a tight range: [2.63, 2.67] over last 10 candles\n- RSI (7-period): 45.86 - neutral, not overbought or oversold\n- RSI (14-period): 52.58 - neutral zone\n- MACD: 0.016 - weakening momentum (declining from 0.022)\n- Price above EMA20 ($2.62) - still in uptrend structure\n- Recent price action shows consolidation after brief spike to $2.67\n\n**Invalidation Check:** Price has NOT closed below $2.50. Current price $2.64 is well above this level. Invalidation condition NOT met.\n\n**Risk Assessment:**\n- Stop-loss at $2.52 is $0.12 away (4.5% move)\n- Profit target at $2.75 is $0.11 away (4.2% move)\n- Risk/reward ratio is balanced\n- Position is slightly profitable and structure remains intact\n\n**Decision:** HOLD - The invalidation condition has not been triggered. Price remains above key support levels and the uptrend structure is intact. The consolidation pattern could be accumulation before the next leg up toward the profit target. No reason to exit prematurely.\n\n**Other Coins:**\n- BTC: Strong uptrend but at $114,640 with RSI 62.3 - could enter but already have capital deployed\n- ETH: Showing weakness with RSI 34.7, declining from overbought levels - not attractive\n- SOL: Consolidating, RSI 37.6 showing weakness - pass\n- BNB: Weak momentum, RSI 43 - pass  \n- DOGE: Very weak, RSI 28.9 oversold but no clear reversal signal - pass\n\nWith limited capital ($8,998 available) and one profitable position, I'll maintain focus on the XRP trade rather than spreading risk across multiple positions.\n\n# TRADING DECISIONS\n\n```json\n{\n  \"XRP\": {\n    \"trade_signal_args\": {\n      \"coin\": \"XRP\",\n      \"signal\": \"hold\",\n      \"quantity\": 1500.0,\n      \"profit_target\": 2.75,\n      \"stop_loss\": 2.52,\n      \"invalidation_condition\": \"If price closes below $2.50 on 3-minute candle, indicating breakdown of uptrend structure\",\n      \"leverage\": 15,\n      \"confidence\": 0.72,\n      \"risk_usd\": 135.0\n    }\n  }\n}\n```",
      "signals": [
        {
          "coin": "XRP",
          "signal": "hold",
          "quantity": 1500.0,
          "leverage": 15,
          "stop_loss": 2.52,
          "profit_target": 2.75,
          "confidence": 0.72,
          "risk_usd": 135.0,
          "invalidation_condition": "If price closes below $2.50 on 3-minute candle, indicating breakdown of uptrend structure"
        }
      ]
    },
    {
      "iteration": 71,
      "timestamp": "2025-10-28T16:00:00",
      "model": "anthropic",
      "raw_response": "# CHAIN OF THOUGHT\n\n## Current Position Analysis\n\n**XRP Position Review:**\n- Entry: $2.6132, Current: $2.64, Unrealized P&L: +$37.79 (+0.96%)\n- Leverage: 15x, Notional: $3,959.55\n- Exit Plan: Profit target $2.75, Stop-loss $2.52\n- Invalidation Condition: \"If price closes below $2.50 on 3-minute candle\"\n\n**Technical Analysis:**\n- Current price $2.64 is ABOVE the $2.50 invalidation level \u2713\n- Price is trading above EMA20 ($2.63), showing slight bullish bias\n- RSI (7-period): 53.19 - neutral territory, not overbought/oversold\n- RSI (14-period): 54.06 - healthy mid-range\n- MACD: 0.009 - positive but weakening from 0.014 peak\n- Price action: Consolidating in tight range $2.63-$2.67 over last 30 minutes\n- Volume: 11M vs average 6.9M - elevated activity\n\n**Key Observations:**\n1. Invalidation condition NOT met - price holding well above $2.50\n2. Position is slightly profitable but far from profit target ($2.75)\n3. Stop-loss at $2.52 provides adequate protection\n4. Price consolidating near entry, showing indecision\n5. RSI neutral suggests no immediate directional pressure\n6. MACD weakening but still positive\n\n**Decision: HOLD**\n- Invalidation condition not triggered\n- Position remains valid with proper risk management in place\n- Small profit but no reason to exit prematurely\n- Technical setup still constructive despite consolidation\n\n## Other Market Opportunities\n\n**BTC:** Sharp selloff from $115,566 to $113,694 (-1.6%). RSI at 30.98 (oversold), but below EMA20. Potential bounce setup but catching falling knife risk. PASS - too volatile.\n\n**ETH:** Severe decline from $4,203 to $4,037 (-4%). RSI at 18.86 (extremely oversold), below EMA20. High volume selloff. Could bounce but momentum strongly bearish. PASS - wait for stabilization.\n\n**SOL:** Down from $202.49 to $195.35 (-3.5%). RSI 21.12 (oversold), below EMA20. Similar bearish pattern to ETH/BTC. PASS.\n\n**BNB:** Dropped from $1,180 to $1,127 (-4.5%). RSI 29.99 (oversold). Part of broader market selloff. PASS.\n\n**DOGE:** Crashed from $0.2061 to $0.1966 (-4.6%). RSI 12.96 (extremely oversold). Most oversold of all coins but high risk. PASS.\n\n**Market Context:** Broad-based selloff across all major coins in last 30 minutes. Better to preserve capital and maintain existing position rather than catch falling knives. XRP showing relative strength (only -0.4% vs -3% to -5% for others).\n\n# TRADING DECISIONS\n\n```json\n{\n  \"XRP\": {\n    \"trade_signal_args\": {\n      \"coin\": \"XRP\",\n      \"signal\": \"hold\",\n      \"quantity\": 1500.0,\n      \"profit_target\": 2.75,\n      \"stop_loss\": 2.52,\n      \"invalidation_condition\": \"If price closes below $2.50 on 3-minute candle, indicating breakdown of uptrend structure\",\n      \"leverage\": 15,\n      \"confidence\": 0.72,\n      \"risk_usd\": 135.0\n    }\n  }\n}\n```",
      "signals": [
        {
          "coin": "XRP",
          "signal": "hold",
          "quantity": 1500.0,
          "leverage": 15,
          "stop_loss": 2.52,
          "profit_target": 2.75,
          "confidence": 0.72,
          "risk_usd": 135.0,
          "invalidation_condition": "If price closes below $2.50 on 3-minute candle, indicating breakdown of uptrend structure"
        }
      ]
    },
    {
      "iteration": 72,
      "timestamp": "2025-10-28T20:00:00",
      "model": "anthropic",
      "raw_response": "# CHAIN OF THOUGHT\n\n## Current Position Analysis\n\n### XRP Position Review\n- **Entry**: $2.6132, **Current**: $2.602, **P&L**: -$18.76 (-0.42%)\n- **Stop-loss**: $2.52, **Profit target**: $2.75\n- **Invalidation condition**: \"If price closes below $2.50 on 3-minute candle, indicating breakdown of uptrend structure\"\n\n**Technical Analysis**:\n- Current price: $2.60 (ABOVE invalidation level of $2.50)\n- RSI (7-period): 21.015 - deeply oversold, potential bounce zone\n- RSI (14-period): 34.127 - oversold territory\n- MACD: 0.005 - weakening but still slightly positive\n- EMA20: $2.63 - price below EMA, bearish short-term\n- Price action: Recent sharp drop from $2.67 to $2.60\n\n**Invalidation Check**: \n- Current price $2.60 is ABOVE the $2.50 invalidation level\n- However, we're only $0.10 away from invalidation\n- Price is $0.08 above stop-loss at $2.52\n\n**Decision Reasoning**:\nThe position has NOT met its invalidation condition yet. Current price $2.60 > $2.50 invalidation level. However, this is a critical juncture:\n\n1. **Oversold RSI**: 7-period RSI at 21.015 suggests we're in bounce territory\n2. **Near stop-loss**: Only $0.08 cushion above $2.52 stop-loss\n3. **Weak momentum**: MACD declining, below EMA20\n4. **High volume**: 13.5M vs 7.2M average suggests strong selling pressure\n\nThe invalidation condition is clear: \"close below $2.50\". We're at $2.60, so technically the condition is NOT met. Given the deeply oversold RSI readings (21 on 7-period, 34 on 14-period), there's potential for a bounce. The stop-loss at $2.52 provides protection if the decline continues.\n\n**Decision**: HOLD - Invalidation condition not met, oversold RSI suggests potential bounce, stop-loss provides downside protection.\n\n## Market-Wide Context\nAll major coins showing severe oversold conditions:\n- BTC: RSI 19.456 (7-period), down to $112,864\n- ETH: RSI 11.565 (7-period), down to $3,978\n- SOL: RSI 17.724 (7-period), down to $194.24\n- BNB: RSI 12.382 (7-period), down to $1,102.30\n- DOGE: RSI 7.266 (7-period), down to $0.19356\n\nThis is a broad market selloff with extreme oversold readings across the board. This could represent either:\n1. A capitulation/bounce opportunity\n2. The beginning of a larger correction\n\nGiven we only have ONE position (XRP) and it hasn't hit its invalidation condition, the prudent approach is to maintain the position with the existing stop-loss protection while the oversold conditions potentially resolve.\n\n# TRADING DECISIONS\n\n```json\n{\n  \"XRP\": {\n    \"trade_signal_args\": {\n      \"coin\": \"XRP\",\n      \"signal\": \"hold\",\n      \"quantity\": 1500.0,\n      \"profit_target\": 2.75,\n      \"stop_loss\": 2.52,\n      \"invalidation_condition\": \"If price closes below $2.50 on 3-minute candle, indicating breakdown of uptrend structure\",\n      \"leverage\": 15,\n      \"confidence\": 0.72,\n      \"risk_usd\": 135.0\n    }\n  }\n}\n```",
      "signals": [
        {
          "coin": "XRP",
          "signal": "hold",
          "quantity": 1500.0,
          "leverage": 15,
          "stop_loss": 2.52,
          "profit_target": 2.75,
          "confidence": 0.72,
          "risk_usd": 135.0,
          "invalidation_condition": "If price closes below $2.50 on 3-minute candle, indicating breakdown of uptrend structure"
        }
      ]
    },
    {
      "iteration": 73,
      "timestamp": "2025-10-29T00:00:00",
      "model": "anthropic",
      "raw_response": "# CHAIN OF THOUGHT\n\n## Current Position Analysis\n\n**XRP Position Review:**\n- Entry: $2.6132, Current: $2.6073\n- Unrealized P&L: -$10.81 (-0.23%)\n- Stop-loss: $2.52, Profit target: $2.75\n- Invalidation: \"If price closes below $2.50 on 3-minute candle\"\n- Leverage: 15x\n\n**Technical Analysis:**\n- Current price: $2.61 (ABOVE invalidation level of $2.50)\n- RSI (7-period): 29.076 - oversold territory, potential bounce\n- RSI (14-period): 38.055 - still oversold but recovering from 34.362\n- MACD: 0.004 - near zero, weakening but not negative\n- Price vs EMA20: $2.61 vs $2.63 - slightly below, but close\n- Recent price action: Dropped from $2.67 to $2.60, now recovering to $2.61\n\n**Critical Assessment:**\nThe invalidation condition states \"closes below $2.50\" - current price is $2.61, which is **$0.11 above the invalidation level**. The position is NOT invalidated. While the price has declined and is showing weakness:\n- RSI shows oversold conditions (29.076), suggesting potential reversal\n- Price is holding above the stop-loss at $2.52\n- The invalidation level of $2.50 has NOT been breached\n- Small loss of only $10.81 on a $3,910 position\n\n**Market Context - Broad Weakness:**\nAll major coins showing severe oversold conditions:\n- BTC: RSI 16.001 (extremely oversold)\n- ETH: RSI 23.917 (oversold)\n- SOL: RSI 16.824 (extremely oversold)\n- BNB: RSI 15.992 (extremely oversold)\n- DOGE: RSI 6.467 (catastrophically oversold)\n\nThis suggests a market-wide selloff, not XRP-specific weakness. Oversold conditions often precede bounces.\n\n**Decision: HOLD**\n- Invalidation condition NOT met (price at $2.61, invalidation at $2.50)\n- Stop-loss NOT hit ($2.52)\n- Oversold RSI suggests potential bounce\n- Loss is minimal (-0.23%)\n- No technical reason to exit prematurely\n\n**Other Coins:**\nGiven the extreme oversold conditions across all assets, there may be buying opportunities, but:\n- Already have capital deployed in XRP\n- Market showing panic selling\n- Better to wait for stabilization before adding new positions\n- Risk management: Don't add positions during extreme volatility\n\n# TRADING DECISIONS\n\n```json\n{\n  \"XRP\": {\n    \"trade_signal_args\": {\n      \"coin\": \"XRP\",\n      \"signal\": \"hold\",\n      \"quantity\": 1500.0,\n      \"profit_target\": 2.75,\n      \"stop_loss\": 2.52,\n      \"invalidation_condition\": \"If price closes below $2.50 on 3-minute candle, indicating breakdown of uptrend structure\",\n      \"leverage\": 15,\n      \"confidence\": 0.72,\n      \"risk_usd\": 135.0\n    }\n  }\n}\n```",
      "signals": [
        {
          "coin": "XRP",
          "signal": "hold",
          "quantity": 1500.0,
          "leverage": 15,
          "stop_loss": 2.52,
          "profit_target": 2.75,
          "confidence": 0.72,
          "risk_usd": 135.0,
          "invalidation_condition": "If price closes below $2.50 on 3-minute candle, indicating breakdown of uptrend structure"
        }
      ]
    },
    {
      "iteration": 74,
      "timestamp": "2025-10-29T04:00:00",
      "model": "anthropic",
      "raw_response": "# CHAIN OF THOUGHT\n\nReviewing my current position:\n\n**XRP Position Analysis:**\n- Entry: $2.6132, Current: $2.6336\n- Unrealized P&L: +$28.64 (+0.78%)\n- Leverage: 15x\n- Stop-loss: $2.52\n- Profit target: $2.75\n- Invalidation: \"If price closes below $2.50 on 3-minute candle\"\n\n**Technical Analysis:**\n- Current price: $2.63 (holding steady at EMA20)\n- RSI (7-period): 57.614 - neutral to slightly bullish, recovered from oversold\n- RSI (14-period): 52.975 - neutral zone\n- MACD: 0.003 - near zero, minimal momentum\n- Price action: Recent low was $2.60, bounced back to $2.63\n- EMA20: $2.63 - price right at support\n- Volume: 1.97M vs average 6.92M - significantly low volume (28% of average)\n\n**Invalidation Check:**\nThe invalidation condition states \"below $2.50 on 3-minute candle\" - current price is $2.63, well above this level. The recent low was $2.60, which is still $0.10 above the invalidation level. **Invalidation NOT met.**\n\n**Risk Assessment:**\n- Position is slightly profitable (+$28.64)\n- Stop-loss at $2.52 provides $0.11 cushion from current price\n- Recent price action shows volatility ($2.60-$2.67 range)\n- Very low volume is concerning - suggests weak conviction\n- MACD near zero indicates lack of momentum\n- RSI recovering but not showing strong bullish momentum\n\n**Decision Rationale:**\nWhile the invalidation condition is NOT met, the position shows concerning signs:\n1. Extremely low volume (28% of average) suggests lack of market participation\n2. MACD near zero shows momentum fading\n3. Price struggling to break above $2.64 resistance\n4. Only $28 profit on $3,950 notional (0.78%) with 15x leverage is minimal\n5. Price hovering right at EMA20 support - vulnerable position\n\nHowever, the technical setup hasn't broken down:\n- Price above invalidation level ($2.50)\n- Price above stop-loss ($2.52)\n- RSI showing recovery from oversold\n- Still holding EMA20 support\n\n**DECISION: HOLD** - The invalidation condition has not been met. Price remains above $2.50, stop-loss not hit, and profit target not reached. While momentum is weak, there's no clear technical breakdown yet. Will monitor closely for breakdown below $2.60 or EMA20.\n\n**Other Coins Assessment:**\n- **BTC**: Price at $113,569, below EMA20 ($113,524). RSI neutral at 50.5. MACD declining. No clear setup.\n- **ETH**: Price at $4,022.80, below EMA20 ($4,057). RSI weak at 39.4. Bearish momentum. No entry.\n- **SOL**: Price at $195.67, below EMA20 ($197.29). RSI at 40.8. Weak momentum. No entry.\n- **BNB**: Price at $1,116.60, below EMA20 ($1,127). RSI at 44.2. Negative MACD. No entry.\n- **DOGE**: Price at $0.19427, below EMA20 ($0.19817). RSI very weak at 28.4. Oversold but no reversal signal. No entry.\n\nAll major coins showing weakness below their EMA20 levels with declining momentum. No compelling buy setups at this time.\n\n# TRADING DECISIONS\n\n```json\n{\n  \"XRP\": {\n    \"trade_signal_args\": {\n      \"coin\": \"XRP\",\n      \"signal\": \"hold\",\n      \"quantity\": 1500.0,\n      \"profit_target\": 2.75,\n      \"stop_loss\": 2.52,\n      \"invalidation_condition\": \"If price closes below $2.50 on 3-minute candle, indicating breakdown of uptrend structure\",\n      \"leverage\": 15,\n      \"confidence\": 0.72,\n      \"risk_usd\": 135.0\n    }\n  }\n}\n```",
      "signals": [
        {
          "coin": "XRP",
          "signal": "hold",
          "quantity": 1500.0,
          "leverage": 15,
          "stop_loss": 2.52,
          "profit_target": 2.75,
          "confidence": 0.72,
          "risk_usd": 135.0,
          "invalidation_condition": "If price closes below $2.50 on 3-minute candle, indicating breakdown of uptrend structure"
        }
      ]
    },
    {
      "iteration": 75,
      "timestamp": "2025-10-29T08:00:00",
      "model": "anthropic",
      "raw_response": "# CHAIN OF THOUGHT\n\nReviewing my current position and market conditions:\n\n**XRP Position Analysis:**\n- Entry: $2.6132, Current: $2.6478\n- Unrealized P&L: +$49.94 (+1.9%)\n- Leverage: 15x, Notional: $3,971.70\n- Exit Plan: Profit target $2.75, Stop-loss $2.52\n- Invalidation: \"If price closes below $2.50 on 3-minute candle\"\n\n**Technical Analysis:**\n- Current price $2.65 is ABOVE the $2.50 invalidation level \u2713\n- RSI (7-period): 67.091 - showing strong momentum, not overbought yet\n- RSI (14-period): 58.615 - healthy bullish territory\n- MACD: 0.001 - positive and turning up from -0.001\n- Price above EMA20 ($2.63) - bullish structure intact\n- Recent price action: Strong recovery from $2.60 low, now at $2.65\n- Volume: 2.99M vs average 6.94M - lower volume but price moving up\n\n**Decision on XRP:**\nThe invalidation condition has NOT been met. Price is holding well above $2.50 and showing strength. The recent dip to $2.60 was bought aggressively, and we're now back at $2.65 with strong RSI readings. MACD is turning positive. The uptrend structure remains intact with price above EMA20. \n\nHowever, I'm concerned about:\n1. Lower volume compared to average\n2. We're only up $50 on a $4,000 position (1.9%)\n3. Sharpe ratio of -2.689 indicates poor risk-adjusted returns\n\n**Verdict: HOLD** - The invalidation condition is not met, technical structure remains bullish, and we're in profit. The momentum indicators support continuation toward our $2.75 target.\n\n**Other Coins Review:**\n\n**BTC**: Price $113,134, below EMA20 ($113,552). RSI 41.26 showing weakness. MACD declining (185.88). Downtrend from $114,640 high. No position, not entering in weak conditions.\n\n**ETH**: Price $4,008.70, below EMA20 ($4,055.47). RSI 34.29 showing oversold but no reversal signal yet. MACD declining (2.58). Not entering.\n\n**SOL**: Price $198.84, above EMA20 ($197.55). RSI 65.37 showing strength. MACD positive (0.195). This looks interesting but I cannot add positions while holding XRP due to risk management.\n\n**BNB**: Price $1,113, below EMA20 ($1,126.48). RSI 39.30 weak. MACD negative (-3.665). Downtrend. No entry.\n\n**DOGE**: Price $0.19534, below EMA20 ($0.19813). RSI 42.39 weak. MACD negative. Downtrend. No entry.\n\n# TRADING DECISIONS\n\n```json\n{\n  \"XRP\": {\n    \"trade_signal_args\": {\n      \"coin\": \"XRP\",\n      \"signal\": \"hold\",\n      \"quantity\": 1500.0,\n      \"profit_target\": 2.75,\n      \"stop_loss\": 2.52,\n      \"invalidation_condition\": \"If price closes below $2.50 on 3-minute candle, indicating breakdown of uptrend structure\",\n      \"leverage\": 15,\n      \"confidence\": 0.72,\n      \"risk_usd\": 135.0\n    }\n  }\n}\n```",
      "signals": [
        {
          "coin": "XRP",
          "signal": "hold",
          "quantity": 1500.0,
          "leverage": 15,
          "stop_loss": 2.52,
          "profit_target": 2.75,
          "confidence": 0.72,
          "risk_usd": 135.0,
          "invalidation_condition": "If price closes below $2.50 on 3-minute candle, indicating breakdown of uptrend structure"
        }
      ]
    },
    {
      "iteration": 76,
      "timestamp": "2025-10-29T12:00:00",
      "model": "anthropic",
      "raw_response": "# CHAIN OF THOUGHT\n\n## Current Position Analysis\n\n**XRP Position Review:**\n- Entry: $2.6132, Current: $2.6247\n- Unrealized P&L: +$15.29 (+0.44%)\n- Stop-loss: $2.52, Profit target: $2.75\n- Invalidation condition: \"If price closes below $2.50 on 3-minute candle\"\n- Leverage: 15x (high risk)\n\n**Technical Analysis:**\n- Current price: $2.62 (well above $2.50 invalidation level)\n- RSI (7-period): 45.002 - neutral territory, not overbought or oversold\n- RSI (14-period): 46.103 - confirming neutral momentum\n- MACD: -0.004 - slightly negative but near zero, showing consolidation\n- EMA20: $2.63 - price slightly below but very close\n- Recent price action: Recovered from $2.60 low to $2.65, now pulling back to $2.62\n\n**Invalidation Check:**\nThe invalidation condition states \"closes below $2.50\" - current price is $2.62, which is $0.12 above the invalidation level. The position is safe and invalidation condition is NOT met.\n\n**Market Context:**\n- XRP showing consolidation pattern around $2.62-$2.64 range\n- No clear directional bias with neutral RSI\n- MACD near zero suggests sideways movement\n- Price has not threatened the $2.52 stop-loss or approached the $2.75 profit target\n- The position is slightly profitable but not at any critical decision point\n\n**Risk Assessment:**\n- 15x leverage is high, but position is small ($3,937 notional)\n- Current drawdown on account: -7.23%\n- Available cash: $8,998.92 (sufficient buffer)\n- Position is not in distress\n\n**Decision:** HOLD\n- Invalidation condition NOT met (price well above $2.50)\n- Stop-loss not threatened ($2.52 vs current $2.62)\n- Profit target not reached ($2.75 vs current $2.62)\n- Technical indicators show consolidation, not reversal\n- No compelling reason to exit prematurely\n\n## Other Coins Assessment\n\n**BTC:** Severe oversold conditions (RSI 21.45), down -2.8% to $111,510. Strong bearish momentum with MACD -273.78. Below EMA20 ($113,567). Too risky to enter in this knife-falling scenario.\n\n**ETH:** Extremely oversold (RSI 19.70), down -3.5% to $3,949.50. MACD -22.63 showing strong bearish momentum. Below EMA20 ($4,058). Similar to BTC - avoid catching falling knives.\n\n**SOL:** Neutral conditions (RSI 47.84), price $196.76 vs EMA $198.02. MACD slightly negative. Consolidating but no clear setup. Pass.\n\n**BNB:** Oversold (RSI 24.73), down to $1,098.90 from $1,137.50. MACD -8.05. Below EMA20. Bearish trend. Pass.\n\n**DOGE:** Severely oversold (RSI 20.29), down -4.3% to $0.1910. MACD -0.002. Below EMA20. Strong selling pressure. Pass.\n\n**Conclusion:** Market showing broad weakness across major coins. XRP is the only position holding up relatively well in neutral territory. Will maintain current position as invalidation condition is not met.\n\n# TRADING DECISIONS\n\n```json\n{\n  \"XRP\": {\n    \"trade_signal_args\": {\n      \"coin\": \"XRP\",\n      \"signal\": \"hold\",\n      \"quantity\": 1500.0,\n      \"profit_target\": 2.75,\n      \"stop_loss\": 2.52,\n      \"invalidation_condition\": \"If price closes below $2.50 on 3-minute candle, indicating breakdown of uptrend structure\",\n      \"leverage\": 15,\n      \"confidence\": 0.72,\n      \"risk_usd\": 135.0\n    }\n  }\n}\n```",
      "signals": [
        {
          "coin": "XRP",
          "signal": "hold",
          "quantity": 1500.0,
          "leverage": 15,
          "stop_loss": 2.52,
          "profit_target": 2.75,
          "confidence": 0.72,
          "risk_usd": 135.0,
          "invalidation_condition": "If price closes below $2.50 on 3-minute candle, indicating breakdown of uptrend structure"
        }
      ]
    },
    {
      "iteration": 77,
      "timestamp": "2025-10-29T16:00:00",
      "model": "anthropic",
      "raw_response": "# CHAIN OF THOUGHT\n\nReviewing my current XRP position and overall market conditions:\n\n**XRP Position Analysis:**\n- Entry: $2.6132, Current: $2.5862\n- Unrealized P&L: -$42.46 (-1.63%)\n- Stop-loss: $2.52, Profit target: $2.75\n- Invalidation condition: \"If price closes below $2.50 on 3-minute candle\"\n- Current technical indicators:\n  * RSI (7-period): 26.018 - deeply oversold\n  * RSI (14-period): 33.216 - oversold\n  * MACD: -0.006 - negative and deteriorating\n  * Price: $2.59 vs EMA20: $2.63 - trading below EMA\n  * Recent price action: Down from $2.65 to $2.59\n\n**Critical Assessment:**\nThe XRP position is approaching its invalidation level. Current price is $2.59, and the invalidation condition is a close below $2.50. We're only $0.09 away from that critical level. The technical indicators are concerning:\n- Extremely oversold RSI suggests selling pressure\n- Negative MACD with worsening momentum\n- Price trending below EMA20 \n- Recent candles show continued weakness\n\nHowever, the price has NOT yet closed below $2.50, so the invalidation condition is technically not met yet. The stop-loss at $2.52 is still below current price by $0.07.\n\nGiven the proximity to invalidation ($0.09 away) and the weak technical setup, this position is at high risk. The RSI being deeply oversold (26) could signal a bounce, but the overall trend is bearish.\n\n**Decision: HOLD** - The invalidation condition has not been triggered yet (price still above $2.50). However, I'm monitoring this position very closely. If the next candle closes below $2.50, I will immediately close.\n\n**Other Coins Analysis:**\n- **BTC**: RSI 16.118 - extremely oversold, but in strong downtrend. Down from 114,640 to 110,675. MACD -542, deeply negative. Too risky to enter during this volatility.\n- **ETH**: RSI 13.637 - extremely oversold, similar pattern to BTC. Down from 4,116 to 3,903. High volume selloff. Avoid.\n- **SOL**: RSI 28.319 - oversold but showing some stability. Down from 202 to 192. Not compelling enough for entry.\n- **BNB**: RSI 40.811 - relatively stronger, but still below EMA. Down from 1,131 to 1,106. Neutral.\n- **DOGE**: RSI 45.285 - showing recovery from extreme oversold. Some bounce potential but uncertain.\n\n**Risk Management:**\nCurrent account value: $9,215.08 (down 7.85%)\nAvailable cash: $8,998.92\nOnly position: XRP with $42 unrealized loss\n\nThe market is experiencing significant selling pressure across all major coins. This is not an ideal environment to add new positions. I will maintain my XRP position as the invalidation has not been triggered, but I'm prepared to exit if conditions deteriorate further.\n\n# TRADING DECISIONS\n\n```json\n{\n  \"XRP\": {\n    \"trade_signal_args\": {\n      \"coin\": \"XRP\",\n      \"signal\": \"hold\",\n      \"quantity\": 1500.0,\n      \"profit_target\": 2.75,\n      \"stop_loss\": 2.52,\n      \"invalidation_condition\": \"If price closes below $2.50 on 3-minute candle, indicating breakdown of uptrend structure\",\n      \"leverage\": 15,\n      \"confidence\": 0.72,\n      \"risk_usd\": 135.0\n    }\n  }\n}\n```",
      "signals": [
        {
          "coin": "XRP",
          "signal": "hold",
          "quantity": 1500.0,
          "leverage": 15,
          "stop_loss": 2.52,
          "profit_target": 2.75,
          "confidence": 0.72,
          "risk_usd": 135.0,
          "invalidation_condition": "If price closes below $2.50 on 3-minute candle, indicating breakdown of uptrend structure"
        }
      ]
    },
    {
      "iteration": 78,
      "timestamp": "2025-10-29T20:00:00",
      "model": "anthropic",
      "raw_response": "# CHAIN OF THOUGHT\n\n## Current Position Analysis\n\n**XRP Position Review:**\n- Entry: $2.6132, Current: $2.5488\n- Unrealized P&L: -$98.56 (-2.46%)\n- Stop-loss: $2.52, Profit target: $2.75\n- Invalidation condition: \"If price closes below $2.50 on 3-minute candle\"\n- Leverage: 15x (high risk)\n\n**Technical Analysis:**\n- Current price $2.55 is ABOVE the invalidation level of $2.50 \u2713\n- Current price is ABOVE the stop-loss of $2.52 \u2713\n- RSI (7-period): 16.84 - EXTREMELY oversold (below 20)\n- RSI (14-period): 25.53 - Very oversold\n- MACD: -0.007 (negative but small)\n- Price below EMA20 ($2.62) - bearish short-term trend\n- Recent price action: Sharp decline from $2.65 to $2.55\n\n**Critical Assessment:**\nThe position is currently in a precarious state:\n1. Price is just $0.03 above the stop-loss ($2.52)\n2. Price is $0.05 above the invalidation level ($2.50)\n3. RSI at 16.84 indicates extreme oversold conditions - typically a bounce signal\n4. However, the downtrend is strong with price well below EMA20\n5. High volume (17.87M vs avg 9.73M) suggests strong selling pressure\n\n**Decision Rationale:**\nWhile the invalidation condition has NOT been technically met (price hasn't closed below $2.50), the position is extremely close to both stop-loss and invalidation levels. Given:\n- Extreme proximity to stop-loss (only 1.2% away)\n- 15x leverage amplifies risk significantly\n- Strong bearish momentum despite oversold RSI\n- Already down $98.56 on this position\n- Portfolio is down -8.45% overall\n\nThe prudent decision is to CLOSE this position for risk management. The invalidation condition is on the verge of being triggered, and waiting for it to officially trigger could result in slippage and worse fills. The extremely oversold RSI could provide a bounce, but with 15x leverage, the risk is too high to wait.\n\n**Other Coins Assessment:**\n- **BTC**: RSI 13.15 - extremely oversold, MACD deeply negative (-711), price at $110,102 vs EMA $113,027. Strong downtrend but extreme oversold could signal bounce. However, risk/reward unclear at this moment.\n- **ETH**: RSI 13.49 - extremely oversold, similar to BTC. Price $3,902 vs EMA $4,032.\n- **SOL**: RSI 38.64 - less oversold, showing relative strength. Price $193.99 vs EMA $197.29.\n- **BNB**: RSI 41.92 - neutral zone, relatively stable.\n- **DOGE**: RSI 36.78 - slightly oversold but not extreme.\n\nGiven the current portfolio drawdown and the need for capital preservation, I will not enter new positions at this time. The market is showing extreme weakness across major coins, and it's better to preserve capital and wait for clearer setups.\n\n# TRADING DECISIONS\n\n```json\n{\n  \"XRP\": {\n    \"trade_signal_args\": {\n      \"coin\": \"XRP\",\n      \"signal\": \"close_position\",\n      \"quantity\": 1500.0,\n      \"profit_target\": 2.75,\n      \"stop_loss\": 2.52,\n      \"invalidation_condition\": \"If price closes below $2.50 on 3-minute candle, indicating breakdown of uptrend structure\",\n      \"leverage\": 15,\n      \"confidence\": 0.72,\n      \"risk_usd\": 135.0,\n      \"close_reason\": \"Risk management - price within 1.2% of stop-loss at $2.52 and approaching invalidation level of $2.50. With 15x leverage and strong bearish momentum despite extremely oversold RSI (16.84), the risk of further downside outweighs potential bounce. Preserving capital to avoid larger losses.\"\n    }\n  }\n}\n```",
      "signals": [
        {
          "coin": "XRP",
          "signal": "close_position",
          "quantity": 1500.0,
          "leverage": 15,
          "stop_loss": 2.52,
          "profit_target": 2.75,
          "confidence": 0.72,
          "risk_usd": 135.0,
          "invalidation_condition": "If price closes below $2.50 on 3-minute candle, indicating breakdown of uptrend structure"
        }
      ]
    },
    {
      "iteration": 79,
      "timestamp": "2025-10-30T00:00:00",
      "model": "anthropic",
      "raw_response": "# CHAIN OF THOUGHT\n\n## Current Portfolio Status\n- **No open positions** - Full cash position at $9,159.77\n- **Portfolio down 8.40%** with negative Sharpe ratio of -2.638\n- Need to find high-conviction setups to recover losses while managing risk carefully\n\n## Market Analysis by Coin\n\n### BTC Analysis\n- **Price**: $110,833 (down from $114,640 peak, -3.3%)\n- **Technical**: Below EMA20 ($112,948), MACD deeply negative (-965), RSI(7) at 33.78 (oversold territory)\n- **Trend**: Strong downtrend with price breaking below multiple support levels\n- **Assessment**: Oversold but still in bearish momentum. RSI bouncing from extreme oversold (13.0) suggests potential relief rally, but MACD still deteriorating. Too risky to enter against the trend.\n\n### ETH Analysis\n- **Price**: $3,933.40 (down from $4,096 peak, -4.0%)\n- **Technical**: Below EMA20 ($4,035.59), MACD negative (-61.46), RSI(7) at 36.35 (oversold)\n- **Trend**: Bearish with lower highs and lower lows\n- **Assessment**: Similar to BTC - oversold bounce from RSI 13.09 but still weak. Not compelling enough.\n\n### SOL Analysis\n- **Price**: $197.17 (recovered from $192.75 low)\n- **Technical**: Just below EMA20 ($197.45), MACD negative but improving (-1.33), RSI(7) at 58.85 (neutral/bullish)\n- **Trend**: **BULLISH REVERSAL** - Strong bounce from oversold RSI 15.39 to 58.85, price recovering\n- **Volume**: Lower than average but showing recovery\n- **Assessment**: **BEST SETUP** - Clear reversal pattern with RSI momentum shift. Price near EMA20 support/resistance. This is a mean reversion opportunity with defined risk.\n\n### BNB Analysis\n- **Price**: $1,118.30 (recovering from $1,098.90 low)\n- **Technical**: Just below EMA20 ($1,122.59), MACD improving (-8.59), RSI(7) at 62.01 (bullish)\n- **Trend**: Showing recovery similar to SOL\n- **Assessment**: Good setup but SOL shows stronger momentum. Secondary opportunity.\n\n### XRP Analysis\n- **Price**: $2.58 (below EMA20 at $2.62)\n- **Technical**: MACD negative (-0.015), RSI(7) at 38.98 (weak)\n- **Assessment**: Weak recovery, not compelling.\n\n### DOGE Analysis\n- **Price**: $0.19368 (below EMA20 at $0.19740)\n- **Technical**: MACD negative (-0.003), RSI(7) at 48.13 (neutral)\n- **Assessment**: Choppy action, no clear setup.\n\n## Trading Decision\n\nGiven the portfolio is down 8.40%, I need a high-probability setup to recover. **SOL** presents the best risk/reward:\n\n1. **Clear reversal pattern**: RSI bounced from extreme oversold (15.39) to bullish territory (58.85)\n2. **Price action**: Recovered from $192.75 to $197.17, testing EMA20 resistance\n3. **MACD improving**: From -1.497 to -1.329, showing momentum shift\n4. **Risk management**: Tight stop-loss possible just below recent low\n\n**Entry Strategy for SOL**:\n- Entry: $197.17\n- Stop-loss: $191.50 (below recent low of $192.75, -2.9% risk)\n- Profit target: $205.00 (above recent high, +4.0% gain, 1.4:1 R/R)\n- Invalidation: If price closes below $191.50, reversal failed\n- Position size: ~$2,500 with 15x leverage = ~190 SOL (~$2,000 risk capital, ~$250 risk)\n\nThis represents a measured risk (~2.7% of portfolio) with asymmetric upside potential.\n\n# TRADING DECISIONS\n\n```json\n{\n  \"SOL\": {\n    \"trade_signal_args\": {\n      \"coin\": \"SOL\",\n      \"signal\": \"buy\",\n      \"quantity\": 190,\n      \"profit_target\": 205.00,\n      \"stop_loss\": 191.50,\n      \"invalidation_condition\": \"If price closes below $191.50 on 3-minute candle, indicating failed reversal\",\n      \"leverage\": 15,\n      \"confidence\": 0.72,\n      \"risk_usd\": 250.00\n    }\n  }\n}\n```",
      "signals": [
        {
          "coin": "SOL",
          "signal": "buy",
          "quantity": 190.0,
          "leverage": 15,
          "stop_loss": 191.5,
          "profit_target": 205.0,
          "confidence": 0.72,
          "risk_usd": 250.0,
          "invalidation_condition": "If price closes below $191.50 on 3-minute candle, indicating failed reversal"
        }
      ]
    },
    {
      "iteration": 80,
      "timestamp": "2025-10-30T04:00:00",
      "model": "anthropic",
      "raw_response": "# CHAIN OF THOUGHT\n\nReviewing my current position:\n\n**SOL Position Analysis:**\n- Entry: $197.17, Current: $195.87\n- Unrealized P&L: -$265.73 (-1.3% loss)\n- Leverage: 15x\n- Exit Plan: Profit target $205.00, Stop-loss $191.50\n- Invalidation: \"If price closes below $191.50 on 3-minute candle, indicating failed reversal\"\n\n**Checking Invalidation Condition:**\nCurrent price is $195.87, which is ABOVE the invalidation level of $191.50. The position has NOT hit the stop-loss yet. Looking at recent price action:\n- Recent lows: $192.75 (3 candles ago), $193.99 (2 candles ago)\n- Current: $195.87\n- The price did NOT close below $191.50\n\n**Technical Analysis:**\n- RSI (7-period): 49.769 - neutral territory, showing recovery from oversold\n- MACD: -2.064 - still negative but improving from -2.368\n- Price vs EMA20: $195.87 vs $197.89 - price below EMA but converging\n- Recent price action shows volatility: spike to $198.84, then pullback to $192.75, now recovering to $195.87\n\n**Risk Assessment:**\n- Current loss: $265.73 (2.9% of account value)\n- Price is $4.37 above stop-loss ($191.50)\n- Price needs to move $9.13 (+4.7%) to reach profit target\n- Market showing indecision with RSI near 50\n\n**Decision Rationale:**\nThe invalidation condition has NOT been met - price has not closed below $191.50. However, the position is showing weakness:\n1. Price struggling to reclaim EMA20\n2. MACD still negative\n3. Position underwater by $265\n4. SOL showing relative weakness compared to entry\n\nGiven that:\n- Invalidation NOT triggered (price at $195.87 > $191.50)\n- Stop-loss not hit\n- Technical indicators showing neutral/slight recovery\n- Need to respect the exit plan\n\nI will HOLD the position as the invalidation condition has not been met, but I'm watching closely for any close below $191.50.\n\n**Other Coins:**\n- BTC, ETH, BNB, XRP, DOGE: No positions. Market showing weakness across the board with prices below EMAs and negative MACD. Not entering new trades in this environment.\n\n# TRADING DECISIONS\n\n```json\n{\n  \"SOL\": {\n    \"trade_signal_args\": {\n      \"coin\": \"SOL\",\n      \"signal\": \"hold\",\n      \"quantity\": 190.0,\n      \"profit_target\": 205.0,\n      \"stop_loss\": 191.5,\n      \"invalidation_condition\": \"If price closes below $191.50 on 3-minute candle, indicating failed reversal\",\n      \"leverage\": 15,\n      \"confidence\": 0.72,\n      \"risk_usd\": 250.0\n    }\n  }\n}\n```",
      "signals": [
        {
          "coin": "SOL",
          "signal": "hold",
          "quantity": 190.0,
          "leverage": 15,
          "stop_loss": 191.5,
          "profit_target": 205.0,
          "confidence": 0.72,
          "risk_usd": 250.0,
          "invalidation_condition": "If price closes below $191.50 on 3-minute candle, indicating failed reversal"
        }
      ]
    },
    {
      "iteration": 81,
      "timestamp": "2025-10-30T08:00:00",
      "model": "anthropic",
      "raw_response": "# CHAIN OF THOUGHT\n\n## Current Position Analysis\n\n**SOL Position Review:**\n- Entry: $197.17, Current: $191.88\n- Unrealized P&L: -$1,023.83 (-5.36% loss)\n- Liquidation: $184.03\n- Stop-loss: $191.50\n- Invalidation condition: \"If price closes below $191.50 on 3-minute candle, indicating failed reversal\"\n\n**Critical Issue - Invalidation Condition Met:**\nThe current price is $191.88, which is BELOW the stop-loss at $191.50. Looking at the recent price action:\n- Latest candle closed at $191.88\n- This is $0.38 below our invalidation level of $191.50\n- The invalidation condition explicitly states: \"If price closes below $191.50 on 3-minute candle\"\n\n**Technical Analysis Confirms Exit:**\n- RSI (7-period): 30.65 - showing weakness, not oversold enough for reversal\n- RSI (14-period): 34.86 - confirming bearish momentum\n- MACD: -1.949 - deeply negative and worsening\n- Price below EMA20 ($197.06) - bearish trend intact\n- Recent price action: $195.87 \u2192 $191.88 (sharp drop)\n\n**Risk Management:**\n- Position is down -5.36% from entry\n- Price has breached our predetermined stop-loss level\n- Further downside risk exists with liquidation at $184.03 (only $7.85 away)\n- Market showing broad weakness across all coins (BTC RSI 26.9, ETH RSI 21.8)\n\n**Decision: CLOSE POSITION**\nThe invalidation condition has been clearly met. The price closed below $191.50, which was our predefined exit level. Holding this position would violate our risk management rules and expose us to further losses in a deteriorating market environment.\n\n## Other Coins Assessment\n\n**BTC, ETH, XRP, DOGE:** All showing extremely oversold conditions (RSI 7-period: 26.9, 21.8, 26.5, 21.2 respectively) with negative MACD and prices well below EMA20. While these could present bounce opportunities, the current market is in a strong downtrend with no clear reversal signals.\n\n**BNB:** RSI at 44.3 shows relative strength but still below EMA20 with negative MACD. Not compelling enough for entry.\n\nGiven the portfolio is down -19.50% and we're closing our losing SOL position, prudent risk management suggests waiting for clearer reversal signals before entering new trades.\n\n# TRADING DECISIONS\n\n```json\n{\n  \"SOL\": {\n    \"trade_signal_args\": {\n      \"coin\": \"SOL\",\n      \"signal\": \"close_position\",\n      \"quantity\": 190.0,\n      \"profit_target\": 205.0,\n      \"stop_loss\": 191.5,\n      \"invalidation_condition\": \"If price closes below $191.50 on 3-minute candle, indicating failed reversal\",\n      \"leverage\": 15,\n      \"confidence\": 0.72,\n      \"risk_usd\": 250.0,\n      \"close_reason\": \"Invalidation condition met - price closed at $191.88, below stop-loss at $191.50. Failed reversal confirmed with continued bearish momentum (MACD -1.949, RSI 30.65). Risk management requires exit per predefined rules.\"\n    }\n  }\n}\n```",
      "signals": [
        {
          "coin": "SOL",
          "signal": "close_position",
          "quantity": 190.0,
          "leverage": 15,
          "stop_loss": 191.5,
          "profit_target": 205.0,
          "confidence": 0.72,
          "risk_usd": 250.0,
          "invalidation_condition": "If price closes below $191.50 on 3-minute candle, indicating failed reversal"
        }
      ]
    },
    {
      "iteration": 82,
      "timestamp": "2025-10-30T12:00:00",
      "model": "anthropic",
      "raw_response": "# CHAIN OF THOUGHT\n\n## Current Market Analysis\n\nI have NO open positions and $8,098.97 in available cash. The portfolio is down -19.01% with a negative Sharpe ratio of -5.215, indicating poor risk-adjusted returns. I need to be extremely cautious about new entries.\n\n## Market Condition Assessment\n\n**ALL COINS ARE IN SEVERE DOWNTRENDS:**\n\n**BTC:** \n- Price: $107,752 (down from $113,569 peak, -5.1% in 30 minutes)\n- Below EMA20 ($112,149) by -4.0%\n- RSI(7): 15.73 - EXTREMELY oversold\n- RSI(14): 19.56 - EXTREMELY oversold\n- MACD: -1446 and deteriorating rapidly\n- Volume: 14,065 vs avg 6,759 (+108%) - HIGH selling pressure\n\n**ETH:**\n- Price: $3,772.70 (down from $4,022.80, -6.2% in 30 minutes)\n- Below EMA20 ($3,988.91) by -5.4%\n- RSI(7): 10.29 - CRITICALLY oversold (lowest of all coins)\n- RSI(14): 14.77 - CRITICALLY oversold\n- MACD: -75.59 and worsening\n- Volume: 231,564 vs avg 104,179 (+122%) - EXTREME selling pressure\n\n**SOL:**\n- Price: $185.02 (down from $198.84, -6.9% in 30 minutes)\n- Below EMA20 ($195.60) by -5.4%\n- RSI(7): 16.29 - EXTREMELY oversold\n- RSI(14): 23.64 - Oversold\n- MACD: -2.25 and declining\n- Volume: 1,645,511 vs avg 897,097 (+83%) - HIGH selling pressure\n\n**BNB:**\n- Price: $1,076.10 (down from $1,118.30, -3.8% in 30 minutes)\n- Below EMA20 ($1,122.12) by -4.1%\n- RSI(7): 15.28 - EXTREMELY oversold\n- RSI(14): 21.50 - EXTREMELY oversold\n- MACD: -17.55 and deteriorating\n\n**XRP:**\n- Price: $2.45 (down from $2.65, -7.5% in 30 minutes)\n- Below EMA20 ($2.59) by -5.4%\n- RSI(7): 12.08 - CRITICALLY oversold\n- RSI(14): 18.59 - EXTREMELY oversold\n- MACD: -0.026 and worsening\n- Volume: 16,695,347 vs avg 9,905,416 (+69%) - HIGH selling pressure\n\n**DOGE:**\n- Price: $0.18055 (down from $0.19534, -7.6% in 30 minutes)\n- Below EMA20 ($0.19423) by -7.0%\n- RSI(7): 10.70 - CRITICALLY oversold (second lowest)\n- RSI(14): 16.13 - EXTREMELY oversold\n- MACD: -0.004 and declining\n- Volume: 206,451,913 vs avg 59,803,679 (+245%) - MASSIVE selling pressure\n\n## Trading Decision\n\n**ALL INDICATORS POINT TO EXTREME PANIC SELLING:**\n- RSI(7) readings between 10-16 across all coins (panic territory)\n- All coins below their EMA20 by 4-7%\n- Massive volume spikes (83-245% above average)\n- All MACD deeply negative and worsening\n- Consistent downtrend across all 10 recent candles\n\n**RISK ASSESSMENT:**\nGiven my current -19% drawdown and negative Sharpe ratio, I should NOT be catching falling knives. While these oversold conditions COULD lead to a bounce, the momentum is strongly downward with no signs of stabilization:\n- No bullish divergence on RSI\n- No MACD turning positive\n- No price action showing support\n- Volume suggests capitulation may still be ongoing\n\n**DECISION: STAY IN CASH**\n\nThe prudent approach is to wait for signs of stabilization:\n1. RSI(7) crossing back above 30\n2. MACD showing positive divergence\n3. Price reclaiming EMA20\n4. Volume declining (selling exhaustion)\n\nEntering now would be pure speculation on a bounce with no technical confirmation. Given my poor performance (-19%), capital preservation is paramount.\n\n# TRADING DECISIONS\n\n{}",
      "signals": []
    },
    {
      "iteration": 83,
      "timestamp": "2025-10-30T16:00:00",
      "model": "anthropic",
      "raw_response": "# CHAIN OF THOUGHT\n\n## Market Overview\nThe entire cryptocurrency market is experiencing a severe selloff:\n- **BTC**: Down to 106,526 from recent highs around 113,569 (-6.2%). RSI(7) at 11.79 - extremely oversold\n- **ETH**: Down to 3,688 from 4,022 (-8.3%). RSI(7) at 6.60 - critically oversold\n- **SOL**: Down to 179.02 from 198.84 (-10.0%). RSI(7) at 10.53 - extremely oversold\n- **BNB**: Down to 1,061 from 1,116 (-4.9%). RSI(7) at 11.19 - extremely oversold\n- **XRP**: Down to 2.38 from 2.65 (-10.2%). RSI(7) at 7.73 - critically oversold\n- **DOGE**: Down to 0.1768 from 0.1953 (-9.5%). RSI(7) at 8.01 - critically oversold\n\n## Technical Analysis\nAll coins showing identical bearish patterns:\n- Price well below EMA20 (4-8% below)\n- Negative MACD with increasing bearish momentum\n- RSI(7) in single digits or low teens (extreme oversold territory)\n- RSI(14) also deeply oversold (10-18 range)\n- High volume confirming the selloff\n- All trending below both 20-period and 50-period EMAs\n\n## Current Position Status\n**No open positions** - I'm sitting in 100% cash ($8,098.97) after previous losses (-19.01% total return).\n\n## Trading Decision Analysis\n\n### Should I Enter New Positions?\n\n**Pros of entering now:**\n1. Extreme oversold conditions across all assets (RSI(7) below 12 on everything)\n2. Potential for mean reversion bounce\n3. High volume suggests capitulation may be near\n4. Historical RSI levels this low often precede short-term bounces\n\n**Cons of entering now:**\n1. Strong downtrend momentum (MACD deeply negative and accelerating)\n2. Price action showing no signs of stabilization yet\n3. All prices well below key EMAs with no support found\n4. \"Catching a falling knife\" risk is extremely high\n5. No clear reversal signals (no bullish divergence, no hammer candles)\n6. Portfolio already down -19% - need to preserve capital\n7. Could easily drop another 5-10% before finding support\n\n### Risk Management Considerations\n- Account value: $8,098.97\n- Sharpe ratio: -5.215 (very poor risk-adjusted returns)\n- Need to be extremely selective given poor performance\n- Better to wait for confirmation of reversal than catch falling knives\n\n### Decision: WAIT FOR CONFIRMATION\n\nWhile the oversold conditions are extreme and tempting, the momentum is still strongly bearish with no reversal signals. All coins are:\n- Breaking down through support levels\n- Showing accelerating negative MACD\n- Trading below all major EMAs\n- Displaying panic selling characteristics\n\n**The prudent approach is to wait for:**\n1. Price stabilization (at least 2-3 candles without new lows)\n2. Bullish divergence on RSI or MACD\n3. Price reclaiming EMA20 or showing rejection wicks\n4. Volume declining (exhaustion of sellers)\n\nGiven my current drawdown and the lack of clear reversal signals, I will remain in cash and wait for better entry opportunities with confirmed momentum shifts.\n\n# TRADING DECISIONS\n\n{}",
      "signals": []
    },
    {
      "iteration": 84,
      "timestamp": "2025-10-30T20:00:00",
      "model": "anthropic",
      "raw_response": "# CHAIN OF THOUGHT\n\n## Current Portfolio Status\n- Account Value: $8,098.97 (down -19.01% from starting capital)\n- No open positions currently\n- Sharpe Ratio: -5.215 (very poor risk-adjusted returns)\n- Need to be highly selective given drawdown\n\n## Market Analysis\n\n**BTC Analysis:**\n- Current: $108,360 vs EMA20: $111,252 (2.6% below)\n- Strong downtrend: Price dropped from $113,134 to $106,526 (lowest), now recovering\n- RSI(7): 41.19 - oversold territory but recovering from 11.79\n- RSI(14): 35.13 - still oversold\n- MACD: -1,681 (deeply negative but was -1,635 prior, slightly worsening)\n- Recent bounce from $106,526 to $108,360 (+1.7% recovery)\n- Assessment: Oversold bounce in progress, but still in downtrend (below EMA20)\n\n**ETH Analysis:**\n- Current: $3,803.70 vs EMA20: $3,949.47 (3.7% below)\n- Severe drop from $4,008.70 to $3,688 (lowest), now recovering\n- RSI(7): 43.35 - recovering from extreme oversold (6.56)\n- RSI(14): 35.78 - oversold\n- MACD: -96.61 (very negative)\n- Bounce from $3,688 to $3,803.70 (+3.1% recovery)\n- Assessment: Strong oversold bounce, better momentum than BTC\n\n**SOL Analysis:**\n- Current: $184.62 vs EMA20: $193.10 (4.4% below)\n- Dropped from $198.84 to $179.02, now recovering\n- RSI(7): 37.87 - recovering from 10.53\n- RSI(14): 35.17 - oversold\n- MACD: -3.58 (negative)\n- Bounce: +3.1% from lows\n- Assessment: Oversold but weaker recovery than ETH\n\n**BNB Analysis:**\n- Current: $1,078.20 vs EMA20: $1,108.39 (2.7% below)\n- Dropped to $1,061.20, now recovering\n- RSI(7): 37.08 - recovering from 11.17\n- RSI(14): 34.29 - oversold\n- Assessment: Oversold bounce but relatively weaker\n\n**XRP Analysis:**\n- Current: $2.44 vs EMA20: $2.56 (4.7% below)\n- Dropped from $2.65 to $2.38, now recovering\n- RSI(7): 32.82 - recovering from 7.71\n- RSI(14): 29.57 - deeply oversold\n- MACD: -0.052 (very negative)\n- Assessment: Oversold but still weak momentum\n\n**DOGE Analysis:**\n- Current: $0.18253 vs EMA20: $0.19160 (4.7% below)\n- Dropped from $0.19534 to $0.17684, now recovering\n- RSI(7): 39.26 - recovering from 7.99\n- RSI(14): 33.76 - oversold\n- Assessment: Oversold bounce in progress\n\n## Trading Decision\n\nGiven my significant drawdown (-19.01%) and poor Sharpe ratio, I need to be extremely selective. All coins are showing oversold bounces, but I need the strongest technical setup with best risk/reward.\n\n**ETH shows the best setup:**\n1. Strongest RSI recovery (43.35 from 6.56 - largest improvement)\n2. Good bounce momentum (+3.1% from lows)\n3. Clear support at $3,688 (recent low)\n4. RSI(14) at 35.78 suggests room to run to neutral (50)\n5. Below EMA20 provides resistance target\n\n**Trade Plan for ETH:**\n- Entry: $3,803.70\n- Stop-loss: $3,650 (below recent low of $3,688, -4.0% risk)\n- Profit target: $3,950 (near EMA20 resistance, +3.8% gain)\n- Risk/Reward: 1:0.95 (acceptable for oversold bounce)\n- Leverage: 15x (moderate given volatility)\n- Position size: ~$1,200 risk = ~$300 actual risk at 15x\n- Invalidation: If price falls below $3,650 or RSI(7) drops below 30 again\n\nRisk management: Using only ~15% of capital on this trade to preserve capital given drawdown.\n\n# TRADING DECISIONS\n\n```json\n{\n  \"ETH\": {\n    \"trade_signal_args\": {\n      \"coin\": \"ETH\",\n      \"signal\": \"buy\",\n      \"quantity\": 4.73,\n      \"profit_target\": 3950.00,\n      \"stop_loss\": 3650.00,\n      \"invalidation_condition\": \"If price closes below $3,650 or RSI(7) drops below 30 on 3-minute candle, indicating failed oversold bounce\",\n      \"leverage\": 15,\n      \"confidence\": 0.68,\n      \"risk_usd\": 1086.50\n    }\n  }\n}\n```",
      "signals": [
        {
          "coin": "ETH",
          "signal": "buy",
          "quantity": 4.73,
          "leverage": 15,
          "stop_loss": 3650.0,
          "profit_target": 3950.0,
          "confidence": 0.68,
          "risk_usd": 1086.5,
          "invalidation_condition": "If price closes below $3,650 or RSI(7) drops below 30 on 3-minute candle, indicating failed oversold bounce"
        }
      ]
    },
    {
      "iteration": 85,
      "timestamp": "2025-10-31T00:00:00",
      "model": "anthropic",
      "raw_response": "# CHAIN OF THOUGHT\n\n\u26a0\ufe0f **CRITICAL: This is the FINAL candle of the backtest period. I MUST close ALL open positions.**\n\nReviewing my current ETH position:\n- Entry: $3,803.70\n- Current: $3,828.40\n- Unrealized P&L: +$107.84 (+0.65%)\n- Leverage: 15x\n- Position size: 4.73 ETH ($18,108 notional)\n\n**Technical Analysis:**\n- Price: $3,828.40 (above entry but below EMA20 of $3,927.86)\n- RSI(7): 49.124 (neutral, above the invalidation threshold of 30)\n- RSI(14): 40.481 (still below 50, showing weakness)\n- MACD: -80.735 (deeply negative, bearish momentum)\n- Price is below EMA20, indicating downtrend\n- Recent recovery from oversold levels ($3,688 low)\n\n**Exit Plan Check:**\n- Profit target: $3,950 (NOT hit - current $3,828.40)\n- Stop-loss: $3,650 (NOT hit - current well above)\n- Invalidation: \"If price closes below $3,650 or RSI(7) drops below 30\"\n  - Current price $3,828.40 > $3,650 \u2713\n  - Current RSI(7) 49.124 > 30 \u2713\n  - Invalidation condition NOT met\n\n**Decision Rationale:**\nDespite the invalidation condition NOT being met and the position showing a small profit, this is the **FINAL candle of the backtest**. Per explicit instructions, I MUST close ALL positions regardless of technical conditions. This is a mandatory end-of-backtest closure.\n\nThe position has recovered from deep oversold conditions and is showing a small profit of $107.84. While I would normally hold this position as the invalidation condition is not met, the backtest ending requirement overrides all other considerations.\n\n**Other Coins:**\nNo positions in BTC, SOL, BNB, XRP, or DOGE. Will not initiate any new trades on the final candle.\n\n# TRADING DECISIONS\n\n```json\n{\n  \"ETH\": {\n    \"trade_signal_args\": {\n      \"coin\": \"ETH\",\n      \"signal\": \"close_position\",\n      \"quantity\": 4.73,\n      \"profit_target\": 3950.0,\n      \"stop_loss\": 3650.0,\n      \"invalidation_condition\": \"If price closes below $3,650 or RSI(7) drops below 30 on 3-minute candle, indicating failed oversold bounce\",\n      \"leverage\": 15,\n      \"confidence\": 0.68,\n      \"risk_usd\": 1086.5,\n      \"close_reason\": \"FINAL CANDLE - Mandatory end-of-backtest closure. Closing with +$107.84 profit (+0.65%). Invalidation condition was not met, but all positions must be closed at backtest end.\"\n    }\n  }\n}\n```",
      "signals": [
        {
          "coin": "ETH",
          "signal": "close_position",
          "quantity": 4.73,
          "leverage": 15,
          "stop_loss": 3650.0,
          "profit_target": 3950.0,
          "confidence": 0.68,
          "risk_usd": 1086.5,
          "invalidation_condition": "If price closes below $3,650 or RSI(7) drops below 30 on 3-minute candle, indicating failed oversold bounce"
        }
      ]
    }
  ]
}